,ticker,content
11,AIV,apartment investment management company aiv free report better know report first quarter pro fund operation ffo cent share line zack consensus estimate figure indicate increase year quarter tally cent result display growth property net operate income noi support same store property lease redevelopment acquisition community however positive be partially offset lower noi apartment sale report quarter total revenue comfortably outpaced zack consensus estimate addition report figure come marginally higher prior year quarter tally quarter detailsame store revenue utility reimbursement increase year year expense net utility reimbursement increase prior year quarter consequently same store noi climb year year basis same store average daily occupancy expand basis point bps year year rental rate new lease be rental rate renewal lease be expire lease rate mar have cash restrict cash hand moreover estimate fair market value company unencumbered apartment community be further end quarter review outstanding borrowing revolve credit facility be available capacity be consider letter credit backed facility portfolio activitydure report quarter invest redevelopment development addition be revamp portfolio property sale reinvest proceed select apartment home higher rent superior margin higher expect growth effort company increase revenue apartment home additionally enhance quality expect growth rate portfolio specifically percentage home be respectively first quarter compare record year quarter full year company update pro ffo share guidance provide earlier zack consensus estimate same be second quarter provide pro ffo share guidance cent zack consensus estimate same be cent company project same store noi growth be range revenue growth range dividendon announce quarterly cash dividend cent share class common stock first quarter mark year year increase dividend be paid stockholder record bottom lineaimco effort reposition portfolio shedding strategic property investing proceed opportunistic acquisition be likely drive long term growth addition company have solid portfolio diversify term geography price point be likely help meet rise demand apartment property efficiently however dilutive impact earning such asset disposition be bypass term also new supply various market be anticipate dampen company rent growth new lease pricing ability hike interest rate add wo apartment investment management company price consensus ep surprise apartment investment management company price consensus ep surprise apartment investment management company quoteaimco currently carry zack rank hold see complete list today zack rank strong buy stock here performance other reitshere be few other reit company have report first quarter result recently hcp inc hcp free report report first quarter ffo adjust cent share beating zack consensus estimate cent comparable ffo adjust prior year quarter be cent vornado realty trust vno free report report first quarter adjust ffo share assume conversion cent beating zack consensus estimate cent further figure surpass prior year quarter tally cent residential reit essex property trust inc ess free report deliver first quarter core ffo share beating zack consensus estimate core ffo share improve year quarter figure note anything related earning present represent fund operation ffo widely used metric gauge performance reit look stock skyrocket upside zack have just release special report boom investment opportunity legal marijuana ignited new referendum legislation industry be expect blast already robust early investor stand make kill have be ready act know just look see pot trade re target
12,AIV,mack cali realty corp cli free report report first quarter core fund operation ffo share cent beating zack consensus estimate cent result reflect better expect revenue number quarter company also reaffirm guidance reflect positive sentiment share mack cali climb nearly regular trading session fact total revenue comfortably exceed zack consensus estimate however year year basis core ffo share fall revenue decline quarter detaila mar mack cali consolidated core office property be lease shrink basis point bps prior quarter end same store cash revenue office portfolio descend same store cash net operate income noi fall report quarter mack cali execute lease deal span square foot space company consolidated service commercial portfolio comprise new lease lease renewal other tenant retention deal further core portfolio rental rate roll first quarter deal be cash basis new transaction rental rate roll be cash basis renewal other tenant retention deal be cash basis moreover company residential same store portfolio comprise unit lease quarter end noi inched quarter portfolio activitymack cali complete disposition property comprise square foot space further company expect additional disposition be accomplish year end liquiditymack cali exit first quarter cash cash equivalent record end prior quarter addition mar company have debt undepreciated asset ratio compare dec guidancemack cali project core ffo share zack consensus estimate same be currently peg company project office occupancy year end lease disposition full year mark completion company major disposition program sale future occur select basis takewe be encourage better expect performance mack cali company have be make solid progress respect strategic plan aim focuse waterfront transit base office holding luxury multus family portfolio growth nevertheless such plan involve significant upfront cost drag company profit margin addition have be aggressively dispose asset such measure be strategic fit long term dilutive impact earning huge asset sale be bypass term rate hike also remain concern mack cali currently carry zack rank sell see complete list today zack rank strong buy stock here mack cali realty corporation price consensus ep surprise mack cali realty corporation price consensus ep surprise mack cali realty corporation quotewe now look forward earning release other reit apartment investment management company aiv free report epr property epr free report realty income corporation free report apartment investment management company be schedule release earning epr property realty income be slate report quarterly number note anything related earning present represent fund operation ffo widely used metric gauge performance reit today stock zack hottest strategiesit hard believe even zack market gain top stock pick screen have return outperformance have not just be recent phenomenon year have be remarkably consistent composite yearly average gain strategy have beaten market more maybe even more remarkable be fact re willing share latest stock cost obligation see free
13,AIV,be last leg earning season member have already report quarterly result go encourage trend first quarter look well poise record robust earning revenue growth earning member have already report be same period last year higher revenue outpace ep estimate beating revenue latest earning preview overall earning first quarter member be project be growth revenue positive earning outlook let concentrate earning finance sector include real estate investment trust reit too total earning company sector have report quarterly figure so far have climb year year higher revenue particularly underlie asset category location property play vital role determine reit performance not company space be equally poise excel fall season fact rate hike cautious approach investor have affected return industry so far year let take look reit schedule report first quarter earning see thing be shape upcoming result apartment investment management co aiv free report commonly know have diversify portfolio term geography price point be likely have aid company meet increase demand apartment property echo boomer child baby boomer generation be report quarter also have be make concerted effort revamp portfolio property sale reinvest proceed select apartment home higher rent superior margin higher expect growth read more report earning be beat card prior first quarter earning release be lack solid catalyst raise optimism company business activity prospect past month zack consensus estimate fund operation ffo share soon be report quarter remain unchanged cent indicate increase year year first quarter management project pro ffo share band cent proven model show have right combination key ingredient positive earning esp zack rank hold better increase odd earning beat first quarter uncover best stock buy sell re report earning esp filter company have earning esp favorable zack rank trail quarters company outpaced zack consensus estimate occasion report line number other be depict graph apartment investment management company price ep surprise apartment investment management company price ep surprise apartment investment management company quoteomega healthcare investor inc ohi free report invest principally long term care facility locate unite state provide lease mortgage financing qualify operator skilled nursing facility snfs lesser extent assist live facility alfs independent live facility rehabilitation acute care facility zack consensus estimate rental income reflect marginal increase year figure however zack consensus estimate ffo share cent reflect year year decline further consensus estimate sale be be report quarter underscore fall year year omega healthcare investor inc price ep surprise omega healthcare investor inc price ep surprise omega healthcare investor inc quoteomega healthcare have earning esp unfavorable zack rank sell make difficult proven model conclusively predict likely earning beat season see complete list today zack rank strong buy stock here apple hospitality reit inc aple free report have portfolio consist hotel guest room resort first quarter end anticipate company have witness year year expansion portfolio ownership hotel room subsequently zack consensus estimate revenue guest room indicate improvement prior year quarter overall portfolio occupancy be expect have moderately increase ffo share be estimate have remain unchanged revenue have increase year year favorable zack rank earning esp lower chance earning beat also precede quarters company result outpaced zack consensus estimate occasion miss meet depict graph apple hospitality reit inc price ep surprise apple hospitality reit inc price ep surprise apple hospitality reit inc quoteequity commonwealth eqc free report primarily own office building locate unite state notably majority portfolio consist office building locate central business district cbds major metropolitan market rise supply office asset vacancy rate tick rent growth slow first quarter be expect have impact quarterly performance equity commonwealth zack consensus estimate first quarter revenue indicate steep decline year earlier quarter furthermore company activity quarter not gain adequate analyst confidence consequently zack consensus estimate ffo share cent first quarter remain unchanged past month figure reflect decline prior year quarter fact unfavorable zack rank sell earning esp make surprise prediction difficult last quarters company miss ffo share estimate occasion beat result average negative surprise be depict graph equity commonwealth price ep surprise equity commonwealth price ep surprise equity commonwealth quotesunstone hotel investor inc free report be lodging reit own manage hotel primarily upper upscale upscale segment be particularly operated franchise own nationally recognize company such marriott hilton hyatt company have high quality well diversify portfolio locate most dynamic location country significant capital investment bid reposition portfolio be expect have boost operate performance company however zack consensus estimate first quarter revenue be peg represent year year decline also zack consensus estimate ffo share remain unchanged cent past month indicate estimate year year fall nonetheless have impressive surprise history beating estimate past quarters depict graph sunstone hotel investor inc price ep surprise sunstone hotel investor inc price ep surprise sunstone hotel investor inc quotealso chance sunstone beating zack consensus estimate quarter be high be have earning esp zack rank buy note anything related earning present represent fund operation ffo widely used metric gauge performance reit today stock zack hottest strategiesit hard believe even zack market gain top stock pick screen have return outperformance have not just be recent phenomenon year have be remarkably consistent composite yearly average gain strategy have beaten market more maybe even more remarkable be fact re willing share latest stock cost obligation see free
14,AIV,residential real estate investment trust reit essex property trust inc ess free report deliver first quarter core fund operation ffo share beating zack consensus estimate core ffo share improve year quarter figure result reflect growth net operate income noi high occupancy level total revenue quarter grow year year however figure narrowly miss zack consensus estimate quarter detaildure report quarter essex property same property gross revenue grow prior year quarter same property net operate income noi improve year year financial occupancy expand basis point bps year year essex property exit first quarter cash cash equivalent include restrict cash record end notably january company make amendment unsecured line credit facility thereby enhance maximum amount available borrow well lengthen maturity december apr company have undrawn capacity unsecured credit facility report quarter company repurchase share common stock total include commission average price share company have purchase authority left stock buyback program end quarter notably company do not issue share common stock equity distribution program outlookessex property provide guidance second quarter full year full year company project core ffo share range denote cent share increase mid point zack consensus estimate same be currently peg current year projection be backed expectation same property revenue growth band denote basis point bps increase mid point same property noi growth range mark bps growth midpoint second quarter company project core ffo share zack consensus estimate same be currently peg conclusionwe be encourage stellar performance essex property term ffo share however company revenue miss remain disappointment strong property base solid balance sheet essex property be likely leverage favorable demographic trend market company substantial exposure west coast market be home several innovation technology company offer ample scope boost top line long term nonetheless aggressive rental concession moderate pricing power high supply remain concern also rate hike add wo essex property currently carry zack rank hold see complete list today zack rank strong buy stock here essex property trust inc price consensus ep surprise essex property trust inc price consensus ep surprise essex property trust inc quotewe now look forward earning release other reit apartment investment management company aiv free report epr property epr free report realty income corporation free report apartment investment management company be schedule release earning epr property realty income be slate report quarterly number note anything related earning present represent fund operation ffo widely used metric gauge performance reit medical stock buy nowzack name company poise ride medical breakthrough be target cure leukemia aids muscular dystrophy hemophilia other condition new product field be already generate substantial revenue even more wondrous treatment be pipeline early investor realize exceptional profit click here see stock
15,AIV,lamar advertising company lamr free report report first quarter adjust fund operation ffo cent share mark increase year tally cent result be drive growth revenue particularly net revenue report quarter climb prior year quarter reflect positive sentiment company share rally more wednesday regular trading session quarter detailoperate income dip record prior year period however adjust earning interest taxe depreciation amortization ebitda rise year year reflect benefit company cost containment effort additionally free cash flow first quarter be year year end first quarter lamar have total liquidity be available revolve senior credit facility cash cash equivalent takelamar impressive national presence tenant diverse industry valuable permit augur well growth moreover company strategy focus portfolio upgradation expansion be expect drive long term profitability effort control expense also prove conducive nonetheless dreary environment national advertising market remain concern company further high investment expenditure acquisition be likely take toll lamar balance sheet rate hike remain concern lamar currently have zack rank hold see complete list today zack rank strong buy stock here lamar advertising company price consensus ep surprise lamar advertising company price consensus ep surprise lamar advertising company quotewe now look forward earning release other reit apartment investment management company aiv free report epr property epr free report realty income corporation free report apartment investment management company be schedule release earning epr property realty income be slate report quarterly number note anything related earning present represent fund operation ffo widely used metric gauge performance reit medical stock buy nowzack name company poise ride medical breakthrough be target cure leukemia aids muscular dystrophy hemophilia other condition new product field be already generate substantial revenue even more wondrous treatment be pipeline early investor realize exceptional profit click here see stock
16,AIV,retail reit federal realty investment trust frt free report post first quarter fund operation ffo share beating zack consensus estimate also report figure compare favorably prior year quarter tally result reflect growth revenue company experience rise property operate income lease rollover comparable property specifically solid residential occupancy mixed use property new retail tenant opening controlled expenditure attribute performance first quarter management note total revenue quarter grow year year moreover top line surpass zack consensus estimate quarter detailsdure report quarter comparable space basis federal realty sign lease deal square foot space lease be sign average rent square foot denote cash basis rollover growth mar company overall portfolio be lease mar comparable property portfolio be lease mar mar addition property operate income poi comparable property climb first quarter federal realty exit first quarter cash cash equivalent approximately post end federal realty maintain ffo share guidance zack consensus estimate same be currently peg be company guide range dividend federal realty announce quarterly cash dividend share dividend be paid jul shareholder record jun takefederal realty portfolio premium retail asset mainly situate major coastal market washington boston san francisco los angele diverse tenant base position well decent growth effort improve company operate performance expansion renovation re tenanting support long term profitability nevertheless shrink footfall mall online retail take precedence store closure bankruptcy retailer continue hurt retail reit performance also rate hike add wo federal realty currently have zack rank hold see complete list today zack rank strong buy stock here federal realty investment trust price consensus ep surprise federal realty investment trust price consensus ep surprise federal realty investment trust quotewe now look forward earning release other reit apartment investment management company aiv free report epr property epr free report realty income corporation free report apartment investment management company be schedule release earning epr property realty income be slate report quarterly number note anything related earning present represent fund operation ffo widely used metric gauge performance reit medical stock buy nowzack name company poise ride medical breakthrough be target cure leukemia aids muscular dystrophy hemophilia other condition new product field be already generate substantial revenue even more wondrous treatment be pipeline early investor realize exceptional profit click here see stock
17,AIV,host hotel resort inc hst free report report first quarter adjust fund operation ffo cent share outpaced zack consensus estimate cent however adjust ffo share fall shy year quarter tally cent result reflect margin improvement better productivity however year year decline mainly reflect increase interest expense additional tax expense company have also raise outlook full year company generate total revenue surpass zack consensus estimate marginally slip year tally year year decline mainly reflect impact disposition hotel early notably quarter host hotel complete acquisition room andaz maui wailea resort room grand hyatt san francisco room hyatt regency coconut point resort spa quarter detailsdure report quarter comparable hotel revenue increase year year nearly comparable hotel revenue available room revpar constant dollar basis be year year drive basis point bps expansion occupancy partly offset decrease average room rate domestic property comparable hotel revpar be same international property climb first quarter comparable hotel ebitda increase comparable hotel ebitda margin improve bps reflect improvement operate efficiency higher ancillary revenue tax rebate property finally company exit first quarter unrestricted cash available capacity remain revolver part credit facility addition mar total debt be have average maturity year average interest rate notably company have debt maturity host hotel do not buy back share have capacity available current repurchase program capital investmentsdure first quarter company expend capital expenditure be return investment capital project renewal replacement project outlookhost hotel have raise outlook full year company now expect adjust ffo share range denote cent increase midpoint earlier guidance zack consensus estimate same be currently peg company full year projection include comparable hotel revpar constant dollar basis growth reflect growth bps midpoint moreover company continue expect capital expenditure year comprise project renewal replacement project conclusionhost hotel be likely gain solid portfolio upscale hotel lucrative market strategic capital recycling program healthy balance sheet bode well long term growth opportunistic acquisition top growth market unite state include maui san francisco augur well long term growth nevertheless supply growth specifically company key market remain concern addition dilutive impact asset sale be bypass also rate hike add wo host hotel currently have zack rank hold see complete list today zack rank strong buy stock here host hotel resort inc price consensus ep surprise host hotel resort inc price consensus ep surprise host hotel resort inc quotewe now look forward earning release other reit apartment investment management company aiv free report epr property epr free report realty income corporation free report apartment investment management company be schedule release earning epr property realty income be slate report note anything related earning present represent fund operation ffo widely used metric gauge performance reit medical stock buy nowzack name company poise ride medical breakthrough be target cure leukemia aids muscular dystrophy hemophilia other condition new product field be already generate substantial revenue even more wondrous treatment be pipeline early investor realize exceptional profit click here see stock
