,ticker,content
34,AIV,minute september federal open market committee meeting clearly signal december rate hike keep investor reit space worry fed anticipation factor lead slowdown inflation eventually subside further enhance chance rate hike however win be prudent brood too much rate hike rather focus be expect financial result reit base fundamental asset category cater here tell forget fed movesno doubt reit depend debt business pay high consistent dividend higher rate affect present value future cash flow therefore asset valuation include bond coupon stock dividend experience decline rise rate also lug scope increase future cash flow fact decision fed increase rate mirror growth domestic economy central bank confidence recovery economic growth pick inflation rise price real estate generally increase consequently rent occupancy property go such reit earning cash flow dividend get boost focus underlie asset strengthsin fact economy job market show sign recovery number asset category display strength third quarter take example industrial asset category have grab attention back robust demand recover economy job market strengthen commerce market healthy manufacturing environment moreover growth cloud compute internet thing big datum increase number company opt third party infrastructure datum center reit be experience boom market fact demand have be outpace supply top tier datum center market enjoy high occupancy market be absorb new construction faster pace go number study commercial real estate service firm cbre group inc office vacancy rate decline third quarter growth office used job most office market vacancy decline take national office vacancy rate close post recession low also apartment market report stable rent growth occupancy remain healthy third quarter study real estate technology analytic firm realpage inc rp free report new lease effective rent inched quarter annually further apartment occupancy come third quarter country top metro pick stock poise beat however not reit asset category be poise excel therefore addition focuse reit have healthy underlie asset category fundamental investing be yet release number poise beat expectation be far more reward earning beat essentially serve catalyst raise investor confidence stock nevertheless choose right stock be quite difficult know proper method make task simple rely zack methodology take account favorable rank zack rank strong buy buy hold positive earning esp proprietary methodology earning esp denote percentage difference most accurate estimate zack consensus estimate research show stock combination rank esp chance positive earning surprise be high uncover best stock buy sell re report earning esp filter here be reit have right combination element deliver earning beat release third quarter result prologis inc pld free report carry zack rank have earning esp zack consensus estimate be peg cent company deliver positive surprise last quarters average beat have expect long term growth rate also stock be trading discount industry average base san francisco prologis be industrial reit offer logistic real estate unite state abroad company focus high barrier high growth market prologis be schedule report result oct coresite realty corporation cor free report have zack rank earning esp zack consensus estimate quarter be peg company deliver positive surprise trail quarters average beat stock be also trading discount industry average co base coresite realty be datum center reit engage provide secure reliable high performance datum center interconnection solution rise customer ecosystem key north american market coresite be slate report quarterly number oct zack consensus estimate boston property inc bxp free report be share company deliver positive surprise trail quarters average beat boston property have zack rank earning esp see complete list today zack rank stock here massachusett base boston property be reputable owner developer premium office property unite state property be concentrated core market boston los angele new york san francisco washington dc boston property be likely report result nov digital realty trust inc dlr free report have zack rank earning esp zack consensus estimate quarter be peg company have long term expect growth rate stock be also trading discount industry average headquarter san francisco digital realty be datum center reit offer datum center colocation interconnection solution domestic international tenant portfolio datum center locate north america europe asia australia digital realty be slate report quarterly number oct apartment investment management company aiv free report commonly know have zack rank earning esp zack consensus estimate quarter be cent company have long term expect growth rate headquarter co be residential reit engage acquisition ownership management redevelopment apartment property situate major coastal job growth market unite state be expect report result oct note earning share number present report represent fund operation ffo share ffo widely used metric gauge performance reit be obtain add depreciation amortization other cash expense net income wall street next amazonzack evp kevin matra believe familiar stock have only just begin climb become greatest investment time once generation opportunity invest pure genius click detail
35,AIV,base preliminary assessment apartment investment management company aiv free report better know announce florida base property experience minor damage due hurricane irma cost repair damage have be estimate be cost be mainly limit clean landscaping repair roofing minor water intrusion repair accord paul beldin company executive vice president chief financial officer neither teammate resident sustain serious injury moreover company asset too do not sustain structural severe damage have apartment community apartment home miami fl jun residential real estate investment trust reit witness dip lease activity due storm prior evacuation nonetheless anticipate lease have be delay later period company second quarter result reflect strong lease improvement close significant portion lease transaction year recently report quarter contribute growth revenue have underperform industry belong year date company share have gain industry register growth time period currently carry zack rank hold zack consensus estimate fund operation ffo share estimate third quarter moved upward cent past day however estimate edge cent same time frame stock considerbetter rank stock reit space include umh property inc umh free report prefer apartment community inc apt free report seritage growth property stock carry zack rank buy see complete list today zack rank strong buy stock here umh property ffo share estimate inched cent month time prefer apartment community ffo share estimate remain unchanged same time period seritage ffo share estimate inched past day note ep number present represent fund operation ffo share ffo widely used metric gauge performance reit be obtain add depreciation amortization other cash expense net income new report investor guide have become more frequent destructive ever fact re expect cause year damage cybersecurity industry be expand quickly response threat fact project year be spend protect consumer corporate asset zack have just release cybersecurity investor guide locking profit reveal promising investment candidate download new report now
36,AIV,apartment investment management company aiv free report better know report second quarter pro fund operation ffo cent share beating zack consensus estimate cent figure also represent increase year quarter tally cent result display growth same store property net operate income noi increase contribution development redevelopment acquisition community lesser general administrative cost lower interest expense other expense also contribute higher fund operation however positive be partially offset loss income apartment sale reduce earning exit asset management business lower tax benefit total revenue outpaced zack consensus estimate addition report figure come higher prior year quarter tally apartment investment management company price consensus ep surprise apartment investment management company price consensus ep surprise apartment investment management company quotenote ep number present chart represent fund operation ffo share quarter detailsame store revenue increase year year expense edge year year consequently same store net operate income noi climb year year basis however same store average daily occupancy contract basis point year year rental rate renewal contract basis point bps expire lease rate compare previous quarter rent new lease improve decline witness previous quarter jun hold cash restrict cash hand moreover estimate fair market value company unencumbered apartment community come further end quarter outstanding borrowing revolve credit facility be available capacity be consider letter credit backed facility portfolio activitydure quarter invest redevelopment development company increase revenue apartment home additionally enhance quality expect growth rate portfolio specifically percentage home come second quarter compare record respectively year quarter third quarter provide pro ffo share guidance band zack consensus estimate same be cent dividendon jul announce quarterly cash dividend cent share class common stock second quarter mark year year increase dividend be paid aug stockholder record aug bottom lineaimco have solid portfolio diversify term geography price point furthermore company have be revamp portfolio property sale reinvest proceed select apartment home higher rent superior margin greater expect growth effort reduce cost result significant growth same store noi other improvement same store noi new construction redevelopment activity also contribute bottom line however late have be witness sluggish rent growth certain location due competition new supply company elaborate construction project plan plan capital replacement spending remain key concern moreover even divestiture exit asset management business pay long run company term adverse effect earning be bypass currently carry zack rank hold see complete list today zack rank strong buy stock here stock have lose year date growth record industry belong now look forward earning release other reit boston property inc bxp free report avalonbay community inc avb free report condor hospitality trust inc cdor free report boston property avalonbay community be schedule announce result aug aug condor hospitality trust be slate release quarterly number aug note ffo widely used metric gauge performance reit be obtain add depreciation amortization other cash expense net income hottest tech mega trend year generate global revenue predict blast roof fame investor mark cuban say produce world second trillionaire still leave plenty money regular investor make right trade early see zack best stock play trend
37,AIV,residential reit udr inc udr free report report fund operation ffo adjust share cent second quarter match zack consensus estimate figure also come higher prior year quarter tally cent total revenue improve year year additionally exceed zack consensus estimate growth revenue same store stabilize mature community backed increase addition company increase reaffirm full year ffo adjust share same store guidance range unite dominion realty trust inc price consensus ep surprise unite dominion realty trust inc price consensus ep surprise unite dominion realty trust inc quotenote ep number present represent fund operation ffo share headlinesduring quarter same store revenue increase year year same store expense climb consequently same store net operate income rise year year company same store physical occupancy expand basis point bps year year second quarter annualize rate turnover contract bps year year end second quarter udr development pipeline aggregate include complete stabilize project construction development jun company have available combination cash undrawn capacity credit facility further company total debt be same date notably quarter company issue year unsecured debt coupon proceed be used prepay higher cost debt originally schedule mature portfolio activitydure quarter udr metlife joint venture complete construction verve mountain view home community situate mountain view estimate cost construction further company strengthen developer capital program investment amberglen be home development community situate also provide funding commitment totale development community locate san francisco washington third quarter udr project ffo adjust share cent range zack consensus estimate cent lie range full year company project ffo adjust share zack consensus estimate also lie range moreover company anticipate same store revenue climb expense increase same store noi growth year superior portfolio target market discipline capital allocation udr be well poise growth moreover focus enhance portfolio expansion core market support momentum however elevated delivery number market remain concern additionally rate hike add company wo currently udr have zack rank hold see complete list today zack rank strong buy stock here addition stock have gain year date outperform growth industry belong now look forward earning release other residential reit camden property trust cpt free report essex property trust inc ess free report apartment investment management company aiv free report be also schedule report second quarter result week note ffo widely used metric gauge performance reit be obtain add depreciation amortization other cash expense net income more stock news tech opportunity worth driverless car artificial intelligence ve see unsurpassed growth high tech product recent month yesterday science fiction be become today reality innovation be single component tech company survive demand critical device reach year alone likely grow even faster future zack have release brand new special report help take advantage exciting investment opportunity most importantly reveal stock massive profit potential see stock now
38,AIV,realty income corporation free report second quarter adjust fund operation ffo share cent be line zack consensus estimate figure be higher prior year quarter tally cent result reflect better expect growth revenue total revenue quarter come surpass zack consensus estimate revenue be also year year realty income corporation price consensus ep surprise realty income corporation price consensus ep surprise realty income corporation quotenote ep number present represent fund operation ffo share quarter detaildure second quarter same store rent property lease expand prior year quarter portfolio occupancy jun expand basis point bps sequentially bps year year further company have property available lease total property portfolio jun compare property mar moreover report quarter company re lease property exist new tenant recapture expire rent portfolio activitydure report quarter realty income invest new property property development expansion situate state asset be fully lease weight average lease term year initial average cash lease yield notably rental revenue acquisition first month be investment grade rate tenant other hand report quarter company sell property gain sale realty income exit second quarter cash cash equivalent end prior year however company have unsecured credit facility comprise revolve credit facility year unsecured term loan credit facility also have expansion feature jun realty income have borrow capacity available revolve credit facility realty income project adjust ffo share range takerealty income focus lease service discretionary low price base retailer accretive acquisition conservative capital structure augur well rise monthly dividend payout enhance shareholder confidence however substantial exposure single tenant asset raise risk associate tenant default further generation notable rental revenue asset lease drug store rate hike add wo realty income currently carry zack rank hold see complete list today zack rank strong buy stock here stock have gain nearly year date outperform decline industry belong let now look forward earning release essex property trust inc ess free report apartment investment management company aiv free report camden property trust cpt free report be expect report weeknote ffo widely used metric gauge performance reit be obtain add depreciation amortization other cash expense net income more stock news tech opportunity worth driverless car artificial intelligence ve see unsurpassed growth high tech product recent month yesterday science fiction be become today reality innovation be single component tech company survive demand critical device reach year alone likely grow even faster future zack have release brand new special report help take advantage exciting investment opportunity most importantly reveal stock massive profit potential see stock now
39,AIV,liberty property trust lpt free report report second quarter fund operation ffo share cent surpass zack consensus estimate cent total operate revenue also outpaced zack consensus estimate however year year basis company ffo share report decline cent cent report year quarter also total operate revenue edge year year report quarter liberty property accomplish lease deal square foot space however jun occupancy company operate portfolio span square foot contract basis point bps sequentially share liberty property fall nearly regular trading session jul quarter detailliberty property industrial portfolio span square foot be lease end quarter underline contraction bps prior quarter however industrial distribution rent escalate renewal replacement lease sign quarter other hand office portfolio comprise square foot have occupancy bps prior quarter be due commencement previously announce lease square foot office space office rent be renewal replacement lease same store property operate income inched year year cash basis straight line basis additionally same store operate income industrial portfolio climb cash basis straight line basis however same store operate income office portfolio decrease cash basis straight line basis liberty property exit second quarter cash cash equivalent record end prior year portfolio activitydure second quarter wholly own development property be bring service liberty property aggregate investment property comprise square foot leasable space be occupied end quarter furthermore company begin development wholly own property property aggregate square foot leasable space involve project investment report quarter liberty acquire square foot industrial build be presently development gardena other hand report quarter company sell suburban office building aggregate square foot outlookliberty property update guidance now expect full year ffo share range guide earlier zack consensus estimate same be currently peg takeliberty property be poise growth fundamental industrial real estate market remain robust backed grow demand result solid rent growth development opportunity however increase supply industrial real estate upcoming period adverse term impact earning disposition rise interest rate remain concern currently liberty property carry zack rank buy see complete list today zack rank strong buy stock here liberty property trust price consensus ep surprise liberty property trust price consensus ep surprise liberty property trust quotewe now look forward earning release essex property trust inc ess free report apartment investment management company aiv free report venta inc vtr free report be expect report quarterly number week note ep number present represent fund operation ffo share ffo widely used metric gauge performance reit be obtain add depreciation amortization other cash expense net income hottest tech mega trend year generate global revenue predict blast roof fame investor mark cuban say produce world first trillionaire still leave plenty money regular investor make right trade early see zack best stock play trend
40,AIV,equity residential eqr free report report second quarter normalize fund operation ffo share cent line zack consensus estimate figure be higher cent report year quarter result reflect enhance same store net operate income noi lease noi addition company experience lower corporate overhead however company experience adverse impact noi primarily stem huge disposition activity also company incur higher interest expense quarter management be solid steady rental demand company coastal gateway market help occupancy retention renewal pricing even high apartment supply such company have increase full year revenue guidance drive seattle san francisco new york city be likely meet most optimistic projection year moreover total revenue report quarter come indicate growth prior year period addition figure surpass zack consensus estimate quarter detailsame store revenue include apartment unit increase year year expense climb year year result same store noi advanced year year company experience growth average rental rate occupancy fall basis point year quarter same store portfolio company exit second quarter cash cash equivalent end prior quarter portfolio activitydure quarter equity residential acquire consolidated apartment property seattle apartment unit other hand sell consolidated apartment property apartment unit total approximately additionally company stabilize unit fremont development san francisco development yield third quarter equity residential project normalize ffo share range cent zack consensus estimate same be currently peg cent company revise projection full year revenue guidance upward now estimate normalize ffo share range compare prior guidance zack consensus estimate lie range same store portfolio company revise full year physical occupancy revenue growth range compare guide previously furthermore expense be project increase prior range noi be estimate grow compare previous range viewpointequity residential be anticipate benefit effort reposition portfolio high barrier entry core market favorable demographic lifestyle transformation creation new household company current focus be acquisition development asset primarily core coastal metropolitan area boston new york washington southern california san francisco seattle also be solid rental demand coastal gateway city nevertheless high apartment supply new lease rate be likely remain pressure equity residential currently carry zack rank buy see complete list today zack rank strong buy stock here equity residential price consensus ep surprise equity residential price consensus ep surprise equity residential quotewe now look forward earning release other residential reit essex property trust inc ess free report apartment investment management company aiv free report avalonbay community inc avb free report essex property apartment investment management company be expect release result jul avalonbay be likely report quarterly number aug note ep number present represent fund operation ffo share ffo widely used metric gauge performance reit be obtain add depreciation amortization other cash expense net income hottest tech mega trend year generate global revenue predict blast roof fame investor mark cuban say produce world first trillionary still leave plenty money regular investor make right trade early see zack best stock play trend
