,ticker,content
18,AIV,apartment investment management co aiv free report commonly know be slate report first quarter result market close fund operation ffo share likely increase year year basis revenue be expect decline last report quarter co base residential real estate investment trust reit meet zack consensus estimate ffo result display growth same store property noi lease redevelopment acquisition community however positive be partially offset loss income apartment sale have mixed earning surprise history trail quarters company outpaced zack consensus estimate occasion report line number other overall stock witness average positive surprise be depict chart apartment investment management company price ep surprise apartment investment management company price ep surprise apartment investment management company quoteshare have outperformed industry company share have lose industry have witness decline last month factor influence resultsper latest report real estate technology analytic firm realpage inc rp free report national apartment market moderate first quarter occupancy shrink slightly rent growth slow nevertheless first quarter marked slow lease period thank cold weather inhibit shift household limit growth demand go statistic annual rent growth shrink first quarter marked moderation growth rate experience occupancy level march edge prior year tally metro have subdue construction activity fare well record strongest occupancy nevertheless overall occupancy level be still healthy furthermore have diversify portfolio term geography price point be likely aid company meet increase demand apartment property echo boomer child baby boomer generation be report quarter also have be make concerted effort revamp portfolio property sale reinvest proceed select apartment home higher rent superior margin higher expect growth such streamline effort be strategic fit long term term dilutive effect be bypass fact such short term impact be likely drag company quarterly result further be increase apartment supply number company market high supply be likely put pressure rental rate adversely affect revenue growth be report quarter prior first quarter earning release be lack solid catalyst raise optimism company business activity prospect past month zack consensus estimate ffo share soon be report quarter remain unchanged cent indicate increase year year first quarter management project pro ffo share band cent zack consensus estimate first quarter revenue be peg indicate year year decline earning whispersour proven model show have right combination key ingredient positive earning esp zack rank hold better increase odd earning beat first quarter uncover best stock buy sell re report earning esp filter zack esp have earning esp represent percentage difference most accurate estimate zack consensus estimate zack rank carry zack rank other stock warrant lookhere be few other stock reit space want consider model show have right combination element report positive surprise time hcp inc hcp free report schedule report quarterly number have earning esp zack rank see complete list today zack rank strong buy stock here sabra health care reit inc sbra free report set release first quarter result have earning esp zack rank note anything related earning present represent fund operation ffo widely used metric gauge performance reit look stock skyrocket upside zack have just release special report boom investment opportunity legal marijuana ignited new referendum legislation industry be expect blast already robust early investor stand make kill have be ready act know just look see pot trade re target
19,AIV,solid job growth recent month indicate more household formation raise expectation robust revival apartment market fundamental then perhaps think twice be latest report real estate technology analytic firm realpage inc rp free report state national apartment market indeed moderate first quarter occupancy shrink rent growth slow seem be respite choppy environment time soon aggressive delivery anticipate continue early next year too course first quarter mark slow lease period thank cold weather inhibit shift household limit growth demand however whole lot new supply be ultimate culprit fuel competition curb landlord pricing power go statistic annual rent growth pace shrink not only marked moderation growth rate experience fact denote slowest growth third quarter notably market have achieve annual price increase third quarter represent economic cycle highest rent growth also occupancy level march edge prior year tally metro have subdue construction activity fare well record strongest occupancy overall occupancy level be still healthy deceleration suggest competitive lease environment be fast build robust upturn occupancy seem elusive term be quite obvious so much new supply be likely come course accord realpage report last half nation largest metro annual pace completion climb unit level further early schedule new supply keep add flow same annual pace admittedly performance residential reit recent quarters have be affected elevated supply new unit market anticipation continue stress environment impact landlord ability command higher rent fill vacant space so pressure new lease rate occupancy well retention persist concession activity lure renter be expect remain high now time investor consider portfolio reshuffle discard stock say sector be unlikely bounce back term be avalonbay community inc avb free report residential reit own hold direct indirect ownership stake apartment community dec company share have underperform industry past month time period share company have lose industry incur loss additionally stock have see zack consensus estimate fund operation ffo share be revise downward month time reflect bearish analyst sentiment apartment investment management co aiv free report better know have ownership stake community state district columbia company share have decline underperform industry belong month time further zack consensus estimate ffo share have be revise downward month time mid america apartment community inc maa free report commonly refer maa enjoy ownership stake apartment unit dec company share have underperform industry belong past month decline moreover stock have see zack consensus estimate ffo share be revise downward last month note anything related earning present represent fund operation ffo widely used metric gauge performance reit today stock zack hottest strategiesit hard believe even zack market gain top stock pick screen have return outperformance have not just be recent phenomenon year have be remarkably consistent composite yearly average gain strategy have beaten market more maybe even more remarkable be fact re willing share latest stock cost obligation see free
20,AIV,lawsuit apartment investment management company aiv free report better know airbnb allege short term rental have allow tenant violate lease agreement unauthorized sublease have proceed florida court further court dismiss airbnb premise be supposedly protected communication decency act act online service provider be protected responsibility content user action allege high end apartment community tenant los angele complain noisy airbnb tourist therefore more security staff have be employ property monitoring trace expel unlawful airbnb guest court company be right claim compensation due increase expense enhance security damage cause property reduction value property further court allow put perpetual ban succeed trial cindy lempke spokesperson inform vigorously pursue remedy airbnb illegal use property disrupt residential live experience trample private property right reduce affordable housing option middle class renter be confident be successful effort stand work family need housing want maintain tranquil home life free intrusion be create illegal short term rental verdict court be favorable elevated apartment supply remain concern company particularly new supply be compete higher rent property high supply number company market be concern curtail landlord ability command more rent result lesser absorption past month share company edge industry decline currently carry zack rank sell stock worth looka few better rank stock reit space include arbor realty trust abr free report extra space storage inc exr free report sotherly hotel inc soho free report stock carry zack rank buy see complete list today zack rank strong buy stock here arbor realty trust zack consensus estimate fund operation ffo share remain unchanged cent past month share return month time extra space storage ffo share estimate current year moved month time share gain past month sotherly hotel ffo share estimate be revise upward approximately past month stock gain past month note anything related earning present represent fund operation ffo widely used metric gauge performance reit wall street next amazonzack evp kevin matra believe familiar stock have only just begin climb become greatest investment time once generation opportunity invest pure genius click detail
21,AIV,recently issue operate update first quarter avalonbay community inc avb free report state expect total rental revenue establish community be year year notably prior quarter company have report growth total revenue establish community result indicated increase average rental rate economic occupancy specifically fourth quarter average rental rate be year year economic occupancy inched year quarter avalonbay have high quality asset locate premium market country enable company generate steady rental revenue fact company deliver seventh consecutive year sector average core fund operation ffo share growth be encourage base strong fundamental expect uptrend continue increase consumer confidence back job growth rise wage healthier balance sheet promise bright prospect avalonbay however new apartment delivery be anticipate remain elevated term have emerge press concern residential reit include avalonbay equity residential eqr free report apartment investment management co aiv free report mid america apartment community inc maa free report particularly avalonbay consider region delivery be project increase southern california pacific northwest additionally supply continue be most noticeable urban submarket high supply number company market be likely put pressure rental rate hence growth stabilize portfolio remain modest upcoming period furthermore be high concession activity elevated supply remain concern currently avalonbay have zack rank sell see complete list today zack rank strong buy stock here stock have depreciate past month underperform loss incur industry belong note ffo widely used metric gauge performance reit be obtain add depreciation amortization other cash expense net income wall street next amazonzack evp kevin matra believe familiar stock have only just begin climb become greatest investment time once generation opportunity invest pure genius click detail
22,AIV,apartment investment management company aiv free report better know announce acquisition bent tree apartment community fairfax county va first month ownership deal be likely benefit company adjust fund operation share cent situate suburban fairfax county bent tree apartment community consist apartment home be locate beside other community own have apartment home bent tree be quality community average rent approximately unit acquisition be strategic fit company capital investment unit have capability generate higher market rate revenue growth transaction be line strategy revamp portfolio property sale reinvest proceed select apartment home higher rent superior margin higher expect growth community be locate few minute away dulle international airport travele distance downtown resident be provide opportune access employment fact onsite amenity comfortable home likely hold significance educate high income customer plan put sale same value community have probability lower rental growth lower expect free cash flow internal rate return fcf irr sync pair trade discipline company expect bent tree fcf irr surpass fcf irr property be vend support acquisition minimum basis point acquisition be finance bank borrowing await anticipate third quarter sale complete pair trade funding share have lose past month compare decline record industry belong currently carry zack rank sell last day zack consensus estimate fund operation ffo share witness decline stock warrant lookthe rmr group rmr free report have witness upward earning estimate revision last day also share gain past month sport zack rank strong buy see complete list today zack rank stock here zack consensus estimate home avhi free report have be revise upward last day also share have moved month time flaunt zack rank ally financial ally free report zack consensus estimate have moved last day share have gain past month carry zack rank note anything related earning present represent fund operation ffo widely used metric gauge performance reit zack top stock addition stock discuss know finest buy hold ticker entirety last year zack top stock portfolio produce double digit winner include fmc corp vmware rac stellar gain now brand new portfolio have be handpick company cover zack rank don miss chance get long term buy access zack top stock today
23,AIV,report record price homebuilding have start high homebuilding pace month high january primarily due sharp rise construction apartment accord government datum release last friday fact rise be drive surge apartment construction other hand single family home start increase meager december surge homebuilding be be credit strong economic fundamental support impressive job datum higher wage turn be also likely quicken pace rate hike boost rate spread reit sector shift multifamily dwelling historically american have show inclination single family home however scenario have witness sea change post recession person opt multifamily apartment absence sufficient fund change trend trigger rise construction multifamily apartment peak step activity new york metropolitan area recovery be early stage increase continue other major metropolitan area too witness surge activity recovery prompt growth single family homeshowever economy recover multifamily apartment start witness decline downtrend be palpable multifamily apartment start be lesser dodge datum analytic accord robert murray chief economist dodge datum analytic scenario change market such los angele dalla ft worth tx washington dc retreat level post go national volume multifamily commercial start be worth however be still amount report do mean demand single family home have increase go just price national association realtor nar average cost exist single family home fourth quarter be prior year quarter moreover november witness rise sale newly construct single family home highest pace july say demand multifamily apartment not have really go accord national multifamily housing council latest research report demand apartment unite state be rise country witness additional demand apartment be scenario homebuilder be well track multifamily apartment start have witness decline necessarily not be shift single family home accord datum release commerce department last friday total housing start surge january annual rate unit be highest level record october largest increase month have be observed multifamily housing be attract real estate investor primarily demographic change increase number young older american be go rent apartment buy home moreover monthly rental price be not increase much real estate research firm yardi matrix national average rent be january higher year year flat month month however be nothing compare increase monthly rent price witness be perhaps overall increase apartment construction multifamiy reit recover course fate reit related sector have be quite different long term quantitative ease have compress rate spread sector depend generate income result stock such camden property trust cpt free report armada hoffler property inc ahh free report apartment investment management company aiv free report equity residential eqr free report be last month stock carry zack rank hold see complete list today zack rank stock here situation be likely change radically rate hike be already schedule current year further recent jump yearly wage increase be likely provide much need thrust sluggish inflation level turn lead quicken pace rate hike boost rate spread reit give backdrop be likely have much better year ahead further boom economy be likely boost rent demand apartment also increase fund operation level offset higher interest cost boost reit price hacker put money portfolio earlier month credit bureau equifax announce massive datum breach affect american cybersecurity industry be expand quickly response similar event stock be better investment other zack have just release cybersecurity investor guide help zack com reader make most year investment opportunity create hacker other threat reveal stock worth look right away download new report now
24,AIV,apartment investment management company aiv free report better know report fourth quarter pro fund operation ffo cent share line zack consensus estimate figure indicate increase year quarter tally cent full year pro ffo share come share line zack consensus estimate bottom line figure full year be share result display growth property net operate income noi support same store property lease redevelopment acquisition community however positive be partially offset loss income apartment sale report quarter total revenue comfortably outpaced zack consensus estimate addition report figure come higher prior year quarter tally full year total revenue come exceed prior year figure also surpass zack consensus estimate quarter detailsame store revenue increase year year expense increase prior year quarter consequently same store net operate income noi climb year year basis same store average daily occupancy expand basis point bps year year rental rate new lease be rental rate renewal lease be expire lease rate dec hold cash restrict cash hand moreover estimate fair market value company unencumbered apartment community come further end quarter outstanding borrowing revolve credit facility be available capacity be consider letter credit backed facility portfolio activitydure report quarter invest redevelopment development addition be revamp portfolio property sale reinvest proceed select apartment home higher rent superior margin higher expect growth effort company increase revenue apartment home additionally enhance quality expect growth rate portfolio specifically percentage home come fourth quarter compare respectively record year quarter full year company expect pro ffo share guidance range zack consensus estimate same be notably management have exclude legal cost relate case file airbnb guidance unpredictable nature cost first quarter provide pro ffo share guidance band cent zack consensus estimate same be cent company project same store noi growth be range revenue growth be range further management expect average daily occupancy rise bps figure record dividendon jan announce quarterly cash dividend cent share class common stock fourth quarter mark year year increase dividend be paid feb stockholder record feb bottom lineaimco effort reposition portfolio shedding strategic property investing proceed opportunistic acquisition likely drive long term growth addition company have solid portfolio diversify term geography price point be likely help meet rise demand apartment property efficiently however stiff competition new supply various market be expect dampen rent growth new lease pricing ability additionally interest rate hike dilutive effect sale asset remain concern apartment investment management company price consensus ep surprise apartment investment management company price consensus ep surprise apartment investment management company quoteaimco currently carry zack rank sell see complete list today zack rank strong buy stock here upcoming releaseswe now look forward fourth quarter earning release other company epr property epr free report lamar advertising company lamr free report outfront medium inc free report epr property be schedule announce result feb lamar advertising company outfront medium be slate report feb note anything related earning present represent fund operation ffo widely used metric gauge performance reit breaking news cryptocurrency now bigger total market cap cryptos recently surpass more increase previous month re now bigger morgan stanley goldman sachs even visa new asset class expand even more rapidly new investor continue pour wall street become increasingly involved zack have just name company enable investor take advantage explosive growth cryptocurrency stock market click here access stock
25,AIV,equity residential eqr free report report fourth quarter normalize fund operation ffo share cent beating zack consensus estimate cent figure also come higher cent report year quarter result mirror enhance same store net operate income noi lease noi however company incur higher corporate overhead quarter moreover total revenue report quarter come indicate growth prior year period addition figure surpass zack consensus estimate management solid steady rental demand company market be support favorable demographic low unemployment level rise wage however be anticipate witness high level new supply lead decrease pricing power well decelerate revenue growth full year normalize ffo share come ahead prior year tally be backed year year growth total revenue nearly quarter detailsame store revenue include apartment unit be year year expense climb year year result same store noi advanced year year company experience growth average rental rate physical occupancy remain flat year year same store portfolio company exit fourth quarter cash cash equivalent record end prior quarter portfolio activitydure report quarter equity residential do not purchase consolidated apartment property other hand company sell consolidated apartment property southern new jersey apartment unit further company complete cascade unit apartment development project seattle total cost first quarter equity residential project normalize ffo share range cent zack consensus estimate same be currently peg cent full year company project normalize ffo share band zack consensus estimate lie range company full year outlook be backed same store portfolio revenue growth physical occupancy noi change also expense be project flare dividend updatecurrently equity residential expect declare first quarter common share dividend cent share reflect annualize hike amount paid viewpointequity residential better expect performance fourth quarter be impressive company be anticipate benefit effort reposition portfolio high barrier entry core market favorable demographic lifestyle transformation creation new household company current focus be acquisition development asset primarily core coastal metropolitan area boston new york washington southern california san francisco seattle however elevated supply number market be likely put pressure rental rate result high concession furthermore rate hike add wo equity residential currently carry zack rank hold see complete list today zack rank strong buy stock here equity residential price consensus ep surprise equity residential price consensus ep surprise equity residential quotewe now look forward earning release other residential reit apartment investment management company aiv free report udr inc udr free report essex property trust inc ess free report apartment investment management company udr inc be schedule release result feb feb essex property be slate report number feb note anything related earning present represent fund operation ffo widely used metric gauge performance reit hottest tech mega trend year generate global revenue predict blast roof fame investor mark cuban say produce world first trillionaire still leave plenty money regular investor make right trade early see zack best stock play trend
