,ticker,content
18,APTV,first quarter earning season have crossed half way mark earning revenue growth track reach highest level year accord latest earning preview company have already report result earning company increase same period last year higher revenue outpaced earning estimate exceed top line expectation proportion company beating ep revenue estimate be notably more company include member report result week bullish index total first quarter earning be expect increase higher revenue notably last report quarter witness earning growth increase revenue full year total earning be expect improve higher revenue rosy picture business servicesper report company business service sector be expect record top bottom line growth respectively notably zack sector end ongoing earning season double digit earning growth sector be business service usually sector be directly proportional broader economy be currently quite favorable fact rise gdp record low unemployment level strong job addition ease dollar momentum oil price be sign improvement economy turn boost sector performance trump business friendly policy include tax cut repeal regulation be additional tailwind stock watch earning automatic datum process inc adp free report business process outsource service provider report third quarter fiscal result zack consensus estimate company third quarter revenue be peg reflect year year growth same earning share stand indicate year year growth yet be report quarter company top line be expect benefit higher organic growth favorable foreign currency movement acquisition bottom line be likely be positively impact tax benefit result tax cut job act additionally automatic datum process have impressive earning surprise history have surpass estimate trail quarters average beat year time share zack rank buy company have gain compare industry rally see complete list today zack rank strong buy stock here republic service inc rsg free report solid waste collection transfer recycling disposal company report first quarter result consensus estimate first quarter revenue stand reflect year year growth top line be expect benefit higher internal growth buyout strong segmental performance consensus mark earning share be report quarter be peg cent indicate year year growth lower tax rate revenue growth be likely positively impact company bottom line republic service also have impressive earning surprise history have outpaced estimate trail quarters average positive surprise company carry zack rank sell share company have gain past year underperform industry rally aptiv plc aptv free report automotive technology solution provider report first quarter result zack consensus estimate company earning be peg reflect decline year quarter actual figure consensus mark revenue be peg reflect decline year quarter actual figure company however have impressive earning surprise history surpass estimate trail quarters average beat year time share zack rank have rally industry decline holding inc iqv free report integrate information technology enabled healthcare service company report first quarter result zack consensus estimate company earning revenue be peg respectively earning estimate compare year quarter actual figure reflect growth revenue estimate show year year improvement zack rank hold company earning surprise history have be impressive too company outpaced estimate trail quarters average beat company share have rally year industry decline wall street next amazonzack evp kevin matra believe familiar stock have only just begin climb become greatest investment time once generation opportunity invest pure genius click detail
19,APTV,investor be always look stock be poise beat earning season delphi automotive plc aptv free report be such company firm have earning come pretty soon event be shape quite nicely report be delphi automotive be see favorable earning estimate revision activity late be generally precursor earning beat analyst raise estimate right earning most date information possible be pretty good indicator favorable trend surface aptv report analyst have very recently bump estimate aptv give stock zack earning esp head earning season delphi automotive plc price ep surprise delphi automotive plc price ep surprise delphi automotive plc quotewhy be important positive read zack earning esp have proven be very powerful produce positive surprise outperform market recent year backtest show stock have positive earning esp zack rank hold better show positive surprise nearly time have return average annual return see more top earning esp stock here give aptv have zack rank buy esp positive territory investor want consider stock ahead earning see complete list today zack rank strong buy stock here clearly recent earning estimate revision suggest good thing be ahead delphi automotive beat be card upcoming report wall street next amazonzack evp kevin matra believe familiar stock have only just begin climb become greatest investment time once generation opportunity invest pure genius click detail
20,APTV,launch spdr russell momentum focus etf oneo free report be passively manage exchange trade fund design provide broad exposure large cap blend segment equity market fund be sponsored state street global advisor have amassed asset make average size etfs attempt match large cap blend segment equity market large cap blendlarge cap company typically have market capitalization overall be usually stable option less risk more sure fire cash flow mid small cap company typically hold combination growth value stock blend etfs also demonstrate quality see value growth investment costssince cheaper fund tend produce better result more expensive fund assume other factor remain equal be important investor pay attention etf expense ratio annual operate expense etf be make cheaper product space have month trail dividend yield sector exposure top holdingsetfs offer diversify exposure thus minimize single stock risk be still important delve fund holding investing most etfs be very transparent product many disclose holding daily basis etf have heaviest allocation consumer discretionary sector portfolio information technology industrial round top look individual holding micron technology inc mu free report account total asset follow lear corporation lea free report aptiv plc aptv free report top holding account total asset management performance riskoneo seek match performance russell momentum focuse factor index fee expense russell momentum focuse factor index reflect performance segment large capitalization equity security demonstrate combination core factor focus factor comprise high momentum characteristic etf have lose so far year be last year past week period have trade holding effectively diversify company specific risk russell momentum focus etf carry zack etf rank hold be base expect asset class return expense ratio momentum other factor thus oneo be reasonable option seek exposure large cap etfs area market investor also want consider other etf option space ishare core etf ivv free report spdr etf spy free report track similar index ishare core etf have asset spdr etf have ivv have expense ratio spy charge bottom linean increasingly popular option retail institutional investor passively manage etfs offer low cost transparency flexibility tax efficiency be also excellent vehicle long term investor learn more product other etfs screen product match investment objective read article latest development etf investing universe please visit zack etf center
21,APTV,significant decline inflation pond come breather key index apr lower inflation nominal increase wage disappointing manufacturing industrial production datum ultimately reduce concern rate increase early bank england boe recent economic datum also weigh pound sterling turn be boon british blue chip giant generate revenue foreign currency moreover international monetary fund imf upgrade growth projection unite kingdom recently world economic outlook report follow development investing big british company look prudent investment option inflation weakest year wage only accord office national statistic on datum consumer price index cpi fall february march reach lowest settlement year cpi inflation datum be also lower bank england monetary policy committee recent projection additionally core cpi datum come last month lower register february core cpi also reach lowest level year key inflation datum be slowly move bank england boe desire target moreover decline food price also weigh producer price performance producer price index ppi come march lowest decline cpi ppi datum be expect weigh bank england ability raise key interest rate early moreover follow fall key inflation metric prospect november rate hike fall less previous forecast bloomberg also unemployment rate decline same period however wage include bonuse rise merely real term also weigh recent rate hike prospect pound sterling plummet imf raise growth industrial production advanced only february january manufacturing output fall february weak industrial manufacturing output fall inflation slow wage growth also weigh pound sterling earlier week pound sterling rise settle best level britain decide exit european union eu june however follow release new economic datum pound sterling decline most big british company blue chip have significant exposure global market thus weak sterling be expect have positive impact behemoth apr imf show optimism british economy growth potential raise year year economic growth projection earlier imf give stronger projection follow better global economic growth outlook british stock buy nowfollowing fall inflation wage industrial manufacturing production rate hike worry have abate additionally weaker pound have bring focus back british stock have strong foothold international market also strong global economy outlook have make big british company strong bet investorsin context have select british stock be expect gain follow development stock also flaunt zack rank strong buy buy see complete list today zack rank stock here fiat chrysler automobile fcau free report be designer manufacturer distributor seller vehicle component production system global market london base company have zack rank expect earning growth rate current year be zack consensus estimate current year have improve last day fiat chrysler automobile have gain more last year sainsbury plc jsaiy free report be major food general merchandise clothing retail company london base company have zack rank expect earning growth rate current year be zack consensus estimate current year have improve last day sainsbury have gain last year barclay plc bcs free report be provider various financial service unite kingdom other european country asia africa americas middle east london base company have zack rank expect earning growth rate current year be zack consensus estimate current year have improve last day barclay have gain year time aptiv plc aptv free report be manufacturer vehicle component provider safety technology solution global automotive commercial vehicle market gillingham base company have zack rank expect earning growth rate current year be zack consensus estimate current year have improve last day aptiv have gain past year relx plc relx free report be provider information analytic professional business customer unite state globally london base company have zack rank expect earning growth rate current year be zack consensus estimate current year have improve last day relx have gain year hottest tech mega trend year generate global revenue predict blast roof fame investor mark cuban say produce world first trillionaire still leave plenty money regular investor make right trade early see zack best stock play trend
22,APTV,share blackberry bb free report mobile phone maker turn software provider climb more morning trading wednesday company announce work internet giant baidu bidu free report self drive car project blackberry management say today baidu use qnx hypervisor software be design complex vehicle computer system chinese firm open source self drive platform apollo integrate blackberry qnx os apollo platform enable carmaker leap prototype production system add li zhenyu head baidu intelligent drive division blackberry join grow list tech company have contribute apollo last summer microsoft msft free report announce azure cloud platform help apollo reach outside china make roughly brand work project goal apollo be provide open powerful platform automotive industry further goal autonomous vehicle baidu president ya qin zhang say time also read microsoft baidu partner autonomous car other notable company have collaborate baidu include nvidia nvda free report bosch boch free report continental blackberry new partnership be several have form grow self drive car market software firm have also sign deal work chipmaker qualcomm qcom free report well auto tech company aptiv aptv free report denso dnzoy free report opportunity be global very large market think very solid blackberry cibc capital market analyst todd coupland reuter want more stock market analysis author make sure follow ryan_mcqueeney twitter investor alert breakthrough pending medical advance be now flashpoint theory realization billion dollar research have pour company be already generate substantial revenue even more wondrous product be pipeline cure variety deadly disease be sight so be big potential profit early investor zack name stock buy now click here see
23,APTV,similar wise buy decision exit certain underperformer right time help maximize portfolio return selling loser be difficult share price estimate be fall be time get rid security more loss hit portfolio such stock want consider drop be aptiv plc aptv free report have witness significant price decline past week have see negative earning estimate revision current quarter current year zack rank strong sell further confirm weakness aptv key reason move have be negative trend earning estimate revision full year have see estimate move past day compare just upward revision trend have cause consensus estimate trend lower go share month current level also current quarter aptiv have see downward estimate revision versus revision opposite direction drag consensus estimate share past day stock also have see pretty dismal trading lately share price have drop past month delphi automotive plc price consensus delphi automotive plc price consensus delphi automotive plc quoteso not be good decision keep stock portfolio anymore least don have long time horizon be still interested technology service industry instead consider better rank stock luna innovation incorporate luna free report stock currently hold zack rank buy be better selection time see complete list today zack rank strong buy stock here wall street next amazonzack evp kevin matra believe familiar stock have only just begin climb become greatest investment time once generation opportunity invest pure genius click detail
24,APTV,here be stock add zack rank strong sell list today aptiv plc aptv free report be vehicle component manufacturer zack consensus estimate current year earning have be revise downward last day johnson control international plc jci free report be global diversify technology multus industrial company zack consensus estimate current year earning have be revise downward last day valvoline inc vvv free report be manufacturer marketer automotive industrial lubricant zack consensus estimate current year earning have be revise downward last day commercewest bank cwbk free report be provider various commercial banking service zack consensus estimate current year earning have be revise downward last day bbva banco francs bfr free report be provider financial service small medium enterprise individual customer zack consensus estimate current year earning have be revise downward last day view entire zack rank list
