,ticker,content
11,APTV,growth reasonable price garp be excellent way investor make quick gain strategy help investor gain exposure stock have impressive prospect be trading discount garp approach lead identification stock be price market reasonable target determine fundamental analysis stock also have solid prospect term cash flow revenue earning share ep so mean portfolio create basis garp strategy be expect have stock offer best value growth investing growth metricsstrong earning growth solid prospect be main concept garp investor borrow growth investing strategy however instead super normal growth rate pick stock more stable reasonable growth rate be prefer tactic garp investor hence growth rate be consider ideal strategy growth metric be consider growth garp investor be return equity roe garp investor look strong higher roe compare industry average identify superior stock moreover stock positive cash flow find precedence garp plan value metricsgarp investing give priority popular value metric price earning ratio investing style pick stock higher ratio compare value investor avoid company extremely high ratio moreover price book value ratio be value metric be consider used garp principle have run screen identify stock be likely offer solid return term screening parametersalong criterium discuss section have consider favorable zack rank strong buy buy last year ep project year ep growth rate strong ep growth history prospect ensure improve business roe past month greater industry average higher roe compare industry average indicate superior stock ratio less industry average ratio less industry indicate stock be undervalue here be stock make screen vmware inc vmw free report provide virtualization solution desktop datum center zack rank stock deliver average quarter earning surprise see complete list today zack rank stock here boston scientific corporation bsx free report transform life innovative medical solution improve health patient world zack rank stock deliver average quarter earning surprise factset research system inc fds free report create flexible open datum software solution ten thousand investment professional world provide instant access financial datum analytic investor use make crucial investment decision zack rank stock deliver average quarter earning surprise grand canyon education inc lope free report be regionally accredit provider online postsecondary education service focuse offer graduate undergraduate degree program core discipline education business healthcare zack rank stock deliver average quarter earning surprise anthem inc antm free report be health care company provide medical product subsidiary company deliver average quarter positive earning surprise carry zack rank petm express inc pet free report be lead nationwide pet pharmacy zack rank stock come average quarter earning surprise aptiv plc aptv free report be technology company serve automotive sector company design manufacture vehicle component provide electrical electronic active safety technology solution global automotive commercial vehicle market zack rank stock deliver positive earning surprise last quarter get rest stock list start putt other idea test be do research wizard stock pick back testing software research wizard be great place begin easy use everything be plain language very intuitive start research wizard trial today next time read economic report open research wizard plug find see gem come click here sign free trial research wizard today disclosure officer director employee zack investment research own have sell short security hold long short position option be mentioned material affiliated investment advisory firm own have sell short security hold long short position option be mentioned material disclosure performance information zack portfolio strategy be available https www zack com performance zack restaurant recommendation addition dine special place feast stock share zack special report spotlight recent ipos watch stock offer immediate promise boom sector download free
12,APTV,fifa world cup be hold russia jun jul less week left month long mega football event british economy be expect gain event revenue generation not come directly fifa world cup british entertainment company retailer restaurant chain be expect gain event optimism world cup recent economic datum unite kingdom be quite encourage manufacturing service purchasing manager index pmis register noticeable increase follow development investing british company be expect gain world cup strong manufacturing service sector look prudent investment option fifa world cup bring billion datum british think tank world advertising research center warc world cup bring economy moreover figure total even england reach final stage event accord base digital marketplace vouchercode large number british retailer brand be gain world cup vouchercode british hospitality sector be expect make additionally revenue barbecue garden party be estimate be more further expenditure sportswear item include team jersey be moreover football fan watch match home be project spend food alcohol fact tv audience separately spend get better experience world cup number sector be expect increase even further england become finalist mega event additionally marketing director vouchercode jimmy new say fifa world cup turn be big event football fan british retailer add massive be expect be generate next couple month celebrate occasion britain manufacturing service pmi shine mayaccord ihs markit cip manufacturing purchasing manager index pmi increase april read british manufacturing activity re-cover touch year low april finished good inventory register best increase commencement survey year back strong decline backlog boost manufacturing pmi additionally ihs markit cip service pmi rise april country manufacturing activity not only expand last month also reach highest settlement last month increase new work order service sector fading concern bad weather boost index british stock buy world cup not help direct revenue generation british stock company be expect gain significantly sporting event strong manufacturing service activity country be definitely good news investor make british stock wise investment choice context have select british stock be expect gain follow development stock also flaunt zack rank strong buy buy see complete list today zack rank stock here aptiv plc aptv free report be manufacturer vehicle component provider safety technology solution global automotive commercial vehicle market gillingham base company have zack rank expect earning growth rate current year be zack consensus estimate current year have improve last day aptiv have gain past year spirax sarco engineering plc spxsf free report be provider engineer solution design maintenance provision industrial commercial steam system cheltenham base company have zack rank expect earning growth rate current year be zack consensus estimate current year have improve last day spirax sarco engineering have gain past year nmc health plc nmhly free report be provider healthcare service unite arab emirate globally london base company have zack rank expect earning growth rate current year be zack consensus estimate current year have improve last day nmc health have gain past year safestore holding plc sfshf free report be largest self storage group store comprise wholly own store britain borehamwood base company have zack rank expect earning growth rate current year be zack consensus estimate current year have improve last day safestore holding have gain past year tt electronic plc ttgpf free report be provider engineer electronic performance critical application globally woking base company have zack rank expect earning growth rate current year be zack consensus estimate current year have improve last day tt electronic have gain past year today stock zack hottest strategiesit hard believe even zack market gain top stock pick screen have return outperformance have not just be recent phenomenon year have be remarkably consistent composite yearly average gain strategy have beaten market more maybe even more remarkable be fact re willing share latest stock cost obligation see free
13,APTV,highly anticipate royal wedding docket weekend ve be live rock prince harry be wed american actress humanitarian activist markle saturday mid day england very early time thought be worthwhile take peek performance british oriented stock especially now brexit decision vote nearly year be finally be enact be see different forecast favorite english stock be hardly only article feature such equity way even here zack com publish separate study top rate british company earlier week here royal wedding record job growth aid economy picksintegrate oil super major bp inc bp free report be clearly not feel negative effect brexit activity brent crude oil price recently have hit barrel be assist zack rank strong buy company zack style score value growth momentum neighbor sector be also do well overall bp sit top zack industry rank top sector rank share be slightly today pre market have be steadily climb back fall oil price few year back say bp share be still multus year high experience just prior company horizon oil spill gulf mexico be rage time year bp stock be couple dollar share past month big pharma company astrazeneca azn free report also boast zack style score zack rank hold however reside sector bottom zack scale company be well diversify do suffer setback recently asthma treatment fasenra have fail copd study share be bit ahead open bell today continue trade range just time high hit just few year county kent own delphi automotive aptv free report auto tech specialty company feature solution auto emission fuel economy currently hold zack rank buy however style score be relatively lag growth momentum proudly hail time market high even close slightly lower yesterday record high share
14,APTV,friday highly anticipate royal wedding docket weekend ve be live rock prince harry be wed american actress humanitarian activist markle saturday mid day england very early time thought be worthwhile take peek performance british oriented stock especially now brexit decision vote nearly year be finally be enact be see different forecast favorite english stock be hardly only article feature such equity way even here zack com publish separate study top rate british company earlier week here royal wedding record job growth aid economy picksintegrate oil super major bp inc bp free report be clearly not feel negative effect brexit activity brent crude oil price recently have hit barrel be assist zack rank strong buy company zack style score value growth momentum neighbor sector be also do well overall bp sit top zack industry rank top sector rank share be slightly today pre market have be steadily climb back fall oil price few year back say bp share be still multus year high experience just prior company horizon oil spill gulf mexico be rage time year bp stock be couple dollar share past month big pharma company astrazeneca azn free report also boast zack style score zack rank hold however reside sector bottom zack scale company be well diversify do suffer setback recently asthma treatment fasenra have fail copd study share be bit ahead open bell today continue trade range just time high hit just few year county kent own delphi automotive aptv free report auto tech specialty company feature solution auto emission fuel economy currently hold zack rank buy however style score be relatively lag growth momentum proudly hail time market high even close slightly lower yesterday record high share mark vickerysenior editorquestion comment article author click here medical stock buy nowzack name company poise ride medical breakthrough be target cure leukemia aids muscular dystrophy hemophilia other condition new product field be already generate substantial revenue even more wondrous treatment be pipeline early investor realize exceptional profit click here see stock
15,APTV,prince harry markle be walking aisle economy be expect earn million pound royal wedding sector retail restaurant automobile tourism become biggest gainer additionally occurrence wedding weekend be expect have positive impact consumer confidence eventually economy additionally register best job addition first month year second half also wage growth increase unemployment rate be year low follow development investing british company be expect gain royal wedding strong job report look prudent investment option royal wedding bring economyaccord brand consultancy firm brand finance prince harry royal wedding be expect add britain economy fact sector tourism pr value be expect generate retail restaurant fashion merchandise add respectively manage director brand consultancy firm brand finance richard haigh say royal wedding be par prince william kate middleton wedding moreover base forecasting firm ey item club say follow wedding consumer confidence undergo feel good factor ey item club chief economic advisor howard say royal wedding bring good news economy post weak first quarter encounter slow start second quarter job addition best jobless rate lowest accord office national statistic on datum first quarter total number employ person be increase previous quarter mark highest increase total number employ person increase first quarter also unemployment rate remain unchanged lowest moreover wage include bonuse rise real term average wage growth be also higher inflation rate come march british stock buy nowstrong gain royal wedding make british stock wise investment choice additionally strong job addition record low unemployment rate steady wage growth be definitely good news investor context have select british stock be expect gain follow development stock also flaunt zack rank strong buy buy see complete list today zack rank stock here bp bp free report be hold company world largest petroleum petrochemical group london base company have zack rank expect earning growth rate current year be zack consensus estimate current year have improve last day bp have gain past year domino pizza group plc dpuky free report be owner operator franchiser domino pizza store unite kingdom milton keyne base company have zack rank expect earning growth rate current year be zack consensus estimate current year have improve last day domino pizza group have gain past year aptiv plc aptv free report be manufacturer vehicle component provider safety technology solution global automotive commercial vehicle market gillingham base company have zack rank expect earning growth rate current year be zack consensus estimate current year have improve last day aptiv have gain past year tesco plc tscdy free report be grocery retailer have operation unite kingdom ireland other country welwyn garden city base company have zack rank expect earning growth rate current year be zack consensus estimate current year have improve last day tesco have gain past year sainsbury plc jsaiy free report be major food general merchandise clothing retail company london base company have zack rank expect earning growth rate current year be zack consensus estimate current year have improve last day sainsbury have gain year time today stock zack hottest strategiesit hard believe even zack market gain top stock pick screen have return outperformance have not just be recent phenomenon year have be remarkably consistent composite yearly average gain strategy have beaten market more maybe even more remarkable be fact re willing share latest stock cost obligation see free
16,APTV,investor lookout stock potential maximum growth value investing consider growth reasonable price garp strategy popular strategy help investor gain exposure stock impressive growth prospect be trading discount garp investing employ popular value metric price earning price book value ratio evaluate stock be undervalue garp metric mix growth value metricsthe garp approach help identify stock be price market reasonable target determine fundamental analysis stock also have solid prospect term cash flow revenue earning share ep so growth metricsstrong earning growth history impressive prospect be main concept garp investor borrow growth investing strategy however instead super normal growth rate pick stock more stable reasonable growth rate be prefer tactic garp investor hence growth rate be consider ideal strategy growth metric be consider growth garp investor be return equity roe garp investor look strong higher roe compare industry average identify superior stock moreover stock positive cash flow find precedence garp plan value metricsgarp investing give priority popular value metric price earning ratio investing style pick stock higher ratio compare value investor avoid company extremely high ratio moreover price book value ratio be value metric be consider used garp principle have run screen identify stock offer solid return term screening parametersalong criterium discuss section have consider favorable zack rank strong buy buy last year ep project year ep growth rate strong ep growth history prospect ensure improve business roe past month greater industry average higher roe compare industry average indicate superior stock ratio less industry average ratio less industry indicate stock be undervalue few criterium have narrow universe stock only here be stock make screen grand canyon education inc lope free report be regionally accredit provider online postsecondary education service focuse offer graduate undergraduate degree program core discipline education business healthcare zack rank stock deliver average quarter earning surprise see complete list today zack rank stock here petm express inc pet free report be lead nationwide pet pharmacy zack rank stock come average quarter earning surprise dollar general corporation dg free report be discount retailer unite state zack rank stock surpass zack consensus estimate thrice trail quarters match same occasion deliver positive average earning surprise best buy company inc bby free report be multinational specialty retailer consumer electronic home office product entertainment software appliance related service zack rank stock surpass zack consensus estimate thrice trail quarters miss same occasion deliver average positive earning surprise anthem inc antm free report be health care company company provide medical product subsidiary zack rank stock come average quarter earning surprise aptiv plc aptv free report be technology company serve automotive sector company design manufacture vehicle component provide electrical electronic active safety technology solution global automotive commercial vehicle market zack rank stock surpass zack consensus estimate thrice trail quarters miss same occasion deliver average positive earning surprise get rest stock list start putt other idea test be do research wizard stock pick back testing software research wizard be great place begin easy use everything be plain language very intuitive start research wizard trial today next time read economic report open research wizard plug find see gem come click here sign free trial research wizard today disclosure officer director employee zack investment research own have sell short security hold long short position option be mentioned material affiliated investment advisory firm own have sell short security hold long short position option be mentioned material disclosure performance information zack portfolio strategy be available https www zack com performance zack restaurant recommendation addition dine special place feast stock share zack special report spotlight recent ipos watch stock offer immediate promise boom sector download free
17,APTV,british economy expand sequentially slow rise previous period fall short market expectation marked weakest growth rate shrinkage see fourth quarter decline construction slow manufacturing growth cause economy expand so stealthily be not enough latest datum reveal inflation suddenly slow march lowest level year rate inflation drop march prior month market expectation bad weather take blame gdp disaster still stir question investor mind british economy be healthy enough survive policy tighten accord analyst slower growth consumer spending likely stem slower real wage growth even nominal wage have increase meant bank england not dive policy tighten mode low inflation growth scenario last time bank england boe hike benchmark interest rate basis point be november be first hike july intend curb inflation read hike interest rate etfs focus be not enough governor boe mark carney send sterling downhill ride acknowledge likely economic contagion brexit suggest delay next interest rate hike pour cold water market odd bank be prepare move powershare currencyshare british pound sterling trust fxb free report lose past trading session apr reflect slow gdp datum be last day etfs stock buy backdrop investor consider etfs stock highlight few product investor see european equity etfs here etf pick deutsche tracker msci unite kingdom hedge equity fund dbuk free report underlie msci unite kingdom dollar hedge index look provide exposure equity market unite kingdom same time mitigate exposure fluctuation value dollar british pound sterling fund yield annually ishare currency hedge msci unite kingdom etf hewu free report underlie msci unite kingdom hedge usd index consist stock trade primarily london stock exchange currency risk security include underlie index hedge dollar monthly basis yield annually spdr msci unite kingdom strategicfactor etf qgbr free report be smart beta fund give exposure combination factor stock low volatility quality value fund yield annually stock pick fiat chrysler automobile fcau free report fiat chrysler automobile nv operate international automotive company have vgm value growth momentum score stock have zack rank strong buy micro focus international plc sponsored adr mfgp free report zack rank buy company be infrastructure software company develop sell support software product solution have vgm score delphi automotive plc aptv free report aptiv plc be technology company serve automotive sector have vgm score stock have zack rank want key etf info deliver straight inbox zack free fund newsletter brief top news analysis well top perform etfs week get free
