,ticker,content
0,APTV,investor interest technology service stock have likely encounter aptiv aptv free report sailpoint technology sail free report stock be more attractive value investor ll need take closer look find be plenty strategy discover value stock have find pairing strong zack rank impressive grade value category style score system produce best return proven zack rank put emphasis earning estimate estimate revision style score work identify stock specific trait aptiv have zack rank buy sailpoint technology have zack rank hold right now mean aptv earning estimate revision activity have be more impressive so investor feel comfortable improve analyst outlook however value investor care much more just value investor also try analyze wide range traditional figure metric help determine company be undervalue current share price level value category style score system identify undervalue company look number key metric include long favore ratio ratio earning yield cash flow share variety other fundamental help determine company fair value aptv currently have forward ratio sail have forward also note aptv have peg ratio popular figure be similar widely used ratio peg ratio also consider company expect ep growth rate sail currently have peg ratio notable valuation metric aptv be ratio ratio pit stock market value book value be defined total asset total liability comparison sail have base metric many more aptv hold value grade sail have value grade aptv stand sail thank solid earning outlook base valuation figure also feel aptv be superior value option right now
1,APTV,investor interested stock technology service sector have probably already hear aptiv aptv free report sailpoint technology sail free report stock present investor better value opportunity right now let take closer look best way find great value stock be pair strong zack rank impressive grade value category style score system zack rank favor stock strong earning estimate revision trend style score highlight company specific trait aptiv have zack rank buy sailpoint technology have zack rank hold right now mean aptv earning estimate revision activity have be more impressive so investor feel comfortable improve analyst outlook be just factor value investor be interested value investor also tend look number traditional try true figure help find stock believe be undervalue current share price level value category highlight undervalue company look variety key metric include popular ratio well ratio earning yield cash flow share variety other fundamental have be used value investor year aptv currently have forward ratio sail have forward also note aptv have peg ratio figure be similar commonly used ratio peg ratio also factor company expect earning growth rate sail currently have peg ratio notable valuation metric aptv be ratio ratio pit stock market value book value be defined total asset total liability comparison sail have metric several other help aptv earn value grade sail have be give value grade aptv have see stronger estimate revision activity sport more attractive valuation metric sail so seem value investor conclude aptv be superior option right now
2,APTV,aptiv plc aptv free report have be struggle lately selling pressure be come end soon be aptv recently see hammer chart pattern signal stock be near bottom be hammer chart pattern hammer chart pattern be popular technical indicator be used candlestick charting hammer appear stock tumble day then find strength point session close open price form candlestick resemble hammer suggest market have find low point stock better day be ahead other factorsplus earning estimate have be rise company even sluggish trading lately just past day alone estimate have go higher compare none lower consensus estimate have also moved right direction estimate have actually rise so much stock now have zack rank buy suggest relatively unloved stock be due soon be especially true aptv stock build momentum here find way continue higher encourage trading development see complete list today zack rank strong buy stock here medical stock buy nowzack name company poise ride medical breakthrough be target cure leukemia aids muscular dystrophy hemophilia other condition new product field be already generate substantial revenue even more wondrous treatment be pipeline early investor realize exceptional profit click here see stock
3,APTV,delphi technology plc dlph free report look strong back vast global network innovative product portfolio update technology aftermarket business generate stable recur revenue notably delphi technology report strong first quarter result adjust earning share beat consensus mark cent be penny year quarter net revenue beat zack consensus estimate figure be year year report basis adjust basis such impressive result observe share delphi technology have decline industry rise year date basis drive delphi technology delphi technology have geographically diverse revenue base region wise derive revenue europe middle east africa emea north america asia pacific south america first quarter company be highly optimistic opportunity asia pacific region net sale region grow almost quarter increase level vehicle production region be encourage regional presence couple diversify innovative product portfolio update technology help delphi technology become solid choice original equipment manufacturer oem be oem be focuse increase efficiency expand global manufacturing footprint choose supplier global scale easily adapt regional variation additionally delphi technology be also optimistic opportunity aftermarket business aftermarket product portfolio offer extensive range solution include fuel injection electronic engine management maintenance test equipment vehicle diagnostic category lead aftermarket company include independent retailer wholesale distributor demand aftermarket product service depend grow number vehicle life cycle total mile cover replacement many aftermarket product be discretionary nature company generate stable recur revenue aftermarket business zack rank stock considerdelphi technology be zack rank buy stock see complete list today zack rank strong buy stock here other top rank stock broader business service sector include blucora bcor free report holding iqv free report aptiv aptv free report blucora sport zack rank holding aptiv carry zack rank long term expect earning share growth rate blucora holding aptiv be respectively hottest tech mega trend year generate global revenue predict blast roof fame investor mark cuban say produce world first trillionaire still leave plenty money regular investor make right trade early see zack best stock play trend
4,APTV,omnicom group inc omc free report be schedule report second quarter result jul open bell expect company top line do well back revenue growth most region lower tax rate be likely have positive impact omnicom earning observe share omnicom have gain year date compare zack composite gain top line improve year zack consensus estimate revenue be report quarter be peg indicate year year increase expect company witness top line growth most region region wise consensus estimate north america revenue indicate improvement year year same latin america be expect rise year year year year year year asia pacific year year euro other europe middle east africa be expect remain stable first quarter company revenue increase year year organic growth be quarter regional market revenue latin america increase year year asia pacific record increase revenue euro other europe improve record improvement however revenue north america reduce year year same middle east africa be earning likely grow tax reform tax cut job act reduce corporate tax rate significantly benefit omnicom earning be report quarter notably consensus estimate earning share ep be peg indicate year year growth first quarter earning increase year year company also enjoy lower income tax rate reduction income tax expense due successful resolution foreign tax claim first quarter full year company anticipate effective tax rate exclude potential tax benefit share base compensation model doesn suggest beatplease note accord zack model company zack rank strong buy buy hold have good chance beating estimate also have positive earning esp stock zack rank sell rate be best avoid especially have negative earning esp uncover best stock buy sell re report earning esp filter omnicom have zack rank earning esp stock considerhere be few stock broader business service sector investor consider model show have right combination element beat earning second quarter aptiv plc aptv free report have earning esp zack rank company be slate report quarterly number jul see complete list today zack rank stock here holding inc iqv free report have earning esp zack rank company be slate report quarterly result jul avis budget group inc car free report have earning esp zack rank company be expect report quarterly number aug hottest tech mega trend year generate global revenue predict blast roof fame investor mark cuban say produce world first trillionaire still leave plenty money regular investor make right trade early see zack best stock play trend
5,APTV,broadridge financial solution inc br free report recently launch cognitive marketing platform broadridge smart insight enable easy efficient distribution content prospect channel be wealth management solution integrate broadridge cloud ai dataset consumer demographic behavioral financial information secure multus channel platform platform feature auto identification prospect fit interest level engagement activity build ai automatically select best suit content prospect just right time be newest release company integrate wealth management solution product suite serve more financial advisor several wealth management firm steve scruton president broadridge advisor solution state be help client advisor become bionic leverage new technology datum scale transform business enrich customer engagement optimize efficiency generate growth observe share broadridge have surge year significantly outperform rally industry belong
6,APTV,aptiv plc aptv free report yesterday announce have inked deal purchase interconnect base provider custom engineer interconnect solution harsh environment application affiliate snow phipps group subject regulatory approval fulfillment customary close condition propose buyout be expect close end come heel aptiv acquisition south korea base provider engineer connector cable management solution kum jun glimpse aptiv price trend reveal stock have have impressive run bourse past month share aptiv have return significantly outperform industry gain say time frame signal power solution likely growpost deal closure operate independent business unit aptiv signal power solution segment segment design manufacture assemble electrical architecture vehicle include engineer component product wiring assembly harness connector cable management electrical center hybrid high voltage safety distribution system first quarter segment contribute largest chunk aptiv total revenue revenue segment increase year year billionkevin clark aptiv president chief executive officer state further establish aptiv market leader connectivity solution be strategic fit signal power solution segment acquisition have be key growth catalyst aptiv company have be continuously acquire investing company globally internationally expand capability strengthen market share increase geographic presence zack rank stock aptiv have zack rank buy see complete list today zack rank strong buy stock here other top rank stock broader business service sector include blucora bcor free report holding iqv free report paychex payx free report blucora sport zack rank holding paychex carry zack rank long term expect earning share growth rate blucora holding paychex be respectively more stock news be bigger iphone become mother technological revolution apple sell mere iphone year new breakthrough be expect generate more device just year create market zack have just release special report spotlight fast emerge phenomenon ticker take advantage don buy now kick click here trade
7,APTV,fifa world cup russia witness many surprise time include defend champion germany early exit other favorite follow suit team england give stunning performance best world cup great world cup season help boost stock considerably additionally bank england say world cup actually help britain overcome brexit related tension addition optimism world cup recent economic datum unite kingdom be upbeat solid increase retail sale june gdp increase steadily service purchasing manager index pmi reach best level last october june follow development investing british company be expect gain world cup strong gdp datum look prudent investment option fifa world cup bring ample gain unite kingdom know england world cup last win coveted title way back country reach semis first time clearly country have year reach semi final tournament follow development june consumer invest significantly barbecue beer big screen television turn boost retail sale june retail sale advanced year year datum british retail consortium brc retail sale have register second best rise year back steady rise consumer spending accord barclaycard overall consumer spending advanced spending restaurant pub climb june also brc say sale be year year world cup soothe brexit induced worrieson jul bank england boe governor mark carney show optimism england success world cup carney say england winning soccer title jul moscow be unadulterated unalloyed good economy country world cup joy come time unite kingdom be reel brexit related tension britain foreign secretary boris johnson brexit minister david davis have resign have raise prospect new election push brexit negotiation murkier water separately british beer pub association additional sale beer follow world cup bring form tax collection pub retailer greene king have already state sell additional pint match england panama other pub operator marston ei group be also expect gain england reach semis britain gdp rise service pmi shine juneaccord national institute economic social research britain gdp growth month be better april rise gdp growth lead economic growth march period higher february april increase strong service sector performance boost gdp month end ihs markit cip service pmi rise june country manufacturing activity not only expand last month also reach highest settlement last month overall service activity increase second quarter british stock buy england sailing quarterfinal now gear face croatia second semi final clearly have lot more gain additionally strong retail sale steady economic growth help british company gain significantly strong service activity country be definitely good news investor make british stock wise investment choice context have select british stock be expect gain follow development stock also flaunt zack rank strong buy buy see complete list today zack rank stock here bp plc bp free report be involved energy business world london base company have zack rank expect earning growth rate current year be zack consensus estimate current year have improve last day bp have gain past year aptiv plc aptv free report be manufacturer vehicle component provider safety technology solution global automotive commercial vehicle market dublin base company have zack rank expect earning growth rate current year be zack consensus estimate current year have improve last day aptiv have gain past year atlantica yield plc ay free report be manager renewable energy natural gas power electric transmission line water asset brentford base company have zack rank expect earning growth rate current year be more zack consensus estimate current year have improve last day atlantica yield have gain past year mimecast limit mime free report be email datum security company london base company have zack rank expect earning growth rate current year be more zack consensus estimate current year have improve last day mimecast have gain year tullow oil plc tuwoy free report be involved oil gas exploration development production activity london base company have zack rank expect earning growth rate current year be zack consensus estimate current year have improve last day tullow oil have gain year time more stock news be bigger iphone become mother technological revolution apple sell mere iphone year new breakthrough be expect generate more device just year create market zack have just release special report spotlight fast emerge phenomenon ticker take advantage don buy now kick click here trade
8,APTV,wise investment decision involve buy stock right time selling risk rise share price fundamental signal stock bullish run aptiv plc aptv free report be technology service stock have perform extremely well past month have potential carry momentum term therefore haven take advantage share price appreciation yet time add stock portfolio let take look factor make stock attractive pick share price performancea glimpse company price trend reveal stock have have run bourse past month aptiv return compare industry increase
9,APTV,re look profitable portfolio stock offer best value growth investing try growth reasonable price garp strategy help investor gain exposure stock be undervalue have impressive growth prospect however not confuse garp investing blend strategy blend strategy promote investment value growth stock garp investing require value growth feature single stock garp metric mix growth value metricsthe garp approach prefer stock be price market reasonable target determine fundamental analysis stock also have solid prospect term cash flow revenue earning share ep so growth metricsstrong earning growth history impressive earning prospect be main concept garp investor borrow growth investing strategy however instead super normal growth rate pursue stock more stable reasonable growth rate be also tactic garp investor hence growth rate be consider ideal garp strategy growth metric be consider growth garp investor be return equity roe garp investor look strong higher roe compare industry average identify superior stock moreover stock positive cash flow find precedence garp plan value metricsgarp investing give priority popular value metric price earning ratio investing style pick stock higher ratio compare value investor avoid company extremely high ratio moreover price book value ratio be also consider used garp principle have run screen identify stock offer solid return term screening parametersalong criterium discuss section have consider favorable zack rank strong buy buy last year ep project year ep growth rate strong ep growth history prospect ensure improve business roe past month greater industry average higher roe compare industry average indicate superior stock ratio less industry average ratio less industry indicate stock be undervalue here be stock make screen anthem inc antm free report be health care company company provide medical product subsidiary zack rank stock deliver average quarter earning surprise see complete list today zack rank stock here vmware inc vmw free report provide virtualization solution desktop datum center company deliver average quarter positive earning surprise have zack rank merit medical system inc mmsi free report set build world most customer focuse healthcare company understand customer need innovate deliver diverse range product improve life person family community world zack rank stock deliver average quarter earning surprise boston scientific corporation bsx free report transform life innovative medical solution improve health patient world zack rank stock deliver average quarter earning surprise grand canyon education inc lope free report be regionally accredit provider online postsecondary education service focuse offer graduate undergraduate degree program core discipline education business healthcare zack rank stock deliver average quarter earning surprise petm express inc pet free report be lead nationwide pet pharmacy zack rank stock come average quarter earning surprise aptiv plc aptv free report be technology company serve automotive sector company design manufacture vehicle component provide electrical electronic active safety technology solution global automotive commercial vehicle market zack rank stock deliver positive earning surprise last quarter get rest stock list start putt other idea test be do research wizard stock pick back testing software research wizard be great place begin easy use everything be plain language very intuitive start research wizard trial today next time read economic report open research wizard plug find see gem come click here sign free trial research wizard today disclosure officer director employee zack investment research own have sell short security hold long short position option be mentioned material affiliated investment advisory firm own have sell short security hold long short position option be mentioned material disclosure performance information zack portfolio strategy be available https www zack com performance zack restaurant recommendation addition dine special place feast stock share zack special report spotlight recent ipos watch stock offer immediate promise boom sector download free
10,APTV,aptiv plc aptv free report yesterday complete purchase south korea base provider connector cable management solution kum buyout be also expect boost aptiv earning share ep notably company have raise guidance now expect ep be range compare previously guide range glimpse aptiv price trend reveal stock have have impressive run bourse last year share aptiv have return significantly outperform industry gain enhance footprint asia acquisition be expect complement aptiv robust growth asia pacific region kum be integrate aptiv exist asia pacific operation thereby enrich competitive position korea china kevin clark president chief executive officer aptiv state kum be great fit business strengthen leadership position asia pacific engineer component geographically diverse revenue base aptiv be highly optimistic growth opportunity asia pacific region generate net sale region further net sale region grow almost signal power solution buyout be likely enhance aptiv signal power solution segment segment design manufacture assemble vehicle electrical architecture include engineer component product wiring assembly harness connector cable management electrical center hybrid high voltage safety distribution system first quarter segment revenue increase year year contribute total revenue zack rank stock aptiv have zack rank buy see complete list today zack rank strong buy stock here other top rank stock broader business service sector include delphi technology plc dlph free report blucora inc bcor free report mastercard incorporate free report stock sport zack rank long term expect earning share growth rate delphi technology blucora mastercard be respectively wall street next amazonzack evp kevin matra believe familiar stock have only just begin climb become greatest investment time once generation opportunity invest pure genius click detail
