,ticker,content
153,DOV,value investing be easily most popular way find great stock market environment wouldn want find stock be fly radar be compelling buy offer tantalize discount compare fair value way find company be look several key metric financial ratio many be crucial value stock selection process let put corporation dov free report stock equation find be good choice value oriented investor right now investor subscribe methodology look elsewhere top pick pe ratioa key metric value investor always look be price earning ratio pe short show much investor be willing pay dollar earning give stock be easily most popular financial ratio world best use pe ratio be compare stock current pe ratio ratio have be past compare average industry sector compare market whole front have trail month pe ratio see chart level actually compare pretty favorably market large pe stand focus long term pe trend current pe level put slightly midpoint past year moreover current level be fairly high stock suggest be good entry point further stock pe also compare favorably industry trail month pe ratio stand very least indicate stock be relatively undervalue right now compare peer also point have forward pe ratio price relative year earning just so be fair say slightly more value oriented path be ahead stock term too ratioanother key metric note be price sale ratio approach compare give stock price total sale lower read be generally consider better person metric more other value focuse one look sale something be far harder manipulate accounting trick earning right now have ratio be lower average come right now also see chart be well high stock particular past few year anything dov be lower end range time period metric suggest level undervalue trading least compare historical norm broad value outlookin aggregate currently have zack value style score putt top stock cover look make solid choice value investor other key metric make pretty clear too example peg ratio be just level be lower industry average peg ratio be modify pe ratio take account stock earning growth rate additionally cf ratio great indicator value come be far better industry average clearly dov be solid choice value front multiple angle stock overall be good choice value investor be plenty other factor consider investing name particular be worth note company have growth grade momentum score give dov zack vgm score overarch fundamental grade read more zack style score here meanwhile company recent earning estimate have be mixed best current year have see estimate go higher past day compare lower next year estimate have see upward downward revision same time period result current year consensus estimate have inched lower past month next year estimate have inched see consensus estimate trend recent price action stock chart corporation price consensus corporation price consensus corporation somewhat mixed trend be stock have just zack rank hold be look line performance company term bottom linedover be inspire choice value investor be hard beat incredible lineup statistic front moreover strong industry rank top more industry further support growth potential stock fact past year industry have outperformed broader market see however zack rank be hard get too excited company overall so value investor want estimate analyst sentiment turn name first once happen stock be compelling pick moreover broader factor industry level support growth potential company well medical stock buy nowzack name company poise ride medical breakthrough be target cure leukemia aids muscular dystrophy hemophilia other condition new product field be already generate substantial revenue even more wondrous treatment be pipeline early investor realize exceptional profit click here see stock
154,DOV,issue update research report corporation dov free report company benefit effort simplify portfolio share repurchase well strong momentum segment however separation cost pertain apergy continue weakness retail refrigeration remain headwind upbeat performance deliver first quarter adjust earning share increase prior year quarter mainly drive continue strength business earning also beat zack consensus estimate total revenue increase year year quarter surpass zack consensus estimate year year increase be attribute acquisition growth organic growth favorable impact foreign exchange partly offset impact disposition booking end first quarter be worth report end first quarter organic booking increase business exception refrigeration food equipment backlog increase end report quarter year quarter end backed strong booking growth company be poise improve second quarter performance upbeat guidance backed continue momentum segment guide adjust earning share reflect increase approximately prior year guidance factor full year revenue growth be comprise organic growth acquisition contribute growth favorable impact foreign currency translation add benefit be partially offset impact disposition guidance also include impact incremental share repurchase impact tax reform segment be poise deliver growth fiscal company anticipate strong booking engineer system fluid strong book bill drive organic revenue also mark coding digital printing waste handle be expect continue perform well fluid segment strong growth pump hygienic pharma business drive result bearing compression be solid retail fuel sequentially improve refrigeration food equipment company expect continue strong performance heat exchanger shape equipment retail refrigeration be anticipate improve back half year several customer step remodel activity leaner portfolio drive growth persist effort simplify portfolio sync company have successfully complete spin upstream energy business have be later name apergy now be standalone company focuse industrial product manufacturing equipment apergy be independent public company apergy spin be anticipate enable concentrate less volatile core platform deliver innovative equipment component specialty system consumable supply software digital solution support service consequently core platform compete lower volatility industrial market be well poise provide strong foundation reinvestment long term sustainable revenue earning growth robust free cash flow generation earlier sell consumer industrial winch business fourth quarter company also complete sale performance motorsport international manufacturer piston other engine related component serve motorsport powersport market total proceed first quarter step aid company streamline business investing market lead platform strong margin profile resilience market volatility bright prospect be also review cost structure right size company boost margin company plan achieve cost saving headwind remain expect incur separation cost related apergy second quarter impact quarter margin also retail refrigeration second quarter continue be hurt tough comparison related last year strong shipment softer overall market underperform industry respect share price performance past year stock have dip industry record growth zack rank key pick carry zack rank hold better rank stock same sector include apply industrial technology inc ait free report graco inc ggg free report idex corporation iex free report apply industrial technology graco sport zack rank strong buy idex carry zack rank buy see complete list today zack rank stock here apply industrial technology have expect long term earning growth rate share have go past year graco have expect long term earning growth rate company share have surge past year idex have expect long term earning growth rate share have appreciate last year medical stock buy now zack name company poise ride medical breakthrough be target cure leukemia aids muscular dystrophy hemophilia other condition new product field be already generate substantial revenue even more wondrous treatment be pipeline early investor realize exceptional profit click here see stock
155,DOV,corporation dov free report have successfully complete spin upstream energy business have be later name apergy now be standalone company focuse industrial product manufacturing equipment apergy be independent public company spin historyin december announce tax free spin upstream energy business energy segment comprise artificial lift energy automation synthetic company announce separation anticipate oil gas expose business remain turbulent due volatile oil price apr board director formally approve separation apergy tax free spin distribute common stock apergy hold shareholder corporation price consensus corporation price consensus corporation quotespin detailsa term spin shareholder receive share apergy stock share stock hold close business record date apr however do not issue fractional share apergy stock notably receive time cash payment apergy spin apergyapergy upstream oil sector equipment manufacturer have start trading new york stock exchange symbol apy apergy provide highly engineer equipment technology help company drill produce oil gas moreover company be well position pursue strategic opportunity drill production sector help apergy spin be expect enable concentrate less volatile core platform deliver innovative equipment component specialty system consumable supply software digital solution support service thus core platform compete lower volatility industrial market be well poise provide strong foundation reinvestment long term sustainable revenue earning growth strong free cash flow generation share price performanceover past year have underperform industry respect price performance stock have lose industry record growth same time frame zack rank key picksdover currently carry zack rank hold better rank stock same sector include graco inc ggg free report apply industrial technology inc ait free report atla copco ab atlky free report graco apply industrial technology sport zack rank strong buy atla copco carry zack rank buy see complete list today zack rank stock here graco have long term earning growth rate stock have appreciate year time apply industrial technology have long term earning growth rate company share have be past year atla copco have long term earning growth rate share have rally past year wall street next amazonzack evp kevin matra believe familiar stock have only just begin climb become greatest investment time once generation opportunity invest pure genius click detail
156,DOV,corporation dov free report report first quarter adjust earning share continue operation increase cent record prior year quarter year year improvement be mainly drive continue strength business earning also beat zack consensus estimate report basis post earning share cent quarter decline year year earning report quarter include apergy separation related cost cent rightsize other cost cent also comprise acquisition related amortization cost cent total revenue increase year year quarter surpass zack consensus estimate year year increase be drive acquisition growth organic growth favorable impact foreign exchange partly offset impact disposition corporation price consensus ep surprise corporation price consensus ep surprise corporation quotecost marginscost sale climb year year report quarter gross profit rise year year gross margin expand basis point bps year year selling general administrative expense flare record prior year quarter operate profit jump report year quarter operate margin advanced bps segmental revenue climb year year quarter segment report operate profit compare record comparable period last year revenue engineer system segment ascend record year earlier quarter segment income plunge year year revenue fluid segment be year year quarter segment income rise year year refrigeration food equipment segment revenue decline record prior year quarter segment report operate income witness prior year period booking backlogdover booking end first quarter be worth report end first quarter backlog also increase end report quarter year quarter end financial positiondover generate negative free cash flow first quarter compare cash inflow prior year quarter cash flow operation come report quarter compare year quarter apergy separation updatein december announce tax free spin upstream energy business apergy energy segment apr board director formally approve separation apergy distribution common stock apergy hold shareholder distribution be expect be make shareholder record apr notably shareholder receive share apergy share hold record date follow distribution apergy be independent publicly trade company retain ownership interest apergy outlookdover provide full year ep revenue guidance pro continue operation basis exclude operate result apergy company lower adjust earning share guidance full year mid point guidance reflect increase prior year guidance be base full year revenue growth comprise organic growth acquisition growth favorable impact foreign exchange partially offset impact disposition expect incur further separation cost ongoing quarter expect benefit second quarter strong booking engineer system fluid segment result gain continue focus execution strategy further spin apergy drive performance share price performanceover past year have outperformed industry respect price performance stock have gain industry record growth same time frame zack rank key picksdover currently carry zack rank hold better rank stock same sector include kawasaki heavy industry ltd idex corporation iex free report roper technology inc rop free report kawasaki sport zack rank strong buy idex corporation roper technology carry zack rank buy see complete list today zack rank stock here kawasaki have long term earning growth rate stock have gain year time idex corporation have long term earning growth rate company share have be past year roper technology have long term earning growth rate share have rally past year look stock skyrocket upside zack have just release special report boom investment opportunity legal marijuana ignited new referendum legislation industry be expect blast already robust early investor stand make kill have be ready act know just look see pot trade re target
157,DOV,corporation dov free report be industrial conglomerate produce wide range specialize industrial product manufacturing equipment company report adjust earning share first quarter beating zack consensus estimate earning also improve year year revenue post revenue come ahead zack consensus estimate revenue revenue also increase year year drive acquisition growth organic growth favorable impact foreign exchange partly offset impact disposition booking booking end first quarter be worth end first quarter backlog also increase end report quarter year quarter end outlook lower adjust earning share guidance full year mid point guidance range reflect increase prior year guidance be base full year revenue growth comprise organic growth acquisition growth favorable impact foreign exchange partially offset impact disposition estimate trend surprise historyinvestor note earning estimate revision first quarter have moved south ahead earning release zack consensus estimate currently stand quarter regard earning surprise have outpaced zack consensus estimate past quarters average beat corporation price ep surprise corporation price ep surprise corporation quotezack rank currently have zack rank hold however latest earning performance be yet be reflect estimate revision rank be subject change see complete list today zack rank strong buy stock here market reaction share be inactive follow release be interesting see market react result trading session today check back later full earning report later look stock skyrocket upside zack have just release special report boom investment opportunity legal marijuana ignited new referendum legislation industry be expect blast already robust early investor stand make kill have be ready act know just look see pot trade re target
158,DOV,corporation dov free report be expect report first quarter result apr last report quarter company post positive earning surprise nearly notably surpass zack consensus estimate last quarters deliver average surprise let see thing be shape prior announcement corporation price ep surprise corporation price ep surprise corporation quotefactor playwe believe strong book trend significant drill activity drive company performance first quarter booking increase roughly year year end fourth quarter backlog also increase end quarter report end year quarter backed solid booking growth company be poise improve first quarter performance further significant drill activity last few quarters have create large backlog drilled uncompleted well expect completion well drive performance zack consensus estimate earning go roughly last day be currently peg first quarter earning estimate reflect year year growth zack consensus estimate total sale quarter also indicate growth prior year quarter come segment zack consensus estimate net sale fluid segment be peg quarter represent year year increase segment benefit sound growth pump hygienic pharma business zack consensus estimate refrigeration food equipment segment net sale be peg quarter be report represent year year decline segment be anticipate grow improve productivity prevalent softness commercial cook equipment market be concern meanwhile company expect energy business improve result volume leverage zack consensus estimate indicate segment revenue reach be report quarter reflect year year growth finally zack consensus estimate indicate engineer system segment revenue reach first quarter represent year year improvement addition sprice performance have be impressive past year share company have appreciate modestly outperform growth record industry earning whispersour proven model do not conclusively show be likely beat earning quarter do not possess key component stock need have positive earning esp zack rank strong buy buy least hold happen be not case here see zack esp currently have earning esp be most accurate estimate be peg lower zack consensus estimate uncover best stock buy sell re report earning esp filter zack rank zack rank increase predictive power esp however need have positive esp be confident earning surprise caution stock zack rank sell rate go earning announcement especially company be see negative estimate revision stock considerhere be company want consider model show have right combination element post earning beat quarter graco inc ggg free report earning esp zack rank stock have appreciate year time see complete list today zack rank stock here idex corporation iex free report earning esp zack rank share have rally roughly past year illinois tool work inc itw free report earning esp zack rank company share have be same time frame breaking news cryptocurrency now bigger total market cap cryptos recently surpass more increase previous month re now bigger morgan stanley goldman sachs even visa new asset class expand even more rapidly new investor continue pour wall street become increasingly involved zack have just name company enable investor take advantage explosive growth cryptocurrency stock market click here access stock
159,DOV,deere company free report look promising moment back upbeat outlook strong order activity focus acquisition additionally share price zack rank buy stock have be rise late see complete list today zack strong buy rank stock here haven take advantage share price appreciation yet be right time add stock portfolio look promising be poise carry momentum ahead stock have estimate long term earning growth rate let delve deeper analyze factor make agricultural equipment maker attractive investment option work favor deere positive estimate revision growth zack consensus estimate deere have be revise nearly upward respectively past day zack consensus estimate current year earning be peg reflect estimate year year growth zack consensus estimate earning be peg represent estimate year year rise positive earning surprise historydeere have outpaced zack consensus estimate trail quarters deliver average positive earning surprise industrydeere have outperformed industry belong year time company share have jump compare growth record industry same time frame attractive valuation go price earning multiple deere be currently trading trail month multiple lower industry average superior return asset roa deere roa compare industry average highlight company efficiency generate earning effectively manage asset upbeat guidancedeere raise total equipment sale growth outlook fiscal year year prior guidance fiscal deere expect net sale be year year project net income company be poise gain improve operational performance due discipline cost management continue investment innovative technology solution growth driver placedeere estimate industry sale agricultural equipment unite state canada be nearly fiscal aid higher demand large equipment company have be record strong order activity combine early order program order book large tractor support encourage outlook further construction investment be predict be fiscal previous forecast drive pick oil gas residential activity strong order book upbeat trend retail sale moreover deere positive outlook fiscal also reflect gain wirtgen acquisition december company acquire wirtgen buyout aid deere north america centric construction business deere state transaction contribute roughly net sale fiscal fiscal second quarter deere also recently enter definitive agreement acquire king agro privately hold manufacturer carbon fiber technology product post acquisition deere customer benefit king agro unique knowledge design expertise carbon fiber technology other stock considersome other similarly rank stock deere sector include aptargroup inc atr free report barne group inc free report corporation dov free report aptargroup have long term earning growth rate share have rally past year barne group have long term earning growth rate company share have be same time frame have long term earning growth rate stock have gain year time look stock skyrocket upside zack have just release special report boom investment opportunity legal marijuana ignited new referendum legislation industry be expect blast already robust early investor stand make kill have be ready act know just look see pot trade re target
160,DOV,have issue update research report kennametal inc kmt free report apr earning be project grow next year machinery company currently carry zack rank buy revision earlier zack rank hold market capitalization be approximately let delve deeper discuss investor consider add kennametal stock portfolio financial performance earning estimate revision kennametal financial performance be impressive last quarters average positive earning surprise last quarter revenue surpass zack consensus estimate increase year year also bottom line surge year year back healthy organic sale favorable mix margin improvement last day stock zack consensus estimate remain stable fiscal end june increase fiscal end june year year basis estimate reflect growth fiscal fiscal kennametal inc price consensus kennametal inc price consensus kennametal inc quotesolid term prospect long term target kennametal anticipate adjust earning be share fiscal record fiscal also current bottom line projection be revision company earlier project amount organic sale growth be predict be higher earlier forecast free cash be project be versus prior projection long term target issue december kennametal anticipate adjust sale be fiscal adjust gross margin be estimate be approximately adjust operate expense be predict be roughly sale adjust earning interest taxe depreciation amortization margin be adjust operate margin be healthy segmental business kennametal operate business segment industrial widia infrastructure globally recognize brand be kennametal widia offer standardized customize product vast customer base especially transportation aerospace general engineering earthwork energy end market be company key area focus fiscal timeframe kennametal anticipate industrial segment sale grow cagr segment gain strengthen end market include general engineering transportation aerospace energy widia segment sale be project grow cagr strong distribution network portfolio highly recognize product brand be advantageous segment especially americas europe middle east africa india asia pacific infrastructure segment sale be project grow cagr healthy operate condition key end market include industrial application mining oil gas process industry construction be beneficial benefit strategic initiative kennametal have undertake measure aim improve profitability cost reduction include strategic sourcing modernization initiative be improve cycle time productivity quality throughput facility rationalization initiative substantially complete first quarter fiscal yielded benefit headcount reduction other restructure program annualize benefit be predict be roughly additionally company be track realize benefit modernization end end initiative other stock considersome other top rank stock zack industrial product sector be dxp enterprise inc dxpe free report corporation dov free report kadant inc kai free report dxp enterprise sport zack rank strong buy kadant carry zack rank see complete list today zack rank stock here last day earning estimate stock improve current year also average positive earning surprise last quarters be dxp enterprise kadant look stock skyrocket upside zack have just release special report boom investment opportunity legal marijuana ignited new referendum legislation industry be expect blast already robust early investor stand make kill have be ready act know just look see pot trade re target
