,ticker,content
209,DOV,believe graco inc ggg free report be solid choice investor seek exposure industrial machinery space development new product expand international operation entrance new market synergistic benefit acquire asset be advantageous company stock have be upgrade zack rank strong buy feb currently have market capitalization approximately graco report better expect earning last quarters pull average positive earning surprise notably company share have rally last year outperform gain industry upgrade graco bottom line result fourth quarter lag zack consensus estimate increase year year basis net sale be back double digit growth process contractor segment single digit growth industrial segment graco anticipate healthy demand environment product drive top line result believe organic revenue constant currency basis grow mid single digit year also result segment be solid americas asia pacific emea region increase mid single digit graco be focuse develop new product expand geographical reach explore new market product worth mention process segment be power pro esp electric sampling pump stainless steel air operated double diaphragm aodd pump aodd chemical pump other important product industrial segment be portable abrasive blast equipment spray automation kitchen paint equipment contractor segment handheld airless sprayer line striper battery power be worth mention also company be spending huge amount improve efficiency plant capacity initiative lower cost aim increase earning share more long run addition graco believe expand business acquisition meaningful business notably company acquire florida base grind equipment surface preparation manufacturer manufacturing december acquire asset help strengthen company maintenance equipment offer pavement last day earning estimate graco have be revise upward brokerage firm zack consensus estimate stand reflect increase respectively tally day graco inc price consensus graco inc price consensus graco inc quoteother stock considerother stock worth consider industry include apply industrial technology inc ait free report corporation dov free report roper technology inc rop free report stock sport zack rank strong buy see complete list today zack rank stock here apply industrial technology pull average positive earning surprise last quarters also earning estimate fiscal fiscal be revise upward last day corporation deliver average positive earning surprise trail quarters also bottom line expectation improve past day roper technology financial performance be impressive average positive earning surprise last quarters also earning estimate be revise upward last day hottest tech mega trend year generate global revenue predict blast roof fame investor mark cuban say produce world first trillionaire still leave plenty money regular investor make right trade early see zack best stock play trend
210,DOV,corporation dov free report report third quarter adjust earning share continue operation surge cent record prior year quarter earning also beat zack consensus estimate report basis post earning share quarter year year report quarter include disposition separation related cost cent year earlier quarter do not have such adjustment total revenue increase year year quarter come ahead zack consensus estimate year year increase be drive acquisition growth organic growth favorable impact foreign exchange partly offset impact disposition corporation price consensus ep surprise corporation price consensus ep surprise corporation quotecost marginscost sale climb year year report quarter gross profit rise year year gross margin remain flat year year selling general administrative expense increase record prior year quarter operate profit jump year quarter operate margin expand basis point bps segmental revenue climb year year quarter segment report operate profit compare record comparable period last year revenue engineer system segment advanced record year earlier quarter segment income inched year year revenue fluid segment be year year report quarter segment income surge year year refrigeration food equipment segment revenue drop record prior year quarter segment report operate income prior year period booking backlogdover booking end third quarter be worth end third quarter backlog also increase end report quarter record year quarter end financial positiondover generate free cash flow quarter compare prior year quarter cash flow operation come report quarter compare witness year quarter continue make stride simplify portfolio plan separation company recently sign agreement sell consumer industrial winch business deal help focus core growth platform sale be expect close fourth quarter subject close condition outlookdover reaffirm earning share guidance range full year company raise revenue guidance project grow range compare previous outlook revenue growth guidance comprise organic growth acquisition growth approximately partially offset impact disposition share price performanceover last year underperform industry respect price performance stock gain industry record growth same time frame zack rankdover currently carry zack rank buy other top rank company same sector be barne group inc free report altra industrial motion corp aimc free report graco inc ggg free report barne group sport zack rank strong buy altra industrial motion graco carry zack rank see complete list today zack rank stock here barne group have long term expect earning growth rate altra industrial motion have long term expect earning growth rate graco have long term expect earning growth rate today stock zack hottest strategiesit hard believe even zack market gain top stock pick screen have return respectively outperformance have not just be recent phenomenon year have be remarkably consistent composite yearly average gain strategy have beaten market more maybe even more remarkable be fact re willing share latest stock cost obligation see free
211,DOV,corporation dov free report be industrial conglomerate produce wide range specialize industrial product manufacturing equipment company mainly deliver innovative equipment component specialty system support service major operate segment energy engineer system fluid refrigeration food equipment be likely benefit acquisition strategy robust hygienic pharma market significant drill activity boom printing identification platform further diligent effort divest business help reduce exposure cyclical market focus higher margin growth space however generally weaker capital spending several industrial end market persistent headwind retail refrigeration business be expect affect result have highlighted key stat just reveal third quarter earning announcement estimate trend surprise historyinvestor note earning estimate revision third quarter have moved south ahead earning release zack consensus estimate have go last day currently stand quarter regard earning surprise have outpaced zack consensus estimate past quarters corporation price ep surprise corporation price ep surprise corporation post earning share third quarter beating zack consensus estimate earning also surge year yaer revenuesdover post revenue come ahead zack consensus estimate revenue revenue also increase year year drive acquisition growth organic growth favorable impact foreign exchange partly offset impact disposition key statsdover booking end third quarter be worth end third quarter backlog also increase end report quarter year quarter end reaffirm earning share guidance range full year company raise revenue guidance expect grow range compare previous outlook range revenue growth guidance comprise organic growth band acquisition growth approximately partially offset impact disposition zack rankcurrently have zack rank buy change follow earning report be just release market reactiondover share be inactive follow release be interesting see market react result trading session today check back later full earning report later today stock zack hottest strategiesit hard believe even zack market gain top stock pick screen have return respectively outperformance have not just be recent phenomenon year have be remarkably consistent composite yearly average gain strategy have beaten market more maybe even more remarkable be fact re willing share latest stock cost obligation see free
212,DOV,machinery company altra industrial motion corporation aimc free report fail keep earning streak alive fourth quarter company gaap earning quarter be cent share roughly zack consensus estimate cent however bottom line increase year tally back improve industrial market strategy leverage benefit new business opportunity gain acquire asset company gaap earning year come share line zack consensus estimate increase year year strengthen end market drive salesin quarter altra industrial motion net sale amount year year synergistic benefit stromag acquisition improve net sale year year pricing add basis point bps favorable foreign currency movement contribute bps also top line exceed zack consensus estimate sale generate distribution turf garden agriculture oil gas metal mining end market improve year year quarter positive be partially offset weakness sale material handle renewable energy conventional power generation market geographical basis sale grow europe north america asia pacific other region company report revenue follow head segment coupling clutch brake electromagnetic clutch brake gear brief snapshot segmental sale have be provide revenue generate electromagnetic clutch brake be year year coupling clutch brake sale be surge year quarter gear revenue inched year year company net sale increase year year result be zack consensus estimate margin profile weak rise costsaltra industrial motion cost sale fourth quarter increase year year represent quarter net sale versus year quarter gross margin slip basis point bps selling general administrative expense increase year year represent net sale gaap operate margin quarter be bps year year balance sheet cash flowexite fourth quarter altra industrial motion have cash cash equivalent roughly slightly record precede quarter long term debt be versus previous quarter end company generate net cash operate activity increase year year capital spending totale versus free cash flow year be year year year company paid dividend amount few day release result altra industrial motion announce board director have approve payment quarterly cash dividend cent share shareholder record mar disbursement dividend be make apr altra industrial motion anticipate benefit improvement majority end market partially offset expect weakness conventional power generation market net sale be anticipate be range gaap earning be project be share tax rate be capital spending be approximately altra industrial motion corp price consensus ep surprise altra industrial motion corp price consensus ep surprise altra industrial motion corp quotezack rank stock market capitalization approximately altra industrial motion currently carry zack rank hold better rank stock industry be apply industrial technology inc ait free report corp dov free report roper technology inc rop free report stock sport zack rank strong buy see complete list today zack rank stock here apply industrial technology have pull average positive earning surprise last quarters also earning estimate fiscal end june fiscal end june have be revise upward last day corp have deliver average positive earning surprise trail quarters also bottom line expectation have improve past day roper technology financial performance have be impressive average positive earning surprise last quarters also earning estimate have be revise upward last day more stock news be bigger iphone become mother technological revolution apple sell mere iphone year new breakthrough be expect generate more device just year create market zack have just release special report spotlight fast emerge phenomenon ticker take advantage don buy now kick click here trade
213,DOV,machinery behemoth middleby corporation midd free report report moderate fourth quarter result earning revenue quarterly adjust earning come share line zack consensus estimate however bottom line come higher year tally share adjust earning come share outpace zack consensus estimate also bottom line come higher year figure share net sale report quarter come year year however top line miss zack consensus estimate upswing be backed favorable foreign currency translation impact acquisition benefit net sale commercial foodservice equipment group be year year however revenue food process equipment residential kitchen equipment group slip respectively net sale full year come year year miss zack consensus estimate whisker middleby corporation price consensus ep surprise middleby corporation price consensus ep surprise middleby corporation quotecost marginscost sale fourth quarter be compare record year quarter gross profit margin quarter come shrink basis point bps year year gross margin dip quarter due reduce margin secure acquire business selling general administrative expense totale incur year period operate margin come contract basis point bps year year gross margin year be record comparable period last year operate margin come record year period balance sheetmiddleby exit fourth quarter cash cash equivalent record end long term debt be compare record dec operate cash flow be versus record middleby repurchase share worth deploy capital acquisition zack rank buy company believe elevated demand chain restaurant customer bolster revenue commercial foodservice equipment group addition sturdy demand recently launch product solution be anticipate drive revenue food process equipment residential kitchen equipment group term other stock considerother top rank stock same space be list apply industrial technology inc ait free report sport zack rank strong buy company earning share ep be project be next year see complete list today zack rank stock here corporation dov free report flaunt zack rank company earning share ep be estimate be next year rbc bearing incorporate roll free report sport zack rank company earning share ep be project grow same time frame wall street next amazonzack evp kevin matra believe familiar stock have only just begin climb become greatest investment time once generation opportunity invest pure genius click detail
214,DOV,third quarter earning season be slowly unfold company index have report quarterly number make index total market capitalization latest earning outlook oct company have put increase earning back higher sale scoreboard deliver positive earning surprise surpass revenue expectation pace growth group company witness so far be almost similar second quarter take account member be yet disclose number total earning index be expect be year year increase revenue third quarter be deceleration increase earning second quarter first growth graph pick fourth quarter onwards projection earning growth be fourth quarter first quarter second third quarter take sneak peek industrial product stock be slate report third quarter result oct corporation dov free report manufacture sell range equipment component specialty system software digital solution support service worldwide report financial number open bell proven model do not conclusively show company be likely beat estimate quarter company have earning esp most accurate estimate be zack consensus estimate be peg higher stock carry zack rank buy combine negative esp make surprise prediction difficult uncover best stock buy sell re report earning esp filter company have surpass zack consensus estimate trail quarters negative average earning surprise history corporation price ep surprise corporation price ep surprise corporation quotestrong booking trend strong backlog second quarter have set company strong third quarter energy segment significant drill activity last few quarters have create large backlog drilled incomplete well well get complete eventually drive third quarter performance zack consensus estimate energy segment revenue growth quarter be report be peg estimate segment report operate earning significantly higher prior year quarter earning further solid outlook engineer system segment generate revenue drive quarter performance segment printing identification platform continue deliver consistent solid performance backed unique position digital textile market focus consumable mark coding moreover industrial platform fuel growth lead strong position vehicle service waste handle zack consensus estimate segment revenue be project rise third quarter segment be forecast report earning compare report previous quarter read more earning gain boost drill activity sonoco product company son free report manufacture sell industrial consumer packaging product north south america europe australia asia report quarterly number open bell company beat estimate precede quarters deliver average positive earning surprise sonoco product company price ep surprise sonoco product company price ep surprise sonoco product company stock have earning esp most accurate estimate be peg cent zack consensus estimate be cent stock negative esp zack rank hold make surprise prediction difficult see complete list today zack rank strong buy stock here third quarter company anticipate earning share range cent guidance take consideration impact acquisition net divestiture higher re-cover paper price third quarter zack consensus estimate earning third quarter be peg cent project year year growth zack consensus estimate revenue be reflect year year growth zack consensus estimate consumer packaging paper industrial converted product protective solution segment witness year year growth respectively be offset dip display packaging segment revenue operate profit consumer packaging paper industrial converted product protective solution segment increase year year respectively however display packaging segment operate profit plunge msa safety incorporate msa free report develop manufacture supply safety product protect person facility infrastructure report quarterly result close bell company surpass zack consensus estimate trail quarters result average positive surprise history msa safety incorporporate price ep surprise msa safety incorporporate price ep surprise msa safety incorporporate stock have earning esp most accurate estimate be peg lower cent zack consensus estimate be cent stock carry zack rank negative esp make surprise prediction difficult company be witness good order flow industrial business currently zack consensus estimate revenue be peg third quarter company be observe solid improvement cost structure drive value creation program also benefit recent acquisition globe manufacturing company strengthen position leader north american market firefighter personal protective equipment ppe zack consensus estimate earning quarter be peg cent reflect year year growth hottest tech mega trend year generate global revenue predict blast roof fame investor mark cuban say produce world first trillionaire still leave plenty money regular investor make right trade early see zack best stock play trend
215,DOV,industrial good manufacturer idex corporation iex free report report strong third quarter result drive healthy year year increase earning revenue gaap earning quarter be share compare cent share year quarter year year improvement be primarily attributable top line growth exclude recur item adjust net income report quarter be share compare cent share year earlier quarter adjust earning exceed zack consensus estimate couple cent idex corporation price consensus ep surprise idex corporation price consensus ep surprise idex corporation sale increase year earlier quarter healthy demand pattern diligent execution operational plan revenue exceed zack consensus estimate idex report organic growth report quarter order be year year segment fluid meter technology fmt record year year increase revenue drive organic growth health science technology hst revenue be year year owing organic growth inorganic growth fire safety diversify product fsd record sale year year lead organic growth marginsgross margin be basis point bps prior year quarter owing productivity volume leverage operate income quarter be compare year quarter respective margin adjust operate income report quarter be compare year earlier quarter respective margin primarily due operational efficiency fair value inventory step charge prior year earning interest taxe depreciation amortization ebitda be compare year quarter adjust ebitda improve prior year quarter fmt segment record operate margin quarter bps year year due higher volume cost saving restructure effort hst segment operate margin come bps prior year quarter be largely attributable higher volume fair value inventory step charge prior year period fsd segment adjust operate margin be bps year quarter owing higher volume fair value inventory step charge prior year period balance sheet cash flowa sep idex have cash cash equivalent long term debt cash flow operate activity be first month compare prior year period free cash flow quarter end totale compare year period bring respective tally first month year company repurchase share quarter guidance raisedwith solid quarterly result robust demand pattern idex raise earlier guidance company currently expect adjust earning share expect earlier company reaffirm organic growth expectation fourth quarter adjust earning be expect range share organic growth idex currently carry zack rank buy other stock industry worth consider include altra industrial motion corp aimc free report corporation dov free report illinois tool work inc itw free report carry zack rank see complete list today zack rank strong buy stock here altra industrial have long term earning growth expectation have positive earning surprise history average trail quarters comprehensively beating estimate corporation have long term earning growth expectation illinois tool have long term earning growth expectation look stock skyrocket upside zack have just release special report boom investment opportunity legal marijuana ignited new referendum legislation industry be expect blast already robust early investor stand make kill have be ready act know just look see pot trade re target
216,DOV,corporation dov free report be slate report third quarter earning result oct market open believe strong booking trend consistent rig count addition higher expect well completion have set company strong third quarter moreover solid outlook engineer system segment drive quarter performance factor playin energy segment significant drill activity last few quarters have create large backlog drilled incomplete well second quarter conference call note many well get complete soon company forecast also assume rig count likely be second half year thus rise well completion activity drive segment performance be report quarter respect third quarter expect revenue be nearly sequentially energy segment engineer system segment printing identification platform continue deliver solid performance backed focus consumable product innovation mark coding well unique position digital textile printing market outlook business be fairly strong third quarter achieve organic revenue booking growth segment second quarter booking increase year year second quarter backlog also improve last report quarter record year quarter end strong booking drive third quarter result corporation price ep surprise corporation price ep surprise corporation quotenotably beat zack consensus estimate earning last quarter further share have gain year date outperform industry growth so investor expect earning announcement used zack consensus estimate well exclusive financial metric file ve find important thing note ahead report earningsbased latest zack consensus estimate expect report earning share third quarter mark growth cent share post year quarter zack consensus estimate energy segment revenue growth quarter be report be peg contrary decline witness prior quarter engineer system segment revenue also expect grow third quarter compare drop year quarter operate earningswe estimate company energy segment report operate earning significantly higher prior year quarter earning further engineer system segment be project report earning compare report previous quarter currently carry zack rank hold stock worth lookhere be few stock industrial product sector worth consider have right combination element post earning beat quarter altra industrial motion corp aimc free report be schedule report quarterly number oct have earning esp carry zack rank buy see complete list today zack rank strong buy stock here corporation aos free report also have zack rank earning esp be company be slate release third quarter result oct caterpillar inc cat free report have earning esp carry zack rank be schedule release earning oct trade profit big league trump policiesif stock spark interest look company prime make substantial gain washington change course today zack reveal ticker benefit new trend streamline drug approval tariff lower taxe higher interest rate spending surge defense infrastructure see buy recommendation now
