,ticker,content
186,DOV,feb issue update research report deere company free report company be poise gain wirtgen acquisition higher housing start improve oil gas sector however company lackluster agriculture business elevated expense be expect dent performance future let illustrate factor detail wirtgen acquisition boost deere construction businessin december deere acquire world lead road construction equipment maker wirtgen cash debt buyout aid deere north america centric construction business expand global scale also catapult position industry leader global road construction transaction be also anticipate add construction forestry segment sale fiscal higher housing start boon deeredeere project global sale construction forestry equipment be massive fiscal drive higher housing start unite state single family housing start be strong region nation further increase wage job growth reinforce outlook grow housing start latest report census bureau housing start january come higher december tally be year year january new home construction grow highest level october be expect momentum housing market continue year stabilize oil price fuel growthdeere estimate construction investment be fiscal higher previous forecast increase be primarily be lead oil gas residential activity oil price be estimate average barrel fiscal addition machinery rental utilization rate continue improve rental pricing continue gain positive traction agriculture business concern deeredeere agriculture business be affected fiscal expectation high global grain oil seed stock use ratio be abundant crop have offset strong demand world further farm cash receipt be estimate be approximately lower fiscal gain oil crop be offset decline feed crop adverse impact tax reformdeere earning be hurt impact tax reform fiscal company record equipment operation tax rate first quarter fiscal primarily due impact tax reform remainder fiscal effective tax rate be project range imply effective tax rate approximately fiscal escalate expense impede deere profitin addition deere be affected elevated expense current fiscal guidance cost sale percent net sale be fiscal company believe unfavorable product mix elevated overhead spending increase incentive compensation drive cost sale guidance deere also forecast sa expense flare nearly fiscal expense dampen earning share price have outperformed industry respect price performance year time stock have appreciate industry have record growth same time frame zack rank stock considerdeere currently carry zack rank hold better rank stock same sector be corporation dov free report grainger inc gww free report equipment service inc hee free report stock sport zack rank strong buy see complete list today zack rank stock here have long term earning growth rate share have rally past month grainger have long term earning growth rate company share have be same time frame equipment service have long term earning growth rate stock have gain month time hacker put money portfolio earlier month credit bureau equifax announce massive datum breach affect american cybersecurity industry be expand quickly response similar event stock be better investment other zack have just release cybersecurity investor guide help zack com reader make most year investment opportunity create hacker other threat reveal stock worth look right away download new report now
187,DOV,barne group inc free report report better expect bottom line result fourth quarter pull positive earning surprise adjust earning quarter come cent share beating zack consensus estimate cent also bottom line increase roughly year tally cent adjust result exclude charge roughly cent related restructure action related tax reform company adjust earning be share increase year year organic growth forex gain drive revenuesin quarter barne net sale grow year year improvement be drive gain organic sale growth benefit acquire asset positive impact foreign currency movement also top line surpass zack consensus estimate roughly barne group report revenue segment discuss revenue industrial segment be increase year year result improve back organic sale growth gain acquire asset positive impact foreign currency translation business be strong nitrogen gas product engineer component molding solution unit revenue aerospace segment totale rise year year improvement come back growth sale derive original equipment manufacturing growth sale result maintenance repair overhaul activity well sale spare part business backlog quarter end be increase growth year quarter company net sale be year year margin fall higher cost expensesin quarter barne cost sale jump year year represent net sale compare year quarter selling administrative expense roughly net sale increase year year adjust operate income decrease year year margin slip basis point balance sheet cash flowexite fourth quarter barne have cash cash equivalent previous quarter end long term debt balance increase sequentially company generate net cash operate activity decrease year year capital spending totale year year free cash flow year be adjust conversion ratio year company paid dividend totale repurchase share worth barne anticipate gain solid product portfolio focus innovate new product provide better service strengthen end market initiative direct enhance operational efficiency earning share be anticipate be range reflect year year growth total revenue grow range include organic revenue growth forex gain roughly operate margin be effective tax rate be capital expenditure be predict be barne group inc price consensus ep surprise barne group inc price consensus ep surprise barne group inc quotezack rank stock market capitalization approximately barne carry zack rank hold better rank stock industry be apply industrial technology inc ait free report corporation dov free report roper technology inc rop free report stock sport zack rank strong buy see complete list today zack rank stock here apply industrial technology have pull average positive earning surprise last quarters also earning estimate fiscal end june fiscal end june have be revise upward last day corporation have deliver average positive earning surprise trail quarters also bottom line expectation have improve past day roper technology financial performance be impressive average positive earning surprise last quarters also earning estimate have be revise upward last day breaking news cryptocurrency now bigger total market cap cryptos recently surpass more increase previous month re now bigger morgan stanley goldman sachs even visa new asset class expand even more rapidly new investor continue pour wall street become increasingly involved zack have just name company enable investor take advantage explosive growth cryptocurrency stock market click here access stock
188,DOV,issue update research report illinois tool work inc itw free report mar vast customer base various end market gain business process sound capital allocation strategy be key driver company flip side risk related international operation high debt industry competition remain concern industrial tool maker market capitalization approximately currently carry zack rank hold briefly discuss company potential growth driver possible headwind factor favore illinois tool worksshare price performance earning estimate revision illinois tool work financial performance remain better expect last quarters average positive earning surprise last report quarter company earning share exceed zack consensus estimate last month company share yielded return outperform gain industry last day brokerage firm raise company earning estimate increase however estimate year be lower brokerage firm currently stock zack consensus estimate be peg represent growth respective tally day long term growth potential solid illinois tool work operate business segment test measurement electronic automotive oem polymer fluid food equipment welding construction product specialty product largely minimize risk loss poor performance group also vast customer base various end market include automotive original equipment manufacturer automotive aftermarket general industrial commercial food equipment construction other be beneficial moreover business process help achieve higher operate margin better capital efficiency solid return invest capital first quarter company anticipate gaap earning be share organic revenue be expect grow quarter full year gaap earning guidance have be increase share reflect cent growth mid point increase reflect positive impact tax rate cut forex gain long term company anticipate organic revenue growth be operate margin be excess incremental margin be earning share grow year also tax return invest capital be project be free cash flow likely be more net income capital allocation strategy illinois tool work follow sound capital allocation strategy make meaningful acquisition business expansion invest enhancement organic growth reward shareholder handsomely time acquisition have help development company core segment create new platform expand long term growth opportunity get acquire july engineer fastener component business have strengthen company automotive oem business company remain commit return value shareholder raise quarterly dividend rate august intend increase dividend payout rate free cash august earlier company expect dividend rate increment however increment be still subject company board approval factor work illinois tool worksthreat international expansion global expansion have expose illinois tool work risk rise adverse movement foreign currency also uncertainty economic growth country serve severely impact business product be sell country notably source nearly revenue international operation huge debt raise concern illinois tool work long term debt be approximately exit fourth quarter believe unchecked huge debt level increase financial obligation hence prove detrimental profitability industry competition illinois tool work face stiff competition company offer similar product service produce different item same used also difficulty delay research development production service apart failure new product technology market hurt competitive edge key player industry sporting zack rank strong buy be apply industrial technology inc ait free report corporation dov free report roper technology inc rop free report see complete list today zack rank stock here last day earning estimate stock improve current year next year also average positive earning surprise last quarters be apply industrial roper more stock news be bigger iphone become mother technological revolution apple sell mere iphone year new breakthrough be expect generate more device just year create market zack have just release special report spotlight fast emerge phenomenon ticker take advantage don buy now kick click here trade
189,DOV,parker hannifin corporation ph free report recently unveil low lead brass body llb series solenoid valf beverage dispense industry latest llb series solenoid valf be suitable various potential used dispense system cold hot superheat water shut boiler water load control steam control steam mix steam pressure control notably valf feature stainless steel pilot be design improve valve life endurance well resistance limescale accumulation valve body be compose cw brass contain less lead design maintain high system reliability minimize equipment failure risk apart avoid potential downtime metal structure also allow high temperature variation heat transfer high durability require beverage dispense system takeparker hannifin have benefit tremendously global restructure initiative undertake past few quarters apart company be streamline business corporate function well remove complex bureaucracy organizational structure create leaner frame furthermore have devise complimentary business realignment action combine simplification initiative be likely strengthen manufacturing footprint go forward moreover company eye strategic acquisition alliance have bolster core business instance clarcor buyout have strengthen company filtration product suite consequently drive revenue growth also other acquisition include arnold jger hold gmbh operate unit president engineering group limit helac corporation prove be major catalyst company growth move ahead past month zack rank buy stock yielded return outperform industry growth apart company recently complete year implementation strategy remain bullish deliver fundamental financial goal strategy have start deliver immediate result unlock further opportunity drive ongoing ep growth next several year believe improvise strategy aid parker hannifin stay firmly growth track other stock considersome other stock worth consider same space include cimpress cmpr free report corporation dov free report circor international inc cir free report cimpress sport zack rank strong buy circor international carry zack rank buy see complete list today zack rank stock here cimpress have surpass estimate thrice trail quarters average positive earning surprise have outpaced estimate precede quarters average earning surprise circor international have surpass estimate twice trail quarters average positive earning surprise hottest tech mega trend last year generate global revenue predict blast roof fame investor mark cuban say produce world first trillionaire still leave plenty money regular investor make right trade early see zack best stock play trend
190,DOV,issue update research report corporation dov free report feb benefit effort simplify portfolio cost save action drill activity opportunity fast grow digital textile printing market upbeat fiscal guidance fourth quarter earning revenue surge respectively year year basis also beat respective zack consensus estimate strong performance be drive strong global market cost productivity improvement booking end fourth quarter be worth end fourth quarter backlog also increase end quarter year quarter end company be thus poise improve first quarter performance further significant drill activity last few quarters have create large backlog drilled incomplete well anticipate many well be complete come quarters consequently drive performance guide earning share full year be range reflect rise prior year full year revenue growth be project range comprise organic growth favorable impact foreign exchange partially offset impact disposition go forward anticipate effective tax rate be point lower prior effective rate due enactment tax cut job act leaner portfolio drive growth continue effort simplify portfolio have decide spin business stand alone publicly trade company expect transaction close subject certain customary condition business include artificial lift energy automation synthetic operate oil gas drill production industry spin help focus less volatile core platform have earlier sell consumer industrial winch business performance motorsport international step aid company streamline business investing market lead platform have strong market position margin profile be less volatile bright prospect be also review cost structure right size company boost margin company plan achieve cost saving strategic acquisition bode well have long tradition make successful acquisition diverse end market fiscal company acquire business separate transaction total consideration business be acquire complement expand exist operation engineer system energy segment recently acquire ettlinger affiliated entity bid boost presence plastic polymer process equipment industry deal ettlinger become part maag business unit fluid segment ettlinger high performance filtration system fortify maag position plastic process equipment industry segment poise long term growth benefit opportunity fast grow digital textile printing market current rate company anticipate penetration rate digital technology surge next decade company comprehensive solution include equipment ink software position well fully capitalize technology shift retail fuel emv upgrade cycle unite state accelerate customer begin prepare compliance payment regulation go effect further offer expansion remote monitoring software service provide ample scope future expansion refrigeration food retailer effort manage operate cost differentiate market be now investing close door refrigeration case energy efficient system specialize display case benefit demand have lead position category industrial pump business gain drive increase use plastic globally customer need improve efficiency company command lead position pelletizer other polymer process equipment due high output faster changeover more compact design catalyst margin improvement initiative drive growth next few year upward estimate revision notably past day estimate fiscal fiscal have witness upward revision respectively follow upbeat fourth quarter fiscal result zack consensus estimate fiscal be peg depict year year growth same fiscal be reflect year year growth carry long term estimate earning growth rate company have surpass zack consensus estimate trail quarters lead average positive earning surprise history give positive outperformed industry respect share price performance past year stock have gain industry record growth carry zack rank strong buy see complete list today zack rank stock here other stock same sector include caterpillar inc cat free report graco inc ggg free report apply industrial technology inc ait free report stock carry same rank caterpillar have expect long term earning growth rate share have appreciate last year graco have expect long term earning growth rate company share have surge past year apply industrial technology have expect long term earning growth rate share have go past year today stock zack hottest strategy hard believe even zack market gain top stock pick screen have return respectively outperformance have not just be recent phenomenon year have be remarkably consistent composite yearly average gain strategy have beaten market more maybe even more remarkable be fact re willing share latest stock cost obligation see free
191,DOV,corporation dov free report report fourth quarter adjust earning share continue operation surge cent record prior year quarter earning also beat zack consensus estimate report basis post earning share quarter impressive year year report quarter include cent net benefit tax cut job act cent net benefit disposition cent benefit product recall reserve fourth quarter ep also include right sizing other cost cent separation related cost cent year earlier quarter include cent net benefit disposition product reversal charge cent total revenue increase year year quarter surpass zack consensus estimate year year increase be drive acquisition growth organic growth favorable impact foreign exchange partly offset impact disposition corporation price consensus ep surprise corporation price consensus ep surprise corporation quotecost marginscost sale climb year year report quarter gross profit rise year year gross margin expand basis point bps year year selling general administrative expense flare record prior year quarter operate profit jump report year quarter operate margin expand bps segmental revenue climb year year quarter segment report operate profit compare record comparable period last year revenue engineer system segment advanced record year earlier quarter segment income surge massive year year revenue fluid segment be year year quarter segment income soar whopping year year refrigeration food equipment segment revenue inched record prior year quarter segment report operate income significantly record prior year period booking backlogdover booking end fourth quarter be worth end fourth quarter backlog also increase end quarter year quarter end report adjust earning share share record prior year earning outpaced zack consensus estimate include time item bottom line come improve record revenue grow year year record revenue come line zack consensus estimate financial positiondover generate free cash flow fourth quarter compare prior year quarter cash flow operation come report quarter compare year quarter separation updatein december announce tax free spin upstream energy business energy segment expect complete spin subject certain customary condition year end dec post revenue earning interest taxe depreciation amortization ebitda be exclude cost related rightsize separation full year be expect generate revenue growth approximately ebitda approximately outlookdover guide earning share full year be range represent increase prior year full year revenue growth be project range comprise organic growth favorable impact fx partially offset impact disposition expect result gain continuous focus execution strategy company expect ample organic growth margin expansion excess bps further part discipline capital allocation plan expect deploy capital acquisition aid growth share price performanceover last year underperform industry respect price performance stock have gain industry record growth same time frame zack rank key picksdover currently carry zack rank hold better rank stock same sector include apply industrial technology inc ait free report enpro industry inc npo free report illinois tool work inc itw free report apply industrial technology sport zack rank strong buy enpro industry illinois tool work carry zack rank buy see complete list today zack rank stock here apply industrial technology have long term earning growth rate share have appreciate past month enpro industry have long term earning growth rate company share have rally same time frame illinois tool work have long term earning growth rate stock have gain month time don even think buy bitcoin read most popular cryptocurrency sky-rocket last year give investor chance bank return even more gain however come serious volatility risk bitcoin sank more time zack have just release new special report help reader capitalize explosive profit potential bitcoin other cryptocurrency significantly less volatility buy directly see crypto related stock now
