,ticker,content
173,EFX,proofpoint inc pfpt free report be slate release first quarter result apr company have witness remarkable streak beating earning estimate fact trail quarters proofpoint surpass zack consensus estimate come average positive earning surprise zack model unveil proven model do not conclusively show proofpoint be likely beat earning estimate quarter be stock need have positive earning esp zack rank strong buy buy least hold happen uncover best stock buy sell re report earning esp filter see complete list today zack rank stock here be note stock zack rank sell rate be best avoid especially company be see negative estimate revision proofpoint carry zack rank sell have earning esp make surprise prediction difficult furthermore note zack consensus estimate first quarter earning have be revise downward past day however company be likely continue report top bottom line growth year year basis analyst poll zack project revenue roughly year quarter nonetheless earning growth rate be likely slow be report quarter current zack consensus estimate quarter review be peg cent represent year year growth notably fourth quarter proofpoint have register gaap earning growth believe increase migration microsoft msft free report office healthy cybersecurity market drive company top line result escalate expense dent profitability proofpoint inc price ep surprise proofpoint inc price ep surprise proofpoint inc quoteescalate cost impede record remarkable top line growth past quarters drive healthy product demand continue focus product launch acquisition however company escalate operate expense continue impact bottom line result be note proofpoint have invest heavily enhance sale marketing capability particularly expand company sale force survive highly competitive cyber security market notably company sale marketing expense have record more fold jump also operate expense escalate more fold have impact proofpoint bottom line performance expect soar operate expense partly mitigate benefit stellar revenue growth soon be report quarter increase migration office drive revenuesa more enterprise be migrate cloud demand better cyber security measure be rise last few quarters proofpoint have be witness solid demand cyber security suite enterprise be transition cloud particularly microsoft office company customer be look additional security capability complement enhance baseline solution provide microsoft last year number enterprise migrate office buy company security suit also include significant number fortune enterprise anticipate momentum have continue first quarter well favourable impact likely reflect protection advanced threat segment top line performance zack consensus estimate revenue segment be peg reflect year year jump healthy cybersecurity marketwe believe proofpoint continue benefit increase demand cyber security solution thank slew cyber attack hit globe last year be note world witness back back ransomware attack wannacrypt wannacry petya june follow massive datum breach equifax efx free report be report september last year have increase demand security related product enterprise government latest research report gartner free report worldwide cybersecurity spending be likely witness year year growth year reach believe upswing overall cyber security market bode well proofpoint bring new customer thereby boost top line performance make fortune shift electric car here stock idea consider much petroleum year lithium power soon shake world create millionaire reshape geo politic soon electric vehicle evs be cheaper gas guzzler be already reach mile single charge battery price plummet charge station set multiply company stand stock buy accord zack research not think see ticker free
174,EFX,month have go last earning report equifax inc efx free report share have add time frame recent positive trend continue lead next earning release be efx due pullback dive investor analyst have react late let take quick look most recent earning report order get better handle important catalyst equifax earning revenue beat estimate equifax report fourth quarter result revenue gaap earning share come ahead respective zack consensus estimate be second quarterly result post datum breach incident notably september equifax announce very sensitive personal datum approximately consumer have be steal database fourth quarter company record cost related datum breach notably third quarter have incur owing same incur huge cybersecurity expense company manage record year year increase gaap earning share courtesy latest tax cut job act benefit lower effective tax rate company record time tax benefit due recent tax enactment gaap basis equifax report earning share post year quarter however gaap basis exclude time item include cost related datum breach benefit lower effective tax rate company gaap earning come share cent lower earning report fourth quarter here be note fall have be much more security exchange commission sec rule report financial result gaap basis give scope somewhat mitigate debacle equifax gaap earning come ahead zack consensus estimate let discuss quarterly result detail revenuesequifax revenue surpass zack consensus estimate mark year year improvement however be note be second slowest growth rate last several quarters register third quarter lackluster top line performance be mainly due dismal performance information solution usis division suffer year year decline revenue highlight impact datum breach scandal division suffer revenue decline mortgage solution service sub segment sale online information solution remain flat year year financial marketing service witness increase revenue decline global consumer solution turn dent overall sale growth revenue division plunge year year however company other segment continue perform well revenue international division include europe asia pacific canada latin america advanced year year constant currency basis revenue increase company register growth international region revenue increase asia pacific latin america canada europe respectively revenue workforce solution segment climb year year primarily back sale growth verification service partially offset decline employer service operate resultsequifax adjust ebitda remain flat year year however adjust ebitda margin contract basis point bps adjust net income come share compare share report year balance sheet cash flowequifax exit report quarter cash cash equivalent previous quarter balance total long term debt exclude current portion be end previous quarter year end dec equifax generate cash flow operational activity company paid dividend also equifax board director yesterday approve quarterly cash dividend cent be payable mar shareholder record date mar notably company have history pay quarterly dividend more year company anticipate datum breach incident continue impact overall result have greater impact first half year equifax project revenue range mid point represent year year growth range adjust ebitda margin be project decline significantly year company expect ongoing cost associate free service include lock alert service well expense related security have cent share negative impact earning also higher insurance expense cost company cent share adjust ep be project come share effective tax rate year remain first quarter equifax anticipate revenue come represent year year growth expense related security well legal professional fee be approximately adjust ep be project come share have estimate be move then past month investor have witness downward trend fresh estimate have be revision higher current quarter compare lower equifax inc price consensus equifax inc price consensus equifax inc quotevgm scoresat time efx have nice growth score be lag lot momentum front stock be also allocate grade value side putt bottom investment strategy overall stock have aggregate vgm score aren focuse strategy score be be interested company stock be suitable solely growth base style score outlookestimate have be trend downward stock magnitude revision indicate downward shift interestingly efx have zack rank hold expect line return stock next few month
175,EFX,prudent investment decision involve buy stock have solid prospect selling carry risk time be rational hold certain stock have enough potential be weigh tough market condition here discuss proofpoint inc pfpt free report stock expect long term earning share growth rate growth score last year proofpoint have outperformed zack computer software service industry stock have return approximately say period outperform industry gain believe stock have potential exceed expectation next year well reason optimism include healthy cyber security market benefit increase migration microsoft msft free report office well acquisition let discuss healthy cybersecurity marketwe believe proofpoint continue benefit increase demand cyber security solution give recent rise cyber attack include massive ransomware attack wannacrypt wannacry petya june major datum breach equifax efx free report report september most recently expedia expe free report report datum breach hacker steal customer information payment card used consumer platform well partner platform orbitz be used book engine have spur demand security related product enterprise government world latest research report gartner worldwide cybersecurity spending be likely reach mark growth level report market market suggest cyber security market be expect witness cagr period believe demand cyber security solution bode well proofpoint bring new customer thereby boost top line performance increase migration office more more enterprise be migrate cloud demand better cyber security measure have be rise last few quarters proofpoint have be witness strong demand cyber security suite enterprise transition cloud particularly office company customer be look additional security capability complement enhance baseline solution provide microsoft number enterprise migrate office buy company security suit include significant number fortune enterprise expect bullish momentum continue well thereby boost proofpoint protection advanced threat segment top line performance acquisition drive have make strategic acquisition expedite growth february company sign definitive agreement buy wombat security technology inc company make important buyout cloudmark specialize provide security protection messaging service weblife io leader browser isolation solution company acquire business firelayer email fraud protection efp business unit return path aforementioned buyout have not only expand proofpoint product portfolio also customer revenue base believe company continue strategy grow acquisition help support revenue bottom linethe aforementioned factor have positively impact proofpoint financial performance notably stock have outperformed zack consensus estimate trail quarters average positive surprise believe upbeat performance continue quarters ahead give investor reason remain optimistic stock currently proofpoint have zack rank hold see complete list today zack rank strong buy stock here medical stock buy nowzack name company poise ride medical breakthrough be target cure leukemia aids muscular dystrophy hemophilia other condition new product field be already generate substantial revenue even more wondrous treatment be pipeline early investor realize exceptional profit click here see stock
176,EFX,share equifax inc efx free report continue hit new lows mount scrutiny pressure lawmaker investigate agency regulator credit report company response datum breach stock tumble again yesterday due series event occur entire day recent addition trouble equifax group senator yesterday vow investigation federal trade commission ftc security exchange commission sec department justice argue be possibly higher chance potential insider trading equifax executive have sell share day company discover datum breach meanwhile state massachusett announce yesterday be plan file lawsuit company behalf resident state go ahead plan then be surprise other state follow suit furthermore house panel be probe datum breach announce testify equifax chief executive richard oct share equifax plunge nearly yesterday aforementioned news surface be note stock have lose value last thursday close price year date period equifax have lose significantly underperform industry belong have record growth bother investor sep equifax announce highly sensitive personal datum approximately consumer have be steal database reportedly nearly third adult population have be impact due cyber attack company datum breach occur mid july year be discover jul apart sensitive personal information hacker have steal credit card number consumer certain dispute document personal identify information nearly consumer recent cyber attack have heavily tarnish brand image reputation credibility equifax company be face huge customer criticism cybersecurity company be question preparedness response massive datum breach moreover lawmaker investigate agency probe mishap trouble equifax be unlikely end time soon investor seem concern entire issue result loss customer company also have make huge compensation client be fear have adverse impact company financial performance term bottom be not first instance consumer datum have be steal company datum base last december yahoo inc report massive datum breach private information user be compromise other big company target corporation tgt free report anthem inc antm free report sony corporation sne free report have also be victim cyber attack fraudster steal large number consumer datum however sensitivity information expose equifax datum breach case make worst recent time latest datum breach company likely have last impact criminal use steal resource open new account apply credit card loan buy insurance rent apartment even tax fraud be note bank financial institution rely unite state main consumer credit report agency equifax transunion tru free report experian therefore access social security driver license credit card number criminal make such fraud due consumer have suffer longer period time hence believe investor concern be justified mishap have last impact equifax result form financial cost relate settlement lawsuit litigation expense moreover be very tough company repair brand image well retain current customer base currently equifax carry zack rank hold see complete list today zack rank strong buy stock here trade profit big league trump policiesif stock spark interest look company prime make substantial gain washington change course today zack reveal ticker benefit new trend streamline drug approval tariff lower taxe higher interest rate spending surge defense infrastructure see buy recommendation now
177,EFX,investor have mixed reaction equifax inc efx free report latest quarterly result depict yesterday late hour trade follow company fourth quarter result stock rise approximately finally close hour trading less share price movement apparently reflect uncertainty cautiousness investor pertain last year datum breach incident however credit bureau company revenue gaap earning share come ahead respective zack consensus estimate september equifax announce very sensitive personal datum approximately consumer have be steal database thus analyst investor wait bated breath credit information provider fourth quarter result update datum breach implication finance company be expect quarter company record cost related datum breach notably third quarter have incur owing same incur huge cybersecurity expense company manage record year year increase gaap earning share courtesy latest tax cut job act benefit lower effective tax rate company record time tax benefit due recent tax enactment gaap basis equifax report earning share post year quarter however gaap basis exclude time item include cost related datum breach benefit lower effective tax rate company gaap earning come share cent lower earning report fourth quarter here be note fall have be much more security exchange commission sec rule report financial result gaap basis give scope somewhat mitigate debacle equifax gaap earning come ahead zack consensus estimate diverse opinion investor follow company fourth quarter result have lead volatility yesterday late hour trade furthermore investor focus be company fourth quarter earning conference call be schedule be hold today market open better understand growth prospect notably stock be downtrend report datum breach incident sep have lose value then industry belong have gain let discuss quarterly result detail revenuesequifax revenue surpass zack consensus estimate mark year year improvement however be note be second slowest growth rate last several quarters register third quarter lackluster top line performance be mainly due dismal performance information solution usis division suffer year year decline revenue highlight impact datum breach scandal division suffer revenue decline mortgage solution service sub segment sale online information solution remain flat year year financial marketing service witness increase revenue decline global consumer solution turn dent overall sale growth revenue division plunge year year however company other segment continue perform well revenue international division include europe asia pacific canada latin america advanced year year constant currency basis revenue increase company register growth international region revenue increase asia pacific latin america canada europe respectively revenue workforce solution segment climb year year primarily back sale growth verification service partially offset decline employer service operate resultsequifax adjust ebitda remain flat year year however adjust ebitda margin contract basis point bps adjust net income come share compare share report year equifax inc price consensus ep surprise equifax inc price consensus ep surprise equifax inc quote balance sheet cash flowequifax exit report quarter cash cash equivalent previous quarter balance total long term debt exclude current portion be end previous quarter year end dec equifax generate cash flow operational activity company paid dividend also equifax board director yesterday approve quarterly cash dividend cent be payable mar shareholder record date mar notably company have history pay quarterly dividend more year takewe believe due ongoing uncertainty company have not provide outlook forthcoming quarter therefore have company today conference call have clearer picture future prospect escalate expense related cyber attack remain drag company profitability expect company incur more expense form legal professional service associate datum breach incident further expense flare due increase investment security solution well insurance service brand image creditability equifax have be question be face huge customer criticism cybersecurity company be question preparedness response massive datum breach moreover lawmaker investigate agency probe mishap trouble be unlikely end time soon believe entire issue result loss customer company also have make huge compensation client be fear have adverse impact company financial performance term currently equifax carry zack rank hold better rank stock same space be envestnet inc env free report global payment inc gpn free report total system service inc tss free report carry zack rank buy see complete list today zack rank strong buy stock here envestnet global payment total system service have long term expect growth rate respectively don even think buy bitcoin read most popular cryptocurrency sky-rocket last year give investor chance bank return even more gain however come serious volatility risk bitcoin sank more time zack have just release new special report help reader capitalize explosive profit potential bitcoin other cryptocurrency significantly less volatility buy directly see crypto related stock now
178,EFX,equifax inc efx free report be expect report fourth quarter result week question linger investor mind be credit information provide company be able post positive earning surprise be report quarter last quarter company post positive earning surprise notably equifax outperformed zack consensus estimate trail quarters average positive earning surprise let see thing be shape announcement factor considerwe believe last year datum breach continue hurt equifax fourth quarter financial result notably september company announce very sensitive personal datum approximately consumer have be steal database then brand image creditability equifax have be question have be face huge customer criticism cybersecurity company be question company preparedness response massive datum breach moreover lawmaker investigate agency probe mishap trouble be unlikely end time soon believe entire issue result loss customer company also have make huge compensation client have adverse impact company financial performance term be note third quarter company have witness slowest revenue growth rate last several year be mainly due dismal performance information solution usis division register year year decline revenue reflect massive impact due datum breach scandal furthermore escalate expense related cyber attack remain drag company profitability filing company expect incur more expense form legal professional service associate datum breach incident furthermore have state expense flare due increase investment security solution well insurance service equifax inc price ep surprise equifax inc price ep surprise equifax inc quotewhat zack model unveil proven model do not conclusively show equifax be likely beat earning estimate quarter be stock need have positive earning esp zack rank strong buy buy least hold happen uncover best stock buy sell re report earning esp filter equifax carry zack rank increase predictive power esp however company have earning esp combination equifax zack rank negative earning esp make surprise prediction difficult zack consensus estimate quarter review be peg represent year year decline note zack consensus estimate have remain unchanged past day additionally analyst poll zack project revenue roughly approximately year quarter stock favorable combinationhere be company want consider model show have right combination element post earning beat apply material inc amat free report have earning esp zack rank see complete list today zack rank stock here sina corporation sina free report have earning esp zack rank hubspot inc hub free report have earning esp zack rank wall street next amazonzack evp kevin matra believe familiar stock have only just begin climb become greatest investment time once generation opportunity invest pure genius click detail
179,EFX,proofpoint inc pfpt free report be slate release fourth quarter result feb question linger investor mind be cybersecurity firm be able post positive earning surprise be report quarter notably company have surpass zack consensus estimate trail quarters average positive surprise so let see thing be shape prior announcement expect current zack consensus estimate quarter review be peg cent represent year year growth note zack consensus estimate remain unchanged past day additionally analyst poll zack project revenue roughly year quarter let take look drive factor quarter increase migration office drive security demanda more more enterprise be migrate cloud demand better cyber security measure be rise last few quarters proofpoint have be witness solid demand cyber security suite enterprise be transition cloud particularly microsoft msft free report office company customer be look additional security capability complement enhance baseline solution provide microsoft third quarter number enterprise migrate office buy company security suit also include significant number fortune enterprise expect momentum continue be report quarter well thereby boost protection advanced threat segment top line performance zack consensus estimate revenue segment be peg signify year year increase proofpoint inc price ep surprise proofpoint inc price ep surprise proofpoint inc quotehealthy cybersecurity marketwe believe proofpoint continue benefit increase demand cyber security solution thank number cyber attack hit globe last year be note world witness back back ransomware attack wannacrypt wannacry petya june follow massive datum breach equifax efx free report be report september last year have increase demand security related product enterprise government latest research report gartner free report worldwide cybersecurity spending be likely witness year year growth year reach believe upswing overall cyber security market bode well proofpoint bring new customer thereby boost top line performance high renewal company maintain high renewal rate more signify have better product portfolio stickier customer high renewal rate indicate more predictable revenue lesser selling cost rise cost dent have record remarkable top line growth past quarters back healthy product demand continue focus launch product acquisition however company escalate operate expense remain overhang bottom line result be note proofpoint have invest heavily enhance sale marketing capability particularly expand company sale force survive highly competitive cyber security market notably company expense escalate approximately fold have affected proofpoint bottom line performance expect increase operate expense partly mitigate benefit higher revenue growth be report quarter currently proofpoint carry zack rank hold see complete list today zack rank strong buy stock here breaking news cryptocurrency now bigger total market cap cryptos recently surpass more increase previous month re now bigger morgan stanley goldman sachs even visa new asset class expand even more rapidly new investor continue pour wall street become increasingly involved zack have just name company enable investor take advantage explosive growth cryptocurrency stock market click here access stock
