,ticker,content
155,EFX,investor reaction equifax inc efx free report latest quarterly result be mixed evident yesterday late hour trade follow company third quarter result stock fall approximately then re-cover go nearly finally close hour trading be less analyst investor be wait credit information provider third quarter result have better picture impact datum breach incident company financial performance notably september equifax announce very sensitive personal datum approximately consumer have be steal database company record cost related datum breach be main reason decline third quarter gaap earning company report gaap earning cent post year quarter equifax state be still not sure much bottom line result have be impact mentioned datum breach filing security exchange commission sec company report class action lawsuit have be file equifax be currently face probe number investigate agency regulator however sec rule report financial result gaap basis give scope overshadow debacle gaap basis exclude time item include cost related datum breach company manage report year year earning growth equifax gaap earning share come higher year quarter moreover quarterly earning surpass zack consensus estimate be upper end management guidance rage midpoint be quite possible investor have different opinion company bottom line result have result such volatility yesterday late hour trade furthermore be possible investor be wait third quarter earning conference call be schedule be hold today market open better view growth prospect notably stock be downtrend report datum breach incident sep have lose value then industry belong have gain let discuss quarterly result detail revenuesequifax top line performance be also not impressive revenue miss zack consensus estimate well management guide range figure be year year basis be slowest growth rate last several quarters lackluster top line performance be mainly due dismal performance information solution usis division register year year decline revenue reflect complete sign impact datum breach scandal division witness revenue decline sub segment revenue online information solution mortgage solution service financial marketing service drop respectively however company other segment continue perform well revenue international division include europe asia pacific canada latin america advanced year year constant currency basis revenue increase growth be mainly drive veda group acquisition increase asia pacific region contribution revenue year year moreover revenue register growth latin america canada europe respectively revenue workforce solution segment climb year year primarily back revenue growth verification service revenue employer service remain flat year year global consumer solution contribute total revenue figure be flat year year basis operate resultsequifax adjust ebitda increase approximately adjust operate ebitda margin expand basis point bps adjust net income come share compare share report year equifax inc price consensus ep surprise equifax inc price consensus ep surprise equifax inc quotebalance sheet cash flowequifax exit report quarter cash cash equivalent previous quarter balance total long term debt exclude current portion be flat quarter quarter month period end sep equifax generate cash flow operational activity first quarters company paid dividend also equifax board director approve quarterly cash dividend cent be payable dec shareholder record date nov notably company have history pay quarterly dividend more year takewe believe due ongoing uncertainty company have not provide outlook forthcoming quarter therefore have company conference call today have clearer picture future prospect escalate expense related cyber attack remain drag company profitability also filing company expect incur more expense form legal professional service associate datum breach incident furthermore state expense flare due increase investment security solution well insurance service brand image creditability equifax have be question be face huge customer criticism cybersecurity company be question preparedness response massive datum breach moreover lawmaker investigate agency probe mishap trouble be unlikely end time soon believe entire issue result loss customer company also have make huge compensation client have adverse impact company financial performance term currently equifax carry zack rank strong sell better rank stock same space include envestnet inc env free report global payment inc gpn free report total system service inc tss free report carry zack rank buy see complete list today zack rank strong buy stock here envestnet global payment total system service have long term expect growth rate respectively more stock news be bigger iphone become mother technological revolution apple sell mere iphone year new breakthrough be expect generate more device just year create market zack have just release special report spotlight fast emerge phenomenon ticker take advantage don buy now kick click here trade
156,EFX,symantec corporation symc free report be slate release second quarter fiscal result nov current zack consensus estimate quarter review be peg cent represent year year growth note zack consensus estimate remain unchanged past day additionally analyst poll zack project revenue roughly year quarter level rise demand cybersecurity related product due recent global hacking event acquisition be likely drive symantec fiscal second quarter overall result however divestment company high margin certify authority business undermine profitability symantec corporation price ep surprise symantec corporation price ep surprise symantec corporation quoteto benefit rise company stand gain datum breach chance security related purchase shoot demand cybersecurity related product have get fresh momentum back back ransomware attack wannacry wannacrypt petya june create global havoc apart datum breach equifax inc efx free report be discover september be likely have positive impact cybersecurity related product demand particularly identity protection security provider symantec have be enhance identity theft protection capability acquisition lifelock surely have cash opportunity acquisition drive have take acquisition route redeem struggle business last few quarters company acquire business blue coat lifelock skycure fireglass acquisition have help symantec broaden product portfolio enhance company capability area such identity mobile web protection be currently huge concern almost sector be financial retail technology buyout have help reduce dependency pc market strengthen position enterprise security market be note company be face severe competition palo alto network fireeye enterprise segment market additionally acquisition have broaden symantec customer base therefore anticipate strategy drive company be report quarters revenue earning security divestment hurt first quarter fiscal result symantec announce privately own digicert inc have agree buy security business cash approximately stake latter business symantec security solution verify identity website believe latest move be symantec effort end ongoing dispute alphabet googl free report google have accuse mis issue web certification however be note company certify authority business be very high margin business therefore be increasingly cautious loss high margin associate business drag symantec profitability future zack model unveil proven model do not conclusively show symantec be likely beat earning estimate quarter be stock need have positive earning esp zack rank strong buy buy least hold happen uncover best stock buy sell re report earning esp filter symantec have earning esp carry zack rank sell notably caution stock zack rank sell rate go earning announcement especially company be see negative estimate revision stock favorable combinationa model nvidia corp nvda free report have right combination element post earning beat quarter stock have earning esp zack rank see complete list today zack rank stock here zack best private investment ideaswhile be happy share many article best recommendation most depth research be not available public start today next month follow zack private buy sell real time expert cover kind trade value momentum stock etf option move stock corporate insider be buy company be report positive earning surprise even look exclusive portfolio be normally close new investor click here zack private trade
157,EFX,fiserv inc fisv free report be set report third quarter result oct last quarter earning share miss zack consensus estimate however improve year quarter notably company have beaten zack consensus estimate trail quarters deliver average positive surprise total revenue increase approximately year year miss zack consensus estimate notably share fiserv have gain year date significantly underperform industry rally let see thing be shape announcement key factorsfiserv hold dominant position financial payment solution business backed broad customer base key contract win believe product oriented acquisition drive growth company reportedly third quarter fiserv complete acquisition monitise pclender dovetail group moreover fiserv focus expand product portfolio be also positive believe company launch product prologue credit loss manager instant issue advantage integrator advance september quarter have lead steady flow customer further fiserv digital banking solution be gain momentum financial institution company announce august statement advantage solution have be select bank credit union however note lower termination fee emv deferral adverse foreign currency translation be negatively impact company sale moreover increase regulation banking financial service industry intensify competition like equifax inc efx free report fidelity national information service inc fis free report remain concern give attractive prospect financial service market be always new entrant seek leverage shift technology product innovation attract customer fiserv policy acquire large number company result integration risk company highly leverage balance sheet continue weigh profitability fiserv inc price ep surprise fiserv inc price ep surprise fiserv inc quotewhat model saysaccording zack model company zack rank strong buy buy hold have good chance beating estimate also have positive earning esp sell rate stock zack rank be best avoid uncover best stock buy sell re report earning esp filter fiserv have earning esp zack rank sell therefore proven model do not conclusively show company be likely deliver positive surprise quarter key stock considerhere be company also want consider model show have right combination element post earning beat upcoming release kemet corporation kem free report earning esp zack rank see complete list today zack rank stock here look stock skyrocket upside zack have just release special report boom investment opportunity legal marijuana ignited new referendum legislation industry be expect blast already robust early investor stand make kill have be ready act know just look see pot trade re target
158,EFX,market post loss thursday follow decline financial share bank tank such loss be buoy decline share jpmorgan citigroup further share also decline weigh broader market meanwhile initial jobless claim plummet hit week low business resume texas florida area pummeled destructive hurricane dow jone industrial average djia close decline index inx decrease close meanwhile nasdaq composite index ixic close decrease total share be trade thursday lower last session average share advance issue outnumber decliner nyse ratio nasdaq decliner outnumber advancer ratio cboe vix increase close benchmark post loss bank share lose point thursday end negative territory major sector end red financial consumer discretionary share lead laggard financial select sector spdr etf xlf consumer discretionary select sector spdr etf xly decline respectively financial sector tank follow nosedive bank share share jpmorgan jpm free report citigroup free report decline respectively weigh heavily broader market company possess zack rank hold see complete list today zack rank strong buy stock here jpmorgan report third quarter earning thursday comfortably beating expectation however stock decline company fix income trading revenue dip come third quarter year meanwhile citigroup also report third quarter earning surpass market expectation however stock decline company operate expense decline cost credit increase due global consumer banking well high credit reserve build such loss weigh heavily financial sector moreover weigh market be decline share free report lose such loss follow announcement company lose approximately video subscriber unite state third quarter wake big hurricane also stiff competition market weigh heavily telecom sector dow decline almost point finish red nasdaq end point lower end negative territory new economic weekly initial jobless claim plummet last week decline marked lowest level many week consensus estimate period be claim economist comment only few american apply unemployment benefit period business resume texas florida more person resume work post recent carnage destructive hurricane moreover initial claim puerto rico be also lower not person go back work due absence electricity island be ravage hurricane marium consequently person not file claim island claim be processed result analyst expect such claim show come week meanwhile core ppi month september increase august consensus estimate period be however ppi september increase line consensus estimate period stock make headlineshp inc share jump positive fiscal world largest pc manufacturer hp inc hpq free report provide fiscal outlook recent security analyst meeting read more equifax tank report claim cyber attackshare equifax inc efx free report fall yesterday ars technica report credit information provider have be subject cyber attack read more nu skin raise sale profit viewnu skin enterprise inc nus free report recently update outlook third quarter follow share spiked read more enterprise product hike quarterly cash product partner epd free report board director have announce year year increase quarterly cash distribution read more stock watch massive equifax stock spiked recent news datum breach affect american stock be best buy candidate right now do future hold cybersecurity industry equifax be just most recent victim computer hacking identity theft be more common ever zack have just release cybersecurity investor guide inform zack com reader year space more importantly highlight cybersecurity pick strong profit potential get new investing guide now
159,EFX,share equifax inc efx free report fall yesterday ars technica report credit information provider have be subject cyber attack ars technica randy abram independent security analyst discover company web site be prompt install adobe adbe free report flash update have be find contain malware follow discuss report company share be see tumble mid day thursday however later day stock re-cover almost half loss equifax announce be not subject cyber attack system have not be compromise equifax spokesman wyatt jeffery say company be aware situation identify equifax com web site credit report assistance link further add security team be look matter abundance caution have temporarily take page offline company statement note issue involve third party vendor equifax used collect performance datum vendor code run equifax be serve malicious content equifax further state vendor code have be remove webpage be conduct further analysis matter notably brand image creditability equifax have already be question ever company announce last month very sensitive personal datum approximately consumer have be steal database then equifax have be face huge customer criticism cybersecurity company be question preparedness response massive datum breach moreover lawmaker investigate agency probe mishap trouble be unlikely end time soon share equifax have lose approximately value sep close price year date period company have lose significantly underperform industry belong have record growth investor seem concern entire issue result loss customer company also have make huge compensation client be fear have adverse impact company financial performance term sensitivity information expose equifax datum breach case make worst case recent time latest datum breach company likely have last impact criminal use steal resource open new account apply credit card loan buy insurance rent apartment even tax fraud be note bank financial institution rely unite state main consumer credit report agency equifax transunion tru free report experian therefore access social security driver license credit card number criminal make such fraud due consumer have suffer longer period time hence believe investor concern be justified mishap have last impact equifax result form financial cost relate settlement lawsuit litigation expense moreover be very tough company repair brand image well retain current customer base currently equifax carry zack rank strong sell better rank stock same industry be fidelity national information service inc fis free report carry zack rank buy see complete list today zack rank strong buy stock here stock have long term expect ep growth rate stock watch massive equifax stock spiked recent news datum breach affect american stock be best buy candidate right now do future hold cybersecurity industry equifax be just most recent victim computer hacking identity theft be more common ever zack have just release cybersecurity investor guide inform zack com reader year space more importantly highlight cybersecurity pick strong profit potential get new investing guide now
160,EFX,akamai technology inc akam free report be strengthen security product portfolio company recently announce plan acquire nominum lead provider dns enterprise security solution carrier akamai intend integrate nominum carrier grade cybersecurity solution enterprise security offering threat intelligence help company expand presence carrier enterprise customer nominum be well know dns security product vantio cacheserver big datum connector vantio authserve product face competition cisco system inc csco free report opendns software service saas offer infoblox akamai believe integrate security product portfolio be more effective identify block mitigate malware ransomware phish well datum exfiltration threat however nominum acquisition be dilutive akamai fourth quarter earning almost nickel acquisition be anticipate negatively impact fiscal earning cent company still expect maintain ebitda margin range mid include nominum moreover management expect buyout be accretive fiscal notably akamai share have lose value year date versus increase industry security key catalyst akamaisecurity be area hold lot promise akamai view cyber attack equifax inc efx free report ccleaner back back ransomware attack wannacry wannacrypt petya june create global chaos recently believe urgency stricter security measure compel enterprise well government increase spending cybersecurity software accord market market july report worldwide cybersecurity spending reach year solid spending trend bode well akamai believe expand security portfolio help akamai gain significant share security market long haul notably company cloud security business report revenue increase year quarter last quarter company launch product enterprise threat protector bot manager premier akamai expect revenue security business exceed next year drive strong adoption kona site defender prolexic bot manager web application protector product offering moreover expansion security product portfolio lower akamai dependence medium delivery solution further rapid growth security be expect offset loss large customer content delivery network cdn space zack rank key pickcurrently akamai have zack rank hold inc athm free report sporting zack rank strong buy be stock worth consider same sector see complete list today zack rank stock here long term earning growth be currently peg wall street next amazonzack evp kevin matra believe familiar stock have only just begin climb become greatest investment time once generation opportunity invest pure genius click detail
161,EFX,fresh nobel prize economic university chicago professor richard thaler have admit be puzzled worry current market exuberance seem be live riskiest moment life yet stock market seem be nap thaler say doesn understand anyone pay attention global risk today surely have make investment adjustment now yet stock index remain time high thaler prove human being be predictably irrational help shed light sound investment strategy go awry economic agent be human economic model have incorporate thaler be quote say award winning work so be thaler be so worry now interview bloomberg thaler explain be puxzzled not only record high main index extremely low volatility well outside force have not be able correct potential headwind roadblock massive datum breach equifax efx free report saber rattle president trump north korea kim jong regard nuclear annihilation nothing have be able move needle deeply negative long failure major policy shift congress include repeal replace obamacare well sound immigration reform have add perceive wall worry top ve see extraordinary amount natural disaster western hemisphere just past day hurricane caribbean gulf mexico earthquake outside mexico city now devastate wildfire northern california be cost life livelihood require extraordinary capital outlay make region whole again finally loom shadow investigation russia involvement trump administration affect last november general election have yet be bring light so do thaler see biggest risk stock market be avoid currently be most likely set correction play current lofty level surely market record high be base certitude be massive tax cut give seeming inability republican congress get act together meaning thaler think healthcare immigration reform previously year congress again be unable bring forth meaningful change tax reform result windfall corporate tax cut year next year ever chance be reality set manifest new downward trend president trump give address evening regard tax reform proposal include many american stand receive result new tax policy deficit hawk right not see much benefit putt additional back book just score term cash windfall be even discuss anyone left side congressional aisle have interest provide fiscal benefit multus dollar corporation
162,EFX,share equifax inc efx free report dip company bring light fact have suffer security breach earlier yearautozone inc azo free report share plummet post fourth quarter domestic same store sale growth come expect growth rate share post holding inc post free report surge enter agreement bob evan farm inc purchase company sharesteelcase inc scs free report share surge post second quarter earning share surpass zack consensus estimate
163,EFX,investor equifax inc efx free report need pay close attention stock base move option market lately be sep put have highest imply volatility equity option today be imply volatility imply volatility show much movement market be expect future option high level imply volatility suggest investor underlie stock be expect big move direction other also mean be event come soon cause big rally huge sell however imply volatility be only piece puzzle putt together option trading strategy do analyst think clearly option trader be pricing big move equifax share be fundamental picture company currently equifax be zack rank hold financial transaction service industry rank top zack industry rank zack consensus estimate current quarter have decline share last day give way analyst feel equifax right now huge imply volatility mean trade develop often time option trader look option high level imply volatility sell premium be strategy many seasoned trader use capture decay expiration hope trader be underlie stock do not move much originally expect look trade option week very own dave bartosiak give top option trade check recent live analysis option trade nflx earning report completely free see here bartosiak trading netflix nflx earning option check embed video more detail
164,EFX,share genworth financial gnw free report surge virginia insurance official approve bid sell insurance company base virginia china oceanwide holdingsmacy inc free report share surge company announce plan hire seasonal worker holiday seasonshare equifax inc efx free report decline democratic senator introduce bill prevent credit rating agency charge customer freeze credit file accessoracle corp orcl free report share decline post first quarter revenue lower previous quarter revenue
