,ticker,content
30,EFX,wednesday equifax efx earn positive adjustment relative strength rs rating ibd proprietary rs rating track technical performance show stock price action last week compare other stock database history show top perform stock tend have rs rating early stage move see equifax continue show renew price strength clear threshold equifax be not proper buy point right now see manage form break proper base company report ep growth last quarter sale gain come equifax earn rank peer financial service specialty industry group cboe cboe transunion tru msci msci be top highly rate stock group related ibd stock rating upgrade rise relative strengthwhy use ibd relative strength rating relative strength line help judge stock
31,EFX,stock index pause midday wednesday post gain previous session run include new high nasdaq inched small cap russell rise dow jone industrial average be nearly flat volume decline nyse rise nasdaq compare same time previous session retail oil group dominate day list leader laggard price performance past month oil gas explorer continental resource clr pop modestly higher volume go wednesday session energy explorer group be industry group continental be high marked early december retail discount chain rise strength be broad group target tgt add costco cost smart final sfs pricesmart psmt wal mart store wmt discount chain be industry group ranking big bank money center head group fourth daily gain row gain be concentrated few stock citigroup pop close potential buy point morgan stanley ms add struggle retake hold day line bank america bac rise heavy volume retook day line continue work new base money center be middle pack month price performance blue chip gainer lead loser dow jone industrial average ratio wal mart lead upside apple aapl lead downside loss ibd proxy top rate stock medical manage care provider centene cnc gap gain heavy volume centene announce buy privately hold fideli care give centene presence new york market downside ibd credit information provider transunion tru drop heavy volume cut day line company say panic equifax efx datum breach be also hurt transunion related blue chip be buy range stock new high share trait
32,EFX,stock post weak open thursday asia stock market slump investor factor fresh inflation datum next week fed policy vote dow jone industrial average open fraction red slide nasdaq composite drop economic news rise headline thursday begin asian stock market put early negative spin global trade tokyo nikkei dip snap day rally china market shift lower country industrial output slow forecast second straight month august lead trade china name be firm early pressure alibaba group holding baba jd com jd sina sina new oriental education edu open more europe market trade lower bank england vote hold rate policy unchanged consumer price rise august labor department estimate be well july uptick slightly consensus view increase core price gas food gain gain july line expectation datum be last read investor receive price inflation pressure lack ahead key policy shift expect be announce follow next week meeting federal open market committee labor department also report first time unemployment claim dip week end prior week claim far estimate increase application week move average claim jump apple aapl drop open microsoft msft dive bottom dow apiece apple have now be trading tight nearly week first clear buy point make buy point meaningless rebound strong trade stock week move average breakdown line break resistance move new high be more likely signal stock be next set be move chevron cvx top dow stock oil name chesapeake energy chk eqt eqt grab early lead hospital owner tenet healthcare thc jump start trade tenet surge late wednesday wall street journal article say company have hire banker consider possible sale stock end wednesday mid august low high set july lgi home lgih add take early lead ibd stock stock be fight maintain week support sixth week possible base pattern credit scorekeeper transunion tru gain trade ibd name be look rebound suffering collateral damage take fall wednesday datum breach peer equifax efx datum base compromise personal information report consumer wednesday tumble transunion share remain year date hertz global holding htz drop downgrade underweight morgan stanley be overdue breather run have left rental car leader late june low stock be still july high key level technical support show strong sign institutional interest related top stock buy zone tech giant due investing action big picture record close high dow nasdaq ibd investor research tool get start ibdfollow market stock market todayunderstand market big picture
33,EFX,stock market didn move much wednesday wasn bad performance mean dow jone industrial average nasdaq composite marked record close high second straight session dow russell lead way rise nasdaq inched volume
34,EFX,stock index haven gain much solid day late august bear also haven find much traction scenario play again friday nasdaq drop semiconductor telecom internet industry group lag edge blue chip dow jone industrial average inched
35,EFX,stock index be mixed midday friday oil stock give back part gain earlier week blue chip dow jone industrial average climb nasdaq retreat stay flat small cap russell add volume stock market today be run previous session pace oil stock be lower weekly gain issue batter bank insurance industry group post gain more insurer dow jone industrial average component traveler trv rise fall much earlier week blue chip be evenly split advance issue decline issue money center bank morgan stanley ms rise try rise test day move average morgan stanley have highest ep rating group ep rating mean stock have grow earning faster stock ibd database look morgan stanley rate vs peer see stock checkup investor com superregional bank bb bbt pop heavy volume work cup handle base month potential buy point be go friday session laggard superregional group be industry group early march group be hope bank be dash trump administration congress couldn unite repeal dodd frank regulation decline interest rate signale street doesn expect federal reserve raise interest rate fed meet later month day best performer be security software company symantec symc gap much trimming gain symantec have look flaw double bottom base flaw be second low didn undercut first low aggressive investor regard alternative entry involve more risk double bottom base be proper security software firm be get lift massive datum breach equifax efx security group other stock rise include qualys qlys proofpoint pfpt palo alto network panw related apple iphone production problem delay launch
36,EFX,computer security stock be rise friday credit score service equifax efx announce major cybersecurity breach late thursday expose consumer xsymantec symc close proofpoint pfpt briefly surge buy territory give back gain finished higher fireeye feye rise stock market today view fireeye proofpoint most positively expose breach related spend say pritchard citigroup analyst report also symantec lifelock business sell identity protection service credit bureau breach be beneficiary equifax compete symantec market id patrol offer equifax ability compete be impact news fireeye provide web email malware security software business government agency sunnyvale calif base proofpoint specialize email datum loss protection corporate network cloud compute infrastructure mountain view calif base symantec acquire february close purchase lifelock provider consumer identity theft protection service lifelock deal be aim bolster norton security unit analyst expect symantec make more acquisition proofpoint host investor day thursday new york management up revenue guidance range earlier forecast proofpoint have marketing partnership palo alto network panw also comment current threat landscape andrew nowinski piper jaffray analyst say report proofpoint be see significant increase phish url rather malware url phish be often first stage larger attack bode well proofpoint phish attack be carry email add nowinski ibd take want understand state market pay attention major average lead stock read ibd stock market today column market day end day big picture take free trial timely market analysis highlighted growth stock breaking proper basis share equifax meanwhile plunge equifax say breach occur mid july equifax say find evidence unauthorized use core consumer commercial credit report databasis datum hacker access name social security number birth date address instance driver license number credit card number consumer certain dispute document personal identify information approximately consumer be also expose related be early investing hot spot artificial intelligence fireeye helix platform ignite stock say analystpalo alto network soar earning analyst raise price targetsha cisco system get groove back cybersecurity
37,EFX,stock open narrow loss friday approach hurricane irma pending holiday north korea keep investor cautious mood dow jone industrial average nasdaq composite slip start bell week dow be tack decline nasdaq composite be respectively index be line first decline week ibd take read ibd big picture column day stay top market direction key indicator let know be aggressive move sideline national hurricane center place hurricane irma mile east florida coast claw bahamas estimate foot storm surge wind subside only slightly mph range make category hurricane florida highway reportedly remain packed evacuee storm isn expect make landfall sunday investor also keep eye turn north korea reportedly celebrate founder day holiday saturday celebrate year creation democratic person republic korea south korea report sign preparation possible missile launch country have past launch missile perform nuclear test important holiday accord washington post home depot hd climb lead dow jone industrial stock home depot be nearly week climb buy point flat base apple aapl slip fang stock netflix nflx alphabet googl post tight early gain apple be still trap buy range buy point netflix be rise day line buy point flat base skate surfwear retailer zumiez zumz catch early gain report forecast second quarter earning third quarter guidance late thursday receive upgrade buy neutral riley friday morning gain start share right side deep month consolidation ibd stock control ctrl swung take new high boost upgrade outperform market perform cowen co ibd leaderboard stock palo alto network panw jump more open stock receive big boost investor number analyst upgrade follow aug fiscal fourth quarter report launch buy point flat base share have pull back just entry retook mark remain buy range friday gain downside ibd stock transunion tru slump haul lower consumer credit score keeper equifax efx carved loss announce late thursday network have be hack personal information consumer steal credit card datum person breach occur mid july company say have hire cyber security firm investigate equifax loss drive share deep stock week move average heavy trade more prior buy point trigger double sell signal economic news commerce department report wholesale inventory estimate july et baker hughe bhge deliver weekly rig count report federal reserve july consumer credit number be due et speech philadelphia federal reserve bank president patrick harker be schedule et overseas action related dow titan be buy bullish basestrump debt deal democrat sink tax cut hope goldman sachsstock buy watch top ipos big small cap growth stocksibd investor research tool get start ibd
38,EFX,equifax efx have relative strength rs rating upgrade friday welcome improvement still short higher score prefer see exclusive rating investor business daily identify share price movement worst best score score show stock price performance trail week hold other stock database year market history reveal stock go make biggest gain tend have higher rs rating early stage move see equifax continue rebound clear threshold now be not ideal time invest see stock manage establish enter buy range heavy volume equifax post earning growth last quarter sale growth come equifax earn rank peer financial service specialty industry group cboe cboe transunion tru envestnet env be top highly rate stock group related stock be show improve price performance use ibd relative strength rating relative strength line help judge stock
39,EFX,equifax efx see welcome improvement relative strength rs rating monday rise exclusive rating investor business daily identify market leadership worst best score score show stock price movement last week compare other stock database year market history show best perform stock often have rs rating north early stage move see equifax continue show renew price strength hit benchmark now be not ideal time invest see stock be able establish enter buy range heavy trade equifax show earning growth latest quarterly report revenue rise company hold rank peer financial service specialty industry group transunion tru be top rank stock group related ibd stock rating upgrade rise relative strengthwhy use ibd relative strength rating relative strength line help judge stock
40,EFX,stock market extend winning streak month july advanced drive high such lead stock dow jone industrial stock microsoft msft visa well tech leader priceline pcln diversify stock mutual fund tack average look ahead investor have begin take defensive step margin portfolio wonder long run dodge such peril increasingly high valuation geopolitic tension political infighting xin july broad stock market notch best monthly gain february jump back then market be drive investor optimism trump era usher new policy lower regulatory burden several industry corporate tax reform infrastructure spending july negative headline failure health care reform white house staff intrigue market rise last month encourage corporate earning drive appreciation be corporate earning be surprising upside say lawrence kemp co manager blackrock mid cap growth equity fund bmgkx be top perform midcap stock mutual fund year date month end be close first quarter low interest rate global economic acceleration have be key factor kemp say large cap growth fund blackrock capital appreciation mafgx kemp be sole manager be last month lead july charge diversify stock mutual fund count blackrock capital recent top holding microsoft rise visa july global science technology fund gain lead major sector world equity stock mutual fund gain top diversify stock fund latin american fund soar pace foreign stock fund taxable tax exempt bond mutual fund average edge ahead aram green manager tiny clearbridge select lbfix top perform midcap growth fund year date say economic datum consumer confidence be rosy enough continue propel investor expectation rest year still caution lack investor fear be surprising give social political unrest action north korea skirmish middle east rough dialogue russia well continue turnover trump white house lack further movement health care bill anything else promise trump constituent be surprised make sell now year end green add not forecast be surprised anticipation have make defensive shift portfolio have take profit raise cash average so also have raise cash selling call position little term upside addition be shorting stock prospect think be weak hold outlook do be software developer new relic newr core business be monitoring application understand problem develop say firm be also expand monitoring client information technology infrastructure more business be conduct internet especially cloud new relic be success say sale have mushroomed past fiscal year company have yet post annual profit reflect july leadership large cap growth stock general tech name tom galvin lead manager columbia select large cap growth ccwrx say amazon amzn illustrate outlook seek stock be lead player industry be gain wallet share amazon be add amazon report result july earning share be only cent decline miss wall street consensus expectation share stock pull back be testing support day move average ibd take keep news large cap internet consumer name follow ibd fang facebook amazon netflix google stock news page galvin say priceline pcln also illustrate view re beneficiary increase online usage mobile penetration particular be drive demand commerce solution demographic be drive demand airline hotel automobile rental say expect growth mid teen be better next few year expand geographically already diverse product set stock rise july breaking flat base process visa be third example expectation visa have opportunity long durable growth runway due conversion cash check pay credit card virtual payment consumer business globally say still galvin appetite tech stock be limit past month have be trimming give strong year date gain say month fund be overweight tech vs russell growth index now fund tech weight be weight vs bogey have reallocate money consumer sector say consumer space demographic have be significant force spending trend have create tail wind leisure stock health care education entertainment add kemp large cap blackrock fund cite alphabet googl example outlook have dominant global search engine say used everyone continue improve technology underlay use different type cellular network fuel unit growth kemp add minute average daily time spend site user be hide asset company keep find new way monetize advertising midcap fund kemp like san francisco base first republic bank frc re very well run say re uniquely position grow basically year open new office country penetrate exist market more also cite equifax efx consumer credit additional datum be used mortgage lender other client datum find increase number used advertiser seek aim more highly target pitch consumer say vanguard primecap core vpccx large cap growth fund ibd best mutual fund award winner edge last month china commerce giant alibaba group baba be key driver stock sport comp rating be member ibd leaderboard ibd premium service spotlight play play top stock well ibd list investor conference alibaba say expect revenue grow fiscal year well analyst consensus estimate related need much retirement saving age income step millennial want become rich retiree
41,EFX,dow jone industrial average notch fresh record high early wednesday uptrend pressure cause sell technology stock homebuilder be top perform industry stock market today pulte home phm look follow earlier breakout share jump more wednesday
42,EFX,nasdaq hesitation rally tech stock consolidate heavy loss number high quality name be reach new high friday transunion tru flex muscle early recent test week line credit monitoring company reversed lower fall close sit buy point tuesday fellow credit
43,EFX,transunion tru see ibd smartselect composite rating rise wednesday day new score indicate company be now outperform stock term most important fundamental technical stock pick criterium winning stock often have higher score early stage new price run transunion be not currently proper buy point look stock form break new chart pattern weak spot be company ep rating track quarterly annual earning growth look improve better show top stock accumulation distribution rating show moderate buy institutional investor last week company post ep growth sale growth fall previous quarter transunion hold rank peer financial service specialty industry group equifax efx exchange ice be also group highest rate stock related company be now outperform stock
44,EFX,strong fundamental drive institutional money specific sector stock market so do something new such new development affect entire industry today such new element satisfy ibd point slim investment paradigm be certain fact interest rate be higher year include likely
45,EFX,strong market google parent alphabet googl be look very attractive search giant stock be close potential buy point consolidate record high current shaky market investor be cautious make purchase always be look quality stock form sound consolidation bullish pattern be flat base lead stock catch breath several week try make new advance flat basis be common now give market subdue sideway action last week so alphabet lead top rate stock be flat basis other be nvidia nvda texas instrument txn equifax efx have find support day move average recently ibd take flat base be sideway pattern smaller decline other pattern be short duration minimum week often form cup handle double bottom base here quick explainer identify proper flat base alphabet be fairly typical example flat base stock break double bottom base entry late july share peaked aug then begin consolidate sideway share never fall more high find support last week just day move average close friday flat base entry point be alphabet share rise early close stock market today fundamental adjust earning rise vs year earlier pick total revenue growth have trend higher increase best year core revenue exclude traffic acquisition cost pay partner website carry ad climb related google rebound big ep revenue beatnvidia make chip gaming autonomous drive artificial intelligence stock have long run peak share moved sideway find support day line rebound last week week nvidia now have flat base pattern buy point nvidia close friday nvidia rise climb high stock close just pivot point volume end average tough time be make new buy casefundamental earning sky-rocket latest quarter sale rise fifth straight quarter accelerate growth related ibd top stock rebound key support linesnvidium unveil artificial intelligence tech baidu self drive carstexas instrument be chipmaker serve industry such mobile device automotive industry ti peaked aug gapping higher day report strong quarter result move tightly several week share fall day line share rise last week regain key support level close buy point be texas instrument stock rise fundamental earning rise third straight quarter faster growth sale rise first increase quarters related big cap tight action stock chart be bullish tech stock chip still driver seat continue tesla autopilot update supplier be radar equifax provide information risk service consumer business offer report risk score analytic equifax have big run early february late july share peaked july share have moved sideway then be find support day line past month close friday just support level stock have buy point equifax reversed trade extra note caution equifax be fourth stage base late stage basis be more likely fail fundamental earning rise best quarterly gain year sale climb most several year be second straight quarter accelerate growth top bottom line related new america top rate datum analytic firm be see explode growth
46,EFX,stock gallop ahead wednesday federal reserve decide stand pat interest rate nasdaq pop advanced dow jone utility average lead pack gain ibd rushed higher volume be higher board fed say statement case
47,EFX,load player here tuesday investing action plan need know investor day ahead adobe system adbe report earning tuesday stock try regain buy point also tap earning kb home kbh lennar len fedex fdx netflix nflx cbs cbs present goldman sachs communacopia
48,EFX,stock index rise thursday shrug bank england decision keep interest rate same nasdaq add respectively blue chip dow jone industrial average climb ibd trail pop volume edge nyse nasdaq straight quality
49,EFX,domestic international stock etfs spiked thursday hotly debate brexit referendum get way vote outcome be expect shortly be still consider too close call financial stock outpaced sector ahead release first batch result federal reserve annual stress test exam assess bank ability withstand shock market finance spdr regional banking kre spdr bank kbe jab higher post best day more month financial select sector spdr xlf hold broadly diversify basket financial stock add banking sector have be hard hit uncertainty fed next rate move worry briton decision leave european union brexit have come be know many investor fear vote leave member bloc cause financial chaos region financial service be poorest perform sector year date june re also worst performer month date bank get dose good news market close come look good capital shape fed annual test dow jone industrial average visa add thursday elite ibd list financial company global payment gpn equifax efx lifelock lock transunion tru score gain european stock exchange trade fund be buoy report opinion poll take brexit vote favore remain eu bloc ishare msci unite kingdom ewu punch ishare msci eurozone ezu ishare msci europe financial eufn jab higher highest level june european bank trading push higher include deutsche bank db credit suisse cs barclay bcs royal bank scotland rb lloyds banking group lyg gold wo continue meanwhile precious metal stand gain leave vote brexit referendum boost safe haven demand spdr gold share gld nick loss gld be trading week low be june high here look major exchange trade fund tracking various asset class perform today relative price strength rs rating spdr spy rs powershare qqq qqq rs spdr dow jone industrial average dium rs ishare core mid cap ijh rs ishare russell iwm rs ishare msci eafe efa rs vanguard ftse emerge market vwo rs spdr gold share gld rs unite state oil uso rs ishare core aggregate bond agg rs powershare db bullish uup rs ipath vix short term future vxx rs
