,ticker,content
166,ESS,recently announce quarterly update residential reit avalonbay community inc avb free report note expect total rental revenue establish community climb prior year period midpoint latest outlook denote basis point expansion company have previously project second quarter provide establish community total rental revenue growth outlook january company report increase rental revenue establish community first quarter establish community refer consolidated community have stabilize occupancy jan be neither execute plan significant redevelopment work be not hold sale plan disposition current year moreover company mentioned have begin construction new community estimate total capital cost second quarter other hand company sell wholly own operate community approximately other wholly own community be contract advanced marketing stage project price notably peak lease session avalonbay be expect benefit high quality asset premium location favorable demographic household formation recover economy job market growth however new apartment delivery be anticipate remain elevated company market modestly descend specifically metro new york new jersey mid atlantic region be likely remain turbulent rise supply residential unit upcoming quarters fact mid atlantic region supply be expect continue new york new jersey market supply attain peak level year decline additionally supply continue be most noticeable urban sub market high supply number company market be likely put pressure rental rate hence growth avalonbay stabilize portfolio be expect remain modest future furthermore be high concession activity higher supply remain concern nonetheless elevated supply have not only affected avalonbay other residential reit well include equity residential eqr free report essex property trust inc ess free report curb term growth momentum extent seem be respite dreary environment time soon aggressive delivery anticipate continue early next year too fact accord report real estate technology analytic firm realpage inc rp free report last half nation largest metro annual pace completion climb unit level further early schedule new supply keep add flow same annual pace avalonbay currently have zack rank hold see complete list today zack rank strong buy stock here company share have appreciate past month compare industry growth hottest tech mega trend year generate global revenue predict blast roof fame investor mark cuban say produce world first trillionaire still leave plenty money regular investor make right trade early see zack best stock play trend
167,ESS,apartment investment management company aiv free report better know report first quarter pro fund operation ffo cent share line zack consensus estimate figure indicate increase year quarter tally cent result display growth property net operate income noi support same store property lease redevelopment acquisition community however positive be partially offset lower noi apartment sale report quarter total revenue comfortably outpaced zack consensus estimate addition report figure come marginally higher prior year quarter tally quarter detailsame store revenue utility reimbursement increase year year expense net utility reimbursement increase prior year quarter consequently same store noi climb year year basis same store average daily occupancy expand basis point bps year year rental rate new lease be rental rate renewal lease be expire lease rate mar have cash restrict cash hand moreover estimate fair market value company unencumbered apartment community be further end quarter review outstanding borrowing revolve credit facility be available capacity be consider letter credit backed facility portfolio activitydure report quarter invest redevelopment development addition be revamp portfolio property sale reinvest proceed select apartment home higher rent superior margin higher expect growth effort company increase revenue apartment home additionally enhance quality expect growth rate portfolio specifically percentage home be respectively first quarter compare record year quarter full year company update pro ffo share guidance provide earlier zack consensus estimate same be second quarter provide pro ffo share guidance cent zack consensus estimate same be cent company project same store noi growth be range revenue growth range dividendon announce quarterly cash dividend cent share class common stock first quarter mark year year increase dividend be paid stockholder record bottom lineaimco effort reposition portfolio shedding strategic property investing proceed opportunistic acquisition be likely drive long term growth addition company have solid portfolio diversify term geography price point be likely help meet rise demand apartment property efficiently however dilutive impact earning such asset disposition be bypass term also new supply various market be anticipate dampen company rent growth new lease pricing ability hike interest rate add wo apartment investment management company price consensus ep surprise apartment investment management company price consensus ep surprise apartment investment management company quoteaimco currently carry zack rank hold see complete list today zack rank strong buy stock here performance other reitshere be few other reit company have report first quarter result recently hcp inc hcp free report report first quarter ffo adjust cent share beating zack consensus estimate cent comparable ffo adjust prior year quarter be cent vornado realty trust vno free report report first quarter adjust ffo share assume conversion cent beating zack consensus estimate cent further figure surpass prior year quarter tally cent residential reit essex property trust inc ess free report deliver first quarter core ffo share beating zack consensus estimate core ffo share improve year quarter figure note anything related earning present represent fund operation ffo widely used metric gauge performance reit look stock skyrocket upside zack have just release special report boom investment opportunity legal marijuana ignited new referendum legislation industry be expect blast already robust early investor stand make kill have be ready act know just look see pot trade re target
168,ESS,residential real estate investment trust reit essex property trust inc ess free report deliver first quarter core fund operation ffo share beating zack consensus estimate core ffo share improve year quarter figure result reflect growth net operate income noi high occupancy level total revenue quarter grow year year however figure narrowly miss zack consensus estimate quarter detaildure report quarter essex property same property gross revenue grow prior year quarter same property net operate income noi improve year year financial occupancy expand basis point bps year year essex property exit first quarter cash cash equivalent include restrict cash record end notably january company make amendment unsecured line credit facility thereby enhance maximum amount available borrow well lengthen maturity december apr company have undrawn capacity unsecured credit facility report quarter company repurchase share common stock total include commission average price share company have purchase authority left stock buyback program end quarter notably company do not issue share common stock equity distribution program outlookessex property provide guidance second quarter full year full year company project core ffo share range denote cent share increase mid point zack consensus estimate same be currently peg current year projection be backed expectation same property revenue growth band denote basis point bps increase mid point same property noi growth range mark bps growth midpoint second quarter company project core ffo share zack consensus estimate same be currently peg conclusionwe be encourage stellar performance essex property term ffo share however company revenue miss remain disappointment strong property base solid balance sheet essex property be likely leverage favorable demographic trend market company substantial exposure west coast market be home several innovation technology company offer ample scope boost top line long term nonetheless aggressive rental concession moderate pricing power high supply remain concern also rate hike add wo essex property currently carry zack rank hold see complete list today zack rank strong buy stock here essex property trust inc price consensus ep surprise essex property trust inc price consensus ep surprise essex property trust inc quotewe now look forward earning release other reit apartment investment management company aiv free report epr property epr free report realty income corporation free report apartment investment management company be schedule release earning epr property realty income be slate report quarterly number note anything related earning present represent fund operation ffo widely used metric gauge performance reit medical stock buy nowzack name company poise ride medical breakthrough be target cure leukemia aids muscular dystrophy hemophilia other condition new product field be already generate substantial revenue even more wondrous treatment be pipeline early investor realize exceptional profit click here see stock
169,ESS,vornado realty trust vno free report report first quarter adjust fund operation ffo share assume conversion cent beating zack consensus estimate cent further figure surpass prior year quarter tally cent total revenue come report quarter surpass zack consensus estimate moreover total revenue increase year year result reflect growth occupancy same store net operate income noi new york portfolio headline numbersin new york portfolio square foot office space square foot retail space be lease report quarter also square foot square foot space themart california street respectively be lease end report quarter occupancy new york portfolio be basis point bps sequentially improve bps year year occupancy themart be bps sequentially bps year year further occupancy california street be rise bps sequentially bps year year first quarter same store net operate income noi share increase year year new york portfolio same themart california street grow respectively year year mar vornado have nearly cash cash equivalent prior year end premium asset high rent high barrier entry market diverse tenant base have capability drive long term growth moreover part portfolio repositioning effort company have be aggressively dispose asset recently announce handshake deal kushner company sell stake office tower situate fifth avenue however dilutive impact earning divestiture asset be bypass term also intense competition hike interest rate remain concern currently vornado carry zack rank hold see complete list today zack rank strong buy stock here vornado realty trust price consensus ep surprise vornado realty trust price consensus ep surprise vornado realty trust quote now look forward earning release essex property trust inc ess free report mid america apartment community inc maa free report lamar advertising company lamr free report be schedule report number note anything related earning present represent fund operation ffo widely used metric gauge performance reit wall street next amazonzack evp kevin matra believe familiar stock have only just begin climb become greatest investment time once generation opportunity invest pure genius click detail
170,ESS,american tower amt free report report mixed result first quarter top line surpass zack consensus estimate bottom line lag same quarterly adjust fund operation affo come compare year quarter affo share come lag zack consensus estimate total revenue increase year year beating zack consensus estimate operate metricsadjusted ebitda report quarter be prior year quarter adjust ebitda margin be report quarter selling general administrative expense totale compare year earlier quarter operate income be compare year quarter cash flow liquidityin first quarter american tower generate cash operation year year free cash flow report quarter be year year end report quarter company have cash cash equivalent outstanding long term debt compare respectively end december property revenue gross compare year quarter operate profit be operate profit margin be report quarter property segment revenue unite state totale year year total international revenue amount year year revenue asia totale year year emea revenue gross year year latin america revenue totale year year service revenue totale compare year quarter operate profit be operate profit margin be report quarter cash dividend paymentin first quarter board director american tower declare cash distribution cent share common stockholder record closure business apr payable second quarter addition company paid prefer stock dividend quarter review outlook american tower anticipate property revenue range reflect growth midpoint net income be expect reflect growth midpoint adjust ebitda be anticipate range reflect midpoint growth consolidated affo be expect range reflect midpoint growth currently american tower carry zack rank sell see complete list today zack rank strong buy stock here american tower corporation reit price consensus ep surprise american tower corporation reit price consensus ep surprise american tower corporation reit quotewe now look forward earning release essex property trust inc ess free report mid america apartment community inc maa free report lamar advertising company lamr free report be schedule report number note anything related earning present represent fund operation ffo widely used metric gauge performance reit wall street next amazonzack evp kevin matra believe familiar stock have only just begin climb become greatest investment time once generation opportunity invest pure genius click detail be reissue article correct mistake original article issue earlier today longer be rely
171,ESS,essex property trust inc ess free report be schedule report first quarter result market close company fund operation ffo share revenue be anticipate have increase moderately year year last report quarter san mateo base residential real estate investment trust reit deliver line result term ffo share result reflect solid growth net operate income noi occupancy level trail quarters company beat zack consensus estimate occasion meet other average beat be be depict graph essex property trust inc price ep surprise essex property trust inc price ep surprise essex property trust inc quotelet see thing have shape announcement factor drive resultsper latest report real estate technology analytic firm realpage inc rp free report national apartment market remain moderate first quarter occupancy shrink slightly rent growth slow nevertheless first quarter mark slow lease period thank cold weather inhibit shift household curb growth demand go statistic annual rent growth slip marked moderation growth rate experience occupancy level march edge prior year tally metro have subdue construction activity fare well record strongest occupancy nevertheless overall occupancy level be still healthy essex property focus acquisition development west coast property be predict have offer ample scope enhance top line be report quarter notably west coast be hub innovation technology company real wage be expect rise growth company anticipate apartment area have register decent demand rent growth jan mar quarter further solid balance sheet financial flexibility raise confidence company notably january company amend unsecured line credit facility thereby enhance maximum amount available borrow well lengthen maturity december furthermore feb company have undrawn capacity unsecured credit facility zack consensus estimate first quarter revenue be peg mark expect increase year year first quarter company estimate core ffo share zack consensus estimate same be currently peg reflect growth prior year quarter lastly essex property share have ascend past month outperform industry decline surprise store proven model show essex property have right combination key ingredient positive earning esp zack rank hold better increase odd earning beat first quarter uncover best stock buy sell re report earning esp filter zack esp earning esp essex property be zack rank essex property carry zack rank stock warrant lookhere be few stock reit space want consider model show have right combination element report positive surprise time amanda hoffer property ahh free report slate release first quarter result have earning esp zack rank see complete list today zack rank strong buy stock here spirit realty capital src free report schedule report quarterly number have earning esp zack rank note anything related earning present represent fund operation ffo widely used metric gauge performance reit hottest tech mega trend year generate global revenue predict blast roof fame investor mark cuban say produce world first trillionaire still leave plenty money regular investor make right trade early see zack best stock play trend
172,ESS,re max holding inc rmax free report real estate operation firm be slate report first quarter result market close revenue be expect improve year year earning be expect remain flat company deliver earning share ep cent last report quarter line zack consensus estimate further record average positive surprise surprise history be best depict graph re max holding inc price ep surprise re max holding inc price ep surprise re max holding inc quotein addition stock have gain past month outperform loss incur industry belong factor influence resultsre max holding enjoy enviable global footprint company have steady fee base revenue model specific focus agent also enjoy solid cash flow margin re max holding boast highly productive network more agent management project number agent be first quarter year year basis be expect have have positive influence company performance quarter be report subsequently management estimate revenue adjust ebitda margin band zack consensus estimate revenue be peg reflect increase year year notably feb company announce acquisition booj web design technology company platform provide booj include website mobile apps lead generation cultivation system predictive analytic design real estate industry move mark shift company technology strategy provide competitive edge plan leverage capability booj other partner order deliver technology solution client further newly acquire platform complement re max holding exist platform be expect improve efficiency company agent zack consensus estimate first quarter earning have be revise upward cent past month reflect bullish analyst sentiment earning whispersour proven model do not conclusively show re max holding be likely beat earning quarter be stock need have positive earning esp zack rank strong buy buy hold happen be not case here see zack esp re max holding earning esp be uncover best stock buy sell re report earning esp filter zack rank re max holding carry zack rank increase predictive power esp however also need positive esp be confident earning beat stock warrant lookhere be few stock reit space want consider model show have right combination element come positive surprise time amanda hoffer property ahh free report slate release first quarter result have earning esp zack rank see complete list today zack rank stock here spirit realty capital src free report schedule report quarterly number have earning esp zack rank essex property trust ess free report set report number have earning esp zack rank note anything related earning present represent fund operation ffo widely used metric gauge performance reit hottest tech mega trend year generate global revenue predict blast roof fame investor mark cuban say produce world first trillionaire still leave plenty money regular investor make right trade early see zack best stock play trend
173,ESS,cbre group inc cbre free report be slate report first quarter result market open company be anticipate have record growth revenue earning year year last report quarter los angele base commercial real estate service investment firm deliver positive earning surprise result indicated strong revenue growth global region specifically company witness solid growth occupier outsource lease fee revenue fact cbre have decent record earning surprise have surpass estimate trail quarters average positive surprise graph depict surprise history cbre group inc price ep surprise cbre group inc price ep surprise cbre group inc quotecbre share have rally past month industry incur loss let see thing be shape announcement factor considercbre group broad range real estate product service extensive knowledge domestic international real estate market be likely have help retain solid growth momentum first quarter moreover company be focuse better balanced more resilient business model fact contractual revenue lease largely recur time constitute total fee revenue fourth quarter compare report trend be expect have continue first quarter well further cbre group have flourishing occupier outsource business continue capitalize growth opportunity offer category addition solid pipeline growth reflect expand capability result first quarter be likely reflect strength regional service business growth global occupier outsource business well benefit company cost containment effort company be anticipate have generate decent revenue lease business capital market also strategic fill acquisition play key role widening reit geographic coverage well expand reinforce service offering be anticipate have be conducive growth further company be expect have experience improvement operational efficiency quarter be report fact focuse investment technology datum analytic be likely have drive growth continue calculate investment person platform well strong client service cbre group be expect have experience decent market share gain ride growth trajectory first quarter fact zack consensus estimate first quarter revenue be currently peg indicate project growth nearly year year addition zack consensus estimate first quarter earning be cent reflect estimate growth year year notably earning estimate remain unchanged past week earning whispersour proven model show cbre group be likely beat earning estimate have right combination key ingredient stock need have positive earning esp zack rank strong buy buy least hold beat estimate cbre group have right mix uncover best stock buy sell re report earning esp filter zack esp earning esp be be meaningful lead indicator likely positive earning beat zack rank cbre group zack rank combine positive esp make reasonably confident earning beat season stock warrant lookhere be few stock broader real estate sector want consider model show have right combination element report positive surprise time jll jll free report slate release quarterly number have earning esp zack rank essex property trust inc ess free report slate release earning have earning esp zack rank see complete list today zack rank stock here hcp inc hcp free report schedule report quarterly number have earning esp zack rank hottest tech mega trend year generate global revenue predict blast roof fame investor mark cuban say produce world first trillionaire still leave plenty money regular investor make right trade early see zack best stock play trend
174,ESS,investor be always look stock be poise beat earning season essex property trust inc ess free report be such company firm have earning come pretty soon event be shape quite nicely report be essex property be see favorable earning estimate revision activity late be generally precursor earning beat analyst raise estimate right earning most date information possible be pretty good indicator favorable trend surface ess report analyst have very recently bump estimate ess give stock zack earning esp head earning season essex property trust inc price ep surprise essex property trust inc price ep surprise essex property trust inc quotewhy be important positive read zack earning esp have proven be very powerful produce positive surprise outperform market recent year backtest show stock have positive earning esp zack rank hold better show positive surprise nearly time have return average annual return see more top earning esp stock here give ess have zack rank esp positive territory investor want consider stock ahead earning see complete list today zack rank strong buy stock here clearly recent earning estimate revision suggest good thing be ahead essex property beat be card upcoming report hottest tech mega trend year generate global revenue predict blast roof fame investor mark cuban say produce world first trillionaire still leave plenty money regular investor make right trade early see zack best stock play trend
