,ticker,content
197,ESS,cousin property incorporate free report report first quarter fund operation ffo share cent line zack consensus estimate however figure come lower prior year quarter tally cent result reflect better expect revenue quarter further rise second generation net rent square foot cash basis be experience rental property revenue quarter come compare year quarter further figure beat zack consensus estimate however total revenue come lower report prior year period quarter detailcousin property lease renew square foot office space report quarter same property net operate income noi cash basis rise year quarter moreover second generation net rent square foot cash basis increase total cost expense come prior year quarter cousin property exit first quarter cash cash equivalent record dec outlookcousin property reiterate ffo share guidance issue fourth quarter company expect ffo year be band cent zack consensus estimate be currently peg cent cousin property update guidance fee other income management now expect be range previous range change be due forecast termination fee property diversify portfolio presence high end tenant roster opportunistic investment best sub market likely help company keep impressive growth momentum alive further company investment high growth market be anticipate boost lease metric nonetheless company face stiff competition other market player impact ability retain attract tenant higher rent moreover improvement job market fundamental office real estate market be anticipate be affected future rise new delivery office space cousin property incorporate price consensus ep surprise cousin property incorporate price consensus ep surprise cousin property incorporate quotecurrently cousin property have zack rank hold see complete list today zack rank strong buy stock here now look forward earning release other reit alexandrium real estate equity inc be free report regency center corporation reg free report essex property trust inc ess free report alexandrium regency center be schedule release result apr essex be slate report number note anything related earning present represent fund operation ffo widely used metric gauge performance reit more stock news be bigger iphone become mother technological revolution apple sell mere iphone year new breakthrough be expect generate more device just year create market zack have just release special report spotlight fast emerge phenomenon ticker take advantage don buy now kick click here trade
198,ESS,residential real estate investment trust reit essex property trust inc ess free report deliver line performance fourth quarter company report core fund operation ffo share quarter meeting zack consensus estimate core ffo share improve year quarter figure result reflect solid growth net operate income noi high occupancy level total revenue quarter grow year year however figure narrowly miss zack consensus estimate management expect housing demand surpass supply coastal market california washington be likely result growth market rent close long term average specifically west coast be anticipate outdo nation term rent growth well job growth year full year core ffo share come ahead prior year tally be backed year year growth total revenue follow earning release feb share essex property rally close feb quarter detaildure report quarter essex property same property gross revenue grow prior year quarter same property net operate income noi improve year year financial occupancy expand basis point bps year year further company sell community total contract price quarter other hand company acquire community total contract price liquidityessex property exit year end cash cash equivalent include restrict cash end notably january company make amendment unsecured line credit facility thereby enhance maximum amount available borrow well lengthen maturity december feb company have undrawn capacity unsecured credit facility fourth quarter company issue share common stock average price equity distribution program net proceed full year company issue share common stock average price help generate net proceed outlookessex property provide guidance first quarter full year full year company project core ffo share range zack consensus estimate same be currently peg full year projection be backed expectation same property revenue growth band same property noi increase range first quarter company project core ffo share band zack consensus estimate same be currently peg conclusionwe be encourage better expect performance term ffo share essex property report quarter slightly disappoint revenue miss strong property base solid balance sheet essex property be likely leverage favorable demographic trend market company substantial exposure west coast market be home several innovation technology company offer ample scope boost top line long term however elevated apartment delivery remain concern also rate hike add wo essex property currently carry zack rank hold see complete list today zack rank strong buy stock here essex property trust inc price consensus ep surprise essex property trust inc price consensus ep surprise essex property trust inc quoteamong other residential reit equity residential eqr free report report fourth quarter normalize ffo share cent beating zack consensus estimate cent figure also come higher cent report year quarter result mirror enhance same store noi lease noi however company incur higher corporate overhead quarter read more equity residential ffo beat solid noi growth avalonbay community inc avb free report fourth quarter core ffo share beat zack consensus estimate penny company core ffo share also record growth year figure result highlight growth average rental rate additionally economic occupancy manage increase slightly quarter company also announce hike quarterly dividend read more avalonbay beat ffo estimate raise dividend mid america apartment community inc maa free report commonly refer maa report fourth quarter ffo share beating zack consensus estimate figure also compare favorably prior year quarter tally residential reit quarterly result reflect growth same store property noi rise average effective rent unit same store portfolio read more mid america apartment ffo beat revenue note anything related earning present represent fund operation ffo widely used metric gauge performance reit wall street next amazonzack evp kevin matra believe familiar stock have only just begin climb become greatest investment time once generation opportunity invest pure genius click detail
199,ESS,essex property trust inc ess free report be schedule report fourth quarter result feb market close company fund operation ffo share revenue be anticipate increase year year prior quarter san mateo base residential real estate investment trust reit generate positive surprise term ffo share result reflect solid growth revenue trail quarters company beat zack consensus estimate occasion average beat be be depict graph essex property trust inc price ep surprise essex property trust inc price ep surprise essex property trust inc fourth quarter company estimate core ffo share range zack consensus estimate same be currently peg let see thing have shape announcement factor influence resultsper study real estate technology analytic firm realpage inc rp free report apartment market report moderate rent growth calendar year seasonal pricing cut fourth quarter apartment rent increase modest rate effective rent new lease edge quarter admittedly level rent growth have moderate earlier year however national apartment occupancy come end fourth quarter remain stable year year essex have strong property base sturdy balance sheet company substantial exposure west coast market be home several innovation technology company be likely offer scope boost top line be report quarter also be significant pent demand however apartment delivery remain elevated report quarter elevated supply be concern curb landlord ability command more rent result lesser absorption such be report quarter occupancy be likely remain nearly unchanged furthermore escalate supply certain submarket be expect result aggressive rental concession moderate pricing power landlord zack consensus estimate fourth quarter revenue be peg mark expect increase year year moreover month time zack consensus estimate ffo share fourth quarter inched highlight analyst bullish sentiment however essex property share have descend past month underperform industry decline earning whispersour proven model do not conclusively show essex property likely beat estimate season be stock need have positive earning esp zack rank strong buy buy least hold happen however be not case here see zack esp earning esp be peg uncover best stock buy sell re report earning esp filter zack rank essex property have zack rank favorable zack rank increase predictive power esp company negative esp make surprise prediction difficult caution stock zack rank sell rate go earning announcement especially company be see negative estimate revision stock warrant lookhere be few stock reit space want consider model show have right combination element report positive surprise time cubesmart cube free report slate release fourth quarter result feb have earning esp zack rank see complete list today zack rank stock here epr property epr free report schedule report quarterly number feb have earning esp zack rank note anything related earning present represent fund operation ffo widely used metric gauge performance reit breaking news cryptocurrency now bigger total market cap cryptos recently surpass more increase previous month re now bigger morgan stanley goldman sachs even visa new asset class expand even more rapidly new investor continue pour wall street become increasingly involved zack have just name company enable investor take advantage explosive growth cryptocurrency stock market click here access stock
200,ESS,earning season last leg be right time gauge performance real estate investment trust reit industry admittedly rate hike cautious approach investor have affected gain industry so far year however investor need keep mind operate performance special hybrid asset be highly determine dynamic individual asset category number asset category display strength second quarter economy job market show sign recovery fact nareit medium release occupancy rate remain high second quarter fund operation ffo widely used metric gauge performance reit report growth specifically scorecard reveal total ffo list equity reit industry report quarter increase sequentially figure also come higher prior year quarter tally same store net operate income noi report year year growth result be drive segment single family home datum center manufacture home community witness robust same store noi growth respectively furthermore property own list equity reit enjoy solid occupancy level fact occupancy rate remain unchanged slightly record high occupancy rate record third fourth quarters admittedly growth cloud compute internet thing big datum be not only help tech company also drive demand datum center reit moreover industrial asset category hogged limelight experience high demand economy job market display sign recovery ecommerce gain strength manufacturing environment remain healthy also residential real estate market benefit healthy demand level delay delivery keep supply number check doubt shrink mall traffic store closure aggressive growth online sale keep retail reit tenterhook however retail reit manage grab attention new productive tenant be able replace one depart reit constituent datum center reit digital realty trust inc dlr free report industrial reit prologis inc pld free report deliver better expect result quarter positive surprise nearly respectively term ffo share also retail reit simon property group inc spg free report residential reit essex property trust inc ess free report surpass estimate register positive surprise respectively currently digital realty prologis simon property group essex property carry zack rank hold see complete list today zack rank strong buy stock here note ffo widely used metric gauge performance reit be obtain add depreciation amortization other cash expense net income surprising tech stock keep eye ontech stock have be major force market record high pick best one buy be tough simple way invest success entire sector zack have just release special report reveal thing tech company literally function more importantly reveal top stock set skyrocket increase demand device encourage get report now next wave innovation really take see stock now
201,ESS,essex property trust inc ess free report be slate report second quarter result jul market close prior quarter san mateo base residential real estate investment trust reit generate positive surprise term fund operation ffo share result be backed solid growth revenue trail quarters company beat zack consensus estimate occasion average beat be depict graph essex property trust inc price ep surprise essex property trust inc price ep surprise essex property trust inc second quarter company estimate core ffo share range zack consensus estimate same be currently peg look price performance essex property share have rally year date outperform industry gain let see thing have shape announcement factor consideressex have strong property base sturdy balance sheet company substantial exposure west coast market be home several innovation technology company be likely offer ample scope boost top line be report quarter moreover demographic growth continue be sound young adult age cohort have higher propensity rent also improve economy job market strength be likely act catalyst drive demand apartment company market quarter review however apartment delivery not peak quarter figure remain consistently high west coast submarket also be aggressive rental concession provide newly develop community be expect continue moderate pricing power addition company expect expense increase second quarter furthermore due capital market activity interest expense be predict be higher nevertheless past day zack consensus estimate ffo share second quarter inched reflect analyst bullish sentiment stock earning whispersour proven model do not conclusively show essex property beat estimate season be stock need have positive earning esp zack rank strong buy buy hold happen however be not case here see zack esp earning esp represent percentage difference most accurate estimate zack consensus estimate be uncover best stock buy sell re report earning esp filter zack rank essex property currently have zack rank favorable zack rank increase predictive power esp company negative esp make surprise prediction difficult caution stock zack rank sell rate go earning announcement especially company be see negative estimate revision stock warrant lookhere be few stock reit sector want consider model show have right combination element report positive surprise quarter liberty property trust lpt free report slate release second quarter result jul have earning esp zack rank see complete list today zack rank stock here cyrusone inc cone free report schedule release earning aug have zack rank earning esp piedmont office realty trust inc pdm free report slate release earning aug have earning esp zack rank note ep number present represent fund operation ffo share ffo widely used metric gauge performance reit be obtain add depreciation amortization other cash expense net income more stock news be bigger iphone become mother technological revolution apple sell mere iphone year new breakthrough be expect generate more device just year create market zack have just release special report spotlight fast emerge phenomenon ticker take advantage don buy now kick click here trade
202,ESS,defy concern supply market residential real estate market be back bang drive robust demand level study real estate technology analytic firm realpage inc rp free report second quarter demand level apartment nation marked third increase level witness year help occupancy remain high mid year lead stabilization annual pace rent growth come close growth experience first quarter notably job formation checked move out buy home act catalyst not residential reit be equally poise gain location property play crucial role determine demand property however such residential reit stock have be display strength be essex property trust inc ess free report zack rank buy stock have gain year date outperform increase industry belong furthermore fund operation ffo share estimate third quarter full year moved north past day san mateo base residential reit be likely well leverage favorable demographic trend market fact demographic growth continue be strong young adult age cohort have higher propensity rent age cohort also experience considerable part net job growth provide significant source pent demand moreover supply issue plague market earlier company continue display robust fundamental improve prospect company report core ffo share second quarter beating zack consensus estimate core ffo share also improve year quarter figure result reflect solid growth revenue company have also raise outlook full year project core ffo share range guide earlier mark increase cent mid point further company revise estimate same property gross revenue growth prior range indicate uptick bps mid point same property net operate income noi be now guide band previous range mark bps expansion mid point further essex have year history increase cash dividend solid choice same property noi growth essex property have be experience solid growth same property noi fact presentation company same property noi witness compound annual growth rate cagr well ahead growth record peer average trend be likely continue well company raise noi expectation present year ffo share growth essex property deliver earning surprise last report quarter trail quarters company deliver positive surprise average beat historical ffo share growth year come industry average momentum be anticipate continue term indicated project ffo share growth company compare industry average rate turn highlight essex property bright prospect superior roe essex property return equity roe be compare industry average reflect company reinvest more efficiently compare industry strong leverage debt equity ratio essex property be compare industry average mirror financial stability company lesser risk shareholder other key picksother similarly rank stock residential reit industry be equity lifestyle property inc el free report independence realty trust inc irt free report see complete list today zack rank strong buy stock here equity lifestyle independence realty have expect long term growth rate ffo share respectively note ep number present represent fund operation ffo share ffo widely used metric gauge performance reit be obtain add depreciation amortization other cash expense net income trade profit big league trump policiesif stock spark interest look company prime make substantial gain washington change course today zack reveal ticker benefit new trend streamline drug approval tariff lower taxe higher interest rate spending surge defense infrastructure see buy recommendation now
203,ESS,avalonbay community inc avb free report fourth quarter core fund operation ffo share beat zack consensus estimate penny company core ffo share also record growth year figure total revenue increase year year revenue development community stabilize operate community record growth figure also compare favorably zack consensus estimate result highlight growth average rental rate additionally economic occupancy manage increase slightly quarter company also announce hike quarterly dividend full year core ffo share come prior year tally be backed year year growth total revenue nearly quarter detail report quarter average rental rate be year year economic occupancy inched year quarter revenue establish community stabilize operation jan be neither execute plan significant redevelopment work be not hold sale plan disposition current year improve year year indicate increase average rental rate economic occupancy however operate expense establish community flare year year basis consequently noi establish community rise year year notably fourth quarter company acquire boca contain apartment home boca raton fl purchase denote company entry southeast florida metropolitan region dec avalonbay have community construction expect contain total apartment home square foot retail space be anticipate be accomplish estimate total capital cost include company share community be develop joint venture liquidity positiona dec avalonbay have borrowing outstanding unsecured credit facility company have unrestricted cash cash escrow date addition company annualize net debt core ebitda fourth quarter be time first quarter avalonbay expect core ffo share range zack consensus estimate same be currently peg full year company project core ffo share band zack consensus estimate same be currently peg dividend hikeavalonbay announce first quarter dividend share denote increase prior quarterly dividend new dividend be paid apr stockholder record mar better expect performance fourth quarter hike dividend look encourage company be well poise grow back solid portfolio high quality asset premium location furthermore company have healthy balance sheet nevertheless be presence elevated supply number company market hence growth stabilize portfolio be likely remain modest upcoming period rate hike remain concern avalonbay currently have zack rank hold see complete list today zack rank strong buy stock here past month share avalonbay have depreciate outperform loss incur industry avalonbay community inc price consensus ep surprise avalonbay community inc price consensus ep surprise avalonbay community inc quotewe now look forward earning release other reit udr inc udr free report essex property trust inc ess free report regency center corporation reg free report udr inc essex property be schedule release result feb regency center be slate report number feb note anything related earning present represent fund operation ffo widely used metric gauge performance reit wall street next amazonzack evp kevin matra believe familiar stock have only just begin climb become greatest investment time once generation opportunity invest pure genius click detail
204,ESS,equity residential eqr free report report fourth quarter normalize fund operation ffo share cent beating zack consensus estimate cent figure also come higher cent report year quarter result mirror enhance same store net operate income noi lease noi however company incur higher corporate overhead quarter moreover total revenue report quarter come indicate growth prior year period addition figure surpass zack consensus estimate management solid steady rental demand company market be support favorable demographic low unemployment level rise wage however be anticipate witness high level new supply lead decrease pricing power well decelerate revenue growth full year normalize ffo share come ahead prior year tally be backed year year growth total revenue nearly quarter detailsame store revenue include apartment unit be year year expense climb year year result same store noi advanced year year company experience growth average rental rate physical occupancy remain flat year year same store portfolio company exit fourth quarter cash cash equivalent record end prior quarter portfolio activitydure report quarter equity residential do not purchase consolidated apartment property other hand company sell consolidated apartment property southern new jersey apartment unit further company complete cascade unit apartment development project seattle total cost first quarter equity residential project normalize ffo share range cent zack consensus estimate same be currently peg cent full year company project normalize ffo share band zack consensus estimate lie range company full year outlook be backed same store portfolio revenue growth physical occupancy noi change also expense be project flare dividend updatecurrently equity residential expect declare first quarter common share dividend cent share reflect annualize hike amount paid viewpointequity residential better expect performance fourth quarter be impressive company be anticipate benefit effort reposition portfolio high barrier entry core market favorable demographic lifestyle transformation creation new household company current focus be acquisition development asset primarily core coastal metropolitan area boston new york washington southern california san francisco seattle however elevated supply number market be likely put pressure rental rate result high concession furthermore rate hike add wo equity residential currently carry zack rank hold see complete list today zack rank strong buy stock here equity residential price consensus ep surprise equity residential price consensus ep surprise equity residential quotewe now look forward earning release other residential reit apartment investment management company aiv free report udr inc udr free report essex property trust inc ess free report apartment investment management company udr inc be schedule release result feb feb essex property be slate report number feb note anything related earning present represent fund operation ffo widely used metric gauge performance reit hottest tech mega trend year generate global revenue predict blast roof fame investor mark cuban say produce world first trillionaire still leave plenty money regular investor make right trade early see zack best stock play trend
