,ticker,content
182,ESS,venta inc vtr free report report first quarter fund operation ffo defined national association real estate investment trust cent miss zack consensus estimate figure come lower year quarter tally result reflect increase property level operate expense venta post revenue first quarter comfortably beating zack consensus estimate further compare favorably year number first quarter same store cash net operate income noi growth total portfolio asset climb year year segment wise same store cash noi triple net lease portfolio grow senior housing operate portfolio witness rise medical office build portfolio rise quarter detaildure report quarter venta sign mutually beneficial agreement brookdale senior live currently operate company wholly own senior housing community combine company lease brookdale single master lease initial term dec brookdale have year extension option well brookdale venta also plan sell few property brookdale portfolio totale cash rent liquidityventa exit first quarter cash cash equivalent dec update outlookventa update normalize ffo share outlook previous range company update same store cash net operate income growth issue earlier takeventa be poise grow back diversify portfolio strategic acquisition strong balance sheet rise healthcare spending age population augur well long term growth moreover mutual agreement company have sign brookdale be likely provide further support venta however elevated supply senior housing asset certain market be likely put pressure rent occupancy growth term further company be expose concentration risk majority revenue be generate few tenant hike interest rate be also concern venta inc price consensus venta inc price consensus venta inc quotecurrently venta carry zack rank hold see complete list today zack rank strong buy stock here now look forward earning release other reit alexandrium real estate equity inc be free report essex property trust inc ess free report regency center corp reg free report alexandrium regency center be schedule release result apr essex property be slate report number look stock skyrocket upside zack have just release special report boom investment opportunity legal marijuana ignited new referendum legislation industry be expect blast already robust early investor stand make kill have be ready act know just look see pot trade re target
183,ESS,st joe company joe free report report first quarter net income share cent compare cent record prior year quarter however prior year quarter net income include benefit insurance settlement net realize gain sale investment exclude other item operate loss first quarter improve total revenue quarter come compare record year period upswing be drive higher lease revenue timber revenue real estate revenue however quarter witness slight decline resort leisure business revenue company total expense quarter escalate prior year quarter share st joe decline regular trading session apr headline numbersin report quarter real estate revenue come record comparable period last year timber revenue be increase record prior year quarter further lease revenue first quarter come year quarter figure st joe own square foot rentable commercial space be lease mar nevertheless resort leisure revenue come report quarter post year period liquidityst joe exit first quarter cash cash equivalent investment dec joe strategy expand resort leisure business bode well long term growth such effort achieve optimal portfolio mix likely help company bolster revenue provide more stable source earning further continue effort enhance lease portfolio enabled record encourage growth segment nonetheless inconsistent revenue performance number segment render volatility company top line further regional business concentration remain concern st joe company price consensus ep surprise st joe company price consensus ep surprise st joe company quotest joe currently have zack rank hold see complete list today zack rank strong buy stock here now look forward earning release other reit alexandrium real estate equity inc be free report essex property trust inc ess free report regency center corp reg free report alexandrium regency center be schedule release result apr essex property be slate report number look stock skyrocket upside zack have just release special report boom investment opportunity legal marijuana ignited new referendum legislation industry be expect blast already robust early investor stand make kill have be ready act know just look see pot trade re target
184,ESS,welltower inc well free report report normalize fund operation ffo share cent first quarter miss zack consensus estimate penny further year year basis figure decline result highlight choppy senior housing market however company post revenue nearly beat zack consensus estimate also compare favorably year number importantly be announce welltower promedica health system acquire quality care property qcp real estate newly form joint venture share also promedica enter definitive deal acquire operation hcr manorcare arden court qcp principal tenant addition promedica enter year absolute triple net master lease tenant real estate joint venture notably welltower investment be estimate provide cent share annual accretion company further represent initial cash yield xproperty level ebitdar coverage corporate lease guarantee secure investment grade health system moreover partnership promedica gain immediate scale rapidly grow home health post acute memory care market invest much capex next year quarter detailtotal portfolio same store net operate income ssnoi inched year year mainly drive growth senior housing triple net outpatient medical long term post acute care segment welltower accomplish pro gross investment first quarter include acquisition joint venture development funding well loan notably company complete investment present relationship other hand company accomplish total disposition quarter comprise loan payoff property sale company exit first quarter cash cash equivalent record end prior year quarter addition mar company have available borrow capacity primary unsecured credit facility furthermore extinguish secure debt report quarter dividend updatewelltower announce cash dividend cent share first quarter dividend be paid stockholder record mark company consecutive quarterly cash dividend payout stockholder outlookdue timing variability associate completion promedica joint venture acquisition quality care property company have not include enhance acquisition activity guidance current earning outlook such welltower affirm normalize ffo share outlook zack consensus estimate same be currently peg also company anticipate average blended ssnoi growth addition company increase disposition proceed projection guide earlier takewelltower partnership promedica health system be strategic fit span entire spectrum care include wellness post acute assist live memory care hospice home health give company solid scope capitalize individual market dynamic nonetheless senior housing market remain challenge additionally rate hike be concern welltower due high exposure long term lease asset stiff competition effect increase disposition earning add wo currently welltower have zack rank sell see complete list today zack rank strong buy stock here welltower inc price consensus ep surprise welltower inc price consensus ep surprise welltower inc quotewe now look forward earning release other reit alexandrium real estate equity inc be free report essex property trust inc ess free report regency center corporation reg free report alexandrium regency center be schedule release result apr essex property be slate report number note anything related earning present represent fund operation ffo widely used metric gauge performance reit look stock skyrocket upside zack have just release special report boom investment opportunity legal marijuana ignited new referendum legislation industry be expect blast already robust early investor stand make kill have be ready act know just look see pot trade re target
185,ESS,simon property group inc spg free report retail real estate investment trust reit report first quarter fund operation ffo share surpass zack consensus estimate ffo share figure also come higher year tally result highlight increase base minimum rent square foot lease spread square foot mall premium outlet moreover company record growth net operate income noi total portfolio be backed contribution new development redevelopment expansion acquisition simon property also raise outlook quarter company post revenue outpaced zack consensus estimate also compare favorably year number headline mall premium outlet portfolio occupancy be mar retailer sale square foot come trail month period mark growth base minimum rent square foot rise year year mar further lease spread square foot trail month period end mar increase total portfolio noi growth report quarter come reflect increase operate income comparable property well addition new development redevelopment expansion acquisition comparable property noi growth same period come end report quarter simon property have redevelopment expansion project include addition new anchor progress property unite state canada asia company exit first quarter cash cash equivalent compare nearly report prior year end additionally mar simon have more liquidity comprise cash hand include share joint venture cash available capacity company revolve credit facility moreover company repurchase share common stock quarter outlooksimon property raise outlook company now project ffo share zack consensus estimate same be currently peg dividend updatesimon property announce quarterly dividend share denote increase year year dividend be paid stockholder record viewpointsimon property have diversify exposure retail asset unite state abroad boast strong improve balance sheet moreover company be focuse overhaul property increasingly adopt omni channel strategy fact recently simon property announce substantial redevelopment program property move help retail reit transform former sear store draw more traffic mall order benefit exist retailer admittedly simon property be putt effort enhance value asset however implementation such measure require decent upfront cost therefore limit robust growth profit margin term also rate hike have add wo currently simon property carry zack rank hold see complete list today zack rank strong buy stock here simon property group inc price consensus ep surprise simon property group inc price consensus ep surprise simon property group inc quotewe now look forward earning release other reit alexandrium real estate equity inc be free report essex property trust inc ess free report regency center corporation reg free report alexandrium regency center be schedule release result apr essex property be slate report number note anything related earning present represent fund operation ffo widely used metric gauge performance reit look stock skyrocket upside zack have just release special report boom investment opportunity legal marijuana ignited new referendum legislation industry be expect blast already robust early investor stand make kill have be ready act know just look see pot trade re target
186,ESS,datum center reit digital realty trust inc dlr free report first quarter fund operation ffo share outpaced zack consensus estimate figure also come higher year quarter tally core ffo share come first quarter report prior year quarter result be support growth revenue company report revenue first quarter also surpass zack consensus estimate revenue figure also marked impressive year year growth further company raise core ffo share outlook sign total booking report quarter be estimate generate annualize gaap rental revenue include contribution interconnection notably weight average lag lease sign first quarter contractual commencement date be month moreover company sign renewal lease mark annualize gaap rental revenue rental rate renewal lease sign report quarter rolled cash basis ascend gaap basis notable portfolio activitydure first quarter digital realty close sale ardenwood boulevard square foot technology manufacturing property fremont well quannapowitt parkway considerably vacant square foot datum center redevelopment project wakefield furthermore company close sale gold camp drive sun center drive datum center aggregate square foot rancho cordova balance sheetdigital realty exit first quarter cash cash equivalent record prior year end additionally mar company have total debt outstanding be unsecured debt secure debt also same date net debt adjust ebitda be fix charge coverage be outlook raiseddigital realty raise core ffo share outlook zack consensus estimate same currently peg lie range full year outlook provide company be backed revenue projection year end portfolio occupancy growth bps same capital cash noi growth takedigital realty better expect performance first quarter be impressive notably solid fundamental datum center market offer scope company ride growth curve additionally accretive acquisition development effort augur well long term growth nevertheless company face cut throat competition industry also have substantial debt burden furthermore rate hike add wo digital realty currently carry zack rank hold see complete list today zack strong buy rank stock here digital realty trust inc price consensus ep surprise digital realty trust inc price consensus ep surprise digital realty trust inc quotewe now look forward earning release other reit alexandrium real estate equity inc be free report essex property trust inc ess free report regency center corporation reg free report alexandrium regency center be schedule release result apr essex property be slate report number note anything related earning present represent fund operation ffo widely used metric gauge performance reit look stock skyrocket upside zack have just release special report boom investment opportunity legal marijuana ignited new referendum legislation industry be expect blast already robust early investor stand make kill have be ready act know just look see pot trade re target
187,ESS,have be month last earning report essex property trust inc ess free report share have add time frame recent positive trend continue lead next earning release be ess due pullback dive investor analyst have react late let take quick look most recent earning report order get better handle important catalyst essex property ffo revenue grow yessex property deliver line performance fourth quarter company report core ffo share quarter meeting zack consensus estimate core ffo share improve year quarter figure result reflect solid growth noi high occupancy level total revenue quarter grow year year however figure narrowly miss zack consensus estimate management expect housing demand surpass supply coastal market california washington be likely result growth market rent close long term average specifically west coast be anticipate outdo nation term rent growth well job growth year full year core ffo share come ahead prior year tally be backed year year growth total revenue quarter detaildure report quarter essex property same property gross revenue grow prior year quarter same property noi improve year year financial occupancy expand basis point bps year year further company sell community total contract price quarter other hand company acquire community total contract price liquidityessex property exit year end cash cash equivalent include restrict cash end notably january company make amendment unsecured line credit facility thereby enhance maximum amount available borrow well lengthen maturity december feb company have undrawn capacity unsecured credit facility fourth quarter company issue share common stock average price equity distribution program net proceed full year company issue share common stock average price help generate net proceed outlookessex property provide guidance first quarter full year full year company project core ffo share range full year projection be backed expectation same property revenue growth band same property noi increase range first quarter company project core ffo share band have estimate be move then past month investor have witness upward trend fresh estimate have be revision higher current quarter compare lower essex property trust inc price consensus essex property trust inc price consensus essex property trust inc quotevgm scoresat time ess have average growth score however momentum be do bit better however stock be allocate grade value side putt bottom quintile investment strategy overall stock have aggregate vgm score aren focuse strategy score be be interested style score indicate stock be more suitable momentum investor growth investor outlookestimate have be broadly trend upward stock magnitude revision look promising notably ess have zack rank hold expect line return stock next few month
188,ESS,have crossed halfway mark report season index result member already latest earning preview total earning constituent be year quarter rise revenue beating ep estimate exceed top line expectation retail reit ggp inc ggp free report residential reit essex property trust inc ess free report be yet report number earning season let take look reit have edge other ahead release feb however delve deeper figure let first discuss overall scenario reit industry then particular asset category company glance december rate hike possibility further increase rate year have keep investor reit space worry extent be use leverage reit business make return industry susceptible interest rate movement particularly rise interest rate affect present value future cash flow therefore asset valuation include bond coupon stock dividend experience decline however apart rate factor underlie asset class dynamic play vital role determine operate performance reit study real estate technology analytic firm realpage inc rp free report apartment market report moderate rent growth calendar year seasonal pricing cut fourth quarter apartment rent increase modest rate effective rent new lease edge quarter admittedly level rent growth have moderate earlier year however national apartment occupancy come end fourth quarter remain stable year year also holiday season turn be blissful retailer upbeat consumer sentiment improve economy rise income low unemployment level government datum consumer spending remain solid season retail sale rise november december respectively however retail real estate market continue bear brunt mall traffic suffer rapid shift customer shopping preference online channel result increase number retailer join dot com bandwagon have make retailer reconsider footprint eventually opt store closure recent year other unable cope competition be filing bankruptcy additionally turbulent retail real estate market be say have lead tenant demand substantial lease concession mall landlord find unjustified zack esp be proprietary methodology identify stock have high chance surprising upcoming earning announcement show percentage difference most accurate estimate zack consensus estimate research show stock combination favorable zack rank strong buy buy hold positive earning esp chance positive earning surprise be high uncover best stock buy sell re report earning esp filter price performancedure fourth quarter ggp inc outpaced essex property term price performance ggp inc rally compare essex property depreciation notably month november witness increase shareholder activity retail real estate market trigger brookfield property partner takeover offer ggp inc ggp factor playchicago il base ggp inc have solid portfolio high quality retail property attractive location unite state therefore improve economy retail property have capability generate decent cash flow give cluster renown tenant nevertheless choppy retail real estate market rise online sale store closure retailer bankruptcy be likely have restrain demand space considerably ggp inc have be make effort counter such pressure various initiative company be focuse omni channel retail generate higher sale further be focuse offer mall visitor access retail dine entertainment hub best trade area nation such strategic move boost shopping experience enhance sale volume tenant store consequently raise demand company asset however implementation such measure require significant upfront cost impede term growth profit margin zack consensus estimate revenue be report quarter be peg reflect project growth year period fourth quarter company project fund operation ffo share range cent zack consensus estimate same be currently peg cent indicate project growth year year yet trail quarters company surpass estimate occasion meet other average positive surprise be be depict graph general growth property inc price ep surprise general growth property inc price ep surprise general growth property inc quoteggp inc have earning esp addition have zack rank sell also reduce predictive power esp read more ggp counter impact online retail boom earning essex property factor considersan mateo base essex property have strong property base sturdy balance sheet company substantial exposure west coast market be home several innovation technology company be likely offer scope boost top line quarter be report also be significant pent demand nonetheless apartment delivery remain elevated report quarter uptick supply be concern curb landlord ability command more rent result lesser absorption such fourth quarter occupancy be likely remain nearly unchanged furthermore escalate supply certain submarket be expect result aggressive rental concession moderate pricing power landlord zack consensus estimate fourth quarter revenue be peg mark expect increase year year additionally fourth quarter company estimate core ffo share band zack consensus estimate same be currently peg indicate growth year year company beat zack consensus estimate occasion average beat be precede quarters be depict graph essex property trust inc price ep surprise essex property trust inc price ep surprise essex property trust inc quoteessex property have earning esp zack rank favorable zack rank increase predictive power esp company negative esp make surprise prediction difficult read more essex property post earning store taketherefore proprietary model conclusively predict positive surprise term ffo share ggp inc essex property fourth quarter investor rather focus fundamental company take decision note anything related earning present represent fund operation ffo widely used metric gauge performance reit more stock news be bigger iphone become mother technological revolution apple sell mere iphone year new breakthrough be expect generate more device just year create market zack have just release special report spotlight fast emerge phenomenon ticker take advantage don buy now kick click here trade
