,ticker,content
0,GGP,walk tesla motor store oakbrook center mall chicago last december alan mckeon have more pass interest pricey electric car list more yet month later back home atlanta order online change once see product
1,GGP,deutsche bank downgrade macy sell buy slash price target nationwide department store be see unable drive same store sale growth
2,GGP,be downgrading sell buy lower estimate street guidance reflect low confidence company bust sss rut sale deleverage increase pressure shipping health care retirement expense say deutsche bank analyst paul trussell note
3,GGP,macy share fall stock market today stock gap buy range be still trading day line late monday morning
4,GGP,downgrade trussell acknowledge selling real estate unlock value company macy be reportedly pressure earlier month put sale flagship new york city storefront other asset sale leaseback
5,GGP,acknowledge unlock real estate portfolio drive significant value represent key risk sell rating say trussell
6,GGP,believe odd macy utilize reit particularly flagship store be low
7,GGP,sear holding shld have engage real estate joint venture macerich mac general growth property ggp simon property group spg year
8,GGP,rival department store jwn share fall jc penney jcp fall
9,GGP,follow elaine low twitter ibd_elow
10,GGP,related
11,GGP,macy reportedly urge sell ny flagship property deutsche bank downgrade macy sell buy slash price target nationwide department store be see unable drive same store sale growth be downgrading sell buy lower estimate street guidance reflect low confidence company bust sss rut sale deleverage increase pressure shipping health care retirement expense say deutsche bank analyst paul trussell note macy share fall stock market today stock gap buy range be still trading day line late monday morning downgrade trussell acknowledge selling real estate unlock value company macy be reportedly pressure earlier month put sale flagship new york city storefront other asset sale leaseback acknowledge unlock real estate portfolio drive significant value represent key risk sell rating say trussell believe odd macy utilize reit particularly flagship store be low sear holding shld have engage real estate joint venture macerich mac general growth property ggp simon property group spg year rival department store jwn share fall jc penney jcp fall follow elaine low twitter ibd_elow related macy reportedly urge sell ny flagship property
12,GGP,macy be reportedly investor pressure sell flagship new york city location other real estate asset sale leaseback move several unnamed hedge fund have be build stake macy approach management potentially selling brick mortar location lease back source tell reuter sale leaseback ideally make capital more available
13,GGP,struggle department store sear manage best wall street earning expectation sear kmart same store sale plunge sear holding shld say narrow loss last year adjust diluted loss share vs loss last year accord thomson reuter store lose share widening loss
14,GGP,mall operator macerich mac have paid form joint venture sear shld latest real estate deal struggle retailer attempt boost performance sear operate namesake kmart store chain contribute property venture then lease back property locate macerich mall
15,GGP,effort shore cash position sear holding shld announce joint venture simon property spg monday operator sear mart store say take stake venture contribute property value then lease back store mall operator simon contribute
16,GGP,sear holding shld announce wednesday be form real estate investment trust help turn struggle business
17,GGP,department store chain expect raise create reit buy sear kmart store then lease back property jan sear own lease sear kmart store
18,GGP,share jump premarket trading stock market today
19,GGP,sear also announce formation joint venture general growth property ggp mall operator agreement sear sell store joint venture stake company cash
20,GGP,face stiff competition target tgt online retailer amazon amzn sear have be shedding asset cut cost sear separated land end le clothing business close underperform kmart sear store
21,GGP,follow gillian rich twitter ibd_grich sear holding shld announce wednesday be form real estate investment trust help turn struggle business department store chain expect raise create reit buy sear kmart store then lease back property jan sear own lease sear kmart store share jump premarket trading stock market today sear also announce formation joint venture general growth property ggp mall operator agreement sear sell store joint venture stake company cash face stiff competition target tgt online retailer amazon amzn sear have be shedding asset cut cost sear separated land end le clothing business close underperform kmart sear store follow gillian rich twitter ibd_grich
22,GGP,best mutual fund first quarter performance report nation top perform mutual fund have be court chip big medical select retail stock recent month semiconductor area skywork solution swks technology avgo nxp semiconductor nxpi com technology solution mtsi grab interest top perform mutual fund latest report period smart money have be
23,GGP,stock open hole then dig deeper wednesday datum drive rally china europe
24,GGP,nasdaq tumble dow jone industrial average drop show loss
25,GGP,volume be sharply higher nasdaq higher nyse compare trade same time tuesday
26,GGP,job news do stock market today favor adp march national employment report show job growth weakest last
27,GGP,manufacturing datum be mixed researcher markit report march purchasing manager index rise vs february economist consensus bet mild uptick
28,GGP,institute supply management march ism manufacturing index ease consensus view project dip
29,GGP,construction spending fall second month be less weak february decline vs slip january economist consensus have estimate gain
30,GGP,stock dow component open lower merck mrk nike nke johnson johnson jnj hit hardest none nasdaq stock manage gain bottom list regeneron pharmaceutical regn slip heavy trade pull back test support day move average
31,GGP,twitter twtr rise heavy trade jeffery co initiate coverage stock buy rating price target report note stock be particularly well position benefit online video ad mobile tailwind twitter have be battle clear cup handle buy point
32,GGP,sear shld jump assign property partnership retail reit general growth property ggp sear have post annual loss continue operate store receive cash stake partnership general growth share dip fraction have shape cup handle base late january high
33,GGP,lead stock get weak start nearly ibd list downshifting open only noah holding noah unite therapeutic uthr post narrow gain
34,GGP,ambarella amba take hardest early hit be more left stock bit less most recent buy point stock open hole then dig deeper wednesday datum drive rally china europe nasdaq tumble dow jone industrial average drop show loss volume be sharply higher nasdaq higher nyse compare trade same time tuesday job news do stock market today favor adp march national employment report show job growth weakest last manufacturing datum be mixed researcher markit report march purchasing manager index rise vs february economist consensus bet mild uptick institute supply management march ism manufacturing index ease consensus view project dip construction spending fall second month be less weak february decline vs slip january economist consensus have estimate gain stock dow component open lower merck mrk nike nke johnson johnson jnj hit hardest none nasdaq stock manage gain bottom list regeneron pharmaceutical regn slip heavy trade pull back test support day move average twitter twtr rise heavy trade jeffery co initiate coverage stock buy rating price target report note stock be particularly well position benefit online video ad mobile tailwind twitter have be battle clear cup handle buy point sear shld jump assign property partnership retail reit general growth property ggp sear have post annual loss continue operate store receive cash stake partnership general growth share dip fraction have shape cup handle base late january high lead stock get weak start nearly ibd list downshifting open only noah holding noah unite therapeutic uthr post narrow gain ambarella amba take hardest early hit be more left stock bit less most recent buy point
35,GGP,mall reit head retail outlet center continue take center stage name game new development push come time focus regional mall owner operator have be redevelopment rather ground project many retail tenant be expand price store presence way feed consumer appetite value lift sale profit appear environment outlet center remain strong least enthusiasm part developer owner remain ryan severino senior economist commercial real estate tracker reis tell ibd email outlet center be much more prominent part retail landscape be just year high end mall owner quality shopping center operator be expect perform well year recent report stifel analyst isbee say most new development mall reit have be focuse outlet center outlet center industry be experience build boom deliver outlet center opening well historical average center write simon property group spg tanger factory outlet center skt be dominant outlet center developer add note have robust development pipeline last month tanger joint venture partner start construction newest tanger outlet center southaven miss be locate half mile south tanger say press release announce fourth quarter result tuesday tanger expect center be complete time holiday open construction other new development company intend open be ongoing say current plan include april open tanger outlet savannah grand open tanger outlet foxwood foxwood resort casino mashantucket conn third quarter grand open tanger outlet grand rapid grand rapid mich company joint venture partner expect be able start construction tanger outlet columbus pre development stage project columbus ohio time complete construction open center first half most simon property group new development activity be concentrated outlet center sector isbee say reit open outlet center have new outlet center currently construction include one gloucester tucson ariz tampa fla vancouver british columbia come online isbee say high end retailer jwn be store operator expand price concept rack have rack store have announce plan open new store spokesman dan evan jr tell ibd email interview opening plan year be rack mall louisiana baton la roughly square foot store be schedule open fall mall be own manage general growth property ggp rack be great fit overall strategy serve more customer more place more way say evan rack also allow introduce brand customer have never shop serve customer channel rack store online full price com online price nordstromrack com hautelook hope focuse customer make easy convenient relevant be able improve experience choose shop rack be grow part business online primarily com continue be fastest grow evan say simon property group general growth property tanger factory outlet be part ibd finance property reit industry group simon property group have composite rating possible general growth property have composite rating tanger factory outlet have rating factor several metric such earning growth stock price gain be ibd retail department store industry group have second highest composite rating dd
36,GGP,real estate have be wall street penthouse many investor real estate stock mutual fund gain top other sector gain past month go thursday real estate be also favorite successful investor especially income focuse one past month reit fund advance top sector precious metal
37,GGP,power robust demand lean supply high end mall owner quality shopping center operator be prime perform be ride crest stronger economy healthy consumer spending climate be now lure shopper enhance service experience bright prospect come time star be also align retail industry retailer be head most momentum ve have great recession ken perkin president retail metric tell ibd healthy consumer spending climate retail bode well big mall owner such simon property group spg macerich mac general growth property ggp taubman center tco well community neighborhood shopping center operator owner kimco realty kim benefit tenant get more financially fit mall marketretail mall real estate investment trust be part ibd finance property reit industry group several get high composite rating possible kimco realty have simon property group general growth property factor metric such earning growth stock price gain have run stock market kimco realty share rise be year general growth property jump be simon property group lift be year macro tailwind help mall year be lot momentum stronger economy lower energy price ryan severino senior economist commercial real estate tracker reis reis tell ibd email decline energy add billion spending accrue mall real question be much be enough offset impact store closing top firm still be regional mall reit focus mall sell most square foot tend more upscale retailer trade area real estate expert say class mall continue have low vacancy strong rent growth say severino remainder subsector vacancy actually rise rent growth probably accelerate only slightly year end national mall vacancy rate be basis point rent grow year say severino forecast rent grow roughly national vacancy rate be not likely change much store closure offset rise demand outlook lower caliber mall be murkier say strengthen recovery economy labor market couple decline energy price bolster subsector compete store closing lower caliber mall important retailer such asj penney jcp sear shld class nicolaus analyst isbee be also upbeat prospect mall retailer demand high quality mall space remain robust international domestic retailer write report call high quality mall space be extremely limit general growth property be top regional mall pick reit focus exclusively own manage lease redevelop class regional mall urban flagship location spokesman kevin berry tell ibd say firm believe own retail property position well long term generally add property lease have year term annual contractual increase rent average lease expire say majority annual revenue be place year begin general growth property strategy sandeep mathrani become ceo have be creation redevelopment expansion pipeline project berry say dec firm have development redevelopment activity totale share project totale have open be construction be pipeline redevelopment be tenant drive say berry general largest redevelopment project be ala moana center honolulu be expand new luxury wing anchor bloomingdale jwn general also focus improve shopping experience add option such movie theater restaurant give shopper more reason come mall spend time mall vacancy be currently year low just major market say greg maloney ceo americas retail group commercial real estate firm jone lang lasalle jll cite real estate datum company costar source say mall be go probably best fundamental see past year liquidity appetite product have be here few year now consumer be feel much better economy be drive force add now have positive momentum retailer be look expand new store renew interest term retailer look new space say new mall development first time long time include project jll be do isbee note shopping center reit fundamental be healthy occupancy be approach exceed pre recession level kimco realty be reit rate buy operate north america largest publicly trade portfolio neighborhood community shopping center ceo david henry call fundamental such shopping center strong ve be very fortunate be new build shopping center year tell ibd supply center hasn grow population have grow person year need restaurant grocer dry cleaner other business have grow population occupancy be move vital sign be look good shopping center say add shopping center be still recovery mode rent not back time high say kimco be benefit more demand limit supply henry say occupancy quality center be close kimco time high recession redevelopment vs new mallskimco have be do lot redevelopment say best place invest capital be own property value project pipeline be near most new development mall reit have be concentrated outlet center open say isbee david ober president global outlet management say reason build more outlet center be retailer desire include outlet store part omnichannel distribution mix full price store still garrick brown vice president research property service firm dtz say be near saturation point outlet center build add room only little more product everyone want jump bandwagon build have perform so well recent year say email probably build too many
38,GGP,mall reit head retail outlet center continue take center stage name game new development push come time focus regional mall owner operator have be redevelopment rather ground project many retail tenant be expand price store presence way feed consumer appetite value lift sale profit appear environment outlet center remain strong least enthusiasm part developer owner remain ryan severino senior economist commercial real estate tracker reis tell ibd email outlet center be much more prominent part retail landscape be just year high end mall owner quality shopping center operator be expect perform well year recent report stifel analyst isbee say most new development mall reit have be focuse outlet center outlet center industry be experience build boom deliver outlet center opening well historical average center write simon property group spg tanger factory outlet center skt be dominant outlet center developer add note have robust development pipeline last month tanger joint venture partner start construction newest tanger outlet center southaven miss be locate half mile south tanger say press release announce fourth quarter result tuesday tanger expect center be complete time holiday open construction other new development company intend open be ongoing say current plan include april open tanger outlet savannah grand open tanger outlet foxwood foxwood resort casino mashantucket conn third quarter grand open tanger outlet grand rapid grand rapid mich company joint venture partner expect be able start construction tanger outlet columbus pre development stage project columbus ohio time complete construction open center first half most simon property group new development activity be concentrated outlet center sector isbee say reit open outlet center have new outlet center currently construction include one gloucester tucson ariz tampa fla vancouver british columbia come online isbee say high end retailer jwn be store operator expand price concept rack have rack store have announce plan open new store spokesman dan evan jr tell ibd email interview opening plan year be rack mall louisiana baton la roughly square foot store be schedule open fall mall be own manage general growth property ggp rack be great fit overall strategy serve more customer more place more way say evan rack also allow introduce brand customer have never shop serve customer channel rack store online full price com online price nordstromrack com hautelook hope focuse customer make easy convenient relevant be able improve experience choose shop rack be grow part business online primarily com continue be fastest grow evan say simon property group general growth property tanger factory outlet be part ibd finance property reit industry group simon property group have composite rating possible general growth property have composite rating tanger factory outlet have rating factor several metric such earning growth stock price gain be ibd retail department store industry group have second highest composite rating dd
39,GGP,retailer aim maximize holiday sale get creative store real estate target tgt macy other store operator be try tweak enhance shopping experience make most merchandise crucial season sale number economic holiday retail real estate be retailer try get
40,GGP,re not likely find grinch lurk america shopping center holiday season retailer poise see november december store sale grow fastest clip year be good big mall owner such simon property group spg general growth property ggp macerich co mac taubman center tco benefit
41,GGP,simon property spg post second quarter fund operation beat view early wednesday raise guidance real estate investment trust continue expand large portfolio shopping mall property reap healthy financial return exist one
42,GGP,still share fall slightly early trading stock market todayas reit fall short revenue
43,GGP,simon ffo rise prior year share cent forecast analyst survey thomson reuter still increase be slower gain see prior quarter
44,GGP,simon complete spinoff smaller mall community center washington prime group wpg transaction cost spinoff cent diluted share be include second quarter result
45,GGP,second quarter revenue increase shy estimate
46,GGP,comparable property net income rise year earlier
47,GGP,company also increase full year ffo guidance provide cent range diluted share addition simon up quarterly dividend year year
48,GGP,simon property be part ibd finance property reit industry group also include general growth property ggp washington prime group simon property have highest ep rating group simon property spg post second quarter fund operation beat view early wednesday raise guidance real estate investment trust continue expand large portfolio shopping mall property reap healthy financial return exist one still share fall slightly early trading stock market todayas reit fall short revenue simon ffo rise prior year share cent forecast analyst survey thomson reuter still increase be slower gain see prior quarter simon complete spinoff smaller mall community center washington prime group wpg transaction cost spinoff cent diluted share be include second quarter result second quarter revenue increase shy estimate comparable property net income rise year earlier company also increase full year ffo guidance provide cent range diluted share addition simon up quarterly dividend year year simon property be part ibd finance property reit industry group also include general growth property ggp washington prime group simon property have highest ep rating group
49,GGP,mixed performance stock nice recovery nasdaq result fair amount new high wednesday list still have defensive look name ibd food meat product industry group score new high chicken product maker pilgrim pride ppc add stock continue show relative strength
50,GGP,general growth property second biggest mall owner replace molex standard poor index dow jone index say week general growth ggp be chicago base real estate investment trust market value share have rise compare gain molex ticker
