,ticker,content
289,GGP,macerich company mac free report enjoy premium portfolio presence well capitalize tenant roster additionally company increase adoption omni channel model retail be anticipate enhance shopping experience bolster sale volume tenant store thereby raise demand macerich property notably macerich have high concentration premium mall vibrant market company have be diversify traditional tenant base include several emerge digital store base retailer offer enhance shopping experience company retail center additionally macerich have be focuse aggressive capital recycling program involve divestiture core slower growth asset usage proceed higher growth property acquisition development redevelopment initiative part such measure macerich sell core retail center aggregate proceed moreover company remain track redevelopment pipeline pre lease deal further macerich be aim enhance asset quality well customer relationship go forward expect such move offer upside potential company strengthen high end portfolio nevertheless retail take precedence retail real estate investment trust reit continue suffer mall traffic have take beating fact commerce gain market share brick mortar store retailer be compel reconsider footprint eventually opt store closure other unable cope competition have be filing bankruptcy dreary environment have also result tenant demand substantial lease concession however mall landlord find unjustified such retail reit macerich ggp inc ggp free report kimco realty corp kim free report simon property group spg free report other have be affected company share price have be suffering past month further hike interest rate also challenge company essentially rise rate imply higher borrow cost company affect ability purchase develop real estate lower dividend payout well moreover dividend payout become less attractive compare yield fix income money market account such retail wo share zack rank hold company have underperform industry belong past month see complete list today zack rank strong buy stock here macerich have lose industry growth however zack consensus estimate fund operation share have be revise marginally upward month time note anything related earning present represent fund operation ffo widely used metric gauge performance reit today stock zack hottest strategiesit hard believe even zack market gain top stock pick screen have return outperformance have not just be recent phenomenon year have be remarkably consistent composite yearly average gain strategy have beaten market more maybe even more remarkable be fact re willing share latest stock cost obligation see free
290,GGP,ggp inc ggp free report enjoy portfolio high quality retail property attractive location unite state further tenant roster include number repute name ggp also focus omni channel retail other initiative be encourage nevertheless decline traffic mall store closure bankruptcy have emerge press concern ggp trend be curtail demand retail real estate space company be make effort counter pressure various initiative implementation such measure require decent upfront cost likely limit robust growth profit margin term february retail reit ggp report fourth quarter fund operation ffo share cent beating zack consensus estimate cent figure be also higher prior year quarter tally cent result indicated growth same store net operate income prior year period notably retailer be continuously evolve order maximize revenue be used brick mortar presence internet together ggp be focuse omni channel retail generate higher sale early company invest improve center be provide tenant access retail dine entertainment hub best trade area unite state such move be strategic fit boost shopping experience enhance sale volume tenant store consequently raise demand company asset furthermore ggp have be make effort add residential unit retail center order densify retail center such development lower distance housing retail destination steering dependable traffic recently reuter report asset manager brookfield property partner make revise acquisition offer ggp person familiar matter revise offer boast elevated cash component notably november brookfield offer share cash stock offer acquire remain stake ggp however ggp special board committee reject offer negotiation company be ongoing exact value new offer be not know special board committee have yet offer however retail real estate market have be plague issue downsize bankruptcy retailer recent time be mall traffic continue suffer rapid shift customer shopping preference pattern online purchase grow leap bound have emerge press concern retail reit include simon property group inc spg free report macerich company mac free report federal realty investment trust frt free report ggp other trend be curtail demand retail real estate space considerably curb landlord pricing power occupancy level property moreover such choppy environment have lead tenant demand substantial lease concession mall landlord be find unjustified share zack rank hold stock outperformed industry past month time stock gain compare industry decline see complete list today zack rank strong buy stock here note anything related earning present represent fund operation ffo widely used metric gauge performance reit medical stock buy nowzack name company poise ride medical breakthrough be target cure leukemia aids muscular dystrophy hemophilia other condition new product field be already generate substantial revenue even more wondrous treatment be pipeline early investor realize exceptional profit click here see stock
291,GGP,retail reit ggp inc ggp free report deliver first quarter fund operation ffo share cent miss zack consensus estimate cent figure also come lower prior year quarter tally cent result reflect year year decline same store noi company post revenue lag zack consensus estimate however figure compare favorably year tally quarter detailssame store lease percentage be quarter end initial noi weight rental rate sign lease have commence trail month suite suite basis expand compare rental rate expire lease further tenant sale less anchor inched trail month basis exclude apparel sale increase ggp development redevelopment activity totale project worth be construction pipeline company end first quarter cash cash equivalent dec dividend updateggp announce second quarter common stock dividend cent share dividend be paid jul stockholder record jul takeggp continue upgrade tenant composition customer experience investing recapture anchor box attractive return ggp portfolio high quality retail property attractive location have enabled company enjoy higher rent additionally company continue improve tenant roster be make effort strengthen customer relationship further ggp have be focuse omni channel retail other initiative look encourage notably mar ggp accept revise acquisition offer extend brookfield property partner company have enter definitive agreement brookfield acquire ggp share doesn own yet nearly gain complete ownership second largest mall owner nevertheless grow popularity internet retail remain concern ggp have affected company mall traffic compelling store owner reconsider footprint eventually opt store closure general growth property inc price consensus ep surprise general growth property inc price consensus ep surprise general growth property inc quotecurrently ggp carry zack rank buy see complete list today zack rank strong buy stock here performance other stockstaubman center tco free report report first quarter adjust ffo share surpass zack consensus estimate cent figure also come higher year tally cent simon property group inc spg free report post first quarter ffo share beat zack consensus estimate also report figure come higher prior year tally regency center corporation reg free report first quarter ffo share cent outpaced zack consensus estimate cent further result compare favorably cent report year earlier quarter however result year period include time merger related cost cent share note anything related earning present represent fund operation ffo widely used metric gauge performance reit medical stock buy nowzack name company poise ride medical breakthrough be target cure leukemia aids muscular dystrophy hemophilia other condition new product field be already generate substantial revenue even more wondrous treatment be pipeline early investor realize exceptional profit click here see stock
292,GGP,have be eager see ggp inc ggp free report perform comparison market expectation let quickly scan key fact chicago il base retail real estate investment trust reit earning release morning ffo miss ggp come fund operation ffo share cent miss zack consensus estimate cent result reflect year year decline same store be estimate revision trend company have mixed surprise history beating estimate occasion meeting other average positive surprise be depict graph general growth property inc price ep surprise general growth property inc price ep surprise general growth property inc quoterevenue come lower expectedggp post revenue miss zack consensus estimate however compare favorably year number key development noteggp development redevelopment activity totale however company record decline same store noi year year mar ggp announce have reach agreement brookfield property partner brookfield acquire ggp share doesn own yet nearly gain complete ownership second largest mall owner zack rank saysggp have zack rank buy however latest earning performance be yet be reflect estimate revision rank be subject change see complete list today zack rank strong buy stock here check back later full ggp earning report note anything related earning present represent fund operation ffo widely used metric gauge performance reit medical stock buy nowzack name company poise ride medical breakthrough be target cure leukemia aids muscular dystrophy hemophilia other condition new product field be already generate substantial revenue even more wondrous treatment be pipeline early investor realize exceptional profit click here see stock
293,GGP,ggp inc ggp free report be slate report first quarter result market open fund operation ffo share revenue be anticipate improve year year retail real estate investment trust reit fourth quarter ffo share cent beat zack consensus estimate cent figure be also higher cent post fourth quarter also result reflect year year growth same store net operate income noi precede quarters company surpass estimate occasion meet other average positive surprise be be depict graph general growth property inc price ep surprise general growth property inc price ep surprise general growth property inc quotelet see thing have shape announcement factor consideron mar ggp accept revise acquisition offer extend brookfield property partner brookfield acquire ggp share doesn own yet nearly gain complete ownership second largest mall owner notably ggp continue bear brunt lackluster retail real estate market fact recent datum real estate research firm reis state retail real estate vacancy persist level first quarter additionally mall traffic continue suffer commerce have be increasingly capture market share traditional brick mortar store compelling retailer resort online option file bankruptcy fact first few month year witness several preeminent retail bankruptcy filing record high default retail corporate zack consensus estimate minimum rent underscore decline prior quarter figure further zack consensus estimate overage rent highlight steep sequential plunge nearly nonetheless ggp have solid portfolio high quality retail property attractive location unite state addition have be make effort counter retail pressure various initiative company be focuse omni channel retail generate higher sale moreover be focuse offer mall visitor access retail dine entertainment hub best trade area nation mentioned move be expect boost shopping experience enhance sale volume tenant store consequently raise demand company asset zack consensus estimate revenue be report quarter be peg indicate project growth year period furthermore ggp activity quarter not gain analyst confidence consequently zack consensus estimate ffo share remain unchanged cent past month indicate estimate rise year year earning whispersour proven model do not conclusively show ggp likely beat ffo estimate time be stock need have positive earning esp zack rank strong buy buy least hold happen however be not case here see zack esp ggp have earning esp uncover best stock buy sell re report earning esp filter zack rank ggp have favorable zack rank stock warrant lookhere be few stock reit space want consider model show have right combination element report positive surprise time realty income free report slate release first quarter result have earning esp zack rank see complete list today zack rank stock here retail property america inc rpai free report set report quarterly number have earning esp zack rank store capital corporation stor free report schedule release earning have earning esp zack rank note anything related earning present represent fund operation ffo widely used metric gauge performance reit look stock skyrocket upside zack have just release special report boom investment opportunity legal marijuana ignited new referendum legislation industry be expect blast already robust early investor stand make kill have be ready act know just look see pot trade re target
294,GGP,simon property group spg free report be schedule report first quarter result apr market open fund operation ffo share revenue be anticipate moderately improve year year last report quarter indianapoli base retail real estate investment trust reit post line result term ffo share result reflect high level occupancy increase base minimum rent square foot lease spread square foot company mall premium outlet company also announce hike quarterly dividend moreover trail quarters company exceed zack consensus estimate occasion meet miss other average beat be be depict graph simon property group inc price ep surprise simon property group inc price ep surprise simon property group inc quotelet see thing be shape announcement factor influence resultswhile challenge face retail reit have be well document recent datum reis state retail real estate vacancy remain moderately unchanged first quarter first few month witness several preeminent retail bankruptcy filing record high default retail corporate stability vacancy rate indicate encourage picture retail reit year simon property have be quickly adapt change retail landscape increasingly adopt omni channel strategy overhaul property importantly company be enter several partnership upgrading service amenity provide customer have also re launch brand marketing program strengthen company relationship customer drive traffic effort company beat retail blue raise optimism simon property have re-sort micro retail modele offer store unit range square foot space such move make shopping mall appeal be conducive revenue growth be report quarter further simon property have improve company financial strength amend extend unsecured multus currency revolve credit facility fact credit facility combine exist revolver offer company total revolve credit capacity increase financial flexibility support active redevelopment expansion pipelinefinally share simon property have depreciate versus loss incur industry month time earning quantitative model chance simon property likely beating zack consensus estimate first quarter be high be have right combination key ingredient positive earning esp zack rank hold better be require increase odd earning beat uncover best stock buy sell re report earning esp filterzack esp earning esp simon property be zack rank simon property carry zack rank stock warrant lookhere be few stock reit sector want consider model show have right combination element report positive surprise quarter taubman center inc tco free report slate release earning apr have earning esp zack rank see complete list today zack rank strong buy stock hereggp inc ggp free report schedule release quarterly number have earning esp zack rank buy rlj lodging trust rlj free report set release first quarter result have earning esp zack rank note anything related earning present represent fund operation ffo widely used metric gauge performance reit make fortune shift electric car here stock idea consider much petroleum year lithium power soon shake world create millionaire reshape geo politic soon electric vehicle evs be cheaper gas guzzler be already reach mile single charge battery price plummet charge station set multiply company stand stock buy accord zack research not think see ticker free
295,GGP,current report cycle have already crossed half way mark result be still pour real estate investment trust reit industry fact aug number constituent residential reit avalonbay community inc avb free report datum center reit equinix inc eqix free report retail reit federal realty investment trust frt free report ggp inc ggp free report macerich company mac free report be slate release quarterly figure so far result broader market reveal broad base growth record earning tally abundance positive surprise favorable trend revision front read more earning season past halfway mark nevertheless performance reit sector have so far be mixed result top notch reit stock match estimate beating few other fall shy expectation admittedly rate hike cautious approach investor have deter gain industry so far year however underlie asset category location property play crucial role determine performance reit not player space have equally excel fall fact defy concern supply market residential real estate market be back bang drive robust demand level study real estate technology analytic firm realpage inc rp free report second quarter demand level apartment nation marked third increase level witness year help occupancy remain high mid year lead stabilization annual pace rent growth come close growth experience first quarter notably job formation checked move out buy home act catalyst moreover growth cloud compute internet thing big datum increase number company opt third party infrastructure datum center reit be experience boom market fact demand have be outpace supply top tier datum center market enjoy high occupancy market be absorb new construction faster pace other hand note mall traffic continue decline owing change shopping pattern online purchase have take precedence store purchase have force retailer reconsider strategy shift investment traditional retail online channel optimize brick mortar presence be quite normal retailer do so optimization effort consequent decision close store number reputable retailer macy inc free report sear holding corporation shld jc penney jcp recent month have raise concern cash flow mall landlord also retailer unable cope competition have be filing bankruptcy be result higher vacancy exist mall therefore not player reit space be equally poise excel time predict rely zack methodology combine favorable zack rank zack rank strong buy buy hold positive earning esp uncover best stock buy sell re report earning esp filter proprietary methodology earning esp show percentage difference most accurate estimate zack consensus estimate research show combination rank esp chance positive earning surprise be high stock caution stock zack rank sell rate go earning announcement especially company be see negative estimate revision let have look store reit set release second quarter result wednesday arlington va base residential reit avalonbay be well poise grow back rise demand household formation favorable demographic addition increase consumer confidence back job growth rise wage healthier balance sheet promise bright prospect company company be likely continue experience high occupancy pace rental growth have slow previous year be now likely achieve stability read more avalonbay pull surprise earning avalonbay have earning esp positive esp combine zack rank increase chance positive surprise season trail quarters respect ffo share company surpass estimate occasion miss other result average negative surprise graph depict surprise history company avalonbay community inc price ep surprise avalonbay community inc price ep surprise avalonbay community inc quotenote ep number present represent fund operation ffo share redwood city base datum center reit equinix be global provider network neutral datum center internet exchange service enterprise content company system integrator network service provider company operate various geographical region increase popularity major tech industry player look datum management likely drive revenue second quarter however remain slightly cautious huge capital outlay dent equinix second quarter profitability grow debt burden affect company profitability quarter interest expense go read more equinix post earning offing equinix have earning esp zack rank favorable zack rank increase predictive power esp company esp make surprise prediction difficult however equinix post average positive surprise trail quarters surpass estimate occasion graph depict surprise history equinix inc price ep surprise equinix inc price ep surprise equinix inc quoterockville md base retail reit federal realty portfolio premium retail asset mainly situate major coastal market washington boston san francisco los angele diverse tenant base position well decent growth particularly fast change retail environment company be make concerted effort reposition redevelop re merchandise portfolio include upgrade tenant mix such effort be strategic fit long term however short term adverse impact occupancy net operate income be bypass additionally choppy retail real estate environment be expect adversely affect company performance read more federal realty post earning store presently federal realty have earning esp zack rank increase predictive power esp need have positive esp be confident earning beat trail quarters company surpass estimate occasion miss other result average positive surprise graph depict surprise history company federal realty investment trust price ep surprise federal realty investment trust price ep surprise federal realty investment trust quotechicago il base retail reit ggp inc enjoy robust portfolio high quality retail property attractive location presence renown tenant hence improve economy omni channel retail company be capable generate decent cash flow however online purchase grow rapid pace retail real estate market have be cripple issue bankruptcy downsize retailer be likely curtail demand retail real estate space considerably company have be make effort counter such pressure various initiative such measure require significant upfront cost limit term growth profit margin read more ggp earning disappoint investor ggp inc presently have earning esp also zack rank sell reduce predictive power esp trail quarters ggp inc deliver line performance quarter be depict chart general growth property inc price ep surprise general growth property inc price ep surprise general growth property inc quotesanta monica base retail reit macerich enjoy portfolio premium mall vibrant market presence number well capitalize retailer roster have enabled company maintain stable source rent past few quarters however decrease footfall shift consumer online channel store closure bankruptcy retailer likely mar company performance read more macerich report earning card macerich have earning esp be meaningful lead indicator positive surprise quarter however stock currently carry zack rank actually reduce predictive power esp however macerich surpass estimate trail quarters witness average positive surprise graph depict surprise history macerich company price ep surprise macerich company price ep surprise macerich company quotecheck later full earning release stock note ffo widely used metric gauge performance reit be obtain add depreciation amortization other cash expense net income make fortune shift electric car here stock idea consider much petroleum year lithium power soon shake world create millionaire reshape geo politic soon electric vehicle evs be cheaper gas guzzler be already reach mile single charge battery price plummet charge station set multiply company stand stock buy accord zack research not think see ticker free
