,ticker,content
148,GGP,trading be expect be light choppy most trader remain holiday break update index wait final hour friday muster rally gain still left major index lower week end week winning streak nyse nasdaq first september dow make fourth straight week decline major index also close day move average briefly regain line volume rise wednesday shorten session dow nasdaq fail produce single stock move average volume jone apparel group jny surge prologis pld computer science csc rise major economic release be due monday tuesday see december number chicago purchasing manager index institute supply management index well initial jobless claim datum next week be day trading week market close thursday new year day holiday update stock end slow day moderate gainsby juan carlos major index close moderately higher friday late rally bell nyse composite be dow nasdaq volume rise expect result give wednesday half session gm gm share rise reaction news late wednesday gmac have win clearance become bank hold company energy stock rise crude price climb update index show sign life late tradingby alan elliottindex picked tempo slightly press session high head final hour trading nyse composite pressed ahead energy issue lead exxon mobil xom chevron cvx step advance add coal producer peabody btu massey energy rise top gainer list dow hold gain session high nasdaq composite reversed early loss edge volume also climb session slow remain well wednesday weak action commodity trade mixed oil press february gold jump ounce natural gas backed cent update index refuse budge frail volume alan elliottindex remain little change trading action dwindle afternoon nyse composite dow hold small soft gain nasdaq composite hold loss volume fall further wednesday weak trading action exchange dow issue entire nasdaq moved average volume stock lead decline prologis pld show average volume satellite ground system maker integral system isys gap gain nearly time average trading share sell hard dec company announce request extension full year regulatory filing friday jump be biggest volume move stock small cap left share august high downside sonoco product son slump heavy trading slip support day move average maker paperboard tube packaging construction used have be consolidate september update index narrowly mixed midday tradeby vincent maostock continue chug narrowly mixed fashion midday friday rise dow nyse composite gain nasdaq nasdaq ease respectively only stock nasdaq wynn resort wynn google goog lose more point more stock index gain point more volume exchange be very light ibd firm emergency medical service em rally ambulance provider be work potential double bottom part base base pattern note stock accumulation distribution rating sit suggest little institutional interest athenahealth athn rise emerge day pullback company provide collection record management software health care industry analyst see earning surge current quarter mantech international mant climb regain day move average brisk trade resistance day line lie just ahead service provider earning sale growth slow recent quarters crude oil gain barrel session high update stock mixed muted tradeby vincent maoinvestor business nasdaq slip further negative territory other major index pare gain midday trade exxon mobil xom autozone azo help push gain session peak dow rise nyse composite turnover remain vastly lower board advancer outpaced decliner nyse advancer decliner be even nasdaq aecom technology acm add brisk volume put stock past buy point cup handle base government contractor be featured today edition new america netflix nflx reversed early loss rally online movie firm be form handle stock have resistance just ahead day move average meanwhile crude oil climb first time session february contract rise barrel gold hover just shy ounce update stock hover quiet sessionby alan elliottinvestor business dailyindex trade narrowly mixed figure be light session nasdaq composite slip infosys technology infy provide much drag dow add nyse composite feathered gain general motor gm be only dow component move average volume be nasdaq only average gainer be amazon com amzn volume drag well wednesday sub average level advance decline stock be essentially even oil price be barrel commodity be trading generally higher gold natural gas give ground almost family afam slump better average volume surrender support day move average astrazeneca azn re-cover slip post small gain regain day move average company report wednesday food drug administration have request additional datum company drug seroquel overseas market asia close mixed shanghai composite end fraction hong kong hang seng index slip japan nikkei jump thin trading finish exchange last trading day year week high stock europe be pressured energy stock base astrazeneca ftse london slip afternoon trade update stock mostly higher early tradeby vincent maoinvestor business major stock index open higher friday nasdaq lag early trading rise dow nyse composite nasdaq be mostly unchanged volume be tracking sharply lower board compare wednesday already depress level general motor gm gap surge active trading late wednesday federal reserve approve bid automaker financing unit gmac financial service become bank hold company gmac be now eligible get money government trouble asset relief program plan also significantly reduce ownership stake gm cerberus capital management gmac insituform technology insu rise brisk volume putt pipe maker back buy point cup handle pattern stock clear buy point dec have be unable muster much move panera bread pnra also gain bounce back session lose streak bakery cafe operator be form handle downside general growth property ggp gap tumble standard poor cut reit credit rating elsewhere crude oil jump barrel update stock track higher startby vincent maoinvestor business dailystock be poise higher open friday news not so merry holiday retail sale nasdaq future rise point vs fair value future gain point dow future rally point preliminary datum mastercard spendingpulse say retail sale drop holiday season compare last year exclude auto gas sale fall electronic retailer best buy bby fall pre open discounter target tgt slip wal mart store wmt world largest retailer ease fraction bright side amazon com amzn rise pre market say holiday shopping season have be best ever commerce giant say consumer order more item dec season peak shopping day record pace item second meanwhile new york time nyt be reportedly seek buyer stake new england sport venture own boston red sox team stadium crude oil rebound unite arab emirate agree cut production order comply opec supply curb february contract rise cent barrel earning economic report be due today trading be expect be light choppy most trader remain holiday break
149,GGP,update rally tech issue send stock thursday index waver session nasdaq stay positive session long round late session buy help lock gain
150,GGP,outshine peer nasdaq jump best level early november narrower nasdaq do tad better issue finishing black
151,GGP,rally nyse composite dow
152,GGP,volume end higher board advancer beat decliner nyse nearly nasdaq
153,GGP,several leader have good day
154,GGP,synaptic syna vault heavy trading maker control interface report april analyst see profit rise cent share
155,GGP,shanda interactive snda rally fresh time high chinese online gamer be now almost past buy point cup handle pattern
156,GGP,netease com nte rise record high more double average trade recent day pullback have be meet buy
157,GGP,close google goog deliver earning share ex item year comfortably view share rise hour trading
158,GGP,biogen idec biib deliver earning ex item share nickel view sale grow view share slip hour
159,GGP,citigroup general electric ge allegiant travel algt be due report earning friday
160,GGP,update techs lead market advance
161,GGP,vincent mao
162,GGP,stock finished sharply higher thursday lead big cap tech stock
163,GGP,nasdaq run month high tech bellwether apple aapl amazon com amzn rise research motion rimm climb finishing just shy day move average
164,GGP,meanwhile climb nyse dow
165,GGP,volume rise exchange especially nasdaq
166,GGP,update index ramp late trade
167,GGP,update rally tech issue send stock thursday index waver session nasdaq stay positive session long round late session buy help lock gain outshine peer nasdaq jump best level early november narrower nasdaq do tad better issue finishing black rally nyse composite dow volume end higher board advancer beat decliner nyse nearly nasdaq several leader have good day synaptic syna vault heavy trading maker control interface report april analyst see profit rise cent share shanda interactive snda rally fresh time high chinese online gamer be now almost past buy point cup handle pattern netease com nte rise record high more double average trade recent day pullback have be meet buy close google goog deliver earning share ex item year comfortably view share rise hour trading biogen idec biib deliver earning ex item share nickel view sale grow view share slip hour citigroup general electric ge allegiant travel algt be due report earning friday update techs lead market advanceby vincent maostock finished sharply higher thursday lead big cap tech stock nasdaq run month high tech bellwether apple aapl amazon com amzn rise research motion rimm climb finishing just shy day move average meanwhile climb nyse dow volume rise exchange especially nasdaq update index ramp late trade
168,GGP,update oil commodity topple dollar firm electronic retailer best buy bby slash earning outlook ill omen holiday shopping season treasury secretary henry paulson say government didn plan make purchase illiquid mortgage backed asset index respond nose diving close session lows
169,GGP,nyse composite scour loss nasdaq composite dig dow drag decline
170,GGP,nyse energy index lead decline financial slip amazon com amzn drop pull nasdaq dow citigroup american express axp bank america bac be first canon fire
171,GGP,preliminary datum show volume well tuesday strong level nyse higher nasdaq marked second distribution day row major index make dow apiece nyse nasdaq composite nasdaq end just shy undercut oct low strength decline number distribution day be enough current rally send market officially back correction
172,GGP,mean put tape buy button take close look own lock gain cut loss early give market time shake decide want go next
173,GGP,stock decliner outpunch advance issue nyse nasdaq not industry group track ibd gain ground day very unusual gem miner steel producer coal solar energy play see deepest loss
174,GGP,loneliest stock world be nordic american tanker shipping nat close crude oil tanker fleet operator be back week move average third week gain still face resistance week line attempt climb month correction
175,GGP,downside solar maker take pound ja solar jaso miss earning consensus view receive downgrade standard poor ja solar slip cent
176,GGP,more harrowing first solar fslr shed energy conversion device ener gap plunge stock be close oct low sunpower spwr drop ldk solar ldk surrender
177,GGP,thursday morning initial jobless claim trade deficit datum be tap broader slate economic datum include retail sale natural gas inventory consumer sentiment number be due friday
178,GGP,update slide continue late trading
179,GGP,vincent mao
180,GGP,major stock index hover fresh session lows late wednesday pace third straight day
181,GGP,edt nyse composite be dow nasdaq tumble come point oct trough
182,GGP,volume continue track higher board pace have slow decliner swamp advancer nearly nyse more nasdaq
183,GGP,crude settle barrel gold close ounce
184,GGP,morgan stanley ms drop unveil job cut recently converted bank hold firm plan cut institutional security staff asset manager work force
185,GGP,rival goldman sachs gs have announce own round job cut slide ladenburg thalmann cut price target
186,GGP,citigroup fall single digit territory erased early gain lose year low
187,GGP,meanwhile google goog fall internet giant dip level first time year
188,GGP,ibd component american public education apei give ahead earning report today close online school be slate earn cent share
189,GGP,update stock bounce back midday trade
190,GGP,vincent mao
191,GGP,stock stumble new session lows treasury secretary henry paulson say trouble asset not be purchase originally plan index have rebound
192,GGP,nyse composite be session low be nasdaq dow
193,GGP,turnover be again tracking sharply higher exchange decliner trounce advancer nearly nyse nasdaq
194,GGP,crude oil fall barrel lowest february
195,GGP,best buy bby profit warning weigh tech sector
196,GGP,apple aapl lose trade sixth straight day loss
197,GGP,hewlett packard hpq fall
198,GGP,synaptic syna gap shed active trading slice stock day move average company make control interface electronic device
199,GGP,solar issue take heat cnbc jim cramer tout too expensive light fall oil price
200,GGP,first solar fslr tumble brisk volume
201,GGP,energy conversion device ener gap plunge stock be close oct low
202,GGP,economic worry also hit airline delta dal continental cal dive respectively
203,GGP,update index commodity dollar mixed paulson offer prognosis stock continue drill lower treasury secretary henry paulson argue expand use federal financial relief fund underscored need prop open channel consumer credit
204,GGP,nyse composite have slip dow slump nasdaq composite limp loss
205,GGP,dow american express axp unite technology utx hewlett packard hpq fall hardest general motor gm citigroup be only dow component gain ground
206,GGP,trading volume continue pick tracking higher nyse nasdaq vs tuesday trading level
207,GGP,paulson say economy financial banking system be stronger more stable just few week
208,GGP,propose expand use trouble asset relief program tarp fund make clear market turmoil not abate biggest part mortgage crunch be say purchase illiquid mortgage backed asset be not effective use tarp fund
209,GGP,treasury secretary say government sponsored entity gse primarily freddie mac fre fannie mae fnm now operate stable foot
210,GGP,commodity moved generally lower morning crude future slumping barrel december contract dip low midmorning lowest price front month contract early feb dollar gain euro fall hard vs yen
211,GGP,stock ameron international amn cave add monday pullback week strong gain water chemical transport pipe maker be feel bottom precipitous sell september
212,GGP,upside hologic holx add cent swing high earlier trade diagnostic medical imaging system maker tuesday report flat earning just meet expectation better expect rise sale share be second week gain remain deep month correction
213,GGP,nordic american tanker shipping nat throttle crude oil tanker fleet operator be back week move average third week gain still face resistance week line attempt climb month correction
214,GGP,update stock open lower trimming loss
215,GGP,vincent maoa lower profit outlook best buy overall worry economy send stock early wednesday ve pare loss
216,GGP,nyse composite be dow nasdaq shed
217,GGP,volume be tracking sharply higher nyse slightly higher nasdaq
218,GGP,treasury secretary henry paulson be set provide update tarp financial bailout program
219,GGP,american express axp fall year low reportedly ask government funding
220,GGP,apple aapl slump brisk trade come pressure sixth straight session ipod maker be head test october lows
221,GGP,quality system qsii drop near day move average software maker be biggest percentage loser ibd
222,GGP,upside cephalon ceph rise fast trade drug maker be replace general growth property ggp cephalon be shape cup handle pattern
223,GGP,update stock poise bad open
224,GGP,vincent mao
225,GGP,stock future signale lower start wednesday economic worry continue weigh
226,GGP,nasdaq future shed point vs fair value future lose point dow future drop point
227,GGP,treasury secretary henry paulson give update trouble asset relief program tarp more financial service firm well auto maker be ask government funding
228,GGP,ford general motor gm rise respectively pre market grow belief get bailout fund
229,GGP,best buy bby tumble pre market cut profit outlook cite weak consumer spending macroeconomic factor electronic retailer now expect full year earning range share prior guidance analyst expect share
230,GGP,year retail ve never see such difficult time consumer person be make dramatic change much spend re not immune force best buy president chief operate officer brian dunn say statement
231,GGP,upside macy rise report smaller expect loss exclude item department store retailer lose cent share third quarter vs estimate loss cent sale fall slightly view company also reaffirm full year profit outlook share vs view
232,GGP,fellow department store operator jc penney jcp report friday analyst see earning fall nearly cent share
233,GGP,financial sector american express axp reportedly seek fund government rescue plan late monday dow component win government approval become bank hold company join like goldman sachs gs morgan stanley ms share amex fall pre market
234,GGP,dutch financial service giant ing group ing lose report first ever quarterly loss company lose euro third quarter hurt down euro
235,GGP,crude oil slip cent barrel weekly energy inventory report be thursday update oil commodity topple dollar firm electronic retailer best buy bby slash earning outlook ill omen holiday shopping season treasury secretary henry paulson say government didn plan make purchase illiquid mortgage backed asset index respond nose diving close session lows nyse composite scour loss nasdaq composite dig dow drag decline nyse energy index lead decline financial slip amazon com amzn drop pull nasdaq dow citigroup american express axp bank america bac be first canon fire preliminary datum show volume well tuesday strong level nyse higher nasdaq marked second distribution day row major index make dow apiece nyse nasdaq composite nasdaq end just shy undercut oct low strength decline number distribution day be enough current rally send market officially back correction mean put tape buy button take close look own lock gain cut loss early give market time shake decide want go next stock decliner outpunch advance issue nyse nasdaq not industry group track ibd gain ground day very unusual gem miner steel producer coal solar energy play see deepest loss loneliest stock world be nordic american tanker shipping nat close crude oil tanker fleet operator be back week move average third week gain still face resistance week line attempt climb month correction downside solar maker take pound ja solar jaso miss earning consensus view receive downgrade standard poor ja solar slip cent more harrowing first solar fslr shed energy conversion device ener gap plunge stock be close oct low sunpower spwr drop ldk solar ldk surrender thursday morning initial jobless claim trade deficit datum be tap broader slate economic datum include retail sale natural gas inventory consumer sentiment number be due friday update slide continue late tradingby vincent maothe major stock index hover fresh session lows late wednesday pace third straight day edt nyse composite be dow nasdaq tumble come point oct trough volume continue track higher board pace have slow decliner swamp advancer nearly nyse more nasdaq crude settle barrel gold close ounce morgan stanley ms drop unveil job cut recently converted bank hold firm plan cut institutional security staff asset manager work force rival goldman sachs gs have announce own round job cut slide ladenburg thalmann cut price target citigroup fall single digit territory erased early gain lose year low meanwhile google goog fall internet giant dip level first time year ibd component american public education apei give ahead earning report today close online school be slate earn cent share update stock bounce back midday tradeby vincent maostock stumble new session lows treasury secretary henry paulson say trouble asset not be purchase originally plan index have rebound nyse composite be session low be nasdaq dow turnover be again tracking sharply higher exchange decliner trounce advancer nearly nyse nasdaq crude oil fall barrel lowest february best buy bby profit warning weigh tech sector apple aapl lose trade sixth straight day loss hewlett packard hpq fall synaptic syna gap shed active trading slice stock day move average company make control interface electronic device solar issue take heat cnbc jim cramer tout too expensive light fall oil price first solar fslr tumble brisk volume energy conversion device ener gap plunge stock be close oct low economic worry also hit airline delta dal continental cal dive respectively update index commodity dollar mixed paulson offer prognosis nyse composite have slip dow slump nasdaq composite limp loss dow american express axp unite technology utx hewlett packard hpq fall hardest general motor gm citigroup be only dow component gain ground trading volume continue pick tracking higher nyse nasdaq vs tuesday trading level paulson say economy financial banking system be stronger more stable just few week propose expand use trouble asset relief program tarp fund make clear market turmoil not abate biggest part mortgage crunch be say purchase illiquid mortgage backed asset be not effective use tarp fund treasury secretary say government sponsored entity gse primarily freddie mac fre fannie mae fnm now operate stable foot commodity moved generally lower morning crude future slumping barrel december contract dip low midmorning lowest price front month contract early feb dollar gain euro fall hard vs yen stock ameron international amn cave add monday pullback week strong gain water chemical transport pipe maker be feel bottom precipitous sell september upside hologic holx add cent swing high earlier trade diagnostic medical imaging system maker tuesday report flat earning just meet expectation better expect rise sale share be second week gain remain deep month correction nordic american tanker shipping nat throttle crude oil tanker fleet operator be back week move average third week gain still face resistance week line attempt climb month correction update stock open lower trimming lossesby vincent maoat nyse composite be dow nasdaq shed volume be tracking sharply higher nyse slightly higher nasdaq treasury secretary henry paulson be set provide update tarp financial bailout program american express axp fall year low reportedly ask government funding apple aapl slump brisk trade come pressure sixth straight session ipod maker be head test october lows quality system qsii drop near day move average software maker be biggest percentage loser ibd upside cephalon ceph rise fast trade drug maker be replace general growth property ggp cephalon be shape cup handle pattern update stock poise bad openby vincent maostock future signale lower start wednesday economic worry continue weigh nasdaq future shed point vs fair value future lose point dow future drop point treasury secretary henry paulson give update trouble asset relief program tarp more financial service firm well auto maker be ask government funding ford general motor gm rise respectively pre market grow belief get bailout fund best buy bby tumble pre market cut profit outlook cite weak consumer spending macroeconomic factor electronic retailer now expect full year earning range share prior guidance analyst expect share year retail ve never see such difficult time consumer person be make dramatic change much spend re not immune force best buy president chief operate officer brian dunn say statement upside macy rise report smaller expect loss exclude item department store retailer lose cent share third quarter vs estimate loss cent sale fall slightly view company also reaffirm full year profit outlook share vs view fellow department store operator jc penney jcp report friday analyst see earning fall nearly cent share financial sector american express axp reportedly seek fund government rescue plan late monday dow component win government approval become bank hold company join like goldman sachs gs morgan stanley ms share amex fall pre market dutch financial service giant ing group ing lose report first ever quarterly loss company lose euro third quarter hurt down euro crude oil slip cent barrel weekly energy inventory report be thursday
236,GGP,new issue make good candidate watch list many never become market leader potential reward market new face be significant enough deserve look particularly ve have time establish day move average real estate developer howard hughe corp hhc debut nyse november stock clear handle
237,GGP,many nation top retailer have retool real estate strategy adapt fast change competitive landscape focus get more mileage store
238,GGP,such upscale department store sak sk jwn meant expand outlet location enhance revenue expand customer base
239,GGP,other limit brand ltd have spawn new shop concept retailer such giant discounter target tgt have be expand smaller size store enter more urban market
240,GGP,store chain pursue new strategy wake recession commercial real estate crisis retail real estate market have slowly begin recover
241,GGP,renew interest expansion say john bemis executive vice president retail arm commercial real estate firm jone lang lasalle retailer have open store be look open year many note
242,GGP,be see slow uptick bemis say don think be huge massive explosion retail expansion continue see slow steady growth expansion economic situation continue normalize improve
243,GGP,vacancy rate be regional mall typically store department store anchor second quarter rate top market fall year say real estate research firm reis be third straight quarter decline rent inched fifth straight quarter increase
