,ticker,content
305,GGP,taubman center inc tco free report retail real estate investment trust reit have be limelight bloomberg report reveal elliott management paul singer be preliminary talk company go private share taubman center trade high news surface yesterday ascend market close article cite person familiar matter report accumulate considerable stake company new york domicile hedge fund be advocate strategy change shopping mall giant include dispose company addition mentioned activist fund have less interest taubman center hence avoid regulator disclosure obligation be not first time shareholder significant interest company have attempt garner support target mall owner earlier year land building investment management have attempt oust taubman center board member proxy fight activist fund run litt also suggest retail reit consider cost cut strategy well spin part whole company nevertheless litt fail take rein company lose proxy fight taubman lead director myron ullman iii well chairman chief executive officer robert taubman nov company announce appointment new independent director make change corporate governance similarly brookfield property partner currently own stake ggp inc ggp free report offer take company private brookfield reportedly pay share acquire remain stake ggp read more ggp investor rejoice buyout speculation hit headline late mall traffic have be adversely affected retail landlord include ggp inc regency center corporation reg free report kimco realty corporation kim free report have feel heat due consumer preference increasingly shift online retail have result widespread store closure bankruptcy filing owner challenge time have encourage acquirer take retail reit private favorable term share taubman center have underperform industry belong year date company share have decline industry growth taubman center currently carry zack rank hold see complete list today zack rank strong buy stock here today stock zack hottest strategiesit hard believe even zack market gain top stock pick screen have return respectively outperformance have not just be recent phenomenon year have be remarkably consistent composite yearly average gain strategy have beaten market more maybe even more remarkable be fact re willing share latest stock cost obligation see free
306,GGP,usher good news shareholder agree realty corporation adc free report announce have receive investment grade rating moody investor service particularly rating agency have assign baa issuer rating company stable outlook agree realty cite rating agency baa issuer rating highlight company endure operate history adherence conservative leverage policy solid balance sheet strength sufficient liquidity growth well well laddered debt maturity schedule rating agency also recognize company considerable investment grade tenant roster large pool unencumbered asset healthy net lease portfolio have long term lease nominal lease expiration term confer investment grade credit rating agree realty boost company market be likely enhance investor confidence stock fact such move provide company opportunity enjoy favorable cost debt solid access capital be therefore encourage ownership operation portfolio property state agree realty primarily deal property net lease industry lead retail tenant recently company announce hike quarterly cash dividend now pay dividend cent share mark increase prior dividend payout raise dividend be paid jul shareholder record close business jun notably retail reit have be display lackluster performance traffic property continue suffer due rapid shift consumer shopping preference retail fact commerce grab market share brick mortar store retailer be compel reconsider footprint eventually opt store closure recent year other unable cope competition have be filing bankruptcy result even industry stalwart simon property group inc spg free report ggp inc ggp free report kimco realty corp kim free report have be affected however focus retailer have omni channel strategy value oriented business model service base component agree realty remain well poise navigate broader market blue currently have zack rank hold see complete list today zack rank strong buy stock here moreover company share have appreciate past month outperform industry growth more stock news be bigger iphone become mother technological revolution apple sell mere iphone year new breakthrough be expect generate more device just year create market zack have just release special report spotlight fast emerge phenomenon ticker take advantage don buy now kick click here trade
307,GGP,regency center corporation reg free report recently acquire acre midtown neighborhood raleigh nc announce project midtown east area project be slate open summer project comprise square foot shopping center include wegman grocery store well square foot additional retail also mark wegman first store open door state north carolina project be joint venture regency itb holding llc group local investor be likely grab much attention location regional intersection wake forest road sound accessibility north raleigh midtown downtown be anticipate drive solid footfall also costco wholesale corporation cost free report trader joe be already present regional sub market fact regency have considerable experience retail real estate industry have develop several retail real estate project year also mar regency announce close equity merger deal move create high quality portfolio property mainly grocery anchor regency such strategic acquisition be project boost company long term growth notably mall traffic have be severely affected retail landlord include ggp inc ggp free report taubman center inc tco free report feel heat due consumer preference incline more more online retail however such time regency focus build premium portfolio grocery anchor shopping center be usually necessity drive augur well such center be usually necessity drive drive dependable traffic moreover grocery mark major category consumer spending online retailer amazon com inc amzn free report have make effort penetrate deeper grocery business only minimal percentage grocery shopping take place online addition regency report better expect result third quarter respect fund operation ffo share result be drive robust growth revenue same property net operate income noi company witness stronger lease activity same property portfolio small shop portfolio regency currently have zack rank buy see complete list today zack rank strong buy stock here addition stock have gain past month outperform loss incur industry belong today stock zack hottest strategiesit hard believe even zack market gain top stock pick screen have return respectively outperformance have not just be recent phenomenon year have be remarkably consistent composite yearly average gain strategy have beaten market more maybe even more remarkable be fact re willing share latest stock cost obligation see free
308,GGP,simon property group inc spg free report be make effort boost portfolio quality substantial redevelopment program recently company announce continuation plan recapture former sear location portfolio transform retail fitness dine entertainment hub thereby draw more traffic shopping destination fact earlier april simon property announce company redevelopment plan former sear store major location property include refurbishment plan be brea mall brea burlington mall burlington park mall tx ocean county mall tom river nj ross park mall pittsburgh pa enhancement property include entertainment fitness restaurant dine pavilion residential well new retail brand admittedly rapid shift customer shopping preference online channel have jeopardize traffic flow mall fact commerce grab market share brick mortar store retailer be compel reconsider footprint eventually opt store closure other unable cope competition have be filing bankruptcy tenant be also demand substantial lease concession however mall landlord find unjustified such environment have cast pall retail reit simon property ggp inc ggp free report kimco realty corp kim free report macerich company mac free report other company share price have be suffering past month however simon property be make possible move counter challenge situation company be make heavy investment not only elevate value retail property also explore mixed use development option have gain immense popularity recent year such development lower distance housing workplace retail business other amenity destination hence such development enable company grab attention person prefer live work play same area trend drive development several other city unite state nevertheless implementation such measure require decent upfront cost therefore limit robust growth term profit margin also rate hike have add wo simon property have zack rank hold see complete list today zack rank strong buy stock here stock have slip past month be narrower industry decline more stock news be bigger iphone become mother technological revolution apple sell mere iphone year new breakthrough be expect generate more device just year create market zack have just release special report spotlight fast emerge phenomenon ticker take advantage don buy now kick click here trade
309,GGP,pennsylvania real estate investment trust pei free report better know preit be make possible move strengthen balance sheet company recently announce execution recast revolve credit term loan facility accomplishment transaction prior schedule maturity offer flexibility company term condition remain same exist loan maturity now get extend make company maturity schedule well laddered company now have material debt maturity thus company have accomplish more transaction financing market year so far specifically facility include unsecured revolver year term loan revolver interest rate be unchanged libor range basis point bps base calculation liability gross asset value gav notably rate be bps libor basis company current leverage consider term facility now have year year extension option maturity term loan interest rate be unchanged libor range bps rate be bps libor base company current leverage loan term be year maturity admittedly shrink mall traffic store closure aggressive growth online sale have keep retail reit include preit other simon property group inc spg free report macerich company mac free report ggp inc ggp free report tenterhook furthermore tenant be demand substantial lease concession owing turbulent retail real estate market scenario nonetheless retail reit be counter dreary situation putt effort enhance mall productivity focuse grab attention new productive tenant dispose productive one other hand preit too remerchandising redevelopment anchor repositioning program have re-sort portfolio rejig selling lower productivity mall well other core property past several year company also recently announce scope densification include addition residential unit philadelphia washington dc market hotel unit several property such measure be strategic fit long term effort tend drag margin term therefore choppy retail real estate environment zack rank sell company underperform real estate market past month see complete list today zack rank strong buy stock here share preit have ascend compare real estate market rally today stock zack hottest strategiesit hard believe even zack market gain top stock pick screen have return outperformance have not just be recent phenomenon year have be remarkably consistent composite yearly average gain strategy have beaten market more maybe even more remarkable be fact re willing share latest stock cost obligation see free
310,GGP,asset manager brookfield property partner make revise acquisition offer ggp inc ggp free report accord report reuter person familiar matter revise offer boast elevated cash component november brookfield offer share cash stock offer acquire remain stake ggp however ggp special board committee reject offer negotiation company be ongoing exact value new offer be not know special board committee have yet offer brookfield want buy remain stake ggp largest owner shopping center unite state take company private move acquire ggp brookfield come surprise retail real estate market have be plague issue downsize bankruptcy retailer be mall traffic continue suffer rapid shift customer shopping preference pattern online purchase grow leap bound have emerge press concern retail reit ggp trend be curtail demand retail real estate space considerably curb landlord pricing power occupancy level property moreover such choppy environment have lead tenant demand substantial lease concession mall landlord be find unjustified however combination ggp brookfield make combine company largest company world turn help negotiating better tenant share ggp outperformed industry past month time stock gain compare industry decline ggp currently have zack rank hold stock worth looka few better rank stock real estate industry include arbor realty trust abr free report extra space storage inc exr free report sotherly hotel inc soho free report stock carry zack rank buy see complete list today zack rank strong buy stock here arbor realty trust zack consensus estimate ffo share have be revise upward cent past month share price rise month time extra space storage ffo share estimate current year have moved month time share gain past month sotherly hotel ffo share estimate have be revise approximately upward past month stock gain past month note anything related earning present represent fund operation ffo widely used metric gauge performance reit more stock news be bigger iphone become mother technological revolution apple sell mere iphone year new breakthrough be expect generate more device just year create market zack have just release special report spotlight fast emerge phenomenon ticker take advantage don buy now kick click here trade
311,GGP,follow bloomberg report outlined potential buyout ggp inc ggp free report share retail real estate investment trust reit ascend more tuesday report cite person familiar matter asset manager brookfield asset management inc have hold preliminary talk ggp inc increase ownership stake shopping mall investor take company private company have discuss possible premium ggp inc share price start week takeover deliberation be nascent stage be possibility pricing change deal be call currently brookfield own stake domicile company brookfield first acquire interest ggp inc back company trouble bankruptcy time january acquire additional ggp warrant agree limit ownership company year third quarter brookfield real estate unit exercise outstanding ggp warrant purchasing share total consideration agreement restrict asset manager increase stake threshold limit expire january hence now company have complete flexibility increase ownership ggp inc bid takeover interestingly report have earlier surface january accord brookfield be consider take retail reit private notably ggp inc have portfolio high quality retail property prospective location unite state well capitalize tenant roster well follow buyout news other mall reit simon property group spg free report macerich company mac free report taubman center inc tco free report rejoice company share also trade higher news share simon climb regular trading session nov share macerichwere taubman stock also rally yesterday trading session retail real estate market have be plague issue downsize bankruptcy retailer recent time be mall traffic have be shrink considerably rapid shift consumer shopping pattern retail take center stage have emerge key concern retail reit ggp trend be curtail demand retail real estate space significantly limit landlord pricing power occupancy level property share ggp inc have underperform industry belong year date company share have lose industry growth period further ggp inc currently carry zack rank hold see complete list today zack rank strong buy stock here wall street next amazonzack evp kevin matra believe familiar stock have only just begin climb become greatest investment time once generation opportunity invest pure genius click detail
312,GGP,ggp inc ggp free report deliver third quarter fund operation ffo share cent meeting zack consensus estimate figure also come higher prior year quarter tally cent result reflect growth same store net operate income noi prior year period ggp inc post revenue comfortably surpass zack consensus estimate compare favorably year number general growth property inc price consensus ep surprise general growth property inc price consensus ep surprise general growth property inc quotenote ep number present chart represent fund operation ffo share quarter detailssame store lease percentage be quarter end initial noi weight rental rate sign lease have commence trail month suite suite basis expand compare rental rate expire lease further tenant sale less anchor inched trail month basis company end report quarter cash cash equivalent dec portfolio activitydure third quarter ggp inc complete deal seritage growth property consideration company also increase ownership street fifth avenue fifth avenue respectively ggp inc development redevelopment activity quarter totale project worth be construction pipeline fourth quarter company project ffo share range cent zack consensus estimate same be currently peg cent takeamid challenge retail environment ggp inc line result regard ffo report quarter be encourage furthermore robust growth minimum rent well management fee other corporate revenue aid revenue growth admittedly mall traffic continue suffer online purchase grow leap bound have make retailer reconsider footprint eventually opt store closure file bankruptcy recent time ggp inc be focuse omni channel retail generate higher sale however effort be anticipate limit robust growth company profit margin term ggp inc currently have zack rank hold see complete list today zack rank strong buy stock here stock have lose year date underperform loss incur industry belong be now look forward earning release regency center corporation reg free report taubman center inc tco free report outfront medium inc free report be expect report upcoming day note ffo widely used metric gauge performance reit be obtain add depreciation amortization other cash expense net income wall street next amazonzack evp kevin matra believe familiar stock have only just begin climb become greatest investment time once generation opportunity invest pure genius click detail
313,GGP,month have go last earning report general growth property inc ggp free report share have lose time frame recent negative trend continue lead next earning release be ggp due dive investor analyst have react late let take quick look most recent earning report order get better handle important driver ggp ffo beat estimate revenue missggp deliver fourth quarter ffo share cent beating zack consensus estimate cent figure also come higher prior year quarter tally cent result reflect growth same store noi prior year period company post revenue miss zack consensus estimate however figure compare favorably year tally full year ffo share come prior year number however revenue edge prior year period quarter detailsame store lease percentage be quarter end initial noi weight rental rate sign lease have commence trail month suite suite basis expand compare rental rate expire lease further tenant sale less anchor edge trail month basis exclude apparel sale increase moreover holiday sale november december inched exclude apparel sale increase ggp development redevelopment activity totale project worth be construction pipeline company end year cash cash equivalent dec company do not provide guidance note board receive unsolicited proposal brookfield property partner late dividend updateggp also announce first quarter common stock dividend cent share dividend be paid apr stockholder record apr have estimate be move then analyst be quiet last month period none issue earning estimate revision general growth property inc price consensus general growth property inc price consensus general growth property inc quotevgm scoresat time ggp have nice growth score be lag lot momentum front charting somewhat similar path stock be allocate grade value side putt bottom investment strategy overall stock have aggregate vgm score aren focuse strategy score be be interested company stock be suitable solely growth base style score outlookggp have zack rank hold expect line return stock next few month
314,GGP,retail reit federal realty investment trust frt free report be likely remain growth curve backed premium retail asset diverse tenant base effort improve operate performance expansion renovation re tenanting support long term profitability however choppy retail real estate environment portfolio redevelopment effort limit company growth tempo term recently federal realty report fourth quarter adjust fund operation ffo share line zack consensus estimate adjust ffo share also compare favorably prior year quarter tally result reflect growth revenue however company proactive release effort reposition property have adverse impact quarterly result specifically federal realty have portfolio premium retail asset mainly situate major coastal market washington boston san francisco los angele position well decent growth again due strong demographic fill nature property company have be able maintain high occupancy rental rate addition federal realty have decent balance sheet position ample liquidity be continue effort boost shareholder wealth company have paid uninterrupted dividend inception compound annual growth rate dividend increase past year be give company financial position lower debt equity ratio compare industry dividend rate be expect be sustainable however shrink footfall mall shift consumer online channel store closure bankruptcy retailer have emerge press concern most retail reit include simon property group inc spg free report ggp inc ggp free report macerich company mac free report federal realty other additionally fast change retail environment company be make commendable effort reposition redevelop re merchandise portfolio include upgradation tenant mix repositioning redevelopment be strategic fit long term growth such initiative involve considerable upfront cost tend drag term profitability fact company proactive release effort reposition property have adverse impact recently report quarterly result moreover rise interest rate challenge federal realty be company ability refinance exist debt be restrict interest cost new debt increase adversely affect company financial result consequently dent dividend payout also dividend payout become less attractive yield fix income money market account share federal realty have underperform industry belong past month depreciate loss incur industry nevertheless reflect bullish analyst sentiment stock have see zack consensus estimate ffo share first quarter be revise upward month time see complete list today zack rank strong buy stock here note anything related earning present represent fund operation ffo widely used metric gauge performance reit make fortune shift electric car here stock idea consider much petroleum year lithium power soon shake world create millionaire reshape geo politic soon electric vehicle evs be cheaper gas guzzler be already reach mile single charge battery price plummet charge station set multiply company stand stock buy accord zack research not think see ticker free
