,ticker,content
160,HII,lockheed martin corp lmt free report segment space system recently secure modification contract development hypersonic conventional strike weapon contract be award air force life cycle management eglin air force base florida detail dealper term lockheed martin offer design engineering system integration test logistic plan aircraft integration support element hypersonic conventional air launch stand weapon operation related deal be carry huntsville al lockheed martin utilize fiscal research development test evaluation fund finance task brief note hypersonic weapona hypersonic weapon consider high speed maneuvering weapon be missile travel time faster speed sound extraordinary speed precision help hypersonic weapon hit target anywhere world less hour accord cnbc currently type hypersonic weapon be development hypersonic cruise missile hypersonic glide vehicle hypersonic cruise missile fly altitude foot hypersonic glide vehicle fly foot viewreportedly unite state russia china be forerunner develop hypersonic weapon however russia china have moved ahead unite state hypersonic weapon technology innovation result case such weapon be deploy soil nation doesn have sufficient defense protect fact air force gen john hyten have expressed doubt regard ability defend such weapon turn constrain military global presence impede ability project force key region consequently government be pursue development range hypersonic weapon ensure superiority china russia grow hypersonic arsenal be evident fiscal defense budget provision increase research development fund include upgrading country hypersonic technology such investment hypersonic weapon latest contract surely boost lockheed martin top line day ahead price martin stock have return year compare broader industry gain have be cause intense competition company face aerospace defense space broad portfolio product service domestically well internationally zack rank key pickslockheed martin carry zack rank hold few better rank stock same sector be curtiss corporation cw free report huntington ingall hii free report boee ba free report curtiss sport zack rank strong buy huntington ingall boee carry zack rank buy see complete list today zack rank stock here curtiss record average positive earning surprise last quarters zack consensus estimate earning have rise cent last day huntington ingall record average positive earning surprise last quarters zack consensus estimate earning have rise last day boee post average positive earning surprise last quarters zack consensus estimate earning have rise last day hottest tech mega trend year generate global revenue predict blast roof fame investor mark cuban say produce world first trillionaire still leave plenty money regular investor make right trade early see zack best stock play trend
161,HII,huntington ingall industry inc hii free report operate integrate energy company be interesting play investor be not only do stock have decent short term momentum be see solid activity earning estimate revision front well positive earning estimate revision suggest analyst be become more optimistic hii earning come quarter year fact consensus estimate have moved sharply higher time frame past week suggest huntington ingall be solid choice investor current quarter estimate hiiin past day estimate have go higher huntington ingall none have go lower same time period trend have be pretty favorable too estimate increase share day today move current year estimate hiimeanwhile huntington ingall current year figure be also look quite promising estimate move higher past month compare none lower consensus estimate trend have also see boost time frame increase share day share today increase huntington ingall industry inc price consensus huntington ingall industry inc price consensus huntington ingall industry inc quotebottom linethe stock have also start move higher lately add past week suggest investor be start take note impressive story so investor want consider zack rank strong buy stock profit future see complete list today zack rank stock here hottest tech mega trend last year generate global revenue predict blast roof fame investor mark cuban say produce world first trillionaire still leave plenty money regular investor make right trade early see zack best stock play trend
162,HII,subsidiary unite launch alliance ula joint venture lockheed martin corp lmt free report boee co ba free report secure contract satellite launch service term unite launch service llc ul subsidiary deliver afspc afspc satellite intend orbit detail dealaward contract division launch system enterprise directorate space missile system center los angele air force base be value modification contract ul carry launch vehicle production mission integration launch operation spaceflight certification afspc afspc mission operation be complete march deliver afspc satellite afspc satellite be deliver post completion operation june task related contract be execute centennial co decatur al cape canaveral fl ul utilize fiscal space procurement well fiscal research development test evaluation fund complete operation ulaformed ula provide government affordable reliable assured access space have launch vehicle atla delta iv delta ii ula launch vehicle have play major role space venture high commitment crew safety mission success viewul have be serve nation launch service provider delta iv atla rocket more decade subsidiary incorporate latest technology ensure mission success reasonable cost date ul have successfully launch more satellite orbit provide critical information military enable personal device base gps navigation increase number threat cyber security space military satellite afspc afspc have emerge integral component national security enhance defense capability unite state have be make major investment especially president trump tenure recently release fiscal defense budget propose provision space investment strengthen nation space capability include launch vehicle satellite indicate possibility more contract win boost growth trajectory boee lockheed martin price martin share have gain last year compare broader industry rally be cause intense competition domestic international market meanwhile boee share have gain compare broader industry rally outperformance be attribute demand military jet robust worldwide demand commercial aircraft zack rank key pick boee sport zack rank strong buy lockheed martin carry zack rank hold few top rank stock same sector be huntington ingall hii free report spirit aerosystem spr free report sporting zack rank see complete list today zack rank stock here huntington ingall deliver average positive earning surprise last quarters zack consensus estimate earning have rise last day spirit aerosystem have average positive earning surprise last quarters zack consensus estimate earning rise cent last day hacker put money portfolio earlier month credit bureau equifax announce massive datum breach affect american cybersecurity industry be expand quickly response similar event stock be better investment other zack have just release cybersecurity investor guide help zack com reader make most year investment opportunity create hacker other threat reveal stock worth look right away download new report now
163,HII,raytheon company rtn free report recently secure contract federal business opportunity design testing deploy barracuda mine neutralization system contract be award naval sea system command washington dc majority operation related deal be carry portsmouth ri deleon spring fl raytheon utilize fiscal research development test evaluation navy fund partially finance task work related deal be schedule be complete november cumulative value contract amount option include deal be exercise brief barracuda mine neutralization systema mine neutralizer be small unmanned underwater vehicle uuv typically explosive warhead navigate know location ocean mine locate water surface tether bottom attach ocean bottom barracuda mine neutralization system be expendable semi autonomous uuv used identify neutralize bottom surface drift sea mine navy expect be expendable modular neutralizer consist mechanism propulsion sensor communication buoy enable wireless communication deployment platform favore raytheon seaborne mine remain major threat naval maritime force worldwide raytheon mine neutralization system be specifically design counter such threat neutralize moor bottom mine used helicopter make mine clearance safer geopolitical tension keep rise globe be grow trend nation worldwide increase warfare budget strengthen defense system result defense giant raytheon benefit great deal navy force bank mine neutralization system safety ship submarine turn tend boost revenue defense contractor raytheon evidently company record fourth quarter revenue mark year year growth expect latest mine neutralization contract drive company revenue day ahead well moreover february president trump propose fiscal defense budget provision investment ground system raytheon be unite state top missile maker be allocate missile defense believe development latest contract win enable increase growth prospect raytheon day come price stock have return last month compare broader industry gain outperformance be primarily lead strong domestic international sale robust balance sheet zack rank key pickslockheed martin carry zack rank hold few better rank stock same sector be huntington ingall hii free report curtiss corporation cw free report boee ba free report curtiss sport zack rank strong buy huntington ingall boee carry zack rank buy see complete list today zack rank stock here huntington ingall record average positive earning surprise last quarters zack consensus estimate earning have rise last day curtiss record average positive earning surprise last quarters zack consensus estimate earning have rise cent last day boee post average positive earning surprise last quarters zack consensus estimate earning have rise last day hacker put money portfolio earlier year credit bureau equifax announce massive datum breach affect american cybersecurity industry be expand quickly response similar event stock be better investment other zack have just release cybersecurity investor guide help zack com reader make most year investment opportunity create hacker other threat reveal stock worth look right away download new report now
164,HII,textron inc txt free report report first quarter earning continue operation cent share beat zack consensus estimate cent earning be cent year quarter textron inc price consensus ep surprise textron inc price consensus ep surprise textron inc quote revenuestotal revenue quarter be surpass zack consensus estimate report revenue also improve year figure higher contribution bell textron aviation industrial segment manufacturing revenue be revenue finance division decline segment aviation revenue quarter rise year quarter due higher price volume company deliver jet last year commercial turboprop previous year segment register profit first quarter year quarter due favorable volume mix performance price order backlog end quarter review be sequentially bell segment revenue be year level higher military volume partially offset lower commercial revenue segment profit be primarily due higher volume bell order backlog end quarter be precede quarter textron system revenue quarter come year mainly lower volume weapon sensor related discontinuance sfw production segmental profit improve due improve performance marine land textron system backlog end quarter be line fourth quarter industrial segmental revenue grow primarily drive favorable foreign exchange arctic cat acquisition higher volume business line segmental profit be due timing arctic cat acquisition prior year finance finance segment revenue decline profit increase financialsas mar cash cash equivalent be compare dec cash outflow operate activity totale end first quarter compare prior year quarter capital expenditure report quarter be compare apr long term debt be mar dec guidancetextron have reiterate guidance company continue expect earning share continue operation range zack ranktextron carry zack rank hold see complete list today zack rank strong buy stock here upcoming peer releasesgeneral dynamic gd free report be expect report first quarter result apr boee ba free report be also slate report first quarter result apr huntington ingall hii free report be expect report first quarter result hacker put money portfolio earlier year credit bureau equifax announce massive datum breach affect american cybersecurity industry be expand quickly response similar event stock be better investment other zack have just release cybersecurity investor guide help zack com reader make most year investment opportunity create hacker other threat reveal stock worth look right away download new report now
165,HII,general dynamic corp gd free report subsidiary electric boat recently clinch modification contract worth supply long lead time material construction fiscal fiscal virginia class submarine detail dealmajority work related deal be carry sunnyvale rest be execute different part unite state well loanhead unite kingdom contract be award naval sea system command washington dc term deal offer long lead time material steam electric plant component main propulsion unit effort ship service turbine generator effort miscellaneous hull mechanical electrical system component fiscal shipbuilding conversion navy fund be utilize complete task january brief note virginia class virginia class submarine program be class nuclear power fast attack submarine serve navy submarine be design broad spectrum open ocean littoral mission jointly construct general dynamic huntington ingall industry hii free report submarine be also design intelligence surveillance reconnaissance operation well mine warfare vessel be class attack submarine used navy other be los angele class seawolf class value submarine be operational viewgeneral dynamic be only contractor world equip build nuclear power submarine enjoy dominant position navy contractor nation be strategically strengthen arsenal naval power upgrading submarine widespread geo political tension loom large notably electric boat be prime contractor navy virginia class submarine program continue operate submarine year construction rate have deliver virginia class submarine end conjunction huntington ingall impressively delivery lead virginia class submarine cost time deliver follow ship have be reduce consistently significantly month month improve mission capability quality ship time delivery remain submarine contract be schedule reflect company have opportunity more such contract latest relation support construction submarine turn provide impetus growth story recently announce budget proposal make trump provision spending shipbuilding latest budget include buy virginia class submarine general dynamic be prime contractor turn be expect further strengthen company position nuclear power submarine industry price performancein year time general dynamic share have rally compare broader industry gain have be lead intense competition company face aerospace defense space zack rank key picksgeneral dynamic have zack rank hold better rank stock same industry be boee ba free report wesco aircraft holding wair free report boee sport zack rank strong buy wesco aircraft carry zack rank buy see complete list today zack rank stock here boee deliver average positive earning surprise last quarters zack consensus estimate earning moved past day wesco aircraft post positive earning surprise last quarter zack consensus estimate earning moved north cent past day zack top stock addition stock discuss know finest buy hold ticker entirety last year zack top stock portfolio produce double digit winner include fmc corp vmware rac stellar gain now brand new portfolio have be handpick company cover zack rank don miss chance get long term buy access zack top stock today
166,HII,embraer sa erj free report report fourth quarter adjust earning cent american depository share ad miss zack consensus estimate cent bottom line also plunge year quarter bar time item company post gaap earning cent share compare prior year quarter embraer empresa brasileira aeronautica price consensus ep surprise embraer empresa brasileira aeronautica price consensus ep surprise embraer empresa brasileira aeronautica quote embraer deliver adjust earning share fall short zack consensus estimate year figure revenuesembraer fourth quarter revenue come miss zack consensus estimate top line also decline year year primarily lower delivery commercial aviation segment decrease revenue defense security segment revenue company commercial aviation segment be executive jet segment witness decline defense security segment same decrease year year company revenue totale lag zack consensus estimate report figure be compare year order deliveryembraer deliver total jet quarter year year delivery commercial aviation market business aviation market include jet respectively fourth quarter company have deliver jet commercial aviation market jet business aviation market totale delivery jet year notably embraer report delivery jet compare year period reflect decline delivery commercial business aviation market include jet respectively compare jet jet previous year meanwhile delivery executive aviation market include light large executive jet however full year delivery number meet company guidance fourth quarter embraer commercial aviation unit supply jet rest be deliver business aviation include light large jet embraer commercial aviation unit supply jet rest be deliver business aviation include light large jet markedly embraer exit backlog order worth lower last year operational highlightsin fourth quarter embraer cost sale service be year additionally company gross profit decline embraer post quarterly adjust earning interest taxe depreciation amortization ebitda compare prior year quarter financial updatea dec company cash cash equivalent be compare dec end embraer have net debt reflect improvement end net cash inflow operate activity be compare year company adjust free cash flow be end compare outflow previous year embraer expect generate revenue range defense security revenue be project band commercial aviation revenue be envision lie executive jet segment company anticipate revenue furthermore company anticipate deliver jet commercial aviation segment light jet large jet executive jet segment expect ebit margin range ebitda margin band embraer expect invest include capital expenditure zack rankembraer carry zack rank hold see complete list today zack rank strong buy stock here peer ingall industry hii free report fourth quarter adjust earning share surpass zack consensus estimate however bottom line decline year lockheed martin lmt free report fourth quarter adjust earning continue operation be share surpass zack consensus estimate raytheon rtn free report fourth quarter adjust earning continue operation be share outpaced zack consensus estimate don even think buy bitcoin read most popular cryptocurrency sky-rocket last year give investor chance bank return even more gain however come serious volatility risk bitcoin sank more time zack have just release new special report help reader capitalize explosive profit potential bitcoin other cryptocurrency significantly less volatility buy directly see crypto related stock now
167,HII,lockheed martin corp lmt free report recently secure modification contract enhance terminal high altitude area defense thaad phased array tracking intercept target patriot advanced capability pac missile segment term lockheed martin also help develop patriot launch remote lor contract be award army contract command redstone arsenal alabama operation related deal be carry grand prairie tx lockheed martin utilize fiscal research development test evaluation fund partially fund task work related deal be schedule be complete feb brief note thaad thaad be missile system used hit approach shoot short medium intermediate ballistic missile terminal phase have mission success flight testing pac missile system be long range air defense medium high altitude guide missile system design counter tactical ballistic missile cruise missile advanced aircraft favore lockheed martin be pentagon largest contractor lockheed martin regularly win contract varied missile segment include thaad pac missile february company win contract production pac enhancement missile end january clinch deal production delivery interceptor thaad weapon system such inflow order varied missile boost lockheed martin top line evidently company missile fire control mfc segment record net sale fourth quarter reflect solid improvement year quarter moreover february president trump propose fiscal defense budget provision investment plan varied missile program lockheed martin be expect gain significantly provision include investment plan thaad missile procurement aegis ballistic missile defense system believe development latest contract win enable lockheed martin mfc segment deliver similar solid performance first quarter well price movement lockheed martin stock have return year compare broader industry gain have be cause intense competition company face aerospace defense space broad portfolio product service domestically well internationally zack rank key pickslockheed martin carry zack rank hold few better rank stock same sector be huntington ingall hii free report curtiss corporation cw free report boee ba free report curtiss sport zack rank strong buy huntington ingall boee carry zack rank buy see complete list today zack rank stock here huntington ingall record average positive earning surprise last quarters zack consensus estimate earning have rise last day curtiss record average positive earning surprise last quarters zack consensus estimate earning have rise cent last day boee post average positive earning surprise last quarters zack consensus estimate earning have rise last day hacker put money portfolio earlier year credit bureau equifax announce massive datum breach affect american cybersecurity industry be expand quickly response similar event stock be better investment other zack have just release cybersecurity investor guide help zack com reader make most year investment opportunity create hacker other threat reveal stock worth look right away download new report now
168,HII,raytheon company rtn free report recently secure contract deliver patriot missile system poland country sign letter offer acceptance loa agreement government missile system contract turn be poland biggest arm deal date also make nation nato member rely raytheon patriot system reuter deal value require raytheon deliver patriot system battery fire unit be major achievement raytheon spite state department have clear potential sale patriot defense system poland last november deal get stick cross border negotiation agreement raytheon continue work polish defense company help build key part missile system rationale dealit be widely anticipate poland sign deal strengthen defense capability rise threat russia accord nato planner russia be used baltic enclave kaliningrad well crimea block nato air access baltic state represent third poland naturally deal form part poland defense strategy brace wrath russia third nation current weaponry date back time cold war viewraytheon patriot system not only have strong share domestic market alone also expand international realm recent time nation qatar korea kuwait other regard sweden be expect sign loa mid approximately worth inevitably raytheon frequently enjoy solid inflow missile contract overseas latest deal poland be evidence ofthat moreover raytheon hope polish purchase patriot open new opportunity company supply more modern patriot system germany have not yet sign contract lockheed martin mead system germany do sign deal purchase patriot future surely raytheon international sale growth get solid boost increase geopolitical tension worldwide president trump propose fiscal defense budget provision missile defense last month demand such improve weaponry have be rise raytheon be top missile maker unite state surely be significant beneficiary propose budget also include investment plan patriot missile segment enhancement price stock have return last month compare broader industry gain outperformance be primarily lead strong domestic international sale robust balance sheet zack rank key pick raytheon currently carry zack rank hold few better rank stock same space be boee ba free report huntington ingall hii free report curtiss corporation cw free report sporting zack rank strong buy see complete list today zack rank stock here boee record average positive earning surprise last quarters zack consensus estimate earning have rise last day huntington ingall record average positive earning surprise last quarters zack consensus estimate earning have rise last day curtiss corporation have average positive earning surprise last quarters zack consensus estimate earning rise last day investor alert breakthrough pendinga medical advance be now flashpoint theory realization billion dollar research have pour company be already generate substantial revenue even more wondrous product be pipeline cure variety deadly disease be sight so be big potential profit early investor zack name stock buy now click here see
