,ticker,content
297,HII,general dynamic corp gd free report subsidiary electric boat corp have clinch special complete design integrate product process development columbia class ballistic missile submarine ssbns contract have be award naval sea system command washington contract cover development component technology effort related missile tube module reactor compartment bulkhead prototyp manufacturing unite kingdom strategic weapon support system kit manufacturing columbia class ballistic missile submarine notably deal have be be award general dynamic electric boat division currently own wholeworkforce nuclear ballistic missile submarine design engineering datum environment support achievement highly specialize submarine design product integration effort require meet contemplated technical schedule contract requirement majority work be perform groton ct rest be perform newport news few other place unite state be complete used shipbuilding conversion navy fiscal research design test evaluation navy unite kingdomfundsby december columbia class columbia class submarine program formerly know ohio replacement submarine program be design navy replace exist force trident arm ohio class ballistic missile submarine new class ballistic missile submarine ssbns originally build electric corp columbia class submarine be operated unite kingdom russia china france india navy submarine unify build strategy sub columbia class submarine be jointly construct general dynamic electric boat huntington ingall industry inc hii free report newport news division navy request general dynamic continue be prime contractor design build columbia class boat viewgeneral dynamic enjoy dominant position navy contractor be be only contractor world equip build nuclear power submarine company be prime contractor development virginia class submarine class nuclear power submarine give navy recent acknowledgement columbia class program top priority huge budget allot same modification contract undoubtedly render company lead position nuclear power submarine industry defense scenario help industry grow cross border tension due north korea continuous nuclear test radical terrorism have boost defense sector recent time also recent budgetary amendment country have favoured defense giant general dynamic boee company ba free report lockheed martin corporation lmt free report other factor be expect rake more order company long run recently senate arm service committee approve fiscal defense policy bill national defense authorization act fiscal worth include boost navy shipbuilding notably bill be expect boost revenue growth general dynamic be prime shipbuilder unite state price movementshare general dynamic have rally year underperform industry gain have be cause earlier budget cut inflict government defense space zack rankgeneral dynamic currently carry zack rank hold see complete list today zack rank strong buy stock here trade profit big league trump policiesif stock spark interest look company prime make substantial gain washington change course today zack reveal ticker benefit new trend streamline drug approval tariff lower taxe higher interest rate spending surge defense infrastructure see buy recommendation now
298,HII,senate have approve national defense authorization act provide necessary funding military carry activity homeland overseas bill authorize national defense spending overseas contingency operation defense expenditure fiscal be expect exceed fiscal level nearly defense spending approve senate be higher president trump have request present defense asset be engage hostile situation iraq afghanistan other location rise threat isis increase north korean display military strength be cause discomfort unite state ally japan go say increase defense spending result more order company operate industry apart unite state japan be also plan increase defense spending counter north korean threat investing defense stock be lucrative option investor give prospect solid return space last year zack aerospace defense industry have gain significantly outperform rally defense stock focuslockheed martin corp lmt free report possess high profile missile defense program include terminal high altitude area defense system joint light tactical vehicle pac missilesthe company currently carry zack rank hold project earning share ep growth rate next year be zack consensus estimate current year earning have moved last day new defense bill authorize procure joint strike fighter aircraft exceed administration request aircraft lockheed be manufacturer different variant joint strike fighter be go gain approval company be also manufacturer aircraft hence benefit authorization procure mc aircraft be surpass administration request aircraft boee co ba free report product portfolio spread military aircraft network space system global service support be poise gain new approval boee have zack rank buy stock see complete list today zack rank strong buy stock hereit project ep growth rate next year be zack consensus estimate current year earning increase last day new bill authorize procure kc tanker be tanker more administration request also authorize army helicopter include nearly different variant chinook helicopter boee be go directly benefit development northrop grumman corporation noc free report provide system product solution government commercial customer area aerospace mission system technology service worldwide cyber solution offer missile warning defense system northrop grumman have zack rank stock project ep growth rate next year be current year earning zack consensus estimate have increase last day new bill authorize missile defense agency strengthen homeland regional space missile defense be more administration request northrop expertise missile system be expect benefit development huntington ingall industry inc hii free report be military shipbuilding company provider professional service partner government industry stock carry zack rank project ep growth rate next year be current year earning zack consensus estimate have increase last day new defense bill authorize shipbuilding fund ship exceed administration request ship huntington ingall be manufacturer virginia class ship benefit accommodation procurement virginia class submarine be more administration request trade profit big league trump policy stock spark interest look company prime make substantial gain washington change course today zack reveal ticker benefit new trend streamline drug approval tariff lower taxe higher interest rate spending surge defense infrastructure see buy recommendation now
299,HII,investor be always look stock be poise beat earning season huntington ingall industry inc hii free report be such company firm have earning come pretty soon event be shape quite nicely report be huntington ingall be see favorable earning estimate revision activity late be generally precursor earning beat analyst raise estimate right earning most date information possible be pretty good indicator favorable trend surface hii report fact most accurate estimate current quarter be currently share hii compare broader zack consensus estimate share suggest analyst have very recently bump estimate hii give stock zack earning esp head earning season huntington ingall industry inc price ep surprise huntington ingall industry inc price ep surprise huntington ingall industry inc quotewhy be important positive read zack earning esp have proven be very powerful produce positive surprise outperform market recent year backtest show stock have positive earning esp zack rank hold better show positive surprise nearly time have return average annual return see more top earning esp stock here give hii have zack rank esp positive territory investor want consider stock ahead earning see complete list today zack rank strong buy stock here clearly recent earning estimate revision suggest good thing be ahead huntington ingall beat be card upcoming report zack hide tradeswhile share many recommendation idea public certain move be hide everyone select member portfolio service peek curtain today view start now next month invite follow zack private buy sell real time value momentum stock etf option mover insider trade company be report positive earning surprise ve call accuracy even look portfolio so exclusive be normally close new investor click here zack secret trade
300,HII,investor be always look stock be poise beat earning season huntington ingall industry inc hii free report be such company firm have earning come pretty soon event be shape quite nicely report be huntington ingall industry be see favorable earning estimate revision activity late be generally precursor earning beat analyst raise estimate right earning most date information possible be pretty good indicator favorable trend surface hii report fact most accurate estimate current quarter be currently share hii compare broader zack consensus estimate share suggest analyst have very recently bump estimate hii give stock zack earning esp head earning season huntington ingall industry inc price ep surprise huntington ingall industry inc price ep surprise huntington ingall industry inc quotewhy be important positive read zack earning esp have proven be very powerful produce positive surprise outperform market recent year backtest show stock have positive earning esp zack rank hold better show positive surprise nearly time have return average annual return see more top earning esp stock here give hii have zack rank buy esp positive territory investor want consider stock ahead earning see complete list today zack rank strong buy stock here clearly recent earning estimate revision suggest good thing be ahead huntington ingall industry beat be card upcoming report make fortune shift electric car here stock idea consider much petroleum year lithium power soon shake world create millionaire reshape geo politic soon electric vehicle evs be cheaper gas guzzler be already reach mile single charge battery price plummet charge station set multiply company stand stock buy accord zack research not think see ticker free
301,HII,jacob engineering group inc jec free report joint venture business recently secure management operate contract national nuclear security administration nnsa last month jacob share yielded return nearly loss incur industry zack rank hold company be poise grow back diligent business contract sound restructure initiative notably jacob also sign agreement aug acquire ch hill company ltd be sync effort become global solution provider long run see complete list today zack rank strong buy stock here deal insightson aug jacob joined force huntington ingall industry inc hii free report stoller newport news nuclear unit honeywell international inc hon free report form mission support test service lcc mst joint venture nnsa be division energy department nevada national security site nnss site be locate la vegas aforementioned deal mst directly operate manage nnss site next year nnss training ground testing facility conduct several type national security experiment help augment safety level unite state ally development complex emergency nuclear deterrent response capability accord discuss contract mst adhere ethical standard nnss site proficiently look security safety contract be anticipate be accomplish november jacob note prestigious nnsa contract have reinforce status premium nuclear life cycle solution provider notably reinforce competency renown operation management service provider several critical infrastructure nation jacob quote competitive price contract ensure number contract receipt increase time last few month company have win number contract renown institution public sector agency chevron corporation cvx free report national aeronautic space administration army notably elevated transportation spending government authority australia unite state have largely increase jacob contract winning prospect term more stock news be bigger iphone become mother technological revolution apple sell mere iphone year new breakthrough be expect generate more device just year create market zack have just release special report spotlight fast emerge phenomenon ticker take advantage don buy now kick click here trade
302,HII,defense giant northrop grumman corporation noc free report be schedule release third quarter result oct open bell aerospace segment continue be major growth driver northrop grumman company third quarter result too be expect be gain same substantial inflow order pentagon company varied product offering also remain major catalyst let discuss factor influence northrop grumman quarterly result brief aerospace segment key system segment fetch almost half northrop grumman sale be primary contributor company quarterly growth notably increase demand well delivery manned aircraft mainly boost segment sale growth third quarter company win number contract pentagon regard significant be army contract worth offer logistic support service government own fix wing fleet perform special electronic mission aircraft mission impressively zack consensus estimate aerospace system segment stand reflect annual growth northrop grumman corporation price ep surprise northrop grumman corporation price ep surprise northrop grumman corporation quoteorder flow drive salesdefense major have be receive slew contract pentagon foreign ally northrop grumman too have be exception regard third quarter company notable contract win include contract worth support apr program air force contract ground base strategic deterrent order next generation thermal power control ngt pac program consequently northrop grumman be expect gain number contract have win third quarter evidently zack consensus estimate company third quarter sale be peg reflect year year growth other factor considersegment wise mission system business unit have be benefit company successful cost reduction initiative consider trend continue second half year northrop grumman have increase unit annual sale expectation second quarter earning call keep consideration expect third quarter result reflect strong sale growth unit evidently consensus estimate call sale mission system reflect annual growth flip side increase unallocated corporate expense effective tax rate dent company second quarter earning growth anticipate similar expense linger consensus estimate northrop grumman earning share reflect annual decline end third quarter northrop grumman announce have agree acquire rocket maker orbital atk direct impact deal get reflect upcoming result further update transaction be expect once company release third quarter report earning whisperour proven model do not conclusively show northrop grumman be likely beat earning quarter be stock need have positive earning esp zack rank strong buy buy hold happen be not case here have mentioned zack esp northrop grumman have earning esp be most accurate estimate be peg lower zack consensus estimate uncover best stock buy sell re report earning esp filter zack rank northrop grumman currently carry zack rank negative earning esp make surprise prediction difficult meanwhile caution stock zack rank sell rate go earning announcement especially company be see negative estimate revision stock warrant lookhere be defense company want consider model show have right combination element post earning beat quarter huntington ingall industry inc hii free report be expect report third quarter result nov company have earning esp zack rank leido holding inc ldo free report be expect report third quarter result nov company have earning esp zack rank see complete list today zack rank stock here recent peer releasetextron inc txt free report recently report third quarter adjust earning continue operation cent share beating zack consensus estimate cent total revenue quarter be miss zack consensus estimate make fortune shift electric car here stock idea consider much petroleum year lithium power soon shake world create millionaire reshape geo politic soon electric vehicle evs be cheaper gas guzzler be already reach mile single charge battery price plummet charge station set multiply company stand stock buy accord zack research not think see ticker free
303,HII,boee company ba free report announce have secure contract air force provide support service minuteman iii weapon system contract company provide operation maintenance testing technical datum delivery support minuteman iii work related contract be carry little mountain test facility situate ogden ut operation be expect be conclude sep minuteman iii weapon systemboeing have be primary integrator minuteman ballistic missile icbm system so far company have create test deploy more minuteman series missile air force inception have be number upgrade minuteman iii weapon system minuteman system have be develop meet new challenge undertake new mission latest version minuteman iii be part strategic command strong backlogboee have earn position largest aerospace defense contractor world term revenue order delivery be competitor industry giant northrop grumman corporation noc free report lockheed martin corporation lmt free report huntington ingall industry inc hii free report etc company receive regular order department defense dod backlog end second quarter be end first quarter report backlog include net order quarter quarter company win massive missile defense agency mda procure redesign vehicle rkv development other one defense scenario help growthrecently senate pass fiscal defense policy bill worth be propose july bill provide pentagon main operation buy weapon pay troop rest overseas contingency operation be utilize fund conflict afghanistan iraq syrium elsewhere not just unite state majority nation world be fight internal external enemy be work hard strengthen defense system reason put together help boee peer secure more contract different vertical defense also other ally unite state price movementshare boee have rally last month outperform industry gain outperformance be attribute company strong balance sheet cash flow have be provide financial flexibility matter incremental dividend ongoing share repurchase earning accretive acquisition zack rankboee currently carry zack rank buy see complete list today zack rank strong buy stock here make fortune shift electric car here stock idea consider much petroleum year lithium power soon shake world create millionaire reshape geo politic soon electric vehicle evs be cheaper gas guzzler be already reach mile single charge battery price plummet charge station set multiply company stand stock buy accord zack research not think see ticker free
304,HII,aerospace giant boee co ba free report have secure modification contract provide additional funding service life assessment program slap service life extension program slep phase aircraft notably slap slep program aid extension service life jet original design flight hour detail dealvalu contract have be award naval air system command patuxent river md work related deal be schedule be jul be carry st loui ms el segundo brief note boee super hornet twin engine supersonic weather multirole fighter jet be navy primary strike air superiority aircraft be capable landing take aircraft carrier be single seat variant super hornet be larger predecessor comparatively contain lesser structural part boee boee be major player defense business particular other defense equipment company key forte have be combat proven aircraft additionally proven expertise aerospace program have be clinch huge number contract pentagon long evidently boee win aerospace system air platform technology research program contract air force last week deal come ceiling value contract company be responsible provide quality research affordable revolutionary capability warfighter again last month company clinch contract worth supply spare part aircraft defense logistic agency aviation regard expect recently win contract add further impetus company growth trajectory moreover current budget scenario be favorable defense industry also buoy investor optimism end house representative pass defense policy bill july reflect expenditure level figure exceed president trump fiscal defense budget request propose march enact budgetary amendment be expect immensely boost boee other defense major business term price movementshare boee have surge last month outperform industry gain have be drive company strong balance sheet cash flow provide financial flexibility matter incremental dividend ongoing share repurchase earning accretive acquisition addition company pose strong competition peer lockheed martin corp lmt free report general dynamic corporation gd free report huntington ingall industry inc hii free report zack rankboee currently hold zack rank buy see complete list today zack rank strong buy stock here more stock news be bigger iphone become mother technological revolution apple sell mere iphone year new breakthrough be expect generate more device just year create market zack have just release special report spotlight fast emerge phenomenon ticker take advantage don buy now kick click here trade
305,HII,earning season year be full swing more company set report quarterly result week include member july member have release quarterly number come earning beating figure surpass revenue estimate far broader aerospace sector be concern total earning company space be expect be same period last year lower revenue last trading session major index aerospace defense space be find have record growth be probably support expectation earning upside majority defense biggy line release number week generous flow fund pentagon also benefit industry trail session aerospace defense industry index inched dow jone aerospace defense index rise period last week highlight defense prime textron inc txt free report honeywell international inc hon free report unite technology corp utx free report have release quarterly figure meanwhile lockheed martin corp lmt free report huntington ingall industry inc hii free report boee company ba free report secure few contract department defense dod read defense stock roundup jul here recap last week key story diversify conglomerate textron second quarter adjust earning continue operation surpass zack consensus estimate total revenue also exceed expectation smaller margin only segmental performance second quarter be mixed textron aviation textron system generate lower revenue compare year figure bell industrial unit witness improve revenue growth jul textron cash cash equivalent be compare dec respect outlook textron reiterate bottom line guidance range share read more textron top earning retain ep outlook unite technology second quarter earning well net sale comfortably surpass zack consensus estimate result be also impressive year year however operate profit margin contract basis point bps year year company exit second quarter cash cash equivalent higher record end come outlook full year unite technology raise lower end earning guidance currently expect adjust earning lie share range previously estimate range read more unite technology top earning lift view honeywell international second quarter adjust earning revenue surpass zack consensus estimate respectively year year growth be observed front well segment wise organic growth be witness end quarter free cash flow be compare year quarter term outlook honeywell raise earning revenue guidance earning share be currently expect range revenue be expect range read more honeywell beat earning revenue estimate military shipbuilder huntington ingall unit newport news shipbuilding secure modification contract procure additional long lead time material uss enterprise cvn work related deal be complete jan value contract have be award naval sea system command washington work related contract be carry newport news va uss enterprise cvn gerald ford class third aircraft carrier bear name navy first nuclear power aircraft carrier uss enterprise cvn notably enterprise be schedule be construct be operational read more huntington ingall win navy deal uss enterprise aerospace giant boee clinch year base contract worth year option period provide aircraft spare part defense logistic agency work related deal be execute missouri expect completion date dec defense prime lockheed martin rotary mission system business segment have win modification contract exercise option engineering service support integrate submarine imaging system program value deal be award naval sea system command washington term lockheed martin offer design development testing reverse engineering technology insertion refreshment engineering service field engineering service system support majority work related contract be carry manassas va entire work be schedule be sep performanceover last trading session most defense biggy have put solid show textron northrop grumman corp noc free report share technology inc lll free report gain maximum share price have inched follow boee however last month performance entire industry have be quite stellar time boee gain most share rise follow rockwell collin inc col free report follow table show price movement major defense player past trading day last month companylast monthslmt ba gd rtn noc col txt lll next space raytheon company rtn technology be schedule report second quarter result jul rockwell collin be expect release third quarter fiscal result jul harris corporation hrs be set reveal fourth quarter fiscal result aug hottest tech mega trend year generate global revenue predict blast roof fame investor mark cuban say produce world first trillionaire still leave plenty money regular investor make right trade early see zack best stock play trend
