,ticker,content
229,HII,general dynamic corp gd free report subsidiary electric boat have clinch modification contract exercise option reactor plant plan yard service nuclear power submarine company also support yard service navy moor training ship markedly deal have be award naval sea system command washington contractper modification contract electric boat offer furnishing fabricate purchasing material supply service likely be require perform function plan yard reactor plant related portion propulsion plant nuclear power submarine unit also support yard service moor training ship majority work be perform groton ct rest be perform charleston sc be complete used fiscal operation maintenance navy well fiscal other procurement navy fund september nuclear submarine unite statesto counter rise geopolitical tension world government have be design submarine decade navy be first launch nuclear power submarine submarine be markedly better diesel engine one have make multiple stop refueling currently navy have class nuclear power attack submarine virginia class ohio class los angele class fact market nuclear submarine be consolidated unite state operated prime player general dynamic huntington ingall industry inc hii free report result company enjoy large share market high profit margin context be imperative mention recently administration have be allot significant provision nuclear submarine nation defense budget thereby encourage submarine manufacturer boost production evidently fiscal budget proposal fund be allocate submarine viewgeneral dynamic enjoy dominant position navy contractor be be only contractor world equip build nuclear power submarine addition company be prime contractor development columbia class submarine virginia class submarine give navy recent acknowledgement nuclear submarine top priority huge budget allot same believe modification contract undoubtedly render company lead position nuclear power submarine industry furthermore senate arm service committee recently approve fiscal defense policy bill national defense authorization act fiscal worth include boost navy shipbuilding go forward bill be anticipate boost revenue growth general dynamic be prime shipbuilder unite state price movementshare general dynamic have surge year underperform industry gain have be cause company decline backlog recent time additionally stock face stiff competition industry peer boee company ba free report northrop grumman corporation noc free report zack rankgeneral dynamic carry zack rank hold see complete list today zack strong buy rank stock here trade profit big league trump policiesif stock spark interest look company prime make substantial gain washington change course today zack reveal ticker benefit new trend streamline drug approval tariff lower taxe higher interest rate spending surge defense infrastructure see buy recommendation now
230,HII,military shipbuilder huntington ingall industry inc hii free report business unit newport news recently secure modification contract perform dry dock operation uss helena ssn work related deal be execute company shipbuilding yard newport new va value contract be award naval sea system command washington term deal company conduct repair maintenance upgrade modernization uss helena huntington ingall utilize fiscal operation maintenance navy fund complete task april brief note uss helenauss helena ssn be los angele class nuclear power fast attack submarine notably los angele class form backbone navy submarine force nuclear submarine unite statesto counter rise geopolitical tension world government have be design submarine decade notably modern day nuclear power submarine be markedly better diesel engine one have make multiple stop refueling unite state market nuclear submarine be consolidated operated prime player huntington ingall general dynamic corporation gd free report result company enjoy large share market well high profit margin be imperative mention context recently administration have be allot significant provision nuclear submarine nation defense budget thereby encourage submarine manufacturer huntington ingall boost production evidently fiscal budget proposal allocate submarine deal benefit huntington huntington newport news division enjoy lead position design build nuclear power submarine navy december newport news deliver submarine navy comprise fast attack ballistic missile submarine moreover nuclear power fast attack submarine currently active service be deliver newport news global submarine market be expect grow cagr reach value forecast technavio market research analyst consider aforementioned development expect huntington ingall more such submarine related contract go ahead thereby boost profit margin price huntington have rally year outperform industry gain company be sole designer manufacturer nuclear power aircraft carrier active navy fleet consist huntington ingall ship company continue enjoy strong order growth navy turn have lead company aforementioned outperformance zack rank other stock ingall currently carry zack rank buy few other top rank stock aerospace defense space be boee company ba free report northrop grumman corporation noc free report carry zack rank see complete list today zack rank strong buy stock here boee surpass zack consensus estimate past quarters average company have solid long term growth earning growth northrop grumman surpass zack consensus estimate past quarters average company have solid long term growth earning growth trade profit big league trump policiesif stock spark interest look company prime make substantial gain washington change course today zack reveal ticker benefit new trend streamline drug approval tariff lower taxe higher interest rate spending surge defense infrastructure see buy recommendation now
231,HII,textron inc txt free report know brand bell helicopter cessna aircraft be schedule report fourth quarter result jan market open expect sale growth industrial segment account majority textron top line drive fourth quarter revenue moreover rebound bell segment many quarters buoy optimism let discuss factor detail industrial segment key catalysttextron industrial segment design manufacture variety product include automotive engine component specialize vehicle varied industry related tool equipment acquisition arctic cat leader recreational vehicle industry make first quarter have be boost growth segment fact buyout drive third quarter sale double digit segment expect takeover drive revenue segment fourth quarter well line zack consensus estimate segment fourth quarter sale be peg reflect solid rise prior year quarter bell segment drive growth bell important segment textron have be able deliver improve result third quarter quarters poor performance particular strong demand commercial jet drive top line higher unit management expect maintain upside commercial delivery expect fourth quarter result reflect top line growth bell segment line zack consensus estimate segment fourth quarter sale be peg reflect rise prior year quarter other factor playin addition aforementioned factor improve growth pattern performance steady inflow order pentagon be expect provide impetus fourth quarter sale deal clinch fourth quarter worth mention be contract army mobile strike force vehicle factor be expect boost textron fourth quarter revenue be evident zack consensus estimate sale reflect year year improvement however zack consensus estimate fourth quarter earning be peg cent share reflect decline year year be company generate significant portion revenue fix price contract expose bottom line cost overrun moreover third quarter earning call management announce vehicle business be lag term line rate production output factor well charge associate tapv program incur first quarter have compel management slash ep guidance textron inc price ep surprise textron inc price ep surprise textron inc quote do zack model predictour proven model do not conclusively show earning beat textron quarter be stock need have positive earning esp zack rank strong buy buy hold happen be not case here see zack esp textron have earning esp uncover best stock buy sell re report earning esp filter zack rank textron carry zack rank meanwhile caution stock zack rank sell rate go earning announcement especially company be see negative estimate revision stock considerhere be defense company want consider model show have right combination element post earning beat quarter huntington ingall industry hii free report be expect report fourth quarter result feb company have earning esp zack rank see complete list today zack rank stock here curtiss cw free report be expect report fourth quarter result feb company have earning esp zack rank aar air free report be expect report third quarter fiscal result mar company have earning esp zack rank zack top stock addition stock discuss know finest buy hold ticker entirety last year zack top stock portfolio produce double digit winner include fmc corp vmware rac stellar gain now brand new portfolio have be handpick company cover zack rank don miss chance get long term buy access zack top stock today
232,HII,boee company ba free report commercial airplane segment have be consistently witness solid delivery buoy increase demand commercial jetliner domestic well international market expect strength get reflect fourth quarter result be schedule release jan market open solid delivery buoy optimismon jan boee announce upbeat fourth quarter delivery figure company dispatch jet year figure jet buoy higher delivery figure be company delivery guidance boee deliver jet fleet fleet year period company deliver unit unit fleet boee deliver unit model compare unit year other delivery include compare unit respectively come fourth quarter delivery boee report fourth quarter commercial delivery airplane year year backed higher demand jet sequentially number go delivery single aisle jet increase fourth quarter year shipment dreamliner totale compare year period respectively company deliver jet compare year quarter dubai air show grand success dubai air show hold november witness landmark deal involve renown jet maker globe total order book worth apart airbus group eadsy boee seal majority game change deal event believe boost result quarter be report notably company seal deal worth deliver dreamliner emirate airline very first day show company clinch significant deal worth deliver max airplane flydubai airline marked largest ever single aisle jet order boee middle east carrier apart order boee receive order kuwait base alafco aviation lease finance company supply additional max value additionally company secure order more dreamliner commitment purchase large freighter value azerbaijan airline be major growth driver demand boee commercial airplane have be rise due steady improvement passenger freight traffic boee current market outlook world need new plane worth single aisle jet be expect be major demand driver comprise total projection interestingly company model remain best selling plane single aisle market thank fuel efficiency passenger comfort interestingly majority commercial order boee win belong fleet consider fact be fastest selling airplane boee history exceed total order more customer expect fleet jet play role key catalyst boee fourth quarter result boee company price ep surprise boee company price ep surprise boee company quote huge order drive top line apart aforementioned order boee win dubai air show company receive number multus dollar order fourth quarter thus such huge order growth be expect boost commercial airplane segment revenue however zack consensus estimate commercial airplane segment revenue be peg fourth quarter reflect year year decline have be drive lower delivery rate company jet indeed drop be witness fourth quarter delivery model clearly show lack demand particular jet fact realize decline demand boee implement plan production rate decrease month month first quarter be further reduce rate month third quarter also defer production cost dreamliner product line remain concern segment growth company be witness decline cost hasn be able completely waive same here quantitative model predictsboee currently do not have right combination main ingredient positive earning esp zack rank hold higher increase odd earning beat zack esp earning esp company be uncover best stock buy sell re report earning esp filter zack rank boee sport zack rank strong buy increase predictive power esp however also need have positive esp be confident positive earning surprise zack consensus estimate earning cent reflect rise year year basis please note caution stock zack rank sell rate go earning announcement especially company be see negative estimate revision stock warrant look here be few stock aerospace defense space worth consider basis model show have right combination pull beat huntington ingall industry inc hii free report be expect report fourth quarter result feb company have earning esp zack rank buy see complete list today zack rank stock here curtiss corporation cw free report be expect report fourth quarter result feb company have earning esp zack rank aar corp air free report be expect report third quarter fiscal result mar company have earning esp zack rank zack top stock addition stock discuss know finest buy hold ticker entirety last year zack top stock portfolio produce double digit winner include fmc corp vmware rac stellar gain now brand new portfolio have be handpick company cover zack rank don miss chance get long term buy access zack top stock today
233,HII,raytheon company rtn free report missile system segment recently secure modification contract exercise option design agent engineering support service roll airframe missile ram upgrade mk guide missile weapon system improvement program value contract be award naval sea system command washington term agreement missile system support maintenance current weapon system capability also help resolve issue design system software maintenance reliability maintainability quality assurance logistic engineering service work related contract be execute tucson az louisville ky company utilize fiscal fund procure navy german foreign military sale fms egyptian fms qatar fms complete task september note mk guide missile weapon mk ram guide missile weapon system be cooperative development production program conduct federal republic germany memorandum understand manufacture raytheon weapon system be most modern self defense weapon system deploy ship destroy ship missile have be specifically design provide protection ship size viewraytheon missile system segment have be gain significant award unite state well international customer courtesy high end combat proven advanced arsenal august company win worth modification contract missile defense agency manufacturing standard missile sm block iia missile international front company be witness grow demand missile defense system europe increase global threat dynamic well rise tension saudi arabia iran november reuter report swedish government be willing spend more raytheon patriot surface air defense missile system raytheon be also build missile be utilize government counter attack north korea meanwhile defense industry receive boost senate approval fiscal defense policy bill worth september bill provide pentagon main operation buy weapon pay troop believe raise budget certainly draw more contract defense major raytheon also help achieve missile business target latest contract be example price raytheon have rally year compare broader industry grow demand missile defense system approval fiscal defense policy bill boost overall performance zack rank key picksraytheon carry zack rank hold few better rank stock same sector be teledyne technology incorporate tdy free report leido holding inc ldo free report huntington ingall industry inc hii free report teledyne technology sport zack rank strong buy leido holding huntington ingall carry zack rank buy see complete list today zack rank stock here teledyne technology post average positive earning surprise past quarters zack consensus estimate current quarter earning rise cent last day leido holding have average positive earning surprise last quarters zack consensus estimate current year earning have improve cent past day huntington ingall post average positive earning surprise last quarters zack consensus estimate current year earning have rise cent past day wall street next amazonzack evp kevin matra believe familiar stock have only just begin climb become greatest investment time once generation opportunity invest pure genius click detail
234,HII,military shipbuilder general dynamic corporation gd free report business division electric boat recently secure modification contract worth plan execution uss washington ssn post delivery work period work related deal be schedule be february detail contract be award supervisor shipbuilding conversion repair groton ct term agreement electric boat conduct plan execution related task include long lead time material procurement task aid accomplish maintenance repair alteration testing other work uss washington schedule post delivery work period majority work be carry newport news va company utilize fiscal shipbuilding conversion fund finish task brief note uss washingtonus washington be nuclear power fast attack submarine ssn design operate shallow coastal region maintain capacity open ocean submarine warfare be virginia class attack submarine huntington ingall industry inc hii free report stalwart military shipbuilding space general dynamic co manufacture uss washington be believe delivery ship be most technologically advanced submarine navy service also be least expensive submarine design incorporate significant innovation reduce acquisition cost earlier ship class impact mission capability uss washington be commission oct viewbee only contractor world equip build nuclear power submarine general dynamic enjoy dominant position navy contractor december navy update force level goal prior target achieve maintain ship fleet comprise ssns ship fleet include ssns turn clearly reflect immense priority navy bestow class nuclear submarine navy plan build advanced model virginia class submarine subsequent year come additional mid body section call virginia payload module vpm fact navy have already propose fiscal budget request worth research development funding vpm majority such attack submarine be co develop general dynamic huntington ingall construction vpm pentagon offer lucrative additional defense contract shipbuilder turn be expect boost growth trajectory furthermore navy have acknowledge virginia class program top priority sumptuous budget have be allot same bode well general dynamic company be identify prime contractor virginia class submarine result expect latest modification contract have ability put company lead position nuclear power submarine industry price movementshare general dynamic have rally year underperform industry gain have be cause fact company be witness decline backlog recent time moreover stock also face stiff competition industry peer boee company ba free report northrop grumman corporation noc free report zack rankgeneral dynamic currently carry zack rank buy see complete list today zack rank strong buy stock here wall street next amazonzack evp kevin matra believe familiar stock have only just begin climb become greatest investment time once generation opportunity invest pure genius click detail
235,HII,aerospace defense industry have be growth trajectory begin year courtesy number favorable factor domestic well international also trump latest move policy have be help stock recover loss incur due budget sequestration impose previous administration come third quarter performance industry end period positive note rac market thump return evidently zack aerospace defense industry gain september quarter higher return understand lead defense stock outperform broader market have briefly mentioned factor boost industry past month budget upsideof late geo political tension terrorist activity be rise globally incident have be drive demand defense product turn provide substantial impetus stock also recent budgetary amendment have be drive stock end recently approve defense bill policy worth be worth mention particular jul house pass fy defense policy bill worth surpass trump march budget request worth finally late september senate approve national defense authorization act include funding provision national defense spending overseas contingency operation go say funding significantly boost growth prospect defense stock trump take international global market third quarter witness continue cross border tension north korea unite state former conduct repeat missile test target unite state ally ratiothese rapid altercation bode well defense bellwether rise geopolitical tension always prompt government strengthen arsenal hostile activity north korea administration repeat warning nation response provide strong impetus number defense major scale new time high moreover late august discuss afghanistan strategy trump announce plan not withdraw force nation fight integrate diplomacy military power follow announcement defense stock moved north anticipation escalate military action believe trump foreign policy also provide further impetus stock prudent dealsrecent merger deal major aerospace defense company have also be act major catalyst industry september unite technology corp utx free report agree buy rockwell collin inc once complete deal create world largest aircraft equipment manufacturer acquisition rockwell collin commercial military aircraft avionic business merge unite technology wide portfolio include aircraft engine structure cockpit cabin control ventilation system other electronic mechanical device used aviation other hand later same month northrop grumman inked deal buy orbital atk acquisition northrop grumman benefit orbital atk rocket motor missile electro optical countermeasure product line stock worth add industry outperform broader market september quarter promising yield higher return have shortlist defense stock have rally more third quarter have outperformed gain boee co ba free report be largest aircraft manufacturer world term revenue order delivery be also largest aerospace defense contractor apart manufacturing combat proven military jet high end commercial aircraft boee also produce missile related weapon work tandem nasa space launch system boee currently carry zack rank buy zack consensus estimate company have increase third quarter see complete list today zack rank strong buy stock here company stock have surge outperform rise huntington ingall industry inc hii free report design build maintain nuclear power ship such aircraft carrier submarine nuclear ship such surface combatant expeditionary warfare amphibious assault coastal defense surface ship navy coast guard company provide market service military ship globe company currently flaunt zack rank earning be expect improve yet be report third quarter huntington ingall stock have surge outperform rise northrop grumman corporation noc free report supply broad array product service department defense include electronic system information technology aircraft space technology system integration service company currently hold zack rank sale be expect improve yet be report third quarter northrop stock have surge outperform rise leido holding inc ldo free report be global science technology company provide technology engineering service solution defense intelligence civil health market company currently carry zack rank sale be expect improve yet be report third quarter leido stock have surge outperform rise raytheon company rtn free report be largest aerospace defense company unite state diversify line military product include missile radar sensor surveillance reconnaissance equipment communication information system naval system air traffic control system technical service company currently carry zack rank earning be expect improve yet be report third quarter raytheon stock have surge outperform rise wall street next amazonzack evp kevin matra believe familiar stock have only just begin climb become greatest investment time once generation opportunity invest pure genius click detail
236,HII,growth stock be most exciting pick market high flyer captivate investor attention produce big gain well however also lead downside growth story be so be important find company be still see strong growth prospect business such company be well position future earning growth be huntington ingall industry inc hii free report firm be aerospace defense industry see ep growth last year be look great year too fact current growth estimate year call earning share growth furthermore long term growth rate be currently impressive suggest pretty good prospect long haul huntington ingall industry inc price consensus huntington ingall industry inc price consensus huntington ingall industry inc wasn enough stock have actually see estimate rise past month current fiscal year thank rise earning estimate hii have zack rank buy further underscore potential outperformance company see complete list today zack rank strong buy stock here so be look fast grow stock be still see plenty opportunity horizon make sure consider hii not only do have double digit earning growth prospect impressive zack rank suggest analyst believe better day be ahead hii well wall street next amazonzack evp kevin matra believe familiar stock have only just begin climb become greatest investment time once generation opportunity invest pure genius click detail
