,ticker,content
104,HRB,stock market be time high geopolitic washington turmoil fed dovish view make dividend investing perfect choice cash payout be major source consistent income investor return equity market be risk particular stock have strong history dividend growth opposed pay high yield form healthy portfolio more scope capital appreciation dividend growth stock dividend growth stock offer best world potential capital appreciation rise income even volatile market be stock mature company be less susceptible large swing market simultaneously offer outsized payout sizable yield regular basis irrespective market direction dividend growth reflect sustainable business model long track profitability rise cash flow good liquidity strong balance sheet value characteristic superior fundamental make dividend growth stock quality promising investment long term further history strong dividend growth indicate hike be likely future stock have long history outperformance compare broader stock market other dividend pay stock do not necessarily mean have highest yield result pick dividend growth stock appear winning strategy other parameter be also include year historical dividend growth greater select stock solid dividend growth history year historical sale growth greater represent stock strong record grow revenue year historical ep growth greater represent stock solid earning growth history next year ep growth rate greater represent rate company earning be expect grow improve earning help company sustain dividend payment price cash flow less industry ratio less industry indicate stock be undervalue industry investor need pay less better cash flow generate company week price change greater market weight ensure stock appreciate more past year top zack rank stock have zack rank strong buy buy generally outperform peer type market environment vgm style score better be simply weight combination value growth momentum combine zack rank offer best upside potential here be stock fit bill block inc hrb free report missouri base block be diversify company involved tax return preparation electronic filing income tax return other tax related service company have see strong earning estimate revision cent past day fiscal year deliver average positive earning surprise past quarters have vgm style score sport zack rank see complete list today zack rank stock here lazard ltd laz free report bermuda base company be preeminent international financial advisory asset management firm have long specialize craft solution complex financial strategic challenge client company have see solid earning estimate revision cent past day year have expect earning growth rate have zack rank vgm style score westlake chemical corporation wlk free report texas base company be vertically integrate international manufacturer supplier petrochemical polymer fabricate product have see solid earning estimate revision cent year past month expect earning growth rate stock have zack rank vgm style score aetna inc aet free report connecticut base company be nation largest health benefit company nation largest insurance financial service organization stock have see positive earning estimate revision cent past day year expect earning growth rate stock have zack rank vgm style score republic service inc rsg free report arizona base company be lead provider service domestic hazardous solid waste industry deliver average positive earning surprise past quarters have see solid earning estimate revision couple cent year past month stock have zack rank vgm style score get rest stock list signing now week free trial research wizard start used screen own trading further also create own strategy test first take investment plunge research wizard be great place begin easy use everything be plain language very intuitive start research wizard trial today next time read economic report open research wizard plug find see gem come click here sign free trial research wizard today disclosure officer director employee zack investment research own have sell short security hold long short position option be mentioned material affiliated investment advisory firm own have sell short security hold long short position option be mentioned material disclosure performance information zack portfolio strategy be available https www zack com performance zack restaurant recommendation addition dine special place feast stock share zack special report spotlight recent ipos watch stock offer immediate promise boom sector download free
105,HRB,month have go last earning report block inc hrb free report share have add time frame outperform market recent positive trend continue lead stock next earning release be due pullback dive investor analyst have react late let take quick look most recent earning report order get better handle important driver block beat earning revenue estimatesh block report fourth quarter fiscal end apr adjust earning continue operation share beat zack consensus estimate increase earning be attribute rise revenue quarter gaap earning continue operation come share compare year quarter full year fiscal company report adjust earning continue operation share compare prior year improvement be largely due company cost reduction effort also enabled investment key client drive initiative year operational performanceh block report revenue fiscal fourth quarter compare prior year quarter revenue beat zack consensus estimate fiscal company report revenue relatively flat prior year be due improvement company assist net average charge partially offset decline return volume total operate expense decline year year drive effective cost management financial positionh block exit quarter cash cash equivalent compare apr total outstanding long term debt be approximately fiscal year net cash used operate activity be be higher year period share repurchase dividendin fiscal company buy back approximately share worth apr share be outstanding company complete share repurchase share repurchase program aug run jun company repurchase approximately share share outstanding begin program aggregate purchase price approximately board director declare quarterly dividend share payable jul shareholder record jun company have be pay quarterly dividend shareholder company go public have estimate be move then turn fresh estimate flatlined past month have be revision higher current quarter compare lower vgm scoresat time block stock have strong growth score be lag lot momentum front stock be allocate grade value side putt top quintile investment strategy overall stock have aggregate vgm score aren focuse strategy score be be interested zack style score indicate stock be suitable value growth investor stock have zack rank strong buy be look average return stock next few month
106,HRB,weakest sector market last quarter turn page become strongest earning season rally street today be lead retail thing extension yesterday gain wasn exactly rocket move higher do provide enough bid push major stock market index green session more today dave daily dive video check dave daily dive video break market action today day dave bartosiak zack com twitter bartosiastic dive chart point key price action level watch doesn stop highlight today video see free click be uncover zack rank strong buy stock be breaking new week high today stock have ton momentum be charge higher list stock cover today include aerovironment avav free report aerovironment inc design develop produce support operate unmanned aircraft system uas efficient energy system ee unite state internationally company offer small uas product deliver intelligence surveillance reconnaissance communication such real time tactical reconnaissance tracking combat assessment geographic datum small tactical unit individual operator alibaba baba free report alibaba group hold limit subsidiary operate online mobile commerce company person republic china internationally company operate segment core commerce cloud compute digital medium entertainment innovation initiative other operate taobao marketplace mobile commerce destination tmall third party platform brand retailer rural taobao program enable rural resident business sell agricultural product urban consumer juhuasuan sale marketing platform flash sale alibaba com online wholesale marketplace alitrip online travel book platform com online wholesale marketplace consumer marketplace block hrb free report block inc subsidiary provide assist income tax return preparation digital do diy tax solution other service product related income tax return preparation general public primarily unite state canada australia company offer assist income tax return preparation related service system retail office operated directly company franchisee also develop market diy income tax preparation software provide diy tax service include preparation federal state income tax return review tax return tax professional access tax tip advice tax related news use calculator tax plan error check electronic filing square sq free report square inc develop provide payment process point sale pos financial marketing service worldwide provide square point sale pos application software offer manage payment solution advanced software product include square dashboard cloud base report analytic tool provide seller real time datum insight sale item customer employee square payroll empower seller hire onboard pay employee associate taxe customer engagement tool help seller enhance business digital customer feedback marketing loyalty program tal education group tal free report tal education group subsidiary provide school tutor service person republic china offer tutor service student cover various academic subject include mathematics physics chemistry biology history geography political science english chinese company also provide tutor service primarily small class include xueersi mobby firstleap tutor service personalize premium service izhikang name online course now see private trade today zack rank new addition be be share public other trade be hide everyone select member peek curtain view start today next month follow zack private buy sell real time value momentum stock etf option move insider trade company be report positive earning surprise ve call accuracy even look portfolio so exclusive be normally close new investor click here zack trade
107,HRB,here be stock zack rank strong buy strong income characteristic investor consider today june big sporting good corporation bgfv free report sporting good retailer have witness zack consensus estimate current year earning jump last day big sporting good corporation price consensus big sporting good corporation price consensus big sporting good corporation company have dividend yield compare industry average year average dividend yield be big sporting good corporation dividend yield ttm big sporting good corporation dividend yield ttm big sporting good corporation inc cat free report manufacturer construction mining equipment have witness zack consensus estimate current year earning advance last day caterpillar inc price consensus caterpillar inc price consensus caterpillar inc company have dividend yield compare industry average year average dividend yield be caterpillar inc dividend yield ttm caterpillar inc dividend yield ttm caterpillar inc quotekrono worldwide inc kro free report global producer marketer titanium dioxide pigment have witness zack consensus estimate current year earning jump more last day krono worldwide inc price consensus krono worldwide inc price consensus krono worldwide inc company have dividend yield compare industry average year average dividend yield be krono worldwide inc dividend yield ttm krono worldwide inc dividend yield ttm krono worldwide inc quoteh block inc hrb free report tax preparation service provider have witness zack consensus estimate current year earning increase last day block inc price consensus block inc price consensus block inc company have dividend yield compare industry average year average dividend yield be block inc dividend yield ttm block inc dividend yield ttm block inc quotesee full list top rank stock here find more top income stock great premium screensmore stock news company verge apple run do miss apple stock explosion launch iphone now look be pivotal year get emerge technology expect rock market demand soar almost nothing report suggest save life decade turn save healthcare cost bonus zack special report name breakthrough best stock exploit apple company be already strong coil potential mega gain click see right now
108,HRB,block inc hrb free report incur third quarter fiscal end jan loss continue operation share narrower zack consensus estimate loss better expect result be attributable rise revenue quarter consolidated loss quarter come share compare loss cent year quarter owing change effective tax rate result recently enact federal corporate tax legislation operational performanceh block report revenue fiscal third quarter compare prior year quarter year year increase revenue be attributable higher return volume assist diy tax preparation business revenue beat zack consensus estimate block inc price consensus ep surprise block inc price consensus ep surprise block inc quotea feb total return volume increase return assist diy business increase respectively assist business benefit success early season promotion include company refund advance interest loan free federal ez offer diy business gain continue product improvement enhance partnership block more promotion total operate expense increase year year due higher compensation cost financial positionh block exit quarter cash cash equivalent compare year period total outstanding long term debt be approximately compare prior year quarter first month fiscal net cash used operate activity be compare year quarter board director declare quarterly dividend cent share payable apr shareholder record mar company have be pay uninterrupted quarterly dividend shareholder go public zack rank other stock considerh block expect continue improve financial performance remainder fiscal year increase client trajectory also company reiterate earlier guidance block carry zack rank buy other stock worth consider industry include monro inc mnro free report sp corporation sp free report weight watcher international inc wtw free report sporting zack rank strong buy see complete list today zack rank stock here monro have long term earning growth expectation top earning estimate twice trail quarters average positive surprise sp have long term earning growth expectation top earning estimate thrice trail quarters average positive surprise weight watcher have long term earning growth expectation top earning estimate trail quarters average positive surprise breaking news cryptocurrency now bigger total market cap cryptos recently surpass more increase previous month re now bigger morgan stanley goldman sachs even visa new asset class expand even more rapidly new investor continue pour wall street become increasingly involved zack have just name company enable investor take advantage explosive growth cryptocurrency stock market click here access stock
109,HRB,value investing be easily most popular way find great stock market environment wouldn want find stock be fly radar be compelling buy offer tantalize discount compare fair value way find company be look several key metric financial ratio many be crucial value stock selection process let put block inc hrb free report stock equation find be good choice value oriented investor right now investor subscribe methodology look elsewhere top pick pe ratioa key metric value investor always look be price earning ratio pe short show much investor be willing pay dollar earning give stock be easily most popular financial ratio world best use pe ratio be compare stock current pe ratio ratio have be past compare average industry sector compare market whole front block have trail month pe ratio see chart level actually compare pretty favorably market large pe stand focus long term pe trend block current pe level put midpoint past year moreover current level be fairly high stock suggest be good entry point further stock pe also compare favorably industry trail month pe ratio stand very least indicate stock be relatively undervalue right now compare peer also point block have forward pe ratio price relative year earning just so be fair say slightly more value oriented path be ahead block stock term too ratioanother key metric note be price sale ratio approach compare give stock price total sale lower read be generally consider better person metric more other value focuse one look sale something be far harder manipulate accounting trick earning right now block have ratio be lower average come right now also see chart be well high stock particular past few year anything hrb be lower end range time period metric suggest level undervalue trading least compare historical norm broad value outlookin aggregate block currently have zack value style score putt top stock cover look make block solid choice value investor other key metric make pretty clear too example peg ratio block be just level be lower industry average peg ratio be modify pe ratio take account stock earning growth rate additionally cf ratio great indicator value come be far better industry average clearly hrb be solid choice value front multiple angle stock overall block be good choice value investor be plenty other factor consider investing name particular be worth note company have growth grade momentum score give hrb zack vgm score overarch fundamental grade read more zack style score here meanwhile company recent earning estimate have be encourage current fiscal year well next year have see estimate go higher past day compare none lower result current fiscal year consensus estimate have rise past month next year estimate have increase see consensus estimate trend recent price action stock chart block inc price consensus block inc price consensus block inc bullish trend be stock have zack rank buy be expect outperformance company term bottom lineh block be inspire choice value investor be hard beat incredible lineup statistic front formidable industry rank top strong zack rank block look strong value contender fact past year industry have clearly outperformed broader market see so pay value investor delve deeper company prospect fundamental indicate stock be compelling pick today stock zack hottest strategiesit hard believe even zack market gain top stock pick screen have return respectively outperformance have not just be recent phenomenon year have be remarkably consistent composite yearly average gain strategy have beaten market more maybe even more remarkable be fact re willing share latest stock cost obligation see free
110,HRB,here be stock buy rank strong income characteristic investor consider today february brinker international inc eat free report casual dine restaurant chain have witness zack consensus estimate current year earning rise last day brinker international inc price consensus brinker international inc price consensus brinker international inc zack rank buy company have dividend yield compare industry average year average dividend yield be brinker international inc dividend yield ttm brinker international inc dividend yield ttm brinker international inc quoteh block inc hrb free report income tax filing company have witness zack consensus estimate current year earning increase last day block inc price consensus block inc price consensus block inc zack rank buy company have dividend yield compare industry average year average dividend yield be block inc dividend yield ttm block inc dividend yield ttm block inc quotesonic corp sonc free report chain quick service drive restaurant have witness zack consensus estimate current year earning rise last day sonic corp price consensus sonic corp price consensus sonic corp zack rank buy company have dividend yield compare industry average year average dividend yield be sonic corp dividend yield ttm sonic corp dividend yield ttm sonic corp quoterpm international inc rpm free report manufacturer specialty chemical product have witness zack consensus estimate current year earning increase last day rpm international inc price consensus rpm international inc price consensus rpm international inc zack rank buy company have dividend yield compare industry average year average dividend yield be rpm international inc dividend yield ttm rpm international inc dividend yield ttm rpm international inc quotesee full list top rank stock here find more top income stock great premium screen more stock news be bigger iphone become mother technological revolution apple sell mere iphone year new breakthrough be expect generate more device just year create market zack have just release special report spotlight fast emerge phenomenon ticker take advantage don buy now kick click here trade
111,HRB,diverse portfolio product service block inc hrb free report be premier player consumer tax service market headquarter kansa city mo company provide tax accounting business consult service product globe divestiture block bank hrb have be diligently focuse improve efficiency capability core business company make several enhancement online digital tax software improve monetization conversion hrb have also forayed health insurance brokerage business collaboration gohealth create additional revenue generate opportunity however hrb continue face unfavorable foreign currency translation employment related lawsuit moreover debt equity ratio compare unfavorably sector average last trail quarters hrb have report positive average earning surprise beating earning estimate thrice rise operate cost adverse currency translation effect gradually shrink margin investor have be eagerly wait company latest earning report currently hrb have zack rank hold definitely change follow second quarter fiscal earning report be just release see complete list today zack rank stock here have highlighted key stat just reveal announcement earning hrb report narrower loss zack consensus estimate call loss cent share company report loss cent continue operation block inc price ep surprise block inc price ep surprise block inc quoterevenue revenue beat hrb post revenue compare zack consensus estimate key stat note hrb expect continue improve financial performance remainder fiscal increase client trajectory stock price narrower loss share price fall pre market trading follow release time investor probably expect better performance company check back full hrb earning report later wall street next amazonzack evp kevin matra believe familiar stock have only just begin climb become greatest investment time once generation opportunity invest pure genius click detail
112,HRB,iconix brand group inc icon free report have recently buy back remain interest iconix canada joint venture partner agreement iconix paid remain be paid next year iconix have be form international joint venture seek monetize brand operation have significantly contribute revenue moreover expand international business be vital aspect iconix growth strategy iconix be quite underpenetrated canada therefore acquire remain stake iconix canada enable company strengthen business region iconix canada be form have license brand such london fog rampage charisma zoo york many other similar canada iconix have previously acquire full interest business other territory company acquire remain stake iconix china latin america respectively have also establish joint venture middle east north america iconix also announce retain exist interest buffalo brand company have previously consider selling interest buffalo brand refrain same brand have be perform well canada further retain stake brand facilitate gain control iconix canada well solidify company position organic growth late company have be divest brand focus core portfolio spending resource business generate significant volume include divestiture core brand such sharper image badgley mischka peanut worldwide llc strawberry shortcake brand such divestiture be line company effort develop strong yielding portfolio be mainly carry reduce debt burden have also noticed iconix have be witness sluggishness woman man segment last consecutive quarters headwind be clearly reflect share price company share iconix have plunge past month underperform industry gain such challenge expect iconix strategic partnership consistent effort international expansion improve performance long run enter joint venture iconix also try achieve growth back direct retail partnership licensing agreement moreover long term agreement brand exclusivity contract be incentive retailer make effort promote iconix product turn help boost sale iconix currently have zack rank hold see complete list today zack rank strong buy stock here interested consumer discretionary space take look better rank stock same sector be decker outdoor corporation deck free report block inc hrb free report carry zack rank strong buy time warner inc hold zack rank buy decker have average positive earning surprise trail quarters have long term earning growth rate block have average positive earning surprise trail quarters have long term earning growth rate time warner have average positive earning surprise trail quarters have long term earning growth rate make fortune shift electric car here stock idea consider much petroleum year lithium power soon shake world create millionaire reshape geo politic soon electric vehicle evs be cheaper gas guzzler be already reach mile single charge battery price plummet charge station set multiply company stand stock buy accord zack research not think see ticker free
