,ticker,content
36,HRB,stock rally much session friday strong november job report overpower sharp pullback oil price many energy stock nasdaq pop preliminary datum show move carry weak trade gain take back loss thursday trigger disappointing monetary policy decision european central bank week result left nasdaq be fraction higher back day move average open labor department payroll report show bigger expect jump november payroll back view economy be even mend keel appear clear path fed rate hike dec meeting dow end friday unanimously positive apple aapl microsoft msft home depot hd top index gain gold miner newmont mining nem lead more trouble utility nrg nrg stake index low end decline leader ulta beauty ulta easily top ibd list surge post strong result late thursday gap gain snap share past early buy point month base stock end less entry fellow ibd stock alaska air alk soar fast trade mark new high stock be still buy range buy point late stage flat base initially clear wednesday hawaiian lift china base netease nte also rocket seize fresh high end past buy point new issue fitbit fit jump action surge twice usual pace rally week continue move nov intraday low fitbit ship unit worldwide remain top vendor wearable include smartwatch fitness tracking device accord idc report release thursday next week earning calendar continue lighten unite natural food unfi mattress firm mfrm block hrb healthequity hqy schedule report monday economic calendar also get quiet start speech st loui fed president james bullard mark high point day
37,HRB,share bofi hold bofi rebound thursday follow huge sell previous day internet base bank fought back lawsuit accuse improper business practice report wednesday bofi hold company bofi federal bank also know bank internet usa be be sue bank former internal auditor
38,HRB,share bofi hold plunge wednesday report internet base bank be be sue business practice new york time report bofi hold bofi hold company bofi federal bank also know bank internet usa be be sue former internal auditor accuse bank internet
39,HRB,stock gap open tuesday spend most day grind lower measure chinese manufacturing show world second largest economy slow nasdaq fall dow jone industrial average stock market today volume be higher exchange accord preliminary datum ibd stock be higher be lower only gainer be wesson swhc company report earning well estimate close aug share gap higher next day follow gain monday tuesday solid volume trading highest level october close ambarella amba inched lower report earning be more regular session share block hrb be higher hour report fiscal loss cent share analyst be expect cent loss also say buy back stock market open wednesday census bureau release factory order july economist expect increase june factory order rise nonfarm productivity second quarter be expect rise unit labor cost drop open energy information administration release crude oil inventory week end aug federal reserve beige book be release later day be watch closely sign fed raise interest rate meeting follow ken hoover twitter ibd_khoover
40,HRB,stock seesaw lower finish veteran day wednesday dow jone industrial average nasdaq end accord preliminary datum volume be lower board stock market today close share popeye louisiana kitchen plki jump more company post result beat view fried chicken chain report earning cent share sale view be cent share revenue also slightly raise full year profit outlook range share vs view regular session horizon pharma hznp gap plunge nearly pharmacy benefit manager express script esrx file lawsuit company contract dispute amtrust financial service afsi gap day line slump pricing secondary offer share insurance firm say take expense intraday fall more buy point cup handle base rather lackluster session tal education xrs rally score new high fast trade follow wednesday clear buy point late stage cup handle tuesday company provide tutor china luxoft lxft gap jump beating view raise guidance late tuesday company report adjust fiscal earning cent share year earlier profit growth have now accelerate quarters sale rise luxoft lift full year profit outlook nickel share stock be now extend past buy point flat base weekly jobless claim be thursday morning host central bank official be speaking day include fed chairwoman janet yellen st loui fed chief james bullard richmond fed president jeffrey lacker advance auto part aap cisco system csco be couple notable company report earning thursday follow vincent mao twitter ibd_vmao
41,HRB,stock finished lower monday major index give early gain quickly volume be higher exchange accord preliminary datum
42,HRB,nasdaq fall drop dow jone industrial average give stock market today
43,HRB,dow component mcdonald mcd fall nearly heavy volume investor be spook disappointing same store sale
44,HRB,other dow stock chevron cvx exxon mobil xom drop respectively oil tumble finished day barrel
45,HRB,close spirit airline save unite continental ual report monthly traffic figure stock be trading lower hour
46,HRB,block hrb be lower hour report miss estimate
47,HRB,tuesday be light day economic indicator same store sale wholesale trade number be due morning stock finished lower monday major index give early gain quickly volume be higher exchange accord preliminary datum nasdaq fall drop dow jone industrial average give stock market today dow component mcdonald mcd fall nearly heavy volume investor be spook disappointing same store sale other dow stock chevron cvx exxon mobil xom drop respectively oil tumble finished day barrel close spirit airline save unite continental ual report monthly traffic figure stock be trading lower hour block hrb be lower hour report miss estimate tuesday be light day economic indicator same store sale wholesale trade number be due morning
48,HRB,block hrb share gap wednesday time usual volume report better expect fiscal revenue earning help tax return delay prior quarter
49,HRB,consumer tax preparer earn share year revenue grow consensus analyst poll thomson reuter be ep revenue
50,HRB,unusually harsh series winter storm much nation keep consumer away block office prior quarter create spillover business april end quarter
51,HRB,tax preparer count january april period massive profit offset loss other quarters
52,HRB,block have report larger loss usual recent quarters rise competition do tax preparation program such intuit intu turbotax other
53,HRB,block share be stock market today
54,HRB,fiscal company prepared return prior year drop be partly result discontinue free ez tax preparation service
55,HRB,block have be try focus core tax preparation business exit brokerage banking business agree april sell bofi hold bofi undisclosed price
56,HRB,follow james detar twitter ibd_jdetar block hrb share gap wednesday time usual volume report better expect fiscal revenue earning help tax return delay prior quarter consumer tax preparer earn share year revenue grow consensus analyst poll thomson reuter be ep revenue unusually harsh series winter storm much nation keep consumer away block office prior quarter create spillover business april end quarter tax preparer count january april period massive profit offset loss other quarters block have report larger loss usual recent quarters rise competition do tax preparation program such intuit intu turbotax other block share be stock market today fiscal company prepared return prior year drop be partly result discontinue free ez tax preparation service block have be try focus core tax preparation business exit brokerage banking business agree april sell bofi hold bofi undisclosed price follow james detar twitter ibd_jdetar
57,HRB,new law regulation make life more complicate company find way change landscape block hrb have see play field change respect first company saving loan arm face higher capital requirement dodd frank law respond putt arm block deal be work republic bank recently backed agreement still intend unload unit implementation new health insurance law be second factor initially be speculation many ir refund block navigate customer be wipe obamacare tax penalty not have health insurance human nature be human nature block be more likely get blame new law least be fear september block respond reach deal gohealth develop block brand service help client shop enroll health care plan determine eligibility apply government subsidy earning call september ceo william cobb say law not result materially positive impact business fiscal year still gohealth deal essentially lessen fear obamacare related negative impact block also obamacare be complicate hard understand play block strength fiscal fourth quarter end april be block moneymaking quarter investor focus annual earning ep grow last fiscal year flat revenue street expect growth fiscal year follow year sale growth be expect year company quarterly dividend be cent share work annualize yield dividend have not be increase past quarters
58,HRB,most american consumer know now brand label electronic most be make same network factory china shopper monoprice com follow logical conclusion not cut middleman buy gadget straight far east
59,HRB,monoprice launch selling cable switch have buy asia offer cut rate price thank simplified supply chain then expand computer accessory more recently audio video equipment august come stock market attention blucora bcor acquire
60,HRB,search engine root
61,HRB,blucora have seem unlikely buyer monoprice only thing company have common be internet blucora be know search engine infospace fingernail survivor dot com boom bust experiment various business model stabilize leadership ceo william ruckelshaus take helm
62,HRB,january however branch outside core business buy taxact provider cloud base tax preparation software monoprice taxact have carved place highly competitive market dominate intuit intu block hrb undercut rival price
63,HRB,taxact have product offer substantially same feature set larger player space characterize substantially more fair price filing ruckelshaus tell bmo technology medium entertainment conference december cornerstone offer be free federal filing everybody regardless filing type complexity agi adjust gross income exclusion
64,HRB,thing taxact monoprice have common be potential ruckelshaus see expansion estimate digital do tax market be grow year company have also be broaden product offering site design help person own will navigate obamacare
65,HRB,monoprice also continue offer wider variety ware more kind product available point ruckelshaus believe customer base be expand give high satisfaction exist customer reviews have give site rating say jeffery analyst brian fitzgerald write dec initiation report monoprice also benefit secular growth
66,HRB,monoprice operate large market be rapidly move online write global consumer electronic be market grow single digit online subsegment be forecast grow approximately annually accord idc
67,HRB,business transition
68,HRB,even so majority blucora revenue be still come core search business infospace unit doesn generate own search result aggregate result other search engine site such webcrawler well partner property distribution toolbar have more partner search revenue come top lead google goog
69,HRB,google have be source concern analyst early change software distribution policy response complaint mislead toolbar download wind take browser blucora change own policy accord google fitzgerald say slow search revenue growth quite bit last year third quarter
70,HRB,nonetheless blucora third quarter handily beat expectation send stock year high profit rise year earlier quarter cent share nearly double analyst consensus sale climb vs analyst estimate
71,HRB,conference call discuss result nov wedbush analyst gil lurium ask company have achieve such growth search revenue give policy change
72,HRB,ruckelshaus point advantage used distribution partner model own operated model
73,HRB,re start see evidence take advantage own operated side be really revert back company have origin be consumer face provider search solution be differentiate nature say re see recent period be ability not just bring product market also market promote way think be benefit consumer also benefit
74,HRB,nonetheless analyst still see overhang expiration infospace contract google end first quarter fitzgerald point google yahoo yhoo major infospace partner have refuse renew contract recently partner thought be abuse policy
75,HRB,however barrington research analyst paris didn sound worry dec research note
76,HRB,customer concentration be indeed high do believe agreement be renew similar term write
77,HRB,analyst overall expect continue solid growth blucora estimate fourth quarter sale jump year earlier quarter profit rise cent share most american consumer know now brand label electronic most be make same network factory china shopper monoprice com follow logical conclusion not cut middleman buy gadget straight far east monoprice launch selling cable switch have buy asia offer cut rate price thank simplified supply chain then expand computer accessory more recently audio video equipment august come stock market attention blucora bcor acquire search engine rootsblucora have seem unlikely buyer monoprice only thing company have common be internet blucora be know search engine infospace fingernail survivor dot com boom bust experiment various business model stabilize leadership ceo william ruckelshaus take helm january however branch outside core business buy taxact provider cloud base tax preparation software monoprice taxact have carved place highly competitive market dominate intuit intu block hrb undercut rival price taxact have product offer substantially same feature set larger player space characterize substantially more fair price filing ruckelshaus tell bmo technology medium entertainment conference december cornerstone offer be free federal filing everybody regardless filing type complexity agi adjust gross income exclusion thing taxact monoprice have common be potential ruckelshaus see expansion estimate digital do tax market be grow year company have also be broaden product offering site design help person own will navigate obamacare monoprice also continue offer wider variety ware more kind product available point ruckelshaus believe customer base be expand give high satisfaction exist customer reviews have give site rating say jeffery analyst brian fitzgerald write dec initiation report monoprice also benefit secular growth monoprice operate large market be rapidly move online write global consumer electronic be market grow single digit online subsegment be forecast grow approximately annually accord idc business transitioneven so majority blucora revenue be still come core search business infospace unit doesn generate own search result aggregate result other search engine site such webcrawler well partner property distribution toolbar have more partner search revenue come top lead google goog google have be source concern analyst early change software distribution policy response complaint mislead toolbar download wind take browser blucora change own policy accord google fitzgerald say slow search revenue growth quite bit last year third quarter nonetheless blucora third quarter handily beat expectation send stock year high profit rise year earlier quarter cent share nearly double analyst consensus sale climb vs analyst estimate conference call discuss result nov wedbush analyst gil lurium ask company have achieve such growth search revenue give policy change ruckelshaus point advantage used distribution partner model own operated model re start see evidence take advantage own operated side be really revert back company have origin be consumer face provider search solution be differentiate nature say re see recent period be ability not just bring product market also market promote way think be benefit consumer also benefit nonetheless analyst still see overhang expiration infospace contract google end first quarter fitzgerald point google yahoo yhoo major infospace partner have refuse renew contract recently partner thought be abuse policy however barrington research analyst paris didn sound worry dec research note customer concentration be indeed high do believe agreement be renew similar term write analyst overall expect continue solid growth blucora estimate fourth quarter sale jump year earlier quarter profit rise cent share
78,HRB,similar wise buy decision exit certain underperformer right time help maximize portfolio return selling loser be difficult share price estimate be fall be time get rid security more loss hit portfolio such stock want consider drop be block inc hrb free report have witness significant price decline past week have see negative earning estimate revision current quarter current year zack rank strong sell further confirm weakness hrb key reason move have be negative trend earning estimate revision full year have see estimate move past day compare upward revision trend have cause consensus estimate trend lower go share month current level also current quarter block have see downward estimate revision versus revision opposite direction drag consensus estimate loss cent share loss cent past day stock also have see pretty dismal trading lately share price have drop past month block inc price consensus block inc price consensus block inc quoteso not be good decision keep stock portfolio anymore least don have long time horizon be still interested consumer service miscellaneous industry instead consider better rank stock rent center inc rcii free report stock currently hold zack rank buy be better selection time see complete list today zack rank strong buy stock here more stock news be bigger iphone become mother technological revolution apple sell mere iphone year new breakthrough be expect generate more device just year create market zack have just release special report spotlight fast emerge phenomenon ticker take advantage don buy now kick click here trade
79,HRB,block inc hrb free report report fourth quarter fiscal end apr adjust earning continue operation share surpass zack consensus estimate result be drive increase revenue quarter gaap earning continue operation come share compare year quarter fiscal company report adjust earning continue operation share compare prior year improvement be attribute block lower effective tax rate improve pretax earning operational performancein report quarter block revenue come compare prior year quarter top line figure also outpaced zack consensus estimate block inc price consensus ep surprise block inc price consensus ep surprise block inc quote fiscal company report revenue compare prior year upside be drive increase assist tax preparation fee owing favorable net average charge mix partially offset decrease return volume total operate expense be year year owing higher compensation cost occupancy cost financial positionh block exit quarter cash cash equivalent compare apr total outstanding long term debt be approximately relatively flat prior year quarter fiscal year net cash provide operate activity be be higher year period dividendh block board director declare quarterly dividend cent share payable jul shareholder record jun notably company have be pay uninterrupted quarterly dividend shareholder go public zack rank other stock considerh block currently carry zack rank buy other top rank stock same space be weight watcher international inc wtw free report sp corporation sp free report interface inc tile free report weight watcher international sport zack rank strong buy sp interface carry zack rank see complete list today zack rank stock here weight watcher international surpass estimate trail quarters average beat sp exceed estimate thrice trail quarters average beat interface outpaced estimate trail quarters average beat hottest tech mega trend last year generate global revenue predict blast roof fame investor mark cuban say produce world first trillionaire still leave plenty money regular investor make right trade early see zack best stock play trend
80,HRB,rent center inc rcii free report be previously announce comprehensive review strategic financial alternative part management also explore possible divestiture company however rent center do not get buyout offer suit main business sale objective such maximize shareholder value follow detailed review various alternative management believe continue previously unveil strategic plan be best company well shareholder well rent center have be well track strategic plan be yielding solid result be clearly reflect company revise financial guidance core april operate metric preliminary april sale datain april core same store sale rise same store sale acceptance now anow increase core same store sale jump anow increase better expect performance business be backed robust portfolio performance further improve pricing better marketing endeavor fuel core customer growth first time ever april also customer retention increase considerably comparison historical average same store sale anow be also drive double digit rise demand courtesy recently execute value plan most anow location update cost saving strategic initiative underway rent center be move exceedingly well solidify financial status enhance result markedly company cost save initiative be much ahead track make hopeful generate annual run rate saving more saving roughly fare better management february april forecast february rent center forecast annual saving range deliver april management upgrade outlook predict annual saving generate outlook zack rank hold company envision consolidated revenue range include core revenue anow revenue further adjust ebitda be expect range finally management envision adjust earning band cent free cash flow year be anticipate least expect april second quarter rent center project consolidated revenue range core revenue be expect range revenue anow be likely come band management expect adjust ebitda be roughly adjust earning be cent share free cash flow be likely be clearly guidance reflect management confidence company capability drive profitability enrich shareholder value let see factor drive further growth stock have gain past month industry grow interested same space check stocksweight watcher international wtw free report long term earning growth rate carry zack rank strong buy see complete list today zack rank stock here block hrb free report zack rank buy have long term earning growth rate sp corporation sp free report also zack rank have long term earning growth rate hottest tech mega trend last year generate global revenue predict blast roof fame investor mark cuban say produce world first trillionaire still leave plenty money regular investor make right trade early see zack best stock play trend
