,ticker,content
205,HRB,company ticker current qtr year qtr last ep surprise report day timexcerra corp xcra monday btoability inc abil monday btoutd natural fds unfi monday amcthor ind inc tho monday amcsigma design sigm monday amcxactly corp xtly monday amccovisint corp covs monday amclayne christen layn monday amchd supply hldgs hds tuesday btomichael co mik tuesday btonavistar intl nav tuesday btovince holdng cp vnce tuesday btoadv drainag sys wm tuesday btohooker furnitur hoft tuesday btoiao kun group ikgh tuesday btovaleant pharma vrx tuesday btodave bustrs ent play tuesday amcoxford ind inc oxm tuesday amcseachange intl seac tuesday amchealthequity hqy tuesday amcduluth holding dlth tuesday amcverifone systms pay tuesday amcverint system vrnt tuesday amcuqm tech inc uqm tuesday amcbrown forman bf wednesday btolululemon athlt lulu wednesday btogreif inc gef wednesday btopointer telocat pntr wednesday btorenren inc adr renn wednesday btotailore brand tlrd wednesday amcabm industry abm wednesday amcferrellgas lp fgp wednesday amcstreamline hlth strm wednesday amcrestoration hdw rh wednesday amcfuelcell energy fcel wednesday amcdavidstea inc dtea wednesday amcmitcham ind mind wednesday amcdominion diamnd ddc wednesday amcsmucker jm sjm thursday btovail resort mtn thursday btocrown craft crws thursday btofrancescas hldg fran thursday bnk cbk thursday btoblock hrb thursday amccapstone turbin cpst thursday amccherokee inc chke thursday amcari network svc aris thursday amcorganovo hldgs onvo thursday amckmg chemical kmg thursday firm mfrm thursday amclimoneira co lmnr thursday amc
206,HRB,tax season finally company be probably still fresh american mind block hrb free report kansa city base tax preparation company offer tax advice do tax return preparation advance tax refund country
207,HRB,many american certainly used service past tax season competitive pressure be certainly build company be largely thank advent popularity intuit intu free report turbotax software be eating away hrb core market
208,HRB,thank part pressure hrb stock have be struggle late have underperform key peer past year hasn help hrb have see sluggish result international market too have force company post pretty horrendous result earning season suggest hrb have great trouble meeting earning
209,HRB,fact last quarters hrb have miss zack consensus estimate time average surprise company best miss do come key tax season quarter even then firm miss nearly compare zack consensus estimate
210,HRB,recent weakness mind serious competitive pressure build lofty stock shouldn be too surprising note many earning estimate have be fall hrb late past day not single estimate have go higher hrb earning outlook several have go lower
211,HRB,pain be especially apparent investor look current year next year time frame estimate have go share current year day just today meanwhile next year period share be estimate month once again be push time share suggest analyst be ratchete expectation hrb not only term long haul well
212,HRB,concern have keep lid hrb share stock have add past year just trail month ytd look hrb have lose underperform market face more trouble next earning report recent earning estimate trend be guide
213,HRB,be particularly true investor consider hrb have zack rank strong sell earning esp metric be negative combine factor be generally harbinger negative news earning season give sluggish hrb have be earning season wouldn be much shock see lackluster report tax preparation firm other pick
214,HRB,investor be search better pick consumer service space be worth note sector currently have poor zack industry rank many firm segment have see earning estimate revision move wrong direction however be standout outerwall outr stock have zack rank buy
215,HRB,security see positive surprise most recent earning report rank just moved hold buy now be time consider stock instead embattled block least earning estimate revision activity turn hrb
216,HRB,want latest recommendation zack investment research today download best stock next day click get free report
217,HRB,last week chicago quantitative alliance cqa hold annual fall conference member be able attend interesting day event presentation enjoy most be psychology base talk center reason don perform best move optimal performance remind book recently finished title inner game tennis book have application reach much further title suggest so have easily be call inner game prepare surgery stock investing anything else life
218,HRB,basic premise psychological performance theme be tend think re do be better simply do be course do only ve spend hour prepare practice hone game once be skilled do something just do don think analysis cause paralysis certain thought process analysis also lead confirmation bias study have show analysis confirmation bias do impede performance
219,HRB,highly important do due diligence stock do believe too many investor buy story become emotionally tie mentally commit stock fairly clear sell condition change harder do re commit stock ve get be able let go stock struggle avoid begin something just isn right
220,HRB,person also make mistake form initial viewpoint then only see thing confirm first opinion ignore item don match preliminary thought confirmation bias affect aspect life include stock investing buy stock clearly have favorable viewpoint tend ignore negative aspect be heed avoid potential mistake
221,HRB,take pleasure investing quantitative strategy ve build strategy be confident have good economic rationale superior performance follow even tell sell stock rather hold remove emotion process allow strategy drive return indicate buy sell feel thing give edge market don buy story be not commit specific stock simply see interchangeable vehicle useful make money believe be time investor miss profitable opportunity re tie story stock price remain stagnant versus buy stock true return potential remember good company be not always good investment
222,HRB,also don mind strategy tell short well know company buy company ve never hear so quantitative strategy also help remove familiarity bias be purchase only stock have hear avoid one be unfamiliar fact thing best quantitative strategy be often unearth unfamiliar stock little know stock provide great opportunity profit fewer eye be watch just do
223,HRB,easiest way implement quantitative strategy be screen screen be great way find stock base indicator matter be so much information available investor best focus stock pick proven idea
224,HRB,zack research wizard allow shift hundred different datum item determine be most important then develop screen identify stock meet desire criterium once screen have be test determine profitability just save run often generate list stock
225,HRB,research wizard contain number pre build strategy ll take look growth income winner example here strategy compare historical test august august
226,HRB,result show time strategy significantly outperformed last year annualize rate return growth income winner be higher maximum loss half much now impressive
227,HRB,here find growth income winner first create liquid investible set stock price be greater average daily trading volume greater equal share not enough liquidity ll be hard trade select only stock current zack rank less equal want stock rate least buy hold select company roe higher median want higher average profitability next pick stock less median don want overpay stock then choose only debt equity ratio less debt be good too much be problem beta be less equal low volatility stock reduce risk finally select stock sector highest dividend yield be look good dividend well
228,HRB,here be stock pass screen week ec ecopetrol
229,HRB,ecopetrol base bogota colombia be integrate oil company engage exploration development production crude oil natural gas company have better average valuation good profitability roe have dividend yield ecopetrol also have manageable debt level debt equity low volatility stock price azn astrazeneca plc
230,HRB,astrazeneca engage discovery development prescription medicine cardiovascular neuroscience respiratory inflammation oncology infectious disease worldwide company be top pharmaceutical company world have very attractive valuation base company also have good profitability measure lower average debt level dividend yield be also very appeal rai reynold american inc
231,HRB,reynold american subsidiary manufacture sell cigarette other tobacco product unite state company have mildly attractive valuation be highly stable profitable offer nice dividend price also company be beat earning expectation most recent quarter lead buy rating zack rank rnf rentech nitrogen partner
232,HRB,rentech engage production natural gas base nitrogen fertilizer industrial product agricultural used highly profitable company be ve probably never hear pay nice dividend stock price be ytd even consider price appreciation be still earning projection company have be revise upward many time lead zack rank rating hrb block inc
233,HRB,block subsidiary engage provision tax preparation related service general public unite state interesting stock pass screen week be mentioned cqa conference stock perform better democrat oval office block valuation be just little better average have strong roe high dividend yield low debt have also see earning projection next couple year improve perhaps anticipation incumbent victory november buy result not story
234,HRB,not analysis be good obviously need focus avoid bad analysis concentrate good easiest way do be implement quantitative screen once have develop screen work follow good confirm number ensure everything make sense don think pick get commit specific stock get commit strategy complete portfolio
235,HRB,strategy highlighted article pick stock have low volatility pay high dividend be also perfect stock retract market usually flight quality stability market have identity crisis want see other pick same genre perhaps have other idea pick winning stock problem zack research wizard be used develop screen uncover outperform stock investing style
236,HRB,start today be invite use free charge ll have day create tweak backtest strategy same time see latest pick pre load winning strategy average gain year learn more research wizard free trial
237,HRB,let make money
238,HRB,kip kip robbin be quantitative analyst zack com analyze screen strategy zack customer use zack research wizard empower individual investor use market beating screen build own backtest result
239,HRB,block inc hrb free report have deliver positive earning surprise last quarters boast dividend yield sufficiently higher industry average
240,HRB,follow fiscal fourth quarter earning release share tax service provider be move upward company currently hold zack rank buy fiscal fourth quarter result
241,HRB,substantially block revenue income tax return preparation related service product be receive january april most client file tax return period
242,HRB,block report fourth quarter result june earning come share surpass zack consensus estimate cent little more however miss year quarter earning almost
243,HRB,fiscal block adjust income come share exceed zack consensus estimate cent
244,HRB,fourth quarter revenue decline year year revenue be almost line zack consensus estimate lower financial product revenue more offset rise tax preparation related revenue eventually lead revenue decline
245,HRB,follow earning release analyst have raise estimate fiscal zack consensus estimate be currently be nearly day estimate be revise upward outlook also suggest year year increase fiscal zack consensus estimate have improve penny time represent year year increase dividend
246,HRB,last year board have authorize dividend hike time last dividend increase be announce december
247,HRB,annual dividend payout cent dividend yield come much higher nearest peer intuit inc intu dividend yield well industry average valuation look attractive
248,HRB,share block currently trade forward discount peer group average year historical median price book basis share be currently trading discount peer group average
249,HRB,give long term growth projection peg ratio come marginally benchmark fairly price stock
250,HRB,give double digit earning growth prospect current year valuation present window opportunity investor seek income growth sum
251,HRB,performance block be tie overall health economy nevertheless company have continuously buy back share paid dividend current economic uncertainty block be also increase share digital assist space well grow international operation
252,HRB,founder headquarter kansa city missouri block provide tax preparation service retail tax office canada australia approximately employee company market capitalization be
253,HRB,earning preview
254,HRB,only be handful firm report next week third quarter report season be almost total firm be schedule report include
255,HRB,firm report next week include big lot big free report block hrb free report bank nova scotia bns kroger kr free report royal bank canada ry free report toronto dominion td tif
256,HRB,not be much go earning front more be make economic datum front start week new home sale finish week important job report
257,HRB,way get usual precursor employment report adp survey also get second look productivity unit labor cost third quarter ism manufacturing survey case schiller index housing price have potential move market combine ongoing saga europe make interesting week monday
258,HRB,new home sale be expect fall ever so slightly rate very weak september be simply pathetic level even be slightly record low set january record go back kennedy administration do come be still lower month prior used home sale new home sell represent lot economic activity thus be very important report normally new home sale be lead economy recession have be huge drag time tuesday
259,HRB,case schiller home price index gold standard housing price index be likely show year year decline september august decline be month month basis index be seasonally adjust basis seasonally adjust july august give be now month worth used home inventory market normal be month think be go see continuation home price decline rest year be particularly true more widely report seasonally adjust figure prefer work seasonally adjust number be significant seasonality home price however give very high level affordability due low mortgage rate normal opposed wildly inflate price relative rent income decline be relatively modest continue weakness used home price be big part reason new home sale have be so weak
260,HRB,consumer confidence be expect edge read october be still very weak read so don get too excited increase consumer be economy be important indicator unfortunately consumer say survey actually do be often very different mostly be coincident indicator reflect gasoline price unemployment rate situation europe play role very soft read october probably do so again month think similar university michigan survey be very rate datum point still be very low level be consistent other datum have be see debt ceiling circus downgrade probably hurt confidence fall gas price tick unemployment rate last month wednesday
261,HRB,get first clue big friday job report come adp employment survey last month report growth private sector job slightly report bls adp largest payroll processor be very good position judge employment trend number be often quite different official government number however time do tend track pretty well government often revise number direction adp number month consensus be look adp report growth private sector job take
262,HRB,chicago pmi report mini regional ism be expect fall be magic index so read indicate expansion thus be expect show industrial economy upper midwest be still expand solid pace not quite strong last month
263,HRB,federeal reserve release beige book compilation mostly anecdotal evidence federal reserve district country be likely indicate continue growth economy frustratingly slow pace thursday
264,HRB,weekly initial claim unemployment insurance recently break psychologically important level last week rise only previous week have be revise upward so be really more rise consensus be look week thanksgiving holiday skew lower so don get too excited have very low number week level be important have historically be inflection point tend create enough job bring unemployment rate week week number be very volatile so week average be thing focus keep eye prior week revision well change revise number
265,HRB,continue jobless claim have be downtrend late road have be bumpy last week rise however be year expect small decline week consensus be look bounce most longer term decline be due person simply exhaust regular state benefit run week however don last forever federally paid extend claim fall last week be last year look just regular continue claim number be serious mistake only include little half unemployed now give unprecedentedly high duration unemployment figure better measure be total number person get unemployment benefit currently be last week be timing issue so change continue exist claim do not match change total total number person get benefit be now year level be not know be many person have left extend claim road prosperity find new job many have left road poverty have simply exhaust even extend benefit program be renew extend benefit end january make sure look set number many press report not here zack
266,HRB,ism manufacturing index be expect rise october be also magic index so come expect indicate manufacturing economy nationwide be still expand anemic pace just bit faster october
267,HRB,construction spending be expect have increase very slight october match increase september least be growth
268,HRB,auto light truck sale be likely rise slightly seasonally adjust annual rate post october be nicely recession low be far cry pace be often see recession start friday
269,HRB,most important report week be doubt employment report be expect show total number job economy produce november rise october october report come weaker expect miss be offset very big upward revision previous month once again private sector alone be expect do better produce job last month imply expect loss government job month suspect private sector do better consensus be look give recent fall initial claim mark also expect more government job lose month
270,HRB,unemployment rate be derive separate survey job creation number be expect remain number job create accord household survey be much stronger indicated establishment survey september october key much unemployment rate change be participation rate rise third month row be come year low july increase participation rate be good sign unemployment rate tick only due increase participation be not bad however participation rate start decline again be very bad news even result slightly lower unemployment rate
271,HRB,average hourly earning be expect rise same pace october average workweek be also expect remain stick hour employer be see more demand thus more profitable business oppurtunity be hold back hire due uncertainty regulation taxe expect work exist workforce longer hour have decidedly not be case last year potential positive negative surprise
272,HRB,best indicator firm likely report positive surprise be recent history positive surprise rise estimate go report zack rank be also good indicator potential surprise similarly recent history earning disappointment cut average estimate quarter month report be due poor zack rank be often red flag point potential disappointing earning report
273,HRB,earning calendar be read give very small number firm report next week be few good cadidate make good predicition potential positive negative surprise thus omit section week
274,HRB,want follow twitter be ticker qtr end ep year ep last ep surprise next ep report date time daily pricealexco resource axu amc china cord bld co amc copart inc cprt amc hillenbrand inc amc taomee holding taom amc beacon roofing becn bto fifth street fi fsc amc global educ tec gedu amc kongzhong adr kong amc lentuo int ad la bto omnivision tech ovti amc ralcorp hld new rah amc simulation slp thor ind inc tho amc co tif bto univl tech uti amc zoltek co inc zolt amc aeropostale inc aro amc amer eagle outf aeo bto avanir pharm avnr bto camelot inf ad cis bto casella waste cwst amc coldwater creek cwtr amc express inc expr amc finisar corp fnsr amc fresh market tfm bto gordman store gman amc guess inc ge amc johnson outdoor jout bto jos bank clth josb bto krispy kreme kkd amc la boy inc lzb amc orckit comm orct bto rex american rs rex bto rue inc rue amc seadrill ltd sdrl bto semtech corp smtc amc sigma design sigm amc synopsys inc snps amc utd natural fds unfi bto amer software amswa retail asna amc technolog avgo amc barne noble bks bto block hrb amc cdn impl bk cm bto charming shoppe chrs bto descarte sys dsgx bto flow intl corp flow amc gildan actvwear gil bto isle capri isle bto kroger co kr bto lululemon athlt lulu bto magma design lava amc mitel network mitl amc movado grp inc mov bto pvh corp pvh amc shanda interact snda amc synovis lif tec syno bto talbot inc tlb bto toronto dom bnk td bto ulta salon cosm ulta amc uti worldwide utiw bto zumiez inc zumz amc bank nova sc bns bto big lot inc big bto female health fhco bto royal bank cda ry bto teavana hold tea bto
275,HRB,earning preview
276,HRB,second quarter earning season be almost mostly be retailer many have fiscal quarters end july not june be few significant retailer report week well be just firm report be
277,HRB,next friday afternoon almost have report earning season have be very strong firm report positive surprise have disappoint firm report next week include brown foreman bf free report campbell soup cpb free report block hrb free report joy global joyg saic inc saic
