,ticker,content
175,JBHT,transportation sector be struggle earning season total earning sector total market capitalization have report so far revenue growth be much earning growth revenue growth same period last report cycle read sector etfs revenue growth play earning revenue beat ratio respectively be also disappointing fact most industry player dominate sector manage beat estimate earning revenue better understand let dig earning result well know industry player transportation earning world largest package delivery company unite parcel service up free report top zack consensus estimate front earning surpass earning estimate penny revenue edge past estimate fiscal company narrow earning share guidance range zack consensus estimate time earning release be peg major railroad union pacific unp free report kansa city southern ksu free report norfolk southern corp nsc free report also beat top bottom line nsc outpaced earning estimate wide margin cent earning unp ksu come ahead penny cent respectively revenue railroad trump zack consensus estimate respectively ryder system free report leader supply chain management fleet management service beat earning estimate cent revenue estimate largest airline delta air line dal free report unite continental ual free report report better expect result latter lag revenue earning revenue delta edge past zack consensus estimate respectively unite continental earning share come zack consensus estimate revenue slightly fall shy estimate read airline etf crash subdue take value last not least earning lead trucking carrier hunt jbht free report come zack consensus estimate nickel revenue be estimate etfs sector see average decline average price difference day earning announcement stock response earning announcement such transport etfs ishare dow jone transportation average fund iyt free report spdr transportation etf xtn free report see rough trading past month iyt shed xtn be fund have unfavorable zack etf rank sell rating high risk outlook see industrial etfs here fund track dow jone transportation average index give investor exposure small basket security fund have certain tilt large cap stock mid small cap account share respectively basket product be heavily concentrated top firm fedex fdx focus firm collectively make portfolio sector perspective air freight logistic take top spot portfolio railroad trucking airline round next spot double digit exposure fund have accumulate nearly aum see solid trading volume share day charge bps annual fee fund track transportation select industry index hold stock basket be skewer small cap rest be split mid large cap result focus firm account share further portfolio be dominate trucking airline take fourth share airfreight logistic railroad also make double digit allocation aum fund charge bps fee year investor trade lower volume share day read etfs buy weak job report want key etf info deliver straight inbox zack free fund newsletter brief top news analysis well top perform etfs week get free
176,JBHT,third quarter earning season be tail end majority company have already unveil quarterly financial number picture have emanate so far be healthy earning season remain track end strong note display substantial growth already reassure picture be expect get rosier end week course company include player be expect report financial figure consequently have report player company highly seek space have already post result nov latest earning preview top bottom line company expand respectively year year basis additionally approximately member have outperformed revenue earning front progress quarterly performance be attribute turnaround economy improve job market scenario other factor fact stock highly seek fraternity be project end third quarter top bottom line expand respectively also zack sector be expect witness bottom line expand year year basis turbulent widely diversify zack transportation sector do not share rosy picture sectoral earning project contract due higher cost recent hurricane evidently bottom line key sectoral participant delta air line dal free report unite continental holding ual free report third quarter have contract respective year year basis thus substantiate fact transportation sector have be worst victim natural disaster harvey irma marium earthquake mexico example airline operator have cancel multiple flight lead significant loss revenue additionally catastrophe have hurt operation railroad damage important rail line lead rapid increase freight cost also sluggishness automotive unit be cause concern railroad trucking company shortage driver remain major headwind meanwhile rise labor cost have hurt hunt transport service jbht free report third quarter result trend be likely continue rest quarter give backdrop investor interested transportation space keenly await third quarter report sector participant expeditor international washington expd free report atla air worldwide holding aaww free report be schedule nov accord quantitative model company need right combination key ingredient positive earning esp zack rank hold better increase odd earning surprise see complete list today zack rank strong buy stock here expeditor international washington provide logistic service globally company be engage business global logistic management include international freight forwarding consolidation air ocean freight higher operate expense be likely hit transportation company bottom line quarter fact increase volume lead higher operate expense primary division airfreight service ocean freight ocean service custom brokerage other service company personnel expense be also expect be high owing higher headcount however top line be anticipate improve soon be report quarter prevalent imbalance demand supply airfreight market volume growth be likely drive revenue flagship division fact zack consensus estimate airfreight service segment third quarter revenue be peg higher report previous quarter total revenue ocean freight ocean service unit be also expect increase backed volume growth zack consensus estimate segment third quarter revenue be peg higher report second quarter meanwhile zack consensus estimate custom brokerage other service segment third quarter revenue be peg higher report last quarter yet chance transportation company beating zack consensus estimate be less even carry zack rank be expeditor have earning esp most accurate estimate zack consensus estimate be peg cent uncover best stock buy sell re report earning esp filter fact model do not predict earning beat earlier well previously issue earning preview article company have earning esp zack rank remain same expeditor international washington inc price ep surprise expeditor international washington inc price ep surprise expeditor international washington inc quoteatla air worldwide be parent company atla air polar air cargo together operate world largest fleet boee freighter aircraft company be primarily involved airport airport air transportation heavy freight cargo operate subsidiary airline expect higher cost hurt company bottom line third quarter zack consensus estimate expense aircraft fuel be peg higher figure report year moreover zack consensus estimate block hour measure aircraft utilization be peg higher figure report second quarter moreover accord proven model atla air worldwide have less chance beating estimate quarter zack rank be have earning esp most accurate estimate zack consensus estimate be peg atla air worldwide holding price ep surprise atla air worldwide holding price ep surprise atla air worldwide holding quotewall street next amazon zack evp kevin matra believe familiar stock have only just begin climb become greatest investment time once generation opportunity invest pure genius click detail
177,JBHT,have be month last earning report hunt transport service inc jbht free report share have add time frame outperform market recent positive trend continue lead stock next earning release be due pullback dive investor analyst have react late let take quick look most recent earning report order get better handle important catalyst hunt stock fall earning sale missj hunt earning share miss zack consensus estimate bottom line also dip year year basis total operate revenue increase year year marginally fall short zack consensus estimate exclude fuel surcharge operate revenue increase year year operate income second quarter decrease lower customer rate hurt result interest expense increase year year basis effective income tax rate second quarter be compare year company expect tax rate full year addition company revise aspect full year guidance example capex be now project old guidance segmental intermodal division report quarterly revenue year year overall volume segment climb revenue load exclude fuel surcharge revenue dip operate income increase year year dedicate contract service revenue increase year year company add new truck fleet customer retention rate remain operate income decrease year year primarily due increase cost driver wage capacity solution revenue surge year year back increase volume revenue load plunge year year basis operate income decline due lower gross profit margin higher cost truck revenue decrease end quarter company operated tractor year year also operate income decrease due higher cost higher driver pay liquidityat end second quarter cash cash equivalent be compare approximately end long term debt be compare end have estimate be move then follow release investor have witness downward trend fresh estimate have be revision higher current quarter compare lower look back additional day see even more upward momentum hunt transport service inc price consensus hunt transport service inc price consensus hunt transport service inc quotevgm scoresat time hunt stock have nice growth score be lag lot momentum front however stock be allocate grade value side putt second quintile investment strategy overall stock have aggregate vgm score aren focuse strategy score be be interested zack style score indicate company stock be suitable value growth investor outlookestimate have be broadly trend downward stock magnitude revision also indicate downward shift notably stock have zack rank hold be look inline return stock next few month
178,JBHT,hunt transport service inc jbht free report perform disappointingly second quarter report lower expect earning well revenue transportation company earning cent share miss zack consensus estimate cent bottom line also dip year year basis due higher operate expense total operate revenue increase year year marginally fall short zack consensus estimate exclude fuel surcharge operate revenue increase year year top bottom line miss disappoint investor consequently share company decline early trading quarter zack rank sell company repurchase approximately share see complete list today zack rank strong buy stock here operate income second quarter decrease lower customer rate hurt result interest expense increase year year basis effective income tax rate second quarter be compare year company expect tax rate full year addition company revise aspect full year guidance example capex be now project old guidance segmental intermodal division report quarterly revenue year year overall volume segment climb revenue load exclude fuel surcharge revenue dip operate income increase year year dedicate contract service revenue increase year year company add new truck fleet customer retention rate remain operate income decrease year year primarily due increase cost driver wage capacity solution revenue surge year year back increase volume revenue load plunge year year basis operate income decline due lower gross profit margin higher cost truck revenue decrease end quarter company operated tractor year year also operate income decrease due higher cost higher driver pay liquidityat end second quarter cash cash equivalent be compare approximately end long term debt be compare end hunt transport service inc price ep surprise hunt transport service inc price ep surprise hunt transport service inc quoteupcome interested transportation sector be keenly await second quarter earning report key player kansa city southern ksu free report canadian national railway company cni free report norfolk southern corp nsc free report come day kansa city southern be schedule report jul canadian national norfolk southern be schedule report jul jul respectively today stock zack hottest strategiesit hard believe even zack market gain top stock pick screen have return respectively outperformance have not just be recent phenomenon year have be remarkably consistent composite yearly average gain strategy have beaten market more maybe even more remarkable be fact re willing share latest stock cost obligation see free
179,JBHT,earning season be full flow earning report available more company fact current week be extremely busy company include player slate unveil number course latest earning preview stock highly seek fraternity be project end top bottom line expand respectively fact zack sector be expect witness bottom line expand year year basis rough ride transport zack transportation sector do not share rosy picture sectoral earning project contract due higher cost recent hurricane fact bottom line key sectoral participant delta air line dal free report unite continental holding ual free report have contract respectively year year basis notably unfavorable projection widely diversify sector highlight fact have be worst victim natural disaster harvey irma marium earthquake mexico example airline operator have cancel multiple flight lead significant loss revenue fact negative impact hurricane be also well reflect key transportation earning report available thus far evidently unite continental holding have cancel flight quarter consequently third quarter pretax income reduce tune approximately additionally catastrophe have hurt operation railroad damage important rail line lead rapid increase freight cost also sluggishness automotive unit be cause concern railroad trucking company shortage driver remain major headwind meanwhile rise labor cost have hurt hunt transport service jbht free report third quarter result trend be likely continue rest stock watch earning oct give backdrop investor interested transportation space keenly await report key sector participant american airline group aal free report unite parcel service up free report southwest airline luv free report be schedule oct accord quantitative model company need right combination key ingredient positive earning zack rank hold better increase odd earning surprise american airline group headquarter fort worth tx operate more daily flight destination more nation globe late carrier also undergo turbulent phase other airline mainly due hurricane consequently company call approximately flight third quarter also increase cost fuel labor be expect hit bottom line zack consensus estimate third quarter fuel price gallon include taxe be peg much higher report year disruption scenario respect total revenue available seat mile trasm be improve year quarter courtesy better expect yield third quarter american airline expect total revenue available seat mile trasm grow zack consensus estimate third quarter trasm be peg cent higher cent report third quarter zack consensus estimate third quarter yield be peg cent higher cent report third quarter however chance legacy carrier beating zack consensus estimate be less even have earning esp be american airline zack rank strong sell act spoiler fact model do not predict earning beat earlier well previously issue earning preview article company have earning esp zack rank remain same uncover best stock buy sell re report earning esp filter american airline group inc price ep surprise american airline group inc price ep surprise american airline group inc next company unite parcel service be world largest express carrier markedly up provide specialize transportation logistic service unite state internationally zack consensus estimate third quarter domestic package revenue be peg just figure report second quarter same international package revenue be peg figure report second quarter also high cost be likely hurt company bottom line be report quarter accord proven model chance company beating zack consensus estimate earning quarter be less zack rank be have earning esp read more card up stock earning season unite parcel service inc price ep surprise unite parcel service inc price ep surprise unite parcel service inc see complete list today zack rank strong buy stock here earning performance apart focus be update regard preparation upcoming holiday season additionally growth commerce be likely benefit up meanwhile southwest airline third quarter result be expect be hurt due recent hurricane earthquake mexico natural disaster have force airline cancel approximately flight owing multiple flight cancellation company expect quarters operate revenue be hurt tune increase cost be expect hurt bottom line well cost available seat mile exclude special item be estimate increase fuel price gallon be anticipate quarter zack consensus estimate third quarter fuel price be peg gallon higher report second quarter accord proven model chance company beating zack consensus estimate earning quarter be less be have earning esp carry zack rank sell read more southwest airline disappoint earning southwest airline company price ep surprise southwest airline company price ep surprise southwest airline company quote zack hide trade share many recommendation idea public certain move be hide everyone select member portfolio service peek curtain today view start now next month invite follow zack private buy sell real time value momentum stock etf option mover insider trade company be report positive earning surprise ve call accuracy even look portfolio so exclusive be normally close new investor click here zack secret trade
180,JBHT,canadian pacific railway limit cp free report be schedule report second quarter result jul market close last report quarter company come negative earning surprise lower expect earning revenue result be hurt rough weather condition however top bottom line improve year figure thing do not look company be report quarter too factor playsimilar previous quarter revenue grain forest product automotive segment decline second quarter well soft revenue be likely affect top line overall result company high operate expense also raise concern be anticipate hurt operate ratio limit bottom line growth further add wo be company high debt level debt equity expressed percentage ratio be currently more figure compare unfavorably industry average index tally due headwind share company have underperform industry apr june period gain only compare industry rise however company measure reward shareholder dividend share buyback be impressive raise quarterly dividend share share company be also active repurchase front earning whispersour proven model do not conclusively show canadian pacific be likely beat estimate quarter be stock need have positive earning esp favorable zack rank strong buy buy hold happen be not case here elaborate zack esp canadian pacific have earning esp most accurate estimate be peg share marginally lower zack consensus estimate uncover best stock buy sell re report earning esp filter zack rank canadian pacific carry zack rank sell caution sell rate stock go earning announcement especially company be see negative estimate revision canadian pacific railway limit price ep surprise canadian pacific railway limit price ep surprise canadian pacific railway limit quotestock interested broader transportation sector check stock worth consider namely unite parcel service inc up free report union pacific corporation unp free report hunt transport service inc jbht free report stock possess right combination element come earning beat next release up have earning esp zack rank company report second quarter earning jul union pacific have earning esp zack rank company be schedule release second quarter financial figure jul hunt have earning esp zack rank company announce second quarter earning number jul see complete list today zack rank stock here more stock news be bigger iphone become mother technological revolution apple sell mere iphone year new breakthrough be expect generate more device just year create market zack have just release special report spotlight fast emerge phenomenon ticker take advantage don buy now kick click here trade
181,JBHT,csx corporation csx free report be slate report second quarter earning jul market close last report quarter company deliver positive earning surprise better expect earning revenue moreover measure improve year year basis substantial decrease operate expense also aid result precision schedule railroad well underway thing look company second quarter well likely positive surprise proven model show csx be likely beat earning quarter back perfect combination follow key ingredient zack esp csx have earning esp represent difference most accurate estimate zack consensus estimate most accurate estimate stand cent share zack consensus estimate be peg lower cent positive zack esp be indicative likely positive earning surprise uncover best stock buy sell re report earning esp filter zack rank csx carry zack rank buy increase predictive power esp note stock favorable zack rank strong buy hold have significantly higher chance beating estimate conversely sell rate stock never be consider go earning announcement especially company be see negative estimate revision csx corporation price ep surprise csx corporation price ep surprise csx corporation quotefactor likely company cost cut effort be anticipate boost result be report quarter csx have be benefitting immensely precision schedule railroad system design improve operational efficiency lower cost optimal asset utilization reduce operate expense be expect improve operate ratio drive bottom line growth impressive performance intermodal coal segment be also likely produce better result soon be report quarter zack consensus estimate second quarter intermodal revenue stand higher year figure also compare favorably record precede quarter consensus mark coal revenue be peg tally compare favorably report prior year quarter first quarter respectively needless mention new tax law be also expect buoy result second quarter expect tax cut job act have be aid result implementation december second quarter be not likely be different reduce effective tax rate arise slash corporate tax rate be expect boost company bottom line period be report however company high debt level remain cause concern other stock interested broader transportation sector also consider unite parcel service inc up free report union pacific corporation unp free report hunt transport service inc jbht free report stock too possess right combination element come earning beat next release up have earning esp zack rank company report second quarter earning jul union pacific have earning esp zack rank company be schedule release second quarter financial figure jul hunt have earning esp zack rank company announce second quarter earning number jul see complete list today zack rank stock here more stock news be bigger iphone become mother technological revolution apple sell mere iphone year new breakthrough be expect generate more device just year create market zack have just release special report spotlight fast emerge phenomenon ticker take advantage don buy now kick click here trade
