,ticker,content
157,JBHT,be well document fact high oil price have prevent airline stock fly high year fact oil price have increase more year date notably high oil price do not bode well company airline space fuel cost account significant chunk expenditure other airline high fuel cost be hurt delta air line inc dal free report too remind investor even atlanta ga base company marginally surpass zack consensus estimate earning first quarter metric decline year year bottom line contraction be mainly attribute high fuel cost moreover first quarter earning beat fail translate strength stock evident year date plunge year date price performance oil price continue move northward stock disappoint company release second quarter result jul fact stock lose further value dismal result however earning beat doesn look very difficult delta second quarter zack consensus estimate be pretty conservative number downward revision last couple month quantitative model too point earning beat soon be report quarter here delta have right combination key ingredient positive earning esp zack rank hold better increase odd earning surprise zack esp delta have earning esp most accurate estimate be zack consensus estimate be peg cent lower uncover best stock buy sell re report earning esp filter zack rank delta carry zack rank note stock zack rank strong buy buy have significantly higher chance beating earning estimate see complete list today zack rank stock here conversely sell rate stock zack rank never be consider go earning announcement combination delta zack rank positive esp make reasonably confident earning beat delta air line inc price ep surprise delta air line inc price ep surprise delta air line inc quotefactor likely playsimilar last report quarter high fuel cost be likely act key dampener delta earning second quarter note oil price increase april june period zack consensus estimate second quarter average fuel price mainline net hedge gain stand gallon much higher report carrier first quarter fact delta anticipate fuel cost be even higher lie range soon be report quarter apart high fuel cost expense labor front be expect limit bottom line growth carrier envision fuel unit cost rise approximately year year zack consensus estimate second quarter fuel unit cost stand cent more cent report year however company be expect perform well unit revenue front airline behemoth expect total revenue available seat mile trasm increase year year second quarter bullish forecast be base strong demand air travel entity leisure business segment zack consensus estimate second quarter passenger revenue available seat mile prasm be peg cent cent report first quarter stock warrant lookinvestor interested broader transportation sector check csx corporation csx free report skywest inc skyw free report hunt transport service inc jbht free report await earning release time csx have earning esp zack rank company be schedule announce second quarter result jul skywest have earning esp zack rank company be schedule release second quarter result jul hunt have earning esp zack rank company report second quarter result jul look stock skyrocket upside zack have just release special report boom investment opportunity legal marijuana ignited new referendum legislation industry be expect blast already robust early investor stand make kill have be ready act know just look see pot trade re target
158,JBHT,transportation sector be ride high first quarter financial result total earning sector total market capitalization report so far revenue growth revenue earning surprise also seem impressive be most key industry player manage beat estimate earning revenue few lag better understand let dig earning result well know industry player transportation earning world largest package delivery company unite parcel service up free report top zack consensus estimate front earning surpass earning estimate penny revenue edge past estimate fiscal company continue expect earning share range zack consensus estimate time earning release be peg see industrial etfs here major railroad union pacific unp free report norfolk southern corp nsc free report beat top bottom line kansa city southern ksu free report miss unp nsc surpass earning estimate cent cent respectively revenue estimate other hand earning ksu lag zack consensus estimate cent revenue be also marginally estimate ryder system free report leader supply chain management fleet management service beat earning estimate cent revenue estimate largest airline delta air line dal free report unite continental ual free report also report better expect result earning cent revenue delta edge past zack consensus estimate cent respectively second quarter carrier expect earning share range read etfs stock fly high record spring travel unite continental earning share cent come zack consensus estimate penny revenue slightly edge past estimate company raise lower end earning share year zack consensus estimate time earning release be peg last not least earning lead trucking carrier hunt jbht free report come couple cent zack consensus estimate revenue be estimate etfs focuswhile string solid result industry player make case transport etfs appeal jump oil price rise dollar lead loss past month such ishare dow jone transportation average fund iyt free report spdr transportation etf xtn free report first trust nasdaq transportation etf ftxr shed respectively fund have zack etf rank hold fund track dow jone transportation average index give investor exposure small basket security product be heavily concentrated top firm fedex fdx focus firm collectively make portfolio sector perspective air freight logistic take top spot portfolio railroad trucking airline round next spot double digit exposure fund have accumulate nearly aum see solid trading volume share day charge bps annual fee read transport etfs ride high huge earning beat fedex fund track transportation select industry index hold stock basket focus firm account share further portfolio be dominate trucking airline air freight logistic take fourth share airfreight logistic railroad also make double digit allocation aum fund charge bps fee year investor trade lower volume share day fund offer exposure most liquid transportation security base volatility value growth tracking nasdaq smart transportation index focus firm account combine share ftxr have accumulate asset base charge bps annual fee average trading volume be meager share want key etf info deliver straight inbox zack free fund newsletter brief top news analysis well top perform etfs week get free
159,JBHT,diversify transportation sector include airline company railroad trucker shipper other get impressive start first quarter earning season economy continue grow demand carriage be also increase momentum be anticipate sustain transportation sector be lifeblood economy move freight country offshore favorable economic condition promising fiscal regulatory policy trump administration bode well sector performance dateso far major airline operator delta air line inc dal free report unite continental holding inc ual free report well freight railroad behemoth csx corp csx free report deliver highly impressive result company handily surpass top bottom line respect zack consensus estimate additionally transport logistic company hunt transport service inc jbht free report report mixed result top line outpaced zack consensus estimate bottom line miss same marginally stock mentioned carry zack rank hold see complete list today zack rank strong buy stock here tax overhaul major pro growth agenda president trump namely significant cut corporate tax deregulation be major catalyst transportation sector corporate tax rate be recently lower historic low year large part transporter book much revenue homeland consequently significant reduction corporate tax rate bear transporter be immediately accretive cash flow capital intensive nature transportation company mainly railroad airline invest significantly capital expenditure industry be capital intensive nature old law capital expenditure be tax deduct year be incur consequently corporate need plan judiciously regard capital expenditure however follow tax overhaul company be able deduct capital expenditure taxable income immediately fact go forward company increase capital expenditure tax bill year be lower significantly due higher deduction fact leave more cash hand transporter fund project expansion acquisition share repurchase other apart railroad package delivery company stock belong airline space be also likely be huge beneficiary new tax law robust demand freighta thrive improve economy support overall bullishness transport sector imply more good be be transport unite state improve global growth prospect sustain business consumer confidence have turn help transport sector recover sluggishness quite extent economic growth demand freight be positively correlated healthy growth manufacturing construction mining automobile production increase demand more freight moreover government have take decision spend whopping several infrastructure project construct new road bridge highway railway waterway country period year project generate significant demand manufacturing sector turn raise demand freight benefit transportation sector price chart show year date price performance stock mentioned bottom linethe economy be gathering steam overall economy back track thing be look transportation sector well robust economy healthy consumer business confidence massive tax haul business friendly policy government be anticipate fuel transportation sector growth hottest tech mega trend year generate global revenue predict blast roof fame investor mark cuban say produce world first trillionaire still leave plenty money regular investor make right trade early see zack best stock play trend
160,JBHT,hunt transport service inc jbht free report be big mover last session company see share rise more day move come solid volume too far more share change hand normal session stock remain volatile trade range past month time frame witness sharp increase yesterday move come company report strong first quarter result company have see downward estimate revision upward revision past few week zack consensus estimate current quarter remain unchanged recent price action be encourage so make sure keep close watch firm future hunt currently have zack rank hold earning esp be negative hunt transport service inc price hunt transport service inc price hunt transport service inc quotea better rank stock transportation truck industry be landstar system inc lstr free report currently carry zack rank strong buy see complete list today zack rank stock here be jbht go predict see other think downbreaking news cryptocurrency now bigger visa total market cap cryptos recently surpass more increase previous month re now bigger morgan stanley goldman sachs even visa new asset class expand even more rapidly new investor continue pour wall street become increasingly involved zack have just name company enable investor take advantage explosive growth cryptocurrency stock market click here access stock
161,JBHT,hunt transport service inc jbht free report share increase announce first quarter revenue surpass zack consensus estimate millionshare eldorado resort inc eri free report rise company announce plan buy tropicana entertainment cashmerck co inc mrk free report share increase follow news cancer treatment drug keytruda reduce risk death trial combination chemotherapy instead used chemo aloneshare plc alk free report increase company announce food drug administration fda accept new drug application treatment depression
162,JBHT,stock market surge first trading day week drive robust first quarter earning result ease geopolitical tension least time be monday positive market movement be broad base major index close green dow jone industrial average dji close gain point index inx increase close nasdaq composite index ixic close increase total share be trade monday higher last session average share advancer outnumber decliner nyse ratio nasdaq advancer have edge decliner ratio cboe vix decline close do benchmark perform dow gain stock stock index close green stock trade red notably blue chip index close day move average dow breach psychological barrier first time mar close first time mar indicate positive investor sentiment increase lead gain utility select sector spdr xlu increase material select sector spdr xlb sector benchmark index end positive territory gain more notably return positive territory year monday close be highest mar moreover benchmark index post new week high new lows tech heavy nasdaq composite also gain drive sharp increase technology telecom stock index record new week high new week lows strong earning momentum first quarter earning result have be show strong momentum so far investor have pin high hope first quarter earning total earning index be expect be same period last year backed year year growth revenue big driver positive revision be obviously direct impact tax cut read more be market unimpressed bank earning major company report earning result monday include bank america corp bac free report charle schwab corp schw free report report better expect earning result consequently stock price increase respectively bank america first quarter earning share outpaced zack consensus estimate net revenue report be top zack consensus estimate read more bofa top earning higher rate equity trading charle schwab first quarter earning share outpaced zack consensus estimate net revenue report be top zack consensus estimate read more schwab beat earning revenue estimate geopolitical tension ease geopolitical tension arise possible air strike unite state syrium tumble market friday fade moment secretary defense james mattis announce strike be onetime shot notably syrium be close ally russia however investor seem confident further escalation conflict be uncalled economic commerce depart report retail sale rise march beating consensus estimate auto sale jump highest month stock make headlinesj hunt earning miss revenue beat rise yj hunt transport service inc jbht free report report mixed result first quarter read more conocophillip complete winter appraisal cop free report have wrapped winter exploration appraisal program alaska read more breaking news cryptocurrency now bigger total market cap cryptos recently surpass more increase previous month re now bigger morgan stanley goldman sachs even visa new asset class expand even more rapidly new investor continue pour wall street become increasingly involved zack have just name company enable investor take advantage explosive growth cryptocurrency stock market click here access stock
163,JBHT,hunt transport service inc jbht free report report mixed result first quarter company post better expect revenue earning share lag expectation quarter transportation company earning share fall short zack consensus estimate cent however bottom line improve year year basis higher operate expense fact year year increase revenue aid result top line also cruised ahead zack consensus estimate revenue beat seem have pleased investor consequently stock gain early trading earning miss operate income also increase report basis backed volume growth other factor quarter review zack rank hold company do not repurchase share hunt state be remain share buyback program mar see complete list today zack rank strong buy stock here segmental intermodal division report quarterly revenue year year load volume segment be revenue load exclude fuel surcharge revenue increase year year basis operate income increase year year backed volume growth customer rate increase other factor dedicate contract service revenue increase year year company add new truck fleet first quarter customer retention rate remain operate income decrease year year primarily due foul weather increase cost driver wage integrate capacity solution revenue surge year year revenue load improve year year basis drive vibrant market spot pricing spot volume increase quarter review operate income surge back factor increase gross margin higher revenue load truck revenue decrease end quarter hunt operated tractor year year trailer decrease quarter review operate income increase courtesy favorable factor higher revenue load hunt transport service inc price ep surprise hunt transport service inc price ep surprise hunt transport service inc end first quarter cash cash equivalent be compare approximately end long term debt be compare end upcoming interested broader zack transportation sector be keenly await first quarter earning report key player unite continental holding inc ual free report allegiant travel company algt free report spirit airline save free report come day unite continental be schedule report apr allegiant spirit airline do same apr apr respectively investor alert breakthrough pendinga medical advance be now flashpoint theory realization billion dollar research have pour company be already generate substantial revenue even more wondrous product be pipeline cure variety deadly disease be sight so be big potential profit early investor zack name stock buy now click here see
164,JBHT,hunt transportation service inc jbht free report report first quarter earning share miss zack consensus estimate be estimate revision trend investor note earning estimate revision hunt depict healthy picture prior earning release stock have see zack consensus estimate first quarter earning be revise upward last day however hunt have unimpressive earning surprise history company have surpass zack consensus estimate only last quarters average miss hunt transport service inc price ep surprise hunt transport service inc price ep surprise hunt transport service inc quoterevenue higher expectedj hunt record revenue surpass zack consensus estimate key statistic quarter company do not repurchase share mar company have share remain share buyback program operate income first quarter increase report basis outstanding debt be end quarter zack rank currently hunt carry zack rank hold be subject change follow earning announcement see complete list today zack rank strong buy stock here check back later full hunt earning report later investor alert breakthrough pendinga medical advance be now flashpoint theory realization billion dollar research have pour company be already generate substantial revenue even more wondrous product be pipeline cure variety deadly disease be sight so be big potential profit early investor zack name stock buy now click here see
165,JBHT,hunt transport service inc jbht free report be schedule release first quarter result apr last quarter company deliver positive earning surprise post better expect earning revenue fourth quarter moreover top bottom line improve substantially year year however thing do not look company be report quarter moreover share company have underperform industry january march period stock have gain industry have increase factor playj hunt have be struggle shortage driver quite time company bottom line first quarter be likely be hurt higher operate expense due increase driver wage other factor company be highly leverage further add wo be evident current ratio long term debt equity expressed percentage figure compare unfavorably industry average however new tax law be big boon company huge saving reduce tax rate be anticipate boost cash flow turn aid bottom line expand volume company primary division intermodal be expect aid result quarter be report company effort reward shareholder dividend payment share repurchase be also impressive january hunt raise quarterly dividend cent share represent increase previous payout earning whispersour proven model do not conclusively show hunt be likely beat estimate quarter be stock need have positive earning esp favorable zack rank strong buy buy hold happen be not case here elaborate zack esp hunt have earning esp uncover best stock buy sell re report earning esp filter zack rank hunt have zack rank increase predictive power esp however company need positive esp well be confident earning beat hence combination leave surprise prediction inconclusive caution sell rate stock go earning announcement especially company be witness negative estimate revision hunt transport service inc price ep surprise hunt transport service inc price ep surprise hunt transport service inc quotestock interested broader transportation sector consider american airline group inc aal free report allegiant travel company algt free report jetblue airway corporation jblu free report stock possess right combination element deliver earning beat time american airline have earning esp zack rank company be expect report first quarter result apr see complete list today zack rank stock here allegiant travel have earning esp be zack rank player company be schedule announce first quarter earning apr jetblue be also rank player have earning esp company be slate release first quarter number apr medical stock buy nowzack name company poise ride medical breakthrough be target cure leukemia aids muscular dystrophy hemophilia other condition new product field be already generate substantial revenue even more wondrous treatment be pipeline early investor realize exceptional profit click here see stock
166,JBHT,share gatx corporation gatx free report gain last month outperform zack equipment lease industry decline same time period let take look factor responsible impressive price performance january gatx report higher expect revenue fourth quarter strong performance rail north america segment account bulk gatx revenue aid result company strong product portfolio be encourage well moreover effort modernize fleet particularly rail europe division raise optimism stock be impressed company effort reward shareholder share buyback dividend payment note company have be pay regular dividend continuously january raise quarterly dividend cent share buy back share worth new tax law be blessing transportation company gatx huge saving induced new law result improvement shareholder friendly activity apart gatx transportation stock union pacific corporation unp free report norfolk southern corporation nsc free report hunt transport service jbht free report also hike dividend payout year estimate revisionsupward estimate revision reflect optimism stock prospect gatx score impressively front too fact zack rank buy company have see zack consensus estimate current quarter current year earning be revise upward respectively last day see complete list today zack rank strong buy stock here additionally stock have value score look stock skyrocket upside zack have just release special report boom investment opportunity legal marijuana ignited new referendum legislation industry be expect blast already robust early investor stand make kill have be ready act know just look see pot trade re target
