,ticker,content
523,KMB,most consumer staple company be implement cost reduction initiative boost profit company mccormick co inc mkc mondelez international inc mdlz kimberly clark kellogg co sysco corp many other have be benefit significant cost saving restructure initiative boost earning bottom line
524,KMB,believe strong fundamental solid business structure consumer staple company help withstand global pressure see be plenty reason be optimistic consumer staple industry long haul investing space right now
525,KMB,check latest consumer staple industry outlook here more current state affair market earning perspective current trend important sector economy
526,KMB,want latest recommendation zack investment research today download best stock next day click get free report
527,KMB,consumer staple stock have do reasonably well year date period combination stable operate backdrop inherent defensiveness sector add space allure
528,KMB,operate front moderate economic recovery improve employment scenario have be helpful also lower fuel price rise wage have ease consumer disposable income number major retailer fast food chain wal mart store inc wmt free report mcdonald corp mcd other have announce minimum wage hike lately help buy power low end consumer spectrum
529,KMB,commodity cost have many case stabilize have improve profit margin certain staple company favorable margin help offset negative effect unfavorable currency typically have earning
530,KMB,here be key factor have be drive consumer staple stock past few quarters also have potential boost earning term innovation drive differentiation
531,KMB,crowd competitive space consumer product company need regularly innovate upgrade brand differentiate offering
532,KMB,innovation have be drive force consumer product giant procter gamble co pg free report cereal maker general mill inc gis believe consistent product innovation support strong marketing help deliver stronger result long term company spend marketing annually
533,KMB,global brewer molson coor brewing co tap free report also have be launch new product boost revenue market share help offset impact decline volume molson coor also invest brand marketing advertising create brand awareness
534,KMB,keurig green mountain inc gmcr have particularly notable innovative exclusive offering single serve coffee category order remain competitive company have also enter several strategic agreement other coffee beverage company starbucks corp sbux free report unilever plc ul free report clock bean dunkin donut dnkn offer signature drink company keurig green mountain cup pack
535,KMB,keurig be now partner coca cola company ko dr pepper snapple group inc dps make coca cola dr pepper brand single serve pod use keurig cold home beverage system
536,KMB,shift focus health wellness good product
537,KMB,company be also shift focus make healthier nutritious product view increase health consciousness rise obesity concern grow regulatory pressure
538,KMB,order combat decline sale company carbonate beverage america largest soft drink maker coca cola company pepsico inc pep free report dr pepper snapple pledge reduce calory beverage accordingly company agree promote bottled water lower calorie beverage smaller portion size consumer coca cola bottler coca cola enterprise inc cce also commit recently lower calory soft drink liter
539,KMB,food company food inc bgs general mill also rolled variety nutritious product first half natural organic food beverage maker whitewave food company wwav unite natural food inc unfi free report have be benefit strong demand natural organic food product expect trend continue
540,KMB,food beverage company be not only one try shift healthier option tobacco company lorillard inc altrium group inc mo free report reynold american inc rai be also adapt evolve need consumer have re-sort less harmful alternative electronic cigarette cigarette cater philip morris international inc pm free report plan launch set next generation product ngps year reduce risk related tobacco product attract adult consumer acquisition strategic partnership
541,KMB,consumer staple company be regularly carry acquisition domestically internationally expand exist customer base product line new market be also form partnership take lead challenge environment
542,KMB,tyson food merger deal package meat producer hillshire brand company aug be most talk biggest deal meat industry
543,KMB,tobacco industry long await merger reynold american lorillard announce jun finally receive approval federal trade commission deal be expect close jun
544,KMB,big merger expect complete second half be kraft food group inc krft privately own ketchup maker heinz company deal have be approve board company be await shareholder approval regulatory approval customary close condition food distributor sysco corp syy free report merger food second largest player foodservice distribution industry be also undergo regulatory review process federal trade commission
545,KMB,divestiture
546,KMB,company have also be focuse improve product portfolio divestiture enable concentrate core portfolio
547,KMB,procter gamble company be process eliminate brand roughly brand sale profit have be decline past year order be more focuse company consumer giant unilever nv free report have also divest many business concentrate core product portfolio
548,KMB,similarly oct kimberly clark corp kmb spun health care business be now call halyard health inc hyh snacking giant mondelez international inc tm propose spin coffee business netherlands base coffee company master blender order concentrate core snack business spin coffee business be expect be complete cost cut restructure initiative
549,KMB,most consumer staple company be implement cost reduction initiative boost profit company mccormick co inc mkc free report kimberly clark corp kellogg co sysco corp many other have be benefit significant cost saving restructure initiative boost earning bottom line
550,KMB,see be plenty reason be optimistic consumer staple industry sector have have good run thus far reasonably expect trend continue medium term
551,KMB,check latest consumer staple industry outlook here more current state affair market earning perspective current trend important sector economy want latest recommendation zack investment research today download best stock next day click get free report
552,KMB,kimberly clark corporation kmb free report be slate release third quarter result oct open bell company earning have miss zack consensus estimate trail quarters precede quarter miss consensus mark therefore question linger investor mind now be kimberly clark be able post positive earning surprise third quarter kimberly clark corporation price consensus ep surprise kimberly clark corporation price consensus ep surprise kimberly clark corporation quotefactor likely impact quarterkimberly clark have be witness slower organic sale growth develop emerge market quite time now performance improve china softened latin america particularly brazil argentina due lower volume highly competitive promotional activity management expect modest improvement overall environment develop emerge market second half current promotional environment be weaken market dynamic management anticipate input cost increase owing modestly inflationary environment input cost inflation be expect be higher range previous estimate uptick be attributable higher price several raw material include pulp nevertheless note company higher cost saving continue product innovation strong international presence have be catalyst be expect drive growth company expect generate cost saving range force program prior estimate notably zack consensus estimate quarter review be peg current quarter estimate have moved penny last day be couple cent prior year quarter figure consensus estimate revenue be currently peg be report quarter reflect year year increase expectation increase top bottom line boost investor confidence stock performance quarter sale personal care consumer tissue professional segment be project be respectively estimate show year year increase segment respectively further note volume be estimate increase personal care consumer tissue segment professional segment zack model unveilsour proven model do not conclusively show kimberly clark be likely beat estimate quarter be stock need have positive earning esp zack rank strong buy buy hold happen uncover best stock buy sell re report earning esp filter kimberly clark have earning esp share however company zack rank sell lower chance beat ensue release stock poise beat earning estimateshere be company want consider model show have right combination element post earning beat estee lauder company inc el free report have earning esp carry zack rank see complete list today zack rank stock here colgate palmolive company cl free report have earning esp zack rank avon product inc avp free report have earning esp zack rank wall street next amazonzack evp kevin matra believe familiar stock have only just begin climb become greatest investment time once generation opportunity invest pure genius click detail
553,KMB,kimberly clark corporation kmb free report share have be dismal company share have plunge past month compare industry decline performance have primarily be affected weak organic sale trend north american region first second quarters organic sale region decline owing high competition reduce promotional shipment lower net pricing organic sale have be positive develop emerge market growth rate have decelerate past few quarters further consumer dynamic have also shift negatively kimberly clark diaper offering rise input cost be also hurt company margin owing such challenge kimberly clark issue soft earning guidance full year report second quarter result company now expect earning share low end previous target range follow company discourage performance dull outlook zack consensus estimate also witness downtrend past day say period estimate have go cent reach also estimate earning third quarter depict decline cent nevertheless zack rank hold company have be strive hard spark turnaround let look initiative undertake company improve performance product innovation kimberly clark dedicatedly focus innovation product launch improve market share recently company launch new kleenex reveal countertop system kimberly clark professional segment offer improve exceptional hygiene product company have be provide greater importance improvement personal care product portfolio especially feminine hygiene diaper product innovation related huggy brand have be initiate several region such russia china term company have number innovation line launch north america include upgrade huggy snug dry diaper good night youth pant depend underwear saving enhance initiative kimberly clark be also aggressively cut cost program call focus reduce cost everywhere force force program have generate higher cost saving year fact cost saving exceed initial target least company now expect generate cost saving range force program prior estimate restructure effort involve divestiture lower margin business streamline manufacturing activity have also result significant saving company such effort generate saving bring cumulative benefit annually compare original estimate saving end final verdict expect company innovation restructure effort aid drive performance period ahead moreover company currently carry vgm score have long term growth rate consider pro con kimberly clark currently carry zack rank hold look more consumer staple stock check theseinvestor also consider stock such este lauder company inc el free report flaunt zack rank strong buy procter gamble company pg free report constellation brand inc stz free report carry zack rank buy see complete list today zack rank stock here este lauder deliver average positive earning surprise trail quarters have long term earning growth rate procter gamble come average positive earning surprise trail quarters have long term earning growth rate constellation brand pull average positive earning surprise trail quarters have long term earning growth rate look stock skyrocket upside zack have just release special report boom investment opportunity legal marijuana ignited new referendum legislation industry be expect blast already robust early investor stand make kill have be ready act know just look see pot trade re target
554,KMB,stock highlighted include capital cof free report general dynamic gd free report kimberly clark kmb free report communication lll free report lockheed martin lmt free report chart be show dow dji spx
555,KMB,provide insight current market economic environment want share various trend datum point ve be see lately
556,KMB,earning estimate continue be cut entire zack rank universe negative revision outnumber positive revision ratio caveat be overall number earning estimate revision double next few week change ratio significantly
557,KMB,outlook second half be very questionable actually be positive gdp likely be negative quarter probably negative first quarter anybody guess economic rebound next year be realm possibility
558,KMB,credit crunch be start thaw world equity market continue price worsening economic crisis however short term market be very irrational just asset price movement be sometimes overly optimistic tech bubble asset price movement be sometimes overly pessimistic
559,KMB,pension be issue company fund pension base partially assume rate return plan asset bull market optimistic rate return allow company make smaller contribution bear market optimistic rate return force company make larger contribution compensate inadequate growth plan asset
560,KMB,be happened lockheed martin lmt free report issue disappointing guidance earlier week even accounting pension expense lmt guidance be still analyst forecast be sell focus list
561,KMB,stronger dollar also be headwind corporate earning make export more expensive hurt company have hedge weak dollar
562,KMB,kimberly clark kmb free report blame strengthen dollar negatively impact project fourth quarter earning ironically company think fall commodity price eventually help margin next year problem be determine timing lower commodity price offset stronger dollar
563,KMB,silver line be valuation be attractive head morning plunge dow be trading expect earning price book basis dow be trading multiple just follow benjamin graham strategy recognize multiple be very attractive
564,KMB,keep mind have not trade single digit multiple mid thank plan more household own stock now
565,KMB,fear not match reality
566,KMB,ve hear person possibility very severe recession even depression such call be hyperbole
567,KMB,inventory level have be keep check continue fall not rise overwhelming majority homeowner be current mortgage most consumer be also current credit rate capital cof free report charge rate be just last quarter high not economic depression high national retail federation holiday forecast be consider grim still call increase spending upcoming holiday shopping season
568,KMB,then be unemployment typically recession unemployment rate range last month unemployment rate be take increase current unemployment just touch level typically see recessionary period
569,KMB,economy be recession condition get get better business have already be act control cost fed congress be be proactive combine factor serve lessen severity economic pullback shorten length time see recovery
570,KMB,market
571,KMB,so far call market bottom be prove be correct still be test
572,KMB,point however be dow dji hit level have be trading range yes market have be very volatile have settle range range continue hold prompt buyer emerge let keep finger crossed
573,KMB,similar trading range have emerge spx several other domestic index
574,KMB,vix remain record level market stabilize don see pull back
575,KMB,zack elite portfolio
576,KMB,be continue process rebuild portfolio state be look less economically sensitive sector first recent addition communication lll free report focus list general dynamic gd free report growth income portfolio reflect strategy be consumer staple company be consider give current environment be wait see third quarter earning
577,KMB,be also look stock sector potentially stronger growth prospect be proceed cautiously give primary focus more conservative sector do have flexibility add stock somewhat higher risk profile be few such company watch list none be ready add just yet
578,KMB,stick strategy have work long term
579,KMB,go finish week commentary post write zack com blog
580,KMB,yesterday discuss current market environment financial advisor zack investment management comment be continue sign new client ask response be many person be angry current advisor want someone else manage money
581,KMB,financial advisor be other profession be very smart talented other border edge incompetency middle be mix person generally do decent job manage client money
582,KMB,problem bear market be many individual let anger interfere rationale decision rather stick strategy have work past have be proven work long term many investor look alternative often change do more harm good
583,KMB,analogy same thing happen dieting individual lose weight then switch diet plan pound start come back be likely gain even more weight go back diet plan originally work thank wife show article current issue self magazine
584,KMB,investing be different diversify portfolio comprise fundamentally sound stock rise earning estimate attractive valuation have work past change strategy now
585,KMB,bear market be painful be also temporary remember investing be long term so stick strategy have proven work long term
586,KMB,bristol myer squibb company bmy free report global company report third quarter earning oct
587,KMB,third quarter estimate have be mixed go number cover analyst have raise last week have lower time consensus estimate be cent cent share prior day
588,KMB,company have surprised earning last quarters average
589,KMB,bristol myer squibb have solid fundamental year return equity roe also pay sizable dividend current yield kimberly clark corporation kmb free report global consumer product company manufacture kleenex huggy report third quarter earning oct
590,KMB,third quarter estimate be higher head earning announcement cover analyst have raise last day consensus estimate be cent last month
591,KMB,company have surprised meet estimate last quarters
592,KMB,kimberly clark also have solid fundamental kmb be zack rank buy stock year return equity roe be company also pay dividend current yield list be stock focus list cheapest valuation company ticker shealthspr hs lockheed martin lmt kimberly clark kmb free report bristol myr sqb bmy free report
593,KMB,small handful multinational conglomerate seemingly own almost major consumer package good brand food company restaurant chain yet big name brand firm have manage survive sometimes decade own nestle nsrgy free report pepsico pep free report coca cola ko free report kraft heinz khc free report unilever free report general mill gis free report yum brand yum free report array other firm dominate consumer face industry snatch brand left right reach multibillion dollar company be greater ever especially largest company begin join force order compete long term grand scale always be company avoid be swallow brand various reason especially stock be perform well bottom line continue grow now let look company be almost certainly household name many person find hard believe be still own publicly trade firm tootsie roll industry inc little tiny tootsie roll have be staple halloween basket decade candy company success make investor think get scoop candy giant such mar year contrary tootsie roll have turn bit powerhouse company now boast array different candy brand blow pop caramel apple pop dot even junior mint market cap share tootsie roll have climb steadily recent year candy power stock now sit just few dollar time high share have pop share just year clorox company clx free report tootsie roll clorox have turn bit conglomerate clean company brand include green work pine sol glad other market cap nearly company be certainly not small wouldn be easily acquire giant such procter gamble pg kimberly clark kmb free report lurk be testament company strength still stand own company have be more year be currently zack rank hold earn growth style score system share clorox have soar last decade have gain start year famous inc host famous july hot dog eating contest have be churn case meat famous be small cap company market cap have see stock price do degree turn just last year stock sit time high share sank share share then climb back slowly now rest company own line grocery store dog burger fry pickle well chain restaurant yet have not be scarfed big chain such yum brand hostess brand inc twnk free report iconic maker twinky hos other scream americana be hard believe hostess brand have not be buy big cpg company fact just recently go public hostess brand be almost bankrupt less decade then investment firm buy company liquidation company then go public market cap newly public snack maker stock price have fared well share company have be great depression gain modest start year hostess brand be currently zack rank sell more stock news be bigger iphone become mother technological revolution apple sell mere iphone year new breakthrough be expect generate more device just year create market zack have just release special report spotlight fast emerge phenomenon ticker take advantage don buy now kick click here trade
594,KMB,consumer staple stock benefit space defensive attribute volatile market environment sector operate environment have also improve be shortage issue consumer spending remain anemic moderate economic growth labor market gain haven translate wage gain
595,KMB,haven see much commensurate gain consumer spending result lower energy cost higher health care cost still tighten credit availability continue hurt consumer discretionary spending top issue be impact strong dollar be have material negative effect profitability operator
596,KMB,situation europe still remain challenge improvement stabilization economic landscape emerge market also remain volatile
597,KMB,example consumer product company unilever plc ul free report be still witness weakness develop market little sign recovery north america europe also company still face macro economic headwind europe moreover company do not expect improvement market condition rest year
598,KMB,beverage company coca cola company ko free report also remain apprehensive broader economic challenge year macro environment be improve coca cola expect sluggish consumer spending environment other develop nation europe japan well challenge many key emerge develop market brazil russia china
599,KMB,ongoing economic softness operate challenge europe evolve consumer landscape increasingly competitive environment have also be hurt coca cola enterprise inc cce top line management expect challenge persist couple increasingly strong currency headwind limit revenue growth
600,KMB,here be key headwind face sector slowdown emerge market unfavorable foreign exchange
601,KMB,majority global population life emerge economy growth picture market currently remain less favorable growth opportunity be doubt be hard achieve growth decelerate macro environment key emerge economy china brazil mexico be face economic slowdown situation be even middle east russia ukraine other market
602,KMB,company have significant presence emerge market be be affected currency headwind give recent weaken many emerge market currency dollar particular recent currency fluctuation venezuela argentina turkey be major concern
603,KMB,foreign exchange be major headwind company estee lauder company inc el free report kimberly clark corp kmb free report unilever pepsico inc pep free report have significant business outside venezuelan currency issue be also hurt nu skin enterprise inc nus free report earning significantly
604,KMB,kimberly clark expect foreign currency exchange adversely impact sale coca cola enterprise also expect currency translation be headwind be tailwind
605,KMB,company procter gamble co pg free report kellogg co free report be also struggle decelerate growth develop market currency headwind base brewer diageo plc deo free report also face macroeconomic headwind tough retail condition emerge market decline volume beverage
606,KMB,global brewer molson coor brewing co tap free report have be witness negative beer volume canada quite time volume decline be partially attribute relatively weak economic condition
607,KMB,canada premium beer segment have be gradually lose volume premium value segment mainly due age population sluggish economy loss modelo brand canada due termination joint venture end feb also lead volume decline term
608,KMB,sale food company mondelez international inc mdlz free report have also be dismal so far due volume loss follow significant pricing action response commodity cost increase intense competitive pressure slow response competitor higher input cost impact pricing related dispute retailer customer
609,KMB,beverage company dr pepper snapple group inc dps coca cola pepsico have also be continuously post sluggish result domestic beverage business due category weakness muted volume trend remain continue concern go forward
610,KMB,bottom line
611,KMB,note consumer staple company be fundamentally strong recovery economic scenario increase consumer confidence earning improve soon however company need work survive headwind
612,KMB,be evident be plenty concern consumer staple industry however regard investing space right now be opportunity short term investor
