,ticker,content
343,KMB,company note benefit lower commodity price growth healthcare division sale be last year
344,KMB,estimate
345,KMB,estimate have be rise last few month current year cent next year estimate be peg solid growth projection
346,KMB,valuation
347,KMB,base current year estimate stock have value trading just discount overall market
348,KMB,chart
349,KMB,share kmb recently pull back new week high set last week long term trend be still bullish take look
350,KMB,michael vodicka be momentum stock strategist zack com be also editor charge market beating zack surprise trader service
351,KMB,kimberly clark corporation kmb free report be fresh heel report solid second quarter result income be last year
352,KMB,company description
353,KMB,kimberly clark together subsidiary manufacture market health hygiene product worldwide company be founder have market cap
354,KMB,kimberly clark take beating last year weak market have rebound very nicely last month market help solid second quarter result report july
355,KMB,second quarter result
356,KMB,sale be last year earning come cent ahead zack consensus estimate share
357,KMB,company say result be help higher price product lower energy price kimberly clark do mention however private label competitor have effect landscape value drive consumer hunt bargain
358,KMB,estimate advance
359,KMB,solid quarter analyst have raise estimate current year cent last day share next year estimate be peg growth projection
360,KMB,valuation
361,KMB,base current year estimate stock have multiple discount overall market very nice growth projection
362,KMB,chart
363,KMB,share kmb have rebound nicely slumping late last year more just last month take look
364,KMB,sandwich netflix nflx free report strong quarterly earning report bell yesterday texas instrument txn free report unite air line ual free report follow today close see fresh group earning hit tape week mark first several hundred publicly trade company bring result last quarter healthcare drug device package good giant johnson johnson jnj free report put mixed report earning beating estimate revenue fall tad short zack rank hold company report share surpass zack consensus cent revenue quarter fall slightly have be look however pharma unit grow year year full year earning guidance well ahead expect say revenue guidance full year be currently zack consensus more jnj earning click here competitor procter gamble pg free report report positive result fiscal report ahead today open bell earning share beat consensus estimate revenue outpace anticipate zack rank company report organic growth revenue volume more pg earning click here domestic telecom leader verizon vz free report also post mixed outcome period reverse company miss bottom line expectation cent share cent quarterly sale surpass zack consensus verizon also zack rank stock report post paid churn come total retail connection rise year year more vz earning click here paper sanitary product manufacturer kimberly clark kmb free report also beat bottom line expectation report share have be look share zack rank company fall just short full year guidance be well ahead zack consensus more kmb earning click here finally zack rank buy rate insurer traveler trv free report far outpaced expectation share report share morning be roughly year year however revenue top expect headline number be solid underwriting profit company fall more trv earning click here
365,KMB,kimberly clark corporation kmb free report recently launch kleenex reveal countertop system kimberly clark professional kcp segment partner business offer improve exceptional hygiene product new countertop system provide superior quality hand towel require fewer refill owing greater inbuilt capacity system aids maintain clean restroom area provide hand towel sink thereby reduce water spillage countertop floor addition kleenex other brand category include scott kimtech jackson safety company product be most prefer peer unite state come restroom cleanliness consumer health product innovation boost company have be involved regular innovation product launch improve market share late company have be focuse upgrading personal care portfolio especially feminine hygiene diaper product innovation related huggy brand have be initiate several region such russia china unfavorable industry condition weigh performance effort improve market share kimberly clark have be witness decelerate organic sale growth develop market now sluggish growth be attribute unfavorable economic environment laden increase competition promotional activity sale latin america especially brazil argentina have be display such trend company have strong long term growth prospect market expect only modest improvement second half further company organic sale north american region have be soft due effect competition less promotional shipment competition have particularly hurt company diaper segment volume be observed more parent shopper be shift away huggy buy less expensive premium diaper offering additionally kimberly clark performance be also plague higher input cost owing ongoing inflationary trend such headwind lurk industry be quite challenge task kimberly clark pull positive yield ongoing innovation product launch effort moreover share company have also be lose investor confidence have decrease past month almost line industry decline consumer staple sector belong increase same time frame stock currently carry zack rank sell do kimberly clark guard portfolio stocksinvestor consider better rank stock such nu skin enterprise inc nus free report ingredion incorporate ingr free report constellation brand inc stz free report carry zack rank buy see complete list today zack rank strong buy stock here nu skin deliver average positive earning surprise trail quarters have long term earning growth rate ingredion incorporate deliver average positive earning surprise trail quarters have long term earning growth rate constellation brand deliver average positive earning surprise trail quarters have long term earning growth rate more stock news be bigger iphone become mother technological revolution apple sell mere iphone year new breakthrough be expect generate more device just year create market zack have just release special report spotlight fast emerge phenomenon ticker take advantage don buy now kick click here trade
366,KMB,dow flirted positive territory twice ultimately selling close unable overcome several gloomy earning announcement blue chip index give point day close broader market suffer same fate finished nasdaq slide
367,KMB,fed announce provide half ease pressure money market fund cause surge redemption fall lehman brother trigger fear money fail institution not be re-cover send weary investor get asset plan hopefully alleviate bank run exacerbate ongoing credit crisis
368,KMB,texas instrument txn free report meet analyst expectation earning give bearish outlook future company forecast lower order result quarterly earning cent share announcement consensus estimate be cent next quarter semiconductor giant also say plan further reduce inventory expense capital spending
369,KMB,preliminary announcement sun microsystem java warn first quarter loss cent share stock be crushed analyst be expect gain cent
370,KMB,tracinda corp run billionaire kirk kerkorian divest nearly stake ford motor co free report watch investment slide roughly news cause struggle automaker slide day ford remain confident current strategy turn company
371,KMB,positive note libor overnight loan loosen basis point rate bank loan other be indicator thaw credit market be now fed target first time nearly week
372,KMB,precious metal finished mixed silver gain settle gold drop just nearly settle
373,KMB,crude pull back settle barrel
374,KMB,zack special coverageclick here take look part part video special coverage segment customer receive answer common question
375,KMB,zack elite portfolio
376,KMB,focus list be pretty much line dow tuesday post loss versus dow drop however portfolio outpaced nasdaq
377,KMB,lockheed martin corporation lmt free report report third quarter result today earning share top consensus estimate exceed year prior result however lmt provide soft outlook
378,KMB,share lmt respond selloff determine be best remove company focus list wednesday
379,KMB,also focus list news perrigo co prgo free report be upgrade zack rank buy zack rank strong buy
380,KMB,focus list company soon report be follow
381,KMB,bristol myer squibb co bmy free report be schedule report oct
382,KMB,kimberly clark corporation kmb free report report oct
383,KMB,mcdonald corp mcd free report announce quarterly result oct
384,KMB,air brake technology corp wab free report be slate report oct
385,KMB,growth income portfolio decline day
386,KMB,portfolio holding be schedule report week mcd date be reference computer program system inc cpsi free report be schedule announce oct
387,KMB,have narrow shopping list growth income candidate handful stock be be strongly consider addition week couple company be post quarterly result week be wait report add stock
388,KMB,week wild volatility stock climb steadily day strong earning halliburton hal free report drive energy sector higher testimony washington optimism surround credit market
389,KMB,late afternoon surge dow close point broader market also fared well add point finish nasdaq rise point
390,KMB,much have be do stabilize banking sector fed chairman bernanke allude measure focuse ease credit worry american household seemingly omnipresent chairman tell congress economic stimulus similar plan earlier year help weaken economy bernanke also remain open mind come further rate cut
391,KMB,treasury secretary paulson reiterate today fund be pump nation largest bank be view investment rather cost paulson add not only investment be paid back add premium government be also entitle warrant obtain common stock currently bank have november file application treasury wish sell share government
392,KMB,andrew cuomo new york attorney general government be set investigate credit default swap market few know intricacy derivative be widely believe be major contributor current economic crisis investigator be target market manipulator have illegally artificially pummeled stock rumor other violation federal law not speed economic recovery see have illegally profit bring justice be sight sore eye main street
393,KMB,much anticipate production cut opec meet friday drive oil price higher infamous cartel cut production more half barrel day last month analyst be expect barrel day reduction end week light sweet crude trade high barrel retrace settle gain
394,KMB,optimistic session wall street precious metal have quiet day flight quality see past week have die gold close
395,KMB,zack special coverageclick here take look part part video special coverage segment customer receive answer common question
396,KMB,zack elite portfolio
397,KMB,focus list advanced today overall market bullishness
398,KMB,be new development focus list holding however few portfolio name be deck report earning week
399,KMB,bristol myer squibb co bmy free report be schedule report oct
400,KMB,kimberly clark corporation kmb free report report oct
401,KMB,lockheed martin corporation lmt free report plan report oct
402,KMB,mcdonald corp mcd free report announce quarterly result oct
403,KMB,air brake technology corp wab free report be slate report oct
404,KMB,growth income portfolio turn gain monday
405,KMB,portfolio holding be schedule report week mcd date be reference computer program system inc cpsi free report be schedule announce oct
406,KMB,have narrow shopping list growth income candidate handful stock be be strongly consider addition week couple company be post quarterly result week be wait report add stock
407,KMB,even picture appear rosy economy favorable economic landscape divert investor focus defensive consumer staple zone other seemingly attractive space be likely explanation sector recent trend remain place quite time stock zack consumer staple sector be last month lag index gain same time period continue fed tighten higher interest rate also remain issue stock be so reason first consumer staple stock utility stock be typically dividend payer tend struggle period rise interest rate second consumer staple company have global operation remain vulnerable strength exchange value dollar dollar have start gain ground lately account fed interest rate backdrop also possibility trade war china continue raise fear company business operation be likely be hit tariff other consumer staple space be grapple rise input cost well intense competition latter stem consumer change preference amazon amzn ever grow dominance turn have create significant pricing pressure compelling company undertake aggressive promotional activity factor major threat margin have be plateau quite time now say believe investor take stock possible obstacle consumer staple sector make investment decision input cost volatility escalate freight costsinput cost play major role determine performance company increase input cost directly hit company margin profit moreover price increase offset same drive consumer away note many consumer staple company be bearing brunt high input cost remain concern future also food industry general be battle tough transportation landscape due lower driver availability turn have raise freight cost many player smucker sjm free report pinnacle food pf free report unite natural unpi sysco sys other fact most company expect higher freight cost remain threat margin move higher commodity cost consumer good behemoth colgate have be bearing brunt increase commodity packaging cost have be hurt gross margin input cost inflation also remain cause concern player campbell soup cpb dean food df molson coor tap free report pinnacle food church dwight chd kimberly clark kmb fact kimberly expect commodity cost shoot mainly due higher price several raw material include pulp church dwight expect higher commodity transportation expense weigh gross margin sysco pinnacle food be other example remain trouble headwind intense staple company face stiff competition respect innovation pricing brand strength promotion responsiveness evolve consumer trend result lower pricing power decline market share turn compress margin earning example kimberly clark diaper segment face significant competitive activity put company market share risk dean food also battle stiff competition not only various dairy processor shelf space also various beverage nutritional product further beauty beauty related product industry be highly competitive remain challenge player avon product avp coty coty result alcohol giant constellation brand stz free report brown forman bf also be somewhat stifle cut throat competitive environment strained margin many company consumer staple sector have be plague strained margin stem various factor include tough grocery market condition rise input cost cost associate meeting consumer change demand stiff competition lead aggressive promotion price war grocery chain supervalu svu free report food company campbell soup cosmetic biggy estee lauder consumer product company church dwight colgate cl newell brand nwl free report kimberly clark remain trouble squeeze margin grocery industry have be grapple challenge stiff competition aggressive promotion become more pronounce amazon takeover whole food market traditional grocery company be face competition rival be strengthen franchise offer alternative outlet food other staple also customer be more incline private label product be low cost alternative national brand turn be hurt food company higher operate expense limit profitsa demand staple be usually consistent company strive increase sale market share innovation promotion efficient marketing advertising thus consumer staple company tend spend heavily marketing advertising advertising strengthen brand appeal help counter competition severely hit profit margin company also effort keep consumer change need entail significant cost regard cost related commerce development marketing be likely impact profitability company kimberly clark pepsico pep free report procter gamble pg free report have significantly step investment marketing innovation supply chain capacity addition hinder profit pinnacle food have also be witness escalate marketing cost expect barrier linger emerge market majority global population be cluster emerge economy thus food beverage company be increasingly investing develop emerge market india china brazil boast significant growth potential due relatively low capita consumption reason be burgeon middle class population rise income level turn be increase demand convenience food beverage emerge market offer strong growth prospect be generally volatile due fluctuate currency other structural political issue moreover unprecedented event impact economic condition country china brazil russia remain threat soft volumesmany consumer staple company be struggle decline volume soft volume growth be hurt top line mondelez mdlz free report volume have be weak due volume erosion higher pricing category weakness lower demand company have long be battle soft volume be dairy product player dean food apart grow health wellness consciousness have result volume decline carbonate drink coca cola ko free report pepsico pep free report dr pepper dps have also be hurt cigarette volume bigwig altrium mo free report phillip morris pm free report molson coor have also be post soft beer volume unite state quite time now account difficult industry condition government company altrium group philip morris british american tobacco be face constant government regulation make consumer aware health hazard associate tobacco product well government authority have be brandish whip tobacco player smoking have become primary cause heart disease cancer apart seek authorization new tobacco product fda have make mandatory tobacco company use precautionary label cigarette packet additionally company have be direct put self critical advertisement television newspaper particularly emphasize addictive nature cigarette add wo fda be bent drastically reduce nicotine cigarette minimally addictive level initiative be propose be delay due ongoing research enact low nicotine level prove be disastrous cigarette manufacturing company moreover increase regulatory move have raise awareness consumer regard detrimental effect tobacco consumption motivate quit smoking restriction have lower cigarette consumption significantly dent volume be tobacco company alcohol stock also remain vulnerable government regulation distill spirit be subject excise tax various country thus rise fiscal pressure unite state european emerge market lead increase risk potential excise tax spirit government respective country bottom consumer staple industry be face number problem do sector have anything offer short term investor check latest consumer staple outlook more current state affair market earning perspective trend important sector economy more stock news be bigger iphone become mother technological revolution apple sell mere iphone year new breakthrough be expect generate more device just year create market zack have just release special report spotlight fast emerge phenomenon ticker take advantage don buy now kick click here trade
408,KMB,demand everyday use product create operator consumer staple space doesn tend fluctuate lot be nevertheless expose macroeconomic force margin such outlook space perk outlook global economy improve outlook economy have be favorable last several year recent tax legislation expect add longevity current expansion cycle addition indirect benefit consumer staple company tax cut company also stand benefit directly legislation reflect improve earning outlook many company say consumer staple operator tend be global operation such don benefit same extent tax law change more domestic company growth hard come company mature space consumer staple player have remain focuse squeeze more operation come revenue boost initiative mainly include effort keep pace change consumer pattern note let delve deeper major growth drive strategy space strengthen product portfolio strategic alliance buyout consumer staple company be regularly undertaking domestic international acquisition expand product line gain access new market be also form partnership mostly larger better know company strengthen distribution network diversify portfolio expand reach enhance market position notably leverage other efficiency create significant synergy company go activity merger tyson food tsn free report package meat producer hillshire brand august tobacco giant reynold american lorillard june food giant kraft food group inc khc heinz company july consumer good company newell brand nwl free report jarden be most talk deal belgium base brewer anheuser busch inbev bud buyout sabmiller october also create buzz beverage industry apart molson coor tap free report acquire sabmiller plc stake millercoor make former third largest brewer world anheuser busch inbev heineken cost cut restructure initiativesmost consumer staple company be implement cost reduction initiative boost profit latter half tyson food announce financial fitness program objective enhance operate efficiency reduce overhead fuel bottom line performance colgate cl have also be benefit global growth efficiency program focus reduce structural cost order improve gross operate profit standardize process improve decision make procedure enhance market share worldwide additionally sysco syy free report core strategy include plan optimize business achieve operational efficacy also commend kimberly clark kmb global restructure focus reduce cost everywhere force program be expect generate cost saving more next year company mccormick mkc coca cola ko molson coor mondelez international mdlz smucker sjm free report kellogg many other have also be benefit significant cost saving restructure initiative boost earning focus remain guide principle consumer staple company enable enhance brand appeal product differentiation capture market share region category thus company put lot thrust innovation upgrade brand create differentiate value proposition notably constant innovation support efficient marketing be essential consumer staple company stay ahead competition evidence novelty have be drive force consumer product giant procter gamble co pg free report colgate palmolive cosmetic major estee lauder el company constantly come new product suit change consumer trend tap demand boost revenue also major food company smucker campbell soup cpb alcohol stock brown forman bf constellation brand stz free report even tobacco player altrium mo free report phillip morris pm free report have be add new product gain competitive edge augment market share exit underperform unit enhance operationsapart grow business buyout company also remain focuse improve product portfolio divestiture offloading underperform operation enable company concentrate core profitable area example part strategic business review follow merger jarden newell brand announce plan sell nearly current portfolio include major chunk tool segment highlight company focus simplify operate structure highlight commitment make prudent investment area higher growth potential similarly unilever ul free report announce plan sell shrink spread business kkr december shift concentration fast grow product adopt commerce mantra need hourwith technology have advanced leap bound online shopping have become order day thank various mobile apps dot com business line shopping anything be literally consumer finger tip consumer rapid shift marketplace have compel company adopt commerce mantra company unite natural unfi free report supervalu svu free report campbell soup estee lauder other be strive enhance commerce space investment technology infrastructure drive effort unite natural food commerce sale jump almost second quarter supervalu company contract instacart endeavor upgrade mobile application underscore knack enhance consumer shopping experience transition health wellness productsa consumer preference be life blood consumer staple company have adapt evolve trend stay strong industry key trend last few year have be desire natural organic product prompt many player space come health wellness offering be case almost industry sector apart tobacco company altrium reynold american be also adapt evolve need consumer have re-sort less harmful alternative electronic cigarette cigarette cater change consumer preference philip morris launch much talk iqos smokeless cigarette november aim lead tobacco industry push reduce risk product iqos be anticipate boost market share offset decline volume traditional cigarette business long term additionally rise consumer awareness regard harmful impact toxic chemical have be drive market share organic personal care product too consequently player unilever be make solid progress natural organic product category be evident deal buy schmidt natural specialize personal care product such deodorant toothpaste bar soap clearly robust effort be expect boost company top line future clearly consumer staple space offer plenty reason be optimistic long term so investing space right now check latest consumer staple outlook here more current state affair market earning perspective trend be look important sector economy now more stock news be bigger iphone become mother technological revolution apple sell mere iphone year new breakthrough be expect generate more device just year create market zack have just release special report spotlight fast emerge phenomenon ticker take advantage don buy now kick click here trade
