,ticker,content
0,KMB,investor build equity income portfolio seek etfs hold big dividend payer other focus exchange trade fund consistently grow dividend more important high yield dividend growth stable income stream say lead etf expert investor look fund source cash flow be disappoint find income stream be volatile say ben johnson director global etf research morningstar johnson recently study dividend etf strategy focus large cap screen stock steadily pay grow dividend also generate stable income vs peer dividend drawdown year year decline annual dividend payment be relatively muted even post financial crisis vanguard dividend appreciation vig bellwether etf count ibm ibm johnson johnson jnj top holding stock be classic income play earn most stable possible ibd dividend stability factor ibm have dsf score show stable firm dividend history be year period lower number mean more stable history first trust value line dividend fvd asset hold furniture maker leggett platt leg stock have dsf powershare dividend achiever pfm have asset big stake ibm well altrium group mo tobacco firm have dsf spdr dividend sdy asset hold johnson johnson leggett platt kimberly clark kmb top holding huggy maker have dsf month yield etfs range pfm sdy compare dividend fund investor look yield isolation be run risk yield be volatile time equity income dhs yielded roughly february yield today etps exchange trade product be clearly take more risk other go build income oriented portfolio johnson say less volatile yield say important look fund track benchmark incorporate sort dividend sustainability screen add investor place premium income stability particularly bear market dividend yield vs growthdividend growth provide historical context yield investor etfs grow dividend have better shot cash stream beat rate inflation time vig screen stock have increase dividend least consecutive year have expense ratio lowest dividend focuse etfs sdy look stock have raise dividend past consecutive year have expense ratio fee invest vig be year date wednesday produce annual average gain past year opposed sdy same period
1,KMB,ibd top dividend leader be tobacco stock know hefty dividend so be top nontobacco stock be own warren buffett berkshire hathaway brka verizon communication vz pay cent share full year lead pack yield more
2,KMB,even better big dividend income stream count here be most reliable dividend payer yield also beat market ibd dividend stability factor show stable company dividend history be year period lower number more stable dividend history johnson johnson jnj be
3,KMB,company move boost job pay wake tax overhaul kimberly clark kmb be go opposite direction producer kleenex tissue huggy diaper be cut worker headcount part drive reduce cost boost margin uneven revenue growth higher material cost kimberly clark also close sell factory expand production other site accord statement cutback threaten american factory job time trump administration be try reinvigorate manufacturing economy company didn lay job be eliminate other say hit major region do business chief executive officer tom falk say change make company leaner stronger faster pledge better result even market condition remain challenge term kimberly clark see job cut restructure create annual cost saving end company report fourth quarter profit exclude item share exceed analyst average estimate share fall much new york tuesday have drop year monday close wake government move slash corporate taxe series company have boost pay announce plan expand production
4,KMB,tech stock turn solid performance tuesday help strong earning netflix nflx nasdaq composite marked third straight record close high nasdaq end gain nasdaq add price action be quieter dow jone industrial average
5,KMB,big equity exchange trade fund feature apple aapl top bill be set stage potential investor iphone maker other big company check ishare edge msci usa quality factor qual fund track msci usa sector neutral quality index be buy point month flat base advanced clear previous flat base qual launch july have year annualize return accord morningstar inc line return fund top holding include apple johnson johnson jnj kimberly clark kmb berkshire hathaway brkb microsoft msft financial service account biggest chunk asset follow technology consumer cyclical healthcare stock accord morningstar inc vanguard total stock market vti be again flirt flat base buy point briefly climb entry last week gain prior flat base start current pattern fund be launch have attract asset vti have slightly underperform year date vs year annualize return have outpaced benchmark index top holding vanguard fund end april include apple microsoft amazon amzn facebook fb biggest sector be technology total asset vti track crsp total market index let check wednesday etf pick schwab dividend equity schd be inch closer flat base buy point ishare core dividend growth dgro be hover just flat base entry related etfs watch hold buffett dividend stockswhich etfs watch own nvidia top hold
6,KMB,xu stock shot open monday global market respond favorably france presidential vote sunday dow jone industrial average jump nasdaq add success centrist candidate emmanuel macron first round france presidential election provide powerful challenge marine le pen leader national front party raise odd france remain member european union market standpoint suggest stability stability always earn premium market uncertainty send cac paris sailing higher afternoon trade frankfurt dax blaze higher ftse london rally le pen macron face second round election schedule asia market tokyo nikkei japan grab gain china shanghai composite fall hang seng composite hong kong add monday session launch massive week earning report nearly company more third dow industrial due report bank be leader early action monday buoy election result france jpmorgan chase jpm goldman sachs gs rise dow caterpillar cat be also european bank be fire overseas premarket session deutsche bank db ub group ub barclay bcs ahead credit suisse cs open earning front kimberly clark kmb drop report first quarter earning miss halliburton hal add squeaking past first quarter earning expectation lennox international lii tumble break day line big volume follow first quarter report alcoa aa whirlpool whr barrick gold abx due session close hasbro have buzz more report gain earning revenue increase far analyst first quarter target stock break past buy point flat base koninklijke philips phg brighten open report stronger expect result first quarter share be extend new high breaking past cup base buy point start march fortune be mixed china base name premarket action new oriental education technology edu rise open school tutor chain report strong fiscal third quarter clear expectation issue line revenue guidance fourth quarter stock be past buy point profit investor lock least profit dive sohu com sohu fall report quarter result medical product maker bard bcr spiked medical supply leader becton dickinson bdx announce take control bard deal value becton project deal add high single digit accretion earning share year close becton dickinson share slump open standard poor place company credit watch negative due financial impact acquisition week budget battle congress promise heat ahead friday expiration temporary bill funding government spending pledge white house present tax reform plan week potentially stir market activity expectation specific play appear remain generally low commerce department wrapped week economic calendar friday initial estimate first quarter gdp growth today dalla federal reserve report april manufacturing survey et minneapoli federal reserve bank president neel kashkari speak et related tech industrial giant report euro rally investing action plandow boee near buy point ahead result revenue dropbd buy medical tech firm bard
7,KMB,kraft heinz khc not be interested acquire unilever anymore consumer product firm pay healthy dividend kimberly clark kmb continue garner attention wall street company market capitalization be perhaps best know huggy kleenex brand late january company declare dividend
8,KMB,kraft heinz khc withdraw offer unilever sunday cite anglo dutch consumer food product giant opposition so company kraft target next kraft heinz interest be make public extremely early stage spokesman michael mullen say sunday mailed statement intention be proceed friendly basis be make clear unilever do not wish pursue transaction be best step away early so company focus own independent plan generate value unilever say friday share offer undervalue management quietly concern kraft heinz cost cut culture share unilever rise friday stock market trading kraft leap set record high snack giant mondelez mdlz fall pare earlier loss mondelez maker oreos other nabisco product rise dec kraft buyout buzz meanwhile colgate palmolive cl pop retake day move average clorox clx pop month high kimberly clark kmb advanced highest level late july colgate have market cap colgate kimberly clark procter gamble pg have valuation edge higher friday hit fresh year high procter gamble have gap wednesday follow disclosure activist investor trian fund management snap stake dow industrial component unclear extent investor be snap consumer product stock takeover speculation speculation industry consolidation generally boost pricing power broadly warren buffett berkshire hathaway brkb brazil capital own kraft heinz stock duo pair buy heinz then kraft year later related kraft heinz unilever bid lift clorox colgate kimberly clark gkraft heinz pursue unilever snub mondelez general mill fall
9,KMB,kraft heinz khc unilever soar friday kraft signale win give european food consumer product giant reject takeover bid meanwhile several consumer product giant include colgate palmolive cl clorox clx kimberly clark kmb dow component procter gamble pg also rally kraft heinz rise stock market today hit record high unilever share shot also time best ul stock advanced meanwhile colgate palmolive climb retake day move average clorox pop month high kimberly clark advanced highest level late july procter gamble edge higher hit fresh year high member dow jone industrial average gap wednesday activist investor trian fund management disclose have build stake trian likely press ramp cost cut intensify focus core brand investor see colgate kimberly clark other consumer product firm possible takeover target be bet kraft heinz unilever combination lead reduction rival product lift industry pricing kraft heinz direction brazilian hedge fund have be squeeze cost aggressively boost profit even sale decline related kraft heinz pursue unilever snub mondelez general mill fall
10,KMB,share kraft heinz khc fall nearly tuesday afternoon food giant amicably agree withdraw share proposal merge consumer good conglomerate unilever deal buzz continue support giant well other food consumer product maker unilever kraft heinz hold other high regard say sunday release kraft heinz have utmost respect culture strategy leadership unilever joint statement berkshire hathaway brkb backed kraft heinz unilever spur degree shift friday market action kraft heinz stock spiked public confirmation bid friday statement kraft heinz have also indicated continue pursue parent company dove vaseline initial rejection offer share end day unilever share plunge nearly stock market today soar friday company trade unilever nv unilever plc ul say last week proposal fundamentally undervalue company provide financial strategic merit unilever shareholder quick reversal kraft heinz intention stem warren buffett sentiment hostile takeover berkshire hathaway join only partner make friendly acquisition say annual letter shareholder acknowledge hostile bid be justified leave opportunity other write berkshire go only be welcome berkshire hathaway engineer merger kraft heinz berkshire class share be fractionally kraft heinz unilever merger have make second largest food drink company world accord bloomberg datum bring together brand such oscar mayer planter lipton hellmann combination kraft heinz year create fifth largest kraft unilever retreat tuesday keep good share monday gain speculation industry consolidation still happen other consumer good heavyweight be move tuesday speculation circulate kraft heinz have acquisition target mind colgate palmolive cl be clorox clx tick procter gamble pg edge kimberly clark kmb inched colgate clorox kimberly clark post big gain friday initial kraft unilever news dow component inched year high friday surge earlier week news activist investor trian fund management have take stake meanwhile mondelez international mdlz be announce overhaul snack line general mill gis add mondelez share fall friday previously rally hope kraft takeover bid general mill slide friday weak quarterly result related kraft heinz unilever bid lift clorox colgate kimberly clark gmondelez grow organically industry get merger mindkraft heinz pursue unilever snub mondelez general mill fall
11,KMB,dow jone industrial average other major index hit record high president trump make more noise tax reform fed chief janet yellen take slightly hawkish stance apple aapl rise time best fellow dow stock verizon communication vz return unlimited wireless plan kraft heinz khc be pursue mammoth deal unilever netease nte cisco system csco netapp ntap rally earning general motor gm sell european unit opel dow industrial nasdaq composite rise week add hit new high week apple be key contributor major index fed chair janet yellen somewhat hawkish tone didn worry investor give bond yield bank stock boost wait too long remove accommodation be unwise fed chief janet yellen tell congress shift tone emphasize downside risk economy yellen other fed official speaking week raise odd term hike slightly market don expect march move see move strong likelihood june yellen warn repeal financial regulation pass credit crisis meanwhile retail sale inflation datum be stronger expect small business optimism hit fresh year high philly fed manufacturing index shot strongest read related worry intensified wireless competition pressured phone company stock verizon communication vz reintroduce unlimited datum plan nearly year remove verizon seek edge mobile tmus sprint offer high definition video part unlimited datum mobile quickly change offer include hd video sprint cut unlimited price month user include hd video open unlimited wireless directv verse customer analyst say industry consolidation ease competition merger talk be expect heat government spectrum auction end perhaps late march related mobile tmus feb report profit revenue edge view forecast brand postpaid subscriber addition estimate analyst call guidance conservative event mobile likely lead industry subscriber growth fourth year row first time mobile provide free cash flow guidance forecast year fcf annual growth softbank be willing give control majority own sprint achieve merger mobile reuter report friday sprint rise friday mobile verizon rise modestly day related apple top dow industrial stock hit record high news report related cash return plan upcoming iphone apple reportedly increase order oled display samsung anniversary smartphone due september cfo luca maestri say apple look boost dividend buyback cut corporate tax rate expect president trump related kraft heinz khc signale continue pursue european consumer food product giant even unilever say offer undervalue company see reason further talk combination be largest time create global food giant kraft heinz have be slash cost boost profit shot friday record high unilever leap also set record best snack giant mondelez mdlz fall consumer product firm such kimberly clark kmb rally related president trump wednesday meet ceo target tgt gap gps autozone azo other retailer say cut regulation encourage expand trump also say massive tax plan be come not too distant future target afterward warn gop plan border adjustment tax part corporate tax reform force raise price american family everyday essential subject come meeting be unclear much focus be related warren buffett berkshire hathaway brkb gobble share apple aapl quadruple holding accord regulatory filing also continue fill delta air line dal american airline aal unite airline ual david einhorn greenlight capital also boost stake apple appaloosa cut stake iphone maker hike stake southwest luv george soro take stake facebook fb goldman sachs gs delta drop unite activist investor trian fund management build position procter gamble pg related chinese mobile gaming giant late wednesday report earning american depositary receipt item revenue well analyst consensus online game revenue rise local currency netease say add mobile title december announce new pc mobile game netease license many game activision blizzard atvi include world warcraft overwatch netease stock leap thursday record high edge past buy point earlier week related fiscal end jan cisco earn cent share item flat year earlier top view penny revenue fall fifth straight decline beat expectation cisco defer revenue software subscription jump fiscal sign shift software service core business selling network switch router be gain momentum cisco share rise hit best level november related chip gear maker apply material amat earn cent share ex item fiscal year year sale analyst expect cent be apply material fourth straight quarter accelerate sale ep growth fiscal apply material see strong earning sale growth be wall street model apply material share rise year high related datum storage system provider netapp report earning guidance top view revenue edge past consensus be first top line growth quarters netapp rise thursday move back buy point cup base related crude future fall barrel week organization petroleum export country now see opec supply grow barrel day double prior estimate drill investment pick opec also say oil market report production fall bpd january saudi arabia have biggest decline output crude stockpile jump barrel accord energy information administration well analyst estimate stock cush okla hub be number oil rig operation rise yet again diamondback energy fang report result wall street view raise full year production outlook capital spending target devon energy dvn also report result expectation related peugeot parent psa group say be talk general motor gm potentially acquire automaker opel division also include british vauxhall brand deal give psa group market share europe second only volkswagen vlkay gm have have trouble turn profit unit have tentative deal sell canada magna related big health insurance merger aetna aet humana hum be dead other anthem antm cigna ci break wrestling match federal judge block deal earlier year cigna sue anthem damage top breakup fee judge block cigna end merger anthem countersu argue cigna have try sabotage deal humana get payment aetna trouble moved announce stock buyback say exit obamacare exchange aetna ceo say obamacare exchange be death spiral molina health moh signale likely exit obamacare exchange next year unitedhealth unh tumble friday news justice department have joined whistleblower suit accuse health insurer overcharge medicare advantage hundred million dollar possibly billion dollar other health insurer include aetna humana also retreat friday related doj accuse unitedhealth overcharge medicare advantagesnap snap update sec filing say look share price range share raise roughly give valuation earlier report snapchat parent seek snapchat enjoy rapid revenue growth facebook fb be successfully imitate snapchat feature especially instagram app related steel flirted buy point week steel dynamic stld nucor nue aluminum maker alcoa aa jump report china be consider sweeping production cut combat smog reuter report china slash steel capacity least half aluminum capacity certain month cement aggregate firm steel company be expect benefit president trump infrastructure push well multibillion dollar wall border win help result much martin marietta material mlm tuesday miss fourth quarter earning sale estimate give subdue outlook related la vegas centric mgm resort international mgm turn profitable reverse year earlier loss miss estimate revenue be line melco crown entertainment mpel operate gaming hub macau elsewhere asia top view sale miss ep macau have be try recover chinese government launch money launder crackdown mgm fall thursday month low melco fall briefly retake buy point morning related semiconductor rise thursday hit best level august chipmaker sunday report adjust ep rise sale climb beating guidance also be strong shopify shop hit record high commerce platform provider report earning top view revenue grow revenue guidance be strong mobileye mbly volkswagen vlkay partner development deployment self drive car implement new navigation standard autonomous drive start mobileye already have autonomous car deal bmw also be sharing datum here mapping service own german automaker include bmw vw audi
12,KMB,anyone have buy box recently know thing first be not cheap second need tend need quite few scale part equation level demand create giant kimberly clark kmb kellogg co procter gamble pg ll have grasp
13,KMB,kimberly clark kmb share tumble friday record high consumer product giant report weaker expect earning give negative outlook maker home product such huggy disposable diaper scott paper towel say earning share rise drop revenue wall street expect
14,KMB,stock future ladle moderate loss ahead friday open uptick producer price add inflation pressure federal reserve
15,KMB,dow future slip point fair market value nasdaq future drop point future be point
16,KMB,stock market today head friday nasdaq week ahead nasdaq continue find support day move average slip level late last week retook support wednesday significant change eurozone debt standoff greece clarity regard possible rate increase federal reserve help urge index month long limit market challenge high lows recent range investor stay prepared shift direction
17,KMB,economic news price paid producer rise labor department report largest increase least december gain reversed april decline top analyst expectation increase core producer price index energy food edge vs slip april line expectation
18,KMB,university michigan be slate release initial june consumer sentiment estimate et
19,KMB,stock action showedtwitter twtr perk announce chief executive dick costolo step july twitter co founder chairman jack dorsey serve interim ceo search new ceo dorsey say take compensation position later year stock have be unable exit consolidation begin shortly november ipo end thursday dec high
20,KMB,connecticut base biotech alexion pharmaceutical alxn drop more premarket action stock have be deepen consolidation december have be struggle regain week move average early
21,KMB,ibd stock synaptic syna rise open company announce thursday have reach milestone shipment fingerprint sensor now top unit sensor be used smartphone tablet notebook computer stock have be hover just june high end thursday almost buy point
22,KMB,overseas market asia end higher lead jump hong kong hang seng index shanghai composite rise end week hang seng end fraction week japan tokyo nikkei rise friday end week effectively flat
23,KMB,europe top index be also tracking flat finish week ftse london frankfurt dax cac paris show moderate loss midday
24,KMB,dollar continue gain ground keep downward pressure stock commodity price oil gold trade lower west texas intermediate future hold just barrel august gold contract trading ounce week oil be not quite gold be higher last friday settle price stock future ladle moderate loss ahead friday open uptick producer price add inflation pressure federal reserve dow future slip point fair market value nasdaq future drop point future be point stock market today head friday nasdaq week ahead nasdaq continue find support day move average slip level late last week retook support wednesday significant change eurozone debt standoff greece clarity regard possible rate increase federal reserve help urge index month long limit market challenge high lows recent range investor stay prepared shift direction economic news price paid producer rise labor department report largest increase least december gain reversed april decline top analyst expectation increase core producer price index energy food edge vs slip april line expectation university michigan be slate release initial june consumer sentiment estimate et stock action showedtwitter twtr perk announce chief executive dick costolo step july twitter co founder chairman jack dorsey serve interim ceo search new ceo dorsey say take compensation position later year stock have be unable exit consolidation begin shortly november ipo end thursday dec high connecticut base biotech alexion pharmaceutical alxn drop more premarket action stock have be deepen consolidation december have be struggle regain week move average early ibd stock synaptic syna rise open company announce thursday have reach milestone shipment fingerprint sensor now top unit sensor be used smartphone tablet notebook computer stock have be hover just june high end thursday almost buy point overseas market asia end higher lead jump hong kong hang seng index shanghai composite rise end week hang seng end fraction week japan tokyo nikkei rise friday end week effectively flat europe top index be also tracking flat finish week ftse london frankfurt dax cac paris show moderate loss midday dollar continue gain ground keep downward pressure stock commodity price oil gold trade lower west texas intermediate future hold just barrel august gold contract trading ounce week oil be not quite gold be higher last friday settle price
25,KMB,stock open battle break even point friday unsettled mixed earning report wavering oil price
26,KMB,nasdaq hold gain dow jone industrial average slip
