,ticker,content
890,MOS,nyse composite climb boost fertilizer producer airline oil driller financial also lift index goldman sachs gs gain fact analyst meredith whitney cut earning estimate
891,MOS,rise nasdaq tick fraction meanwhile dow slip loss ibm ibm traveler trv offset gain boee ba kraft food kft
892,MOS,volume surge board
893,MOS,valassis communication vci rally nearly twice average volume clear buy point cup handle pattern company provide marketing service such newspaper insert door hanger direct mail advertising
894,MOS,aegean marine petroleum update stock close mixed follow choppy session tuesday most index hit new multimonth high dow lag nyse composite climb boost fertilizer producer airline oil driller financial also lift index goldman sachs gs gain fact analyst meredith whitney cut earning estimate rise nasdaq tick fraction meanwhile dow slip loss ibm ibm traveler trv offset gain boee ba kraft food kft volume surge board valassis communication vci rally nearly twice average volume clear buy point cup handle pattern company provide marketing service such newspaper insert door hanger direct mail advertising aegean marine petroleum
895,MOS,update market remain firmly correction mode index fail rebound last week sharp loss
896,MOS,decline issue lead advancer better day nearly industry group lose ground day
897,MOS,aerovironment avav plunge hour action miss analyst ep view lower guidance maker unmanned drone aircraft have break week level support past week
898,MOS,comtech cmtl slide narrowly beating earning view fall short revenue forecast
899,MOS,major economic release be slate tuesday dwindle earning calendar include dick sporting good dks general steel holding gsi ja solar holding jaso schedule report market open american public education apei dxp enterprise dxpe retailer crew group jcg be expect report close
900,MOS,update seesaw day end loss
901,MOS,juan carlos arancibia
902,MOS,market close lower nasdaq make lowest close oct
903,MOS,nasdaq plunge nyse composite dow
904,MOS,volume fall most recent day index be early trend downward rest session
905,MOS,insurance stock be worst ub downgrade aflac afl sell neutral analyst question company exposure bank investment
906,MOS,energy stock rise price crude top barrel
907,MOS,update bank mining construction group protect gain
908,MOS,alan elliott
909,MOS,index continue struggle session lows hobble soft trading level
910,MOS,nyse composite dow shed nasdaq composite keep low show loss aid gain mbia mbi well fargo wfc bank america bac
911,MOS,trading volume remain well friday level decline issue top advancer better exchange industry group super regional bank mining equipment maker heavy construction firm continue post strongest gain
912,MOS,google goog dell dell teva pharmaceutical teva celgene celg show nasdaq biggest decline
913,MOS,refinery builder foster wheeler fwlt post index largest gain
914,MOS,merck mrk hewlett packard hpq dupont nemour dd head dow downside
915,MOS,global communication jcom tank lose bid regain support week move average mass fax subscription base communication company have be live week move average early february
916,MOS,update index hit session lows light volume
917,MOS,patrick
918,MOS,stock push session lows loss pile
919,MOS,dow fall nyse composite nasdaq lose
920,MOS,volume be lower board
921,MOS,google goog lose internet giant be lose streak late stock be feb volume have be high way
922,MOS,credit card company visa mastercard fall american express axp gain be top gain dow component share
923,MOS,meridian bioscience vivo maker diagnostic kit antibody slip friday william blair initiate coverage firm market perform rating
924,MOS,upside lincoln education linc gain stock be fifth week sloppy cup shape base chart action also just be week pullback stock rs line be new high
925,MOS,update index slip lower soft volume
926,MOS,alan elliott
927,MOS,index backed slowly away morning mild gain energy sector early gain ease third industry group track ibd post loss
928,MOS,nasdaq composite wander loss nyse composite slip dow be flat
929,MOS,bancorp usb suntrust bank sti jump more manitowoc mtw terex tex gain apiece haul construction mining equipment maker group higher
930,MOS,volume hold steadily friday level
931,MOS,crude future ease early high remain more higher more barrel
932,MOS,lincoln educational service linc jump serious volume tech school operator report thursday ep sale easily top analyst view guide result prior expectation
933,MOS,issue quanta service pwr pop builder electrical energy wiring infrastructure be week possible base
934,MOS,icon iclr tumble compound week dive ireland base provider clinical trial pharmaceutical maker tumble kill stock effort construct right side base
935,MOS,infection prevention product maker steris ste slide leave component month low
936,MOS,update stock seek direction monday halftime
937,MOS,vincent mao
938,MOS,major index be mixed monday halftime morning merger news stock have be mostly struggle direction
939,MOS,rise dow nasdaq lose nyse composite ease fraction
940,MOS,volume be again tracking lower board especially nasdaq
941,MOS,american italian pasta aipc drop heavy trading mark stock third straight day brisk volume be biggest percentage loser ibd
942,MOS,upside financial get boost billionaire warren buffett cnbc buffett say well fargo wfc bancorp usb be better ever year well bancorp jump respectively
943,MOS,allegiant travel algt jump bounce day move average friday last week air carrier report increase february traffic buck industry weakness
944,MOS,hansen natural han add month high analyst see beverage maker earning surge year
945,MOS,update index struggle break mixed trading stalemate
946,MOS,alan elliottmarket push pull edge higher soft volume still mixed territory late morning trading
947,MOS,hold advance dow nasdaq composite add
948,MOS,nyse remain red schering plough sgp bancorp usb general electric ge post top gain exxon mobil xom bolster dow advance
949,MOS,cable satellite television operator group life accident health insurance provider post morning heaviest loss
950,MOS,trading volume be lower count especially nasdaq
951,MOS,oil price surge more barrel highest level january iraq oil minister tell foreign news agency current oil price be not profitable fair oil produce country opec be work push price higher opec be widely expect announce additional production cut march meeting
952,MOS,natural gas gold fall dollar slip vs euro gain yen japan report first current account deficit year
953,MOS,agriculture related issue moved higher fertilizer maker mosaic mo seed strain developer pop strong trading
954,MOS,downside covance cvd drop strong volume provider clinical drug trial have attempt build right side month consolidation be now threaten undercut october lows
955,MOS,glaxosmithkline gsk gap surrender rally most europe base drugmaker news merck mrk plan buy rival schering plough glaxo be trading lowest level
956,MOS,shanghai composite dump hong kong hang seng topple hurt drop hsbc holding hbc ahead right offer schedule later week effort shore balance sheet japan tokyo nikkei fall back lowest close
957,MOS,market europe trade mixed narrow range gain energy pharmaceutical issue offset banking sector loss
958,MOS,update stock rebound lower open
959,MOS,vincent mao
960,MOS,stock open lower have turn narrowly mixed early monday
961,MOS,nasdaq climb bounce back year low rise dow tick fraction nyse composite lose have be much open minute
962,MOS,volume be tracking lower board
963,MOS,rohm haas roh rise delaware judge postpone trial few hour so chemical maker dow chemical dow resume merger talk earlier year dow delay close buyout rohm haas
964,MOS,amazon com amzn rise follow upgrade piper jaffray upgrade internet retailer buy neutral belief company be poise take more market share
965,MOS,mcdonald mcd edge report rise february same store sale still fast food giant warn commodity cost strong dollar pressure result margin
966,MOS,downside aflac afl gap tumble ub cut insurer sell neutral concern be too heavily invest bank
967,MOS,update stock poise soft start buyout news
968,MOS,vincent mao
969,MOS,big merger announcement fail lift stock future monday point lower open equity
970,MOS,nasdaq future drop point vs fair value future shed point dow future lose point
971,MOS,merck mrk buy rival schering plough sgp cash stock effort better compete environment slow sale rise generic competition schering plough share gain pre market merck fall
972,MOS,pfizer pfe unveil buyout wyeth wye january slip pre open
973,MOS,financial once again be spotlight
974,MOS,lloyd banking group lyg decline pre market news uk government stake struggle back exchange insure risky asset
975,MOS,capital financial cof joined slew bank cut dividend slash quarterly dividend nickel share cent order save year
976,MOS,jpmorgan chase jpm pnc financial service pnc bancorp usb well fargo wfc lower dividend recently
977,MOS,follow friday dismal job report more company announce layoff
978,MOS,newspaper publisher mcclatchy mni eliminate job work force
979,MOS,eastman chemical emn say cut job next week cut base pay employee company look save annually also guide full year earning range share vs view
980,MOS,economic datum be due today key report week be retail sale initial jobless claim due thursday update market remain firmly correction mode index fail rebound last week sharp loss decline issue lead advancer better day nearly industry group lose ground day aerovironment avav plunge hour action miss analyst ep view lower guidance maker unmanned drone aircraft have break week level support past week comtech cmtl slide narrowly beating earning view fall short revenue forecast major economic release be slate tuesday dwindle earning calendar include dick sporting good dks general steel holding gsi ja solar holding jaso schedule report market open american public education apei dxp enterprise dxpe retailer crew group jcg be expect report close update seesaw day end lossesby juan carlos market close lower nasdaq make lowest close oct nasdaq plunge nyse composite dow volume fall most recent day index be early trend downward rest session insurance stock be worst ub downgrade aflac afl sell neutral analyst question company exposure bank investment energy stock rise price crude top barrel update bank mining construction group protect gainsby alan elliottindex continue struggle session lows hobble soft trading level nyse composite dow shed nasdaq composite keep low show loss aid gain mbia mbi well fargo wfc bank america bac trading volume remain well friday level decline issue top advancer better exchange industry group super regional bank mining equipment maker heavy construction firm continue post strongest gain google goog dell dell teva pharmaceutical teva celgene celg show nasdaq biggest decline refinery builder foster wheeler fwlt post index largest gain merck mrk hewlett packard hpq dupont nemour dd head dow downside global communication jcom tank lose bid regain support week move average mass fax subscription base communication company have be live week move average early february update index hit session lows light volumeby patrick cainstock push session lows loss pile dow fall nyse composite nasdaq lose volume be lower board google goog lose internet giant be lose streak late stock be feb volume have be high way credit card company visa mastercard fall american express axp gain be top gain dow component share meridian bioscience vivo maker diagnostic kit antibody slip friday william blair initiate coverage firm market perform rating upside lincoln education linc gain stock be fifth week sloppy cup shape base chart action also just be week pullback stock rs line be new high update index slip lower soft volume alan elliottindex backed slowly away morning mild gain energy sector early gain ease third industry group track ibd post loss nasdaq composite wander loss nyse composite slip dow be flat bancorp usb suntrust bank sti jump more manitowoc mtw terex tex gain apiece haul construction mining equipment maker group higher volume hold steadily friday level crude future ease early high remain more higher more barrel lincoln educational service linc jump serious volume tech school operator report thursday ep sale easily top analyst view guide result prior expectation issue quanta service pwr pop builder electrical energy wiring infrastructure be week possible base icon iclr tumble compound week dive ireland base provider clinical trial pharmaceutical maker tumble kill stock effort construct right side base infection prevention product maker steris ste slide leave component month low update stock seek direction monday halftimeby vincent maomajor index be mixed monday halftime morning merger news stock have be mostly struggle direction rise dow nasdaq lose nyse composite ease fraction volume be again tracking lower board especially nasdaq american italian pasta aipc drop heavy trading mark stock third straight day brisk volume be biggest percentage loser ibd upside financial get boost billionaire warren buffett cnbc buffett say well fargo wfc bancorp usb be better ever year well bancorp jump respectively allegiant travel algt jump bounce day move average friday last week air carrier report increase february traffic buck industry weakness hansen natural han add month high analyst see beverage maker earning surge year update index struggle break mixed trading stalemateby alan hold advance dow nasdaq composite add nyse remain red schering plough sgp bancorp usb general electric ge post top gain exxon mobil xom bolster dow advance cable satellite television operator group life accident health insurance provider post morning heaviest loss trading volume be lower count especially nasdaq oil price surge more barrel highest level january iraq oil minister tell foreign news agency current oil price be not profitable fair oil produce country opec be work push price higher opec be widely expect announce additional production cut march meeting natural gas gold fall dollar slip vs euro gain yen japan report first current account deficit year agriculture related issue moved higher fertilizer maker mosaic mo seed strain developer pop strong trading downside covance cvd drop strong volume provider clinical drug trial have attempt build right side month consolidation be now threaten undercut october lows glaxosmithkline gsk gap surrender rally most europe base drugmaker news merck mrk plan buy rival schering plough glaxo be trading lowest level shanghai composite dump hong kong hang seng topple hurt drop hsbc holding hbc ahead right offer schedule later week effort shore balance sheet japan tokyo nikkei fall back lowest close market europe trade mixed narrow range gain energy pharmaceutical issue offset banking sector loss update stock rebound lower openby vincent maostock open lower have turn narrowly mixed early monday nasdaq climb bounce back year low rise dow tick fraction nyse composite lose have be much open minute volume be tracking lower board rohm haas roh rise delaware judge postpone trial few hour so chemical maker dow chemical dow resume merger talk earlier year dow delay close buyout rohm haas amazon com amzn rise follow upgrade piper jaffray upgrade internet retailer buy neutral belief company be poise take more market share mcdonald mcd edge report rise february same store sale still fast food giant warn commodity cost strong dollar pressure result margin downside aflac afl gap tumble ub cut insurer sell neutral concern be too heavily invest bank update stock poise soft start buyout newsby vincent maoa big merger announcement fail lift stock future monday point lower open equity nasdaq future drop point vs fair value future shed point dow future lose point merck mrk buy rival schering plough sgp cash stock effort better compete environment slow sale rise generic competition schering plough share gain pre market merck fall pfizer pfe unveil buyout wyeth wye january slip pre open financial once again be spotlight lloyd banking group lyg decline pre market news uk government stake struggle back exchange insure risky asset capital financial cof joined slew bank cut dividend slash quarterly dividend nickel share cent order save year jpmorgan chase jpm pnc financial service pnc bancorp usb well fargo wfc lower dividend recently follow friday dismal job report more company announce layoff newspaper publisher mcclatchy mni eliminate job work force eastman chemical emn say cut job next week cut base pay employee company look save annually also guide full year earning range share vs view economic datum be due today key report week be retail sale initial jobless claim due thursday
981,MOS,update volume picked afternoon trading apparently mark follow rally confirmation nyse index
982,MOS,current information show volume end higher major exchange necessary ingredient follow
983,MOS,medical sector issue lead gain most day overpowering weak economic news credit downgrade general electric ge
984,MOS,financial kick take control later day bank america bac chief executive kenneth lewis say bank wouldn need additional bailout funding get recession
985,MOS,oil price pitch drive energy stock higher april crude contract spiking barrel april natural gas jump more
986,MOS,hour trading aeropostale aro drop speciality retailer report earning gain analyst expectation company guide first quarter earning expectation share be climb deep consolidation
987,MOS,wesson swhc rise add spike regular session firearm maker report fiscal earning cent view share be work way right side cup shape base
988,MOS,friday economic calendar include release february export import price january trade balance datum labor commerce department market open university michigan deliver preliminary consumer sentiment index number march edt
989,MOS,update index surge volume be questionable
990,MOS,juan carlos arancibia
991,MOS,market close sharply higher thursday volume wasn impressive
992,MOS,nasdaq nyse composite soar dow be close bell
993,MOS,volume rise nasdaq fall nyse accord early reading higher volume nyse have marked follow index new rally attempt
994,MOS,financial lead bank america bac ceo kenneth lewis say bank be profitable january february echo remark citigroup jpmorgan jpm ceo earlier week lewis also say bofa be able get recession new help taxpayer
995,MOS,health care stock also be strong gilead science gild agree acquire cv therapeutic cvtx
996,MOS,update rally hold nasdaq volume go green
997,MOS,update volume picked afternoon trading apparently mark follow rally confirmation nyse index current information show volume end higher major exchange necessary ingredient follow medical sector issue lead gain most day overpowering weak economic news credit downgrade general electric ge financial kick take control later day bank america bac chief executive kenneth lewis say bank wouldn need additional bailout funding get recession oil price pitch drive energy stock higher april crude contract spiking barrel april natural gas jump more hour trading aeropostale aro drop speciality retailer report earning gain analyst expectation company guide first quarter earning expectation share be climb deep consolidation wesson swhc rise add spike regular session firearm maker report fiscal earning cent view share be work way right side cup shape base friday economic calendar include release february export import price january trade balance datum labor commerce department market open university michigan deliver preliminary consumer sentiment index number march edt update index surge volume be questionableby juan carlos market close sharply higher thursday volume wasn impressive nasdaq nyse composite soar dow be close bell volume rise nasdaq fall nyse accord early reading higher volume nyse have marked follow index new rally attempt financial lead bank america bac ceo kenneth lewis say bank be profitable january february echo remark citigroup jpmorgan jpm ceo earlier week lewis also say bofa be able get recession new help taxpayer health care stock also be strong gilead science gild agree acquire cv therapeutic cvtx update rally hold nasdaq volume go green
998,MOS,update major index end comparatively flat day dull finish masked number notable move
999,MOS,transportation shipping group gain massive surge volume triple prior single day trading record stock group basis move be day rise baltic dry index gauge pricing strength dry bulk fleet dryship drys tbi international tbsi genco shipping trading gnk excel maritime exm be beneficiary
1000,MOS,fertilizer maker group add sixth straight day gain more important nearly share trade hand group biggest volume advance record intrepid potash ipi surge nitrogen tnh add
1001,MOS,hospital silver gold miner wholesale computer cell phone group take day hardest hit
1002,MOS,tuesday commerce department deliver wholesale inventory number earning side exchange ice vishay vsh cynosure cyno aecom technology acm be slate report prior open bell cb richard ellis group cbg cf industry cf healthspr hs wireless heavyweight america movil amx plan report close
1003,MOS,update index close mixed
1004,MOS,juan carlos arancibia
1005,MOS,major index close narrowly mixed monday day come go announcement bank rescue plan vote stimulus bill
1006,MOS,nyse composite gain dow ease nasdaq be fraction
1007,MOS,volume be lower market appear be wait outcome initiative
1008,MOS,update dollar oil fade high index slip lower
1009,MOS,alan elliott
1010,MOS,index dig deeper mild soft volume loss late trading
1011,MOS,dow nasdaq composite hold loss nyse composite slip edge lower
1012,MOS,coca cola ko home depot hd caterpillar cat anchor downside dow
1013,MOS,news corp nwsa gilead science gild celgene celg be nasdaq worst hit
1014,MOS,volume fade lower exchange decline issue lead advancer narrow margin nyse spread nasdaq
1015,MOS,crude future backed early gain hold nearly flat barrel dollar continue slump vs yen euro
1016,MOS,industrial tool equipment maker kennametal kmt pop heavy trading upgrade buy keybanc capital market share be week possible base larger consolidation
1017,MOS,resm rmd pull early gap loss decline maker treatment sleep disorder receive downgrade neutral jpmorgan share be build right side month cup shape base
1018,MOS,update midday rally end index go red
1019,MOS,patrick
1020,MOS,stock go negative ground volume remain lower afternoon trading
1021,MOS,dow be nasdaq nyse composite be flat give modest gain
1022,MOS,cephalon ceph maker drug treat neurological disorder erased early loss be strong volume stock find support week move average
1023,MOS,thinly trade ezchip semiconductor ezch gap gain small cap be israeli developer networking chip high speed networking switch router stock be odd week tight second week reversed be much
1024,MOS,downside life partner holding lphi fall buyer life insurance policy reversed lower fall week move average last week volume continue be huge way
1025,MOS,ctrip com ctrp also fall lose china base travel company report earning cent share late sunday top expectation cent share have gap early
1026,MOS,update bank energy lead market press higher
1027,MOS,alan elliott
1028,MOS,index rolled tentatively higher light afternoon trading
1029,MOS,nyse composite edge nasdaq composite dow reversed loss add
1030,MOS,health care sector take hit biogen biib vertex pharmaceutical vrtx davita dva fall brisk heavy volume
1031,MOS,huntington bancshare hban hartford financial service group hig lead topside
1032,MOS,volume run softer exchange nyse nasdaq
1033,MOS,baidu com bidu gap add strong trading china base search engine provider have be build floor month correction november
1034,MOS,itc holding itc punch higher hot trading bring close buy point cup handle base begin november
1035,MOS,downside itron itri skid lower return stock day move average share be week possible base
1036,MOS,update stock seesaw session halftime
1037,MOS,vincent mao
1038,MOS,stock be have hard time decide way go follow last week stellar gain ahead more detail government latest effort help economy banking sector
1039,MOS,thank energy issue nyse composite be only index green dow nasdaq slip be mostly unchanged
1040,MOS,turnover be again tracking lower board especially nasdaq
1041,MOS,sohu com sohu gap rally beating view open chinese internet portal deliver earning share cent view marked fifth straight period triple digit growth guide profit range share vs view
1042,MOS,compass mineral cmp gain fast trade ahead earning report close analyst see salt maker earn share earlier morning company raise quarterly dividend cent share cent
1043,MOS,meanwhile financial be mostly higher fifth third bancorp fitb bank america bac jump respectively citigroup rise
1044,MOS,downside davita dva erased early gain shed month low provider dialysis service report earning wednesday grow single digit past quarters analyst expect rise current quarterly profit
1045,MOS,update index turn mixed dollar slip oil gain
1046,MOS,alan elliott
1047,MOS,index wash back forth ambivalent trading obama administration opted delay detail new bank bailout plan tuesday
1048,MOS,energy financial issue hoist nyse composite away earlier loss positive territory nasdaq composite dow rise lows maintain loss reversed earlier loss climb break even mark
1049,MOS,dollar tumble major currency news stimulus plan delay gold slip more ounce nymex march crude future rise more barrel london brent crude benchmark top barrel
1050,MOS,dry bulk shipping fleet sail higher industry rate barometer baltic dry index advanced straight day dryship drys surge time average volume genco shipping trading gnk jump eagle bulk shipping exm tack gain tbs international tbsi add
