,ticker,content
334,MOS,also quarter company announce year share repurchase plan effective july program kick previous buyback be complete hope agriculture department summer weather forecast be mark june agency say expect hot dry weather trim corn soybean output raise price give boost agriculture related business corn future shot monday concern world largest seed company report fiscal third quarter result market open wednesday share fall monday meanwhile fertilizer maker rally analyst upgrade cf industry cf potash corp saskatchewan pot other possible upside dry weather cf climb pot nitrogen tnh share sprout mosaic mo continue see strong long term growth potential business chief financial officer pierre courduroux say earlier month company announce new share buyback plan cent share dividend favorable weather condition brazil recently raise production estimate year record metric ton corn help house committee last week vote let farmer continue use genetically modify crop part next big agricultural spending bill environmental lawsuit san francisco judge court ruling have delay invalidate usda gm crop approval be lead seller genetically modify seed also sell roundup other herbicide wall street expect ep rise vs same quarter last year revenue be project climb have beaten analyst estimate last quarters upside already be build number firm raise profit guidance guide profit share well ahead street view time full year hike ep outlook analyst expect view have be lift last thursday complete purchase planting technology developer precision planting upfront payment possible performance base payment also quarter company announce year share repurchase plan effective july program kick previous buyback be complete
335,MOS,mosaic mo share fall wednesday fertilizer company cut production due price pressure china rival agriculture company be fare better hold ground mosaic now expect ship metric ton potash earlier estimate metric ton china be
336,MOS,share ibm ibm jump hour trading company result beat expectation
337,MOS,share ibm ibm jump hour trading company result beat expectation
338,MOS,want hear ibd analysis today market emerge stock click here watch market wrap video
339,MOS,big blue climb past base base july be few company be bell earning news
340,MOS,wynn resort wynn rise moderately company report profit share expectation casino company clear pattern july hit new high monday light volume mosaic mo trade erratically be still profit report stock remain deep correction
341,MOS,be bit bright news market sell monday nyse fall nasdaq nasdaq close upper half trading range small cap be weaker russell slide
342,MOS,volume be quiet accord unconfirmed datum
343,MOS,tuesday earning report be expect headliner such chipotle grill cmg polaris pii apple aapl vmware vmw riverb rvbd
344,MOS,latest report exist home sale highlight economic calendar tuesday be open bell
345,MOS,want hear ibd analysis today market emerge stock click here watch market wrap video
346,MOS,big blue climb past base base july be few company be bell earning news
347,MOS,wynn resort wynn rise moderately company report profit share expectation casino company clear pattern july hit new high monday light volume mosaic mo trade erratically be still profit report stock remain deep correction
348,MOS,be bit bright news market sell monday nyse fall nasdaq nasdaq close upper half trading range small cap be weaker russell slide
349,MOS,volume be quiet accord unconfirmed datum
350,MOS,tuesday earning report be expect headliner such chipotle grill cmg polaris pii apple aapl vmware vmw riverb rvbd
351,MOS,latest report exist home sale highlight economic calendar tuesday be open bell big blue climb past base base july be few company be bell earning news wynn resort wynn rise moderately company report profit share expectation casino company clear pattern july hit new high monday light volume mosaic mo trade erratically be still profit report stock remain deep correction be bit bright news market sell monday nyse fall nasdaq nasdaq close upper half trading range small cap be weaker russell slide volume be quiet accord unconfirmed datum tuesday earning report be expect headliner such chipotle grill cmg polaris pii apple aapl vmware vmw riverb rvbd latest report exist home sale highlight economic calendar tuesday be open bell
352,MOS,alarm global shortage grain have send corn bean wheat price fly farmer be scramble put more acre production do need grow more crop fertilizer santiago chile base sociedad quimica minera chile sqm seem poise tap global push more food output company supply fertilizer specialty
353,MOS,person middle east have hold world rivet recently take street demand freedom democracy not unrest have revolve exalted ideal empty stomach have also have say rise food price help incite protest rolled tunisia begin december more recently rocked algerium jordan food price
354,MOS,stock climb midday trade monday volume remain quiet nasdaq be nyse composite volume be well friday pace suggest institutional investor be sideline technology sector continue recent struggle coal steel agriculture do well fertilizer provider mosaic mo bounce double usual trade fund have raise stake past quarters mosaic be high plunge last week have find support day move average apple aapl add twice routine volume computer communication device maker have find support just day line stock be past buy point result pullback day line downside technology leader aruba network arun network ffiv slide further day line have suffer pretty significant chart damage recently undoing positive look pattern aruba be now buy point cup handle be show sign rebound thursday plunge widely hold blue chip ibm ibm continue show strength big blue rise fast trade stock be past buy point clear flat base month ibm have composite rating putt market composite rating combine ibd rating number
355,MOS,stock retreat early trading monday european debt worry rekindle portugal be face rise pressure bailout yield spanish italian greek debt climb nyse composite drop nasdaq volume be tracking marginally higher exchange endo pharmaceutical endp gap drop nearly month low late friday food drug administration reject drugmaker formula painkiller stock have be trading flat base radiant system rad fall further day move average be breach friday share gap lose fast trade company be maker point sale system earning grow past quarters analyst see profit fall current quarter agrium agu lose downgrade td newcrest cut share fertilizer maker hold buy raise price target stock dip buy point cup base clear dec group mate mosaic mo fall fast trade clear buy point flat base dec still hover price level upside ldk solar ldk gap rocket raise guidance chinese maker solar wafer boost sale outlook range prior estimate currently analyst view call also guide full year revenue view stock remain high group mate jinko solar jks jump trina solar limit tsl rise
356,MOS,index show little movement tuesday top rate stock fared much better
357,MOS,index show little movement tuesday top rate stock fared much better
358,MOS,want hear ibd analysis today market emerge stock click here watch latest market wrap video
359,MOS,nasdaq rise nyse composite slip dow be fractionally volume be nasdaq nyse decliner lead advancer ratio nyse be roughly even nasdaq
360,MOS,top rate stock find new high strong volume include china base internet content provider baidu bidu online film provider netflix nflx fast casual restaurant chipotle grill cmg fertilizer maker mosaic mo
361,MOS,several stock break include high end handbag accessory maker coach coh ugg boot maker decker outdoor deck outsource service provider igate igte
362,MOS,industry group apparel maker cruise operator do well profit school steel producer fall hard
363,MOS,want hear ibd analysis today market emerge stock click here watch latest market wrap video
364,MOS,nasdaq rise nyse composite slip dow be fractionally volume be nasdaq nyse decliner lead advancer ratio nyse be roughly even nasdaq
365,MOS,top rate stock find new high strong volume include china base internet content provider baidu bidu online film provider netflix nflx fast casual restaurant chipotle grill cmg fertilizer maker mosaic mo
366,MOS,several stock break include high end handbag accessory maker coach coh ugg boot maker decker outdoor deck outsource service provider igate igte
367,MOS,industry group apparel maker cruise operator do well profit school steel producer fall hard nasdaq rise nyse composite slip dow be fractionally volume be nasdaq nyse decliner lead advancer ratio nyse be roughly even nasdaq top rate stock find new high strong volume include china base internet content provider baidu bidu online film provider netflix nflx fast casual restaurant chipotle grill cmg fertilizer maker mosaic mo several stock break include high end handbag accessory maker coach coh ugg boot maker decker outdoor deck outsource service provider igate igte industry group apparel maker cruise operator do well profit school steel producer fall hard
368,MOS,major index trade slightly lower pre market action monday investor look ahead start third quarter earning season later week nasdaq dow future edge lower ahead open bell aluminum supplier alcoa aa be schedule kick third quarter earning season thursday handful other company operate different fiscal schedule be result then fertilizer maker mosaic mo be slate release quarterly result today close company own ibd composite rating share sara lee slc rocket pre market action producer meat baked good other food perked report reject unsolicited takeover offer kkr french drugmaker sanofi aventis sny launch hostile bid share genzyme genz biotech management refuse earlier buyout bid economic front datum august factory order new home sale be due edt
369,MOS,stock pare gain turn narrowly mixed tuesday halftime reversal monday blue chip fared worst techs sport slim gain
370,MOS,nasdaq rise gain edge meanwhile dow jone industrial average fall turnover be tracking lower board compare same time monday
371,MOS,chuy holding chuy ramp sixth straight session july ipo add nearly fresh record high chuy operate chain tex mex restaurant mostly southern state analyst see earning surge cent share year
372,MOS,panera bread pnra pull back hit new high be still nearly stock clear buy point cup handle base almost triple average trade panera be buy point
373,MOS,lumber liquidator ll be session low still big volume stock be nearly trim loss near day line lumber liquidator have be fire clear cup handle base early march
374,MOS,mosaic mo gap drop report lackluster fiscal result hurt weak phosphate sale mosaic profit fall share exclude item share year period revenue drop just view be share sale
375,MOS,rival potash corp saskatchewan pot cf industry cf lose respectively rentech nitrogen partner rnf shed be still well past handle trigger clear july stock pare gain turn narrowly mixed tuesday halftime reversal monday blue chip fared worst techs sport slim gain nasdaq rise gain edge meanwhile dow jone industrial average fall turnover be tracking lower board compare same time monday chuy holding chuy ramp sixth straight session july ipo add nearly fresh record high chuy operate chain tex mex restaurant mostly southern state analyst see earning surge cent share year panera bread pnra pull back hit new high be still nearly stock clear buy point cup handle base almost triple average trade panera be buy point lumber liquidator ll be session low still big volume stock be nearly trim loss near day line lumber liquidator have be fire clear cup handle base early march mosaic mo gap drop report lackluster fiscal result hurt weak phosphate sale mosaic profit fall share exclude item share year period revenue drop just view be share sale rival potash corp saskatchewan pot cf industry cf lose respectively rentech nitrogen partner rnf shed be still well past handle trigger clear july
376,MOS,lead stock rebound wednesday market recoup much prior session sharp loss netflix nflx leader leisure sector rise regular session then jump hour trade stock remain well double bottom buy point day move average online video rental firm
377,MOS,lead stock rebound wednesday market recoup much prior session sharp loss netflix nflx leader leisure sector rise regular session then jump hour trade stock remain well double bottom buy point day move average online video rental firm
378,MOS,stock remain lower late morning trade wednesday chip chip gear fertilizer banking stock pace decline nasdaq fall slightly lows morning slide nearly nyse composite be volume be tracking slightly higher nasdaq sharply lower nyse chipmake chip equipment stock help drag tech heavy nasdaq lower cree cree plunge follow quarterly profit miss asml hold asml slide post strong result stock be still past double bottom buy point find support week move average late october dutch maker lithography system map electronic circuit post sale euro accord reuter net income be euro quarterly record earning share vault vs year ceo eric meurice tell news conference current cycle chip sector extend asml have market cap second only apply material amat ibd electronic semiconductor equipment industry group veeco instrument veco shed gain prior session lose maker system used make led other product have be trading wide loose pattern hit high late april fertilizer maker also weigh market late tuesday say divest stake mosaic mo plymouth minn base phosphate potash giant sell share own shareholder owner debt mosaic drop wipe away day worth gain cf industry cf make phosphate nitrogen base fertilizer sank heavy trade still hold well buy point follow dec week flat base upside dow component ibm ibm gap open gain new high late september stock clear month saucer pattern have rally past buy point computer service giant notch earning growth fourth quarter double digit gain revenue climb biggest increase second quarter ibm gain help dow industrial trade slightly higher
379,MOS,tree fall forest nobody hear do make sound want hear ibd analysis today market emerge stock click here watch market wrap video wall street answer old riddle be question be tree volume typical year end fashion market
380,MOS,stock notch small gain wednesday average volume persist seventh straight session want hear ibd analysis today market emerge stock click here watch market wrap video nasdaq add dow inched nyse composite pop big gain nyse list fertilizer stock help
381,MOS,major average finished higher unison wednesday first time week
382,MOS,major average finished higher unison wednesday first time week
383,MOS,want hear ibd analysis today market emerge stock click here watch market wrap video
384,MOS,close nyse composite rise nasdaq dow edge nasdaq hit fresh year high turnover slip major exchange be well average again
385,MOS,fertilizer producer sprout gain bunge bg chief executive alberto weisser tell financial time grain supply remain tight price high next year
386,MOS,mosaic mo jump heavy trading highest close more year clear buy point week cup base mosaic be maker phosphate potash fertilizer have deliver triple digit profit growth past quarters sale grow past quarters
387,MOS,group mate potash corp saskatchewan pot rise notch year high brisk volume stock accumulation distribution rating have improve last month
388,MOS,sociedad quimica minera sqm rise fast trade also good year high stock recently find support week move average clear cup handle base aug
389,MOS,elsewhere rovi rovi add best level more year stock be extend breaking base base pattern september rovi provide array digital entertainment technology tuesday sear holding shld say be launch movie download service used technology sonic solution snic rovi be process buy sonic
390,MOS,initial jobless claim chicago pmi pending home sale be thursday
391,MOS,want hear ibd analysis today market emerge stock click here watch market wrap video
392,MOS,close nyse composite rise nasdaq dow edge nasdaq hit fresh year high turnover slip major exchange be well average again
393,MOS,fertilizer producer sprout gain bunge bg chief executive alberto weisser tell financial time grain supply remain tight price high next year
394,MOS,mosaic mo jump heavy trading highest close more year clear buy point week cup base mosaic be maker phosphate potash fertilizer have deliver triple digit profit growth past quarters sale grow past quarters
395,MOS,group mate potash corp saskatchewan pot rise notch year high brisk volume stock accumulation distribution rating have improve last month
396,MOS,sociedad quimica minera sqm rise fast trade also good year high stock recently find support week move average clear cup handle base aug
397,MOS,elsewhere rovi rovi add best level more year stock be extend breaking base base pattern september rovi provide array digital entertainment technology tuesday sear holding shld say be launch movie download service used technology sonic solution snic rovi be process buy sonic
398,MOS,initial jobless claim chicago pmi pending home sale be thursday close nyse composite rise nasdaq dow edge nasdaq hit fresh year high turnover slip major exchange be well average again fertilizer producer sprout gain bunge bg chief executive alberto weisser tell financial time grain supply remain tight price high next year mosaic mo jump heavy trading highest close more year clear buy point week cup base mosaic be maker phosphate potash fertilizer have deliver triple digit profit growth past quarters sale grow past quarters group mate potash corp saskatchewan pot rise notch year high brisk volume stock accumulation distribution rating have improve last month sociedad quimica minera sqm rise fast trade also good year high stock recently find support week move average clear cup handle base aug elsewhere rovi rovi add best level more year stock be extend breaking base base pattern september rovi provide array digital entertainment technology tuesday sear holding shld say be launch movie download service used technology sonic solution snic rovi be process buy sonic initial jobless claim chicago pmi pending home sale be thursday
399,MOS,stock continue recover stage big downside reversal last day month quarter nasdaq nyse composite fall dow lose major index be session lows volume continue track vastly higher board agricultural stock stumble grain price fall sharply farm equipment firm cnh global cnh deere drop respectively fertilizer maker agrium agu mosaic mo lose elsewhere tenneco erased earlier gain drop fast trade stock fall buy point base base pattern clear wednesday share be much earlier netflix nflx reversed new record high lose heavy trading stock wipe most wednesday move upside trimble navigation trmb rise fast trade stock clear buy point cup base have gain trimble make gps device engineering construction market earning drop last year analyst see jump year trimble composite rating be bit leadership quality rating mean eighth market be rate higher composite rating combine ibd rating number elsewhere gold cut most loss settle ounce
400,MOS,stock be modestly higher early thursday shake earlier weakness nasdaq rise nyse composite edge latter index touch year high volume be tracking lower board economic news pending home sale surprisingly rise december marked fifth straight monthly gain economist expect drop china mediaexpress ccme gap bolt record high stock gap past buy point cup handle base china mediaexpress provider digital advertising bus china have already trade more half average daily volume potash corp pot gap gain year high beating view open fertilizer maker say earning surge share boost high demand stem rise food price sale jump easily view guide full year profit mostly line expectation stock clear flat base late december late wednesday company raise quarterly cash dividend cent share dime share also announce stock split other fertilizer stock agrium agu mosaic mo rise armour ua gap day move average gain best expectation stock be form new base open athletic clothing maker report earning cent share cent view sale also beat view grow armour peg full year revenue vs estimate downside starbucks sbux gap fall yet continue find support day move average late wednesday coffee giant deliver fiscal result warn rise coffee price hurt bottom line more previously expect
401,MOS,stock be modestly higher early thursday shake earlier weakness nasdaq rise nyse composite edge latter index touch year high volume be tracking lower board economic news pending home sale surprisingly rise december marked fifth straight monthly gain economist expect drop china mediaexpress ccme gap bolt record high stock gap past buy point cup handle base china mediaexpress provider digital advertising bus china have already trade more half average daily volume potash corp pot gap gain year high beating view open fertilizer maker say earning surge share boost high demand stem rise food price sale jump easily view guide full year profit mostly line expectation stock clear flat base late december late wednesday company raise quarterly cash dividend cent share dime share also announce stock split other fertilizer stock agrium agu mosaic mo rise armour ua gap day move average gain best expectation stock be form new base open athletic clothing maker report earning cent share cent view sale also beat view grow armour peg full year revenue vs estimate downside starbucks sbux gap fall yet continue find support day move average late wednesday coffee giant deliver fiscal result warn rise coffee price hurt bottom line more previously expect
402,MOS,top rank stock rebound thursday aruba network arun gap open gain heavy volume prior session stock lose ground strong trade investor support stock day move average positive sign wireless networking firm announce solid october result late wednesday internet networking industry group
403,MOS,stock future hold steady healthy gain ahead monday open market look short week preholiday trade dow future be level trading point fair market value
404,MOS,nasdaq future future be also steady point respectively
405,MOS,stock market today have work cut christmas week trade generally tend be light young uptrend run heavy distribution friday raise question long last
406,MOS,economic news isn likely have much impact chicago federal reserve national activity index most prominent piece economic news prior open show slip november accelerate october contraction be not economist consensus have expect increase
407,MOS,international market also appear have negligible effect stock europe trade modestly higher midday china market rise include jump shanghai composite tokyo nikkei japan slip
408,MOS,dollar rise bond edge oil price slip west texas intermediate bob barrel brent crude just most metal trade higher big gain
409,MOS,be star war effect early trade walt disney be stock lead dow better gain premarket trade goldman sachs gs apple aapl also gain more
410,MOS,disney star war force awaken gross estimate canada weekend be expectation beating prior record holder jurassic world gross premier june avenger pull premier
411,MOS,disney share briefly clear buy point cup handle base november then drop undercut buy point more trigger sell rule
412,MOS,huge screen savvy imax imax jump new star war film reportedly premier imax screen weekend pull set imax record top open weekend take jurassic world accord box office figure deadline hollywood imax ibd stock end friday buy point cup handle base
413,MOS,also ibd list arm armh perked ahead open share cambridge england base chip designer tumble last week end stock converge week line support stock future hold steady healthy gain ahead monday open market look short week preholiday trade dow future be level trading point fair market value nasdaq future future be also steady point respectively stock market today have work cut christmas week trade generally tend be light young uptrend run heavy distribution friday raise question long last economic news isn likely have much impact chicago federal reserve national activity index most prominent piece economic news prior open show slip november accelerate october contraction be not economist consensus have expect increase international market also appear have negligible effect stock europe trade modestly higher midday china market rise include jump shanghai composite tokyo nikkei japan slip dollar rise bond edge oil price slip west texas intermediate bob barrel brent crude just most metal trade higher big gain be star war effect early trade walt disney be stock lead dow better gain premarket trade goldman sachs gs apple aapl also gain more disney star war force awaken gross estimate canada weekend be expectation beating prior record holder jurassic world gross premier june avenger pull premier disney share briefly clear buy point cup handle base november then drop undercut buy point more trigger sell rule huge screen savvy imax imax jump new star war film reportedly premier imax screen weekend pull set imax record top open weekend take jurassic world accord box office figure deadline hollywood imax ibd stock end friday buy point cup handle base also ibd list arm armh perked ahead open share cambridge england base chip designer tumble last week end stock converge week line support
414,MOS,stock weaken remain worst level thursday session
415,MOS,nasdaq drop hurt chip networking issue dow lose nyse composite fall volume be mixed nasdaq higher nyse lower
416,MOS,netlogic microsystem netl be session low still heavy trading stock have be more stock accumulation distribution rating have crumple late july
417,MOS,jinkosolar holding jks lose pull back second straight session ipo snap session streak wednesday jinkosolar report earning aug analyst be expect cent share cent share year period
