,ticker,content
0,MOS,look best stock buy watch focus rise relative price strength stock fit bill be mosaic mo have relative strength rs rating upgrade wednesday look best stock buy watch be sure pay attention relative price strength ibd unique rating measure market leadership worst best score grade show stock price performance last week compare other stock database history show stock go make biggest gain typically have rs rating least early stage move look winning stock try simple routinenow be not ideal time jump isn proper buy zone see stock be able offer clear proper buy point regard fundamental company have post quarters accelerate earning growth sale growth have also rise same time frame company hold rank peer chemical agriculture industry group american vanguard avd cf industry cf be also group highest rate stock get newsletter deliver inbox more info product service privacy policy term also stock rise relative strength ratingswhy use ibd relative strength rating relative strength line help judge stock
1,MOS,important metric look stock be higher relative strength rating mosaic mo just hit mark jump thursday look best stock buy watch factor watch closely be relative price strength proprietary rating measure market leadership show stock price action last week compare other stock database year market history show market biggest winner typically have rs rating begin biggest climb look winning stock try simple routinewhile mosaic be not proper buy range right now see go form break proper base term fundamental company have post rise ep growth last quarters revenue growth have also increase same period company hold rank peer chemical agriculture industry group american vanguard avd be top rank stock group get newsletter deliver inbox more info product service privacy policy term also ibd stock rating upgrade rise relative strengthwhy use ibd relative strength rating relative strength line help judge stock
2,MOS,welcome move mosaic mo see relative strength rating rise thursday look best stock buy watch factor watch closely be relative price strength ibd unique rating measure share price movement worst best score grade show stock price movement last week stack other stock database decade market research reveal market biggest winner often have rs rating north early stage move see mosaic continue show renew price strength clear threshold look winning stock try simple routinemosaic be build cup handle buy point see stock break heavy volume top bottom line growth moved higher last quarter earning be compare prior report revenue increase next quarterly result be expect company hold rank peer chemical agriculture industry group american vanguard avd be rank stock group get newsletter deliver inbox more info product service privacy policy term also stock be show rise relative strength use ibd relative strength rating relative strength line help judge stock
3,MOS,mosaic mo have relative strength rs rating upgrade tuesday look best stock buy watch factor watch closely be relative price strength proprietary rating track technical performance show stock price action last week compare other stock major index decade market research reveal top perform stock often have rs rating north launch biggest price move look winning stock try simple routinemosaic be try complete cup handle entry see stock break volume least higher normal mosaic see earning sale growth rise last quarter earning share increase revenue rise company earn rank peer chemical agriculture industry group cf industry cf be rank stock group related stock rise relative strength ratingswhy use ibd relative strength rating relative strength line help judge stock
4,MOS,monday mosaic mo receive positive adjustment relative strength rs rating exclusive rating investor business daily measure market leadership worst best score grade show stock price behavior last week stack other stock database year market history reveal market biggest winner often have rs rating north early stage move look best stock buy watch start heremosaic be build cup handle entry see clear price heavy volume top bottom line growth moved higher company most recent quarter earning be compare prior report revenue increase company hold rank peer chemical agriculture industry group sqm sqm be top rank stock group related stock rise relative strength ratingswhy use ibd relative strength rating relative strength line help judge stock
5,MOS,dividend stock come shape size season name cf industry cf recently crop ibd dividend leader list just corn belt farmer be roll spring planting season year weather have be uncooperative however keep farmer field spread snow rain heavy wind gulf coast midwest still analyst consensus project equivalent rebound cf ep cent share year follow gain cf lose cent share deerfield ill company exit quarters earning decline fourth quarter ep be forecast rise stock chart be not pretty price have slip start year share be just climb support week move average be build base have get way go stock drag relative strength line be not want see even dividend stock get newsletter deliver inbox more info product service privacy policy term useand yet cf be worth putt radar analyst project entire fertilizer industry be set cyclical upturn industry largest name potash saskatchewan agrium combine january form nutrien ntr merger tighten competition provide industry add control manufacturing supply consensus estimate expect nutrien earning soar year susquehanna financial group trim earning outlook cf industry late march bad weather point delay purchase nitrogen fertilizer susquehanna also drop stock month price target target be still more stock trade monday cf currently pay cent quarterly dividend share so stock yield annually company paid high interest debt end analyst susquehanna financial group project company pay additional debt year next flashy tech big defense name fertilizer seem sleepy little sideline industry stock wow investor collective run more group crash market then run additional potash agrium merger left cf mosaic mo nutrien lead publicly trade player vast vitally important industry only cf nutrien be dividend stock stock group vary accord several factor be price corn soybean most widely plant north american crop also require most intensive use fertilizer trade tiff china have left corn price uncertain say least price monday be sound be also corn high last july factor crude oil price use corn base ethanol extender gasoline supply have keep corn oil price fairly closely related have also typically make fertilizer stock aggressive way tap oil price gain august june example stock ibd chemical agricultural industry group stage massive rally correspond precisely run oil price same period addition other factor amplify fertilizer rally phosphorus rock be comparatively short supply today link fertilizer stock oil price be somewhat weaken group fertilizer stock monday trade june low crude oil price climb same period same time price natural gas fall nitrogen production capacity be now relatively tight supply analyst project combination tight supply low raw material cost recover demand be ultimately go play strong favor big fertilizer name susquehanna march note say analyst remain positive nitrogen cycle analyst continue expect multiyear cycle due lag global capacity growth be outpaced even modest demand growth cf year dividend growth rate be have not raise payout august related want pay attention earning report oracle chief tell trump pentagon cloud plan make sense apple intel lead tech titan just carved bullish pattern
6,MOS,welcome move sqm sqm see relative strength rating improve thursday look best stock buy watch factor watch closely be relative price strength exclusive rating investor business daily track market leadership worst best score grade show stock price movement trail week compare other stock database history reveal top perform stock typically have better rs rating early stage move see sqm continue rebound hit benchmark look winning stock try simple routinesqm be work consolidation entry see break heavy volume company report ep growth last quarter revenue gain come company earn rank peer chemical agriculture industry group mosaic mo be top rank stock group get newsletter deliver inbox more info product service privacy policy term also stock be show rise relative strength use ibd relative strength rating relative strength line help judge stock
7,MOS,potash ntr have relative strength rs rating upgrade thursday welcome improvement still short higher score prefer see try find best stock buy watch keep close eye relative price strength proprietary rating track market leadership show stock price movement last week compare other stock database year market history reveal best stock typically have rs rating north launch largest price move see potash continue show renew price strength hit benchmark look winning stock try simple routinepotash be try complete consolidation entry see break volume least higher normal earning share growth decrease company most recent report top line rise company earn rank peer chemical agriculture industry group mosaic mo american vanguard avd cf industry cf be top highly rate stock group get newsletter deliver inbox more info product service privacy policy term also ibd stock rating upgrade rise relative strengthwhy use ibd relative strength rating relative strength line help judge stock
8,MOS,tuesday potash ntr earn positive adjustment relative strength rs rating look best stock buy watch factor watch closely be relative price strength ibd proprietary rating identify share price action worst best score score show stock price movement last week hold other stock database decade market research show best stock often have rs rating north early stage move see potash continue show renew price strength clear threshold look best stock buy watch start herepotash be build consolidation entry see stock clear price heavy trade earning growth decrease company most recent performance report top line grow previous report potash earn rank peer chemical agriculture industry group mosaic mo be rank stock group get newsletter deliver inbox more info product service privacy policy term also stock rise relative strength ratingswhy use ibd relative strength rating relative strength line help judge stock
9,MOS,thursday sqm sqm hit key performance benchmark relative strength rs rating rise percentile improvement rise day look best stock buy watch keep close eye relative price strength ibd unique rating measure market leadership worst best score score show stock price behavior last week stack other stock database decade market research reveal market biggest winner often have rs rating north early stage move see ibd help make more money stockssqm be not currently potential buy area see stock go build base kick new climb company report ep growth most recent report sale increase company earn rank peer chemical agriculture industry group cf industry cf mosaic mo be also group highest rate stock related ibd stock rating upgrade rise relative strengthwhy use ibd relative strength rating relative strength line help judge stock
10,MOS,relative strength rs rating potash ntr climb new percentile tuesday increase look best stock buy watch factor watch closely be relative price strength ibd unique rs rating measure technical performance show stock price movement last week measure other stock database year market history reveal best perform stock typically have rs rating least early stage move look winning stock try simple routinepotash be build consolidation entry see clear price volume least average sale growth fall last quarter earning share grow previous report potash hold rank peer chemical agriculture industry group cf industry cf mosaic mo sqm sqm be top highly rate stock group related stock rise relative strength ratingswhy use ibd relative strength rating relative strength line help judge stock
11,MOS,thursday potash ntr earn positive adjustment relative strength rs rating try find best stock buy watch be sure pay attention relative price strength ibd unique rs rating measure technical performance show stock price action last week compare other stock database year market history show stock go make biggest gain often have better rs rating early stage move see potash continue show renew price strength clear threshold look best stock buy watch start herepotash be try complete consolidation buy point see break heavy volume earning growth rise company latest report sale fall potash hold rank peer chemical agriculture industry group sqm sqm cf industry cf mosaic mo be top highly rate stock group related stock rise relative strength ratingswhy use ibd relative strength rating relative strength line help judge stock
12,MOS,last week democrat many mainstream medium become highly perturbed trump administration suggestion unite state tie continue foreign aid support agenda abroad foreign dictator agree turkish president recep tayyip erdogan spend last year arrest dissident announce mr trump buy turkey democratic free dollar decision be clear herein lie great irony unite nation mo eisley international politic hive scum villainy vote repeatedly condemn unite state israel tyranny constitute body continue oppress own people xamong vote last week condemn recognize jerusalem israel capital move embassy jerusalem be north korea iran yeman venezuela exactly unite state ever take advice nation seriously shouldn stop send cash organization operate front immoral agenda item unite nation spend vast majority time condemn israel accord watch human right council issue resolution june june be israel educational scientific cultural organization only pass resolution israel general assembly issue resolution target israel meanwhile have do nearly nothing regard syrium have instead suggest israel turn golan height syrian regime even successfully prevent slaughter rohingya myanmar certainly have something say unite state recognize jerusalem israel capital hide agenda get news pro free market pro growth perspectiveone great lie obama administration be diplomacy be foreign policy often hear only alternative be diplomacy war be state reason pursue side nuclear deal iran left iran burgeon regional power legitimacy do want war something ask moment trump administration used tool diplomacy include financial pressure achieve american end left complain prefer war diplomacy be tool not foreign policy use diplomacy pressure other nation follow lead be not only smart also necessary be trump administration be exactly right negotiate cut budget now slash contribution organization pay fifth total bill have always be foolish fantasy league nation knockoff be productive twice irritating outmoded organization outlive small usefulness once have reason continue cut check prop regime condemn publicly exercise most basic standard morality click here more commentary opinion investor business daily want make more money stock market start ibd university
13,MOS,major market index look kick new week positive note index gain upside momentum early monday morning trade tech heavy nasdaq rise dow jone industrial average hold gain dow industrial caterpillar cat set pace advance heavy machinery firm be well extend flat base buy point meanwhile financial component goldman sachs gs jpmorgan jpm gain respectively jpmorgan be approach flat base buy point lead stock nvidia nvda follow friday advance be now extend flat base buy point other recent breakout tesla tsla look extend winning streak trading session rise electric automaker be almost extend buy point be still buy range fang stock be mixed versus general market stock market today netflix nflx lead advance rise amazon com amzn follow gain try reclaim day line meantime facebook google parent alphabet googl eke minor gain meanwhile several big bank stock be approach buy point ahead week federal reserve meeting investment bank morgan stanley ms citigroup moved respectively early monday morgan stanley be approach flat base buy point citigroup be breaking entry fertilizer name cf industry cf mosaic mo surge more respectively ibd only handful name be trading negative territory early monday apply material amat be breaking past cup handle buy point monday jump chip equipment maker be upgrade sector perform outperform rbc capital downside grubhub grub slip food delivery service be set test week line first time flat base buy point related banking giant be buy ahead key fed decisiondow jone industrial average dow stock news adobe fedex defense giant lead weekly investing action planfang stock news quote facebook amazon netflix googlebank financial stock latest news analysis
14,MOS,stock market moved modestly higher early monday major index lead stock continue recovery last week brutal sell tech heavy nasdaq lead index higher rise dow jone industrial average follow gain respectively volume fall nyse nasdaq vs same time friday dow industrial boee ba soar president trump busy weekend lead set broad range deal saudi arabia blue chip leader mmm cisco system csco unitedhealth group unh advanced more downside pfizer pfe energy component chevron cvx pace decliner fall respectively component lead stock stock market today be casino operator wynn resort wynn chip stock qualcomm qcom rise respectively weak end amgen amgn advanced micro device amd mosaic mo fall more apiece lead stock nvidia nvda amazon amzn trade new high tesla tsla drop china base stock continue recent spate gain weibo wb sina sina gain almost netease nte moved alibaba baba rise jd com jd advanced fiber optic stock be favore early monday analyst provide bullish commentary many industry member apply optoelectronic aaoi be initiate buy rating needham co jump analyst firm rosenblatt say finisar fnsr resume shipping product china network gear maker huawei spark rise share ciena cien benefit nearly upgrade buy hold stifel nicolaus chip fiber optic stock dominate top performer ibd midday trading lumentum lite jump almost macom technology solution mtsi rise life science software provider veeva system veev moved almost new high ahead earn release thursday close downside new issue floor decor fnd fall look build ipo base successful ipo april mortgage insurer essent group esnt lose fight support day line work new base share fall related apply optoelectronic finisar rise datum center be tesla model break even price point more surprise new studywhich sector be show most strength market rally dow jone industrial average dow stock news analysisapple price target raise qualcomm ciena finish line upgrade
15,MOS,stock market shed gain index be session lows late afternoon trading nasdaq erased small gain be facebook fb largest component climb new high volume be run third more normal volume also be well average previous day institutional investor pile share social medium company ahead earning report wednesday close fall dow jone industrial average lead increase gain more visa intel intc help industrial today trading volume be tracking higher compare same time yesterday hospital build material truck manufacturing various retail industry group lead market important stock move taiwan semiconductor tsm break flat base share climb past buy point volume be only moderately average chip foundry be part lead industry group nonetheless have slip bit ranking group taiwan semi remain group leader highest composite rating industry ipg photonic ipgp soar new high company beat profit estimate share gap gain more big volume be now extend april ipg photonic report first quarter earning share sale increase forecast revenue ep well analyst estimate agricultural chemical industry group come fire few stock group fall heavy volume disappointing earning report scott miracle gro smg gap loss company adjust earning share miss wall street estimate scott also announce agree sell european australian consumer operation exponent private equity deal value stock be now dwelling lower half saucer type base buy point mosaic mo gap lose nearly lowest level november fertilizer company report earning exclude item cent share expectation sale be lower year period drop extend streak year year decline top line quarters daniel adm plunge more sink lows current pattern big volume company be ibd food grain industry group report adjust earning cent share sale nearly increase related trump infrastructure play soar earning top price hikeswhich commodity rise year case gold
16,MOS,stock market remain higher monday afternoon stock fall session high news russia ambassador turkey be shot dead ankara nasdaq composite lead way rise help strength several large cap technology name apple aapl rise show sign accumulation work base buy point dow jone industrial average add volume nyse nasdaq be tracking well friday level expect be quiet week trading ahead christmas top technology gainer nasdaq include lam research lrcx adobe system adbe microsoft msft dow walt disney gap rise nearly strong debut rogue weekend don chase extend cup handle buy point stock market today share mosaic mo slump news buy vale vale fertilizer business cash stock mosiac be just cup handle buy point erase gain earning front homebuilder lennar len gain report double digit earning sale growth open however come leader laggard group lennar be definitely latter resistance have be strong lately price level ibd take look lead small cap name homebuilding group consult ibd stock checkup sucampo pharmaceutical scmp be top gainer ibd highly profitable biotech also speculative side market capitalization less lead drug be amitiza used treat constipation rescula eye drug treat open angle glaucoma ocular hypertension sucampo be close quickly nov intraday high heavy volume price level be bullish related russian ambassador turkey assassinate syrium retaliationfang stock pullback buy opportunity canaccord genuityapply material downgrade other chip gear maker rate buydisney studio cash cow continue moo even espn wo simmerlennar top earning view optimistic trump cautious margin
17,MOS,tuesday weak volume session do little influence market status nasdaq do edge fresh high dow snugged nearer mark nasdaq swung nearly day notch new close high briefly top morning trade clock advance dow industrial add small cap tech issue be largely sync russell also finishing higher better forecast october home price datum gain almost oil price give tuesday session positive nudge array industry energy steel be lead beneficiary canadian solar csiq beam average trade cross back day move average process olympic steel zeus pop more trading volume be weak coal miner alliance holding ahgp surge cnx coal resource cnxc swung more rise further rise day line cnx coal be spun consol energy debut july share apple aapl outpaced dow peer rise soft action share end shade more cup base buy point downside nike nke slip still unable gain altitude day move average rise oil price lift energy stock many best gain ibd stock nvidia nvda top gain better double average volume move put chipmaker stock day move average violate upper channel line stock advance be technical sell signal other ibd stock logmein logm pop light trade rise test underside day move average stock be begin fifth week flattish consolidation top advance tuesday come fertilizer maker cf industry cf climb mosaic mo gain advance occur weak trade watch cf mosaic potentially break bottom base pattern follow long decline cf have fall more high marked july significant earning release be due wednesday only major release economic calendar be pending home sale news november national association realtor related ross burlington offer retail haven investing action planstock market today nvidia be surge correction be dueinvesting big cap techs do apple first break year
18,MOS,potash corp saskatchewan pot agrium agu canada largest fertilizer producer agree share merger create world largest crop nutrient supplier market value deal give potash corp shareholder new producer have yet be name agrium investor hold rest company say monday joint statement agrium chief executive officer chuck magro be ceo combine group potash corp leader jochen tilk become executive chairman new company be base saskatoon saskatchewan current location potash corp headquarters latest string mega deal agricultural chemical market announce past year producer fertilizer pesticide seed struggle low commodity price weak demand negotiation bayer world largest seed company be advance german company takeover bid china national chemical corp agree february acquire swiss pesticide maker syngenta syt dupont dd dow chemical dow plan merge then carve new crop science unit ibd take bayer last week sweeten offer have reject earlier bid deal vault bayer top crop product overnight putt together agrium potash corp create company not only produce commodity fertilizer also sell directly farmer north american network retail store potash corp be largely mining company extract potash underground mine agrium get revenue last year retail arm monday deal describe side merger equal potash corp investor get share new company share own now agrium shareholder get share potash corp gain premarket trading new york agrium have yet trade close last week company expect generate cost saving year merger say re commit marketing group canpotex ltd joint venture fertilizer company mosaic mo handle company potash export outside north america be merger create benefit growth opportunity neither company achieve alone agrium magro say combine complementary asset enable serve customer more efficiently deliver significant operate synergy improve cash flow provide capital return invest growth deal be implement plan arrangement canada business corporation act be expect close mid merged company employ person have investment country
