,ticker,content
1287,MOS,harmony gold mining company limit hmy free report post adjust earning cent share first half fiscal end dec compare cent record year year year increase revenue cost revenue increase year year first half fiscal register year gold production increase roughly ounce oz first half fiscal year compare oz record year average gold price receive period rise roughly year year oz total gold sale improve cost sale increase first half fiscal cash operate cost remain flat year sustain cost oz rise year year due strengthen rand versus dollar financial overviewcash cash equivalent fall year year dec dec cash flow operate activity be first month fiscal end dec outlookharmony gold remain track achieve group production guidance oz gold fiscal expect increase production hide valley further help company boost annual production price harmony gold have moved last month outperform industry decline zack rank stock considerharmony gold currently carry zack rank hold better rank stock basic material space be steel dynamic inc stld free report mosaic company mo free report unite state steel corporation free report sporting zack rank strong buy see complete list today zack rank stock here steel dynamic have expect long term earning growth rate share have soar last month mosaic have expect long term earning growth rate share have moved past month steel have expect long term earning growth rate share have rally last month don even think buy bitcoin read most popular cryptocurrency sky-rocket last year give investor chance bank return even more gain however come serious volatility risk bitcoin sank more time zack have just release new special report help reader capitalize explosive profit potential bitcoin other cryptocurrency significantly less volatility buy directly see crypto related stock now
1288,MOS,innospec inc iosp free report swung loss cent share fourth quarter profit cent share year bottom line report quarter be hit time charge related tax reform bar time item earning be share quarter come ahead zack consensus estimate chemical maker revenue go year year quarter top line be drive sale gain business innospec inc price consensus ep surprise innospec inc price consensus ep surprise innospec inc quote fy profit be share compare share logged year adjust earning share year be revenue full year surge year year segment fuel specialty segment edge year year fourth quarter favorable price mix well positive currency impact operate income fall quarter performance chemical unit rake sale quarter more fold year year jump drive double digit growth heritage business operate income rise nearly fold revenue oilfield service division jump buoy increase customer activity higher volume segment record operate income quarter revenue octane additive surge more fold year year operate income soar year balance sheetinnospec end cash cash equivalent year year long term debt be year year net cash operation be fourth quarter year outlookmove ahead innospec say be optimistic company remain focuse further improve margin boost profitability innospec also note strategy focuse core business expand adjacent market deliver value customer shareholder price innospec have lose year underperform industry rally zack rank key picksinnospec be zack rank hold stock better rank company basic material space include olympic steel inc lyondellbasell industry lyb free report mosaic company mo free report sporting zack rank strong buy see complete list today zack rank stock here olympic steel have expect long term earning growth rate share rally past month lyondellbasell have expect long term earning growth rate share have rally past month mosaic have expect long term earning growth rate share have rally past month don even think buy bitcoin read most popular cryptocurrency sky-rocket last year give investor chance bank return even more gain however come serious volatility risk bitcoin sank more time zack have just release new special report help reader capitalize explosive profit potential bitcoin other cryptocurrency significantly less volatility buy directly see crypto related stock now
1289,MOS,yamana gold inc auy free report emergent technology holding lp have inked licensing agreement enable former license latter supply chain solution responsible gold used blockchain technology platform emergent blockchain technology supply chain solution trace origin conflict free gold mine refinery vault solution leverage blockchain technology administer contract party involved delivery gold bearing material include refinery miner insurance company logistic provider move simplify automate supply chain traceability conflict free gold deliver refinery notably yamana be first license blockchain technology supply chain solution emergent platform provide refiner irrefutable transparent system digitally obtain maintain information lot gold bearing material be refine moreover consolidate current standard diligence supply chain participant notably be only authorize blockchain platform track source gold responsibly origin vault yamana gold other miner supply chain participant use emergent mobile application scan smart chip tamper proof seal record transfer datum custody blockchain emergent also launch digital gold currency coin be backed physical gold source responsible gold supply chain platform notably yamana gold have make investment technology be also founding partner emergent company expect coin expand improve benefit responsible gold platform provide credible investment product investor individual coin be available new investment class second quarter yamana gold share have moved last month outperform decline record industry zack rank stock consideryamana gold carry zack rank hold better rank stock basic material space be methanex corporation meoh free report steel dynamic inc stld free report mosaic company mo free report sporting zack rank strong buy see complete list today zack rank stock here methanex have expect long term earning growth rate share have soar last month steel dynamic have expect long term earning growth rate share have moved last month mosaic have expect long term earning growth rate share have rally past month hottest tech mega trend year generate global revenue predict blast roof fame investor mark cuban say produce world first trillionaire still leave plenty money regular investor make right trade early see zack best stock play trend
1290,MOS,fmc corporation fmc free report profit sky-rocket fourth quarter buoy hefty gain sale health nutrition division consolidated profit report shot share report quarter cent share year bar time charge gain earning come share quarter exceed zack consensus estimate chemical maker revenue soar roughly year year report quarter boost acquisition major portion dupont crop protection business sale however trail zack consensus estimate fmc corporation price consensus ep surprise fmc corporation price consensus ep surprise fmc corporation quote fy company logged profit share roughly half fold surge share record adjust earning year come share year year revenue full year go year year segment reviewrevenue agricultural solution division jump year year fourth quarter drive dupont asset buyout sale be also support double digit growth north america asia europe segment earning be year year revenue lithium unit surge year year segment earning more double year year drive higher volume company new hydroxide operation china increase year year price balance sheetfmc corp end cash cash equivalent more fold year year rise long term debt be year year outlookmove ahead fmc corp see adjust earning band share first quarter company expect adjust earning range share company also plan conduct separate list lithium unit second half year create separate public company agricultural solution unit fmc corp expect revenue range segment ebitda year be expect be band ebitda first quarter have be project range fmc corp expect revenue range lithium unit segment ebitda be forecast be band full year first quarter ebitda be expect be range price fmc corp have moved year outperform gain record industry zack rank stock considerfmc corp have zack rank hold better rank company basic material space include be olympic steel inc methanex corporation meoh free report mosaic company mo free report sporting zack rank strong buy see complete list today zack rank stock here olympic steel have expect long term earning growth rate share rally past month methanex have expect long term earning growth rate share have rally past month mosaic have expect long term earning growth rate share have rally past month hottest tech mega trend last year generate global revenue predict blast roof fame investor mark cuban say produce world first trillionaire still leave plenty money regular investor make right trade early see zack best stock play trend
1291,MOS,cf industry holding inc cf free report be set release fourth quarter result close bell feb fertilizer maker adjust loss third quarter be cent share narrower zack consensus estimate loss cent net sale increase roughly year year quarter figure also top zack consensus estimate cf industry beat zack consensus estimate trail quarters miss other average negative surprise cf industry have outperformed industry belong last month company share have gain period compare roughly gain record industry let see thing be shape announcement factor playin november cf industry note third quarter witness rapid increase global price urea second quarter be drive considerably lower chinese export higher production energy cost weaker dollar strong global demand company expect lower chinese urea export volume continue volatility nitrogen price global market continue company also note expect improve volume higher nitrogen price product year year comparison basis fourth quarter cf industry gain higher sale volume segment third quarter cf industry be likely benefit higher nitrogen demand last report quarter brazil be major purchaser nitrogen india issue tender result purchase metric ton urea company expect consistent global nitrogen demand growth be partly drive rise global population industrial growth back increase adoption emission control recover mining sector synthetic nitrogen product cf industry witness lower year year pricing ammonia granular urea urea ammonium nitrate uan unit third quarter due higher nitrogen supply however company be expect benefit improve pricing december quarter cf industry also benefit cost efficiency be report quarter also gain effort boost production capacity volume company ammonia unit surge year year last report quarter owing additional production volume new capacity expansion donaldsonville port neal complex moreover volume increase roughly granular urea segment drive additional volume available new urea capacity port neal nitrogen complex zack consensus estimate revenue cf industry be report quarter stand reflect increase year quarter rise sequentially prior quarter zack consensus estimate average selling price company ammonia unit fourth quarter stand ton reflect expect increase year quarter zack consensus estimate granular urea segment stand ton represent expect year year increase moreover average selling price uan unit be expect rise year year zack consensus estimate stand ton zack consensus estimate ammonium nitrate unit stand ton represent expect year year increase respect volume ammonia sale volume be project witness year year rise fourth quarter zack consensus estimate be peg roughly ton zack consensus estimate granular urea sale volume be peg ton reflect year year rise uan sale volume be expect dip year year zack consensus estimate stand ton moreover zack consensus estimate sale volume unit be ton reflect year year rise cf industry holding inc price consensus cf industry holding inc price consensus cf industry holding inc quoteearning whispersour proven model do not conclusively show cf industry be likely beat zack consensus estimate quarter be stock need have positive earning esp zack rank strong buy buy hold happen be not case here see zack esp earning esp cf industry be most accurate estimate zack consensus estimate stand loss cent uncover best stock buy sell re report earning esp filter zack rank cf industry currently carry zack rank combine esp make surprise prediction difficult note caution sell rate stock go earning announcement especially company be see negative estimate revision other stock considerhere be company basic material space want consider model show have right combination element post earning beat quarter mosaic company mo free report have earning esp zack rank huntsman corporation hun free report have earning esp carry zack rank see complete list today zack rank stock here agnico eagle mine limit aem free report have earning esp carry zack rank hottest tech mega trend last year generate global revenue predict blast roof fame investor mark cuban say produce world first trillionaire still leave plenty money regular investor make right trade early see zack best stock play trend
1292,MOS,cf industry holding inc cf free report fully own subsidiary nitrogen gp inc exercise right purchase publicly trade common unit nitrogen company tnclp apr cash consideration unit roughly cf industry plan fund purchase cash hand move enable cf industry simplify corporate structure considerably reduce administrative cost associate operate tnclp company be positive step cf industry effort reduce controllable cost purchase price deal have be decide regard tnclp partnership agreement consider average daily close price common unit jan feb post closure deal tnclp unit cease be list publicly trade nyse share cf industry have moved past month outperform industry dip cf industry witness rapid increase global price urea third quarter compare second be drive considerably lower chinese export higher production energy cost weaker dollar strong global demand company expect lower chinese urea export volume continue volatility nitrogen price global market continue moreover cf industry expect nitrogen demand remain steady globally be partly drive rise global population industrial growth back increase adoption emission control recover mining sector synthetic nitrogen product cf industry be poise gain effort boost production capacity be also enjoy benefit abundant natural gas supply cf industry holding inc price consensus cf industry holding inc price consensus cf industry holding inc quote zack rank stock considercf industry currently carry zack rank hold better rank stock basic material space be methanex corporation meoh free report steel dynamic inc stld free report mosaic company mo free report sporting zack rank strong buy see complete list today zack rank stock here methanex have expect long term earning growth rate share have soar last month steel dynamic have expect long term earning growth rate share have moved last month mosaic have expect long term earning growth rate share have rally past month make fortune shift electric car here stock idea consider much petroleum year lithium power soon shake world create millionaire reshape geo politic soon electric vehicle evs be cheaper gas guzzler be already reach mile single charge battery price plummet charge station set multiply company stand stock buy accord zack research not think see ticker free
1293,MOS,lyondellbasell industry lyb free report stock look promising moment be positive company prospect believe time be right add stock portfolio look promising be poise carry momentum ahead let delve deeper factor make chemical giant intriguing choice investor right now work favor lyb solid rank vgm score lyondellbasell currently have zack rank strong buy vgm score research show stock vgm score combine zack rank buy offer best investment opportunity investor thus company appear be compelling investment proposition moment outperformer lyondellbasell have trounce industry past month company share have rally period compare roughly gain record industry attractive valuation go ev ebitda enterprise value earning interest tax depreciation amortization multiple be often used value chemical stock lyondellbasell be currently trading trail month ev ebitda multiple much cheaper compare industry average superior return equity roe lyondellbasell roe compare industry average manifest company efficiency utilize shareholder fund strong upbeat outlook lyondellbasell profit surge more fold year year share fourth quarter bottom line be boost cash benefit tax reform share adjust earning share quarter outstripped zack consensus estimate revenue go roughly year year quarter beating zack consensus estimate company witness higher sale segment quarter lyondellbasell note strong global demand delay capacity addition industry have lead improve outlook company intend realize benefit strong operate rate global portfolio asset continue upward trajectory profitability houston refinery company expect strong contribution refinery drive effort improve reliability performance lyondellbasell be execute expansion project leverage natural gas liquid advantage company expansion initiative be expect boost capacity add earning company be construct high density polyethylene hdpe plant gulf coast employ proprietary hyperzone pe technology facility be expect have annual capacity pound lyondellbasell be also construct world scale plant gulf coast produce propylene oxide po tertiary butyl alcohol tba have annual capacity pound po pound tba derivative major part company growth investment be allocate project lyondellbasell expect capital spending roughly roughly be target profit generate growth moreover lyondellbasell november enter agreement buy interest quality circular polymer qcp high standard plastic recycling company locate sittard geleen netherlands agreement lyondellbasell be partner qcp suez french company specialize waste water management deal combine lyondellbasell technical capability european market presence suez ability collect recover waste new material new venture be likely provide strategic platform sustainable growth lyondellbasell industry nv price consensus lyondellbasell industry nv price consensus lyondellbasell industry nv quoteother stock considerother company worth consider basic material space include be olympic steel inc methanex corporation meoh free report mosaic company mo free report sporting zack rank see complete list today zack rank stock here olympic steel have expect long term earning growth rate share rally past month methanex have expect long term earning growth rate share have rally past month mosaic have expect long term earning growth rate share have gain past month hottest tech mega trend last year generate global revenue predict blast roof fame investor mark cuban say produce world first trillionaire still leave plenty money regular investor make right trade early see zack best stock play trend
1294,MOS,investor be always look stock be poise beat earning season mosaic company mo free report be such company firm have earning come pretty soon event be shape quite nicely report be mosaic company be see favorable earning estimate revision activity late be generally precursor earning beat analyst raise estimate right earning most date information possible be pretty good indicator favorable trend surface mo report fact most accurate estimate current quarter be currently cent share mo compare broader zack consensus estimate cent share suggest analyst have very recently bump estimate mo give stock zack earning esp head earning season be important positive read zack earning esp have proven be very powerful produce positive surprise outperform market recent year backtest show stock have positive earning esp zack rank hold better show positive surprise nearly time have return average annual return see more top earning esp stock here give mo have zack rank hold esp positive territory investor want consider stock ahead earning see complete list today zack rank stock here clearly recent earning estimate revision suggest good thing be ahead mosaic company beat be card upcoming report wall street next amazonzack evp kevin matra believe familiar stock have only just begin climb become greatest investment time once generation opportunity invest pure genius click detail
1295,MOS,lyondellbasell industry lyb free report be set release fourth quarter result ahead bell feb company adjust earning share third quarter miss zack consensus estimate however revenue increase roughly year year beating consensus mark lyondellbasell have surpass zack consensus estimate trail quarters miss other average positive earning surprise past month share company have gain outperform industry rally let see thing be shape announcement factor consider lyondellbasell third quarter call note hurricane harvey lead reduce inventory petrochemical industry have result further delay startup new ethylene derivative capacity company expect global market remain tight balanced industry have work rebuild inventory fourth quarter zack consensus estimate revenue lyondellbasell fourth quarter stand reflect expect year year growth revenue lyondellbasell intermediate derivative segment soon be report quarter be project witness rise previous quarter zack consensus estimate fourth quarter be peg olefin polyolefin americas segment revenue be expect rise third quarter zack consensus estimate fourth quarter be peg contrary revenue olefin polyolefin europe asia international division be expect witness fall zack consensus estimate be project quarter zack consensus estimate revenue refine segment be peg fourth quarter reflect estimate increase sequential basis technology segment sale be expect rise sequentially be report quarter zack consensus estimate stand company be benefit favorable north american natural gas environment be also execute expansion project leverage natural gas liquid advantage company expansion initiative be likely boost capacity add earning lyondellbasell be construct high density polyethylene hdpe plant gulf coast employ proprietary hyperzone pe technology facility be expect have annual capacity pound furthermore company have start production polypropylene pp compound plant dalian china kiloton year plant be company third facility china be strategically locate cater country grow automotive market november lyondellbasell enter definitive agreement buy interest quality circular polymer qcp high standard plastic recycling company locate sittard geleen netherlands agreement company be partner qcp suez french company specialize waste water management deal combine lyondellbasell technical capability european market presence suez ability collect recover waste new material be likely provide strategic platform sustainable growth however lyondellbasell face headwind hurricane harvey be expect impact fourth quarter result hurricane harvey adversely impact company major gulf coast site previous quarter lead shutdown ethylene cracker company la porte ethylene cracker have unplanned shutdown third quarter due hurricane harvey affect production sale volume quarter lyondellbasell see lose sale expense harvey impact fourth quarter result roughly company also expect lose production due unplanned maintenance ethylene cracker affect fourth quarter result roughly lyondellbasell industry nv price consensus ep surprise lyondellbasell industry nv price consensus ep surprise lyondellbasell industry nv quoteearning whisperour proven model conclusively show lyondellbasell be likely beat estimate quarter have right combination key ingredient zack esp lyondellbasell have earning esp be most accurate estimate be zack consensus estimate be peg uncover best stock buy sell re report earning esp filter zack rank lyondellbasell carry zack rank buy combine positive esp make confident earning beat note stock positive earning esp zack rank strong buy hold have significantly higher chance beating earning estimate conversely sell rate stock zack rank never be consider go earning announcement stock favorable combinationhere be company basic material space want consider model show have right combination element post earning beat quarter huntsman corporation hun free report have earning esp zack rank see complete list today zack rank stock here agnico eagle mine limit aem free report have earning esp zack rank mosaic company mo free report have earning esp zack rank hottest tech mega trend year generate global revenue predict blast roof fame investor mark cuban say produce world first trillionaire still leave plenty money regular investor make right trade early see zack best stock play trend
