,ticker,content
296,PAYX,common pitfall new experience investor alike be buy stock just ahead earning report act right fundamental be top notch compelling growth story stock be bullish setup sometimes strategy work other time end badly especially stock gap earning buy share domino pizza dpz be cup handle base ahead july earning report turn be right call share gap news didn work mobileye mbly recently share crash day report quarterly result company deliver strong quarter earning sale growth news company be end relationship tesla motor tsla rattle investor ibd recently introduce option strategy limit risk earning strategy provide way capitalize upside potential stock move earning reduce risk negative reaction earning report weekly monthly option be used so long cost option be right option market sound bit daunting strategy isn complicate first look stock proper buy point most be build basis look slightly money weekly monthly call option mean strike price be just underlie stock price strike price come premium cost option divide premium stock price multiply give downside risk trade percentage form look trade downside risk less strategy be detailed week earning preview column ibd weekly edition page several stock featured recent week deliver nice option win early winner be nvidia nvda featured edition ibd weekly get support week move average share be trading slightly money weekly call option strike price expiration come premium offer trade downside risk share gap earning close option have be exercise day didn want share have sell option nice profit other winner recent week include salesforce com crm ulta beauty ulta lululemon lulu paychex payx yum brand yum domino course earning option play aren always go work re lower risk alternative buy stock ahead earning risk be predefined
297,PAYX,small group stock sit buy point ahead earning even don measure ideal option play be nonetheless interesting yield upside little know azz inc azz composite rating report tuesday open company provide variety service power generation transmission distribution industrial
298,PAYX,major etfs flex higher wednesday surge semiconductor technology stock lift stock market fresh time high microsoft msft contribute most gain dow jone industrial average close higher seventh day row compute giant soar surprise beat fiscal earning revenue late tuesday investor zero growth azure cloud base unit priority company try stoke growth technology select sector spdr xlk rise stock market today microsoft be second largest stock holding portfolio diversify technology company top hold apple aapl report tuesday most investor be expect firework apple stock have be hammer past year mount worry growth flagship iphone product apple wo have weigh xlk lag several technology etf peer year date recover broad stock market brexit low june flagship tech exchange trade fund have rise so far july comparison guggenheim equal weight technology ryt be same period etfs track technology sector index weight stock portfolio differently ryt give stock equal stake portfolio asset thereby limit impact dominant player sector such apple alphabet googl have return apple account less portfolio asset ryt vs roughly cap weight xlk apple alphabet relatively weak performance have drag xlk say todd rosenbluth director etf research global market intelligence note stock have far smaller weighting ryt benefit performance ryt also benefit more exposure smaller lesser know name such paychex payx intuit intu perform better point apple be only top stock xlk double digit negative return past year microsoft be facebook fb same period xlk hold total asset ibd take apple share be rise relative price strength rating be lowly find highly rate stock technology industry group check leaderboard other etf market action spdr gold share gld fall more gold price tumble lowest level week wednesday investor appetite riskier equity continue rise dollar have also strengthen follow strong housing other economic datum rally have weigh precious metal gold greenback tend move opposite direction gld commodity etf track price gold here look major exchange trade fund tracking various asset class perform today ibd rs rating rs relative price strength rating be measure stock price performance last month compare stock etfs ibd database scale best possible follow daily etf market action be key successful investing spdr spy rs powershare qqq qqq rs spdr dow jone industrial average dium rs ishare core mid cap ijh rs ishare russell iwm rs ishare msci eafe efa rs vanguard ftse emerge market vwo rs spdr gold share gld rs unite state oil uso rs ishare core aggregate bond agg rs powershare db bullish uup rs ipath vix short term future vxx rs
299,PAYX,be quiet open stock market thursday buyer soon gain upper hand bank england hint fresh stimulus measure netease nte paychex payx be top gainer nasdaq strong gainer include hsy report mondelez mdlz be interesting acquire dow gainer include general electric ge intel intc boee ba minute left go session dow jone industrial average nasdaq gain volume nyse nasdaq be tracking lower wednesday level stock market today mobileye mbly gap rise nearly news team intel bmw develop self drive car intel rise ibd name netease follow nicely wednesday rise china base big cap boast outstanding fundamental capitalize huge interest online gaming china now extend cup handle buy point earning front paychex jump nearly company report earning sale growth accelerate prior quarter paychex be buy range buy point earlier session be now extend plunge combine friday monday priceline pcln have gain past session share backed high thursday still rise morgan stanley upgrade online travel firm overweight equal weight raise price target new york mercantile exchange benchmark crude oil august delivery settle barrel dollar rally
300,PAYX,word come mind scanning earning calendar come week defense friday market carnage several defensive stock be show relative strength ahead upcoming earning report many be slow steady mover make less ideal option play acuity brand ayi be exception report wednesday open quarters company
301,PAYX,paychex payx lead provider payroll service small midsize business have resume dividend increase rebound sale profit company begin raise quarterly payout hold steady cent share year latest increase come august hike cent cent share annual dividend be now share yield current share price well average meanwhile stock have rise year also easily outpace paychex be benefit slowly rise employment expansion germany europe biggest economy south america also expand product offering rochester base company recently form partnership canada base kashoo develop accounting software small business be download internet paychex profit sale have be rise slow steady pace past quarters follow series decline recession paychex post better expect gain profit latest quarter sale rise company reiterate outlook stock year earning stability factor be scale most stable least stable meanwhile pretax margin rise straight year robust cash flow also have be rise sign dividend continue rise paychex be member highly rate computer software enterprise industry group include rival automatic datum process adp risk stock include weaker economic growth stiff competition adp other payroll human resource service provider
302,PAYX,pair semiconductor equipment maker climb buy point monday pace list stock hit new high lam research lrcx rise nearly climb back buy point shallow cup shape base volume be weak however indicate deep pocket institutional investor weren participate move much lam recently announce plan
303,PAYX,friday downbeat job report knock back overall stock market especially pressured company strong link nation employment situation paychex payx be such company share slump friday just few session reach multiyear high rochester firm provide payroll process other service related human resource
304,PAYX,politician policymaker continue deal ramification decision vote leave european union investor shrug brexit stock enjoy solid gain big bank such jpmorgan chase jpm bank america bac citigroup hike payout federal reserve capital plan second round stress test nike nke run ahead sale stumble finance arm general electric ge be longer too big too fail tesla motor tsla face regulatory probe volkswagen vlkay paid hefty price settle investigation stock start week finished prior week fall sharply reaction brexit vote financial market roar back nasdaq dow industrial more week key support level help bank england signal thursday ease further summer notable breakout include netease nte lockheed martin lmt biggest bank wednesday pass second round fed annual stress test industry equivalent final exam clear plan hike buyback dividend subsidiary deutsche bank db banco santander san be only one fail second half test gauge bank capital shareholder return plan hold downturn evaluate bank ability assess own financial plan fed pass morgan stanley ms condition fix risk management weakness resubmit capital plan financial forecast bank submit fed test dec morgan bank america jpmorgan citigroup announce bulk capital return plan shortly result be release wednesday result follow first round stress test result prior week bank pass round jpmorgan rise fail end week day line morgan stanley climb deutsche bank slide set fresh record lows finance arm general electric be longer deem systemically important accord financial stability oversight council end ge capital too big fail list ruling ge longer have follow minimum capital liquidity requirement outlined dodd frank act nonbank systemically important financial institution sifi label be put ge capital then general electric have slash ge capital asset refocuse industrial core ge share rise buy point ism manufacturing index rise point june best read month new order production subindex show solid gain employment measure rise point first positive read export order gauge rise best level late separately automaker report strong sale most roughly line analyst expectation june employment report be due july federal reserve likely hold foreseeable future not have great market impact sportswear brand top analyst profit view penny flat year year ep cent sale slightly miss view gain third straight quarter miss revenue estimate currency neutral global future order rise estimate nike see high single digit report revenue growth fiscal guidance disappoint analyst broadly remain bullish nike long term story management assured earning call inventory level be clean basketball business be strong nike name apple aapl ceo tim cook lead independent director late thursday founder phil knight be step chairman nike share rise week volkswagen agree estimate buyback fix diesel engine model sell earlier admit have alter software cheat emission test problem be far resolve world largest automaker still face multiple lawsuit volkswagen confirm settlement europe industry commissioner elzbieta bienkowska call volkswagen offer similar compensation vw buyer europe reuter report volkswagen fall week tesla motor confirm late thursday regulator be probe fatal crash model operate self drive mode news have negative implication autonomous drive broadly tesla still rise friday week close just day day move average mobileye mbly make driver assistance camera system tesla many other announce alliance bmw intel intc friday produce fully autonomous vehicle mobileye soar hunger game studio lion gate entertainment lgf be acquire premium cable network starz strza cash stock deal worth share starz series stockholder receive cash share lion gate nonvoting stock starz series common stockholder receive cash share lion gate voting stock share lionsgate nonvoting stock company say stifel call move appropriately defensive give movie industry volatility other factor deal bring lion gate rival time warner twx premium channel hbo lion gate fall starz jump hsy chocolate giant reject unsolicited share bid snack giant mondelez mdlz say see basis further talk still close thursday suggest investor see sweeter offer work energy transfer equity ete pipeline company terminate merger deal gas pipeline leader william co wmb court rule appeal william energy transfer be contractually entitle end agreement energy transfer share fall william be seek monetary damage fall largely surprise news chairman other board member resign view defensive play wal mart wmt amazon com set july second annual deal load prime day expect be biggest shopping day year last year prime day be biggest single day shopping sale amazon history help drive prime membership even many shopper analyst say actual deal weren great wal mart apparently pre emptive strike amazon announce be offer day trial membership prime comparable shippingpass also offer free day shipping membership fee be half prime membership amazon share rise wal mart alcoholic beverage maker constellation brand stz report share earning bump revenue rise top street view top bottom line beer sale rise wine spirit sale grow share rise week hit record high late thursday micron technology mu report sale item year year cent share loss ex item swing cent gain year earlier quarter fiscal sale miss analyst forecast loss top view cent loss micron announce cost cut plan include job cut micron share tumble friday week general mill gis fiscal earning share revenue beat estimate raise cost saving estimate earlier maker cheerio wheaty cereal other shelf stable brand have top earning estimate last quarters share leap week record high contrast shelf stable frozen food maker conagra food cag report lower ep just meet view expect revenue decline conagra affirm plan split lamb weston potato product business fall sell part commercial food business move headquarters chicago conagra climb week hit record high acuity brand ayi highly rate company make smart connect light system report third quarter result top expectation acquisition help sale company remain optimistic potential impact vote leave eu company have composite rating best possible acuity brand stock rise week paychex outsource service firm paychex payx say ep climb cent line view revenue increase beating estimate stock pop report trading week best late also more past consolidation buy point
305,PAYX,here be investing action plan thursday need know investor investor reward bank such jpmorgan jpm citigroup bank america bac federal reserve review capital plan earning be also tap constellation brand stz paychex payx micron technology mu conagra food cag stress test federal reserve
306,PAYX,stock market be nicely higher midday wednesday brexit concern stay back burner second straight session nasdaq rise help strong show china base netease nte add oil gas name do heavy lift dow picked chevron cvx merck mrk nike nke be early leader volume nyse nasdaq be tracking close tuesday level new york mercantile exchange crude oil benefit again dollar weakness decline crude inventory wti crude august delivery rise nearly barrel nasdaq gap still have potential resistance level watch nasdaq just level day move average ibd component netease jump nearly breakout have generally be have tough time current market netease clear cup handle base buy point netease be several strong performer computer software gaming group see other leader be ibd stock checkup stock market today lead light specialist acuity brand ayi gain nearly report strong earning open quarterly profit rise year share sale increase buy point be still play acuity still need get day line currently result paychex payx be due thursday open share rise high still buy range buy point biotech tesaro tsro more double price ovarian cancer drug do well late stage trial leaderboard name amazon com amzn extend gain bounce day move average tuesday share rise
307,PAYX,stock ve easily find excuse go friday index keep cool nasdaq add rise ibd jump volume fall major exchange be normal day day holiday market be close monday memorial day market be look excuse
308,PAYX,share automate datum process adp moved higher open stock market today outsourcer payroll tax filing datum process service top quarterly earning view roseland base company report earning cent share fiscal third quarter end march be prior year
309,PAYX,stock be hit session high late thursday recoup big chunk previous day loss mixed earning report economic datum
310,PAYX,dow jone industrial average rise nasdaq rally add volume be tracking higher nasdaq lower nyse compare same time wednesday
311,PAYX,stock market today nq mobile nq plunge much massive volume short seller muddy water research group slap strong sell rating stock call chinese developer mobile security software massive fraud
312,PAYX,muddy water accuse company falsify financial information vastly overstate market share china
313,PAYX,meanwhile gunmaker sturm ruger rgr drop volume be run more double daily average
314,PAYX,stock have recently rise buy point level investor consider take profit now buy point
315,PAYX,generac holding gnrc be biggest gainer ibd stock maker portable generator gap bolt report result blow away view company also raise full year sale outlook due strong demand residential generator impact baldor generator buyout generac clear buy point late stage double bottom base
316,PAYX,elsewhere medidata solution mdso soar new high provider clinical development software report profit jump year earlier beating wall street expectation sale period rise
317,PAYX,stock be extend flat base entry stock be hit session high late thursday recoup big chunk previous day loss mixed earning report economic datum dow jone industrial average rise nasdaq rally add volume be tracking higher nasdaq lower nyse compare same time wednesday stock market today nq mobile nq plunge much massive volume short seller muddy water research group slap strong sell rating stock call chinese developer mobile security software massive fraud muddy water accuse company falsify financial information vastly overstate market share china meanwhile gunmaker sturm ruger rgr drop volume be run more double daily average stock have recently rise buy point level investor consider take profit now buy point generac holding gnrc be biggest gainer ibd stock maker portable generator gap bolt report result blow away view company also raise full year sale outlook due strong demand residential generator impact baldor generator buyout generac clear buy point late stage double bottom base elsewhere medidata solution mdso soar new high provider clinical development software report profit jump year earlier beating wall street expectation sale period rise stock be extend flat base entry
318,PAYX,stock end modestly lower wednesday federal reserve chief janet yellen say be live possibility interest rate hike next month fall dow jone industrial average edge nasdaq dip volume be mixed dip nyse rise nasdaq compare tuesday accord preliminary datum maker consumer stock be biggest loser stock market today motorola solution msi make way radio other communication product plunge more better expect profit sale result stock have be work flat base crash day move average finally steadying just day line tesla motor tsla lead share automaker higher soar electric vehicle maker delivery outlook trump weaker expect quarterly earning report stock be testing resistance day line remain week higher homeaway away rocket post session trading expedia expe agree buy online marketplace vacation rental deal be expect close first quarter next year pending regulatory approval be expect help expedia compete home rental business such airbnb meanwhile facebook fb rise hour trading follow earning report profit period rise cent share gain revenue top wall street estimate company say number daily active user rise year average september mobile daily active user jump average month facebook rise regular session buy range buy point qualcomm qcom be sharply hour outlook fiscal first quarter end december trail analyst estimate outweighed better expect result latest period disney celgene celg cyberark software cybr nvidia nvda be company schedule report quarterly earning thursday economic report due thursday include initial jobless claim week end oct productivity datum
319,PAYX,stock climb tuesday earning merger activity trump news potential downgrade portugal debt
320,PAYX,stock climb tuesday earning merger activity trump news potential downgrade portugal debt
321,PAYX,want hear ibd analysis today market emerge stock click here watch market wrap video
322,PAYX,monday adobe system adbe jabil circuit jbl paychex payx deliver better expect earning toronto dominion bank td say pay cash cerberus capital management chrysler financial corp dutch chemical maker dsm say plan buy biotech martek bioscience matk cash
323,PAYX,nyse composite rally nasdaq however volume fall board
324,PAYX,wabco holding wbc gap surge record high nearly time average turnover auto part maker raise fourth quarter full year earning forecast current analyst estimate wabco make automotive brake transmission control system
325,PAYX,arm holding armh jump month high nearly twice average trade stock clear buy point cup handle base accord bloomberg report microsoft msft be due announce version window operate system arm processor be tablet smart phone
326,PAYX,hansen natural han rise heavy trading stock finished session high match nov peak analyst see earning rise year
327,PAYX,close tibco software tibx report earning cent share cent view sale grow also view share jump extend trading
328,PAYX,red hat rht fall report earning cent share match view sale grow view
329,PAYX,athletic gear maker nike nke lose report earning cent share cent estimate sale rise slightly view
330,PAYX,xilinx xlnx warn sale fall work analyst poll thomson reuter expect
331,PAYX,want hear ibd analysis today market emerge stock click here watch market wrap video
332,PAYX,monday adobe system adbe jabil circuit jbl paychex payx deliver better expect earning toronto dominion bank td say pay cash cerberus capital management chrysler financial corp dutch chemical maker dsm say plan buy biotech martek bioscience matk cash
333,PAYX,nyse composite rally nasdaq however volume fall board
334,PAYX,wabco holding wbc gap surge record high nearly time average turnover auto part maker raise fourth quarter full year earning forecast current analyst estimate wabco make automotive brake transmission control system
335,PAYX,arm holding armh jump month high nearly twice average trade stock clear buy point cup handle base accord bloomberg report microsoft msft be due announce version window operate system arm processor be tablet smart phone
336,PAYX,hansen natural han rise heavy trading stock finished session high match nov peak analyst see earning rise year
337,PAYX,close tibco software tibx report earning cent share cent view sale grow also view share jump extend trading
338,PAYX,red hat rht fall report earning cent share match view sale grow view
339,PAYX,athletic gear maker nike nke lose report earning cent share cent estimate sale rise slightly view
340,PAYX,xilinx xlnx warn sale fall work analyst poll thomson reuter expect monday adobe system adbe jabil circuit jbl paychex payx deliver better expect earning toronto dominion bank td say pay cash cerberus capital management chrysler financial corp dutch chemical maker dsm say plan buy biotech martek bioscience matk cash nyse composite rally nasdaq however volume fall board wabco holding wbc gap surge record high nearly time average turnover auto part maker raise fourth quarter full year earning forecast current analyst estimate wabco make automotive brake transmission control system arm holding armh jump month high nearly twice average trade stock clear buy point cup handle base accord bloomberg report microsoft msft be due announce version window operate system arm processor be tablet smart phone hansen natural han rise heavy trading stock finished session high match nov peak analyst see earning rise year close tibco software tibx report earning cent share cent view sale grow also view share jump extend trading red hat rht fall report earning cent share match view sale grow view athletic gear maker nike nke lose report earning cent share cent estimate sale rise slightly view xilinx xlnx warn sale fall work analyst poll thomson reuter expect
341,PAYX,stock open higher weekly jobless claim fall more expect nyse composite rise nasdaq dow volume climb nasdaq fall nyse heico hei gap fly month high late wednesday aircraft part maker top view lift fiscal earning gain sale heico peg full year profit share vs view also guide full year sale ahead view polypore ppo gap rally brisk turnover stock find support day move average tuesday be news maker filtration solution have already trade more third average daily volume jinko solar jks climb bounce back day pullback chinese maker solar cell wafer come public clear first base july have more double downside cyberonic cybx slip report better expect quarter result late wednesday
342,PAYX,heavy loss smack mutual fund investor month chock full political economic drama here abroad volatility sky-rocket light debt ceiling debate standard poor lower debt rating europe debt crisis worsening steady stream weak economic datum stock sell heavy volume investor fled safe haven
343,PAYX,stock future point sharply higher ahead thursday open dollar fall overseas market show firm gain dow future be point slightly earlier high future hold point gain nasdaq future be point ahead large portion action stock market today be response
344,PAYX,update late rebound help stock finish side wednesday
345,PAYX,major index open higher upbeat economic datum gain fizzle follow weak result treasury year note auction buyer come rescue final minute
346,PAYX,dow nyse composite rally gain nasdaq rise
347,PAYX,volume finished exchange
348,PAYX,number leader notch strong gain
