,ticker,content
0,PAYX,rochester base paychex payx take dive wednesday stock ibd dividend leader have just report fiscal fourth quarter earning growth just meeting analyst view revenue rise better expect thursday handful analyst rolled report reiterate rating hold neutral market perform equal weight pretty much expect unassuming income stock paychex stock have periodically be highflier market downturn paychex share have averaged gain year include decline surge smaller double digit annual gain otherwise stock have stick small single digit gain march paychex announce acquire denmark base lessor group lessor give paychex entry market northern europe term be report deal show cash rich paychex start look further afield growth opportunity paychex president chief executive martin mucci say company aim expand european operation currently limit largely germany get newsletter deliver inbox more info product service privacy policy term use paychex continue look expand market penetration country lessor be now well other european country next month say market capitalization more year old paychex be large cap tech name provide service product help company manage employee payroll health care insurance retirement benefit need typically labele human capital management global market be massive estimate grow more accord grand view research predominate product paychex flex be cloud base subscription product design cover employment management hire retirement core payroll process platform be surepayroll company acquire surepayroll payroll service be revenue human resource service be revenue fiscal paychex fiscal year end paychex be focuse company fewer employee report client retention begin fiscal company run clean balance sheet report debt cash corporate investment wednesday drop come very heavy volume do damage chart slip left stock start become handle month cup base handle be least day long so paychex get friday handle yield valid buy point stock behave well buy point be deutsche bank raise price target stock thursday citigroup raise well fargo hike price target also paychex pay quarterly dividend cent share currently yielding annualize basis get instant access more trading idea exclusive stock list ibd proprietary rating only related stock market hit afternoon selling tech stock small cap hit ipo lovesac investment conference news gathering financial advisorswill investment management portfolio service boom china ceo say cryptocurrency future bitcoin blockchain transform financial system
1,PAYX,dividend stock paychex payx provide outsource service payroll personnel space company offer current dividend yield accord ibd sister company william neil co dividend growth rate be paychex have impressive fundamental return equity gauge financial efficiency be last year best year number be especially impressive investor consider company carry debt high financial leverage boost roe carry risk get newsletter deliver inbox more info product service privacy policy term usepretax margin be area strength paychex last year pretax margin come highest least year highest paychex business outsource industry group year earning growth rate be earning stability factor be scale most calm most wild sale growth rate be fiscal year end street expect quarterly earning roll cent share increase year quarter paychex be stick price channel month begin july stock find resistance support stock break october rise start new consolidation late december paychex then break late january advanced less consolidate again bring action present consolidation be deep low undercut low previous december january pattern create shakeout weak holder shakeout raise odd next work paychex need build more pattern right side stock be high most consolidation have form week move average be flaw bull ve prefer see pattern take shape week line relative strength line have decline mid december rs line measure stock performance vs decline line point related stock analyst be bearish applenvidium reason buy rulemarketsmith week
2,PAYX,do get mix end second quarter july holiday answer be not much way earning report option trading idea come week tesla earning season standstill firm close book second
3,PAYX,here investing action plan wednesday need know investor come day marijuana stock again be spotlight canopy growth cgc deliver first quarterly report go public last month meanwhile paychex payx also report stock approach buy point ibd display video id width
4,PAYX,solid move previous base dividend leader paychex payx have be quietly set new base last week share be proper entry point stock market today payroll human resource leader have be buoy strong gain
5,PAYX,paycom software payc be track expansion regional office move expect build direct sale strategy analyst say thursday maker human resource payroll process software have be add regional office target small medium size business customer paycom have add regional office so far year vs have regional office aim grow number effort be part battle paycom be wage service bureaus automatic datum process adp paychex payx customer even most mature market consistency company direct sale office continue impress keybanc capital market analyst brent bracelin say note client even tulsa reside largest area compete directly adp paychex office tulsa location be second highest perform office last quarter get newsletter deliver inbox more info product service privacy policy term use new bottom forecast imply revenue double then double again office location reach earmark goal add bracelin have overweight rating stock paycom stock fall close stock market today share be thus far paycom be member ibd sector leader stock list technical view stock have be form cup chart pattern trade day move average positive signal paycom be buy point company also compete ultimate software ulti paylocity hold pcty analyst say related link ibd stock day paycom near buy point earning growth set acceleratesell take profit hold here be several guideline followchart read basic buy point mark time real find great growth stock learn spot flat base bullish chart pattern
6,PAYX,stock future flattened then fall early premarket trade wednesday market continue seek foothold monday global sell ibd list other lead stock continue show resilience premarket action stock include kemet kem be set open wednesday buy range buy point sonic sonc aerovironment avav dive late tuesday report quarterly result close oil price close week high be likely be active wednesday session nasdaq future slip ahead wednesday open dow industrial trade fair value future be oil price factor wednesday market session comment state department supply disruption libya canada send benchmark oil more tuesday west texas intermediate crude trade early wednesday top barrel highest level europe brent crude gaoin trading just get newsletter deliver inbox more info product service privacy policy term useoilprice com report libya oil port be longer controlled libyan national army unofficial national oil corporation be affiliated country eastern government base benghazi addition state department official tell reporter global oil buyer cut import iran november buyer fail respect rule face harsh sanction iran export more barrel day country include china india turkey accord bloomberg oil also receive late boost american petroleum institute release datum show oil inventory decrease more barrel week end june economist project barrel decrease official weekly crude storage datum be due energy information administration et wednesday choppy market plenty ibd name end trade tuesday well position acquisitive investor kid friendly dollar store end tuesday session less buy point week tight pattern ibd leaderboard name score breakaway gap june crush first quarter expectation share consolidated just june high complete week tight pattern friday june be third stage base put late stage territory add risk failure further attempt dow jone industrial average have lose ground steadily june kemet complete right side base add handle good measure handle present buy point stock trade less entry tuesday close fort lauderdale fla base maker capacitor used auto telecom aerospace application have best possible ep rating ibd relative strength line be near new high sign strength other watchlist worthy ibd name be healthequity hqy mastercard stock be industry largely unaffected concern china trade brawl remain extend breakout healthequity be day move average mastercard be line touch back rebound level support create buy opportunity case aerovironment ground loss fiscal fourth quarter earning decline much less expect revenue gain eke past consensus target maker remote controlled drone break past cup handle buy point heavy volume regular trade tuesday drive burger joint sonic slunk lower oklahoma city okla base chain report fiscal third quarter revenue earning narrowly analyst consensus target same store sale drive margin decline management trim be full year earning guidance sonic share be extend june general mill gis paychex payx report result wednesday morning retailer bed bath bbby pier pir riteaid rad be schedule report close get instant access more trading idea exclusive stock list ibd proprietary rating only also homebuilder stock soar demolish earning viewsthese stock just come ibd stock liststrump say harley move abroad be begin end
7,PAYX,paycom software payc tuesday report earning revenue beat analyst estimate forecast line june quarter sale share be hour trade paycom say adjust first quarter earning be cent share year revenue rise top consensus estimate year earlier company earn cent share sale analyst expect earning cent sale period end march june quarter paycom say expect sale line expectation paycom forecast adjust earning interest taxe depreciation amortization ebitda also meeting estimate get newsletter deliver inbox more info product service privacy policy term full year paycom increase revenue forecast vs prior outlook analyst have estimate paycom be rank ibd roster growth company share maker human resource payroll process software drop hour trading stock market today tuesday regular session share fall enterprise software provider have expand direct sale strategy add regional office have enabled company gain market share small medium size business customer vs service bureaus automatic datum process adp paychex payx paycom also have better margin rival ultimate software ulti paylocity hold pcty analyst say also be interested big squeeze new risk fed interest rate recession yield curvenvidium apple avoid get chopped market volatilitysell take profit hold here be several guideline followchart read basic buy point mark time real opportunity
8,PAYX,paychex payx see positive improvement relative strength rs rating tuesday increase exclusive rating investor business daily measure price movement worst best score score show stock price performance last week compare other stock database history show best perform stock typically have higher rs rating begin biggest price move see paychex continue rebound hit benchmark look best stock buy watch start herepaychex be buy range breaking past entry flat base proper buy range be initial entry once stock hit benchmark best set buy opportunity sale growth fall last quarter ep grow prior report company hold rank peer commercial service outsource industry group cinta cta insperity nsp healthequity hqy be top highly rate stock group related stock be show rise relative strength use ibd relative strength rating relative strength line help judge stock
9,PAYX,here investing action plan thursday need know investor come day tomorrow see last gasp significant earning news year right wall street clear holiday lead nike nke accenture acn cinta cta paychex payx carmax kmx
10,PAYX,nasdaq composite lead stock higher tuesday afternoon netflix nflx strong earning contribute rally leisure sector nasdaq climb thank part strength biotechs surge share netflix beat subscriber estimate late monday netflix be largest component nasdaq weighting russell rise dow jone industrial average ease johnson johnson jnj tumble heavy trading procter gamble pg slide more big volume federal court dealt setback company patent blockbuster arthritis drug remicade news overshadowed fourth quarter result beat view top sale profit expectation report say be concern company margin volume major exchange be tracking higher compare same time monday netflix share shot time high last evening fourth quarter result video stream company add new subscriber worldwide hike subscriber fee netflix be reason ibd movie industry group be best perform today market other leisure industry group also be lead include travel book lodging group be top group marriott vacation vac rally past buy point base base formation volume be only average eldorado resort eri break flat base rise past entry substantial volume eldorado own casino colorado florida louisiana mississippi nevada other state couple biotechs also break industry continue flex muscle wave life science wve clear cup handle base buy point volume be flat spectrum pharmaceutical sppi break undefined pattern heavy volume stock dip buy point teradata tdc break past buy point flat base volume be well normal level relative strength line have not make new high morgan stanley upgrade datum storage company equal weight underweight marketwatch report paychex payx top entry flat base intense volume stock give back much early surge payroll human resource retirement insurance service provider have weak relative strength line relative price strength rating related dow topple judge toss patent blockbuster drugnetflix fourth quarter earning report key takeaway
11,PAYX,paychex payx have be mainstay dividend leader screen time now mostly due generally steady earning growth well consistent grow dividend paychex provider payroll human resource retirement insurance service small medium size business recently declare quarterly dividend cent share
12,PAYX,major market average be modestly higher early trade thursday dow jone industrial average lead way rise moved meanwhile tech heavy nasdaq trim early gain dow jone industrial component nike nke report quarterly result close thursday stock be extend cup handle entry analyst expect apparel maker earn cent share revenue totale share rise nearly morning trade turn unchanged downside intel intc fall move back cup shape base buy point wednesday fang stock netflix nflx advanced early thursday stock be build flat base entry previous cup handle faltered first stock regain day line company report earning paychex payx decline payroll manager report better expect sale figure line fiscal ep thursday early fall stock be buy point etsy etsy moved keybanc initiate coverage overweight rating price target premium wednesday close price share cup handle entry dec biotech stock biogen biib fall trimming earlier loss company disclose negative update alzheimer drug stock have be build cup shape base buy point thursday action put damper action stock be look support day line still add handle current formation lead chip stock be pressure stock market today memory chip leader micron technology mu faltered stock continue form right side potential base company report strong quarterly result late tuesday meanwhile chip gear maker apply material amat decline nearly stock consolidate day line ibd cinta cta be buy range flat base buy point head fiscal result close analyst expect uniform provider earn share revenue amount elsewhere lead growth stock alibaba group hold baba be pace extend streak trading session rise still stock day line remain current level resistance have emerge previous week related dow jone industrial average dow stock news analysisstealth growth stock buy zone report investing action planahead earning nike face adida home puma abroad oil giant buy point price recover investing action plan
13,PAYX,bill ackman be do valeant pharmaceutical vrx still shorting herbalife hlf tweeting chipotle cmg now billionaire hedge funder be turn blue eye gaze payroll firm automatic datum process adp xackman persh square capital be seek control adp board seat say adp friday statement adp say persh first reach tuesday ackman beneficially own payroll processor ask company extend aug board nomination deadline day nominate director include adp board ackman also tell adp ceo carlos rodriguez be replace adp be push back tout total shareholder return rodriguez take helm contrast persh return adp be open constructive input shareholder board respect right shareholder nominate director say company however adp have clearly defined board nomination process deadline director nomination have be public nearly year board have unanimously determine be not best interest adp other shareholder accede persh square last minute request extension current board have effective balance leadership continuity fresh perspective help adp further goal say statement adp share rise initially close stock market today peer paycom software payc paychex payx paylocity pcty do react much ackman quest be well know take bet drugmaker valeant way bottom more less hold persh square stake march year price spiking scandal drive other hedge fund persh square be reportedly offer share late high trade also have dollar bet multilevel marketing firm herbalife allege nutrition supplement seller be pyramid scheme federal trade commission leveled complaint herbalife last july result company agree fully restructure business pay consumer charge herbalife deceive person believe get rich quick become distributor product ensue ftc regulation have weigh herbalife share be so far calendar year few week ackman joined twitter have post just tweet so far eating own cook chipotletweet make own mix https co cintycywhp pic twitter com ryad bill ackman billackman july persh square take stake chipotle last year chipotle have resume slide be trading year lows related valeant dife year low ackman throw towel trouble herbalife face new challenge upcoming film ackman chipotle menu breakfast burritos mcdonald spike ftc settlement short live
14,PAYX,earning be do come week be quiet earning front most firm get ready close book yet month quarterly earning season be well underway investor doubt have several call option trade consider help mitigate risk earning several institutional quality
15,PAYX,finish line finl dive weak earning sale early wednesday winnebago wgo reversed year high better expect result paychex payx report mixed result estimate share loss narrow cent cent year revenue increase result share loss cent sale significantly estimate same store sale rise just apparel accessory sale fall sharply footwear comp rise high single digit sale macy location jump outlook finish line see ep december february just cent vs analyst view cent stock share athletic gear retailer tumble stock market today well intraday lows finish line break dec then sell dip sell territory last week last month foot locker fl beat earning view revenue be line forecast dick sporting good dks however report strong earning guide weak holiday quarter meanwhile athletic shoe apparel giant nike nke report unexpected earning share gain late tuesday nike rise wednesday estimate fiscal ep cent revenue climb result ep rise cent revenue advanced stock share provider payroll human resource service fall session lows paychex close tuesday briefly clear buy point automatic datum process adp edge higher wednesday intraday rise fresh record high tuesday related paychex outperform market dividend price gainpaycom find big profit sticking smaller firm simpler plansestimate fiscal ep dip cent revenue rise result earning climb cent sale rise stock share rv maker rise high early trading not far time high set late share reversed trade tuesday winnebago have soar more late september just agree buy towable rv maker grand design last month rival thor industry tho easily top fiscal forecast indicated expand production meet high demand stock be profit take zone november related be expand rv maker head labor cost crunch boomer head highway patrick poise profit
16,PAYX,year be wind earning report continue roll slower pace latest week be quiet earning front adobe system adbe only really liquid institutional quality name buy point ahead earning apogee enterprise apog be buy point ahead earning report small cap
17,PAYX,be more same friday new high list financial stock dominate action vast majority bank be well extend price few name outside financial sector do well friday still be early stage upside move paychex payx hit new high ahead dec earning
18,PAYX,expand human resource unit push paychex payx ahead earning estimate fiscal second quarter disappointing overall sale number rochester base payroll process human resource company report profit cent share month period end nov increase year earlier beat
19,PAYX,embattled restaurant chain chipotle grill cmg have price target slash early thursday micron technology mu also get price target cut payment process firm global payment gpn have price target raise follow major buyout announcement earlier week abbreviated trading day wall street telsey advisory group lower price target
20,PAYX,income investor predictability dividend stock most time count steady yield regardless stock price performance so dividend stock outperform market get bonus stock tuesday dividend leader list be beating market term yield stock action
21,PAYX,stable earning track record big dividend be hallmark solid dividend play here be dividend leader feature paychex payx featured tuesday income investor column score earning stability factor scale most stable least stable have year earning growth rate offer
