,ticker,content
520,PAYX,have be month last earning report paychex inc payx free report share have add time frame outperform market recent positive trend continue lead stock next earning release be due pullback dive investor analyst have react late let take quick look most recent earning report order get better handle important driver paychex soar earning beat upbeat viewpaychex commence fiscal impressive note report solid result fiscal first quarter top bottom line come ahead respective zack consensus estimate moreover company register year year improvement count company report gaap earning share cent beat zack consensus estimate couple cent grow year year upside mainly stem higher revenue efficient cost management quarter detailspaychex report total revenue include interest fund hold client year year exclude interest fund hold client total service revenue payroll service human resource service ascend year year zack consensus estimate be peg payroll service segment revenue go year period primarily back higher revenue check client base human resource service segment revenue rise year year chiefly drive strong growth client base employee elevated revenue retirement well online hr administration service growth be partially offset tough comparison segment revenue benefit implementation affordable care act interest fund hold client increase year year basis mainly benefit higher average interest rate earn paychex total expense flare year tally due increase investment technology peo business acquisition related expense also contribute increase however total expense percentage total revenue contract basis point bps company operate income grow year year addition paychex operate margin expand bps chiefly drive lower total expense percentage revenue net income come report prior year quarter balance sheet cash flowpaychex exit fiscal first quarter cash cash equivalent corporate investment compare record end previous quarter company have long term debt generate operate cash flow report quarter quarter paychex paid dividend repurchase share worth guidancebuoy splendid fiscal first quarter result company raise revenue outlook company now anticipate total revenue jump previous estimate translate revenue be higher zack consensus estimate human resource service revenue be now project grow range project earlier apart company revise guidance operate margin effective tax rate operate margin be anticipate be compare previous guidance approximately effective income tax rate be now project be band previous estimate other guidance provide fourth quarter fiscal result remain unchanged management expect payroll service revenue climb year year range interest fund hold client investment income be expect grow mid upper range net income be still likely advance year year gaap basis gaap basis gaap earning share be estimate be range come zack consensus estimate be currently peg have estimate be move then follow release investor have witness downward trend fresh estimate have be revision lower current quarter look back additional day see even more downward momentum have be move higher compare lower month paychex inc price consensus paychex inc price consensus paychex inc quotevgm scoresat time paychex stock have nice growth score be lag bit momentum front charting somewhat similar path stock be allocate grade value side putt bottom investment strategy overall stock have aggregate vgm score aren focuse strategy score be be interested style score indicate stock be more suitable growth investor momentum investor outlookwhile estimate have be broadly trend downward stock magnitude revision have be net interestingly stock have zack rank buy be expect average return stock next few month
521,PAYX,share lennar corp len free report surge post third quarter earning share surpass zack consensus estimate paychex inc payx free report share rally report first quarter earning share surpass zack consensus estimate share wal mart wmt free report increase almost company purchase parcel new york base delivery startupmyovant science myov free report gain almost company report positive result takeda study development drug relugolix
522,PAYX,paylocity hold pcty free report have impressive earning surprise history have surpass zack consensus estimate trail quarters deliver average positive surprise expect long term earning share growth rate market cap seem be stock investor need retain portfolio be look reap long term gain let take look factor aid company performance paylocity provider cloud base payroll human capital management hcm software solution be gain regular investment saas technology last few quarters client move traditional payroll service provider company saas base service contribute significantly revenue hence regular investment technological upgrade product innovation continue boost company top line notably paylocity stock have gain last year outperform industry rally believe accelerate adoption company robust portfolio have aid company financial third quarter fiscal company revenue come reflect increase year year beating zack consensus estimate paylocity hold corporation revenue ttm paylocity hold corporation revenue ttm paylocity hold corporation quoteapart organic enrichment portfolio management be extremely optimistic acquisition beneflex new buyout have add host benefit administration related solution be expect drive revenue further however competition payroll process sector exist player automatic datum process inc adp free report paychex inc payx free report oracle corporation orcl free report other remain major headwind increase competition new entrant also remain threat be expect generate pricing pressure affect paylocity margin go ahead zack rankpaylocity have zack rank hold see complete list today zack rank strong buy stock here more stock news be bigger iphone become mother technological revolution apple sell mere iphone year new breakthrough be expect generate more device just year create market zack have just release special report spotlight fast emerge phenomenon ticker take advantage don buy now kick click here trade
523,PAYX,be tail end first quarter earning season current report cycle be track record strongest growth past year total earning be expect be revenue growth latest earning outlook report be much higher earning growth revenue growth record bullish projection quarter have be attribute factor corporate tax overhaul apart improve economy much improve job market report member have report quarterly result company deliver positive earning surprise beat top line expectation earning company increase year quarter revenue rise business service perform wellgiven prevalent healthy scenario zack sector be project end current report cycle year year earning growth moreover be anticipate display double digit earning growth member business service sector have already report financial number record top bottom line growth respectively first quarter sector benefit strong economy reduce tax rate robust manufacturing manufacturing activity ease dollar momentum oil price sneak peek drive factorsgross domestic product gdp grow seasonally adjust annual rate first quarter follow gain fourth quarter advance estimate release bureau economic analysis slowdown growth be mainly due seasonal quirk economist expect growth accelerate second quarter lower corporate individual tax rate increase government spending be expect push annual economic growth target economic activity manufacturing sector expand april overall economy grow consecutive month manufacturing activity continue robust performance april pmi measure ism touch show strong growth manufacturing consecutive month drive continue increase new order production activity employment inventory manufacturing industry report growth april employment index grow april indicate employment growth consecutive month manufacturing industry report employment growth increase come company be hire more skilled worker indirect personnel far manufacturing sector be concern nmi be april record consecutive month expansion price index gain employment index decline many manufacturing industry report growth continuous increase pmi nmi number job offer manufacturing giant further boost optimism key picksgiven bullish sentiment surround business service stock not be bad idea add company have potential report better expect earning time however give high degree diversity sector pick right stock portfolio appear be colossal task easy way narrow list be choose stock have favorable zack rank strong buy buy hold positive earning esp be do help zack stock screener see complete list today zack rank stock here earning esp be proprietary methodology determine stock have best chance surprise next earning announcement earning esp show percentage difference most accurate estimate zack consensus estimate uncover best stock buy sell re report earning esp filter research show stock combination chance positive earning surprise be high here be business service stock match abovemention criterium thus emerge winner report cycle news information provider thomson reuter corporation tri free report currently carry zack rank have earning esp company earning surpass zack consensus estimate previous quarters deliver average positive earning surprise moreover last day zack consensus estimate first quarter earning increase cent share full year earning estimate increase share same time frame company be slate report quarterly result bell management technology consult service provider booz allen hamilton hold corporation bah free report be also zack rank company earning esp company be poise beat earning estimate company surpass earning estimate trail quarters average beat last day zack consensus estimate first quarter earning increase cent share full year earning estimate increase share same time frame company be slate report quarterly result market open integrate financial information analytical application provider factset research system inc fds free report have earning esp zack rank hold company earning surpass zack consensus estimate last quarters average beat zack consensus estimate third quarter fiscal earning increase share full year earning estimate increase share same time frame company be expect report quarterly result jun payroll human resource retirement insurance service provider paychex inc payx free report surpass zack consensus estimate last quarters average beat have zack rank earning esp last day zack consensus estimate third quarter fiscal earning remain unchanged cent share full year earning estimate increase share same time frame company be expect report quarterly result jun wall street next amazonzack evp kevin matra believe familiar stock have only just begin climb become greatest investment time once generation opportunity invest pure genius click detail
524,PAYX,dun bradstreet corporation dnb free report be slate report first quarter result market close top line be expect benefit higher organic growth acquisition lower tax rate improvement operate income be likely boost bottom line observe share dun bradstreet have gain past year underperform industry gain respectively revenue expectation zack consensus estimate first quarter revenue stand indicate year year growth top line be expect benefit higher organic growth favorable foreign currency movement acquisition disposition zack consensus estimate americas segment revenue be indicate year year growth fourth quarter segment revenue improve dun bradstreet corporation revenue ttm dun bradstreet corporation revenue ttm dun bradstreet corporation consensus estimate americas segment revenue be peg indicate year year growth fourth quarter segment revenue improve fourth quarter total revenue increase year year earning improve year zack consensus estimate earning be report quarter be peg share indicate year year growth lower tax rate result tax cut job act improvement operate income be likely boost company bottom line fourth quarter adjust earning share be year quarter model doesn suggest beatplease note accord zack model company zack rank strong buy buy hold have good chance beating estimate also have positive earning esp zack rank sell strong sell stock be best avoid especially company be witness negative estimate revision uncover best stock buy sell re report earning esp filter dun bradstreet have zack rank earning esp combination make surprise prediction difficult stock considerhere be stock broader business service sector investor consider model show have right combination element beat earning respective upcoming release paychex inc payx free report have earning esp zack rank company be expect report fourth quarter fiscal result jun see complete list today zack rank stock here factset research system inc fdc free report have earning esp zack rank company be expect report third quarter fiscal earning jun wex inc wex free report have earning esp zack rank company be expect report second quarter result jul more stock news be bigger iphone become mother technological revolution apple sell mere iphone year new breakthrough be expect generate more device just year create market zack have just release special report spotlight fast emerge phenomenon ticker take advantage don buy now kick click here trade
525,PAYX,prudent investment decision involve buy stock have solid prospect selling carry risk time be rational hold certain stock have enough potential be weigh tough market condition here discuss factset research system inc fds free report company have expect long term earning share growth rate moreover earning be expect register growth fiscal respectively year time share factset have gain outperform composite rise
526,PAYX,aptiv plc aptv free report yesterday announce have inked deal purchase interconnect base provider custom engineer interconnect solution harsh environment application affiliate snow phipps group subject regulatory approval fulfillment customary close condition propose buyout be expect close end come heel aptiv acquisition south korea base provider engineer connector cable management solution kum jun glimpse aptiv price trend reveal stock have have impressive run bourse past month share aptiv have return significantly outperform industry gain say time frame signal power solution likely growpost deal closure operate independent business unit aptiv signal power solution segment segment design manufacture assemble electrical architecture vehicle include engineer component product wiring assembly harness connector cable management electrical center hybrid high voltage safety distribution system first quarter segment contribute largest chunk aptiv total revenue revenue segment increase year year billionkevin clark aptiv president chief executive officer state further establish aptiv market leader connectivity solution be strategic fit signal power solution segment acquisition have be key growth catalyst aptiv company have be continuously acquire investing company globally internationally expand capability strengthen market share increase geographic presence zack rank stock aptiv have zack rank buy see complete list today zack rank strong buy stock here other top rank stock broader business service sector include blucora bcor free report holding iqv free report paychex payx free report blucora sport zack rank holding paychex carry zack rank long term expect earning share growth rate blucora holding paychex be respectively more stock news be bigger iphone become mother technological revolution apple sell mere iphone year new breakthrough be expect generate more device just year create market zack have just release special report spotlight fast emerge phenomenon ticker take advantage don buy now kick click here trade
527,PAYX,business service sector have perform well compare benchmark index year date sector have gain compare favorably zack composite rally say time frame outlook business service sector be highly dependent health broader economy overall economy be benefit trump administration business friendly approach include tax cut higher spending repeal regulation have improve employment scenario aid manufacturing manufacturing activity robust manufacturing manufacturing business service sector be gain strength be firmly tie manufacturing manufacturing activity manufacturing sector grow consecutive month report pmi june growth be drive increase activity production supplier delivery inventory customer inventory export import order manufacturing industry report growth june additionally manufacturing gauge logged biggest gain last month surpass average pmi level past year far manufacturing sector be concern nmi be june record st consecutive month expansion expansion be drive continue increase business activity new order new export order manufacturing industry report growth june manufacturing gauge also report highest gain past month higher average nmi level past year highest job addition juneper latest datum bureau labor statistic professional business service sector report highest job addition june industry sector add job june past month figure show improvement previous month addition job job year other significant gainer include manufacturing healthcare leisure hospitality education construction retail however lose job overall economy add job june register growth past year monthly job addition revise have averaged past month gdp projection decline annualize pace first quarter gdp be expect register growth second quarter atlanta federal reserve bluechip economist estimate average gdp growth second quarter moreover gdp be expect register growth full year report statista give bullish estimate believe economy be likely rebound come quarters income tax cut increase government spending be expect push annual economic growth target store sector business service sector be expect register earning growth higher revenue second quarter latest earning preview report additionally sector be total zack sector expect register double digit earning growth second quarter total second quarter earning be expect be higher revenue top gainer help zack stock screener have zero promising stock sector have grow june have potential rise further second half year stock have favorable zack rank strong buy buy solid expect earning growth rate current year stock have also witness upward estimate revision last day gain more june see complete list today zack rank stock here let have look top gainer base california korn ferry international kfy free report be world lead largest executive recruitment firm broadest global presence executive recruitment industry currently sport zack rank company expect earning growth rate current year be zack consensus estimate current year improve last day stock rally last month base florida advanced disposal service inc adsw free report be provider hazardous solid waste collection transfer recycling disposal service have zack rank company have expect earning growth rate current year zack consensus estimate current year moved last day stock rally june base maine wex inc wex free report provide payment process business solution wide spectrum sector include fleet travel healthcare have zack rank company have expect earning growth rate current year zack consensus estimate current year moved last day stock rally last month base new york paychex inc payx free report be lead provider payroll human resource employee benefit outsource service small medium size business have zack rank company have expect earning growth rate current year zack consensus estimate current year moved last day stock rally last month more stock news be bigger iphone become mother technological revolution apple sell mere iphone year new breakthrough be expect generate more device just year create market zack have just release special report spotlight fast emerge phenomenon ticker take advantage don buy now kick click here trade
528,PAYX,cinta corporation cta free report lead business service provider be schedule report third quarter fiscal result close bell mar company be likely report higher revenue rental uniform ancillary product segment accounting lion share total revenue due improve demand product turn be likely result higher earning quarter top line expansioncinta record industry lead revenue growth past few quarters continue focus core business new business win deeper penetration exist customer more product service customer retention remain key strength company addition cinta identify additional product service opportunity current future customer expand company portfolio focuse approach steady top line growth be likely benefit company be report quarter well moreover successful integration service inc be likely expand cinta customer profile augment revenue annual revenue approximately service have more customer unite state canada combine company be expect cater more business customer extend product portfolio additional process capacity customer service be also likely improve increase route density zack consensus estimate rental uniform ancillary product segment revenue be peg report year quarter total quarterly revenue be expect be report year earlier period other key factorshowever persistently challenge macroeconomic environment have mostly drive customer perform certain house service instead outsource cinta be expect result loss business addition significant international operation risk fluctuation foreign exchange rate turn be likely impact financial result proven model do not conclusively show cinta be likely beat earning quarter do not possess key component stock need have positive earning esp zack rank strong buy buy hold happen be not case here see zack esp earning esp represent difference most accurate estimate zack consensus estimate be be peg uncover best stock buy sell re report earning esp filter cinta corporation price ep surprise cinta corporation price ep surprise cinta corporation quotezack rank cinta have zack rank increase predictive power esp also need positive esp make reasonably confident earning beat note caution stock zack rank sell rate go earning announcement especially company be see negative estimate revision momentum stock considerhere be company want consider model show have right combination element post earning beat quarter accenture plc acn free report have earning esp zack rank see complete list today zack rank stock here red hat inc rht free report have earning esp zack rank paychex inc payx free report have earning esp zack rank note be reissue article correct mistake original article issue mar longer be rely
529,PAYX,tuesday april week start big sell monday include drop dow midday see value buy clear volatility remain present day market be hard pressed blame anywhere index europe take monday observation easter holiday overnight japan nikkei index fall likely response yesterday red number here home pre market future be hour close day move average yesterday erase nasdaq gain whole thus far fact early trading look dig correction territory today dow nasdaq hold number be contingent wide spectrum news item ve yet see point many analyst be expect merely dead cat bounce meaning period buy back even thought trading cycle remain bearish least term be also week get look new job number adp adp free report private sector report come ahead bell tomorrow big bureau labor statistic bls farm payroll number hit tape friday morning february not have possibly see more goldilock scenario new job only moderate wage increase meaning labor market continue tighten noteworthy spike wage be big contributor overall economic inflation cnbc squawk box morning paychex payx free report ceo martin mucci report small business experience pullback job month march mucci point tight labor market reason small business have have difficulty find enough skilled worker fill job available least firm fewer employee phoenix remain top city wage growth tennessee win top state small business growth overall see report pullback make date expect later week tesla other shoe dropsa expect tesla tsla free report report production delivery last month post new tesla deliver march past week new tesla be produce original guidance week better many tesla bear have be anticipate share electric car leader be nearly today pre market tumble excess monday mark vickerysenior editorquestion comment article author click here medical stock buy nowzack name company poise ride medical breakthrough be target cure leukemia aids muscular dystrophy hemophilia other condition new product field be already generate substantial revenue even more wondrous treatment be pipeline early investor realize exceptional profit click here see stock
