,ticker,content
0,PEP,pepsico pep grapple slumping soda business get boost food operation core pepsi earning be share cent second quarter analyst estimate strong sale frito lay chip quaker cereal fuel gain maker pepsi mountain dew more pepsico rival coca cola ko be look sugary soda drive growth consumer become more health conscious chief executive officer indra nooyi have say fix struggle north american beverage unit be top priority meantime company be get boost food brand pepsico north america beverage division have be pressure consumer taste shift away cola consumption carbonate soft drink fall year low last year accord beverage digest trade publication consumer have moved away sugar laden soda haven make same move away chip pepsico have introduce organic version biggest snack brand addition buy startup competitor baked fruit vegetable snackmaker bare food co get newsletter deliver inbox more info product service privacy policy term useprofit pepsi frito lay north america unit make cheetos doritos be percent quarter revenue latest quarter be slightly ahead estimate pepsi stock rise open tuesday stock market trading also market rally be look strong miss critical element earning hot trump trade war guidance stock market forecast next month expect
1,PEP,blue chip lead advance start gate tuesday oil price surge stock look extend rally fourth day pepsico pep marathon oil mro lead early trade tesla tsla crank early gain news launch manufacturing site china energy name include marathon eog resource eog look overtake buy point oil price tick higher ebay ebay lose ground analyst downgrade dow jone industrial average pop open climb nasdaq fought hold fractional gain heavy early loss biogen biib cerner cern hinder progress update story other market coverage visit stock market today get newsletter deliver inbox more info product service privacy policy term market launch tuesday session several key benchmark nasdaq composite end monday session june high close level dow tuesday start first session day line june level give june europe market rise monday trade firmly higher mid session tuesday top level government cabinet resignation left prime minister theresa struggle piece together support brexit trade strategy european union china hong kong hang seng index dip fraction take breather day advance shanghai composite rise give third straight gain japan tokyo nikkei jump also logging third straight advance oil price be focus today ahead key datum release oil worker begin strike north sea brent crude jump back barrel early action royal dutch shell rdsa announce shutdown oilfield norway coast due striking worker benchmark west texas intermediate rise trading barrel american petroleum institute release weekly oil inventory datum late today energy information administration report weekly oil estimate wednesday marathon oil surge breaking past buy point eog resource gain enough clear cup handle buy point noble energy nbl gain putt less flat base buy point earning news pepsico score early advance report forecast fiscal second quarter earning revenue management hold full year earning forecast consensus view project foreign exchange impact revenue earning be neutral year pepsico share be low be find resistance week move average kb home kbh edge early action susquehanna upgrade stock positive analyst expect los angele base builder report earning advance third quarter result year consensus view project decline earning share company have yet announce report date third quarter result kb share be week support line look turn right side month consolidation tesla climb open trade bloomberg report company plan manufacturing facility china capacity turn luxury electric auto year chief executive elon musk be schedule round meeting shanghai tuesday beij wednesday thursday news report monday say tesla raise price model sell china follow china impose retaliatory trade tariff friday tesla share be fight retake hold support converge week move average ebay trade lower suntrust robinson humphrey downgrade stock hold buy note also lower stock price target report say supreme court recent ruling payment tax internet sale place pressure ebay gross merchandise value growth ebay share have be downtrend fight regain support february get instant access more trading idea exclusive stock list ibd proprietary rating only related big picture sector lead market higherdow future stock market rally be miss key elementmr musk go china boee order pepsi earning investing action planwhy high octane china stock move buy listthese top stock expect earning growth
2,PEP,stock market moved higher early trade tuesday major index look add monday solid gain electric auto maker tesla tsla announce deal open chinese factory lead stock marathon oil mro clear flat base early backed update story other market coverage visit stock market today dow jone industrial average lead stock market action rise moved meanwhile tech heavy nasdaq be just major index look extend streak trading session company report earning pepsico pep hit multimonth high report better expect earning result early tuesday share advanced almost highest level mid march stock be attempt regain long term day move average line tesla continue rise day line advance early tuesday company announce sign deal chinese authority open plant city shanghai factory be able produce car year avoid newly implement chinese tariff import automobile get newsletter deliver inbox more info product service privacy policy term analyst action square sq fall jeffery downgrade payment processor hold share remain well extend double bottom entry early share be time high chipotle grill cmg drop mizuho downgrade burrito maker neutral underperform last week stock find solid support day line biotech biogen biib fall second straight day move lower baird cut stock outperform neutral last friday stock surge alzheimer treatment show positive result stock be cup shape base entry accord marketsmith chart analysis be add handle formation top energy stock marathon oil be breaking flat base buy point stock rise volume be tracking more average stock relative strength line be hit new high bullish technical metric top growth stock viper energy partner vnom regain cup shape base entry stock moved almost downside chinese top stock momo momo fall pace snap day streak share be midst rebound day line get instant access more trading idea exclusive stock list ibd proprietary rating only related top stock be buy range new market strengthmr musk go china boee order pepsi earning investing action planwhy high octane china stock move watch list buy listdow jone industrial average dow stock news top tech stock play beat market recent slide
3,PEP,here be investing action plan tuesday need know investor come day tesla tsla ceo elon musk visit shanghai just day china hit car more tariff boee ba unveil second quarter order pepsico pep report earning elon musk go china tesla
4,PEP,search best stock buy watch look company strong earning growth check earning calendar see report be sure also see latest list stock just add remove ibd top screen build watch list earning season action plan regularly check page preview upcoming quarterly earning report analyst estimate alert top rate stock offer new buy opportunity release latest number ll also find link stock buy zone ahead next earning report scroll more earning season news stock watch view more earning season newsget instant access more trading idea exclusive stock list ibd proprietary rating only related buy stock ahead earning report video build earning season action plannew option strategy limit risk earning
5,PEP,quiet day be due stock market tuesday session row strong gain nasdaq be flat go final hour add blue chip show more life dow jone industrial average advanced small cap russell fall touch time high earlier session volume higher nyse slip nasdaq dow outperformance be somewhat mislead dow be price weight index distort result boee ba unitedhealth group unh be heaviest weighting dow advanced confidently tuesday boee rise unitedhealth gain pepsico pep surge retook day line fast trade day line be reclaim june pepsi earning pop top view revenue come expectation only narrowly so pepsi image be tie namesake soft drink company brand include doritos cheetos frito lay ruffle quaker oat revenue snack segment grow overall revenue growth be only meanwhile chip stock different order do well chip designer marvell technology mrvl gap twice usual volume chipmaker skywork solution swks rise try retake day line alphabet googl tack small gain be track extend streak day row oil stock show breakout action be unsteady example conocophillip cop diamondback energy fang exxon mobil xom marathon oil mro clear buy point then reversed entry seesaw entry light sweet crude climb barrel then reversed crude then re-cover partially rise noise trade war have quiet recent session optimism have even emerge mohamad el erian chief economic advisor financial service company tell cnbc relative term be winning trade war add end day prevail update story other market coverage check ibd market news today related ibd stock daywal mart strike back amazon item reveal much company
6,PEP,hedge fund fled equity first quarter apple aapl pepsico pep most sell stock global market intelligence say report wednesday top hedge fund manage equity holding more fund decrease total number stock position hold fewest stock position hold global market intelligence begin tracking such datum be second consecutive quarter equity sell large fund consumer discretionary information technology stock lead sell apple rank see most selling individual stock last quarter major hedge fund sell worth apple stock other top sell include pepsico amazon com amzn priceline pcln boot alliance wba highest volume buy top hedge fund occur facebook fb stock total buy first quarter say other top buy include broadcom avgo alphabet googl eli lilly lly willi tower watson wltw related growth investor flee apple warren buffett see valuestartup bubble burst valuation due reset analyst say
7,PEP,year teeter totter market have pose special challenge investor manager usaa aggressive growth usaux be exception past year go wednesday fund have outperformed rival large cap growth mutual fund track morningstar inc lose less most fund have gain volatile past month only top peer fund be prime strong performance stock market strengthen quality top holding be indication aggressive growth top holding march include stock ibd composite rating higher highest comp rating be composite rating combine ibd performance rating include ep relative strength rating stock poise move higher often have high comp rating addition holding include adobe system adbe sport comp rating trading adobe be work cup handle base buy point volume have dry handle form be positive ibd leaderboard analysis stock point adobe earlier past handle entry base be successful point view stock be extend still make case right side base need more work adobe have succeed morph company let customer receive product cloud pay subscription fee be adobe buy sell take free trial ibd leaderboard today find outrevenue growth have sped past quarters fiscal second quarter end month wall street currently expect earning rise cent share extend slowdown ep gain prior quarters still vigorous profit growth facebook fb leaderboard stock be top holding have composite rating ep gain be accelerate rise past quarters earning jump cent share easily beat wall street estimate do jump revenue stock respond upbeat result gapping april clear buy point cup handle base get high ease just buy point facebook have gifted investor big return break past buy point double bottom base week end july ibd point recently electronic art ea be top new buy have comp rating video game publisher deliver better expect earning sale growth last week ep rise profit get boost ea grow digital sale make fourth quarter revenue ibd report tuesday also ea have debt last year solid return equity average annual ep growth rate past year have attract rise number fund investor typically better perform fund own share electronic art fidelity otc focpx mfs growth mfegx other holding zimmer biomet holding zbh have comp rating be so far year maker orthopedic dental reconstruction implant trauma product related surgical product have see ep rise past quarters climb span revenue grow past stanzas company beat consensus estimate ep revenue company be born last year merger zimmer holding biomet create global leader musculoskeletal health care do business more country ibd recently report last month zimmer say take cayenne medical strengthen sport medicine offering trading stock be buy point long cup handle base portfolio be run separate subadvisor capital wellington management manage fund side outperformance skews split too much usaa rebalance funnele inflow lag portion also take shareholder redemption larger portion clark patrick burton justin kelly be somewhat more aggressive style say usaa wasif latif oversee subadvisor wellington manager be paul wellington be more conscious valuation latif say subadvisor sleeve share many name have more fang stock say usaa analyst julius barne refer high flyer facebook fb amazon amzn netflix nflx google now alphabet googl jan unitedhealth group unh starbucks sbux be sleeve only go thursday unitedhealth be year have comp rating weak accumulation distribution rating be sign more recent selling buy mutual fund past week starbucks be year have so so comp rating worst possible accumulation distribution rating oracle orcl pepsico pep be name wellington sleeve only oracle be have weak composite rating accumulation distribution rating ep fall past quarters be flat frame pepsi be less composite rating accumulation distribution rating have high growth bullish market do better latif say opposite happen market be not lead growth be challenged wellington sleeve have outperformed so far year latif say
8,PEP,stock be trading moderately higher go noon hour monday oil price stage comeback dip much early trading west texas intermediate crude oil future delivery be cent mere decline conference major producer end agreement limit production goldman sachs maintain forecast advise client buy energy stock consider temporary weakness nasdaq rise dow jone industrial average jump volume be tracking lighter nyse nasdaq exchange compare same time friday toy maker hasbro have gap strong volume break base report earning cent share increase year blow away estimate cent stock be trading nearly higher ibd stock be higher be lower stock market today best performer be universal display oled rise heavy volume hit new high have break base buy point company make organic light emit diode device consumer electronic stock have composite rating company say sale earning be boost strong demand toy related star war force awaken sale doll base disney princess character pepsico pep bubble gain report earning be higher year earlier beating estimate revenue fall stock be just buy point
9,PEP,coca cola ko earning sale fall less fear first quarter sluggish soda other product shipment volume hit share investor hope global giant continue momentum earning share time item world largest soft drink maker fall cent revenue decline wall street be look cent ep revenue beverage volume rise vs second half organic sale growth slow soda volume be flat rise noncarbonated beverage volume rise coca cola share close stock market today plunge day move average investor expectation have be run high especially company decline top bottom line coke stock rise flat base buy point feb climb high april consolidate ibd take do coca cola stock still have fizz do compare rival find ibd stock checkupcoke say number case ship europe fall vs year earlier rise north america latin america growth be flat eurasia africa currency fluctuation result point headwind comparable operate income point headwind ep quarter johnson johnson jnj ibm ibm other multinational coca cola see smaller currency headwind go forward dollar weaken coca cola still see organic currency neutral revenue growth year pepsico pep monday top earning view improve productivity gain lower cost join other package food company manage earning gain weaker revenue pepsi report rise ep cent share top forecast cent revenue decline lighter estimate pepsi fall intraday wednesday dr pepper snapple dps fall intraday dr pepper report quarterly result april
10,PEP,dollar have be not so jolly green giant corporate america mid cut top bottom line growth buck retreat negative impact ibm ibm other multinational fade result even more improvement expect go forward dollar index fall tuesday lowest level last august flash market crash continue downtrend year huge run mid late last year company heavy overseas exposure already be see smaller fx loss raise full year guidance currency trend johnson johnson sale come overseas say lindsey bell senior analyst global market intelligence encourage sign dollar index shot june november make export less competitive reduce dollar value overseas income revenue strong buck also contribute huge sell dollar price commodity crude oil fall much hurt energy company emerge market hurt industrial sector dollar rise large part federal reserve be move raise rate finally do last december other central bank ease policy fed have turn more dovish year sluggish economic growth financial turmoil earlier year fed now indicate just rate hike year previously market see just tighten step perhaps not september meanwhile bank japan european central bank push ahead negative rate policy currency unexpectedly rally move also china yuan re-cover early loss vs dollar dollar index be year year august say robert keiser vice president global market intelligence dollar be now vs year earlier suggest fx impact continue fade even start turn positive weaker dollar also have help crude price rise back barrel mid january slew corporate giant huge international exposure likely report less dollar impact next week so general motor gm alphabet googl report thursday mcdonald mcd general electric ge friday apple aapl facebook fb amazon amzn be tap next week less bad isn quite same good apple be expect post rare sale decline overall earning likely fall sale dip accord analyst poll thomson reuter exclude energy earning be forecast slip revenue
11,PEP,chicago seem be few business realm amazon com amzn hasn become major player now commerce giant be even venture world candy snack company sweet snack expo chicago past week say not necessarily bad thing rise amazon be likely create opportunity challenge food product manufacturer overall be net positive especially benefit niche regional player past month end april amazon rac sale sweet snack sale category climb just past month say mike black global vice president marketing commerce analytic firm profitero consumer count something almost always be available black say amazon be create endless shelf get newsletter deliver inbox more info product service privacy policy term useamazon fulfill third snack product order make site third come third party seller marketplace shopper have be trained think amazon place find enormous selection black say have bring new challenge company make product stand keyword engage content include photo video say today only package grocery sale be do online grow rapidly black say way amazon have help top brand be amazon dash program allow customer instantly reorder favorite product touch button have button doritos lay chip pepsico pep unit frito lay candy bar hsy other amazon endless shelf also be boon regional candy snack brand serve customer have moved longer get product local retail store be tremendous opportunity especially regional company look broaden distribution say christopher gindlesperger vice president public affair communication national confectioner association sponsor sweet snack expo amazon also be boon startup maker niche product be amazing say michael goldstein representative clever cookie hauppauge clever cookie shrewd food brand start selling protein crisps amazon month sale take say be product be healthy high protein be make anything provide nutrient taste good say shrewd food protein crisps come such flavor baked cheddar brick oven pizza have sriracha cheddar smokehouse maple cookies cream company also sell crisps costco cost store northeastern commerce giant also be increasingly competitor private label brand wickedly prime currently sell wickedly prime chip crisps granola nutrition bar snack nut seed also popcorn puff snack seaweed snack snack trail mix still growth commerce sale be ignore re see double digit growth snacking treat say sally lyon wyatt executive vice president practice leader marketing consult firm iri past year online sale popcorn be chocolate candy salty snack be say category see growth include chocolate candy gum dry meat snack related trump personally lobby postmaster hike amazon rate reportamazon stock touch record high obliterate earning viewsamazon stock quote company news chart analysis
12,PEP,dow jone industrial average outperformed midday tuesday blue chip index near level blue chip stock boee ba procter gamble pg chevron cvx be top gainer dow jone be add nasdaq composite picked russell reversed slightly lower touch time high new issue stitch fix sfix re-cover nicely monday reversal surge strength be fuel positive comment cnbc jim cramer monday stock break powerfully friday first stage base coca cola ko be strong gainer dow help nice earning report pepsico pep open stock market result today tesla tsla jump news plan build factory china annual capacity car tesla monday announce price increase china model model sedan leaderboard name marathon oil mro give back early gain clear flat base entry earlier session marathon price action basically follow price crude oil crude oil future be recently trading barrel hit high other stock market news share square sq hold well jeffery downgrade hold buy square have be outstanding performer continue boast strong technical still handle buy point see daily chart solid support level heavy volume gainer include ibd sector leader palo alto network panw security software name add wall street shrug news debt offer also stock just come ibd stock liststhese top stock expect earning growth walmart vs amazon here war be heating
13,PEP,blue chip overcome resistance key line hour trade left monday session stock index be track third straight gain dow jone industrial average climb become last major index cross day line line have be act resistance more week now become support day line often act test area stock index trade line day act test support price be line day act resistance meanwhile rise nasdaq gain small cap russell lag pop volume rise major exchange compare same time friday blue chip dow caterpillar cat jpmorgan chase jpm advanced respectively caterpillar have fall much high mid january decline be blame president trump protectionist stance now have progressed trade war china yet caterpillar be do fine monday afternoon market watcher still regard trump move negotiating tactic rather action conviction so then stock be ready substantial relief rally earning season too hold potential drive stock price higher result jpmorgan be due friday open get newsletter deliver inbox more info product service privacy policy term firm report quarterly result week include pepsico pep tuesday bank ozark ozrk delta air line dal fastenal fast wednesday citigroup well fargo wfc friday personal care product provider helen troy hele gap report result fiscal end adjust earning rise top view accord william neil co datum update story other market coverage check ibd stock market news today get instant access more trading idea exclusive stock list ibd proprietary rating only related obamacare just explode meansthe ipo marijuana stockwhy fail isn always failureibd stock day
14,PEP,rally be moderate tuesday market action show stock continue be remarkably resilient market overcome afternoon dip close higher extend major index streak day second day row dow jone industrial average lead add climb more
15,PEP,here weekly investing action plan need know investor come week earning season start kick jpmorgan chase jpm citigroup well fargo wfc strong earning be expect bank index component generally investor focus continue especially trump trade
16,PEP,peak printing stock system ddd stratasys ssys be soar essentially printing money investor stock have yet recover subsequent slump fellow printing innovator proto lab prlb have be rise have now mold new move system stratasys manufacture
