,ticker,content
869,PEP,monster beverage corporation mnst free report be slate release third quarter financial number nov close bell last report quarter company deliver negative earning surprise however company manage surpass zack consensus estimate last quarters average beat chart depict surprise history monster beverage corporation price ep surprise monster beverage corporation price ep surprise monster beverage corporation quotefactor playmonster beverage have be do well back product innovation play major role company success company net sale grow year year first half banking wide range portfolio energy drink brand have be experience solid demand domestic international market company sale monster energy drink segment accounting almost total net sale increase due grow health awareness consumer be now particularly vigilant use artificial sweetener high sugar content obesity related concern result broader carbonate soft drink csd category have be suffering last few year however energy drink constitute few sub category continue gain momentum therefore portfolio base energy drink drive company top line term again strategic brand segment include various energy drink brand acquire coca cola company ko free report grow more period company strategic deal expand portfolio notable brand increase presence international energy drink market addition have be boost company sale trend be likely continue be report quarter meanwhile company be experience solid growth margin company first well second quarters gross margin benefit raw material cost saving related american fruit flavor acquisition trend be likely continue be report quarter however monster beverage sale profit have be dent significantly unfavorable currency translation dollar have softened other currency impact be still significant distributor termination expense too affect company bottom line company have be transition third party distributor coca cola distribution network follow strategic deal coca cola overall third quarter zack consensus estimate earning be peg cent share reflect increase year year meanwhile zack consensus estimate revenue stand imply year year growth here be quantitative model predict monster beverage do not have right combination key ingredient positive earning esp zack rank hold higher increase odd earning beat uncover best stock buy sell re report earning esp filter zack esp monster beverage have earning esp zack rank monster beverage carry zack rank increase predictive power esp however also need have positive esp be confident earning surprise see complete list today zack rank strong buy stock here peer coca cola company report better expect third quarter result lower sg expense higher gross margin basis point bps higher operate margin bps help come better number however coca cola total sale decrease mark consecutive quarterly decline revenue pepsico inc pep free report report mixed third quarter end sep result earning beating zack consensus estimate revenue miss same nonetheless be sixth consecutive quarter positive earning surprise dr pepper snapple group inc third quarter adjust earning share miss zack consensus estimate earning decrease year year basis owing recent hurricane unite state earthquake mexico previously disclose prepay resin inventory net sale miss zack consensus estimate rise year year zack hide tradeswhile share many recommendation idea public certain move be hide everyone select member portfolio service peek curtain today view start now next month invite follow zack private buy sell real time value momentum stock etf option mover insider trade company be report positive earning surprise ve call accuracy even look portfolio so exclusive be normally close new investor click here zack secret trade
870,PEP,coca cola bottle co consolidated be schedule report third quarter financial number nov large independent bottler coca cola company ko free report have encourage strategy grow organically acquisition additional manufacturing distribution territory first half coca cola bottle report net sale year year primarily acquisition hike comparable net sale rise comparable equivalent unit case volume trend be expect continue third quarter company usually experience higher sale second third quarters year sparkling product portfolio higher margin still product range drive comparable net sale sparkling product comparable volume grow year year still product increase first month be expect continue be report quarter however higher expense such expansion transaction amortization expense dent company bottom line notably stock see dismal trading third quarter stock lose compare industry decline peer releasescoca cola report better expect result third quarter lower sg expense higher gross margin basis point bps higher operate margin bps help company come better number however coca cola total sale drop mark consecutive quarterly decline pepsico inc pep free report report mixed third quarter end sep result earning beating zack consensus estimate revenue miss same nonetheless be sixth consecutive quarter positive earning surprise dr pepper snapple group inc third quarter adjust earning share miss zack consensus estimate earning be year year basis owing recent hurricane unite state earthquake mexico previously disclose prepay resin inventory net sale miss zack consensus estimate rise year year wall street next amazonzack evp kevin matra believe familiar stock have only just begin climb become greatest investment time once generation opportunity invest pure genius click detail
871,PEP,coca cola european partner plc ccep cce free report be set report third quarter result open bell nov last quarter deliver positive earning surprise company surpass zack consensus estimate earning trail quarters average beat chart depict price earning surprise history coca cola european partner plc price ep surprise coca cola european partner plc price ep surprise coca cola european partner plc quoteccep be gain significant synergy merger be expect continue drive growth foreseeable future company continuous focus brand packaging innovation strengthen execution customer service further improve operate effectiveness help drive growth be quite evident last report quarter sale marketing plan well favorable weather drive result revenue increase year year drive inclusion germany iberium iceland comparable fx neutral sale be include better price case volume strong result be drive growth northern european territory belgium luxembourg netherlands growth germany however norway great britain weigh result expect growth momentum continue be report quarter well importantly ccep remain track achieve pre tax synergy saving mid again expect achieve half total target end be likely help ccep boost bottom line considerably give solid performance ccep even raise guidance fx be expect hurt earning overall third quarter zack consensus estimate earning be peg cent reflect year year increase consensus estimate revenue be imply increase here be quantitative model predict ccep do not have right combination ingredient positive earning esp zack rank hold higher be require increase odd earning beat zack esp earning esp ccep be uncover best stock buy sell re report earning esp filter zack rank ccep carry zack rank sell notably caution stock zack rank strong sell go earning announcement especially company be witness negative estimate revision see complete list today zack rank strong buy stock here release coca cola company ko free report report better expect third quarter result lower sg expense higher gross margin basis point bps higher operate margin bps help come better number however coca cola total sale decrease mark consecutive quarterly decline revenue pepsico inc pep free report report mixed third quarter end sep result earning beating zack consensus estimate revenue miss same nonetheless be sixth consecutive quarter positive earning surprise dr pepper snapple group inc third quarter adjust earning share miss zack consensus estimate earning be year year basis owing recent hurricane unite state earthquake mexico previously disclose prepay resin inventory net sale miss zack consensus estimate increase year year wall street next amazonzack evp kevin matra believe familiar stock have only just begin climb become greatest investment time once generation opportunity invest pure genius click detail
872,PEP,earning season be approach end company release result nov earning growth be trend lower comparable period dollar amount total earning be track reach time quarterly high investor employ see approach classic example back fill market benefit cash cow stock garner higher return however single cash rich stock alone do not make solid investment proposition be backed attractive efficiency ratio return equity roe high roe ensure company be reinvest cash high rate return roe roe net income shareholder equityroe help investor distinguish profit generate company profit burner be useful determine financial health company other word financial metric enable investor identify stock diligently deploy cash higher return moreover roe be often used compare profitability company other firm industry higher better measure well company be multiply profit investing new equity capital portray management efficiency reward shareholder attractive risk adjust return parameter used screening stocksin order shortlist stock be cash rich high roe have add cash flow greater roe greater industry primary screening parameter addition have take few other criterium consideration arrive winning strategy price cash flow less industry metric measure much investor pay dollar free cash flow lower ratio indicate investor need pay less better cash flow generate stock return asset roa greater industry metric determine much profit company earn dollar asset include cash account receivable property equipment inventory furniture higher roa better be company year ep historical growth greater industry criterion indicate continue earning momentum have translate solid cash strength zack rank less equal zack rank strong buy buy stock be know outperform irrespective market environment here be stock qualify screen company missouri base be lead global provider agricultural product company have stellar trail quarter average positive earning surprise long term earning growth expectation carry zack rank cbre group inc headquarter los angele cbre group be commercial real estate service investment firm offer wide range service tenant owner lender investor office retail industrial multus family other type commercial real estate major metropolitan area globe company have trail quarter average positive earning surprise long term earning growth expectation cbre group carry zack rank see complete list today zack rank stock here pepsico inc pep free report headquarter purchase ny pepsico be lead global food beverage company premier brand frito lay snack pepsi cola beverage gatorade sport drink tropicana juice quaker food company have zack rank pepsico have trail quarter average positive earning surprise long term earning growth expectation apply material inc amat free report headquarter santa clara apply material offer manufacturing equipment service software semiconductor display related industry worldwide zack rank company have trail quarter average positive earning surprise long term earning growth projection celanese corporation ce free report texas base celanese be global hybrid chemical company diverse product rank first second respective market base market share zack rank company have trail quarter average positive earning surprise long term earning growth projection get rest stock list signing now week free trial research wizard start used screen own trading further also create own strategy test first take investment plunge research wizard be great place begin easy use everything be plain language very intuitive start research wizard trial today next time read economic report open research wizard plug find see gem come click here sign free trial research wizard today disclosure officer director employee zack investment research own have sell short security hold long short position option be mentioned material affiliated investment advisory firm own have sell short security hold long short position option be mentioned material disclosure performance information zack portfolio strategy be available https www zack com performance zack restaurant recommendation inaddition dine special place feast stock share zack special report spotlight recent ipos watch stock offer immediate promise boom sector download free
873,PEP,economy have be rally donald trump election victory trump tax reform be recently sign law increase optimism investor faster pace economic growth prospective pass other policy president however better expect job growth investor be bet faster rate rise inflation cause havoc market such situation investor generally flock traditional defensive investment however investment fail protect investor most recent downturn market correctionper datum release labor department wage grow year year january compare prior month highest pace april introduce fear investor rise rate inflation make comeback move interest rate fed be widely expect hike interest rate multiple time year tame inflation give market be bet fed hike rate more time suggest earlier cme fed watch tool be chance basis point rate hike march read way build rate proof portfolio etfs result enter correction territory decline more record high set january spook investor weigh risk appetite turn make investor reallocate portfolio defensive fund volatility etfs be go investment vehicle time high market uncertainty investment fared well high political uncertainty geopolitical risk bring low volatility play favor low volatility etfs generally include utility staple stock try investor high dividend yield fund invest stock be view bond investor steady business strategy be know protect investor uncertain time reason do not work recent selloff be rise rate expectation be instance powershare low volatility portfolio splv free report have lose so far february high dividend fund be know be negatively correlated rise rate be good play combat market uncertainty however bond yield record high year yield touch appeal bond equity decline instance quality dividend growth fund dgrw free report have lose so far february result be surprise defensive fund fail be positive territory sell cause fear rise rate fed keep raise rate so call defensive investment not be able protect investor wrath correction instance utility select sector spdr fund xlu free report have lose so far february consumer staple select sector spdr fund have lose period let now discuss few etfs focuse provide exposure discuss sector powershare low volatility portfolio splv free report fund be popular etf target large cap company low volatility have aum charge fee basis point year sector look fund have high exposure financial utility industrial allocation respectively fund top holding be honeywell international inc hon free report berkshire hathaway brkb coca cola co ko free report allocation fund have return year have lose year date have zack etf rank hold medium risk outlook quality dividend growth fund dgrw free report fund seek provide exposure large establish company provide high dividend apply quality screen have aum charge fee basis point year sector look fund have high exposure information technology industrial health care allocation respectively fund top holding be exxon mobil xom johnson johnson jnj free report microsoft corporation msft free report allocation respectively fund have return year have lose year date have zack etf rank medium risk outlook consumer staple select sector spdr fund xlp free report fund seek provide exposure staple stock have aum charge low fee basis point year fund top holding be procter gamble pg coca cola co pepsico inc pep free report allocation respectively fund have return year have lose year date xlp have zack etf rank sell medium risk outlook utility select sector spdr fund xlu free report xlu be most popular fund utility space fund have aum be relatively cheaper bet charge fee basis point year have allocation nextera energy nee free report duke energy duk free report dominion energy free report fund have return year have lose year date have zack etf rank medium risk outlook want key etf info deliver straight inbox zack free fund newsletter brief top news analysis well top perform etfs week get free
874,PEP,share shopify shop free report plummet tuesday morning even commerce platform post third quarter earning revenue beat leave many investor focuse bold claim make notable short seller citron research shopify ottawa ontario base commerce platform be gear small mid size business have see share surge more last week tuesday shopify post earning revenue top wall street estimate shopify revenue jump third quarter company report earning adjust stock option expense share fourth quarter company now expect post revenue shopify also project pull full year revenue range mark roughly year year jump solid revenue gain adjust earning beat shopify post third quarter net loss full year company now expect post gaap operate loss shopify recent top line growth have clearly help cloud base business platform company soar still company be lose money overall now be also question legality least portion business short seller share shopify begin dip recently due part push citron research founder andrew left citron left specifically have call shopify get rich quick scheme minute video left highlight shopify practice feel support case company refer same breath herbalife hlf free report long consider pyramid scheme recently entangled own federal trade commission suit note short seller point shopify boast merchant use shopify be business use company platform run commerce even internet connect brick mortar need then concede company also have shopify advanced customer left then point company claim power online store worldwide set simple question be rest user do shopify really make money citron boss then plant seed doubt suggest shopify be profit user sell shopify service person say become millionaire work home go state shopify used have resignation letter outline post make money promotionally blog shopify service be pyramid scheme tag start carry water investor shopify work like buzzfeed visa free report frito lay pep free report canadian tire thenew york time celebrity such drake kanye west now however investor seem worry shopify ceo tobias ltke have not do enough address citron pyramid scheme concern video be release oct ltke do take twitter twtr free report tuesday morning post many entrepreneur benefit platform sec entrepreneur make first sale shopify entrepreneur small company be lead quiet revolution commerce tobi ltke tobi october yet first comment be twitter user ask many customer quickly stop used shopify platform join seem only time tell citron get wish ftc take look believe be unsavory business practice shopify now investor look shy away come commerce company concern valid not be address more completely share shopify tank tuesday morning company post relatively solid quarterly earning wall street next amazonzack evp kevin matra believe familiar stock have only just begin climb become greatest investment time once generation opportunity invest pure genius click detail
875,PEP,stock market seem have defy eerie hallow eve maintain bull run halloween strategy technique investor start place big bet hallow eve restrain precede month give even more optimism right now demand candy costume halloween season drife sale retailer include discount store sale such item be poise beat previous year number courtesy upbeat consumer sentiment finance consumer have largely benefit improve economy lower unemployment better wage spooky stock market ghost goblin fear apprehension concern broader market be unsubstantiated instance have war word north korea kim jong trump scared investor apparently not market continue gain unhindered fear be fed hike rate kill bull market fuel cheap borrow policymaker haven hike rate yet fear rate hike strengthen dollar eventually dent export hamper economic growth finally lofty valuation give goosebump bull market often scale string record high so succumb fear high eventually lose money halloween drife record sale more money expect pour candy sale be expect rise fact halloween account industry total annual sale turn lead fierce competition confectioner accord ihs markit datum candy sale be set rise last year reach seasonally adjust be particularly impressive give candy price have decline last year mark second successive drop halloween candy price halloween be super bowl sunday north america largest chocolate maker co hsy free report banking upbeat sale forecast maker kiss reese krackel symphony mr goodbar expect sale go last year company have see earning grow last year drive share price nearly major player mondelez international inc mdlz free report be expect gain immensely year rise candy sale be successor kraft food inc own household name candy industry nabisco cadbury toblerone have see share price climb year be introduce almost today halloween boost costume discount store salesa large chunk halloween spending go costume well accord survey national retail federation nrf american be expect spend costume survey also show majority consumer shop online costume do so retail store fact nrf spending hallow eve year be more mark rise last year consumer confidence ride upbeat read halloween sale say lot consumer sentiment have be improve strengthen economy economy expand solid seasonally adjust annual rate third quarter accord commerce department such expansion come heel growth second quarter also mark first time consecutive quarters growth more mid economy be boost solid consumer spending steady job market buoy household optimism unemployment rate decline september lowest february wage increase average hour labor department fact last month hourly pay increase prior month also line post recession high read more gdp hit twin hurricane top gainer solid pickshere look publicly trade company aforesaid area be position gain maximum halloween company flaunt zack rank strong buy buy pepsico inc pep free report be global food beverage company be know manufacturing different type candy be top candy producer world stock have zack rank buy zack consensus estimate current year earning rise last day pepsico expect growth rate current next quarters be respectively zumiez inc operate specialty retailer apparel footwear accessory hard good young man woman company currently have zack rank strong buy zack consensus estimate current year earning rise last day zumiez be expect yield return current next quarters respectively see complete list today zack rank stock here canada goose holding inc goos free report design manufacture sell premium outdoor apparel man woman youth child baby canada unite state internationally right now company have zack rank buy zack consensus estimate current year earning climb last day canada goose holding expect growth rate current year be contrast industry project decline big lot inc big free report zack rank company be traditional discount retailer unite state zack consensus estimate big lot have moved north past day estimate rise share share stock expect growth rate current next quarters be respectively wall street next amazonzack evp kevin matra believe familiar stock have only just begin climb become greatest investment time once generation opportunity invest pure genius click detail
876,PEP,share pepsico inc pep free report increase post fourth quarter core earning share beating zack consensus estimate dun bradstreet corporation dnb free report share rise report fourth quarter adjust earning share surpass zack consensus estimate share corporation abc free report advanced report walgreen boot alliance inc wba free report be early stage talk buy remain stake companychegg inc chgg free report share jump post fourth quarter gaap earning share beating zack consensus estimate couple cent
