,ticker,content
152,PEP,facebook also have benefit social hotspot instagram acquire time london game instagram have user now have user open app daily posting rio offer intimate look athlete live quarters late night shenanigan teammate banter viewer win find polish post game interview real athlete olympic village nbc today show host formal sit down final social channel be fan see blossom friendship gymnastic quintet play particularly bff simone bile aly raisman go woman individual final help sista say grandma so anyone need back be crack gotchuuu photo post simone bile simonebile aug pm addition instagram story read video feature inspire snapchat here hour then re go video be lure return user worth nbc olympic have be do part keep millennial fan base striking deal facebook provide social network exclusive content real change pace official air commentary speaking gold medal activity facebook share be still float buy zone breaking flat base entry late july facebook fall stock market today ibd university have pro tip buy stock be greater testament olympic size influence social medium leslie jone live tweeting mega fan official nbc correspondent course game comedian snl castmate new ghostbuster foursome be biggest olympic fan ever unreserved enthusiasm primarily take form post short twitter video sofa clad star spangled outfit american flag least nbc picked viral popularity game related tweet decide fly rio much bleep able commentary probably be rebroadcast nbc tv station vulture have pretty comprehensive round pre rio coverage seem keep best work twitter snapchat anyway
153,PEP,life make kerrileewalsh pic twitter com ck leslie jone lesdoggg august
154,PEP,mutual fandom jone olympic volleyball star kerri walsh jenning be recur theme be impact viewership nbc volleyball telecast remain be see twitter love translate gold volleyball walsh jenning be fan jone pep talk say yahoo sport be queen be so pump grateful so stoke everything do give so much ty https co gfz kerri walsh jenning kerrileewalsh august twitter share be climb back finally make appearance day line last wednesday first time twitter jump monday rumor talk stream deal apple tv then privately hold snapchat olympic newbie wasn really thing last game disappear photo app reportedly only have daily active user early time huge usa today have dub team usa basketball greatest snapchat team time regularly tracking court antic kyrie irve green company example get mural selfie brazilian favela just day carmelo anthony suntrust robinson humphrey say april snapchat user have deeper engagement facebook twitter instagram advertiser start allocate money rise platform ibd take be major winner loser olympic check part series brand olympic medal count coca cola nike mcdonald brand olympic part medal count apple armour visa limit time only nature snapchat content mean user have remain constant connection app miss important happening olympic village fire drill prompt simone bile screech fire alarm go get gold medal quartz save snap save medal simone so basically look internet have win gold medal
155,PEP,food be testing support day move average set potential buy opportunity ahead quarterly earning report test key support line be first food bgs break past buy point cup base april first
156,PEP,market uptrend confirm oct continue look pretty good performance top rate growth stock have be mixed best today dividend leader screen be load consumer staple name look poise break long consolidation have already start other be rev engine share kimberly clark ticker
157,PEP,warn trian fund management run activist investor nelson peltz be urge general electric ge buy back share current expectation represent potential threat financial health wednesday report rating agency revise outlook ge credit rating negative stable mean downgrade be possible
158,PEP,insider nike nke pepsico pep palo alto network panw be make notable trade company share reveal disclosure week apple aapl ceo tim cook sit nike board director have sell share athletic apparel maker disclosure come day nike analyst day
159,PEP,pepsico pep top third quarter expectation raise earning outlook even record charge related change accounting venezuela operation earning dip share estimate cent revenue fall foreign exchange wo weigh result analyst have forecast sale north america beverage volume rise revenue grow category include pepsi gatorade naked juice other drink volume frito lay north america snack segment include cheetos sun chip edge sale grow quaker food north america volume sale rise year date mid single digit organic revenue growth double digit core constant currency ep growth reflect focus manage thing be control challenge environment namely innovation brand build marketplace execution productivity say ceo indra nooyi statement productivity particular continue simultaneously fund investment business contribute margin enhancement remain track deliver year productivity saving target pepsico raise core constant currency share earning growth target prior guidance growth currency headwind be expect weigh core ep company say be track produce productivity saving cash return shareholder share close stock market today coca cola ko dip follow elaine low twitter ibd_elow related consumer etfs usher earning season
160,PEP,forget current banner year new car sale auto part retailer be forge ahead undaunted benefitting host favorable industry trend
161,PEP,cheap gasoline price increase mile drive age fleet car road have help lead player such reilly automotive orly autozone azo advance auto part aap maintain decent growth
162,PEP,ve accomplish even vehicle sale be highest point decade something normally act headwind auto part sector
163,PEP,auto part chain have also largely avoid competition amazon amzn
164,PEP,reilly sector biggest market cap have show particular strength year long streak double digit earning growth extend streak wednesday close logging year year ep gain breeze past consensus view
165,PEP,reilly share touch new high wednesday moved even higher hour autozone share set own new high wednesday advance auto hit new record last week
166,PEP,ibd retail wholesale auto part group also include genuine part gpc lkq lkq other stock rank industry survey
167,PEP,pep boy acquire
168,PEP,group be do so well even member consider be laggard be attract attention
169,PEP,case point monday news auto part supplier bridgestone acquire pep boy manny moe jack pby bridgestone pay share cash premium pep boy oct close price deal be expect close early
170,PEP,bridgestone paid premium even pep boy have underperform most decade company annual revenue have barely budge last year hasn grow annual earning fact pep boy bring such rich buyout offer say lot much auto part retailer be value right now analyst say
171,PEP,certainly signify health strength industry see company pay much pep boy historically have be laggard industry sterne agee crt analyst ali ahmad faghri tell ibd faghri follow several auto part stock include reilly autozone not pep boy
172,PEP,industry strength be result several dynamic analyst say be average age car road record year accord research firm ihs automotive older car require more replacement part maintenance repair work auto part retailer provide
173,PEP,age fleet have also put more vehicle road record accord bloomberg more car lead higher demand auto part service
174,PEP,lower gas price have be boon well consumer pay less gas have incentive drive more increase demand part service
175,PEP,mile drive have be critical growth driver ve see nice uptick morningstar analyst adam fleck tell ibd consumer be increase mile drive increase wear tear car
176,PEP,do fuel retailer
177,PEP,meanwhile grow number consumer be outsource maintenance repair auto part retailer rather do do difm side business have provide additional revenue stream auto part retailer used rely almost exclusively do diy market
178,PEP,continue see growth do market have be major growth driver company fleck say
179,PEP,finally auto part retailer most other retailer have not be hurt amazon other commerce site mainly someone need auto part doesn arrive mail
180,PEP,give focus service speed online retailer amazon haven disrupt auto part retailer faghri say
181,PEP,favorable trend have help offset be normally headwind auto part retailer rise vehicle sale
182,PEP,auto sale climb seasonally adjust annual rate september highest rate more decade
183,PEP,september be particularly strong include full labor day weekend expert expect pace slow october annual rate still be highest great recession
184,PEP,last week auto industry consultant power lmc automotive raise forecast auto sale vehicle
185,PEP,more new car road previously translate less demand replacement part maintenance service previous condition longer prevail
186,PEP,thing different day older car aren be send graveyard just owner be buy new one instead owner be trading old car selling
187,PEP,ve see boom new car sale yet average age car have continue tick fleck say car last longer used so secular shift go still grow need auto part age continue rise big positive forget current banner year new car sale auto part retailer be forge ahead undaunted benefitting host favorable industry trend cheap gasoline price increase mile drive age fleet car road have help lead player such reilly automotive orly autozone azo advance auto part aap maintain decent growth ve accomplish even vehicle sale be highest point decade something normally act headwind auto part sector auto part chain have also largely avoid competition amazon amzn reilly sector biggest market cap have show particular strength year long streak double digit earning growth extend streak wednesday close logging year year ep gain breeze past consensus view reilly share touch new high wednesday moved even higher hour autozone share set own new high wednesday advance auto hit new record last week ibd retail wholesale auto part group also include genuine part gpc lkq lkq other stock rank industry survey pep boy group be do so well even member consider be laggard be attract attention case point monday news auto part supplier bridgestone acquire pep boy manny moe jack pby bridgestone pay share cash premium pep boy oct close price deal be expect close early bridgestone paid premium even pep boy have underperform most decade company annual revenue have barely budge last year hasn grow annual earning fact pep boy bring such rich buyout offer say lot much auto part retailer be value right now analyst say certainly signify health strength industry see company pay much pep boy historically have be laggard industry sterne agee crt analyst ali ahmad faghri tell ibd faghri follow several auto part stock include reilly autozone not pep boy industry strength be result several dynamic analyst say be average age car road record year accord research firm ihs automotive older car require more replacement part maintenance repair work auto part retailer provide age fleet have also put more vehicle road record accord bloomberg more car lead higher demand auto part service lower gas price have be boon well consumer pay less gas have incentive drive more increase demand part service mile drive have be critical growth driver ve see nice uptick morningstar analyst adam fleck tell ibd consumer be increase mile drive increase wear tear car do fuel grow number consumer be outsource maintenance repair auto part retailer rather do do difm side business have provide additional revenue stream auto part retailer used rely almost exclusively do diy market continue see growth do market have be major growth driver company fleck say finally auto part retailer most other retailer have not be hurt amazon other commerce site mainly someone need auto part doesn arrive mail give focus service speed online retailer amazon haven disrupt auto part retailer faghri say favorable trend have help offset be normally headwind auto part retailer rise vehicle sale auto sale climb seasonally adjust annual rate september highest rate more decade september be particularly strong include full labor day weekend expert expect pace slow october annual rate still be highest great recession last week auto industry consultant power lmc automotive raise forecast auto sale vehicle more new car road previously translate less demand replacement part maintenance service previous condition longer prevail thing different day older car aren be send graveyard just owner be buy new one instead owner be trading old car selling ve see boom new car sale yet average age car have continue tick fleck say car last longer used so secular shift go still grow need auto part age continue rise big positive
188,PEP,month american century investment have sponsored big name professional golf tournament instead trumpet mutual fund directly kansa city mo base asset manager advertisement highlight ownership structure benefit nonprofit stower institute medical research simr newly launch prosper purpose ad campaign be aim set fund company apart other not only do have equity fund strong long term performance be only tie so directly benefit society medical research funding simr be name american century founder jim stower jr wife virginia endow medical research organization cash american century stock ownership stake more follow jim battle prostate cancer virginia surgery breast cancer be motivated experience cancer say american century vice president client marketing woody bendle jim stower pass away march age stower founder american century then name twentieth century asset june be largest mutual fund complex firm be only largest mutual fund complex have year date investor inflow net new money year american century enjoy inflow june accord morningstar turnaround come straight calendar year net outflow inflow go mainly target date fund underlie fund such ac alternative market neutral value fund acvqx mid cap value acmvx industrywide target date fund draw steady inflow retirement account saver rupp say alternative value fund offer relatively safe haven market volatility firm inflow defy industrywide trend investor shift money lower cost passively run investment yet american century have etfs do not run index mutual fund fund family popularity year complex stock mutual fund be outperform morningstar category average july most clan top holding be household name most be perform well year date apple aapl have largest weighting be next be exxon mobil xom weighting be third be pepsico pep allocation be top stock have smr rating ibd highest possible grade ibd take strong sale growth profit margin return equity be hallmark many stock market winner ibd smr rating measure trait combine rating read learn more smr rating tell stock buy american century portfolio be build bottom stock time growth value style weighting reflect manager have find stock best opportunity appreciate percent american century asset be value stock vs only growth camp june new step complex have begin expand lineup fund focus alternative help investor manage volatility balance market downturn improve diversification say company spokesman chris doyle overall result american century stock fund averaged gain year june be fifth best largest fund family gain report year morningstar say fund manager turnover shop have decline recent year meanwhile manager investment own fund have increase increase alignment manager self interest shareholder addition manager bonus plan have be change reward longer term performance more american century be solid investment outfit morningstar say most investment team seem sturdier ground company evolution have be positive firm fundholder new leadership initiative bear watch however need performance improvement area
189,PEP,monster beverage mnst be get boost consumer need speed company stock energy product easily fall caffeine high know distinctive tall rip logo monster be help lead energy drink revolution soda other carbonate drink fall favor american consumer many develop market carbonate soft drink volume fall top drop accord beverage marketing corp meanwhile energy drink volume have rise dramatically top double digit increase recent year energy drink have have very strong growth decade now primary reason be be huge demand energy product be well formulate deliver say gary hemphill manage director research beverage marketing monster can come fluid ounce contain serving serve have milligram caffeine vs milligram find typical cup coffee drink often contain other stimulant guarana taurine vitamin consumer gravitate more thing be healthier consumer want variety change pace hemphill say monster decline request interview company offer variety product include low carb version muscle monster energy shake football theme version inspire rob gronkowski energetic new england patriot tight end manage simultaneously maintain fun loving lifestyle still set national football league record monster austria red bull be global leader energy drink market red bull have more market share europe tap eu market monster do monster lead largest energy drink market world volume gallon last year beverage marketing say monster be typically sell twice size red bull same price smaller player energy beverage spectrum include rockstar rip national beverage fizz hour energy shot capital management firm innovation venture monster generally have be highly rate stock well fargo downgrade market perform outperform past monday send stock tumble analyst warn lower expect sale new product fourth quarter share have gain back ground then remain buy range share end trading close friday be fractionally close monday monster be founder name hansen natural switch name monster beverage emphasize focus energy drink first quarter conference call april monster say accord nielsen datum sale energy drink grow sale red bull increase sale pepsico pep amp decrease monster also be make headway overseas see market share gain first quarter slew european nation include germany france denmark belgium hungary ireland netherlands norway poland sweden much monster international growth have come coca cola ko ownership stake company last year monster complete deal move bottle distribution coke bottler sell energy drink asset include hansen soda coke coke sell energy product such burn drink monster open new channel new area get product more storefront say adam fleck director consumer equity research morningstar have be lawsuit continue regulator concern product fleck say company size coke have concern go energy drink instead have choose take minority stake monster get business entirely fleck believe energy drink volume continue grow high single low double digit foreseeable future monster consumer tend skew younger male fleck say monster sponsor extreme sporting event athlete motocross bmx mountain biking surfing snowboard also have athlete development program kid age ibd take monster share be try recover mini selloff tumble wake analyst downgrade past monday remain short new high strongest player nonalcoholic beverage group be national beverage stock checkup be available here addition line java theme product include coffee cream monster energy blend brand be look expand reach past key demographic monster be plan launch product china later year warn first quarter conference call launch be delay regulatory approval finalization distribution agreement monster settle wrongful death lawsuit last year teenager die cardiac problem drink energy drink study have show increase blood pressure drink energy drink make person more susceptible cardiovascular problem world health organization say high caffeine level cause heart palpitation hypertension heart attack extreme case middlebury college vermont have ban sale energy drink campus center disease control prevention say mix energy drink alcohol make person time more likely binge drink monster rely so heavily product fleck say investor need have larger margin safety more diversify beverage company coke rely signature drink bottled water juice health concern be real downside risk monster story say international growth rate remain pretty good slowdown be big risk
190,PEP,investor cheer pepsico pep earning report earlier month investor coca cola ko second quarter report due next week just much july pepsi report earning share better year earlier beating estimate nickel sale be line estimate cause stock break flat
191,PEP,major stock index shift neutral thursday afternoon tesla motor tsla let early gain dissolve small loss meanwhile tesla rival ferrari race have be show most pep automaker stock be cool light decline follow week rally send share nasdaq composite edge higher pull modest gain microsoft msft cisco system csco other mega cap techs fractionally higher dow jone industrial average dip less noon et volume be run modestly lighter vs same time wednesday help lead stock market today upside be oil field service oil exploration mobile home rv mortgage service group crude oil market be quiet west texas intermediate future continue hold psychological barrel level rise tesla rise average volume look snap session lose streak tesla have hold day move average also positive tesla day line recently crossed longer term day move average hint improve price momentum large cap electric vehicle battery play late wednesday tesla report underwhelm sale second quarter yet sale still grow year year biggest jump quarters palo alto calif company lose share seventh quarter row net loss yet ceo elon musk expressed confidence company meet full year production goal wall street be now forecasting return profitability third quarter follow company exhaustive spending ramp model preparation more affordable model sedan due end analyst see profit cent share vs cent loss year earlier quarter sale be see spiking mark second quarter row top line growth acceleration tesla share have be base mode peak july double bottom have form recently long deep consolidation offer early entry point ultra aggressive investor however keep mind stock also face potentially heavy overhead supply price level ferrari meanwhile have be work cup base watch potential upside resistance stock active trading have day average turnover share earlier week italian luxury sport car maker announce gain sale jump unit deliver adjust earning share rise euro cent share accord ferrari news release aug elsewhere april ipo enviva partner eva show bullish action rise more big turnover hoist stock closer top nearly week base pivot point post brexit sell mar look enviva base weekly chart show week end july stock bounce hard lows finished week higher huge volume such action point strong institutional demand necessary ingredient successful breakout enviva be thinly trade small cap alternative energy play market value company wood pellet act raw material substitute coal fire power plant enviva earning share have grow average past quarters year average annual revenue growth be also superb however due cyclical nature power industry quarterly result swing past quarters enviva top line grow fall then rise vs year earlier period respectively
192,PEP,snack beverage giant pepsico pep serve earning surprise tuesday push stock more pepsi clear resistance be approach feb high stock be form cup type base entry stock be member dividend aristocrat index comprise company
193,PEP,exchange operator exchange ice agree monday buy interactive datum corp private equity firm silver lake warburg pincus cash stock deal move give exchange more presence financial datum analytic deal be expect close end year share exchange finished stock
194,PEP,remember old batman tv show remember batman robin be take joker penguin mr freeze mad hatter riddler even king tut do remember show fight word pow boom smack appear bubble tv screen fight be left viewer imagination so lady gentleman be appear be today market
195,PEP,imagination word global weakness china interest rate qe stimulus flash computer screen cause stock jump yesterday send dow nasdaq higher straight day
196,PEP,look last week be example manipulate market trader feel force buy stock cover short bet medium industry celebrate weaker macro datum new evidence economic weakness celebrate yes mean fed ecb boj pboc come rescue again way stock rally yesterday rumor chatter fed have delay raise interest rate even tell appropriate be raise rate october december most recent reading economy global economy appear now force fed qtr
197,PEP,just add notch belt yesterday learn ism service sector report miss analyst expectation be fair be still expansionary mode so many take opportunity accentuate negative then translate positive risk asset
198,PEP,do see treasury sell new gov security month yield first time history so just so understand investor give gov month free loan interest here just take see money investing section today wsj
199,PEP,yield first month bill sale
200,PEP,article point
201,PEP,result reflect diminish expectation financial market federal reserve raise short term rate year end friday disappointing job report
202,PEP,so prospect load punch bowl more kool aid create demand riskier asset send stock commodity higher
203,PEP,technically speaking expect more volatility week ahead enter earning season have see analyst have slash estimate reposition ahead be likely be volatile couple week
204,PEP,last night learn ellen kullman ceo dupont dd be first casualty hurricane season news last night be retire convenient just company slash profit forecast dollar strength global weakness blah blah blah activist investor trian boost stake company cite kullman failure meet target remember trian own ed garden nelson peltz want break company say part be worth more sum whole stock be trading pre market trading
205,PEP,morning pepsico pep announce surprise earning report vs exp be contra expectation be revenue bil vs exp bil be track deliver bil productivity saving thru return bil shareholder year stock be trading pt sh
