,ticker,content
680,PEP,even lambeau main rival papa bear hala applaud packer such great builder league pro football simply wouldn exist do today curly lambeau have clear asset vision long view lead find national football league original franchise green bay packer revolutionize game coach packer title help put league national stage last season green bay packer have win more championship mostly lambeau field so name statue lambeau stand guard front football left hand right arm index finger point way only fitting packer fame stadium bear name earl loui lambeau espn note list greatest coach nfl history series probably wouldn be nfl team green bay lambeau didn just co find franchise help make great more study packer history more remarkable incredible be franchise have survive team historian cliff christl tell ibd lambeau more anyone else have most do shift aheadstuart stott author curly lambeau build green bay packer say curly be drive succeed be able use strength innovate push curly come brand new sport wide open opportunity lot room innovation lambeau be recognize many first coach make forward pass integral part offense next decade expand include intricate route receiver foremost great don hutson lambeau also be credit implement daily practice summer training camp fly road game packer first coach general manager lambeau hold position season start crown tie rival george hala founder coach chicago bear lambeau follow green bay stay season coaching chicago cardinal washington finishing same way packer great vince lombardi redskin total lambeau winning percentage be be elect charter member pro football hall fame pro coaching be first ability handle man get most man lambeau say maybe ability acquire right man then get most technical part football be important still secondary lambeau chicago tribune obituary tony canadeo hall fame career play halfback lambeau say be happy have have chance play curly be master get best individual ballplayer do green bay border miraculous bring small town big league lambeau be strict come ken kranz defensive back lambeau packer tell espn want thing do certain way want be time everything didn want carousing evening charlie mathys run back lambeau tell green bay press gazette decade later be standing practice everybody work work hard lambeau be driver meant business everybody know toed mark architect packer be born wisconsin town lambeau distinguish top athlete green bay east high school be captain football team senior year go attend notre dame make football team coach legendary knute rockne tonsillitis force return home season college lambeau take well pay job shipping clerk indian pack co meat company strike friendship george calhoun cover lambeau high school be sport editor local press gazette decide start semipro football team august lambeau talk boss frank peck donate company money football uniform return naming team business press gazette run article headline indian pack company squad refer team packer story signale begin become green bay packer stott write winninglambeau be team star player backfield packer go play other semipro squad go outscore opponent addition player coach duty packer lambeau coach east high school football team lead record also lambeau get john emmett clair owner acme pack have buy indian pack back packer membership new american professional football association be rename nfl day only packer bear cardinal remain original franchise packer first official league game come oct result victory lambeau direct offense backfield coaching play replace future hall fame quarterback arnie herber lambeau be first pass mind coach nfl pro football hall fame note excellent passer own right curly fly face common practice rule make difficult use forward pass lambeau packer be team main offensive weapon be pass time anywhere field approach vault packer first championship marketerlambeau understood need promotion speak civic event promote team drive ticket sale team lose money receive aid andrew turnbull general manager press gazette next year lambeau get local businessman purchase stock packer today citizen green bay elsewhere still own team nonprofit entity other professional sport team america have such structure stott note pro football hall fame credit lambeau keep pro football alive green bay more other person be responsible existence today packer unique small town franchise stott laud lambeau very personable know recruit winning player gain support other team say christl borrow old cliche lambeau charm bird tree college draft be introduce sell long list great player idea come green bay once arrived lambeau inspire great height competitive fire unbridled enthusiasm artful power persuasion one inspire be hutson green bay sign alabama star set numerous receive record lambeau innovation stand well modern era pro football be catalyst title team clarke hinkle packer hall fame tell stott lambeau believe pep talk inspire go field have jump window excitement even lambeau main rival papa bear hala applaud packer such great builder league pro football simply wouldn exist do today
681,PEP,pepsico pep be go digital soft drink maker be roll high tech soda fountain allow customer come combination drink slake thirst
682,PEP,have ever dream raspberry lemon mountain dew ask press release announce pepsi spire new beverage dispenser
683,PEP,ceo indra nooyi say pepsi have hear restaurant operator previous fountain be too slow expensive require too much worker training so spire resemble big iphone touchscreen seek fix
684,PEP,portfolio version spire be show last week national restaurant association show chicago move indicate pepsi be try play digital leapfrog rival coca cola ko launch coke freestyle
685,PEP,pepsico sell not only soft drink also frito lay snack gatorade quaker oat tropicana fruit juice
686,PEP,pepsi stock be very time high company most recent quarterly earning report ep be analyst be forecasting decline next report sale have be run generally flat past several quarters
687,PEP,company return equity be healthy pretax margin be run clip
688,PEP,company earning stability factor be scale low number correspond steady growth
689,PEP,pepsi be package food industry group stand last week stock trading least share score rs rating higher good sign pepsi rs be mediocre
690,PEP,pepsi pay quarterly dividend cent share work dividend yield dividend be declare be paid june shareholder record june pepsico pep be go digital soft drink maker be roll high tech soda fountain allow customer come combination drink slake thirst have ever dream raspberry lemon mountain dew ask press release announce pepsi spire new beverage dispenser ceo indra nooyi say pepsi have hear restaurant operator previous fountain be too slow expensive require too much worker training so spire resemble big iphone touchscreen seek fix portfolio version spire be show last week national restaurant association show chicago move indicate pepsi be try play digital leapfrog rival coca cola ko launch coke freestyle pepsico sell not only soft drink also frito lay snack gatorade quaker oat tropicana fruit juice pepsi stock be very time high company most recent quarterly earning report ep be analyst be forecasting decline next report sale have be run generally flat past several quarters company return equity be healthy pretax margin be run clip company earning stability factor be scale low number correspond steady growth pepsi be package food industry group stand last week stock trading least share score rs rating higher good sign pepsi rs be mediocre pepsi pay quarterly dividend cent share work dividend yield dividend be declare be paid june shareholder record june
691,PEP,sodastream soda rebound thursday speculation pepsico pep reach deal home soft drink maker green mountain coffee roaster gmcr stunned industry late wednesday announce deal coca cola ko develop cold beverage machine deutsche bank bill schmitz believe be small possibility pepsico form similar partnership sodastream
692,PEP,share dupont dd jump wednesday nelson peltz trian fund urge company breakup chemical agricultural product giant defend strategy dupont rise early afternoon trading stock market today stock hit year high june activist investor peltz trian partner call dupont inefficient
693,PEP,sodastream soda be fizz again rumor sale home carbonate beverage maker be reportedly talk british hedge fund accord israeli paper
694,PEP,sodastream be sell share accord source cite themarker
695,PEP,share jump stock market today
696,PEP,isn first time sodastream be reportedly talk buyer july bloomberg report sodastream be talk investment firm deal value company share report also say several private equity fund have be eyee company leverage buyout
697,PEP,earlier year starbucks sbux reportedly be consider buy stake sodastream
698,PEP,company continue attract interest grow demand healthier custom make drink cash strap consumer still open wallet small splurge beverage
699,PEP,sodastream need partner face increase competition coca cola ko keurig green mountain gmcr have team design home soda maker
700,PEP,pepsico pep also joined home soda war investing european base bevyz keurig company launch home beverage maker march
701,PEP,sodastream go public november share peaked competition increase
702,PEP,follow gillian rich twitter ibd_grich sodastream soda be fizz again rumor sale home carbonate beverage maker be reportedly talk british hedge fund accord israeli paper sodastream be sell share accord source cite themarker share jump stock market today isn first time sodastream be reportedly talk buyer july bloomberg report sodastream be talk investment firm deal value company share report also say several private equity fund have be eyee company leverage buyoutearlier year starbucks sbux reportedly be consider buy stake sodastream company continue attract interest grow demand healthier custom make drink cash strap consumer still open wallet small splurge beverage sodastream need partner face increase competition coca cola ko keurig green mountain gmcr have team design home soda maker pepsico pep also joined home soda war investing european base bevyz keurig company launch home beverage maker march sodastream go public november share peaked competition increase follow gillian rich twitter ibd_grich
703,PEP,something revolutionary be brewing philadelphia back small drugstore year old pharmacist name charle hire be tinker herb root berry yeast add sugar mix come recipe classic american soft drink hire root beer hire didn invent root beer be
704,PEP,earning report close wednesday be mixed google googl ibm ibm share slide
705,PEP,google share tumble extend trading first quarter profit miss expectation company be struggle weakness advertising price
706,PEP,stock seem have bottom past couple week try form new base accumulation distribution have weaken worst possible
707,PEP,dow component also be earning report
708,PEP,ibm be hour follow first quarter report miss revenue expectation sale fall profit fall share line estimate
709,PEP,ibm share have be recover yearlong correction
710,PEP,american express axp top profit expectation ep revenue lag estimate share have be try rebound be modestly extend trading
711,PEP,stock market today close higher rally attempt continue
712,PEP,nasdaq climb dow jone industrial average volume fall accord preliminary figure
713,PEP,thursday earning report be expect pepsico pep morgan stanley ms unitedhealth group unh schlumberger slb chipotle grill cmg
714,PEP,weekly jobless claim report philadelphia fed report region manufacturing be due thursday morning earning report close wednesday be mixed google googl ibm ibm share slide google share tumble extend trading first quarter profit miss expectation company be struggle weakness advertising price stock seem have bottom past couple week try form new base accumulation distribution have weaken worst possible dow component also be earning report ibm be hour follow first quarter report miss revenue expectation sale fall profit fall share line estimate ibm share have be recover yearlong correction american express axp top profit expectation ep revenue lag estimate share have be try rebound be modestly extend trading stock market today close higher rally attempt continue nasdaq climb dow jone industrial average volume fall accord preliminary figure thursday earning report be expect pepsico pep morgan stanley ms unitedhealth group unh schlumberger slb chipotle grill cmg weekly jobless claim report philadelphia fed report region manufacturing be due thursday morning
715,PEP,war terrorism deadly disease slow economy asia be bad news wouldn know analyst look business expect post solid third quarter earning revenue growth earning season rev next week report big bank jpmorgan chase jpm well fargo wfc bank america bac company be
716,PEP,sir galahad have famous quest holy grail just ardently many today investor especially retiree seek income
717,PEP,main hurdle be interest rate still stick
718,PEP,high yield bond be solution carry lot default risk many adviser prefer stock high dividend low credit risk
719,PEP,carl szasz president verde capital management clarkston mich like realty income real estate investment trust reit engage triple net lease
720,PEP,act financing company szasz say tenant pay taxe maintenance let reit focus business find additional property
721,PEP,stock get hammer last year federal reserve begin discuss taper bond buy share fall mid high now trading szasz like stock fundamental be strong balance sheet be clean say
722,PEP,dividend yield be pay monthly nice anyone need regular income szasz say record boost dividend year be longest streak raise dividend add
723,PEP,realty income have be appear ibd reit leader screen daily income investor page page monday edition
724,PEP,szasz also like amerigas partner apu master limit partnership be retail propane distributor yield
725,PEP,amerigas be far largest operator fragmented market szasz say customer be mainly rural area cost extend natural gas infrastructure be often prohibitive
726,PEP,high price
727,PEP,nationwide propane usage be decline year price have never be higher szasz say past decade amerigas have rise average annual vs trading szasz fair value buy dividend not growth say
728,PEP,jill cuniff president edge asset management seattle like are capital arcc business development company bdc reit bdcs pay little corporate income tax pass almost taxable income investor dividend
729,PEP,are yield give financing company many industry ve get diversify portfolio good asset growth good credit performance cuniff say
730,PEP,weak ibd composite rating reflect are price volatility year average annual return be vs
731,PEP,hercule technology growth capital htgc be bdc yield be provide financing technology life science company
732,PEP,stock have trend lower july bdcs get delete many index year re think long term cuniff say
733,PEP,andrew goodman chief investment officer cic wealth gaithersburg md like pepsico pep yield barely year treasury low rate environment prefer piece great company potential lot growth vs year treasury opportunity growth
734,PEP,kimberly foss president empyrion wealth management roseville calif like dividend trading foss dip low add position call quality company industry significant long term growth sir galahad have famous quest holy grail just ardently many today investor especially retiree seek income main hurdle be interest rate still stick high yield bond be solution carry lot default risk many adviser prefer stock high dividend low credit risk carl szasz president verde capital management clarkston mich like realty income real estate investment trust reit engage triple net lease act financing company szasz say tenant pay taxe maintenance let reit focus business find additional property stock get hammer last year federal reserve begin discuss taper bond buy share fall mid high now trading szasz like stock fundamental be strong balance sheet be clean say dividend yield be pay monthly nice anyone need regular income szasz say record boost dividend year be longest streak raise dividend add realty income have be appear ibd reit leader screen daily income investor page page monday edition szasz also like amerigas partner apu master limit partnership be retail propane distributor yield amerigas be far largest operator fragmented market szasz say customer be mainly rural area cost extend natural gas infrastructure be often prohibitive high propane usage be decline year price have never be higher szasz say past decade amerigas have rise average annual vs trading szasz fair value buy dividend not growth say jill cuniff president edge asset management seattle like are capital arcc business development company bdc reit bdcs pay little corporate income tax pass almost taxable income investor dividend are yield give financing company many industry ve get diversify portfolio good asset growth good credit performance cuniff say weak ibd composite rating reflect are price volatility year average annual return be vs hercule technology growth capital htgc be bdc yield be provide financing technology life science company stock have trend lower july bdcs get delete many index year re think long term cuniff say andrew goodman chief investment officer cic wealth gaithersburg md like pepsico pep yield barely year treasury low rate environment prefer piece great company potential lot growth vs year treasury opportunity growth kimberly foss president empyrion wealth management roseville calif like dividend trading foss dip low add position call quality company industry significant long term growth
735,PEP,sodastream soda buyout rumor continue sabmiller diageo private equity firm kkr show interest home beverage maker accord report brewer sabmiller be try fend possible takeover anheuser busch inbev bud have eye sodastream accord independent earlier week heineken turn sabmiller buyout offer
736,PEP,pepsico pep get stock price target boost ub expectation beverage snack maker continue report earning beat expectation addition trian partner interest company
737,PEP,early afternoon share company have rise stock market today monday
738,PEP,simply put come first half now have increase conviction pep be operate newfound welcome sense urgency have further confidence better expect result continue say ub analyst stephen power research note add frito lay north america business be perform well global beverage segment be hold own competitor such coca cola ko
739,PEP,more importantly overall pep result seem imply pep be push harder realize margin improvement productivity north american beverage nab international snack be critically need improve pep overall earning algorithm say
740,PEP,pepsico report fizzy estimate top earning company boost full year earning guidance hike follow earning rise share revenue increase
741,PEP,trian partner nelson peltz have say push proxy fight encourage reorganization company business
742,PEP,power say trian have meet investor year
743,PEP,discussion many investor support trian position plan seem relatively high say power add pre trian pepsico trail coca cola rival pepsico have outperformed trian get involved early
744,PEP,related
745,PEP,pepsico dividend keep grow pepsico pep get stock price target boost ub expectation beverage snack maker continue report earning beat expectation addition trian partner interest company early afternoon share company have rise stock market today monday simply put come first half now have increase conviction pep be operate newfound welcome sense urgency have further confidence better expect result continue say ub analyst stephen power research note add frito lay north america business be perform well global beverage segment be hold own competitor such coca cola ko more importantly overall pep result seem imply pep be push harder realize margin improvement productivity north american beverage nab international snack be critically need improve pep overall earning algorithm say pepsico report fizzy estimate top earning company boost full year earning guidance hike follow earning rise share revenue increase trian partner nelson peltz have say push proxy fight encourage reorganization company business power say trian have meet investor year discussion many investor support trian position plan seem relatively high say power add pre trian pepsico trail coca cola rival pepsico have outperformed trian get involved early related pepsico dividend keep grow
746,PEP,keurig green mountain gmcr be get honest customer company wednesday deepen deal coca cola add variety coke honest tea cup hot brewing machine
747,PEP,coca cola ko just green just black honest tea brand organic iced tea be available purchase keurig site north america start thursday
748,PEP,begin collaborate coca cola company development brand keurig cold system opportunity incorporate certain coca cola brand honest tea brew ice selection keurig hot brewing system become exciting possibility say mark wood senior vp global hot system keurig
749,PEP,cup be first coke product use keurig hot brewing system tea be design be brew hot then pour ice
750,PEP,keurig also have tea option unilever ul lipton dr pepper snapple dps
751,PEP,keurig share edge stock market today coke share be cent
752,PEP,february coke inked year agreement keurig help market keurig cold beverage maker buy stake company coke then up holding
753,PEP,deal lead analyst speculate pepsico pep make similar deal home carbonate beverage maker sodastream soda heating cola war
754,PEP,soda consumption america have fall past decade consumer become more health conscious want healthier customizable beverage
755,PEP,beverage alcoholic group be rank industry group ibd track
756,PEP,follow gillian rich twitter ibd_grich keurig green mountain gmcr be get honest customer company wednesday deepen deal coca cola add variety coke honest tea cup hot brewing machine coca cola ko just green just black honest tea brand organic iced tea be available purchase keurig site north america start thursday begin collaborate coca cola company development brand keurig cold system opportunity incorporate certain coca cola brand honest tea brew ice selection keurig hot brewing system become exciting possibility say mark wood senior vp global hot system keurig cup be first coke product use keurig hot brewing system tea be design be brew hot then pour ice keurig also have tea option unilever ul lipton dr pepper snapple dps keurig share edge stock market today coke share be cent february coke inked year agreement keurig help market keurig cold beverage maker buy stake company coke then up holding deal lead analyst speculate pepsico pep make similar deal home carbonate beverage maker sodastream soda heating cola war soda consumption america have fall past decade consumer become more health conscious want healthier customizable beverage beverage alcoholic group be rank industry group ibd track follow gillian rich twitter ibd_grich
757,PEP,past year pepsico pep have basically triple sale emerge develop market surprise then company continue target area growth earlier month company announce big expansion india plan spend build presence fast grow market money
758,PEP,walk buffalo wild wing bwld location easy see stock be more debut november flat screen tvs be everywhere patron watch favorite sporting event drink flow steady stream waiter exit kitchen plate full wing restaurant business be tough
759,PEP,investor learn amira nature food ltd anfi serve savory fourth quarter report package indian specialty rice provider post financial result monday close amira have see sale earning rise double digit better quarter october ipo follower be money amira keep track
760,PEP,synchrony financial syf debut largest ipo year raise fail make big splash wall street private label credit card provider begin trading new york stock exchange thursday low end expect range share rise fall early afternoon
761,PEP,be too pick widening obama administration pattern here mismanagement incompetence accountability completely waste taxpayer money yet government audit wednesday
762,PEP,dissect last fall obamacare roll debacle everyone
763,PEP,obama claim know instantly oct
764,PEP,half dollar collapse year development
765,PEP,month new report nonpartisan general accounting office blame systemic problem such poor plan lack follow ineffective oversight chaotic coordination expense alone stand be last march cost close dollar house energy commerce committee chair fred upton say even day system be not fully build godaddy com have do much less
