,ticker,content
222,PKI,perkinelmer inc pki free report report third quarter adjust earning cent share beating zack consensus estimate cent company base waltham report adjust revenue approximately beat zack consensus estimate revenue also surpass year figure segment detailsrevenue discovery analytical solution da totale third quarter year quarter meanwhile operate profit margin percentage revenue be compare prior year quarter level diagnostic segment revenue be compare year quarter reflect increase organically meanwhile operate profit margin segment percentage revenue be compare year quarter perkinelmer inc price consensus ep surprise perkinelmer inc price consensus ep surprise perkinelmer inc quote margin detailsadjust gross margin percentage revenue be quarter basis point bps year year deterioration be result acquisition divestiture execute adjust selling general administrative sg expense percentage revenue be bps year quarter research development expense percentage revenue rise bps third quarter result company overall adjust operate margin continue operation be net revenue bps year year basis financial detailsin first month perkinelmer operate cash flow continue operation be company conclude quarter approximately debt cash guidance company revise adjust earning guidance full year perkinelmer now expect adjust earning share band compare previous range zack rank key have zack rank hold few better rank stock broader medical sector be petm express inc pet free report luminex corporation lmnx free report intuitive surgical inc isrg free report notably petm luminex sport zack rank strong buy intuitive surgical carry zack rank buy see complete list today zack rank stock here petm report second quarter fiscal earning cent cent year quarter gross margin expand bps year year luminex report third quarter adjust earning cent year year company revenue quarter increase almost year year intuitive surgical post third quarter adjust earning year year basis revenue increase year year look stock skyrocket upside zack have just release special report boom investment opportunity legal marijuana ignited new referendum legislation industry be expect blast already robust early investor stand make kill have be ready act know just look see pot trade re target
223,PKI,perkinelmer inc pki free report be expect release third quarter result nov close bell last quarter company register adjust earning cent share line zack consensus estimate furthermore adjust revenue approximately lag zack consensus estimate perkinelmer decision restructure discovery analytical solution da diagnostic segment hold promise third quarter furthermore company divestiture medical imaging segment last quarter be expect impact earning season let take look thing be shape prior third quarter earning announcement perkinelmer inc price consensus perkinelmer inc price consensus perkinelmer inc quotefactor considerview upbeat zack consensus estimate perkinelmer third quarter earning stand cent share signify year year growth revenue consensus estimate stand year year third quarter perkinelmer project revenue range represent organic revenue growth approximately third quarter adjust earning share be expect range cent cent solid global foothold perkinelmer have be develop biochemical molecular testing menu meet need pharmaceutical company serve market china india last quarter company win newborn screening tender russia mexico add strong demand china laboratory business launch last year be expect yield solid result quarter be report perkinelmer also acquire goa india base tulip diagnostic private ltd undisclosed amount tulip be acquire early january be bullish buyout help perkinelmer tap opportunity emerge market diagnostic takeover be also likely strengthen perkinelmer foothold infectious disease testing space foreign exchange volatility increase exposure international market increase risk foreign exchange volatility foreign exchange pose headwind approximately top line last quarter fluctuation currency exchange rate adversely impact company international sale due sluggish european economy revenue earning be likely be affected adversely season quantitative model do not conclusively show earning beat perkinelmer quarter be stock need have positive earning esp zack rank strong buy buy hold be able beat estimate be not case here see zack esp earning esp perkinelmer be uncover best stock buy sell re report earning esp filter zack rank perkinelmer carry zack rank favorable zack rank increase predictive power esp company negative esp make surprise prediction difficult here be few medical stock worth consider have right combination element post earning beat quarter inc research holding inc have earning esp zack rank see complete list today zack rank stock here penumbra inc pen free report have earning esp zack rank henry schein inc hsic free report have earning esp zack rank more stock news be bigger iphone become mother technological revolution apple sell mere iphone year new breakthrough be expect generate more device just year create market zack have just release special report spotlight fast emerge phenomenon ticker take advantage don buy now kick click here trade
224,PKI,water corporation free report have brilliant earning beat streak span quarters positive earning surprise company break line earning quarters last year second quarter water corp continue impressive streak company adjust earning share trump zack consensus estimate bottom line figure fared even better year year comparison reflect striking growth prior year quarter tally remarkable broad base top line expansion spectacular growth asia aid earning beat solid operational execution backed company efficient business model also lend strength result further decline interest expense aid quarterly profit headlinesin report quarter water corp net sale grow year year also come ahead zack consensus estimate upside top line come back robust performance industrial end market constant currency basis bio pharmaceutical end market constant currency basis momentum be further aid growth constant currency basis government academic market also impressive contribution sale key product major geography supplement quarterly sale growth addition water corp recur revenue instrument system sale grow respectively drive top line growth term geography water corp witness strong sale asia europe post growth respectively constant currency however sale americas continue reflect weakness decline year year total selling administrative expense quarter come incur second quarter research development outlay quarter be compare incur year rise expense operate income quarter climb year year water corporation price consensus ep surprise water corporation price consensus ep surprise water corporation corp cash cash equivalent investment quarter end amount just higher record dec company total liability quarter end increase dec takewater corp lead position high performance liquid chromatography mass spectrometry market be key strength have act strong revenue driver past few quarters company bright pharmaceutical business start healthy note look set continue momentum go ahead be also see encourage trend industrial business governmental academic market have also turn performance look poise maintain growth trend come quarters water corp exposure pharma biotech industry be primarily regulate commercial lab environment demand be discretionary not prone cyclicality help company mitigate uncertain client spending stem macroeconomic volatility additionally give fact liquid chromatography be used huge variety application water corp be well poise benefit significantly business move ahead zack rank other stock considerwater corp currently hold zack rank buy other similarly rank stock same space include bruker corporation brkr free report mettler toledo international inc mtd free report perkinelmer inc pki free report see complete list today zack rank strong buy stock here bruker corporation generate huge beat trail quarters average positive surprise mettler toledo have striking earning surprise history last quarters have beaten estimate average beat perkinelmer also have decent earning surprise history average beat trail quarters beating estimate thrice more stock news tech opportunity worth driverless car artificial intelligence ve see unsurpassed growth high tech product recent month yesterday science fiction be become today reality innovation be single component tech company survive demand critical device reach year alone likely grow even faster future zack have release brand new special report help take advantage exciting investment opportunity most importantly reveal stock massive profit potential see stock now
225,PKI,amedisys inc am free report report adjust earning share ep continue operation cent fourth quarter year year however earning miss zack consensus estimate cent full year adjust ep come miss zack consensus estimate however figure improve year number fourth quarter net service revenue gross year year top line also beat zack consensus estimate net revenue totale line zack consensus estimate figure improve year number quarter company home health division net service revenue totale fourth quarter reflect improvement year year medicare revenue rise year year medicare revenue improve year year hospice division net service revenue gross year year include medicare revenue medicare revenue recently company integrate additional operate segment business personal care corporate personal care net service revenue totale reflect increase year number meanwhile corporate segment do not register revenue end fourth quarter company gross margin contract basis point bps fourth quarter increase gross profit expense salary benefit rise other expense drop adjust operate income report quarter reflect increase year adjust operate margin expand bps year figure amedisys exit cash cash equivalent compare end company long term obligation exclude current portion be net cash provide operate activity be compare year period takeamedisys end fourth quarter mixed note home health hospice division company witness encourage growth medicare medicare revenue amedisys be currently explore opportunity segment be also upbeat company solid performance recently launch personal care segment favorable demographic trend strategic acquisition bode well company however escalate operate expense decline gross margin continue raise concern also intense competitive landscape regulatory concern continue challenge home health hospice industry peer performancesome medical stock report solid result earning season be petm express pet free report perkinelmer pki free report becton dickinson company bdx free report petm report third quarter fiscal result adjust ep cent be prior year quarter revenue rise perkinelmer report fourth quarter adjust ep cent adjust revenue be approximately year quarter becton dickinson report first quarter adjust ep constant currency revenue totale constant currency hottest tech mega trend year generate global revenue predict blast roof fame investor mark cuban say produce world first trillionaire still leave plenty money regular investor make right trade early see zack best stock play trend
226,PKI,mar issue update research report abaxis inc abax free report company have be witness strength veterinary business base encourage consumable segment growth however rise expense bleak gross operate margin scenario have be raise concern stock carry zack rank hold manufacturer portable medical human veterinary animal blood analysis system provide clinician rapid blood constituent measurement medical veterinarian market globally have outperformed industry past month stock have gain compare industry be upbeat abaxis double digit consumable growth veterinary business consumable product line total rotor revenue grow double digit apart other veterinary consumable include hematology reagent rapid assay stat cartridge coagulation cartridge urine analysis strip drive veterinary consumable revenue moreover abaxis have be emphasize product innovation research development regard january company receive approval usda center veterinary biologic vetscan flex rapid test solid global sale piccolo instrument be encourage management healthcare delivery consolidate unite state group network healthcare conglomerate abaxis piccolo be position capture lion share diagnostic test market meanwhile escalate operate expense have be exert pressure bottom line moreover abaxis face intense competition medical veterinary market regard company compete firm have substantially greater resource front financial research development operation marketing key picksa few better rank stock broader medical sector be bio rad laboratory bio free report petm express pet free report perkinelmer pki free report bio rad laboratory sport zack rank strong buy see complete list today zack rank stock here company have long term expect earning growth rate petm have long term expect earning growth rate boast zack rank perkinelmer have long term expect earning growth rate stock carry zack rank buy wall street next amazonzack evp kevin matra believe familiar stock have only just begin climb become greatest investment time once generation opportunity invest pure genius click detail
227,PKI,mar issue update research report integra lifescience holding corporation iart free report stock carry zack rank hold integra lifescience exit fourth quarter solid note strong year year increase revenue back company recently acquire business johnson johnson codman neurosurgery business derma science buoy optimism however tough competitive landscape add company wo past year integra lifescience have outperformed industry stock have gain compare decline industry come quarterly result integra lifescience see organic growth codman specialty surgical css segment fourth quarter report revenue quarter grow back revenue codman neurosurgery be attribute sequential double digit growth register tissue ablation business owing strong capital sale newly launch cusa clarity apart dural repair business perform well year year organic growth strength duragen duraseal product line be also encourage note segment see year year revenue growth period nonetheless believe company be try execute growth plan efficient management team moreover rise year year investment research development be encourage also company promising guidance instill investor confidence stock however integra lifescience face intense competition surgical implant medical instrument market company need be innovative product front fend competition moreover consolidation industry lead intense pricing pressure also significant margin contraction cause escalate cost expense raise concern further company generate significant revenue international business increase vulnerability adverse currency movement key picksa few better rank stock broader medical sector be perkinelmer pki free report bio rad laboratory bio free report athenahealth inc athn free report bio rad laboratory sport zack rank strong buy see complete list today zack rank stock here company have long term expect earning growth rate perkinelmer have long term expect earning growth rate stock carry zack rank athenahealth be zack rank player company have long term expect earning growth rate wall street next amazonzack evp kevin matra believe familiar stock have only just begin climb become greatest investment time once generation opportunity invest pure genius click detail
228,PKI,teleflex incorporate tfx free report share lose close announce earning result mar company report adjust earning share fourth quarter beating zack consensus estimate earning improve year figure revenue detailadjust revenue fourth quarter increase year year constant exchange rate cer miss zack consensus estimate owing temporary softness segmental basis vascular north america revenue increase cer year year fourth quarter teleflex incorporate price consensus ep surprise teleflex incorporate price consensus ep surprise teleflex incorporate quote interventional north america revenue increase fourth quarter year quarter cer anesthesia north america revenue be year quarter cer surgical north america revenue fourth quarter be year quarter cer emea revenue increase year quarter fall cer asia revenue rise quarter year quarter cer oem revenue climb year quarter decline cer other revenue increase cer quarter review operational updateteleflex gross profit report quarter increase year year gross margin expand basis point bps sg expense fourth quarter rise year year research development expense rise year year operate expense totale fourth quarter year year adjust operate margin quarter be bps year quarter financial updateteleflex exit cash cash equivalent compare end glancefull year adjust earning come compare year figure reflect increase full year adjust revenue come year period teleflex expect adjust revenue growth cer band company also expect adjust earning share band zack consensus estimate full year earning share be peg company guide range zack consensus estimate full year revenue stand taketeleflex exitedfourth quarter mixed note be encourage note company be work product innovation however contraction operate margin be discourage also tough competitive landscape act dampener zack rank key picksteleflex have zack rank hold few better rank stock report solid result earning season be petm express pet free report perkinelmer pki free report resm rmd free report petm sport zack rank strong buy perkinelmer resm carry zack rank buy see complete list today zack rank stock here petm report third quarter fiscal result adjust earning share be cent prior year quarter revenue rise year year basis perkinelmer report fourth quarter adjust earning share cent adjust revenue be approximately year quarter resm post second quarter fiscal adjust earning share prior year quarter revenue report quarter increase year year constant exchange rate cer wall street next amazonzack evp kevin matra believe familiar stock have only just begin climb become greatest investment time once generation opportunity invest pure genius click detail
229,PKI,bio rad laboratory inc bio free report report fourth quarter earning share year loss cent thus make huge improvement zack consensus estimate be peg earning share notably net income quarter be favorably impact substantial benefit tax cut job act net sale come year year constant exchange rate cer top line closely beat zack consensus estimate year year rise sale be largely drive strong sale life science product include continue sturdy sale droplet digital pcr instrument consumable cell biology product quarter detailon segmental basis life science net sale come year year cer also sale droplet digital pcr ddpcr cell biology product line process medium rise back strong performance cer geographically north america europe asia pacific demonstrated sturdy flourish bio rad laboratory inc price consensus ep surprise bio rad laboratory inc price consensus ep surprise bio rad laboratory inc quote clinical diagnostic company register sale year year cer upside result increase blood typing immunology diabetes quality control product line gross margin report quarter contract basis point bps year year climb gross profit adjust operate margin however expand basis point surge adjust operate profit company exit year cash cash equivalent short term investment compare end full year net cash provide operate activity be compare year guidance bio rad expect currency neutral revenue growth approximately outlook anticipate continue strong sale life science segment increase growth diagnostic zack consensus estimate be peg operate margin constant exchange rate be target revenue bottom linebio rad post strong quarterly performance earning sale show sharp year year improvement sale growth be majorly drive company many life science product line diagnostic instrument placement be solid promising guidance further instill confidence stock however contraction gross margin quarter review be due toescalate warranty service cost largely associate higher instrument placement zack rank key picksbio rad have zack rank hold few better rank medical stock be petm express pet free report perkinelmer pki free report becton dickinson company bdx free report petm perkinelmer sport zack rank strong buy becton dickinson company carry zack rank buy see complete list today zack rank stock here petm report third quarter fiscal result adjust ep cent soar prior year quarter revenue rise perkinelmer report fourth quarter adjust ep cent adjust revenue be approximately year earlier quarter becton dickinson report first quarter adjust ep constant currency revenue totale constant currency basis hottest tech mega trend year generate global revenue predict blast roof fame investor mark cuban say produce world first trillionaire still leave plenty money regular investor make right trade early see zack best stock play trend
230,PKI,express script hold company esrx free report post fourth quarter adjust earning share beat zack consensus estimate further adjust earning improve share year quarter revenue also beat zack consensus estimate increase year quarter patient claim volume script fourth quarter result benefit rise patient claim strong customer retention adjust network claim be year year adjust home delivery specialty claim be fourth quarter year year result net adjust claim fourth quarter be flat year year basis notably adjust ebitda earning interest tax depreciation amortization adjust patient claim fourth quarter be higher report year quarter express script hold company price consensus express script hold company price consensus express script hold company quote margin detailsadjust gross profit fourth quarter be year year percentage revenue adjust gross margin expand basis point bps net revenue adjust selling general administrative expense be prior year quarter upside margin be drive operational cost improvement backed focus technology digital tool home delivery specialty service balance sheetnet cash flow provide operate activity be year year company exit quarter cash cash equivalent year quarter total debt end quarter be end fact company be strive reduce debt level guidance adjust claim first quarter be expect range adjust earning share first quarter be estimate range represent growth year year basis full year adjust earning be estimate band reflect growth year year revenue be expect band adjust ebitda be expect come guidance express script core business total adjust claim be expect range first quarter total adjust claim core business be expect net revenue be estimate range long term viewbuoyed strong result quarter express script enterprise value initiative be estimate cost notably management expect cumulative saving nearly further company target compound annual adjust ebitda growth rate core business be positive zack rank other key picksexpress script have zack rank buy few other top rank stock broader medical sector be perkinelmer pki free report bio rad laboratory bio free report becton dickinson company bdx free report bio rad laboratory sport zack rank strong buy see complete list today zack rank stock here company have long term expect earning growth rate perkinelmer have long term expect earning growth rate stock carry zack rank becton dickinson company be zack rank player company have long term expect earning growth rate wall street next amazonzack evp kevin matra believe familiar stock have only just begin climb become greatest investment time once generation opportunity invest pure genius click detail
