,ticker,content
261,PKI,hologic inc holx free report report first quarter fiscal adjust earning share ep cent year year moreover adjust ep beat zack consensus estimate surpass company guidance cent report basis company record ep compare cent first quarter fiscal notably report figure include time tax provision net benefit courtesy tax reform revenue detailrevenue gross quarter year year constant exchange rate cer top line also exceed zack consensus estimate company guidance solid contribution hologic molecular diagnostic breast health international business drive top line geographically revenue unite state grow year year exclude blood screening medical aesthetic revenue decline international revenue be cer banking strong contribution cynosure exclude blood screening medical aesthetic international revenue increase constant currency hologic inc price consensus ep surprise hologic inc price consensus ep surprise hologic inc quotesegment detailrevenue diagnostic segment total revenue decline year year cer first quarter segment molecular diagnostic revenue increase cer global growth molecular diagnostic be primarily drive increase market share utilization fully automate panther system continue solid uptake aptima woman health product cytology perinatal revenue also show rise cer revenue breast health segment inched cer revenue unite state slip report quarter change product mix be partially offset increase service new product revenue international revenue however climb year year cer revenue gyn surgical business be cer medical aesthetic business quarter report revenue determine total revenue revenue skeletal health accounting rest decrease cer operational updatein fiscal first quarter hologic gross margin contract basis point bps adjust gross margin also decrease bps due divestiture blood screening business revenue low margin cynosure product hologic adjust operate expense amount year year adjust operate margin contract massive bps financial updatehologic exit first quarter fiscal cash cash equivalent report end first quarter fiscal total long term debt be end report quarter compare year quarter company generate operate cash flow compare year cash flow guidancehologic have update fiscal financial guidance company currently expect adjust revenue grow range compare previously provide range cer current zack consensus estimate be guide range adjust ep be expect grow previously state range current zack consensus estimate adjust ep be peg guide range second quarter fiscal hologic expect adjust revenue represent annualize growth cer current zack consensus estimate revenue be peg project range adjust ep be project cent reflect annualize growth current zack consensus estimate second quarter adjust ep be peg cent company guidance takehologic post better expect result first quarter fiscal term earning revenue growth geographical region buoy optimism however be disappoint decline revenue company diagnostic segment blood screening divestiture be also likely impede growth momentum company zack rank key pickshologic carry zack rank hold few better rank stock report solid result earning season be petm express pet free report perkinelmer pki free report becton dickinson company bdx free report petm sport zack rank strong buy perkinelmer becton dickinson carry zack rank buy see complete list today zack rank stock here petm recently report third quarter fiscal result adjust earning share cent be prior year quarter revenue rise year year basis perkinelmer report fourth quarter adjust earning share cent adjust revenue be approximately year quarter becton dickinson report first quarter adjust earning share constant currency revenue be constant currency hottest tech mega trend year generate global revenue predict blast roof fame investor mark cuban say produce world first trillionaire still leave plenty money regular investor make right trade early see zack best stock play trend
262,PKI,surmodic inc srdx free report report adjust earning cent share first quarter fiscal lower year figure cent zack consensus estimate be loss cent revenue quarter fall miss zack consensus estimate stock have zack rank hold segment report revenue segment medical device diagnostic ivd medical devicein report quarter sale decline due lower hydrophilic royalty revenue royalty license fee revenue totale year year management decline royalty license fee revenue be cause lower royalty result expiration patent third generation hydrophilic coating unit generate operate loss report quarter compare unfavorably operate income year quarter operate income segment be affected plan increase investment related surmodic whole product solution strategy reduction royalty revenue well increase contingent consideration expense ivdin quarter review sale increase upside come back strong growth stabilization biofx microarray antigen product sale ivd operate income be current quarter compare first quarter fiscal surmodic inc price consensus ep surprise surmodic inc price consensus ep surprise surmodic inc quote margin detailsproduct gross margin contract basis point bps first quarter product sale compare year period margin quarter suffer expense irish facility infrastructure lower medical device product gross margin first quarter fiscal expense be net sale higher net sale year quarter company anticipate expense increase fiscal thank company whole product solution strategy investment advance transcend drug coater balloon human clinical trial preclinical work knee platform av fistula drug coat balloon project sg expense first quarter fiscal be revenue expand bps year year balance sheet cash flowat end first quarter company have cash investment surmodic generate cash operate activity company invest plant equipment continue expect fiscal year revenue range company expect fiscal earning share negative cent cent compare previous estimate adjust loss cent bottom linesurmodic end first quarter fiscal favorable note courtesy solid performance diagnostic segment segment have be gain ground back strong growth stabilization biofx microarray antigen product sale surmodic issue solid guidance fiscal company solid initiative strengthen research development program hold promise company witness significantly high operate loss specifically ireland product sale decline substantially owing shipment issue particularly medical device segment further foreign exchange wo related creagh medical buyout have be major dampener surmodic drug coat balloon face stiff competition niche space company margin be expect be pressure thank expense irish facility infrastructure lower medical device product gross margin key picksa few better rank stock report solid result earning season be petm express pet free report perkinelmer pki free report becton dickinson company bdx free report petm sport zack rank strong buy perkinelmer becton dickinson carry zack rank buy see complete list today zack rank stock here petm report third quarter fiscal result adjust earning share be cent prior year quarter revenue rise year year basis perkinelmer report fourth quarter adjust earning share cent adjust revenue be approximately year quarter becton dickinson report first quarter adjust earning share constant currency revenue totale constant currency hottest tech mega trend year generate global revenue predict blast roof fame investor mark cuban say produce world first trillionaire still leave plenty money regular investor make right trade early see zack best stock play trend
263,PKI,cvs health corporation cvs free report fourth quarter adjust earning share ep be year year adjust ep also beat zack consensus estimate cent time adjustment exclude impact income tax benefit result latest tax reform report ep continue operation come share surge year period full year adjust ep come improvement year adjust number net revenue fourth quarter increase year year exceed zack consensus estimate cvs health corporation price consensus ep surprise cvs health corporation price consensus ep surprise cvs health corporation quoterevenue year be improvement revenue also beat zack consensus estimate quarter detailspharmacy service revenue increase report quarter drive growth specialty pharmacy volume higher pharmacy network volume well brand inflation be however partially offset increase generic dispense continue price compression pharmacy network claim processed quarter climb day equivalent basis backed net new business growth also mail choice processed claim count be day equivalent basis continue adoption maintenance choice offering rise specialty pharmacy claim revenue cvs health retail ltc be marginal year year accord company increase same store prescription day equivalent basis brand inflation be partially offset continue reimbursement pressure increase generic dispense rate front end same store sale be year year be positively impact basis point seasonal cough cold front store sale be adversely affected soft customer traffic effort rationalize promotional strategy be partially offset increase basket size pharmacy same store sale increase report quarter sale be adversely affected approximately basis point bps due recent generic drug introduction apart marketplace change restrict cvs pharmacy participate certain network have bps negative impact same store prescription volume report quarter generic dispense rate proportion generic prescription total number prescription dispense increase approximately bps pharmacy service segment bps retail ltc segment gross profit improve however gross margin contract bps total operate margin quarter decline bps cvs health exit year cash cash equivalent short term investment compare end full year net cash provide operate activity be year period fourth quarter cvs health open new retail store close relocate retail location dec cvs health operated retail store include pharmacy target store state well district columbia puerto rico brazil company have revise outlook revision reflect effect tax reform achieve tax cut job act tcja management note cash benefit tcja company be able make strategic investment stimulate greater growth longer term accordingly company have increase adjust operate profit growth guidance range earlier state range earlier provide initial outlook cvs health note expect deliver net revenue growth year current zack consensus estimate full year revenue be peg first quarter company expect register adjust operate profit growth range takecvs health end year solid note better expect fourth quarter performance year year growth top line be drive strong pharmacy service segment benefit upside specialty service however year year retail ltc comparison be dull zack rank key pickscvs health have zack rank hold few better rank stock report solid result earning season be petm express pet free report perkinelmer pki free report becton dickinson company bdx free report petm sport zack rank strong buy perkinelmer becton dickinson carry zack rank buy see complete list today zack rank stock here petm recently report third quarter fiscal result adjust earning share cent be prior year quarter revenue rise year year basis perkinelmer report fourth quarter adjust earning share cent adjust revenue be approximately year quarter becton dickinson report first quarter adjust earning share constant currency revenue be constant currency make fortune shift electric car here stock idea consider much petroleum year lithium power soon shake world create millionaire reshape geo politic soon electric vehicle evs be cheaper gas guzzler be already reach mile single charge battery price plummet charge station set multiply company stand stock buy accord zack research not think see ticker free
264,PKI,omnicell inc omcl free report have be gain investor confidence consistently positive result past year stock have rally mountain view base developer marketer end end automation solution medication use process have market cap company year project growth rate be favorable compare broader industry however estimate revision trend zack rank hold company current year have be mixed last day analyst revise estimate upward movement opposite direction however estimate revision earning increase share same time frame factor playwe note stock be progress well legged strategy cover market expansion delivery differentiate innovative solution expansion new market primarily outside unite state expansion strategic partnership acquisition new technology last report quarter company gain new prominent customer well significant strategic deal exist customer thereby progressed first leg strategy apart xt series momentum company be witness market momentum value validate entire omnicell platform strategic solution omnicell xr automate central pharmacy system be likely be available mid be already gain significant momentum market number contractual booking fourth quarter second leg expand new market be drive growth acute care segment company continue focus middle east south africa also see greater adoption technology other part world latest be australia internationally company have sign contract hcl hca healthcare pharmacy supply solution hospital third leg acquisition partnership be also progress successfully company most recent buyout be inpharmic mississippi base technology service company help omnicell expand capability performance center omnicell strong position sweden germany singapore middle east south africa china also buoy optimism company have be witness strong pipeline development country addition omnicell witness strong business trend europe have observed healthy acceptance medication adherence product meanwhile remain sideline past month omnicell have be underperform broader industry stock have decline versus industry fall moreover omnicell continue expect higher cost upcoming quarters stem integration aesynt ateb expense related recently launch xt series thereby add concern moreover omnicell be expose resilient hospital capital expenditure environment adversely affect adoption solution furthermore reimbursement mix have also affected endowment income further affect hospital spending capability company have win new deal larger hospital market be still susceptible economy credit condition key picksa few better rank stock broader medical sector be perkinelmer pki free report bio rad laboratory bio free report becton dickinson company bdx free report bio rad laboratory have zack rank buy see complete list today zack rank strong buy stock here company have long term expect earning growth rate perkinelmer have long term expect earning growth rate stock carry zack rank becton dickinson company have zack rank company have long term expect earning growth rate more stock news be bigger iphone become mother technological revolution apple sell mere iphone year new breakthrough be expect generate more device just year create market zack have just release special report spotlight fast emerge phenomenon ticker take advantage don buy now kick click here trade
265,PKI,edward lifescience corporation ew free report have be healthy growth trajectory late positive tiding regulatory front strategic acquisition have be provide company competitive edge medtech solid prospect zack rank buy stock be attractive pick moment edward lifescience have outperformed broader industry last month stock have gain ahead gain broader industry stock have market cap company year historical growth rate be also favorable compare increase industry gain company have positive earning surprise last quarters also have long term expect earning growth rate headquarter irvine company estimate revision trend current year have be positive past couple month analyst moved north movement opposite direction earning estimate rise share same time frame let find recent positive trend be sustainable edward lifescience fourth quarter performance be quite promising company beating zack consensus estimate revenue earning also raise guidance hint brighter prospect fact raise outlook be backed strong performance company product line market be also upbeat edward lifescience recent ce mark self expand centera valve regulatory approval be likely boost company transcatheter heart valf thv segment edward lifescience recently acquire harpoon medical inc privately hold medical technology company focuse beating heart repair degenerative mitral regurgitation agreement harpoon medical flagship beating heart repair procedure mitral valve patient harpoon system be add edward lifescience surgical heart valve therapy portfolio treat structural heart disease other key picksother top rank stock broader medical sector be perkinelmer pki free report bio rad laboratory bio free report becton dickinson company bdx free report bio rad laboratory have zack rank see complete list today zack rank strong buy stock here company have long term expect earning growth rate perkinelmer have long term expect earning growth rate stock carry zack rank becton dickinson company have zack rank company have long term expect earning growth rate more stock news be bigger iphone become mother technological revolution apple sell mere iphone year new breakthrough be expect generate more device just year create market zack have just release special report spotlight fast emerge phenomenon ticker take advantage don buy now kick click here trade
266,PKI,ecolab inc ecl free report report fourth quarter adjust earning share miss zack consensus estimate penny earning improve year quarter ecolab carry zack rank hold include net discrete tax benefit tax reform cent share ecolab register earning report basis adjust quarterly net sale be year quarter also net sale miss zack consensus estimate ecolab inc price consensus ep surprise ecolab inc price consensus ep surprise ecolab inc quotesegmental analysisglobal industrial segmentsale segment grow year year almost upside be drive major gain water food beverage life science unit europe north america latin america lead global industrial regional growth acquisition adjust fix currency operate income improve year year basis global institutional segmentsale increase lead strong growth specialty business line segment witness solid growth north america asia pacific acquisition adjust fix currency operate income remain flat year year global energy segmentsale rise owing strong growth well stimulation business modest gain downstream business acquisition adjust fix currency operate income increase year year other segmentsale decline year year sale segment witness robust growth north america margin analysisas percentage revenue ecolab register adjust gross margin fourth quarter basis point bps year year basis adjust operate margin fourth quarter contract bps net revenue outlookecolab expect full year adjust earning range share year year percentage revenue adjust gross margin be expect range first quarter ecolab expect adjust earning range cent share previous range cent current outlook reflect increase year year adjust gross margin first quarter be expect be net revenue takeecolab end fourth quarter unfavorable note miss zack consensus estimate count strength pest elimination business other segment decline year year report basis ecolab operate highly competitive market mar prospect long haul believe volatility foreign currency exchange rate remain significant headwind company ecolab face pricing pressure energy segment be likely hurt profit brighter side strong guidance instill optimism stock further europe north america latin america lead global industrial regional growth quarter strength global institutional segment lead growth specialty healthcare business line be also positive robust product portfolio expand customer base be likely drive organic sale long haul key picksa few better rank stock report solid result earning season be petm express pet free report perkinelmer pki free report becton dickinson company bdx free report petm sport zack rank strong buy perkinelmer becton dickinson carry zack rank buy see complete list today zack rank stock here petm report third quarter fiscal adjust earning share cent prior year quarter revenue rise perkinelmer post fourth quarter adjust earning share cent adjust revenue be approximately year quarter becton dickinson report first quarter fiscal adjust earning share constant currency revenue totale constant currency hacker put money portfolio earlier month credit bureau equifax announce massive datum breach affect american cybersecurity industry be expand quickly response similar event stock be better investment other zack have just release cybersecurity investor guide help zack com reader make most year investment opportunity create hacker other threat reveal stock worth look right away download new report now
267,PKI,henry schein inc hsic free report report adjust earning share ep cent fourth quarter year year adjust ep remain line zack consensus estimate year year upside earning be drive strong revenue growth business segment adjust ep year be improvement year period also remain line zack consensus estimate revenue detailhenry schein report net sale fourth quarter year year marginally zack consensus estimate year year improvement come back internal sale growth local currency increase owing foreign currency exchange acquisition growth be quarter net sale full year be improvement year number top line also exceed zack consensus estimate henry schein inc price consensus ep surprise henry schein inc price consensus ep surprise henry schein inc quotein fourth quarter company record sale north american market year year sale totale international market year year segment analysis henry schein derive revenue operate segment dental medical animal health technology value add service fourth quarter company derive revenue global dental sale year year include growth local currency contribution foreign currency exchange local currency internally generate sale increase acquisition growth be quarterly result also have negative impact additional week year period internal growth local currency include growth north america rise internationally company global animal health segment witness rise revenue include growth local currency increase foreign currency exchange local currency internally generate sale increase acquisition growth be extra week have negative impact quarterly sale performance internal growth local currency include rise north america improvement internationally worldwide medical revenue rise year year growth local currency be increase owing favorable foreign exchange revenue global technology value add service grow include growth local currency rise related foreign currency exchange acquisition contribute quarter review margin trend gross profit increase report quarter however gross margin contract basis point bps year quarter due rise cost sale higher revenue growth rate rise selling general administrative expense adjust operate income improve year year however adjust operate margin decline bps year year report quarter financial positionhenry schein exit year cash cash equivalent compare end full year net cash provide operate activity be compare year period quarter review company buy back approximately share almost close fourth quarter company have authorize repurchase common stock guidancehenry schein raise ep guidance reflect impact tax reform legislation include estimate cent impact associate certain time cash bonus company currently expect ep range reflect growth report ep figure previous ep guidance range be zack consensus estimate adjust ep be guide range takehenry schein exit fourth quarter mixed note company operate segment record strong year year growth henry schein strong share gain north american overseas market solid revenue raise optimism better expect revenue performance be disappoint year year deterioration henry schein gross operate margin due higher cost sale expense increase ep guidance buoy optimism zack rank key pickshenry schein have zack rank hold better rank stock broader medical sector be perkinelmer pki free report bio rad laboratory bio free report becton dickinson company bdx free report bio rad laboratory have zack rank see complete list today zack rank stock here company have long term expect earning growth rate perkinelmer have long term expect earning growth rate stock carry zack rank becton dickinson company have zack rank company have long term expect earning growth rate hacker put money portfolio earlier month credit bureau equifax announce massive datum breach affect american cybersecurity industry be expand quickly response similar event stock be better investment other zack have just release cybersecurity investor guide help zack com reader make most year investment opportunity create hacker other threat reveal stock worth look right away download new report now
