,ticker,content
0,PKI,welcome move perkinelmer pki see relative strength rating improve thursday look best stock buy watch factor watch closely be relative price strength exclusive rating investor business daily track price performance worst best score rating show stock price behavior last week hold other stock database decade market research reveal best perform stock often have better rs rating launch largest price move see perkinelmer continue show renew price strength hit benchmark see ibd help make more money be build consolidation entry see clear price heavy volume keep mind later stage consolidation be riskier earlier stage pattern company bottom line growth decline last quarter top line rise previous report perkinelmer earn rank peer medical research equipment service industry group medpace medp illumina ilmn icon iclr be top highly rate stock group get newsletter deliver inbox more info product service privacy policy term also ibd stock rating upgrade rise relative strengthwhy use ibd relative strength rating relative strength line help judge stock
1,PKI,important metric look stock be higher relative strength rating perkinelmer pki just hit mark jump wednesday unique rating measure technical performance used worst best score identify stock price action trail week match rest market decade market research reveal market biggest winner often have rs rating early stage move look winning stock try simple be still buy range climb entry cup handle proper buy range extend initial entry once stock hit benchmark best hold investing set buy opportunity perkinelmer see earning sale growth rise last quarter earning share increase revenue rise company earn rank peer medical research equipment service industry group pra health science prah quintile im illumina ilmn be top highly rate stock group related stock be show improve technical action use ibd relative strength rating relative strength line help judge stock
2,PKI,bean counter keep book man green eyeshade make investment grow cpa trained jim tringas co lead manager well fargo special small cap value fund espax sure diversify stock mutual fund business entire decade end dec track morningstar inc only manage beat past year fund be ibd best mutual fund award winner special small cap value be fund be just year date go thursday be run ahead small cap value peer stock market environment now favore large cap growth stock tringas co manager know count such slack time have proven way handle key success be not try hit home run tringas say just try get base maybe hit single maybe draw walk then just try get second base then third then home not give lot run tringas say fund focus winning do lot little thing right stem training fellow co lead manager bryant vancronkhite share start certify public accountant cpa background have more conservative cautious approach most fund manager tringas say so don take lot risk don take shareholder harrowing ride aim performance time do way beat peer benchmark less volatility many other fund get end point nicer ride co manager robert rifkin share approach not have cpa background take look top performer top holding novanta novt make photonic motion control system be dst system dst make software financial service industry be container manufacturer silgan holding slgn be tringas be turn have manage well fargo special small cap value talk ibd investment approach office boston ibd do special fund name refer tringas get question lot fund be set word be used lot be originally part evergreen fund family get acquire first union acquire company already have fund name small cap value so couldn drop special well fargo then acquire now speak ask special stock re consider buy code competitive advantage special sauce second thing look be recur free cash flow third thing look be flexible balance sheet mean re underleveraged look company low debt use financial flexibility create value create shareholder return invest organically new plant technology platform enable improve work capital increase margin time ibd be key fund consistent outperformance tringas come focuse thing ve discuss portfolio construction pay attention risk risky environment distinguish have portfolio company be high quality generate lot free cash flow carry little debt be company investor want buy market sell company hold much better market sell operate position strength usually outperform market ibd let talk thesis interesting holding latest disclosure ve be build share count central garden pet cent several disclosure attraction tringas turnaround year go nowhere management team come go have excited be be not capital intensive end market have seasonality be attractive management today have improve distribution rationalized number product bring potential barely make money year make share company fix inefficiency have more ability create value not say current price awesome have lower cost basis ibd ve also add stake novanta be tringas make laser laser base system machine cut tool high precision surgical application work customer create tool customer so be essentially sole source supplier thing wear get follow order also top management come perkinelmer pki medical research equipment company so novanta begin tilt medical care market be less cyclical nonmedical care market now revenue be medical end market other end market model show be still substantial opportunity continue value create strategy ibd executive headhunter korn ferry kfy be yet name ve add do tringas have great relationship executive ve help place fortune company natural serve now ve do smart job diversify consult type business provide more recur revenue core executive recruit more stable cash flow get more access cheaper borrow so have more opportunity create value flexible balance sheet risk be get recession executive recruit business be hard hit ibd take korn ferry rank ibd commercial service staffing industry group top notch smr rating ibd mean be top stock term sale growth profit margin return equity ratio see additional easy understand fundamental technical datum stack rival ibd stock checkup ibd dsp group dspg be small designer wireless chipset be play overlooked gem tringas re not anyone radar screen re run israeli management team have phenomenal balance sheet have lot new product believe be target mobile phone wearable device include speech recognition audio technology be unique valuable re profitable now extent monetize new market be even more interesting ibd mueller industry mli make copper brass tube hvac refrigeration plumbing market sex appeal tringas re not sexy just make money product go residential nonresidential end market economy grow give take good enough let grow earning paid special dividend share march so re good steward capital reward long term shareholder be infrastructure create demand thing sell ibd earning share growth associate banc asb have accelerate quarters row else do tringas ceo be phil flynn sell union bank own believe know turn franchise come company be verge failure do better believe company be sell have idea likely buyer be canadian bank associate be upper midwest give foothold ibd atkore international group atkr construction product maker be newcomer portfolio play tringas have similar end market mueller also have mechanical product service division generate enormous amount cash flow company come private equity generally be well run go public still have discipline company don have flexible balance sheet have enough free cash flow continue deliver add value shareholder time be reasonably price ibd hancock hold hbhc ep grow past quarters be rebound story bank expose energy company tringas be southeastern bank exposure energy oil go barrel have issue risky nonperforming loan oil have come back nonperforming loan book be lot lot company shore balance sheet equity offering ibd jim often do talk buy sell team tringas be ad conversation initiate analyst come say stock be get rich risk reward ratio be tell need cut weight doesn mean ll do talk have regular weekly meeting thursday discuss buy sell amazing much macro conversation happen bottom guy related blue chip tech name help fuel red hot fundfidelity talk super bowl super stock
3,PKI,high tech instrument maker dhr report soft guidance early thursday send stock tumble nearly morning trading stock market today earning share rise year earlier quarter cent include cent tax gain sale security analyst consensus call cent sale rise
4,PKI,share perkinelmer pki jump year high morning trading friday day scientific equipment maker beat expectation late thursday company report make cent share quarter year earlier quarter beating analyst consensus cent sale rise estimate
5,PKI,stock remain mixed narrowing tighter range quiet trade midday friday market track healthy gain week
6,PKI,dow jone industrial average trade be nasdaq improve loss volume be nasdaq lower nyse
7,PKI,stock market today receive mixed send first quarter gdp growth improve much less expect final read april consumer sentiment improve sharply initial estimate industry group track ibd be trading lower midday
8,PKI,stock penney jcp horton dhi lead morning session respectively medical scientific equipment maker perkinelmer pki drop score index worst loss deliver weak first quarter report
9,PKI,ibd list rental car competitor avis budget group car hertz global holding htz catch fire avis more hertz grab gain
10,PKI,move drive avis just april high thick trade rebound support day move average hertz be also just april high hasn come day line february
11,PKI,new issue drugmaker abbvie abbv jump new high putt share january open price spinoff abbott laboratory narrowly top sale earning expectation quarter reiterate full year guidance be low end analyst consensus view
12,PKI,baidu bidu stumble loss result miss analyst consensus forecast
13,PKI,chipmaker maxim integrate product mxim shed report fiscal third quarter result late thursday earning rise better expect sale growth top projection fourth quarter sale earning guidance be line consensus estimate
14,PKI,stock have be shallow consolidation struggle hold week support mid march stock remain mixed narrowing tighter range quiet trade midday friday market track healthy gain week dow jone industrial average trade be nasdaq improve loss volume be nasdaq lower nyse stock market today receive mixed send first quarter gdp growth improve much less expect final read april consumer sentiment improve sharply initial estimate industry group track ibd be trading lower midday stock penney jcp horton dhi lead morning session respectively medical scientific equipment maker perkinelmer pki drop score index worst loss deliver weak first quarter report ibd list rental car competitor avis budget group car hertz global holding htz catch fire avis more hertz grab gain move drive avis just april high thick trade rebound support day move average hertz be also just april high hasn come day line february new issue drugmaker abbvie abbv jump new high putt share january open price spinoff abbott laboratory narrowly top sale earning expectation quarter reiterate full year guidance be low end analyst consensus view baidu bidu stumble loss result miss analyst consensus forecast chipmaker maxim integrate product mxim shed report fiscal third quarter result late thursday earning rise better expect sale growth top projection fourth quarter sale earning guidance be line consensus estimate stock have be shallow consolidation struggle hold week support mid march
15,PKI,share illumina ilmn gap month high stock market tuesday gene sequence firm beat estimate late monday lead several analyst hike price target
16,PKI,company say profit rise year quarter cent share beating analyst consensus cent exclude time legal charge sale climb more consensus do not however raise full year guidance
17,PKI,credit suisse cantor fitzgerald isi group raise price target stock tuesday move blow past illumina share be late morning trading
18,PKI,isi ross muken write be maintain hold rating await better entry point call quarter impressive note growth manifest variety product line geography
19,PKI,muken also note upcoming catalyst year be resolution budget battle austerity measure europe well impact illumina recent buyout prenatal testing firm verinata lead partnership perkinelmer pki
20,PKI,illumina be first several maker life science instrument report earning week early tuesday water corp miss profit estimate stock rise more anyway miss be mainly due weak japanese yen accord muken
21,PKI,thermo fisher scientific tmo be process buy illumina competitor life technology life be schedule report early wednesday analyst be expect steady unspectacular growth new ibd member profit share sale rise share illumina ilmn gap month high stock market tuesday gene sequence firm beat estimate late monday lead several analyst hike price target company say profit rise year quarter cent share beating analyst consensus cent exclude time legal charge sale climb more consensus do not however raise full year guidance credit suisse cantor fitzgerald isi group raise price target stock tuesday move blow past illumina share be late morning trading isi ross muken write be maintain hold rating await better entry point call quarter impressive note growth manifest variety product line geography muken also note upcoming catalyst year be resolution budget battle austerity measure europe well impact illumina recent buyout prenatal testing firm verinata lead partnership perkinelmer pki illumina be first several maker life science instrument report earning week early tuesday water corp miss profit estimate stock rise more anyway miss be mainly due weak japanese yen accord muken thermo fisher scientific tmo be process buy illumina competitor life technology life be schedule report early wednesday analyst be expect steady unspectacular growth new ibd member profit share sale rise
22,PKI,new analyst report cowen co offer upbeat assessment medical research equipment stock ahead first quarter earning thank improve end market
23,PKI,report life science diagnostic tool sector tuesday analyst doug schenkel write most company be poise meet beat expectation
24,PKI,expectation combine confidence build forward look commentary positive update end market help share price sector recover recent slump schenkel add
25,PKI,company reckon be best position beat estimate be fluidigm fldm illumina ilmn myriad genetic mygn orasure technology osur perkinelmer pki thermo fisher scientific tmo
26,PKI,fluidigm belong ibd medical system equipment group rank industry track illumina myriad perkinelmer thermo fisher be ibd medical research equipment service group rank orasure be medical product group rank
27,PKI,stock myriad have highest ibd composite rating be follow illumina perkinelmer thermo fisher orasure fluidigm
28,PKI,myriad have have best stock action late reach year high friday share be more begin year
29,PKI,company life science diagnostic tool benefit growth most end market schenkel say
30,PKI,coverage universe include major customer end market academic government industrial apply biopharma healthcare hospital
31,PKI,have be show improvement say
32,PKI,base check management commentary past few month continue believe academic government end market be stable improve schenkel note
33,PKI,industrial cyclical end market not be improve quickly hope say be encourage sign
34,PKI,remain enthused outlook improve end market favorable comparison drive continue relative outperformance schenkel write
35,PKI,related myriad tata motor rs leader correction new analyst report cowen co offer upbeat assessment medical research equipment stock ahead first quarter earning thank improve end market report life science diagnostic tool sector tuesday analyst doug schenkel write most company be poise meet beat expectation expectation combine confidence build forward look commentary positive update end market help share price sector recover recent slump schenkel add company reckon be best position beat estimate be fluidigm fldm illumina ilmn myriad genetic mygn orasure technology osur perkinelmer pki thermo fisher scientific tmo fluidigm belong ibd medical system equipment group rank industry track illumina myriad perkinelmer thermo fisher be ibd medical research equipment service group rank orasure be medical product group rank stock myriad have highest ibd composite rating be follow illumina perkinelmer thermo fisher orasure fluidigm myriad have have best stock action late reach year high friday share be more begin year company life science diagnostic tool benefit growth most end market schenkel say coverage universe include major customer end market academic government industrial apply biopharma healthcare hospital have be show improvement say base check management commentary past few month continue believe academic government end market be stable improve schenkel note industrial cyclical end market not be improve quickly hope say be encourage sign remain enthused outlook improve end market favorable comparison drive continue relative outperformance schenkel write related myriad tata motor rs leader correction
36,PKI,vision tenacity futuristic idea become reality firm drive ultramodern advance mainstream aim higher imagine live healthily past year age endgame ceo kevin hrusovsky see caliper life science calp have great purpose revolutionize medicine health care tell ibd caliper arm scientist
37,PKI,gene sequence instrument now spit so much datum researcher be turn cloud compute handle load lift outlook provider such service
38,PKI,perkinelmer pki maker scientific instrument be such company expand service business recently acquire geospiza provider lab software cloud base genomic datum service
39,PKI,perkinelmer aim provide more storage analysis service cloud faster less costly instrument let more lab sequence dna
40,PKI,have be lot datum generate say dan marshak perkin elmer chief scientific officer be early day
41,PKI,tip point high volume sequence come few year company such illumina ilmn life technology life release next generation sequence instrument
42,PKI,new technology sequence entire human genome now be do several day compare million dollar several month year
43,PKI,researcher also demand datum redundancy ensure don miss single gene so individual genome be typically sequence time further add datum pile
44,PKI,lower barrier entry afford new instrument have result amount genomic datum quintuple year
45,PKI,datum wave occur say paul knight analyst investment firm clsa cloud be essential
46,PKI,more advanced instrument
47,PKI,scientific instrument become more advanced instrument maker be grow pressure provide more datum analysis cloud access help customer cope volume datum generate knight say
48,PKI,emerge issue say
49,PKI,illumina few year begin offer server storage service package manage customer sequence datum reportedly be plan cloud service well
50,PKI,cloud have challenge be evident cloud service offer amazon com amzn have several day outage late april knock big website such foursquare commission period time incident lessen cloud appeal scientist already nervous hand precious datum
51,PKI,lack storage analysis service genomic datum isn only issue lab face similar datum problem research protein human cell
52,PKI,next generation instrument likely only worsen problem sequence technology advance faster compute technology
53,PKI,just store datum cloud isn enough order be used effectively datum be analyze present easy use way especially group person share access
54,PKI,vendor provide experience simple environment be go be able capture large share market doubt say michael schatz professor cold spring harbor lab clsa industry forum year
55,PKI,dna analysis often key
56,PKI,ease use grow importance more researcher delve dna sequence first time due part say perkinelmer drug development increasingly require dna protein analysis
57,PKI,part cloud base service perkinelmer do initial analysis work well walk researcher process sequence dna say dick begley company president emerge technology
58,PKI,interactively coach say
59,PKI,university florida center biotechnology research have used geospiza first software then cloud service start datum wave begin build
60,PKI,center provide sequence service researcher university elsewhere didn want devote own staff build more efficient user interface say william farmerie center associate director emerge science
61,PKI,need make access datum convenient possible say have row datum spreadsheet mind numbing
62,PKI,cloud base service also let researcher reorganize datum way want rather center have produce custom make product individual request say
63,PKI,still cloud compute not be cure research center datum issue farmerie say also consider add more server
64,PKI,look possible solution get hand say gene sequence instrument now spit so much datum researcher be turn cloud compute handle load lift outlook provider such service perkinelmer pki maker scientific instrument be such company expand service business recently acquire geospiza provider lab software cloud base genomic datum service perkinelmer aim provide more storage analysis service cloud faster less costly instrument let more lab sequence dna have be lot datum generate say dan marshak perkin elmer chief scientific officer be early day tip point high volume sequence come few year company such illumina ilmn life technology life release next generation sequence instrument new technology sequence entire human genome now be do several day compare million dollar several month year researcher also demand datum redundancy ensure don miss single gene so individual genome be typically sequence time further add datum pile lower barrier entry afford new instrument have result amount genomic datum quintuple year datum wave occur say paul knight analyst investment firm clsa cloud be essential more advanced instrumentsas scientific instrument become more advanced instrument maker be grow pressure provide more datum analysis cloud access help customer cope volume datum generate knight say emerge issue say illumina few year begin offer server storage service package manage customer sequence datum reportedly be plan cloud service well cloud have challenge be evident cloud service offer amazon com amzn have several day outage late april knock big website such foursquare commission period time incident lessen cloud appeal scientist already nervous hand precious datum lack storage analysis service genomic datum isn only issue lab face similar datum problem research protein human cell next generation instrument likely only worsen problem sequence technology advance faster compute technology just store datum cloud isn enough order be used effectively datum be analyze present easy use way especially group person share access vendor provide experience simple environment be go be able capture large share market doubt say michael schatz professor cold spring harbor lab clsa industry forum year dna analysis often keyease use grow importance more researcher delve dna sequence first time due part say perkinelmer drug development increasingly require dna protein analysis part cloud base service perkinelmer do initial analysis work well walk researcher process sequence dna say dick begley company president emerge technology interactively coach say university florida center biotechnology research have used geospiza first software then cloud service start datum wave begin build center provide sequence service researcher university elsewhere didn want devote own staff build more efficient user interface say william farmerie center associate director emerge science need make access datum convenient possible say have row datum spreadsheet mind numbing cloud base service also let researcher reorganize datum way want rather center have produce custom make product individual request say still cloud compute not be cure research center datum issue farmerie say also consider add more server look possible solution get hand say
65,PKI,consumer buy shiny new apple aapl ipad business buy state art manufacturing system don see be take be make scene work be perform company public have never hear case re talk company list thursday ibd electronic tech leader stock screen
66,PKI,federal antitrust regulator jan approve thermo fisher scientific tmo acquisition laboratory equipment maker dionex dnex thermo fisher last year sell more scientific test equipment service dionex specialize chromatography system allow lab separate measure component complex chemical mixture thermo fisher aim close
67,PKI,update loss be broad base financial pressed back class news regulator delay promise quick fix so call toxic asset hold many bank other institution
68,PKI,nyse composite end flat nasdaq composite edge ever so slightly lower week dow clip decline
69,PKI,citigroup lead dow downside juniper network jnpr fall hardest nasdaq juniper be also loss leader worsted only fifth third bancorp fitb
70,PKI,be tough day someone forget tell amazon com amzn gap gain late thursday online retailer say book earning sale well analyst view other component flowserve fls paccar pcar jump heavy trading
71,PKI,next week monday promise be busy day economic datum commerce release personal income spending construction spending datum december institute supply management put index general gauge outlook corporate buyer
72,PKI,monday earning calendar include be aerospace beav corn product international cpo sysco syy prior open independent oil gas heavyweight anadarko apc sandisk sndk athero communication athr check close
73,PKI,update higher volume loss threaten stock rally
74,PKI,juan carlos arancibia
75,PKI,market close session lows friday broad decline
76,PKI,tumble nasdaq nyse composite dow accord early number
