,ticker,content
180,PKI,corporation abc free report have be healthy growth trajectory late past month company have outperformed industry stock have gain compare industry rally also company have outperformed index gain lead pharmaceutical service company focus provide drug distribution related service reduce health care cost improve patient outcome have market cap companyha positive earning surprise last quarters also have long term expect earning growth rate backed such prospect zack rank buy stock be attractive pick investor moment company estimate revision trend current year have be positive past day analyst revise estimate upward movement opposite direction resultantly earning estimate improve share style score sport value score indicate company strong prospect research show stock value style score combine zack rank strong buy offer best upside potential regard have favorable price earning growth peg ratio compare broader industry moreover surpass industry cash flow share signify be favorable value pick let find recent positive trend be sustainable be upbeat active pursuit acquisition strengthen core area recently company announce buyout largest independent wholesaler unite state cash mwi veterinary acquisition have diversify company exist pharmaceutical distribution service business attractive animal health market hold huge potential moment meanwhile acquisition pharmedium enhance company ability provide market lead service solution health system customer segment be play increasingly important role healthcare market unite state believe benefit generic growth long run first quarter fiscal marked company consecutive quarter greater revenue growth part business end first quarter management confirm company strategic focuse effort be drive generic product volume growth offset historic deflation rate notably company be well position ensure product reach market patient access traditional complex new therapy site care strong organic growth rate pharmaceutical market improve patient access care improve economic condition population demographic introduction new innovative drug hepatitis drug well consistent brand pricing environment drive growth also company world courier business have be fare well notably end first quarter fiscal world courier company own office be spread more country investigational drug depot locate emerge market worldwide other key picksa few other top rank stock broader medical sector be bio rad laboratory bio free report athenahealth inc athn free report perkinelmer pki free report bio rad laboratory sport zack rank see complete list today zack rank stock here company have long term expect earning growth rate athenahealth be zack rank player company have long term expect earning growth rate perkinelmer have long term expect earning growth rate stock carry zack rank hottest tech mega trend year generate global revenue predict blast roof fame investor mark cuban say produce world first trillionaire still leave plenty money regular investor make right trade early see zack best stock play trend
181,PKI,varian medical system inc var free report have be healthy growth trajectory late positive tiding regulatory front have lend company competitive edge medtech space solid prospect zack rank buy stock be attractive pick moment varian medical have outperformed industry last month stock have gain higher industry stock have market cap company have positive earning surprise last quarters also have long term expect earning growth rate company have impressive growth style score growth style score highlight vital metric company financial obtain clearer picture quality sustainability growth research show stock style score combine zack rank strong buy hold offer best investment opportunity company estimate revision trend current year have be encourage well past couple month estimate moved north movement opposite direction earning share estimate rise let find recent positive trend be sustainable factor drive varian medicalpositive regulatory tiding varian medical recently announce receipt regulatory clearance antitrust authority german federal cartel office fco acquisition sirtex medical limit transaction be expect strengthen varian medical footprint australia close varian medical equip mexico center instituto mexicano del seguro social imss have select varian medical equip treatment center mexico modern radiotherapy treatment system include edge system image guide stereotactic radiosurgery evinance innovation acquisition varian medical recently acquire montreal base privately hold evinance innovation inc clinical decision support cds software company deal be initiate last september varian medical have state utilize evinance patented technology offer better service client other key picksother top rank stock broader medical sector be bio rad laboratory bio free report athenahealth inc athn free report perkinelmer pki free report bio rad laboratory sport zack rank see complete list today zack rank stock here company have long term expect earning growth rate athenahealth be zack rank player company have long term expect earning growth rate perkinelmer have long term expect earning growth rate stock carry zack rank hottest tech mega trend year generate global revenue predict blast roof fame investor mark cuban say produce world first trillionaire still leave plenty money regular investor make right trade early see zack best stock play trend
182,PKI,qiagen qgen free report announce international panel physician association ippa have endorse quantiferon tb gold qft immigrant medical screening management innumerable migrant suffer latent active tuberculosis tb year consequently prudent usage qiagen qft aid curb challenge public health come quarters do ippa endorse qft notably ippa be not profit physician education group work country receive immigrant refugee press release ippa call modern class tb test know interferon gamma release assay igra essential safety efficacy screening program design early detection tb infection post center disease control cdc division global migration quarantine announcement expand tb testing requirement ippa endorse use qft immigration medical screening cdc announcement expand tb testing requirement be effective oct prior announcement guideline tb testing be limit child age previously immigrant have option use tst igra however new guideline require igra testing immigrant adult child apply legal status unite state tst method longer be accept immigration screening panel physician practice abroad appoint receive country government take care mandatory pre departure medical examination migrant now be require use igra tb screening notably be more half migrant year receive permanent lawful residence unite state qft unit glancebuilt quantiferon tb gold qft platform qft provide enhance analysis tb infection advanced kit make tb testing innovative antigen possible measure cell mediate immune response cd cd cell believe approval help qiagen expand customer base drive uptake qft test consequently boost top line qft be register more country europe middle east africa asia latin america qft be also endorse world health organization igra campaign eradicate tb quantiferon tb diagnostic test kit fall qiagen molecular diagnostic segment be highest revenue grosser last report quarter notably segment contribute total revenue last report quarter substantial growth quantiferon latent tb test qiasymphony automation system consumable portfolio solid performance companion diagnostic pharma collaboration development qftin regard post receipt fda approval june qiagen have announce complete launch fourth generation blood test tb infection qft unite state furthermore continue slew development qiagen announce signing collaboration agreement diasorin january post collaboration qiagen quantiferon tb diagnostic test be available diasorin liaison portfolio fully automate analyzer qiagen recently announce receipt japan ministry health labor welfare approval qft diagnostic detect tb infection market prospectsaccord research market datum publish business wire global tb diagnostic market be expect see cagr consider bullish market sentiment believe latest development have arrived opportune moment share price have be gain investor confidence consistently encourage result past month company share price have outperformed industry stock have gain contrast industry decline zack rank key picksqiagen carry zack rank hold better rank stock broader medical sector be bio rad laboratory bio free report athenahealth inc athn free report perkinelmer pki free report bio rad laboratory sport zack rank strong buy see complete list today zack rank stock here company have long term expect earning growth rate athenahealth be zack rank player company have long term expect earning growth rate perkinelmer have long term expect earning growth rate stock carry zack rank buy hacker put money portfolio earlier month credit bureau equifax announce massive datum breach affect american cybersecurity industry be expand quickly response similar event stock be better investment other zack have just release cybersecurity investor guide help zack com reader make most year investment opportunity create hacker other threat reveal stock worth look right away download new report now
183,PKI,boston scientific bsx free report recently broaden endoscopy portfolio buyout privately hold company emcision limit presence canada financial term deal have be keep wrapped company expect deal prove accretive earning post post acquisition boston scientific endoscopy portfolio include emcision fda approve ce marked habib endohpb probe notably habib endohpb probe be innovative endoscopic bipolar radiofrequency device coagulate tissue gi tract moreover habib endohpb probe aids treatment palliative care patient diagnosed cancer glimpse endoscopy businessboston scientific endoscopy division develop manufacture device treat variety digestive disease include affect oesophagus stomach liver pancreas duodenum colon revenue division rise year year last report quarter upside be drive strength biliary hemostasis endochoice ambulatory surgery center portfolio company also witness organic revenue growth segment last november boston scientific complete integration endochoice endoscopy business acquire endochoice holding focus development pathology service infection control product single use device treat variety condition thus believe latest buyout help boston scientific boost top line contribution endoscopy business market prospectsper market datum forecast report global pancreatic cancer therapeutic market be project reach value cagr period upbeat prospect market be primarily base rise consumption tobacco unhealthy lifestyle practice smoking age population obesity company death annually be attribute cancer globally thus addition habib endohpb probe help boston scientific cash abundant opportunity pancreatic cancer therapeutic market share price movementover past month boston scientific have be outperform industry stock have gain compare industry gain zack rank key picksboston scientific carry zack rank hold better rank stock broader medical sector be bio rad laboratory bio free report petm express pet free report perkinelmer pki free report bio rad laboratory sport zack rank strong buy see complete list today zack rank stock here company have long term expect earning growth rate petm have long term expect earning growth rate zack rank perkinelmer have long term expect earning growth rate stock carry zack rank buy wall street next amazonzack evp kevin matra believe familiar stock have only just begin climb become greatest investment time once generation opportunity invest pure genius click detail
184,PKI,abiom inc abmd free report scale new week high feb eventually close bit lower company share have gain last month compare broader industry gain headquarter danver abiom be engage develop manufacturing marketing medical product design assist replace pump function case heart failure be currently top perform stock medtech space improvement price performance strong fundamental indicate stock bullish run therefore haven take advantage price appreciation yet time add stock portfolio long term expect earning growth rate also hold promise solid stock have market cap abiom year historical growth rate be also favorable compare broader industry company have zack rank hold indicate robust fundamental expectation line performance term company have impressive growth style score growth style score highlight vital metric company financial obtain clearer picture quality sustainability growth research show stock style score combine zack rank strong buy buy offer best investment opportunity factor drive stocklet take look major factor have be boost abiom late strong earning resultsabiom recently exit third quarter fiscal better expect revenue margin quarter company witness breakthrough term record revenue earning growth also expansion margin buoy optimism guidance raisedbase strong third quarter performance company raise fiscal revenue guidance again earlier fourth quarter revenue be estimate year year basis guidance operate margin fiscal have also be raise earlier expectation regulatory approval impella product lineabiom recently announce expand fda pre market approval pma flagship impella impella cp impella impella ld heart pump expand pma heart pump now be used treat heart failure associate cardiomyopathy lead cardiogenic shock include peripartum postpartum cardiomyopathy also abiom recently announce flagship impella impella cp heart pump have receive pma fda expand use product now be used elective urgent high risk percutaneous coronary intervention procedure bcc research global market cardiac medical device be project reach cagr consider prospect niche space expect abiom gain solid market traction year come northward estimate revisionfive estimate current quarter moved north past day southward revision indicate analyst optimism zack consensus estimate adjust earning increase current quarter much cent also year year growth be expect positive trend signify analyst bullish sentiment key pickssome better rank stock broader medical sector be perkinelmer pki free report bio rad laboratory bio free report becton dickinson company bdx free report bio rad laboratory have zack rank buy see complete list today zack rank strong buy stock here company have long term expect earning growth rate perkinelmer have long term expect earning growth rate stock carry zack rank becton dickinson have zack rank company have long term expect earning growth rate breaking news cryptocurrency now bigger total market cap cryptos recently surpass more increase previous month re now bigger morgan stanley goldman sachs even visa new asset class expand even more rapidly new investor continue pour wall street become increasingly involved zack have just name company enable investor take advantage explosive growth cryptocurrency stock market click here access stock
185,PKI,edward lifescience corporation ew free report announce receipt ce mark self expand centera valve valve be used severe symptomatic aortic stenosis patient high risk open heart surgery however centera valve be not approve commercial sale unite state company edward centera valve be repositionable retrievable be deliver low profile french motorize delivery system ce mark be base centera eu trial result be present europcr study enrolled high risk patient center europe australia new outcome trial demonstrated high survival rate low rate disable stroke new permanent pacemaker day regulatory approval be likely boost company transcatheter heart valf thv segment precisely thv focusthv segment include technology design treat heart valve disease used catheter base approach opposed open surgical technique fourth quarter company report thv sale growth prior year quarter double digit procedure growth europe latest development be likely further enhance company prospect europe outside unite state underlie growth rate be contribution region late edward lifescience have witness multiple development thv segment edward lifescience announce receipt fda approval aortic mitral valve valve procedure used sapien transcatheter heart valve june management release positive patient outcome sapien valve include high survival rate low rate stroke paravalvular leak market potentialtaking consideration huge growth potential thv market recent ce mark centera valveis strategic persistence market research report global heart valve repair replacement market be project reach worth cagr share price estimate revision trendedward lifescience have be gain investor confidence consistently positive result last year company share price have outperformed industry stock have gain compare industry current estimate revision trend be favorable current year estimate moved north compare movement opposite direction last month result zack consensus estimate full year have rise share zack rank other key picksedward lifescience carry zack rank buy few other top rank stock broader medical sector be perkinelmer pki free report bio rad laboratory bio free report becton dickinson company bdx free report bio rad laboratory have zack rank see complete list today zack rank strong buy stock here company have long term expect earning growth rate perkinelmer have long term expect earning growth rate stock carry zack rank becton dickinson company have zack rank company have long term expect earning growth rate wall street next amazonzack evp kevin matra believe familiar stock have only just begin climb become greatest investment time once generation opportunity invest pure genius click detail
186,PKI,perkinelmer inc pki free report be top perform stock medtech space improve price performance strong fundamental reflect stock bullish run thus haven take advantage share price appreciation yet time add stock portfolio company have perform impressively fourth quarter be likely sustain momentum upcoming period attractive pick share price appreciationa glimpse company price trend reveal stock have have impressive run bourse last month perkinelmer share have return compare favorably index rally current return be also higher industry gain northward estimate revisionnine estimate current year earning moved north last day versus downward revision indicate analyst optimism period zack consensus estimate rise share company hold zack rank buy indicate robust fundamental expectation outperformance term perkinelmer inc price consensus perkinelmer inc price consensus perkinelmer inc quote promising company have issue adjust earning share guidance furthermore revenue be expect be range organic growth project be zack consensus estimate earning cent current quarter reflect year year growth moreover earning be expect register growth zack consensus estimate revenue be current year reflect year year growth moreover revenue be expect grow improve operate operate margin continue improve back productivity initiative volume leverage broad spectrum product new product integration be expect improve product mix also drive gross margin also stringent cost control be expect drive operate margin further exit fourth quarter solid note discovery analytical solution segment register organic growth upside be attribute product introduction healthy growth major region company have also be benefitting latest acquisition euroimmun laboratory diagnostic ag majorly drive diagnostic segment sale report quarter euroimmun alliance have add autoimmune allergy testing company portfolio well additional infectious disease testing capability addition euroimmun tulip diagnostic increase company headcount diagnostic more employee significantly bolster research development sale clinical capability other key picksa few other top rank stock broader medical space be amphastar pharmaceutical inc amph free report hca healthcare inc hca free report athenahealth inc athn free report stock sport zack rank strong buy see complete list today zack rank stock here amphastar have impressive expect long term growth rate last month stock have rally hca healthcare have project long term growth rate last month stock have gain athenahealth have long term growth rate last month stock have gain hottest tech mega trend year generate global revenue predict blast roof fame investor mark cuban say produce world first trillionaire still leave plenty money regular investor make right trade early see zack best stock play trend
187,PKI,medtronic plc mdt free report have present positive datum home pediatric study patient age year notably datum be base minime system be demonstrated advanced technology treatment diabetes international conference vienna austria study result multus center study have enrolled participant year age group trial consist week run phase study phase month participant choose continue used system part continue access program moreover study result demonstrated datum pivotal trial minime system patient age year used study result company have apply expand fda approval include patient range year eligible used minime system same time company be work expand usage product child age year hope be harbore effectiveness system get greater customer adoptability time minime glancepost receipt fda approval medtronic have commercially launch minime system june be hybrid close loop insulin delivery system type diabetic patient age year older minime system feature medtronic latest guardian sensor glucose sensor increase accuracy enhance performance be only fda approve sensor control hybrid close loop system include diagnostic technology continuously check sensor health system also carry medtronic most advanced algorithm know smartguard hcl technology development diabetes witness sluggish growth diabetes business last quarter however company gain strong uptake new sensor augment insulin pump system unite state well international market growth be temporarily offset limit supply continuous glucose monitor cgm sensor moreover strong customer enrollment priority access program briefly affected revenue management diabetes business witness revenue growth third quarter fiscal company have finished shipping pump priority access program also company be move steadily sensor capacity expansion plan schedule be complete fourth quarter fiscal additionally medtronic gear international launch minime launch cgm system guardian connect sugar iq late new professional cgm ipro regard company also announce favorable result support use cgm person type diabetes october apart be upbeat corporation johnson johnson diabetes care company exit insulin pump business medtronic partner support transition patient caregiver healthcare provider notably patient used insulin pump be offer choice switch medtronic pump market potentialan agee population unhealthy lifestyle rise awareness expenditure healthcare be likely drive growth diabetes market report mordor intelligence global market diabetes care device be project reach value cagr give bullish market sentiment believe latest positive study result have come opportune moment share price have be gain investor confidence consistently positive result past month company share price have outperformed broader industry stock have gain comparison broader industry increase zack rank key picksmedtronic carry zack rank hold better rank stock broader medical sector be perkinelmer pki free report bio rad laboratory bio free report becton dickinson company bdx free report perkinelmer have long term expect earning growth rate stock carry zack rank buy bio rad laboratory have zack rank see complete list today zack rank strong buy stock here company have long term expect earning growth rate becton dickinson company be zack rank player company have long term expect earning growth rate wall street next amazonzack evp kevin matra believe familiar stock have only just begin climb become greatest investment time once generation opportunity invest pure genius click detail
