,ticker,content
121,ROST,wednesday ross store rost hit noteworthy performance benchmark relative strength rs rating jump percentile upgrade increase day look best stock buy watch factor watch closely be relative price strength proprietary rating measure technical performance used worst best score identify stock price action trail week match other stock history show stock go make biggest gain often have rs rating early stage move see ibd help make more money stocksross store be try complete flat base buy point see stock clear price volume least higher normal company see earning sale growth rise last quarter earning share increase revenue rise company hold rank peer retail apparel shoe accessory industry group tjx tjx be rank stock group related ibd stock rating upgrade rise relative strengthwhy use ibd relative strength rating relative strength line help judge stock
122,ROST,tjx tjx parent maxx marshall homegood turn strong first quarter result open tuesday raise low end full year earning guidance estimate earning growth share revenue growth same store sale growth be expect rise accord consensus metrix result ep revenue same store sale growth pretax profit margin widen year total inventory be year earlier customer traffic be once again primary driver comparable store sale increase large division ceo ernie herrman say statement outlook ep consensus view same store sale growth full year ep be now see prior view vs consensus view stock share close stock market today go tjx earning stock have mostly be trading day move average last month get newsletter deliver inbox more info product service privacy policy term price rival ross store rost report thursday share briefly break buy range cup handle base decline territory big week retail earning kohl kss top view tuesday morning urban outfitter urbn close target tgt be tap thursday be interested kohl crush earning view stock spike buy pointthese retail stock include amazon be buy pointsfacebook ceo hot seat again tjx intuit earning investing action planross store kohl best buy headline busy week retail earningsretail commerce stock industry news
123,ROST,retail stock continue perform mostly well slew recent earning announcement department store meanwhile quarterly earning release loom member top tier retail apparel shoe accessory industry group include leaderboard member lululemon lulu retail apparel shoe accessory group be rank group investor normally focus top stock top group group lululemon be top rank stock highest possible ibd composite rating accord ibd stock checkup rating be blend key fundamental technical metric lululemon continue act market leader stock hit new high monday ease lower tuesday maker yoga gear rise much company report strong earning growth march next earning release be market close analyst expect company earn cent share revenue get newsletter deliver inbox more info product service privacy policy term useurban outfitter urbn report market close tuesday street expect company earning grow cent revenue share be well extend flat base entry feb market open tjx tjx parent company maxx marshall homegood report better expect result earning beat spark advance midday trade tuesday stock be slow steady uptrend cup handle jan share fall much buy point feb just shy loss cut level ross store rost report earning thursday market close consensus estimate show price department store chain ep grow revenue be expect grow stock be trading right cup handle entry accord marketsmith chart analysis stock relative strength line hit new high last week stock sign solid market outperformance related maxx marshall parent tjx beat earning forecast stock jumpsthese retail stock include amazon be buy pointsfacebook ceo hot seat again tjx intuit earning investing action planretail commerce news stock watch
124,ROST,datum storage firm pure storage pstg china online marketplace com wuba have break cup handle basis recent day oil major royal dutch shell rdsa moved buy zone wednesday oil clear barrel meanwhile retailer best buy bby ross store rost also be buy point classic bullish formation cup handle base be stock chart pattern dip then ascend form trajectory resemble shape cup stock slant downward form handle formation indicate shake more skeptical investor more solid bullish sentiment take midpoint handle be midpoint base cup handle formation be long week year many run month buy point be cent handle high point pure storage rise stock market today once again extend buy point stock break base monday then pull back somewhat tuesday fast grow flash storage company report fiscal first quarter earning get newsletter deliver inbox more info product service privacy policy term usemeanwhile com clear cup handle buy point last week royal dutch shell wednesday rise high clear buy point share close many oil stock have break set crude future soar multiyear high crude future top wednesday continue rebound president donald trump announce tuesday afternoon exit iran nuclear deal price apparel retailer ross store meanwhile be make way shallow cup handle buy point however lot base be stock day line be not great action share rise consumer electronic chain best buy climb form consolidation handle buy point ross store best buy be set hold quarterly earning conference call be interested stock watch best mutual fund buy potential watch amazon deal fire retail stock top retail name fend industry weakness be buy point
125,ROST,retail industry group dominate monday new high list accounting top group top several retail name near clear buy point include william sonoma wsm kohl kss shopify shop target tgt hot retail stock keep rise include lululemon athletica lulu struggle walmart wmt rebound share amazon amzn rise monday remain buy zone entry top rate ibd leaderboard stock be hit new high surpass last april gap follow amazon blockbuster earning retailer be benefit headwind solid retail earning robust hire retreat oil price largely avoid headwind trade war fear stronger dollar get newsletter deliver inbox more info product service privacy policy term usehere key retail commerce stock be perform william sonoma jump monday stock market trading clear first stage cup shape base buy point volume be well normal sign mutual fund other big institution be buy bulk seller home furnishing beat raise earning report grow commerce presence drive late rally share stock yield have recently joined ibd dividend leader list retailer rs line bolt higher monday stock continue outperform index kohl surge monday hit year high clear week consolidation stock already top shallow double bottom base offer alternative entry meanwhile volume be modestly normal simultaneously shopify stage jump cup handle entry shopify moved low volume shopify be part enterprise software group software platform help retailer set commerce site kohl rs line be now highest level past year be shopify kohl have be adapt rapidly shift retail environment carve space store amazon customer return purchase target tgt shot close flat base buy point zoom near flat base entry friendly discount brand report earning late wednesday ross store rost add rs line be rise remain high ross store price peer burlington store burl tjx co tjx beat earning view recent report ross store sell follow report invalidate entry now have new handle new buy point popularity discount retailer continue dent traditional mall even prove amazon resistant jpmorgan initiate coverage monday overweight rating price target canada goose goos advanced set time high pull back fellow canadian retailer lululemon sell trendy yogawear gain post earn rally continue canada goose commerce push drive revenue growth february have not announce date next report luxury apparel retailer see massive opportunity china be interested retail stock expect growth near buy zone composite rating stock skyrocket huge earning growthsell take profit hold here be several guideline find great growth stock learn spot flat base bullish chart pattern
126,ROST,build earning season watch list focus stock potential buy range ahead next quarterly report company fit bill be calere cal expect release latest number stock be approximately buy point first stage flat base be aware buy just stock report be risky don know stock report market react don have enough time build profit cushion minimize risk wait see actual number market reaction see ibd help make more money stocksearning grow last quarter prior report revenue also increase analyst expect earning share growth quarter growth full year annual growth estimate be recently revise lower calere have composite rating hold rank peer retail apparel shoe accessory industry group lululemon athletica lulu burlington store burl ross store rost be top highly rate stock group note date earning report be subject change check company update get newsletter deliver inbox more info product service privacy policy term also earning calendar analyst estimate stock watchnew option strategy limit risk earning
127,ROST,burlington store burl report fourth quarter earning sale ep guidance view early thursday push share price apparel retailer higher estimate earning share increase year revenue same store sale be expect rise accord consensus metrix result burlington store earn share sale same store sale jump outlook company expect adjust ep consensus cent burlington store see sale growth slightly view stock share rise stock market today drop wednesday rival price clothing chain ross store rost result late tuesday also beat analyst expectation dip thursday share ross tumble wednesday price chain say raise minimum wage hour management say be effort attract retain talented associate rbc analyst brian tunick research note also say lack flow tax upside seem bit disappointing investor ross store also give muted same store sale guidance tjx co tjx last week report result top estimate announce dividend hike share buyback climb cent thursday tjx also slide wednesday use ibd marketsmith free march
128,ROST,see stock buy point get chart pattern recognition run custom screen start nowburlington year have become less coat cold weather attempt offer better home product beauty item woman sportswear company have also shrink remodel store analyst have say price retailer burlington be more amazon amzn proof more expensive rival part retail watcher call treasure hunt experience offer bargain seeker visit store little sense want buy hunt attractive discount december well fargo analyst say amazon clothing shoe sale gross merchandise volume pass tjx macy be interested dollar tree earning sale outlook weak costco beat revenue stock sink late reject family bidkohl top share pressured sink late earningsmacy stock soar earning comp sale beat outlook strong
129,ROST,discount clothing giant ross store rost fashion apparel chain urban outfitter urbn report better expect fourth quarter earning share fall hour trading tuesday estimate ep be expect jump cent revenue growth accord zack investment reserach
130,ROST,result ross store earn share sale grow same store sale rise outlook ross see ep vs view see same store sale ceo barbara rentler cite challenge multus year comparison well very competitive retail environment stock ross store stock fall initial hour action share close stock market today work buy point ross stock be stick day move average relative strength line track stock performance vs index have be lag end use ibd marketsmith free march
131,ROST,see stock buy point get chart pattern recognition run custom screen start firm big rival sector leader tjx tjx parent company price chain maxx marshall homegood report strong result last month reveal significant increase shareholder return dividend buyback fellow price apparel retailer burlington store burl report earning thursday burlington store also have new flat base burlington store rise retake day line estimate ep swell cent share revenue increase
132,ROST,result ep rise cent share revenue same store sale rise free person anthropologie group urban outfittersibd take buy hold stock be risky head earning report here earning option strategy help cash post earning stock gain minimize risk weak quarter stock urban outfitter tumble nearly late trade suggest move back buy point have stock close urban outfitter close entry point first time feb have be then urban outfitter rs line close week high fellow youth apparel chain abercrombie fitch anf wednesday american eagle outfitter aeo thursday also have earning week also be interested ross store join rank stock composite ratingretail commerce stock industry newsstock buy watch top ipos big small cap growth stock
133,ROST,stock open sharply lower wednesday pressure ongoing turmoil trump administration continue rattle market struggle uptrend dow jone industrial average be open lows caterpillar cat boee ba suffering hardest early hit nasdaq composite slump apple aapl fang stock leader fall netflix nflx lead early decline retail chain dollar tree dltr ross store rost post largest loss nasdaq index sudden resignation top economic advisor gary cohn late tuesday roil investor appear have negative effect overseas action cohn be broadly see few protectionist trade policy voice white house reportedly disagree president trump strategy steel aluminum trade tariff use ibd marketsmith free march
134,ROST,see stock buy point get chart pattern recognition run custom screen start noweconomic news open better forecast jump february hire upward revision january job creation closely watch inflation gauge also jump expectation employer hire new worker february accord national employment report adp just january tally well expectation slowdown new hire adp also revise january estimate higher denote much stronger rate hire start year productivity worker remain unchanged fourth quarter labor department say slight improvement decline third quarter better consensus forecast slip labor unit cost jump third quarter increase outpace view gain oil price be focus energy information administration report weekly crude number et new york federal reserve president william dudley atlanta fed president raphael bostic be schedule speak morning follow federal reserve release february beige book report et dow boee sag news late tuesday hawaiian airline parent hawaiian holding have agree buy dreamliner value option more similar aircraft boee share have maintain firm support week move average be profit take zone follow september netflix shed follow downgrade hold buy stifel nicolaus stifel report cite valuation stock climb past brokerage price target tuesday putt share start year stifel say remain positive netflix business competitive position believe share price have sprint ahead fundamental short term dollar tree topple fourth quarter result stop short analyst estimate board stock end tuesday early february high premarket action suggest early dive test support stock day move average premarket move do not always carry regular trade discount retailer ross store tumble more report stronger expect earning revenue fourth quarter first quarter earning guidance top consensus view first quarter guidance same store sale be light chief executive barbara rentler cite challenge multus year comparison well very competitive retail environment ross stock have be meeting resistance week move average sixth week flat base china base stock be mixed early action mobile social networking service momo momo post advance baozun bzun gap gain tuesday backed open momo turn positive fourth quarter performance include gain earning share rise revenue share end tuesday december low back support week move average climb right side deep month consolidation early winner autodesk adsk leap block hrb gain nearly report positive quarterly result related trump globalist cohn be trade war odd big picture nasdaq ibd show bullish actionapple carve new buy point chip stock stand china online sale specialist break past buy point strong stock spotlight name be sharply outperform market
135,ROST,north korea be headline again thursday stock market wasn keen news least early go president trump cancele summit north korea kim jong dow nasdaq composite fall intraday major stock index re-cover impressively late afternoon trade dow be weigh weakness exxon mobil xom chevron cvx oil gas related group be day worst performer crude oil future be barrel give back nasdaq composite edge higher volume nyse nasdaq be tracking slightly higher wednesday level stock market result today fang name netflix nflx follow wednesday flat base share rise still buy range entry netflix be leaderboard name meanwhile fang name facebook fb be just handle buy point share ease facebook have rally sharply hit intraday low late march only high earning news william sonoma wsm gap powerfully solid earning share surge stock be well session high near week high elsewhere zto express zto continue impressive move higher rise nearly still buy range buy point stock have moved lot short period time leave vulnerable pullback china base name be featured monday sector leader column related news china base baozun bzun sector leader extend gain wednesday new high share rise now extend last week buy point thursday hour session have plenty earning report top rate name consider result be due splunk splk ross store rost veeva system veev decker outdoor deck ross store be featured possible call option trade latest earning preview column late thursday be hold just cup handle buy point related way profit trump cancellation north korean summittop chinese stock get price target hike continue industry dominanceokta stock rise security firm add facebook vmware partner
136,ROST,stock slouch lower midday tuesday discounter hardest hit issue nasdaq bow dow jone industrial average trim less respectively volume stock market today be run higher board dollar general dg skid heavy volume pull discounter further day move average line other discount space also struggle tjx company tjx gap punctured day line slice discounter fall keep damage routine big lot big retreat almost dollar tree dltr shave ollie bargain outlet olli inched ross store rost step back blue chip be mostly dow component apple aapl tack gain apple have rebound nicely market june bottom stock be then have retake day day line elite stock be hold together well selling tuesday amazon com amzn ulta beauty ulta netease nte show disturbance chart west texas intermediate crude oil rise barrel gold rise
137,ROST,here investing action plan need know investor come week chinese internet giant tencent tcehy netease nte weigh earning rival alibaba baba baidu bidu top chain wal mart wmt home depot hd fill more piece shape be even
138,ROST,stock moved sideway time high week week be packed market move news alibaba baba break growth accelerate acacia communication acia explode fiber optic ipo growth name spark macy trigger huge relief rally wal mart wmt buy jet com better compete vs amazon amzn oil price rebound solar stock crash week dow industrial hit time high nasdaq eclipse peak major index rise fractionally week nasdaq dow close climb point more quality breakout appear retailer energy play hot growth stock lead market earning report higher oil price solar stock tumble weak sunpower spwr guidance reit struggle investor seek growth name worry store closure alibaba report revenue beating wall street consensus estimate revenue rise local currency term best gain alibaba september ipo ep rise cent beating consensus cent jd com report revenue slightly consensus local currency report earning share cent double cent consensus revenue estimate fall short projection company show strong growth mobile user alibaba stock soar week breaking base highest level january jd com leap nearly next week messaging giant tencent tcehy perhaps alibaba biggest chinese rival report earning so do mobile gaming portal netease nte flash commerce seller vipshop vip ibd take market record high many growth name large small be breaking get depth look alibaba acacia other top rate stock fare vs rival go ibd stock checkup develop watch list saudi energy minister khalid al falih hint production freeze come meeting sideline international energy forum next month russia energy minister say didn see reason renew talk international energy agency say oil glut have disappear warn weaker demand dimmer macroeconomic outlook opec say saudi arabia pump record amount crude oil july cartel left demand outlook unchanged barrel day energy information administration say stockpile rise barrel week end aug production fall barrel second straight week decline oil rig operation rise week end aug baker hughe say seventh straight weekly gain highest level late february still crude oil price close week barrel wal mart store look keep pace amazon agree buy jet com wal mart have sizable online sale growth have be decelerate wal mart also put jet com ceo marc lore charge wal mart commerce operation jet com remain separately lore previously founder quidsi parent diaper com amazon buy wal mart stock rise hit month high week solar stock sunpower cut guidance inverter supplier solaredge sedg cite slowdown installer sunpower revenue growth adjust loss top estimate sunpower see revenue just vs consensus demand utility scale solar project tumble sunpower also cut view miss analyst view solaredge fiscal sale miss analyst expectation cent ep item beat nickel midpoint current quarter sale guidance trail consensus ep miss penny solarcity scty have agree takeover deal tesla tsla top analyst projection adjust loss revenue current quarter view revenue lag consensus sunpower stock crash year low chipmaker nvidia nvda involved everything gaming autonomous drive ai rise week fresh high tesla partner report sale cent earning share top consensus cent be respectively vs last year nvidia see current quarter sale beating analyst model china telecom datum center spending heavily higher speed connection maker fiber optic component be see huge demand hot ipo acacia communication say revenue rise adjust earning soar lumentum lite inphi iphi also report stronger expect figure neophotonic nptn sale growth fall short due sluggish demand older part production gigabit gear be ramp ibd company telecom fiber optic industry group hit year high thursday rank group acacia rise friday nearly week blast new high lumentum rise more inphi also new high neophotonic climb clear buy point friday related ibd take acacia communication be several tech leader have rise past buy point putt profit take zone sell top stock ibd latest tech leader column explain hold winning stock rule apply acacia weibo other right now recent ipo twilio twlo communication software firm report narrower expect gaap loss revenue jump vs wall street estimate sale top customer facebook fb own whatsapp fall year year twilio full year guidance edge consensus estimate twilio share surge week hit new high medpace holding medp soar thursday debut pricing high end expect ipo range share edge friday medpace provide outsourced clinical development service drug medical device company specialty drugmaker end have be strong season drug industry more ambiguous note allergan agn freshly divest generic business beat expectation slightly trim sale guidance share fall week valeant pharmaceutical vrx miss number affirm guidance reorganize say deal walgreen wba be finally turn profitable be willing sell worth core asset stock soar tuesday pare weekly gain report valeant face criminal charge defraud insurer medivation mdvn report hum quarter profit likely be flat expect market expansion drug xtandi share rise month high just barely buy range entry jazz pharmaceutical jazz miss ep estimate lower guidance partly due change tax report partly due higher cost stock drop mylan myl beat profit estimate slightly affirm guidance controversially high price epipen make light generic drug sale mylan close week unchanged walt disney top wall street estimate late tuesday say have buy stake stream company bamtech vie remain competitive digital medium conglomerate plan launch espn brand top service not include current espn content ep rise revenue growth share be week fail hold day line southwest luv cut third quarter unit revenue outlook say expect higher unit cost due flight cancellation july single router failure blac much technological infrastructure guidance come delta air line dal spend much week try recover own flight cancellation cause outage early monday american airline aal meanwhile forecast improvement unit revenue southwest delta share fall american air climb macy kohl kss report lower sale macy also have decline earning say cut store top forecast week bad news consumer stock such ford mcdonald mcd so macy kohl sky-rocket respectively week jwn jcpenney jcp top earning miss revenue share also soar week overall retail sale be flat july exclude auto accord commerce department home depot hd lowe low wal mart ross store rost be retailer report come week ibd tipp economic optimism index rise month high august climb point still neutral level
