,ticker,content
230,ROST,look sad mall dead mall online re likely be confront image desolate shutter shopping center have be left dead overgrow plant crack abandon storefront crumble tile litter break escalator common enough phenomenon entire photography project revolve state country retail center be hold american shopper not quite upcoming year isn exactly go be cakewalk hundred collective store closure macy wal mart wmt other combine bankruptcy sport authority sport chalet be enough make even most devote shopaholic wonder future commerce be big amazon com amzn screen go be year transition year reckon year awaken retailer say marshal cohen npd group chief industry analyst retail sale exclude auto gasoline rise nov dec accord mastercard spendingpulse suggest stronger expect holiday season perhaps reflect more optimistic consumer digital sale continue boom amazon grab ever larger commerce share brick mortar location face decline traffic trend be likely intensify new year big discount offer apparel store holiday season echo prior sale heavy year particularly retailer generally go important shopping period claim inventory be lean store feel have choice already cutthroat environment consumer have be trained hold get promotion say morningstar analyst bridget weishaar other problem be really overcrowded space barrier entry lot retailer be choose compete price ibd take hold amazon back become major player beauty depth look read amazon have be powerless beauty store retail metric president ken perkin say outside few busy hour weekend holiday be somewhat eerily quiet mall store check research firm observed handful person foot locker fl abercrombie fitch anf brand hollister american eagle outfitter aeo macy brand lb bath body work always seem have buzz say even apple aapl store seem less bustling year past year feel lull be bit deeper deeper say perkin lag be attribute holiday promotion be push earlier november say npd cohen spread spending perhaps greater problem be lack product innovation uniqueness shelve say other word not enough new fun stuff buy other person self gift purpose npd track november december shopping period week week say latest report week end dec dollar sale first week holiday retail season be lag prior year period brick mortar traffic fall store dec accord prodco retail traffic index save grace brick mortar location christmas eve also start hanukkah year be saturday dec be also day issue face retailer be likely continue face much abatement perkin highlighted ongoing shift online mobile spending consumer taste experience instead product high promotional activity hollow middle class leave less disposable income table course amazon insistent gain top prime shipping prime video company smart home device alexa help prime member place order alexa cut retailer equation consumer be pressed time say upper tier mall kind house tiffanys tif loui vuitton shake shack shak be expect continue perform well enough average mall still see individual store close shop say expert go way attract more foot traffic mid tier mall be go need step game restaurant movie theater lifestyle store say npd cohen add food court win be good enough simon property group spg major mall operator have tumble last month sink wednesday lowest level nearly month young person be do more mobile shopping be craving experience be surprise retailer respond foreshadow brick mortar industry fate wal mart wmt investment include commerce effort weigh short term income growth lead foreseeable reward future say perkin store check find wal mart have be busier store season top performer list feature familiar name perkin estimate home depot hd lowe low be strongest performer retail also see price trio tjx tjx ross store rost burlington burl continue do well well ulta beauty ulta be obviously standout player home improvement price beauty involve element store necessity look just right part dig bargain rack try new makeup brand be usually best do person department store have have choppy year jwn frequently get analyst be omnichannel retailer know engage customer platform macy kohl kss compete amazon everyone else internet say morningstar weishaar have differentiate cater more affluent shopper highly curate selection go amazon type red dress re go get literally hundred page result sift be not useful say go re go get product line price point brand even so be recently handed downgrade jpmorgan department store management team say brick mortar level hadn be bad future be omnichannel not be enough particularly world increasingly populate alexa google home device retail omnipresence be key say npd cohen be instead simply give customer way buy product store online behoove retailer latch shopper transaction say educate anticipate need ahead potential transaction allow different way buy then stay touch product reviews other method follow purchase goal say cohen be store become epicenter entire process related amazon top selling holiday product come amazone beauty ceo amin social cosmetic ageless beauty boomnordstorm warning be sign die mall
231,ROST,market tread water high so do lead stock tight action lead stock follow large advance be constructive give savvy investor opportunity add exist position initiate new one be miss tight action indicate institution be unwilling sell share anticipation higher price primerica pri
232,ROST,ulta beauty ross store have be winner bull market begin march do stock have more store be just tired story ride hasn always be ross store rost show choppy action year half begin early begin august stock sketch
233,ROST,burlington store burl third quarter result top analyst estimate company raise full year guidance issue earning wall street view price retailer earning more double cent share easily beating analyst view cent sale climb top view same store sale rise burlington share jump stock market today blast day line near buy point burlington see full year ep prior outlook due mainly beat analyst forecast holiday quarter burlington see sale line consensus view gain comp see ep analyst expect price retailer be mixed bag holiday season last week ross store rost report earning sale wall street view give full year guidance analyst expectation tjx co tjx report better expect earning guide forecast lower ross share rise tuesday remain buy range breaking flat base friday buy point tjx share be hit month high ibd take last year holiday retail sale disappoint only growth overall year sale be little less dire accord national retail federation related dollar tree see strong holiday quarter sale mixed signet movado share shine earning holiday
234,ROST,do still have paper copy ibd wednesday feb edition newspaper eibd yes put table computer screen now place copy latest edition list premier growth stock scan week move average stock focus
235,ROST,higher up facebook fb fitbit fit nike nke apple aapl supplier skywork solution swks broadcom avgo be make noteworthy insider trade week whatsapp founder facebook director jan koum again disclose hefty sale not only recent month time share facebook tune facebook oculus rift virtual reality headset make debut monday competition virtual reality augment reality market heat share social networking giant notch gain week be near buy point cup base major stakeholder foundry venture capital disclose thursday have sell fitbit share total fitness tracker maker announce week have ship fitbit blaze device first month market have ship more fitbit alta device hit shelve march nearly blaze be poise compete apple watch fitbit share rise week have tumble start year director john thompson jr disclose thursday sale share sportswear giant nike remain leader athletic apparel footwear industry fbr note earlier week armour ua be well position gain china market share nike adida nike share dip week remain area consolidation chairman ceo david aldrich file thursday disclose sale share pacific crest have suggest apple chip supplier take look maxim integrate product mxim potential takeover target move help skywork diversify slow smartphone radio frequency market skywork share rise vs week have find support day line start march director bruno guilmart file wednesday disclose sale share director lewis eggebrecht sell share share apple supplier be score weekly increase skywork broadcom have presence new inch iphone former gain new chip accord teardown smartphone oracle orcl ceo safra catz disclose sec tuesday sale share share lose week stock have be form long cup handle base last summer price chain president coo michael sullivan sell share accord thursday filing earlier executive chairman michael balmuth disclose have sell share often struggle retail landscape pricer have be hailed outperformer space ross store rost share gain week stock remain buy range recently breaking area consolidation insider transaction don typically have major impact stock indicate major pending news rapid liquidation most insider holding however affect stock image provide shutterstock
236,ROST,biggest stock market winner past century typically show strong profit growth least year begin big advance accord ibd research annual earning growth be so important have own letter ibd slim investing system acronym find stock potential greatest price gain look company annual profit growth least year such company typically boast new product service take market share create new market apple aapl do iphone mac computer ipad full year earning estimate be also key flag come growth company combination strong earning last several quarters record solid growth recent year create superb stock least higher probability success uptrending general market ibd founder william neil write make money stock annual earning share figure be find minichart ibd include ibd stock spotlight datum also be find ibd stock checkup investor com lately few company have be able post robust ep growth sluggish economy result many slower grow defensive stock have replace growth stock ibd earlier year include real estate investment trust such coresite realty cor big cap stock ross store rost tend perform better slow growth environment pocket strong growth remain select number ibd stock strong annual earning growth be list accompany table include facebook fb enjoy year earning sale growth rate more course not stock meet slim turn winner also important consider criterium such sale growth return equity profit margin buy stock case investor stock form proper base clear buy point strong volume buy strong profit growth accompany weak sale growth be sign company be cut cost boost profit sale growth exceed profit growth margin be shrink mean company cost be too high product be face tough competition
237,ROST,defensive sector be still outperform general market however strength retail group indicate consumer spending be still strong overall retail consumer sector be grand canyon incredibly vast yet company do well field stock market be often excel super specific niche wednesday ibd
238,ROST,retailer urban outfitter urbn soar tuesday earning top expectation day strong price performance doesn make stock industry group leader take lot more urban outfitter be member ibd apparel retail industry group group have rally mid november low same time
239,ROST,stock market end modest gain wednesday dreary beige book report federal reserve district fuel modest selling earlier day overall be quiet session didn stir much excitement list new high add soft volume progress have be slow
240,ROST,stock end little change wednesday hold tight big gain previous day push major average back key support line edge nasdaq dow jone industrial average end flat volume stock market today edge nyse dip nasdaq compare tuesday accord preliminary datum defensive stock such steelmaker miner lead gain solar stock also fared well lead solaredge technology sedg pop heavy volume retook week week move average israel base company go public march last year have post strong sale profit growth recent quarters earning be expect rise cent share mark third straight quarter triple digit gain meanwhile chip designer nvidia nvda edge continue march possible buy point cup base stock jump more retook day line feb post much better expect gain profit fiscal fourth quarter end january overall chip sector remain weak chip designer manufacturer equipment maker have be show strength ross store rost lead ibd higher climb nearly heavy volume follow better expect quarterly earning report however company guidance current year trail analyst forecast due part concern economy meanwhile lead lower plunge provider corn other crop seed slash outlook due strong dollar stiffer competition lower commodity price broadcom avgo wesson swhc trina solar tsl kroger kr be company schedule report quarterly earning thursday economic datum due thursday include factory order january revise productivity figure institute supply management index service sector activity february initial jobless claim week end feb
241,ROST,core consumer price exclude food energy rise february annual inflation rate hold steady undershoot expectation labor department report tuesday soft inflation read slightly lower odd fourth fed interest rate hike report dow jone industrial average nasdaq future extend gain major average open modestly higher stock market today year treasury yield point lower overall consumer price index rise month year match expectation fed be expect hike rate time year quarter point move economy look head relatively strong growth jobless rate sink multidecade low fed policymaker expect wage pressure rise unemployment fall lead company pass higher wage bill form price increase so far official measure haven detected pickup wage labor department report weaker expect annual average hourly wage inflation february faster wage growth begin show spring reflect recently announce wage hike walmart wmt target tgt cvs health cvs starbucks sbux didn happen soon enough latest job report get newsletter deliver inbox more info product service privacy policy term usea company hike wage competitor be be pressured do same last week kroger kr dollar tree dltr ross store rost say re raise wage employee stock sell worry profit margin competitive environment face kroger walmart amazon com amzn whole food division other offer least reason doubt wage pressure feed higher price kroger say thursday use third tax cut boost shareholder return other third go higher wage lower price yet even dove fed be begin sound more hawkish last year face disconnect continue strengthen labor market step inflation mount tailwind time full employment trend growth tip balance consideration view fed governor lael brainard say last week bottom line inflation be go remain concern wall street soft inflation read come medical care service inflation be unchanged february january monthly gain price medical care commodity include prescription drug slip meanwhile price food away home rise cost food consume home fall more evidence competition amazon grocery arena outside energy inflation be show transportation service price rise month year cost shelter rise moderate month february also be interested fang stock be flash bullish strength just buy pointinflation fed rate hike outlook need big picture nasdaq hit new high so do key gaugethese ipos join wave new issue breakout unicorn hypefive chinese internet be buy point new basesthese top finance stock be buy range ahead key vote
242,ROST,february job report friday morning come strong wall street expect set financial market fed interest rate scare later spring here reason economist expect new job datum match january hourly annual wage gain best even surprising datum point appear inflate dive work week reduce hour low wage worker even bigger pay gain be likely come spring reflect recently announce wage hike walmart wmt target tgt cvs health cvs starbucks sbux win show yet february job report company hike wage competitor be be pressured do same week kroger kr dollar tree dltr ross store rost say re raise wage employee stock sell worry profit margin wall street also expect jobless rate dip february first time economy add robust job use ibd marketsmith free march
243,ROST,see stock buy point get chart pattern recognition run custom screen start combination low fall unemployment accelerate wage gain fit perfectly phillip curve theory have long guide federal reserve policy far investor be concern key point be most fed policymaker still seem pretty confident inflation pressure win follow too far wage pressure business pass portion higher wage bill interest rate scare be look increasingly likely even legitimate inflation scare doesn materialize yet competitive environment face kroger walmart amazon com amzn whole food division other offer least reason doubt wage pressure feed higher price kroger say thursday use third tax cut boost shareholder return other third go higher wage lower price kroger give weak profit guidance forecast smaller profit margin send share crash thursday walmart minimum wage hike hour be first new entry level worker raise minimum wage hour then early walmart hike pay current associate minimum hour lead target costco cost other raise own wage point be wage hike come bunch didn really happen last year wage growth hit bit lull do appear be happen do wall street continue bump odd fourth rate hike already odd be month accord cme group fedwatch tool be interested dow jone stock be buy point fang make bullish movethe big picture be real news investorshere be chip stock breaking hit new high set upwhat do facebook grubhub salesforce epam have common
244,ROST,economy add job february unemployment rate hold labor department say friday average hourly wage rise cent hour tame year earlier miss consensus expectation rise january wage gain originally report rise be revise wall street expect gain job jobless rate december january payroll be revise combine job report dow jone industrial average index nasdaq future moved significantly higher stock market today index close point day move average thursday reclaim key level friday open year treasury yield rise few basis point job wage datum didn substantially bolster case federal reserve add extra interest rate hike blowout job number datum give stock tad more run room fed hike expectation begin bite investor shouldn take too much comfort datum don show goldilock type wage gain be history bigger pay gain be likely come spring reflect recently announce wage hike walmart wmt target tgt cvs health cvs starbucks sbux don show yet february job report company hike wage competitor be be pressured do same week kroger kr dollar tree dltr ross store rost say re raise wage employee stock sell worry profit margin retail sector add job construction employment surge manufacturer hire net likely combination low fall unemployment accelerate wage gain fit perfectly phillip curve theory have long guide federal reserve policy far investor be concern key point be most fed policymaker still seem pretty confident inflation pressure win follow too far wage pressure business pass portion higher wage bill use ibd marketsmith free march
245,ROST,see stock buy point get chart pattern recognition run custom screen start nowthat interest rate scare be look possible even legitimate inflation scare doesn materialize competitive environment face kroger walmart amazon com amzn whole food division other offer least reason doubt wage pressure feed higher price kroger say thursday use third tax cut boost shareholder return other third go higher wage lower price kroger give weak profit guidance forecast smaller profit margin send share crash thursday walmart minimum wage hike hour be first new entry level worker raise minimum wage hour then early walmart hike pay current associate minimum hour lead target costco cost other raise own wage point be wage hike come bunch didn really happen last year wage growth hit bit lull do appear be happen do wall street continue bump odd fourth rate hike already odd be month accord cme group fedwatch tool be interested dow jone stock be buy point fang make bullish movethe big picture be real news investorshere be chip stock breaking hit new high set upwhat do facebook grubhub salesforce epam have common
246,ROST,stock show mild loss midday wednesday respectable performance light strong gain market tuesday nasdaq lose dow jone industrial average give less volume nyse nasdaq be tracking close tuesday level steel mining stock buck trend early go stock market today intel intc also rise tide be dow best performer early go nearly face key test resistance level growth space ibd sector leader maxlinear mxl add nearly work right side week cup shape base amazon com amzn reversed early gain edge lower get resistance day move average nice rally recent day bmo capital initiate coverage outperform rating set price target ross store rost be top percentage gainer ibd rise more wall street like look earning report release tuesday close technical buy point take time get go gain traction wednesday buy range go other base build stock ibd include prestige brand pbh cadence design system cdns universal display oled downside wesson swhc slump ahead thursday earning report stock remain time high work cup shape base buy point economic news private sector add job february nicely consensus estimate datum come ahead friday job report nonfarm payroll be expect rise image provide shutterstock
247,ROST,online retail sale continue skyrocket meanwhile many brick mortar retailer store be layer employee other traditional brick mortar retailer wal mart store wmt compete shop anywhere convenience amazon com amzn other online retailer offer well perk free day shipping nearly product free stream music ten thousand movie
248,ROST,super tuesday be equally super stock market stock end big gain higher volume stock strengthen february ism manufacturing index come better expect even index still show contraction fifth straight month meanwhile consumer month economic outlook nation fall lowest level more year accord fresh read ibd tipp economic optimism index nasdaq surge gain dow jone industrial average rise stock market today winner top loser nyse margin ratio be nearly nasdaq money flow bond stock year treasury yield jump basis point ross store rost rise more regular session slip hour trading report better expect earning sale adjust earning cent share top view cent rise year earlier sale rise vs consensus estimate regular session bank do most heavy lift super regional bank svb financial sivb jump nearly fifth third bancorp fitb rise money center group citigroup morgan stanley ms be big winner rise retail sector dollar tree dltr paid visit day move average tuesday reversed higher soft start share rise more stock be still buy range prior buy point open retailer report third straight quarter decline earning growth sale jump help merger last year family dollar annual earning growth dollar tree be expect rise more current fiscal year next fiscal year elsewhere autozone azo gain open company report quarter solid growth help upbeat industry trend higher margin ibd citrix system ctxs outperformed rise not buy point yet however work right side first stage base new york mercantile exchange west texas intermediate crude oil april delivery settle barrel cent
249,ROST,stock show strong gain midday tuesday day nasdaq marked ugly close notch distribution day stock market strengthen february ism manufacturing index come better expect still show contraction fifth straight month meanwhile consumer month economic outlook nation fall lowest level more year accord fresh read ibd tipp economic optimism index nasdaq jump rally dow jone industrial average gain money flow bond stock year treasury yield jump basis point stock market today dollar tree dltr paid visit day move average tuesday then reversed higher soft start share jump still buy range prior buy point month cup handle longer cup handle have also form yielding fresh buy point open retailer report third straight quarter decline earning growth sale jump help merger last year family dollar annual earning growth dollar tree be expect rise more current fiscal year next elsewhere autozone azo be early gainer rise nearly open company report quarter solid growth help upbeat industry trend higher margin ross store rost add ahead fiscal earning report close discount retailer have hold well choppy market entry have be slow materialize consensus estimate call profit cent share year ibd new oriental education edu have good day work choppy cup handle pattern buy point west texas intermediate crude oil april delivery reversed early gain be barrel image provide shutterstock
