,ticker,content
0,ROST,top rate retailer ross store rost well ibd name twitter twtr tal education tal momo momo score new high friday latter be well extend past proper buy point ross store be still buy range handle entry ross flash sell signal prior entry fall buy point key ibd sell rule say always cut loss purchase price sometimes loss be cut sooner strong move stock past year ross latest be still early stage stock reset base count make big consolidation last year low undercut low prior base shake enough seller reset base count nov be first stage bright horizon family solution bfam also make new high list stock look poise third straight gain friday clear buy point wednesday higher volume still buy zone market face risk thursday close nasdaq show distribution day meaningful loss major stock index higher volume be sign institutional selling number distribution day always be monitored closely market be confirm uptrend now financial sector also deliver new high small cap cadence bancorp cade pop buy point friday plenty liquid average daily volume more share also sport composite rating point plenty positive trait fundamental perspective umpqua holding umpq also hit new high try clear flat base buy point related retail commerce stock industry newsbank financial stock news analysis
1,ROST,dow jone future today rise friday morning do future nasdaq future splunk splk veeva system veev ross store rost decker outdoor deck top stock close thursday session buy range be active late earning report meanwhile autodesk adsk buy point also report earning stock buy range have strong composite rating splunk boast best possible composite rating veeva system have cr ross store ugg boot maker decker outdoor be meanwhile autodesk have mediocre composite rating reflect weak earning transition cloud base subscription model composite rating provide overall score stock time stock winner often have cr least start big run dow jone index nasdaq composite sell thursday morning president trump abruptly cancele june summit north korean leader kim jong major stock market average pare loss dow jone close index nasdaq composite fractionally lower dow jone future today rise vs fair value future climb nasdaq future advanced crude oil future fall nearly drop barrel get newsletter deliver inbox more info product service privacy policy term usemeanwhile foot locker fl sky-rocket early friday buy point foot locker report surprise earning gain splunk earning revenue top view first quarter datum analytic software firm give revenue guidance just consensus share fall open stock market today still be buy point health science software maker comfortably top earning view veeva raise full year guidance well veeva stock fall premarket late thursday veeva signale undercut buy point double bottom base price apparel retailer top first quarter profit sale estimate ross store earning guidance be light full year ross store have close just move back buy point cup handle base ross stock be not yet active early friday fall late decker outdoor top fiscal earning revenue view guidance be mixed decker fiscal ep target be consensus so be full year revenue view decker be not yet active premarket late thursday stock rise suggest open extend flat base buy point decker have close top chase zone maker computer aid design software top adjust ep view revenue line autodesk earning guidance be analyst consensus autodesk stock fall premarket be interested big picture stock hold place sector outperform top fang stock here netflix have reach new buy pointforget trump be cold china trade war loom way profit trump cancele north korean summit
2,ROST,big box retailer target tgt miss first quarter earning estimate wednesday slow start spring weather weigh sale xestimate earning share revenue accord zack investment research same store sale be expect notch gain accord consensus metrix result ep sale sale miss thomson reuter estimate same store sale rise traffic digital sale climb vs management say spending online effort well price cut higher wage also hit margin outlook ep midpoint consensus view comparable sale growth accelerate low mid single digit range strong sale growth home essential food beverage category offset impact delay sale temperature sensitive category accelerate rapidly recent week weather improve country say chairman ceo brian cornell statement additionally team be deliver excellent execution guest service day momentum traffic have accelerate second quarter stock share tumble close stock market today have be work buy point flat base rival walmart wmt report strong earning improve commerce growth last week dip wednesday get newsletter deliver inbox more info product service privacy policy term usetarget result follow aggressive effort company move delivery pick service better compete walmart amazon past year company have acquire shipt online delivery service have offer drive app service item be bring customer car target have also buy transportation tech company better handle delivery other retail stock discounter ross store rost department store kohl kss amazon amzn be set basis buy range ross store report thursday kohl however crash tuesday department store chain signale weaker same store sale second quarter urban outfitter urbn beat estimate late tuesday tjx co tjx parent maxx jump tuesday company turn strong quarterly report be interested make money stock find correct buy pointwhich stock be show rise relative strength retail commerce news stock watch
3,ROST,bearish earning option trade work quite well latest week toll brother tol meanwhile cheap call option trade ross store rost turn be cheap reason investor have several intriguing chart consider earning option trade come week high quality name salesforce com crm costco ticker
4,ROST,clothing retailer gap gps report steeper expect drop same store sale namesake store first quarter earning share also miss estimate xestimate earning share jump cent revenue grow accord zack investment research overall same store sale be expect rise accord consensus metrix namesake comp banana republic old navy result earning share cent net sale same store sale gap global store fall banana republic old navy gain figure gap store slow company overall same store sale year same store sale overall rise compare gain last year company hold full year ep outlook compare analyst estimate gap see same store sale come flat slightly retail chain also hold capital spending level move intend build effort be more digitally oriented retailer stock share crash hour stock market today drift further consolidation entry stock relative strength rating wednesday reach potentially foreshadow bigger rise ahead rating measure stock price movement compare other big index higher better get newsletter deliver inbox more info product service privacy policy term useceo art peck say statement difficulty gap be expect other apparel retailer gap have deal rival slash price prop sale nation increasingly vacant mall telsey advisory group upgrading gap last week say discounting pressure be already price gap stock price apparel chain ross store rost also report earning close clear buy point handle cup base thursday share tumble late thursday earning follow week have be stuffed earning retail sector have show sign strength online improvement healthy global economy urban outfitter urbn first quarter result easily beat estimate week company same store sale gain be best so far week thomson reuter say wednesday share company be unchanged hour finishing higher day share tjx tjx parent maxx also get lift company earning top view commerce help william sonoma wsm luxury international tourism thomson reuter say help tif stock cruised past buy point report earning however kohl kss sank same store sale outlook target tgt blame weather weaker sale say higher wage discount spending online effort cut margin be interested ralph lauren retake buy point then surprise earning basic analyze stock cup handlemake money stock find correct buy point
5,ROST,here investing action plan thursday need know investor come day tech company splunk splk veeva system veev report earning com wuba so call craigslist china also report ross store rost electronic chain best buy bby gap gps continue week heavy retail result
6,ROST,share target tgt ross store rost rh rh kohl kss amazon amzn be near entry point monday so keep eye retail stock approach hover buy territory open kohl report wall street expect department store retailer report increase earning cent share revenue growth stock be consolidate share climb entry point rise stock market today price chain ross store be tap report earning thursday analyst be expect earning growth share sale rise stock briefly break cup handle base clear entry point be struggle definitively stay zone monday dip target have be climb consecutive session build right side flat base entry point climb monday month long base have stock reach high hasn see late consensus be ep grow sale notch gain big box retailer report wednesday get newsletter deliver inbox more info product service privacy policy term userh share be area messy consolidation stock swing day move average late april stock have be uptrend gain monday retail strategy build enormous showroom space have buck trend create smaller format store focuse commerce amazon share surface appear have form cup handle base edge higher base be not quite week long minimum be consider true cup handle base handle less cup shape basis be week long look entry point amazon share investor want stock clear post earning peak be interested facebook ceo hot seat again tjx intuit earning investing action planbest buy target lead retail earning splunk top tech investing action planross store kohl best buy headline busy week retail earningsretail commerce stock industry news
7,ROST,option trading continue grow popularity bullish call option buyer have plenty earning report consider come week option trading be busy retail sector several top rate name healthy chart release result heel strong earning macy latest week department
8,ROST,here weekly investing action plan need know investor come day best buy bby target tgt ross store rost lead busy week retail earning splunk splk veeva system veev com wuba pure storage pstg lead tech earning week top player space industry
9,ROST,retail stock be dicey bunch several name be move higher ahead week full key earning report include target tgt best buy bby walmart wmt ross store rost specialty retail etf direxion retail bull retl target rise stock market today swiftly retake day move average baird analyst reiterate confidence big box chain outperform rating price target retailer report result early be build flat base entry point walmart have recently nail deal acquire stake india flipkart rise strive retake day level recently crossed longer term day share haven come air day mid february walmart report thursday best buy clear buy point handle cup handle base average volume share rise share have be climb steadily last week so meanwhile price chain ross store briefly surpass entry monday emerge cup handle base ross store stock close slow trade best buy ross report earning next thursday direxion retail bull hit month high charge higher session retail rally top holding thrice leverage retail etf include guess ge finish line finl dsw dsw dick sporting good dks other specialty retailer move come department store macy jwn penney jcp ready disclose quarterly result thursday friday be interested ink isn dry walmart flipkart deal ipo come yearswalmart home depot tencent cisco earning investing action planwalmart tap postmate grocery delivery amazon rev los angelesindex close high resilient session trump back iran invest stock market start simple routine
10,ROST,thursday genesco gco earn positive adjustment relative strength rs rating look best stock buy watch keep close eye relative price strength ibd proprietary rs rating identify technical performance used worst best score indicate stock price action trail week compare rest market history reveal best stock tend have better rs rating early stage move see genesco continue show renew price strength clear threshold look winning stock try simple routinegenesco be not currently offer proper buy opportunity see stock go build sound pattern kick new climb company report earning growth last quarter sale gain come company earn rank peer retail apparel shoe accessory industry group lululemon athletica lulu burlington store burl ross store rost be top highly rate stock group get newsletter deliver inbox more info product service privacy policy term useget instant access more trading idea exclusive stock list ibd proprietary rating only also stock be show rise relative strength use ibd relative strength rating relative strength line help judge stock
11,ROST,putt together watch list focus stock higher rs rating gap gps just meet criterium new score look best stock buy watch factor watch closely be relative price strength proprietary rating identify technical performance used worst best score identify stock price performance last week match other publicly trade company decade market research reveal market biggest winner often have rs rating least begin biggest run see ibd help make more money stocksgap be try complete consolidation buy point see break heavy volume ep growth decline company most recent performance report sale rise prior report company hold rank peer retail apparel shoe accessory industry group lululemon athletica lulu burlington store burl ross store rost be top highly rate stock group get newsletter deliver inbox more info product service privacy policy term also ibd stock rating upgrade rise relative strengthwhy use ibd relative strength rating relative strength line help judge stock
12,ROST,friday gap gps receive upgrade relative strength rs rating re research best stock buy watch keep close eye relative price strength exclusive rating investor business daily track market leadership worst best score grade show stock price movement last week hold other stock database decade market research reveal stock go make biggest gain tend have rs rating north launch biggest climb look best stock buy watch start heregap be build consolidation buy point see stock break volume least higher normal ep growth drop company most recently report quarter sale grow prior report company earn rank peer retail apparel shoe accessory industry group lululemon athletica lulu burlington store burl ross store rost be top highly rate stock group get newsletter deliver inbox more info product service privacy policy term also ibd stock rating upgrade rise relative strengthwhy use ibd relative strength rating relative strength line help judge stock
13,ROST,welcome move child place plce see relative strength rating improve wednesday re research best stock buy watch keep close eye relative price strength ibd proprietary rs rating track market leadership show stock price action last week compare other stock database decade market research show top perform stock often have rs rating north begin largest run see child place continue show renew price strength clear threshold see ibd help make more money stocksnow be not ideal time jump isn proper buy zone see stock go form consolidation break child place report ep growth latest quarterly report sale growth come company hold rank peer retail apparel shoe accessory industry group lululemon athletica lulu burlington store burl ross store rost be top highly rate stock group get newsletter deliver inbox more info product service privacy policy term also stock be show rise relative strength use ibd relative strength rating relative strength line help judge stock
14,ROST,here weekly investing action plan need know investor come week earning season start kick jpmorgan chase jpm citigroup well fargo wfc strong earning be expect bank index component generally investor focus continue especially trump trade
15,ROST,last week rally lead nasdaq composite signale stock market be look healthier stock sector be likely lead fang stock apple aapl facebook fb amazon amzn netflix nflx google parent alphabet googl generally have be perform well salesforce com crm other software stock have be winner payment stock be pocket strength many retail name lululemon lulu tjx tjx have be strong energy stock chevron cvx marathon oil mro be do well be subject up down crude oil price biotechs be try make recovery biogen biib skyrocket friday positive alzheimer drug news meanwhile chip be still well high bad sign stock market rally financial be lows jpmorgan chase jpm citigroup well fargo wfc kick earning season friday dow future rise vs fair value future climb nasdaq future be fair value keep mind dow jone future other overnight action doesn always translate actual trading next regular session china shanghai composite roar higher monday tumble bear market recent week hong kong hang seng advanced japan nikkei european market show modest gain intraday last week holiday shorten week stock market average be volatile ultimately rally nasdaq composite rally dow jone friday post job post china tariff rally be particularly significant haven already read latest big picture column get newsletter deliver inbox more info product service privacy policy term stock market come pressure trump trade war tariff threat past several week president donald trump friday impose tariff worth chinese good quickly match beij trump also threaten tariff virtually chinese import now wall street have decide trump trade impact have be price stock look nasdaq composite last several month tech heavy index look break june rally few week then erased gain rebound again last week day move average index dow jone have be consolidate late january somewhat better shape stock even top stock tend track broader stock market sector rotation china internet software stock energy name have left many individual stock chart look more volatile amazon stock especially netflix stock have be biggest stock market winner facebook stock scandalous spring be record high slightly extend buy point apple stock be buy range double bottom entry dow jone component have pull back day line be work new consolidation alphabet googl be buy point low volume last month hit resistance old high software account top group industry ibd track more be top buy hold individual software stock have be challenge salesforce top stock rank enterprise software group stage low volume early then promptly undercut buy point didn trigger loss trigger automatic sell end follow quarterly earning salesforce stock be back buy range be now modestly extend meanwhile stock do trigger loss sell rule workday wday red hat rht other round trip double digit gain such qualys qlys software stock watch okta okta april cybersecurity ipo be find support day move average first time late april solid gain heavy volume offer buy opportunity alternatively okta continue consolidate few week form new base buy point collaboration software maker atlassian team break last october anyone hold atlassian stock then be sit pretty then stock have stage few fail breakout still moved generally follow day atlassian stock be once again find day support need least week form proper base lululemon athletica canada goose goos be trendy apparel retail stock have boom specialty discounter such tjx be fare well too tjx rival ross store rost stock buy range currently dollar general dg be set buy point improve job market trump tax cut have fuel consumer wallet confidence most retailer also aren expose trump trade war europe china other energy stock be tricky play tend rise fall crude price refiner tend benefit wider crack spread crude gasoline price eog resource eog recent ibd stock day break early run couple week crude future rally eog stock pull back buy point find support day line june crude also backed multiyear high eog resource know apple oil be set new base crude hit best level marathon oil ibd stock day also break early run marathon oil stock also pull back day line never undercut buy point share be now flat base base base formation biogen shot nearly friday race cup base entry vertex pharmaceutical vrtx also be close buy point biogen vertex pharma have relative strength line improve be downtrend several month relative strength line track stock performance vs indexnotable biotech etfs include ishare nasdaq biotech ibb triple lever direxion daily biotech bull labu also be approach possible buy point rs line have make much headway past year payment stock have be pocket strength mastercard dow jone component visa have be consolidate record high few week find support day week line square sq have also be act well paypal pypl be close record high recent fizzle rs line have be go sideway late get instant access more trading idea exclusive stock list ibd proprietary rating only also stock have rs line high include ipo breakoutdon discount top stock buy leader qualys rebound sell many top growth stock be form basis now ibd stock day near new buy point run
16,ROST,retail stock be rally stock market didn set record first half brewing trade war rise interest rate market due serious consolidation gnaw investor confidence backdrop rebound retail stock come surprise retail industry group
