,ticker,content
488,ROST,never mind let snow head crucial holiday shopping season retailer be more likely singing let go movie frozen try shake disappointing quarterly earning result bad week collectively sank merchant stock jwn macy penney co jcp kohl kss be report week nov macy turn weak result discount forecast penney kohl share fall beating consensus view october retail sale datum miss expect gain didn help amazon amzn other commerce seller notably logged rise previous year consumer continue do much shopping online cowen co predict july amazon knock macy top apparel retailer even much laud pricer haven be immune pummeling retail stock be subject past week share tjx tjx parent company maxx marshall homegood lose past week possible sign thing come same store sale price arm rack fall type miss rack be surprising acknowledge rack price slowdown be negative indicator tjx write cowen co analyst oliver chen friday add tjx report tuesday offset secular weakness base few factor include strength company sourcing buy team home good offering international reach company be expect report slight earning dip cent share mark third straight quarter earning deceleration swing earning gain precede period revenue be see rise also reflect slowdown ibd composite rating tjx be highest ranking member ibd retail apparel shoe accessory group rank feeble group peer group include ross store foot locker fl brand lb american eagle outfitter aeo fellow pricer ross store rost gap ahead thursday earning release lose week analyst expect ep growth cent sale growth big box retailer target tgt earning be see accelerate predict climb cent share revenue dip share retreat last week wall street expect wal mart wmt earning slide cent share revenue decline share slide believe retail be state transition brand wrestle compete grow dynamic pureplay online retailer write chen related retail sale weak amazon ecommercemacy stock selloff be tip iceberg reason tjx price retailer keep surge
489,ROST,back basic apparel maker high fashion take back seat underwear sock legging fitness clothing shift consumer buy trend basic athletic inspire casual wear have put spotlight everyday innerwear activewear focuse company such hanesbrand hbi iii apparel giii cherokee chke columbia sportswear colm not
490,ROST,stock future be lower steady ahead friday open market start pack bag day weekend
491,ROST,dow future trade point fair market value nasdaq future future be bit more point apiece small cap show weakness russell future point
492,ROST,stock china rolled higher friday europe market be mixed tracking sizeable gain week contrast stock market today open vs overseas market deserve quick review
493,ROST,nasdaq start friday week be almost higher dow be effectively flat market europe asia other hand be post sizeable gain week term behavior past month overseas market find similar foot
494,ROST,europe market be briskly mixed midsession friday cac paris tracking gain week frankfurt dax ahead vs last friday close market be make lose ground correct respectively april high
495,ROST,london market ease late april high be trading week london be just fraction april high paris be line frankfurt be hole
496,ROST,shanghai composite vault friday seize gain week have just break new high thursday steep correction april
497,ROST,hong kong hang seng bang gain friday end week remain april high correct
498,ROST,japan tokyo nikkei add friday weekly gain edge new high wednesday take back pullback
499,ROST,inched narrowly new high week pullback nasdaq be fraction april high follow consolidation question be momentum china europe maintain rebound follow lead bog
500,ROST,economic news
501,ROST,mixed read inflation consumer price inched april lift labor department consumer price index gain be less march increase line analyst forecast price food fuel rise march gain well consensus expectation gain
502,ROST,fed chairwoman janet yellen be schedule give outlook economy speaking providence et
503,ROST,stock
504,ROST,hewlett packard hpq drift less higher report fiscal result late thursday retailer be generally quiet wild week quarterly report ross store rost tick fraction mixed report gap gps dip narrowly report aeropostale aro be sore spot diving disappointing quarter
505,ROST,deere climb more ahead open farm construction equipment maker report much stronger forecast fiscal earning revenue slip more expect full year guidance be mixed stock have be flat line high
506,ROST,china elong long surge ctrip com ctrp jump expedia expe announce sell stake elong
507,ROST,large portion sale go ctrip report purchase equity stake call center online travel reservation service expedia share dip fraction premarket trade ctrip break deep cup handle base week end thursday not quite buy point
508,ROST,foot locker fl jump earning beat revenue meet analyst consensus view comparable store sale increase better project gross margin pop basis point stock end thursday buy range just buy point week flat base
509,ROST,currency commodity
510,ROST,dollar ease friday finished week bit more vs euro oil slip early friday putt west texas intermediate week brent crude slip fraction vs last friday settle price gold edge friday be flat week year yield dip bit friday trading basis point week stock future be lower steady ahead friday open market start pack bag day weekend dow future trade point fair market value nasdaq future future be bit more point apiece small cap show weakness russell future point stock china rolled higher friday europe market be mixed tracking sizeable gain week contrast stock market today open vs overseas market deserve quick review nasdaq start friday week be almost higher dow be effectively flat market europe asia other hand be post sizeable gain week term behavior past month overseas market find similar foot europe market be briskly mixed midsession friday cac paris tracking gain week frankfurt dax ahead vs last friday close market be make lose ground correct respectively april high london market ease late april high be trading week london be just fraction april high paris be line frankfurt be hole shanghai composite vault friday seize gain week have just break new high thursday steep correction april hong kong hang seng bang gain friday end week remain april high correct japan tokyo nikkei add friday weekly gain edge new high wednesday take back pullback inched narrowly new high week pullback nasdaq be fraction april high follow consolidation question be momentum china europe maintain rebound follow lead bog economic newsin mixed read inflation consumer price inched april lift labor department consumer price index gain be less march increase line analyst forecast price food fuel rise march gain well consensus expectation gain fed chairwoman janet yellen be schedule give outlook economy speaking providence et stockshewlett packard hpq drift less higher report fiscal result late thursday retailer be generally quiet wild week quarterly report ross store rost tick fraction mixed report gap gps dip narrowly report aeropostale aro be sore spot diving disappointing quarter deere climb more ahead open farm construction equipment maker report much stronger forecast fiscal earning revenue slip more expect full year guidance be mixed stock have be flat line high china elong long surge ctrip com ctrp jump expedia expe announce sell stake elong large portion sale go ctrip report purchase equity stake call center online travel reservation service expedia share dip fraction premarket trade ctrip break deep cup handle base week end thursday not quite buy point foot locker fl jump earning beat revenue meet analyst consensus view comparable store sale increase better project gross margin pop basis point stock end thursday buy range just buy point week flat base currency dollar ease friday finished week bit more vs euro oil slip early friday putt west texas intermediate week brent crude slip fraction vs last friday settle price gold edge friday be flat week year yield dip bit friday trading basis point week
511,ROST,unit count ross store rost be largest price apparel home fashion chain yet have few store northeast none dense new york city market only last few year have begin open store midwest huge shopping void be big reason
512,ROST,tuesday ibd group top industry group be retail sector decent representation match medical sector leadership retail apparel shoe accessory grip spot tuesday be week let look top player group judge composite rating
513,ROST,brand lb report thursday sale month march be positively impact earlier easter year
514,ROST,parent victorium secret bath body work henri bendel say net sale week end april increase
515,ROST,comparable store sale period jump positive impact percentage point percentage point easter holiday
516,ROST,retail metric have estimate brand show rise same store sale month
517,ROST,share fall initially climb stock market today stock be buy range flat base buy point
518,ROST,brand have ibd composite rating mean share outperform stock market measure fundamental technical factor factor be earning sale growth profit margin return equity relative price performance
519,ROST,retail apparel shoe accessory group be rank industry group ibd track be lead ross store rost cr foot locker fl cr lululemon lulu cr
520,ROST,follow alissa william twitter ibd_awilliam
521,ROST,related
522,ROST,march retail sale see hurt weather currency hit brand lb report thursday sale month march be positively impact earlier easter year parent victorium secret bath body work henri bendel say net sale week end april increase comparable store sale period jump positive impact percentage point percentage point easter holiday retail metric have estimate brand show rise same store sale month share fall initially climb stock market today stock be buy range flat base buy point brand have ibd composite rating mean share outperform stock market measure fundamental technical factor factor be earning sale growth profit margin return equity relative price performance retail apparel shoe accessory group be rank industry group ibd track be lead ross store rost cr foot locker fl cr lululemon lulu cr follow alissa william twitter ibd_awilliam related march retail sale see hurt weather currency hit
523,ROST,factory outlet aren provide sizzle retailer used face greater competition price retailer such tjx co tjx ross store rost burlington store burl commerce venue include flash sale site also be threat even traditional mall greater number promotion be take away thunder factory outlet accord
524,ROST,apple be handful lead big cap stock have post accelerate sale profit growth recent quarters big cap stock tend be lumbering giant sale profit growth stick single digit many stock big cap screen be act more growth stock profit sale rise pace better
525,ROST,apple aapl profit have rise past quarters sale period have grow impressive company market capitalization
526,ROST,ipad maker march edition big cap be past flat base buy point just buy range
527,ROST,analog device adi be several chipmaker big cap screen
528,ROST,profit rise latest quarter follow gain prior quarters sale growth have accelerate straight quarters latest period
529,ROST,analog have composite rating make leader stock semiconductor manufacturing industry be rank monday ibd rival big cap stock qorvo qrvo skywork solution swks lead group best possible rating
530,ROST,meanwhile discount retailer ross store rost have see profit increase pick straight quarters follow modest decline fiscal first quarter last year sale growth have also accelerate span rise latest period
531,ROST,ross be extend clear buy point flat base last month be trading tight fashion bullish gap heavy volume feb latest quarterly earning report top expectation
532,ROST,qorvo big cap stock leader be featured last week column have rise buy range clear entry march heavy volume profit growth rival post best growth stock soar triple digit pace more straight quarters
533,ROST,qorvo base north carolina oregon still sport accumulation distribution rating indicate strong demand share relative strength line also continue hit new high
534,ROST,skywork too have outperformed many growth stock have market cap stock have rise straight week be far buy point
535,ROST,profit growth have picked straight quarters follow decline fiscal profit latest quarter jump beating wall street estimate
536,ROST,sale growth have accelerate straight quarters soar latest period skywork relative price strength rating remain best possible rating be apple be handful lead big cap stock have post accelerate sale profit growth recent quarters big cap stock tend be lumbering giant sale profit growth stick single digit many stock big cap screen be act more growth stock profit sale rise pace better apple aapl profit have rise past quarters sale period have grow impressive company market capitalization ipad maker march edition big cap be past flat base buy point just buy range analog device adi be several chipmaker big cap screen profit rise latest quarter follow gain prior quarters sale growth have accelerate straight quarters latest period analog have composite rating make leader stock semiconductor manufacturing industry be rank monday ibd rival big cap stock qorvo qrvo skywork solution swks lead group best possible rating meanwhile discount retailer ross store rost have see profit increase pick straight quarters follow modest decline fiscal first quarter last year sale growth have also accelerate span rise latest period ross be extend clear buy point flat base last month be trading tight fashion bullish gap heavy volume feb latest quarterly earning report top expectation qorvo big cap stock leader be featured last week column have rise buy range clear entry march heavy volume profit growth rival post best growth stock soar triple digit pace more straight quarters qorvo base north carolina oregon still sport accumulation distribution rating indicate strong demand share relative strength line also continue hit new high skywork too have outperformed many growth stock have market cap stock have rise straight week be far buy point profit growth have picked straight quarters follow decline fiscal profit latest quarter jump beating wall street estimate sale growth have accelerate straight quarters soar latest period skywork relative price strength rating remain best possible rating be
537,ROST,burlington store burl surpass fourth quarter earning revenue expectation offer conservative guidance full year price apparel retailer earn share gain last year analyst poll thomson reuter have project revenue increase beating forecast share climb fresh
538,ROST,presidential campaign mercifully come end let briefly look back large publicly trade company candidate have trash democrat hillary clinton denounce well fargo wfc fake account scandal accuse valeant pharmaceutical vrx mylan myl price gouge upbraided auto part maker johnson control jci tax inversion merger republican
539,ROST,here investing action plan friday need know investor come day jpmorgan chase jpm citigroup well fargo wfc report earning investor keep close eye federal reserve chairwoman janet yellen share price retailer ross store rost stock watch retail sector have be
540,ROST,economy add job september come modestly expectation labor department say friday jobless rate rise job gain initially report august be revise prior month be revise report be unlikely shift federal reserve december timetable hike key interest rate hike november just election be see doubtful market have be edge lately possibility faster expect hike year treasury yield close month high thursday do use online broker now chance tell well need be meet ibd annual investor survey broker performance be underway click take survey now stock open modestly higher close lower nasdaq lose average hourly earning rise september year just cycle high hourly wage growth marked july recent month company have be raise wage talk rise still moderate wage pressure jpmorgan chase jpm starbucks sbux wal mart wmt have hike minimum wage wendy wen ross store rost chipotle grill cmg other have say re pay more compete top talent incentivize performance keep minimum wage law workweek tick higher hour sink summer suggest bit less slack labor force indicated august report same line household survey show person enter workforce last month increase participation rate rise jobless rate recent month come more person joined workforce report have job even latter number grow ibd take tell job report be too hot too cold just right market react negatively positively day report key investor be stay abreast market prevailing trend visit ibd university primer time stock market read big picture column day weaker expect report isn likely trouble fed most policymaker think be close full employment point job gain only need match net addition workforce else wage inflation pressure intensify john william president san francisco federal reserve layer case monthly job gain slow back august current pace job gain be well need put be somewhere month estimate range william add expect pace job gain slow be alarm do more job report fed meet dec economist be say take weak report row derail year end hike related goldilock economy be shrink come job
541,ROST,trade top brass facebook fb nvidia nvda qualcomm qcom electronic art ea palo alto network panw ross store rost lead week insider activity ceo mark zuckerberg file sale share facebook worth sale be make day zuckerberg initiative announce plan invest help cure disease end century zuckerberg wife priscilla have previously say plan give away facebook share worth lifetime philanthropic cause share facebook have be move sideway breaking flat base earlier month end week right buy point related shale breakout gush facebook alphabet tease friday investing action planibd take echo messenger bot siri cortana be awful lot little ai helper read ibd latest cover story more amazon echo facebook bot apple siri spruce digital butler board member tench coxe sell share nvidia value accord sec filing week graphic chipmaker debut new artificial intelligence chip xavier autonomous vehicle nvidia chip be find car tesla motor tsla honda hmc bmw mercede benz other nvidia share gain week climb steadily upward related nvidia debut new ai supercomputer chip self drive carsnvidium provide graphic chip apple mac derek aberle sell share company worth sale come report qualcomm be talk acquire nxp semiconductor nxpi qualcomm share be week nxp have shot nearly vs week related apple alphabet qualcomm pt hike amazon tout netapp upgradednxp semiconductor rocket qualcomm acquisition reportceo andrew wilson dispense share video game publisher tune accord thursday sec filing ea other video game publisher activision atvi netease nte have be hit new high console cycle remain solid digital revenue grow ea share be week stock be now extend buy range breaking flat base entry point mid august related netease ea activision pioneer new gaming spaceelectronic art hit new high good fifa cybersecurity firm president mark anderson sell share palo alto network share be week retake day mid september sag close day late last month disappointing guidance peer fireeye feye cyberark cybr be trading day line related cyberark security focus mega hack privileged access marketpalo alto network deceleration worry investor stock downceo barbara rentler president james fassio file sale share rentler selling share fassio let go price chain be outperformer often struggle retail peer analyst point treasure hunt appeal shopping pricer lead return foot traffic share be week be build flat base entry point tjx tjx share be related apply material guide high ross beat gap view transaction don typically have major impact stock indicate major pending news rapid liquidation most insider holding however affect stock
542,ROST,retailer aren particularly highflying group right now perhaps worth keep eye share jwn child place plce break resistance day line thursday gain come mixed economic datum thursday commerce department report august retail sale fall july forecast dip clothing store see gain general merchandise store see flat sale department store see decline july stock rebound day line moved short term day average share rise stock market today rival macy only see uptick macy also remain day day line high end department store report profit exceed expectation last month retailer broadly rally better anticipate quarterly result meanwhile kid clothing retailer child place rise day line day stock be form cup shape base late spring early summer fail properly break share jump ibd take clear entry point thursday current market environment mean buy be risky learn properly evaluate basis time buy read ibd university buy stock ibd retail department store group member segment include macy jcpenney jcp other be well collective high reach april child place be member ibd retail apparel shoe accessory group be collectively day line look find support day star pricer tjx tjx ross store rost be also member related jcpenney beat add retail stock relief rallyamerican eagle comp slow child place lift outlook
543,ROST,wall street economist expect friday job report show economy add job august jobless rate dip be solid gain not likely strong enough prompt federal reserve raise interest rate september meeting especially thursday surprisingly weak ism manufacturing index other detail also be key happened workweek averaged hour latest report do wage growth rise july annual rate anything wage growth be likely surprise upside start july jpmorgan chase jpm teller starbucks sbux barista get significant bump pay wendy wen ross store rost chipotle grill cmg other have say corporate earning call re pay more compete top talent incentivize performance keep minimum wage law be anecdotal report federal taxe withhold paycheck broadest gauge health job market be grow fastest rate month so take prompt fed action later month instead wait december next hike market currently expect have be real blockbuster trip september move say dan north chief economist trade credit insurer euler herme north america qualify blockbuster north view mean new job strong wage growth increase hour increase participation wage hour participation provide signal much slack remain labor market element report signal weakness north figure addition job august be need provoke fed act next meeting ibd take wage growth pick investor want focus company strong enough position market withstand labor inflation suffering hit profit margin read investor corner study profit margin check ibd stock checkup see stock rate fed policymaker have say economy be close full employment point theory suggest employment growth exceed growth labor force increase upward pressure wage report week well fargo chief economist john colleague estimate job growth month now reduce labor market slack lower be slower growth potential labor force baby boomer retire slowdown job creation very well be need avoid overheat cause fed tighten policy faster expect well fargo team write
544,ROST,august job gain miss expectation slow july headline figure still look decent even better wall street mean federal reserve take time raise interest rate yet look surface reveal something entirely different be worst job report datum be accurate economy be much shape commonly believe yet go ugly detail consider contrary signal start july jpmorgan chase jpm teller starbucks sbux barista get significant bump pay wendy wen ross store rost chipotle grill cmg other have say earning call re pay more compete top talent incentivize performance keep minimum wage law be anecdotal report federal taxe withhold paycheck broadest gauge health job market be grow fastest rate month now here wrong latest job report problem isn primarily job growth have decelerate wage gain also slow average workweek be now shorter time economy be still get back foot count blizzard hit month winter workweek be equally short ibd take job report say wage have be trend higher likely continue economy near full employment investor want focus company strong enough position market withstand labor inflation suffering hit profit margin read investor corner profit margin check ibd stock checkup see investment rate most important number report isn net number new job number combine total number job economy length workweek average hourly wage here shock aggregate weekly payroll essentially sum total private sector pay earn week grow just year august weakest gain september gain match level see unusually stormy december biggest culprit be length average workweek be revise july hour hour then fall hour august here mean combine modest deceleration job creation total number hour work economy rise just year smallest increase july comparison total hour work have grow least vs year past year august job report meanwhile average hourly wage grow just august annual rate increase slow upwardly revise july just last month add job paltry wage growth last month drop hour meant aggregate pay fall august july bottom line be detail reflect reality purchasing power american consumer have get pinch help explain fast food chain mcdonald mcd have see sale growth slow retailer target tgt see decline same store sale also possible company face margin pressure tough competition higher wage have curtailed work hour still labor department datum be subject revision tax datum be signale faster rise aggregate pay so doesn make sense jump negative conclusion related slower august job growth keep fed hold septembera company step wage hike tax receipt get lift
