,ticker,content
802,TIF,much focus economic datum lately be anticipation fed meeting tuesday wednesday next week odd be basically seed versus interest rate be go basis point jay powell inaugural session new fed chair mostly analyst appear be look sign inflation accelerate current economy yet signal be happen see something else walk sentiment back take morning housing start permit report example see pullback measure month february new start forward indicate permit downturn permit meet estimate exactly start be roughly double loss analyst be expect last month new seasonally adjust annualize housing start be initiate permit be sign datum have plenty information fold often headline be somewhat mislead result today report single family start actually go be multus family unit be lag betray disappointment here single family unit be generally higher value thus sign economy strengthen further then again have see big growth start permit last month have see evidence pre market inflation interest rate jitter major index don dow look open point nasdaq have yet get mat week be trading ahead bell point top estimatesluxury retailer co tif free report report earning ahead bell today beating zack consensus bottom line cent share revenue top expect figure represent growth bottom line top guidance full year be push measurably zack estimate share range trader look be selling news however share be trading today pre market more tif earning click here https www zack com stock quote tif detailed estimate
803,TIF,earning season last stretch
804,TIF,don have much term earning release thanksgiving day week still have company release result include member earning season be mostly result member index total membership already know most week report be come tuesday include hewlett packard hpq free report tif free report hormel food hrl free report end week have see result member
805,TIF,overall verdict earning season be favorable particularly relative last few quarters fact actual result have be better relative lower pre season expectation be surprise give management team impressive track record promising deliver be still not much growth most company be still guide lower prompt estimate come little growth have thus far be better have see recent quarters keep record earning season appear track new quarterly record total earning surpass level achieve
806,TIF,retail sector have be focus lately broadly underwhelm guidance wal mart wmt free report target tgt free report best buy bby free report other point soft holiday shopping season sector even earning report retailer know consumer spending growth have decelerate know gdp report personal consumption expenditure be only growth pace low growth environment force retailer rely promotional effort grab more consumer dollar sum drive market share company gain be loss typically drife margin everyone
807,TIF,look way wal mart sub par outlook not solely be function pressured household finance also reflective hyper competitive retail environment operator amazon amzn free report be more willing sacrifice margin more sale wal mart refer competitive dynamic earning call apparently more offset beneficial effect recent downtrend gasoline price earning scorecard friday
808,TIF,total earning company have report result be beating earning expectation total revenue company be be beating top line expectation table show current earning scorecard
809,TIF,be better performance same group company report quarter average see chart earning revenue growth rate company be notably better see same group company quarter average
810,TIF,recent quarters finance sector isn drive growth total earning growth outside finance compare earning decline average decline precede quarters improve growth technology basic material transportation sector account positive ex finance variance relative recent past
811,TIF,total earning technology sector market capitalization have report result already be same period last year compare earning decline quarter average
812,TIF,medium industry level level have industry technology sector only telecom service hasn report result yet growth picture have improve other industry improvement particularly notable software service semiconductor industry industry combine account sector total earning
813,TIF,strong earning growth google goog microsoft msft free report account positive growth profile software service industry account big part tech sector positive growth picture exclude company form tech sector tally sector total earning growth drop
814,TIF,total earning computer office equipment industry biggest industry sector accounting almost sector total earning be same period last year primarily drive tough comparison apple aapl still better performance industry be able achieve recent quarters apple negative year year comparison have be big drag sector growth picture exclude apple total earning tech sector be include company
815,TIF,total earning basic material sector be higher revenue improvement sector growth number be primarily function easy comparison particularly sector dominant chemical industry total sector earning come chemical fertilizer industry chemical industry earning be stage largely due easy comparison dow chemical dow dow miss guide lower total earning be year year composite growth picture
816,TIF,total earning whole combine result have report estimate remain be growth higher revenue compare earning growth revenue
817,TIF,only zack sector be expect have double digit earning growth consumer discretionary construction transportation auto aerospace exclude finance total earning be expect be higher revenue be decline total earning higher revenue estimate come
818,TIF,estimate have start come still have plenty room go reach reasonable level chart show estimate have evolved recent week
819,TIF,investor seem be fine current record level earning provide enough justification stock market time record level have see justification work once fed start get qe suspect happen early december irrespective fed start taper stock market need stronger earning growth come quarters have see recent past maintain recent momentum
820,TIF,more detailed look overall earning picture please check weekly earning trend report click here here be list company report week include member
821,TIF,company ticker current qtr year qtr last ep surprise report day timeseadrill ltd sdrl monday btodycom ind dy monday amccopart inc cprt monday comm inc nuan monday amcculp inc cfi monday amcperfect world pwrd monday amcfifth street fi fsc monday amcqihoo tech qihu monday bto gp adr vnet monday amcnavio mari hld nm monday btopalo alto netwk panw monday amcnj resource njr monday btoworkday inc wday monday amchasting entmt hast monday btohewlett packard hpq tuesday amcpall corp pll tuesday btoanalog device adi tuesday co tif tuesday btohormel food cp hrl tuesday btochildren place plce tuesday btocracker barrel cbrl tuesday btomovado grp inc mov tuesday btobeacon roofing becn tuesday btobrown shoe co bws tuesday btoeaton vance ev tuesday btodsw inc cl dsw tuesday btosignet jeweler sig tuesday avav tuesday amctillys inc tlys tuesday amcchico fas inc ch tuesday btofred inc fred tuesday btoshanda game adr game tuesday amcamer woodmark amwd tuesday btoqad inc qada tuesday amcltx credence cp ltxc tuesday btolaclede grp inc lg tuesday btoinfoblox inc blox tuesday amcbarne noble bks tuesday btotivo inc tivo tuesday amcciti trend inc ctrn tuesday btostar bulk carr sblk tuesday btoja solar holdgs jaso tuesday btozale corp new zlc tuesday amcldk solar co ldk tuesday btoisle capri isle wednesday btorenren inc adr renn wednesday amcfrontline ltd fro wednesday bto
822,TIF,benchmark close record high tuesday senate advanced republican tax bill be see major stride implementation tax reform further jerome powell comment follow yellen path term monetary policy also boost investor sentiment hiatus month north korea test yet missile tuesday such event weigh investor sentiment partly pare gain market lastly consumer confidence hit year high drive upward broadly encourage economy dow jone industrial average djia increase close index inx gain close tech laden nasdaq composite index ixic close increase advancer outnumber decliner nyse nasdaq advance issue outnumber decline one cboe vix decrease close senate vote republican tax billin vote tuesday senate budget committee advanced tax bill propose member gop senator bob corker ron johnson also vote favor bill interestingly republican have earlier be skeptical success such tax reform framework object openly most important facet bill seek reduce corporate tax rate economist be estimate full senate vote be reach thursday such development take president trump step closer push tax reform development also boost investor sentiment north korea launch geopolitical tension washington pyongyang seem have ebb kim jong regime test ballistic missile icbm tuesday test come hiatus month launch be confirm yonhap news agency south korea report news agency north korea launch missile be local time pm travelled mile landing water korean peninsula japan retaliation south korea also fire missile surround water order let north korea know also be take fire interview fox news pentagon spokesperson robert man iii comment latest missile launch pyongyang do not threat north america territory ally do benchmark perform dow amassed almost point finish record high buoy gain notch jp morgan jpm share surge moreover progress tax bill also boost market further jerome powell select trump post fed chief comment choose not deviate path fed current chief janet yellen have layer powell mentioned continue work raise interest rate same time gradually unwinding fed humungous balance sheet such comment powell boost financial stock sector post best performance mar see complete list today zack rank strong buy stock here financial select sector spdr etf xlf spdr bank exchange trade fund kbe surge respectively moreover gain point gain be boost primarily financial stock major segment end positive territory finally nasdaq gain point end green consumer confidence hit year highconsumer confidence november come surpass previous month read consensus estimate period be be highest level november economist believe such read be achieve broadly encourage economic condition economy be full throttle gdp hit growth consecutive quarters lastly also spiked consumer confidence be fact unemployment unite state be year low stock make earning sale top estimate view intacttiffany co tif free report post sixth straight quarter positive earning surprise report third quarter fiscal result read more shell resume full cash dividend payment oil revivalshare european oil giant royal dutch shell plc rd free report rise yesterday company announce plan resume full cash dividend payout share repurchase program read more exxonmobil hebron project come online ahead corporation xom free report have commence production hebron project ahead schedule read more investor alert breakthrough pendinga medical advance be now flashpoint theory realization billion dollar research have pour company be already generate substantial revenue even more wondrous product be pipeline cure variety deadly disease be sight so be big potential profit early investor zack name stock buy now click here see
823,TIF,co tif free report post sixth straight quarter positive earning surprise report third quarter fiscal result designer retailer fine jewelry post quarterly earning cent share beat zack consensus estimate cent increase approximately year period account higher sale improve margin net sale come record prior year quarter come ahead zack consensus estimate company register sturdy sale fashion jewelry high fine solitaire jewelry category however comparable store sale comp decline constant currency worldwide net sale jump omni channel platform store expansion program tap new market venture new revenue generate avenue bode well stock so far year company share have increase industry decline let delve deepby geographic segment sale americas climb comp also increase equivalent rate sale asia pacific region surge comp grow sale japan decline comp also decline same rate sale europe come comp decrease other sale come comp increase gross margin expand basis point quarter account favorable product input cost partially offset rise wholesale sale diamond operate margin increase basis point co price consensus ep surprise co price consensus ep surprise co quotestore updatein first month fiscal year have open store shutter location oct company operated store americas asia pacific japan europe management now anticipate gross retail square footage growth opening relocation closing other financial detailstiffany carry zack rank buy end quarter cash cash equivalent short term investment total short term long term debt reflect shareholder equity quarter company repurchase approximately share average cost share oct company have remain buyback program run jan management anticipate capital expenditure band expect generate free cash flow approximately fiscal continue anticipate fiscal earning share increase high single digit percentage fiscal earning however expect earning jump mid single digit percentage adjust earning share report fiscal now envision fiscal year net sale increase low single digit percentage report constant exchange rate basis want know gem retail space urban outfitter inc urbn free report deliver average positive earning surprise trail quarters have long term earning growth rate carry zack rank strong buy see complete list today zack rank stock here zumiez inc deliver average positive earning surprise trail quarters company have long term earning growth rate carry zack rank home depot inc hd free report deliver average positive earning surprise trail quarters have long term earning growth rate carry zack rank investor alert breakthrough pendinga medical advance be now flashpoint theory realization billion dollar research have pour company be already generate substantial revenue even more wondrous product be pipeline cure variety deadly disease be sight so be big potential profit early investor zack name stock buy now click here see
824,TIF,retail industry have be force keep pace evolve consumer buy habit consumer today be knowledgeable more inquisitive choosier importantly today customer have numerous shopping option disposal store online mobile social medium so influence purchasing decision satisfying customer enrich buy experience require new strategy modern retail interestingly enough be new game new rule
825,TIF,retail food service sale datum sep be last year be marginally previous month accord census bureau retail food service sale rise year year decline sequentially
826,TIF,trend be expect rule retail sector go forward include increase technological solution incorporating customer feedback target additional audience product service omni channel retail new norm sluggish economy persistent weakness europe motivated retailer focus buyer need lure innovative product attractive discount free shipping ease shopping smartphone tablet however effort fail pay retailer feel need better channel connect customer
827,TIF,give rise omnichannel approach focus provide more touch point multiple channel customer approach facilitate use possible medium engage consumer include brick mortar store online mobile same time alternatively
828,TIF,strategy provide customer ease select purchasing exchange product multiple channel example customer select product online buy phone exchange same store hassle retailer be already benefit strategy include staple inc spls macy inc free report inc jwn free report chico fas inc ch free report personalize store experience evolution com era advancement consumer retailer be work hard reinvent marketing style gradually shift mass advertising promotion format more personalize method impress today omni channel customer consumer today seek more direct communication hence prefer interact executive smartphone app chat company moreover customer prefer tailor offer recommendation online well store increase use mobile wallet technology everything retail undergo sea change mode payment used shopping have also evolved drastically increase use smartphone tablet mobile technology have give rise new mobile application call mobile wallet customer be make payment instantly used smartphone tablet cash credit card remain primary payment method use mobile wallet be catch quickly mobile user convenience offer
829,TIF,popularity app customer be drive retailer adapt payment mode collaborate mobile wallet provider available market paypal google wallet square wallet dwolla more
830,TIF,recent stride direction lead car rental company avis budget group inc car free report fuse express rental service avis prefer google wallet application moreover paypal app have gain recognition wide array retailer include abercrombie fitch co anf advance auto part inc aap aeropostale inc aro american eagle outfitter inc aeo barne noble inc bks foot locker inc fl free report penney company inc jcp free report office depot inc odp free report technology friendly brick mortar store shopper increasingly become tech savvy brick mortar store need leave old fashion layout improvise adopt innovative store technology simplest way execute be implementation store mobile device customer make payment see product demonstration gather information connect social network
831,TIF,have be well demonstrated apple inc aapl equip associate iphone enable assist customer receive payment anywhere store reduce bill queue ensure efficient management space make store less congested
832,TIF,further retailer be explore new way use mobile device store be look develop mobile apps track customer shop send tailor offer related store section be recommend item base past purchase allow shopper program automate shopping list
833,TIF,store technology customer look day include mobile point sale price checker self checkout payment lane information kiosk digital signage etc other innovative technology prove effective engage customer store elsewhere be smart shelve wi fi hot spot point sale pos system virtual storefront endless aisle reinvention loyalty program loyalty program offer edge retailer customer keep come back more offer however age old reward program be lose popularity shopper offer be sometimes irrelevant benefit accumulation be slow
834,TIF,trend change industry retailer be now perk loyalty program replace loyalty card customize offer base social information behavioral pattern shopper frequently buy item other such detail retailer have show stringent focus enhance reward loyalty scheme include rite aid corp rad free report office depot many other impact social medium shopping decision grow use social networking site mass business firm have also enter social medium promote business social medium platform retailer advertise brand launch new product campaign company also offer mobile coupon exclusively platform largely influence shopper buy decision
835,TIF,additionally social networking site provide insight customer preference base interest expressed product featured site investing big datum track shopper grow need give personal attention shopper retailer be widely investing analysis software big datum help accumulate information regard behavioral pattern history background customer analysis datum facilitate prediction customer reaction formulate pricing strategy offer shopper specific discount provide personalize recommendation shopper
836,TIF,amazon com inc amzn be retailer have be involved datum analysis quite time now offer tailor product recommendation base customer previous purchase growth retail emerge market have tap most potential domestic market retailer have start venture emerge market most retail chain be witness grow demand product country brazil middle east china india aim grow exposure country time retailer venture market include gap gps free report ralph lauren corp rl free report corp vfc free report co tif free report bottom line
837,TIF,retailer be try remain competitive primarily shift focus long term horizon find innovative solution create value reduce operate cost mitigate risk enterprise
838,TIF,right sizing inventory enhance efficiency competence bring technological advancement be key agenda retailer be focuse moreover cost containment effort merchandise initiative improve margin be top priority
839,TIF,retail owing huge spectrum remain lucrative investment avenue investor change landscape wouldn kind operator concept require flawless execution part management team stay relevant day age industry hasn do much term stock price performance year trend likely remain place more
840,TIF,see be plenty reason be optimistic retail industry long term investing space right now
841,TIF,check latest retail industry outlook here more current state affair market earning perspective trend be look important sector economy now
842,TIF,want latest recommendation zack investment research today download best stock next day click get free report
843,TIF,earning preview earning season be wind do not mean be actually be start again next week bring earning report include member define first quarter fiscal period end february march april firm report actually be report first quarter earning february fiscal end higher profile firm report be best buy bby general mill gis free report oracle orcl free report co wag economic datum calendar also be light side focus be housing datum then end week get final number fourth quarter gdp light earning calendar relatively light datum calendar be plenty time focus really important stuff college basketball political development also help set tone market vote health care reform bill be likely happen weekend think vast majority market commentator have wrong market react positively passage negatively fail monday significant datum be due be release know open bell health care reform have pass not tuesday exist home sale be expect slide seasonally adjust annual rate january pace so far second iteration st time buyer tax credit do not seem be generate response have first time fall exist home sale generate relatively little overall economic activity be thus much less important be new home sale be release next day even be far more exist home sale new home sale exist home sale have be tumble november hit interim peak level inventory be very important month supply wednesday new home sale be expect rebound slightly annual rate january january figure be time record low datum go back far cry peak set july normally residential investment be largely construction sale new house be key locomotive pull economy recession however housing inventory new used be still extremely high especially consider million shadow inventory person be far mortgage payment be already process foreclosure new home sale pick meaningfully rise record low level be hardly meaningful be hard see have robust sustain economic recovery consider be most important datum release week very wide margin
844,TIF,new order durable good be expect have rise top rise january however january number be auto exclude auto actually fall be expect rise february thursday
845,TIF,weekly initial claim unemployment insurance come fall last week huge downtrend mid april end initial claim start rise again week fall last week last week be good progress not good enough probably need weekly claim week move average get signal economy be balance add job be lot closer now be last spring be run north consistent basis still have way go
846,TIF,continue claim have also be steep downtrend late however be part due person simply exhaust regular state benefit run week factor extend claim paid federal government part stimulus program claim soar last week look just regular continue claim number be serious mistake only include little half unemployed now give unprecedentedly high duration unemployment figure last week regular continue claim be previous week extend claim paid federal arra fund be increase make sure look set number many press report not here zack friday
