,ticker,content
86,TIF,opec somewhat unexpectedly agree production cut send crude price soar energy stock spiked not techs biotechs job growth remain modest factory other economic datum picked holiday sale have be strong least online major sector rotation continue dow edge higher record high level energy stock soar oil price opec output cut deal financial advanced rise treasury yield nasdaq hit record high tuesday then retreat fall day line chip fiber optic biotechs big cap internet sell organization petroleum export country finalize deal cut production barrel day start january first agreement be contingent nonmember cut barrel day russia say cut barrel day warn reduction happen gradually still crude future shot week barrel shale company be big winner decision continental resource clr parsley energy pe other post massive gain soar buy range crude output have inched highest nearly month oil rig use have trend higher month analyst don expect output meaningfully ramp year related opec deal rest opec cut be detailed lateru shale be big opec winner output come back crude production hit highest level nearly monthsthe jobless rate tumble year low november lowest vs view unchanged main reason be drop labor force participation rate second straight month wage gain also moderate add job last month line forecast meanwhile ism manufacturing index match best level early black friday online spending rise cyber monday result record online spending last year shopping holiday accord adobe datum mobile shopping prove be growth area thanksgiving weekend more person buy product smartphone store traffic continue decline meanwhile co tif beat forecast note early sign sale trend improvement related cyber monday black friday set online sale recordstiffany see sign improve sale trend chip designer earn cent share exclude item year year sale fiscal be semtech third straight quarter accelerate sale earning growth analyst expect semtech smtc earn cent share sale semtech guide cent ep sale analyst be look cent share clear buy point hit year high intraday thursday related chip designer semtech growth story track stock soarssplunk splk report revenue rise earning jump beating consensus big datum firm also raise full year revenue guidance splunk share fall week friday intraday nutanix ntnx say fiscal revenue rise billing jump nutanix come public late september report gaap loss cent share cent loss year earlier period analyst have project cent loss revenue billing nutanix software manage network storage server infrastructure private cloud platform field see revenue share loss better analyst forecast share sank week so far autodesk adsk computer assist design software maker report smaller expect loss revenue drop give guidance well view autodesk share fall week synopsys snps meet ep forecast rise revenue top view chip design firm give bullish guidance mixed full year outlook synopsys slide week box box lose cent share less expect narrowing year earlier revenue rise cloud datum storage firm see smaller expect loss revenue line box share rise week workday wday revenue rise top forecast loss be less expect give weak revenue guidance send share friday nearly week black friday online spending rise cyber monday result record online spending last year shopping holiday accord adobe datum mobile shopping prove be growth area thanksgiving weekend more person buy product smartphone store traffic continue decline meanwhile co tif beat forecast note early sign sale trend improvement share rise more hit month high week food price deflation grocery store giant kroger kr trim top end full year profit guidance guide ep growth lower quarter ep cent meet view sale slightly exceed forecast same store sale ex fuel edge short estimate share fall nearly week big automaker ford general motor gm toyota tm report november gain analyst cite black friday postelection optimism truck suvs lead way automaker reduce incentive concern have hung sustainability auto sale new york fed say wednesday higher delinquency rate subprime auto loan be significant concern gm share rise year high related gm ford share jump truck suvs lead november salesat launch directv now video stream service mainly aim wireless customer directv now service start month channel count directv now usage monthly datum cap wireless subscriber cricket brand customer try directv now month free other get day free trial directv now customer sign month qualify apple tv stream device acquire satellite broadcaster directv gain negotiating leverage content provider well sizable free cash flow related directv now launch herald net neutrality end health insurance giant give initial forecast analyst estimate predict adjust ep revenue wall street have expect ep revenue unitedhealth unh be pull most obamacare exchange next year be big player government health care program isn worry donald trump have vow repeal obamacare president unitedhealth share rise time high related unitedhealth offer bullish guidance stock rise amazon health care isn sweat wto say boee ba receive illegal subsidy new plane appeal bernstein analyst predict little material impact boee european rival airbus eadsy wto rule september eu still illegally subsidize airbus meanwhile israel buy more lockheed martin lmt cost estimate not include operate maintenance expense bring total order israel decision come week canada say plan buy older boee jet hold new fighter competition related boee see tax incentive remain wto rulingisrael think lockheed be still awesome buy morerv maker thor industry tho earn share beating view revenue leap help jayco acquisition rv sale spiked towable rvs thor be bullish suggest need boost production capacity thor share rise week hit record high lift other rv maker related thor crush forecast see need more production capacity
87,TIF,busy week earning see tif semtech smtc yield solid option play come week be more same fast grow retailer set report well high profile semiconductor name case share be trading just ahead earning slightly money weekly call option
88,TIF,investor week learn stop worry love rate hike even fed official fresh economic datum bolster case summer interest rate increase stock rally apple aapl bank continue climb energy stock take heart oil top rate ulta beauty ulta deep discount store shrug retail earning wo hewlett packard enterprise hpe keep spin alibaba baba disclose sec accounting probe alphabet googl bank america bac win key court battle odd federal reserve rate increase june july meeting continue climb stock rally nasdaq rise dow industrial regain day line market direction return confirm uptrend apple advanced climb last week financial energy stock also rally latter rise oil price crude oil future briefly top barrel thursday month high inventory production fall crude rise week federal reserve chief janet yellen have be more dovish policymaker publicly recent month say friday raise rate cautiously be appropriate come month economy continue improve earlier week san francisco fed president john william say see rate hike year more next year st loui fed president james bullard reiterate job market be tight start push inflation higher cause rate hike fed gov jerome powell say benchmark rate go soon weak productivity growth curb further increase odd rate hike june policy meeting be chance least quarter point hike july meeting be economic datum largely backed call rate hike new home sale spiked year high pending home sale shot best level year durable good order rise soar aircraft demand report also show core capital good booking slide year low come week datum manufacturing ism index auto sale employment lock expectation fed rate hike automaker tech pairing continue toyota tm say invest undisclosed amount uber last year disclose plan invest self drive car toyota offer auto lease uber driver bmw venture say invest scoop technology creator scoop carpool mobile app volkswagen vlkay invest gett uber rival europe new york city trio join apple early say invest top china ride hail service didi chux reportedly work secret apple car project didi be backed alibaba tencent tcehy uber partner china baidu bidu also general motor gm january say invest lyft uber rival specialty beauty retailer continue be outperformer field retail disappointment ulta beauty notch ep gain biggest year revenue growth way view ulta also amp full year outlook guidance be mixed more retailer be schedule report week share rise week mostly friday post earning jump ibd take beautiful be ulta stock base ibd criterium do stand vs rival find ibd stock checkupdollar less variety store chain dollar general dg dollar tree dltr crushed first quarter earning estimate thursday strong expansion dollar general report ep gain plan open new store year dollar tree report ep advance trouble sign be fall short wall street revenue target still dollar tree ceo bob sasser say be generally pleased company performance continue be challenge economic environment dollar general stock leap week dollar tree gain breaking new high alibaba disclose ongoing sec investigation potential violation regard commerce giant transaction consolidation practice well operate datum single day chinese company most lucrative shopping day year share plunge wednesday alibaba worst day percentage decline more year alibaba end higher week evercore morgan stanley deutsche bank analyst say remain positive stock hewlett packard enterprise say spin enterprise service business merge computer service corp csc move company say create global behemoth hpe spin hewlett packard also keep full year ep guidance view hpe stock rise week computer science spiked nearly month high bank america citigroup jpmorgan chase jpm other big bank be back hook potentially cripple sum cash appeal court overturned lower court ruling antitrust lawsuit allege bank rig libor hurt investor lower court find plaintiff didn show sufficient harm appeal court feel opposite now lower court deliberate further matter decide plaintiff be justified sue same appeal court overturned suit bank america allege bank countrywide financial misled mortgage giant fannie mae fnma freddie mac fmcc loan sale run financial crisis court say countrywide action be likelier fall breach contract rather fraud court also dismiss civil suit rebecca mairone be once executive countrywide jury rule alphabet google didn need approval oracle orcl use latter programming tool apis build android world lead mobile operate system oracle have seek damage possible additional royalty say google violate copyright jury say alphabet unit exercise fair use oracle say appeal alphabet stock rise week close back day move average agree deal bayer bayry make financial sense agriculture giant reject share offer say be worth more money also say be open more talk bayer say look further talk say address potential financing regulatory issue stock rise bayer fall year low gannett gci threaten withdraw share offer tribune publish tpub owner time chicago tribune issue new share sell nant capital investment firm towle control tribune share blast move say support acquisition gannett tribune publish stock dive spiking prior week gannett stock fall palo alto network panw guide fiscal sale cent earning share ex item miss midpoint consensus model cent cybersecurity firm fiscal sale grow year year top wall street ep shot merely meet analyst forecast palo alto share dive week crumble friday tif report ep fall cent beat view penny sale fall view european asia pacific same store sale be americas unit comp be lower tourist spending jeweler raise quarterly dividend cent share share rally close wednesday lose week signet jeweler sig say ep jump beating view penny revenue climb fall short view same store sale be signet own zale kay jared mall base jewelry chain see ep vs analyst estimate also project comp growth analyst forecast signet stock fall
89,TIF,co tif cut full year guidance again say eliminate job fourth quarter holiday sale disappoint share close stock market today lowest level early important month holiday gift season november december be hit strong dollar weak tourist spending number market company say statement global net sale decline constant exchange rate basis same store sale fall dollar worldwide net sale fall vs holiday season believe overall sale result be negatively affected restrain consumer spending tie challenge uncertain global economic condition expect earning come low end previously set range expectation ceo frederic cumenal say press release upscale jeweler now expect net earning decline year end jan prior outlook decline translate new guidance share fiscal current analyst estimate new guidance exclude cent share charge staff occupancy reduction company do not provide further detail occupancy reduction relate corporate office not retail space accord wall street journal report cite spokesman strong dollar also lean performance financial plan have not be finalize management currently believe strong dollar global macro challenge likely result minimal growth net sale net earning report dollar exclude charge year say company currency tourism impact be nothing new strong dollar weaker foreign tourist spending general consumer anxiety weigh result expect report full year result march meanwhile signet jeweler sig parent mall base jewelry brand kay zale jared say jan holiday season sale grow comp rise news pleased investor prompt stock rise day signet share rise tuesday follow elaine low twitter ibd_elow related signet lose luster luxury slowdownwhy signet be expect outdo growthamid die mall retailer signet jeweler be gem
90,TIF,shutter mall be so commonplace entire dedicate string dead mall country more benign environment pent demand easy year year comparison give retail chain much need opportunity fundamental acceleration year write jeffery retail analyst randal konik edward plank monday call co ticker
91,TIF,cyber monday threaten take wind brick mortar sale black friday weekend retailer brand score win heavy promotional post thanksgiving period accord nomura group analyst trudge store new york city connecticut thanksgiving evening sunday traffic appear heaviest macy kohl kss tif nike nke
92,TIF,tif top third quarter expectation tuesday help strong performance asia high end jeweler note early sign improvement sale trend caution still early estimate ep cent revenue dip result ep rise cent revenue edge mark first topline increase year asia pacific sale rise jump japan same store sale dip also better view drop accord consensus metrix outlook backed full year view low single digit decline sale mid single digit drop ep stock share be stock market today rise high highest august stock be now buy range breaking earlier month strong dollar have weigh tourist spending prior quarters cowen lift stock rating outperform market perform analyst project comeback luxury good highlighted standing trust brand other factor consumer always need great diamond get married want buy beautiful gift area tif excel tenet fuel sustainable long term growth even face amazon write cowen analyst oliver chen last week signet jeweler sig parent company kay jared zale store come ahead expectation raise full year profit guidance luxury watchmaker movado mov also top estimate signet edge tuesday movado dip
93,TIF,stock turn higher tuesday morning positive earning report even oil gas stock tumble oil price opec discord nasdaq be rise dow jone industrial average edge unitedhealth group unh buoy dow gain chevron cvx lag blue chip index fall almost unitedhealth give strong guidance be higher even most optimistic analyst estimate ahead investor day schedule meeting analyst institutional investor big loser stock market today be primarily mining energy company oil price fall worst perform stock today be mining energy related freeport mcmoran fcx copper miner have be tear recently decline apple aapl fall ub issue cautious comment iphone procurement estimate idc say smartphone growth nearly stall apple share remain day move average thor industry tho recreational vehicle manufacturer report ep easily surpass street estimate revenue increase also beating estimate share ibd member surge stock break cup base nov entry point be now extend co tif moved almost be month high set intraday high end jewelry retailer beat ep expectation cent share versus cent expect first rise year year quarterly earning growth quarter end january ceo frederic cumenal note early sign improve sale trend caution more datum be need know be inflection point oil price plummet report member be struggle agree deal cut production price oil fall further day move average line be just day line trading most likely continue be volatile lead tomorrow formal production meeting dollar rise slightly commerce department second read gdp growth come initial fastest pace economist expect consumer confidence index soar year high november september case shiller home price index moved september line expectation index marked annual gain september seattle ore see strongest price gain related economy rise faster pace consumersopec deadlock iran saudis harden position cut dealtiffany see improve sale trend beatsthor crush forecast see need more production capacity
94,TIF,stock market strengthen midday tuesday wall street weigh upward revision gdp growth big jump consumer confidence nasdaq score time best rise hit high add dow jone industrial average gain nearly volume nyse nasdaq be tracking slightly higher vs same time monday unitedhealth unh goldman sachs gs be early leader dow unitedhealth jump health insurer company issue bullish guidance late monday goldman sachs meanwhile rise brokerage firm keefe bruyette wood upgrade stock outperform market perform raise price target ibd take buyout be top rate chipmaker broadcom ready break bust economic news gdp growth third quarter be revise higher best annualize growth more year slightly consensus estimate separately consumer confidence november shot year high conference board read be well consensus estimate october read benchmark nymex crude oil slump nearly get low barrel oil trader fret possibility output cut wednesday opec meeting vienna oil gas related group be day worst performer solar metal ore stock copper producer freeport mcmoran fcx slump bring session decline also stock market today tif be early winner nearly report better expect earning open head tuesday have pull back buy range entry long deep bottom base stock be extend now ibd rv maker thor industry tho soar report big earning sale late monday quarterly profit jump year sale soar just related earning revenue show surprise increase stock jumpsu economy rise faster pace offer bullish guidanceopec say remain split russia say win join talkswhat be bottom base chart pattern help investor make money
95,TIF,stock edge marginally higher tuesday open slide oil price counter better expect revision third quarter growth estimate commerce department dow jone industrial be fractionally nasdaq composite edge little more higher russell suffer drop monday gain nearly unitedhealth group unh lead dow nearly hit new high offer upbeat full year guidance oil price place pressure early trade exxon mobil xom chevron cvx weakest premarket link dow security software developer mimecast mime scramble premarket trade rise more british base outfit end monday session november initial public offer price china base zto express zto open higher immediately reversed fall nationwide parcel delivery logistic operation monday report solid third quarter earning revenue beat first quarterly result october ipo share end monday initial offer price blue box jeweler co tif polish gain report stronger expect third quarter result earning rise sale gain first increase line quarters respectively stock end monday session july low texas capital bancshare tcbi drop pricing follow offer share common stock company release say texas capital expect proceed offer plan close dec mean average selling price be roughly share stock ease fresh high monday powerful week rebound support week move average stock market today receive early boost commerce department revise estimate third quarter gdp growth upward previous estimate economist have project revision upward gdp price index be revise slightly lower gain vs initial estimate economist consensus have target change read home price rise september accord corelogic case shiller index accelerate august gain lift index past previous peak city survey climb new high big boom city miami tampa phoenix la vegas still remain peak new york federal reserve bank president william dudley be schedule speak et conference board serve consumer confidence november et oil drilled nearly west texas intermediate trading just barrel gold dip almost ounce copper pare early loss bit more dollar rebound sharply monday slip bond ease lift year yield basis point trade be generally quiet global market china lead benchmark end tuesday session mixed tight range japan tokyo nikkei dip continue pull back big week rally europe action remain mixed afternoon trade cac paris be frankfurt dax dip london ftse slip related earning revenue show surprise offer bullish guidance
96,TIF,here investing action plan tuesday need know investor come day software developer autodesk adsk splunk splk report earning do jewelry giant tif drugmaker mallinckrodt mnk maker computer aid design software report result close transition selling perpetual license software offer cloud compute service estimate share loss cent vs year profit cent share revenue fall stock share fall stock market today still profit take territory breaking august investor be focuse subscriber growth annualize recur revenue transition big datum software company report result close estimate ep jump cent revenue climb mark fourth straight quarter decelerate top line growth stock share fall work way consolidation base buy point splunk be also shift cloud summit redstone partner recently estimate company total addressable market rise high end jewelry retailer report result open bell estimate ep cent revenue dip stock share rise still buy range breaking early month last week signet jeweler sig owner kay jared zale store beat wall street expectation raise full year profit guidance specialty drugmaker report fiscal result open estimate ep revenue ease stock share close have largely give postelection gain short seller citron research earlier month publish bearish note
97,TIF,stock market be usually pretty quiet thanksgiving shorten week trading offer plenty big earning mover come week be more same earning due recent ibd name thor industry tho tif semtech smtc ulta beauty ulta other think prospect be good
98,TIF,stock future scrape lower ahead tuesday open bump early gain international conflict global travel alert dow future dig point be fall
99,TIF,nasdaq future be point fair market value future carved point loss
100,TIF,turkey report fighter jet have shot russian aircraft plane have be warn be violate turkish air space russia defense ministry claim aircraft have not stray turkish air space be fly meter be shot ground
101,TIF,case stock future veer lower news break stock market today feel additional premarket pressure state department issue global travel alert american base plan terrorist threat multiple region ahead travel heavy thanksgiving weekend alert less serious caution department travel warning do not say citizen not travel advise traveler remain vigilant avoid large crowds crowd place alert expire feb
102,TIF,airline stock travel related issue such priceline com pcln tripadvisor trip come moderate premarket pressure follow release oil price rise west texas intermediate bob back barrel europe brent crude benchmark
103,TIF,commerce department revise estimate third quarter gdp growth upward number be better initial estimate growth line economist consensus expectation department revise gdp deflator measure price notch gain vs first estimate consensus projection have hold mark
104,TIF,case shiller be schedule release city home price index september et conference board report november consumer confidence index richmond federal reserve put regional manufacturing survey month
105,TIF,dow stock trade ahead open pfizer pfe be holdout gain
106,TIF,quarterly report continue stir heavy early action auto salvage consolidator copart cprt china base continue education specialist tarena international tedu leap
107,TIF,be tough morning jeweler signet jeweler sig diving tif chain miss analyst consensus sale earning expectation third quarters premarket gain loss often do not carry regular session signet loss hold stock open gap loss day move average
108,TIF,ibd stock dycom dy spun gain report late monday fiscal earning soar past consensus view revenue gain easily top expectation gross margin expand year management revenue guidance be better forecast telecom engineering construction service firm end monday still buy range buy point
