,ticker,content
493,TIF,arista network anet bitauto bita fleetmatic fltx jack box jack middleby midd monster beverage mnst nvidia nvda ubiquiti network ubnt be few notable company report earning close stock remain vastly lower late thursday have trim loss nasdaq have cut early loss shave deficit dow jone industrial average dip volume run sharply higher board gray television gtn come session low be still intraday stock slump more buy point flat base mark sell signal amc network amcx trim early deficit damage have also be do earlier trigger sell rule buy point cup handle base medium stock be hammer stock market today weak quarterly sale viacom viab share diversify medium firm be session lows still almost upside fleetcor technology flt buck market weakness be have jump much follow late wednesday better expect earning susquehanna upgrade share positive neutral thursday fleetcor be flat base buy point arista network anet bitauto bita fleetmatic fltx jack box jack middleby midd monster beverage mnst nvidia nvda ubiquiti network ubnt be few notable company report earning close
494,TIF,retailer general post decent sale gain january fuel improve economy brighter job picture lower gas price even shopper take bit breather holiday buy frenzy low gas price be implicate major miss warehouse club giant costco wholesale cost end weigh industry
495,TIF,silver gold haven lose luster ahead holiday same store sale major jeweler rise send stock record high tuesday tif double digit sale growth americas debut collection help boost revenue jeweler still miss expectation poor sale japan
496,TIF,move hong kong new york upper fifth avenue have take mantle word most expensive shopping destination
497,TIF,rent fame block stretch reach record square foot month end september accord new main street world report real estate adviser cushman wakefield
498,TIF,be earlier year new breed fast fashion chain have joined luxury retailer such tif sak fifth avenue ralph lauren rl district mobbed tourist local shopper
499,TIF,meanwhile hong kong causeway bay slip second most costly spot rental value fall be impact less exuberant consumption mainland china visitor report say street protest election have further weaken retail causeway bay note
500,TIF,upper fifth avenue have long be know luxury walk sak start open street follow limestone granite marble clad store block north
501,TIF,fad value conscious retailer have be change luxury walk fast fashion walk earlier month britain topshop open square foot emporium sak block away even larger recently open square foot japan uniqlo snag big spot few block north
502,TIF,new microsoft msft store soon join nearby rival apple aapl iconic glass cube store upper fifth avenue well be call tech walk too
503,TIF,establish flagship high demand shopping district such upper fifth avenue retailer raise brand profile note investment analyst martin mahmuti
504,TIF,champ elysee paris be third most costly shopping destination report say next be new bond street london follow pitt street mall sydney australia rent surge vs prior month period
505,TIF,prime retail rent worldwide rise just september end year accord report global gateway market continue surge ahead major brand battle premier address top city say john global head retail
506,TIF,report note gateway city san francisco new york particular be see double digit rent growth spur strong retailer demand robust tourism move hong kong new york upper fifth avenue have take mantle word most expensive shopping destination rent fame block stretch reach record square foot month end september accord new main street world report real estate adviser cushman wakefield be earlier year new breed fast fashion chain have joined luxury retailer such tif sak fifth avenue ralph lauren rl district mobbed tourist local shopper meanwhile hong kong causeway bay slip second most costly spot rental value fall be impact less exuberant consumption mainland china visitor report say street protest election have further weaken retail causeway bay note upper fifth avenue have long be know luxury walk sak start open street follow limestone granite marble clad store block north fad value conscious retailer have be change luxury walk fast fashion walk earlier month britain topshop open square foot emporium sak block away even larger recently open square foot japan uniqlo snag big spot few block north new microsoft msft store soon join nearby rival apple aapl iconic glass cube store upper fifth avenue well be call tech walk too establish flagship high demand shopping district such upper fifth avenue retailer raise brand profile note investment analyst martin mahmuti champ elysee paris be third most costly shopping destination report say next be new bond street london follow pitt street mall sydney australia rent surge vs prior month period prime retail rent worldwide rise just september end year accord report global gateway market continue surge ahead major brand battle premier address top city say john global head retail report note gateway city san francisco new york particular be see double digit rent growth spur strong retailer demand robust tourism
507,TIF,stock market today be poise vastly higher open holiday shorten week overseas jitter
508,TIF,nasdaq future surge point vs fair value future jump point dow future bolt point
509,TIF,major stock index climb more last week fed taper bond purchase remove layer uncertainty upgrade market outlook upward revision economic growth also contribute large gain
510,TIF,monday borrow cost china surge highest level june measure person bank china avoid cash squeeze
511,TIF,economic news personal spending rise november line consensus estimate econoday personal income edge miss view gain
512,TIF,final read december michigan sentiment index be et
513,TIF,corporate news apple aapl rally premarket trade news reach distribution deal china mobile chl world biggest phone carrier china mobile share be nearly pre open trade
514,TIF,arm hold armh design chip iphone be also slightly higher premarket trading stock break cup handle base last week now past buy point
515,TIF,co tif slump news lower outlook be order pay watchmaker swatch damage botch joint venture
516,TIF,result expect full year earning be lower share previous estimate share stock market today be poise vastly higher open holiday shorten week overseas jitter nasdaq future surge point vs fair value future jump point dow future bolt point major stock index climb more last week fed taper bond purchase remove layer uncertainty upgrade market outlook upward revision economic growth also contribute large gain monday borrow cost china surge highest level june measure person bank china avoid cash squeeze economic news personal spending rise november line consensus estimate econoday personal income edge miss view gain final read december michigan sentiment index be et corporate news apple aapl rally premarket trade news reach distribution deal china mobile chl world biggest phone carrier china mobile share be nearly pre open trade arm hold armh design chip iphone be also slightly higher premarket trading stock break cup handle base last week now past buy point co tif slump news lower outlook be order pay watchmaker swatch damage botch joint venture result expect full year earning be lower share previous estimate share
517,TIF,stock be again mildly higher dull trade late tuesday nasdaq dow jone industrial average be be fractionally higher nasdaq trade be tracking higher compare monday pace nyse volume be tracking lower lead stock century aluminum cenx jump year high fast trade clear buy point irregular handle last month company post second straight quarterly profit lose money number quarters profit be expect current quarter gopro gpro rise step recent rebound effort have sell recently stock offer share maker wearable camera dive nearly last week co tif pare gain half earlier stock market today jewelry retailer post result miss view same store sale be strong clear buy point month cup base earlier session ctrip com international ctrp hewlett packard hpq veeva system veev be few notable company report earning close
518,TIF,luxury jeweler co tif be lose luster asia pacific apac region share fall concern slowdown luxury brand demand region lead credit suisse adjust company valuation apac generate revenue contribute operate profit estimate be apac margin
519,TIF,turn head wednesday sparkling earning upscale cookware home furnishing retailer william sonoma turn south close so so result weak outlook
520,TIF,luxury jeweler earn cent share vs year earlier sailing past forecast cent
521,TIF,revenue grow exclude effect foreign currency translation ahead estimate sale store open least year increase year earlier
522,TIF,same store sale rise americas asia pacific region exclude japan japan sale comp tumble consumer cut purchase wake april sale tax hike european comp slide
523,TIF,tif also raise ep forecast year end jan nickel analyst have expect be cent beat
524,TIF,share rise hit record shortly open
525,TIF,gross margin jump see favorable product cost raise price product category region
526,TIF,suggest good news luxury good retailer william sonoma wsm result underscored consumer demand remain uneven high end
527,TIF,operator namesake cookware store pottery barn several other chain earn cent share meeting view gain revenue rise just hair short target
528,TIF,same store sale rise william sonoma comp pottery barn west elm
529,TIF,william sonoma stunned outlook predict ep cent revenue analyst have see earning cent sale
530,TIF,affordable luxury retailer share plunge hour action wipe august gain stock have close cent hit new intraday high
531,TIF,pricey home furniture chain restoration hardware rh fall late sympathy
532,TIF,other affordable luxury brand have take beating
533,TIF,michael kor kor share have stumble past month weaker margin even fashion house sale earning growth remain strong
534,TIF,movado mov tuesday report disappointing earning sale luxury watchmaker share fall nearly wednesday tuesday tumble turn head wednesday sparkling earning upscale cookware home furnishing retailer william sonoma turn south close so so result weak outlook luxury jeweler earn cent share vs year earlier sailing past forecast cent revenue grow exclude effect foreign currency translation ahead estimate sale store open least year increase year earlier same store sale rise americas asia pacific region exclude japan japan sale comp tumble consumer cut purchase wake april sale tax hike european comp slide tif also raise ep forecast year end jan nickel analyst have expect be cent beat share rise hit record shortly open gross margin jump see favorable product cost raise price product category region suggest good news luxury good retailer william sonoma wsm result underscored consumer demand remain uneven high end operator namesake cookware store pottery barn several other chain earn cent share meeting view gain revenue rise just hair short target same store sale rise william sonoma comp pottery barn west elm william sonoma stunned outlook predict ep cent revenue analyst have see earning cent sale affordable luxury retailer share plunge hour action wipe august gain stock have close cent hit new intraday high pricey home furniture chain restoration hardware rh fall late sympathy other affordable luxury brand have take beating michael kor kor share have stumble past month weaker margin even fashion house sale earning growth remain strong movado mov tuesday report disappointing earning sale luxury watchmaker share fall nearly wednesday tuesday tumble
535,TIF,stock slip mixed trade go noon hour tuesday trader continue handicap upcoming earning report nasdaq be dow jone industrial average rise smidgen stock market today volume run higher same time monday nyse nasdaq exchange
536,TIF,hawaiian holding parent hawaiian airline be only claw way back loss morning stock report earning beat estimate close monday sidoti co downgrade stock neutral cowen raise price maintain market perform rating
537,TIF,amazon amzn fall tuesday morning report consumer intelligence research partner say amazon prime have customer spend average year site triple size year research organization say
538,TIF,amazon report earning close thursday analyst forecast loss cent share
539,TIF,facebook fb have carved similar pattern amazon be slightly touch new intraday high stock be find resistance century mark open jeffery lift price target facebook
540,TIF,ibd company be higher be lower best performer be bank ozark ozrk nearly break cup handle base late monday announce have buy atlanta base community southern holding stock
541,TIF,worst performer be egg producer cal maine food calm fall pull back hit new high monday
542,TIF,follow ken hoover twitter ibd_khoover stock slip mixed trade go noon hour tuesday trader continue handicap upcoming earning report nasdaq be dow jone industrial average rise smidgen stock market today volume run higher same time monday nyse nasdaq exchange hawaiian holding parent hawaiian airline be only claw way back loss morning stock report earning beat estimate close monday sidoti co downgrade stock neutral cowen raise price maintain market perform rating amazon amzn fall tuesday morning report consumer intelligence research partner say amazon prime have customer spend average year site triple size year research organization say amazon report earning close thursday analyst forecast loss cent share facebook fb have carved similar pattern amazon be slightly touch new intraday high stock be find resistance century mark open jeffery lift price target facebook ibd company be higher be lower best performer be bank ozark ozrk nearly break cup handle base late monday announce have buy atlanta base community southern holding stock worst performer be egg producer cal maine food calm fall pull back hit new high monday follow ken hoover twitter ibd_khoover
543,TIF,stock turn modest gain early trade tuesday hold ground slug disappointing housing economic datum dow jone industrial average nasdaq hold gain cling fractional gain stock market today open weak trade volume nasdaq
544,TIF,stock rise friday european central bank hint new stimulus measure boost inflation major average end intraday high
545,TIF,nasdaq rise dow jone industrial average gain be volume be mixed stock market today rise nyse fall nasdaq compare thursday accord preliminary figure
546,TIF,european central bank head mario draghi suggest ecb introduce new stimulus measure dec meeting
547,TIF,retailer medical apparel stock lead upside datum storage energy steel stock underperform
548,TIF,nike nke lead dow ibd jump heavy volume announce stock split share buyback dividend increase late thursday stock be well extend past buy point have find support day move average
549,TIF,alaska air alk be also best perform ibd stock regional airline climb nearly line oil plunge barrel near buy point flat base hawaiian holding also rise nearly carrier be just time high well buy range
550,TIF,downside mentor graphic ment plunge week low mentor developer software used test electronic system issue disappointing quarterly earning report stock rise friday european central bank hint new stimulus measure boost inflation major average end intraday high nasdaq rise dow jone industrial average gain be volume be mixed stock market today rise nyse fall nasdaq compare thursday accord preliminary figure european central bank head mario draghi suggest ecb introduce new stimulus measure dec meeting retailer medical apparel stock lead upside datum storage energy steel stock underperform nike nke lead dow ibd jump heavy volume announce stock split share buyback dividend increase late thursday stock be well extend past buy point have find support day move average alaska air alk be also best perform ibd stock regional airline climb nearly line oil plunge barrel near buy point flat base hawaiian holding also rise nearly carrier be just time high well buy range downside mentor graphic ment plunge week low mentor developer software used test electronic system issue disappointing quarterly earning report
551,TIF,thank sizzling sale china other asian market outshone fellow jewelry watch company signet jeweler movado report earning tuesday tif profit jump cent share blow past analyst estimate cent be fourth straight quarter accelerate growth revenue rise
552,TIF,retailer capped holiday shopping season bit cheery note discover many shopper simply wait be wire rev spending pace overall industry likely see only modest gain holiday period expert forecast international council shopping center goldman sachs chain store sale index
553,TIF,stock market close mixed friday index bounce back early slump nasdaq rise thank strength biotechs security software solar stock fall dow jone industrial average lag drop close session lows small cap pace market small cap russell climb volume rise nyse edge lower nasdaq accord early figure serious decline prior day friday price reversal be encourage yet market remain lock long sideway trend stock sank open better expect job report trigger slide bond price energy stock rise opec left output target unchanged expect solar share jump china base ja solar jaso chief executive offer buy company take private financial also help lead stock market today bank america bac rise more close back buy point jpmorgan jpm rise hit new high thinly trade bofi holding bofi rise top buy point long cup handle base be strong day ibd average component volume be just average light most stock
554,TIF,stock recoup much wednesday loss heel fed chief janet yellen first news conference
555,TIF,meanwhile datum thursday show economic growth remain steady numerous chinese leader fall sharply
556,TIF,february lead economic indicator index weekly jobless claim beat economist view march read philadelphia fed manufacturing index be dramatically improve february read
557,TIF,lead gain dow industrial rise boost gain ibm ibm jpmorgan chase jpm unitedhealth unh nasdaq edge higher volume grow fractionally nyse decline nasdaq exchange accord preliminary datum
558,TIF,stock market today semiconductor stock do well apply material amat help pace upside rise nearly nearly twice usual trade chip equipment giant be now past double bottom buy point
559,TIF,apply base santa clara calif be await approval merge japanese giant tokyo electron february firm say committee foreign investment announce propose merger have unresolved national security issue apply sport composite rating meaning combination proprietary ibd rating be superior stock ibd database
560,TIF,fiber optic transmitter transceiver specialist finisar fnsr grow faster typical turnover moved further past buy point stock have be base make october high
561,TIF,downside vipshop holding vip slump further narrow gap create jump march flash sale commerce firm be still well extend past
562,TIF,also downside fireeye feye fall wednesday gouge day move average drop thursday volume more triple day average
563,TIF,darden restaurant dri tif be slate report quarterly result friday significant economic report be due stock recoup much wednesday loss heel fed chief janet yellen first news conference meanwhile datum thursday show economic growth remain steady numerous chinese leader fall sharply february lead economic indicator index weekly jobless claim beat economist view march read philadelphia fed manufacturing index be dramatically improve february read lead gain dow industrial rise boost gain ibm ibm jpmorgan chase jpm unitedhealth unh nasdaq edge higher volume grow fractionally nyse decline nasdaq exchange accord preliminary datum stock market today semiconductor stock do well apply material amat help pace upside rise nearly nearly twice usual trade chip equipment giant be now past double bottom buy point apply base santa clara calif be await approval merge japanese giant tokyo electron february firm say committee foreign investment announce propose merger have unresolved national security issue apply sport composite rating meaning combination proprietary ibd rating be superior stock ibd database fiber optic transmitter transceiver specialist finisar fnsr grow faster typical turnover moved further past buy point stock have be base make october high downside vipshop holding vip slump further narrow gap create jump march flash sale commerce firm be still well extend past also downside fireeye feye fall wednesday gouge day move average drop thursday volume more triple day average darden restaurant dri tif be slate report quarterly result friday significant economic report be due
564,TIF,frederic remington hit bottom investment store saloon go bust heart wasn business anyway really want be illustrator painter almost break paid horse left kansa city mo aim be fast disappear old west hit target preserve
565,TIF,jewelry watch be mainstay holiday gift buy investor be look retailer tuesday outlook crucial year end quarter mean luxury retail report earning october end quarter tuesday movado group mov tif signet jeweler sig parent kay jeweler jared zale group ticker
566,TIF,signet jeweler sig get nice lift merger zale once synergy kick next few month accord report sterne agee analyst ike signet close acquisition rival zale create world largest specialty jewelry retailer more sale
567,TIF,harsh winter keep many consumer hibernation shopping heated second quarter weather lead nice lift sale sporting good jewelry hardware store operator accord datum chase freedom lifestyle index wednesday spring summer holiday celebration prompt consumer spend more freely gift
568,TIF,william sonoma wsm home depot hd be retailer expect turn strongest same store sale gain shopper continue make sprucing home top priority accord report jharonne martis thomson reuter director consumer research thomson reuter same store sale index august september october most
569,TIF,stock future shed thursday premarket gain reversed moderate loss mixed report unemployment claim gdp growth
570,TIF,dow future drop point fair market value point advance hour earlier nasdaq future shed point gain drop point future also reversed trading point
571,TIF,stock market today receive boost federal reserve wednesday left nasdaq so far week show gain index be work be fifth straight weekly advance
572,TIF,more important growth investor small cap be have strong week russell surge wednesday strongest session dec lift small cap gauge clear day move average put ahead week even so index remain well next test resistance day line
573,TIF,ibd index pop wednesday be easily outpace market gain week
574,TIF,big day economic news be mixed start preliminary estimate commerce department putt gdp growth less half jump just forecast increase price inflation also softened gdp price index rise shade view advance
575,TIF,unemployment claim inched fractionally higher week end oct labor department report be better uptick claim forecast economist prior week tally be claim week move average dip sixth straight decline
576,TIF,atlanta federal reserve bank president dennis lockhart be schedule speak washington et national association realtor report september pending home sale datum
577,TIF,big oil company get earning ball roll royal dutch shell rdsa total tot conocophillip cop report result oil price backed west texas intermediate barrel surge more wednesday
578,TIF,drug maker pfizer pfe climb allergan agn soar news report company be explore possible merger wall street journal quote unnamed source say talk be early stage detail be unclear pfizer end wednesday week less buy point cup handle base
579,TIF,premarket session move identity security firm lifelock lock soar healthy result report late wednesday news have settle federal trade commission lawsuit digital video camera maker gopro gpro dive weaker forecast sale earning also report wednesday close
580,TIF,lead stock reilly automotive orly jump tesoro tso rise ellie mae elli be flat report reilly end wednesday session buy range less buy point tesoro be buy point cup handle base
581,TIF,nxp semiconductor nxpi dive netherlands base chip maker report earning stronger expect revenue rise less weaker estimate management expand stock buyback initiative share nxp finished wednesday just week move average have be work climb right side month consolidation
582,TIF,cavium cavm take hit report line earning revenue late wednesday chip maker have be chop uneven consolidation fight hold support june
