,ticker,content
286,TROW,finance sector have be best performer second quarter earning so today bring sei investment co seic free report sector consider investment management company reflect strong fundamental solid growth prospect diversify product revenue mix strong global presence enhance capital deployment robust asset inflow make zack rank buy stock attractive pick analyst seem be optimistic company prospect stock be witness solid upward estimate revision also share have rally last month marginally outperform industry gain sei investment be solid pick revenue growth sei investment have be witness consistent improvement revenue past few year last year company revenue record cagr company project sale growth respectively ensure continuation upward trend top line earning share strength past year sei investment witness earning share ep growth justify fold jump share price year earning momentum be expect continue term reflect company project ep growth also company long term year estimate ep growth rate promise reward investor robust asset base asset inflow sei investment remain strong company register rise trend total asset management administration last year cagr overall equity market remain volatile investment manager be well position benefit same steady capital deployment sei investment continue impress enhance capital deployment activity dec company increase semi annual dividend increase share buyback authorization additional drive strong balance sheet position company be expect continue deploy capital meaningfully strong leverage sei investment have debt compare industry debt equity ratio reflect relatively strong financial health company help perform better peer dynamic business environment other stock considersome other stock same space worth consider be ameriprise financial inc amp free report rowe price group inc trow free report hold ab free report carry zack rank see complete list today zack rank strong buy stock here ameriprise have witness upward earning estimate revision past day share price have rise last month rowe price past day zack consensus estimate have be revise upward share price have increase last month have witness upward earning estimate revision past day last month share price be simple trading ideasince zack system have more double average gain year compound rebalance exclusive fee turn thousand million dollar proven stock pick system be ground single big idea be fortune shape life change apply portfolio start today learn more
287,TROW,lazard ltd laz free report report positive surprise second quarter company report adjust earning cent share comfortably surpass zack consensus estimate cent further report figure compare favorably cent earn prior year quarter strong top line performance growth asset management aum be positive however escalate expense be major drag share lazard lose follow second quarter earning release earning beat perhaps lesser support expense front lead investor bearish stance adjust net income quarter come year year gaap basis lazard net income come cent share compare cent record prior year quarter revenue escalate cost pressure persistin second quarter adjust operate revenue come year year upsurge chiefly be attribute increase financial advisory revenue well asset management revenue moreover revenue outpaced zack consensus estimate adjust operate expense be quarter year year higher compensation benefit compensation expense lead upsurge adjust compensation benefit expense flare year year basis adjust compensation expense quarter be year year ratio compensation expense operate revenue be line prior year quarter ratio compensation expense operate revenue be compare prior year quarter company affirm annual target adjust compensation expense revenue ratio compensation operate revenue ratio target be mid high percentage range segment advisory segment total revenue be prior year quarter rise be primarily due increase revenue strategic advisory well higher restructure revenue asset management segment total revenue be prior year quarter higher management incentive other fee lead rise corporate segment generate total revenue plunge prior year quarter strong asset management aum jun aum be record year year quarter experience market foreign exchange appreciation partially offset net outflow average aum come rise year year stable balance sheetlazard cash cash equivalent stand jun compare dec company stockholder equity be compare dec steady capital deployment activitydure second quarter lazard return shareholder include dividend payment share repurchase paid meeting employee tax obligation exchange share issuance vest equity grant viewpointresult reflect decent quarter lazard company diverse footprint steady capital deployment activity revenue strength position favorably long run macro headwind elevated cost pressure stringent regulation put company financial strain lazard ltd price consensus ep surprise lazard ltd price consensus ep surprise lazard ltd quotecurrently lazard carry zack rank hold see complete list today zack rank strong buy stock here competitive landscapet rowe price group inc trow free report report positive earning surprise second quarter adjust earning share outpaced zack consensus estimate penny further bottom line improve year figure ameriprise financial inc amp free report second quarter operate earning share comfortably surpass zack consensus estimate also figure represent year year increase blackstone group bx free report report second quarter economic net income eni cent share lag zack consensus estimate cent increase expense be primary reason lower expect result however quarter witness rise revenue hottest tech mega trend last year generate global revenue predict blast roof fame investor mark cuban say produce world first trillionaire still leave plenty money regular investor make right trade early see zack best stock play trend
288,TROW,franklin resource inc ben free report report third quarter fiscal earning cent share line zack consensus estimate moreover result compare unfavorably prior year quarter earning cent share lower revenue elevated operate expense be record net outflow be also undermine factor however growth asset management aum be witness net income be quarter compare prior year quarter lower revenue record cost escalatetotal operate revenue edge year year quarter mainly due lower sale distribution shareholder servicing fee other fee further revenue lag zack consensus estimate investment management fee inched slightly year year sale distribution fee be year year addition shareholder servicing fee descend year year basis other net revenue decline year year total operate expense be year year rise result mainly elevated compensation benefit general administrative information system technology expense increase be partially offset lower sale distribution marketing occupancy expense jun total aum come jun notably quarter record net new outflow simple monthly average aum increase slightly year year basis stable capital positiona jun cash cash equivalent investment be compare sep furthermore total stockholder equity be compare sep report quarter franklin repurchase share common stock total cost post decent quarter company global footprint be exceptionally favorable strategic point aum be well diversify however regulatory restriction sluggish economic recovery mar aum growth escalate cost additionally lower revenue remain concern franklin resource inc price consensus ep surprise franklin resource inc price consensus ep surprise franklin resource inc quotecurrently franklin carry zack rank hold see complete list today zack rank strong buy stock here competitive landscapet rowe price group inc trow free report report positive earning surprise second quarter adjust earning share outpaced zack consensus estimate penny further bottom line improve year figure ameriprise financial inc amp free report second quarter operate earning share comfortably surpass zack consensus estimate also figure represent year year increase blackstone group bx free report report second quarter economic net income eni cent share lag zack consensus estimate cent increase expense be primary reason lower expect result however quarter witness rise revenue hottest tech mega trend last year generate global revenue predict blast roof fame investor mark cuban say produce world first trillionaire still leave plenty money regular investor make right trade early see zack best stock play trend
289,TROW,navient corporation navi free report third quarter core earning share ep cent surpass zack consensus estimate cent also figure come year quarter tally core earning exclude impact loss derivative accounting treatment also exclude impact certain other time item include unrealized mark market gain loss derivative goodwill acquire intangible asset amortization impairment third quarter result navient reflect higher interest income however downside company record reduce net interest income higher expense net income come quarter prior year period gaap net income quarter be cent share compare cent share year quarter rise fee income more offset decline nii core earning basis net interest income nii decline year year however interest income jump year year asset recovery revenue rise servicing revenue decline slightly provision credit loss increase nearly year year total expense climb year year segment guarantee student loan ffelp segment generate core earning year year be mainly due lower nii owing amortization portfolio decrease net interest margin partially offset decline operate expense ffelp loan spread contract basis point bps year year quarter navient acquire ffelp loan sep company ffelp loan be year year private education loan segment report core earning flat year year total delinquency rate come compare year quarter charge rate average loan repayment be bps year year basis private education loan spread expand bps year year sep company private education loan totale year year business service segment report core earning prior year quarter figure currently navient service student loan customer include customer behalf department education source funding liquidityin order meet liquidity need navient expect utilize various source include cash investment portfolio issuance additional unsecured debt repayment principal unencumbered student loan asset distribution securitization trust include servicing fee also issue term asset backed security ab report quarter navient issue ffelp loan ab close private education loan ab repurchase facility totale also company retire repurchase senior unsecured debt quarter share repurchasedure quarter navient repurchase share common stock however company have currently suspend share repurchase program order use available capital grow education lend business build book value takenavient top line continue remain pressure also company be recently allege conduct improper lend practice be likely hurt reputation keep legal expense elevated however effort enforce digitization acquisition technologically advanced company be encourage navient corporation price ep surprise navient corporation price ep surprise navient corporation quotenavient currently carry zack rank strong sell see complete list today zack rank strong buy stock here other firm finance space ally financial inc ally free report be slate release result oct trustmark corp trmk free report rowe price group inc trow free report release earning oct oct respectively hottest tech mega trend year generate global revenue predict blast roof fame investor mark cuban say produce world first trillionaire still leave plenty money regular investor make right trade early see zack best stock play trend
290,TROW,person unite financial inc pbct free report be schedule report third quarter result oct revenue earning be anticipate grow year year conclusively predict likely earning beat discuss earning beat not be store influence result let take look company perform last quarter drive higher revenue lower provision person unite report positive earning surprise second quarter further elevated loan deposit balance be tailwind however escalate expense decline profitability ratio be undermine factor notably person unite deliver positive earning surprise trail quarters average beat person unite financial inc price ep surprise person unite financial inc price ep surprise person unite financial inc quoteregard stock performance share company gain month period end sep underperform growth record industry upcoming earning release give boost person unite stock depend largely firm be able post beat third quarter however quantitative model doesn conclusively point likely earning beat time here person unite doesn have right combination key ingredient positive earning esp zack rank strong buy buy least hold increase chance earning beat be note caution stock zack rank sell rate go earning announcement especially company be see negative estimate revision zack esp earning esp person unite be uncover best stock buy sell re report earning esp filter zack rank person unite zack rank increase predictive power esp however also need have positive esp be confident earning beat factor influence resultsloan growth federal reserve latest datum loan grow sequential basis third quarter particularly growth commercial consumer loan slowdown commercial real estate loan be expect therefore interest income bank be project improve marginally addition management expectation loan deposit growth likely be reflect quarter management project loan portfolio grow range modest rise net interest income nii give influence rise interest rate person unite have record increase nii notably management projection nii grow range be likely show impact third quarter well fee income escalate strong retail banking fee income escalate bank addition company project interest income rise range impact be likely be reflect be report quarter increase expense undertaking number expense save initiative person unite operate expense have witness elevated level company be focuse optimize branch network have initiate installation technology improve efficiency reduce cost escalate expense level be likely limit bottom line expansion stock warrant lookhere be other stock want consider accord model have right combination element post earning beat quarter state street corporation stt free report have earning esp carry zack rank be schedule report result oct see complete list today zack rank stock here bank corporation mtb free report be slate release third quarter earning oct company carry zack rank have earning esp earning esp rowe price group inc trow free report be stock carry zack rank company be schedule report quarterly number oct look stock skyrocket upside zack have just release special report boom investment opportunity legal marijuana ignited new referendum legislation industry be expect blast already robust early investor stand make kill have be ready act know just look see pot trade re target
291,TROW,franklin resource inc ben free report have announce preliminary asset management aum subsidiary march result display drop record feb net market loss outflow be primarily responsible decline further figure edge prior year month end total equity asset come previous month marginally year year total equity asset be international source remain come unite state total fix income asset be moderately previous month well prior year overall tax free asset account only fix income asset remain be taxable franklin record hybrid asset be witness previous month report march cash management fund come prior month figure record year period company global footprint be exceptionally favorable strategic point aum be well diversify nevertheless regulatory restriction sluggish economic recovery mar aum growth escalate cost franklin carry zack rank hold share company have decline last month compare loss incur industry see complete list today zack rank strong buy stock here other asset manager invesco ltd ivz free report rowe price group inc trow free report legg mason inc lm free report be expect release preliminary aum result march later week look stock skyrocket upside zack have just release special report boom investment opportunity legal marijuana ignited new referendum legislation industry be expect blast already robust early investor stand make kill have be ready act know just look see pot trade re target
292,TROW,invesco ltd ivz free report report preliminary month end asset management aum february figure reflect decline prior month higher money market aum support growth extent decrease total aum be due unfavorable market return fee earn aum outflow net long term outflow also fx decrease february aum invesco preliminary average total aum quarter feb be preliminary average active aum be end report month invesco equity aum decline prior month further fix income aum decrease marginally january level balanced aum be fall prior month also alternative aum decrease precede month however money market aum be increase slightly last month company have be witness continuous growth aum last few year support revenue growth overall challenge operate environment seem be weigh investor mind present past year share invesco gain underperform industry rally apart invesco franklin resource inc ben free report declare preliminary aum subsidiary february reflect decline prior month also legg mason inc lm free report report fall aum feb compare prior month preliminary month end aum come january rowe price group inc trow free report announce preliminary aum february result reflect fall jan currently invesco carry zack rank hold see complete list today zack rank strong buy stock here zack top stock addition stock discuss know finest buy hold ticker entirety last year zack top stock portfolio produce double digit winner include fmc corp vmware rac stellar gain now brand new portfolio have be handpick company cover zack rank don miss chance get long term buy access zack top stock today
293,TROW,legg mason inc lm free report headquarter baltimore report fall asset management aum feb compare prior month preliminary month end aum come january february aum display fix income inflow equity inflow alternative inflow partly offset liquidity outflow notably negative foreign exchange impact remain unfavorable factor legg mason equity aum end february slip prior month figure fix income aum edge nearly previous month further alternative asset decrease moderately fall fix income equity aum alternative aum result long term aum figure marked decline previous month moreover liquid asset be convertible cash moved slightly competitive resource ben free report have announce preliminary aum subsidiary february result display drop record jan net market loss outflow be primarily responsible decline however figure inched prior year rowe price group inc trow free report report preliminary aum february result reflect fall jan client transfer mutual fund other portfolio totale month invesco ltd ivz free report report preliminary month end aum february figure indicate drop prior month aum decline due unfavorable market return foreign exchange management fee earn aum outflow net long term outflow partially offset higher money market aum notably fx decrease february aum viewpointlegg mason have potential outperform peer long run backed diversify product mix leverage change market demography nonetheless absence continue growth equity market foreign exchange fluctuation remain headwind legg mason currently carry zack rank buy see complete list today zack rank strong buy stock hereshare company have increase last month underperform growth record industry zack top stock addition stock discuss know finest buy hold ticker entirety last year zack top stock portfolio produce double digit winner include fmc corp vmware rac stellar gain now brand new portfolio have be handpick company cover zack rank don miss chance get long term buy access zack top stock today
294,TROW,franklin resource inc ben free report have announce preliminary asset management aum subsidiary february result display drop record jan net market loss outflow be primarily responsible decline however figure inched prior year plunge february aum investor be optimistic expectation better market condition backed improve economy lead share rise follow release month end total equity asset come previous month year year total equity asset be international source remain come unite state total fix income asset be previous month slightly prior year overall tax free asset account only fix income asset remain be taxable franklin record hybrid asset be witness previous month report february cash management fund come line prior month record year period company global footprint be exceptionally favorable strategic point aum be well diversify nevertheless regulatory restriction sluggish economic recovery mar aum growth escalate cost franklin currently carry zack rank hold share company have decline last month compare growth record industry see complete list today zack rank strong buy stock here other asset manager invesco ltd ivz free report rowe price group inc trow free report legg mason inc lm free report be expect release preliminary aum result february later week hottest tech mega trend year generate global revenue predict blast roof fame investor mark cuban say produce world first trillionaire still leave plenty money regular investor make right trade early see zack best stock play trend
295,TROW,mar issue update research report rowe price group trow free report company robust organic growth initiative expand business make optimistic prospect rise expense be major concern company effort gain investor confidence steady capital deployment activity be encourage share company have gain year time outperform growth industry belong moreover zack consensus estimate current year earning have be revise upward last day result carry zack rank buy rowe price remain commit bolster business launch investment strategy vehicle strengthen distribution channel unite state emea asia pacific improve technology platform derive long term cost efficiency further organic growth remain key strength rowe price reflect revenue growth net revenue see cagr last year company benefit diverse business model mix shift international growth fund be also expect increase revenue investment management margin moreover company debt free position strong liquidity keep well poise undertake strategic investment growth opportunity future also enable company enhance shareholder value steady capital deployment activity february hike quarterly common stock dividend however consistently rise expense owing rowe price strategic effort attract investment client affect bottom line growth also overdependence investment advisory fee comprise net revenue revenue source remain major concern other stock financial service amp free report zack consensus estimate earning be revise upward last day also share price have increase past month stock carry zack rank see complete list today zack rank strong buy stock here blackrock blk free report carry zack rank stock current year earning estimate be revise upward last day further company share have gain year time federated investor fii free report zack consensus estimate earning have be revise upward last day past year share have gain also carry zack rank wall street next amazonzack evp kevin matra believe familiar stock have only just begin climb become greatest investment time once generation opportunity invest pure genius click detail
296,TROW,invesco ltd ivz free report report preliminary month end asset management aum april figure reflect increase prior month rise be mainly drive guggenheim acquisition favorable market return improvement money market aum reinvest distribution be partially offset net long term outflow management fee earn aum outflow also fx decrease april aum notably guggenheim acquisition add aum exclude aum report month remain relatively stable sequentially invesco preliminary average total aum quarter apr be preliminary average active aum be end report month invesco equity aum grow prior month further fix income aum increase march level also money market aum be increase last month additionally balanced aum be stable sequentially alternative aum be also relatively stable compare precede month company have be witness continuous growth aum last few year support revenue growth overall challenge operate environment seem be weigh investor mind present past year share invesco have lose industry rally currently invesco carry zack rank strong sell see complete list today zack rank strong buy stock here apart invesco franklin resource inc ben free report declare preliminary aum subsidiary april reflect decline prior month further legg mason inc lm free report rowe price group inc trow free report be expect announce aum figure soon wall street next amazonzack evp kevin matra believe familiar stock have only just begin climb become greatest investment time once generation opportunity invest pure genius click detail
