,ticker,content
323,TROW,president trump call tariff steel aluminum import hurt corporation well consumer such tariff also stir fear trade dispute unite state china turn propel wall street fear gauge index historic average drag broader market inflation scare lead rate hike have already trigger sudden panic investor rate hike raise borrow cost eventually dent corporate profit affect economy such uncertainty investing dividend aristocrat seem prudent provide higher total return lower volatility be undoubtedly holy grail investing tariff affect street begin march sour note trump say unite state impose steel aluminum tariff trump say impose tariff steel import tariff aluminum such protectionist trade policy be widest reach trade action have take date have trigger lot concern corporation consumer tariff increase cost company rely heavily aluminum steel auto plane maker needless say share ford motor company free report general motor company gm free report boee company ba free report dip fact corporate america have caution trump tariff backfire import make third steel american business house use year higher price steel aluminum furthermore compel company rely such product pass cost consumer increase consumer price long run hamper sale growth affect company lead job loss wall street be worry trade wartrump contentious tariff announcement have raise apprehension retaliation china other major trading partner china caution america abide multilateral trade rule not harm delicate global economy shouldn forget china be world dominant steel producer trump tariff move easily start trade war li xinchuang vice secretary general china iron steel association add impose tariff steel aluminum import be extremely stupid move make industry fall globally period china be prime tariff also raise threat trade war america closest ally canada not canada be top exporter steel aluminum unite state canada be solely responsible manufacturing steel import aluminum import canadian foreign minister chrystia freeland meantime have announce restriction be impose canadian steel aluminum product canada take responsive measure defend trade interest worker rate hike fear loomconcern trade come time broader market be already roller coaster ride broader dow tank nearly february bourse have worst month year meanwhile cboe volatility index vix soar mar indicate turbulence have picked well investor remain worry rise inflation term prompt fed hike short term interest rate faster pace expect turn increase borrow cost business consumer eventually lead slowdown economy important also note easy monetary policy help equity market notch nearly year bull run inflation riserecent hike pay level raise worry higher commodity price wage growth hit fastest pace january more half year accord labor department average hourly wage increase cent help average year year hourly earning rise highest june american be now get fatter paycheck mostly due tighter labor market tax cut policy rise minimum wage threshold several state consumer have also be ramp spending level late be largely benefit rise income trader predict such upbeat consumer outlay fuel inflation read more consumer most confident year top pick minute jan federal open market committee meeting have already show several official expect inflation move year touch fed target only small number forecast inflation fall short dividend aristocrat solid choicesgiven aforesaid concern investing dividend aristocrat seem judicious such company have tremendous financial strength be immune market vagary reflect solid financial structure healthy underlie fundamental have also rake excellent risk adjust return last decade have thus select such dividend aristocrat boost return such stock also possess zack rank buy favorable zack rank help stock gain further year see complete list today zack rank strong buy stock here company mmm free report operate diversify technology company worldwide company have paid dividend year have raise dividend straight year bard have dividend yield year average dividend yield be also peg stock expect earning growth be walmart inc wmt free report operate retail store various format worldwide wal mart first dividend be paid have increase dividend year be currently pay year average dividend yield be peg stock expect earning growth be kimberly clark corporation kmb free report manufacture market personal care consumer tissue professional product worldwide company raise dividend consecutive year kimberly clark have dividend yield year average dividend yield be peg expect earning growth stock year be automatic datum process inc adp free report provide business process outsource service worldwide adp have raise dividend year year row company have dividend yield year average dividend yield be peg stock have expect earning growth rate rowe price group inc trow free report be publicly own investment manager company have increase dividend year stretch have dividend yield year average dividend yield be peg rowe price expect earning growth be don even think buy bitcoin read most popular cryptocurrency sky-rocket last year give investor chance bank return even more gain however come serious volatility risk bitcoin sank more time zack have just release new special report help reader capitalize explosive profit potential bitcoin other cryptocurrency significantly less volatility buy directly see crypto related stock now
324,TROW,citizen financial group cfg free report be schedule report fourth quarter result jan market open company be expect witness year year growth revenue earning further citizen financial boast impressive surprise history surpass earning estimate trail quarters average beat providence ri base bank organic growth be reflect third quarter result witness continue rise loan balance higher revenue also company record lower expense improve credit quality citizen financial fourth quarter result be expect benefit rise interest income prudent expense management effort zack consensus estimate be report quarter earning cent indicate year year improvement citizen financial group inc price ep surprise citizen financial group inc price ep surprise citizen financial group inc quotefactor drive better expect resultshigher net interest income nii fourth quarter be decent term consumer loan growth higher interest rate hence citizen financial nii be likely increase zack consensus estimate nii reflect growth year year moreover estimate average interest earn asset reflect increase year quarter controlled expense citizen financial expense be expect continue decline due top iv efficiency initiative also self funding revenue initiative help lower efficiency ratio consensus estimate efficiency ratio be basis point year year fee income improve fee income be likely have increase fourth quarter due improve investment banking activity consensus estimate trust investment management fee indicate increase overall interest income be project climb fourth quarter mortgage banking likely decline refinancing boom near end seasonality play add factor mortgage banking revenue be expect decline quarter consensus estimate mortgage banking revenue be reflect decline year year likely positive surprise proven model show citizen financial have right combination key ingredient positive earning esp zack rank hold better increase odd earning beat uncover best stock buy sell re report earning esp filter zack esp earning esp citizen financial be zack rank citizen financial currently carry zack rank buy other stock warrant lookhere be other stock want consider have right combination element post earning beat upcoming release bank new york mellon corporation bk free report be slate release fourth quarter result jan have earning esp carry zack rank associate banc corp asb free report be slate report result jan have earning esp sport zack rank strong buy see complete list today zack rank stock here rowe price group trow free report have earning esp carry zack rank be schedule report result jan more stock news be bigger iphone become mother technological revolution apple sell mere iphone year new breakthrough be expect generate more device just year create market zack have just release special report spotlight fast emerge phenomenon ticker take advantage don buy now kick click here trade
325,TROW,bank new york mellon corporation bk free report be schedule report fourth quarter full year result jan market open revenue earning be expect grow year year last quarter company earning surpass zack consensus estimate higher revenue asset management aum growth be offset increase expense bny mellon have decent earning surprise history surpass zack consensus estimate twice match once trail quarters average beat be however activity company fourth quarter be not adequate analyst confidence result zack consensus estimate cent have remain stable last day nevertheless figure reflect year year growth further company zack consensus estimate sale be be report quarter reflect improvement year year bank new york mellon corporation price ep surprise bank new york mellon corporation price ep surprise bank new york mellon corporation quotebny mellon share have gain underperform growth industry belong share price performance improve post earning great extent depend company be able beat earning estimate time let take look quantitative model predict likely positive surprise accord quantitative model chance bny mellon beating zack consensus estimate fourth quarter be high be have right combination key ingredient positive earning esp zack rank hold better be require increase odd earning beat uncover best stock buy sell re report earning esp filter zack esp earning esp bny mellon be zack rank bny mellon carry zack rank combine positive esp make reasonably confident earning beat factor influence resultsmodest improvement fee revenue equity market have perform decently fourth quarter result performance fee be expect improve moreover seasonally higher security lend revenue quarter be likely boost fee income growth however management project depositary receipt revenue decline nearly sequentially due seasonality lower dr revenue expectation fall foreign exchange trading revenue due lower volume be offset factor overall fee income be expect improve quarter notably zack consensus estimate fee revenue reflect year year improvement higher rate boost net interest revenue nir zack consensus estimate average interest earn asset reflect marginal improvement year quarter moreover overall loan balance witness modest improvement quarter give improvement loan balance effect rise interest rate bny mellon register increase nir moreover management believe rate hike lead improvement margin hence improve margin due increase rate be likely more offset reduce size balance sheet hence lead modest increase nir quarter notably management expect nir be higher end range expense decline slightly management expect legal professional expense decline nearly fourth quarter impact investment related expense overall cost be expect decline other stock warrant lookhere be few other finance stock want consider model show have right combination element post earning beat time bb corp bbt free report be slate release fourth quarter result jan have earning esp zack rank buy associate banc corp asb free report be slate report result jan have earning esp zack rank strong buy see complete list today zack rank stock here rowe price group inc trow free report have earning esp zack rank be schedule report result jan today stock zack hottest strategiesit hard believe even zack market gain top stock pick screen have return respectively outperformance have not just be recent phenomenon year have be remarkably consistent composite yearly average gain strategy have beaten market more maybe even more remarkable be fact re willing share latest stock cost obligation see free
326,TROW,person unite financial inc pbct free report be schedule report fourth quarter result jan revenue earning be anticipate grow year year likely earning beat card discuss earning beat be likely influence result let take look company perform last quarter drive higher revenue lower provision person unite report positive earning surprise third quarter further elevated loan deposit balance be tailwind however escalate expense be undermine factor notably person unite deliver positive earning surprise trail quarters average beat person unite financial inc price ep surprise person unite financial inc price ep surprise person unite financial inc quoteregard stock performance share company have gain month period end dec outperform growth record industry upcoming earning release give boost person unite stock depend largely firm be able post beat fourth quarter notably quantitative model predict likely earning beat time here proven model indicate chance person unite beating zack consensus estimate be high have right combination key ingredient positive earning esp zack rank strong buy buy least hold uncover best stock buy sell re report earning esp filter zack esp earning esp represent difference most accurate estimate zack consensus estimate be currently peg be very significant lead indicator likely positive earning surprise company zack rank combination person unite zack rank positive esp make confident earning beat zack consensus estimate be report quarter remain unchanged last day be expect move year year moreover zack consensus estimate sale be project year year factor influence resultsloan growth federal reserve latest datum loan decline sequential basis december end quarter particularly growth consumer loan slowdown real estate loan commercial industrial loan be expect therefore interest income bank be project improve marginally addition management expectation loan deposit growth likely be reflect quarter management project loan portfolio grow range modest rise net interest income nii give influence rise interest rate person unite be anticipate have record increase nii notably management projection nii grow range be likely show impact quarter be report well fee income escalate strong retail banking fee income escalate bank additionally company project interest income rise range impact be likely be reflect be report quarter increase expense undertaking number expense save initiative person unite operate expense have witness elevated level company be focuse optimize branch network have initiate installation technology improve efficiency reduce cost escalate expense level be likely limit bottom line expansion adverse impact new tax code tax reform result elevated operate expense time bonus payment higher charitable contribution investment loss security portfolio restructuring also company have not provide information defer tax asset dta record significant time charge fourth quarter stock warrant lookhere be other stock want consider accord model have right combination element post earning beat quarter earning esp legg mason inc lm free report be stock flaunt zack rank strong buy company be schedule release december quarter end result jan seethe complete list today zack rank stock here rowe price group inc trow free report be slate release result jan company have earning esp sport zack rank suntrust bank inc sti free report have earning esp carry zack rank be schedule report result jan today stock zack hottest strategiesit hard believe even zack market gain top stock pick screen have return respectively outperformance have not just be recent phenomenon year have be remarkably consistent composite yearly average gain strategy have beaten market more maybe even more remarkable be fact re willing share latest stock cost obligation see free
327,TROW,fifth third bancorp fitb free report be schedule report fourth quarter result open bell jan company be expect witness year year growth revenue earning decline however company have decent earning surprise history top earning trail quarters average positive earning surprise last quarter company earning be line zack consensus estimate result be support higher net interest income lower provision however lower interest income be undermine factor fifth third share gain month period end dec outperform industry rally fifth third bancorp price ep surprise fifth third bancorp price ep surprise fifth third bancorp quotewill upcoming earning release give boost fifth third stock depend largely firm be able impress market fourth quarter result factor influence resultsexpense increase slightly fifth third ongoing strategic investment several area such technology increase expense however company be successful offset expense rise north star initiative extent net interest income nii improve quarter witness moderate improvement lend particularly consumer front thus loan growth combine rise interest rate be likely boost company nii zack consensus estimate revenue indicate year year growth fee income remain flat fifth third focus strengthen fee income base north star initiative be likely lend support also higher credit card revenue due seasonality improve investment banking business increase interest income however poor mortgage banking revenue quarter be likely offset positive let have look quantitative model predict proven model doesn conclusively show fifth third be able beat zack consensus estimate time do not have right combination key ingredient note stock combination positive earning esp zack rank hold better have significantly higher chance beating estimate uncover best stock buy sell re report earning esp filter zack esp earning esp fifth third be zack rank fifth third carry zack rank stock warrant lookhere be stock want consider model show have right combination element post earning beat time associate banc corp asb free report be slate report result jan have earning esp sport zack rank strong buy see complete list today zack rank stock here rowe price group trow free report have earning esp carry zack rank be schedule report result jan federated investor fii free report earning esp be sport zack rank company be expect release fourth quarter result jan hottest tech mega trend year generate global revenue predict blast roof fame investor mark cuban say produce world first trillionaire still leave plenty money regular investor make right trade early see zack best stock play trend
328,TROW,state street corporation stt free report be schedule report fourth quarter result market open jan quarterly earning revenue be expect grow year year last quarter increase revenue drive company operate earning growth fact number outpaced zack consensus estimate however higher expense decline trading servicing fee be state street boast impressive earning surprise history company earning surpass zack consensus estimate trail quarters average beat state street corporation price ep surprise state street corporation price ep surprise state street corporation quotealso activity company fourth quarter encourage analyst revise estimate upward thus zack consensus estimate earning be report quarter increase last day also figure represent year year improvement zack consensus estimate sale be quarter reflect year year growth factor influence resultsstable net interest income nii zack consensus estimate average interest earn asset quarter represent decline year year further overall lend activity be decent quarter higher interest rate be expect boost company nii lower interest earn asset be likely offset gain extent notably management expect nii be relatively stable sequentially assumption slightly smaller balance sheet net interest margin be project increase few basis point drive asset repricing continue liability management management project nii be range take consideration interest rate expectation curve currency apart nii growth depend size balance sheet client deposit behavior balance sheet management activity impact fx swap cost balance sheet be expect modestly decline owing lower client deposit fall wholesale cd level decrease average earn asset roughly muted fee revenue growth drive benefit acquire ge asset management business management fee be likely improve be report quarter also sequential basis management expect servicing fee rise however lower market volatility be expect lower trading revenue fee revenue operate basis be project increase range be base assumption market condition october dollar remain stable relative major currency benefit ge asset management deal modest rise expense management expect operate expense rise slightly third quarter level mainly due cost associate new business activity expense level also be dependent revenue backdrop quarter onboard new client company anticipate state street beacon expense saving least partially offset expense support new business continue business investment merit depreciation increase here be quantitative model predict state street do not have right combination key ingredient positive earning esp zack rank hold higher increase odd earning beat uncover best stock buy sell re report earning esp filter zack esp earning esp state street be zack rank state street have zack rank increase predictive power esp also need have positive esp be confident positive earning surprise stock warrant lookhere be few stock want consider accord model have right combination element post earning beat quarter synovus financial corp snv free report be slate release fourth quarter result jan have earning esp zack rank buy see complete list today zack rank strong buy stock here associate banc corp asb free report be slate report result jan have earning esp zack rank rowe price group inc trow free report have earning esp zack rank be schedule report result jan hottest tech mega trend year generate global revenue predict blast roof fame investor mark cuban say produce world first trillionaire still leave plenty money regular investor make right trade early see zack best stock play trend
329,TROW,huntington bancshare incorporate hban free report be schedule report fourth quarter result jan open bell company revenue earning be project grow year year company fourth quarter result be expect be support robust organic growth benefit firstmerit acquisition complete aug rise interest rate have work favor too flatter yield curve offset benefit extent pressure huntington net interest margin be likely ease slightly rate hike zack consensus estimate revenue indicate year year improvement huntington have decent earning surprise history surpass earning estimate trail quarters average positive surprise huntington bancshare incorporate price ep surprise huntington bancshare incorporate price ep surprise huntington bancshare incorporate quotelast quarter company earning be line zack consensus estimate higher revenue continual growth loan deposit balance lower provision be positive however higher net charge off be primary headwind activity huntington fourth quarter be inadequate analyst confidence thus last day zack consensus estimate quarter earning have remain stable cent nevertheless reflect year year improvement notably huntington fundamental strength have help share gain past month outperform growth record industry stock rally continue post fourth quarter earning release let see thing be shape earning proven model conclusively predict huntington beat zack consensus estimate time doesn have right combination key ingredient positive earning esp zack rank hold better increase odd earning beat uncover best stock buy sell re report earning esp filter zack esp company have earning esp zack rank huntington currently carry zack rank buy increase predictive power esp however also need positive esp be confident earning beat factor influence resultsrevenue grow revenue be likely improve line company long term financial goal support synergy firstmerit acquisition also increase net interest margin decent loan growth quarter enhance net interest income zack consensus estimate average interest earn asset reflect sequential growth further management expect total revenue grow year year expense likely increase management believe cost saving related acquisition firstmerit have be achieve last quarter have now shift focus revenue growth be likely push expense quarter full year company expect interest expense growth be nearly credit quality deteriorate zack consensus estimate allowance loan lease loss show increase last quarter also net charge off be project be reflect marginal sequential increase stock warrant lookhere be other stock want consider accord model have right combination element post earning beat quarter earning esp legg mason inc lm free report be stock have zack rank strong buy company be schedule release december quarter end result jan see complete list today zack rank stock here santander consumer usa holding inc sc free report earning esp be carry zack rank company be expect release fourth quarter result jan rowe price group inc trow free report be slate release result jan company have earning esp carry zack rank make fortune shift electric car here stock idea consider much petroleum year lithium power soon shake world create millionaire reshape geo politic soon electric vehicle evs be cheaper gas guzzler be already reach mile single charge battery price plummet charge station set multiply company stand stock buy accord zack research not think see ticker free
