,ticker,content
0,TROW,new high wednesday left much be desire reversal new high low volume be commonplace case bold thrust lack valid buy point february initial public offer cactus whd provide bold thrust new high valid buy point nearby stock pop then reversed essentially break even oil equipment maker have have good timing ipo stock debut nasdaq feb just day low crude oil pullback then oil have rally low cactus get newsletter deliver inbox more info product service privacy policy term useyet bull have hard time find buy point cactus uneven march april consolidation offer argument argument seem stretched be conventional base ipo cactus be expect grow earning year next year stock composite rating be putt top stock ibd database meanwhile ibd style investor patiently conventional base form recently consumer electronic retailer best buy bby have be try clear buy point stock hit first minute trade mark new high roughly average volume then best buy reversed close buy point earning be report early march ep grow revenue gain revenue gain be best least quarters quarterly same store sale jump trouncing analyst view best buy have respectable composite rating financial advisory firm rowe price group trow break past buy point stock close volume be only average related stock screen be smash be oil card ugg boot maker stirsmacy crush forecastwhat oil give take away time sell
1,TROW,ibd stock screen be regularly update add new stock watch well weed have start show weakness table ll see stock have be add remove list ibd sector leader ibd big cap screen be
2,TROW,keep watch list date be key make money stock market ibd help do regularly update stock screen ibd sector leader ibd big cap ipo leader table see stock have just be add remove list ibd display video id
3,TROW,tuesday price rowe group trow get upgrade ibd smartselect composite rating new rating show stock be outpace stock come most important stock pick criterium market biggest winner often have higher rating early stage new price run price rowe group be currently extend proper buy zone clear buy point flat base look best stock buy watch start stock earn ep rating meaning recent quarterly annual earning growth top stock accumulation distribution rating show roughly equal amount buy selling institutional investor last week company report ep growth mean now deliver straight quarters rise ep growth revenue growth climb prior report mark quarter increase revenue increase price rowe group earn rank peer finance investment management industry group blackrock blk be rank stock group related company be now outperform stock
4,TROW,tuesday investment wetf receive positive adjustment relative strength rs rating look best stock buy watch factor watch closely be relative price strength exclusive rating investor business daily measure market leadership worst best score grade show stock price movement last week hold other stock database decade market research reveal best stock often have rs rating north early stage move see investment continue show renew price strength clear threshold look winning stock try simple investment be try complete cup handle buy point see break heavy trading earning growth moved company latest report revenue fall investment hold rank peer finance investment management industry group noah noah financial engine fngn price rowe group trow be top highly rate stock group get newsletter deliver inbox more info product service privacy policy term also ibd stock rating upgrade rise relative strengthwhy use ibd relative strength rating relative strength line help judge stock
5,TROW,mutual fund have be workhorse american retirement decade vanguard fidelity american fund jpmorgan chase jpm rowe price trow lead asset industry offer numerous investment choice help reach investment goal do build maintain portfolio fund carry safely goal start check list update monday friday highlight top performer invest various type stock bond ll also find ongoing coverage latest trend tip invest monthly report ibd annual best mutual fund award see best mutual fund last stock growth large cap small cap categoriesnew buy top perform fund last monthsview more mutual fund newsview more mutual fund performance reportsview full best mutual fund award reportrelated buy sell mutual fund long termwhere mutual fund bigwig expect see stock gain best exchange trade fund etfs best stock buy watch
6,TROW,keep watch list date be key make money stock market ibd help do regularly update stock screen ibd sector leader ibd big cap ipo leader table see stock have just be add remove list ibd display video id
7,TROW,keep watch list date be key make money stock market ibd help do regularly update stock screen ibd sector leader ibd big cap ipo leader table see stock have just be add remove list ibd display video id
8,TROW,dow nasdaq composite hold solid gain afternoon trading wednesday retail stock garner attention april retail sale datum tuesday be mostly line expectation upward revision march datum spark sharp rise year treasury yield spiked year high tuesday be level wednesday retail stock be headline come day several top performer sector be earning result walmart wmt be due thursday open jwn report thursday close result kohl kss urban outfitter urbn tjx company tjx ross store rost best buy bby be next week nasdaq composite be help strength micron technology mu western digital wdc reclaim day move average monday light volume share micron surge help positive comment rbc capital market competitor western digital gain just dow jone add picked russell small cap index outperformed rise be poise time close high volume nyse nasdaq be tracking close tuesday level compare same time yesterday stock market result today macy be nice winner strong earning bullish guidance recently flash sell signal buy point share reversed day move average tuesday gap wednesday improve technical picture dramatically share jump also retail space boot barn boot gap powerfully recent share pop head wednesday be already extend buy point meanwhile cisco system csco be poise fourth straight decline ahead earning report close still high just buy point day breakout nike nke jump buy point rise get newsletter deliver inbox more info product service privacy policy term usein financial sector rowe price trow gap consolidation buy point strength be fuel upgrade deutsche bank credit suisse related macy crush earning forecast lift full year viewswhy investor interest be high ipo tonighttop investor bet buffett stock buysoption trading be turnaround quarter store cisco system
9,TROW,premise retirement plan guide be straightforward plan retirement let do want want entail not work work less same field striking whole new dream career do go perhaps most important afford dream short answer be start early save heavily re save investing come comprehensive plan carry comfortable retirement form take ibd retirement plan guide help answer question more detail story retirement plan guide cover such issue create best retirement plan ll also find estate plan checklist coverage best place retire work retirement deal social security many article advise now re retire do something exciting say natalie choate attorney boston law firm nutter mcclennen fish get comfort zone skydiving buy motorcycle take jungle safari so say get newsletter deliver inbox more info product service privacy policy term usechoate classic book life death plan retirement benefit be edition have different message different method step airplane run estate plan checklist list item include live trust power attorney advance health care directive take minute rainy weekend do something bore say find organize retirement plan record save heir lot trouble money just do paperwork such paperwork indicate far be line fund retirement retiree have more responsibility now say ira expert ed slott founder irahelp com past more person have pension now person have ira manage last long retirement now ira have largely replace traditional private sector pension new era come retirement take new think longer automatic plan retire receive medicare social security benefit live income investment interest dividend retirement age spectrum stretch even so many opportunity depend want shape life never have be so many tool disposal build financially independent life early want retirement vehicle include ira regular roth version annuity separate account get referral search online financial advisor help plan retirement employer plan likely offer education get start build saving maintain nest egg tax advantage account fund company award winning stock broker fidelity investment charle schwab schw rowe price trow td ameritrade amtd tradestation offer ton educational material associate offer various level assistance open account set financial plan begin savvy retirement plan retirement plan guide have information ll need personalize note self memo action take today have critical last impact live retirement start plan knowledge put plan action achieve financial goal smart investment plan underpin have enough money retirement investing regular schedule especially automatic withdrawal tax defer retirement account such create effective effortless strategy build retirement saving today investment scene present daunting challenge stock be record level raise fear see repeat retreat investor experience such pullback put stock sale have past investor many year retirement millennial investor now do especially well overcome fear student loan debt stick stock person be just start retirement be greater risk steep market pullback next year decade worth saving be wipe never fully replace be draw portfolio new retiree avoid risk switch cash yield be puny now take middle ground be prudent bull market have be experience client often forget importance hold fix income portfolio say certify financial planner robert westley vice president wealth advisor northern trust new york add retiree have enough fix income support spending need number year event market drop allocation fix income help keep retiree have sell equity depress value so ride market downturn investor utilize prudent asset location plan determine hold target equity fix income exposure westley say asset location plan consist consider different tax characteristic asset class vehicle account be hold order gain better tax rate return say westley be cpa pfs serve aicpa personal financial specialist credential committee example corporate bond corporate bond fund generate ordinary interest income be best hold tax defer retirement account municipal bond holding pay federally tax free income work better taxable account more thing change more stay same include perennial worry future social security meanwhile dependence many retiree social security also remain same sub yield year treasury note now annual cash flow say social security equal more retirement income treasury favorable taxation inflation protection well lifetime payout social security still address key retiree concern so well worth effort keep tactic boost benefit more rule mix earn income social security benefit have be ease story work retirement show pick extra income pursue dream career yet still get full payout uncle sam many person retirement equal relocation special report article live retirement explore need know call home stay put familiar surrounding move retirement community live abroad day smart technology used sensor camera bluetooth be help retiree keep home same time increase mobility more slott cpa rockville centre new york put taxe be single biggest factor much spend retirement recently enact tax cut job act increase tax pressure cross state line many retiree previously taxpayer have be able deduct state local tax salt income federal tax return now salt deduction be capped year limit cause many person especially retiree aren work bound high tax state go reduce salt outflow new tax law also affected ira slott say impact be feel person convert tax defer traditional ira roth ira eventually deliver tax free cash flow low tax rate new law reduce tax such conversion roth ira conversion be undo have past ir recently explain conversion be reversed completely partially oct say slott reversal make sense ira owner doesn want pay full amount tax say account have lose value now type win be allow slott say so roth ira conversion be best implement late year be calculate qualify relatively low tax rate new tax law also increase federal estate tax exemption thus fewer retiree have less worry estate tax plan say special report estate plan checklist story go document need order make asset transfer intend attorney choate urge retiree make sure retirement plan other beneficiary designation be date review estate plan lawyer make sure plan administrator agree be beneficiary say asset generally flow beneficiary record even say otherwise therefore retirement plan guide offer powerful lineup help make transition workforce work free work less also article describe ibd slim investment program do retirement account retire check prominent financial advice expert ric edelman start finish special report help create maintain financial plan help ensure financial success even paycheck stop related be stock go
10,TROW,mutual fund make perfect sense most investor especially busy novice investor do really know buy mutual fund meet objective matter sell mutual fund investing fund get professional management access diversify portfolio stock bond reasonable cost fund also increase likelihood reach retirement other financial goal mutual fund come shape size so need way pick best fund few quick step put portfolio fund custom design take step help financial advisor guidance provide brokerage major mutual fund company include fidelity charle schwab schw rowe price trow vanguard american fund franklin templeton ben jpmorgan chase jmp blackrock blk advisor fund company broker provide form fill age current asset expect retirement income need risk tolerance not sure risk tolerance don worry questionnaire suss detail investor profile help guide fund appropriate portfolio profile include time horizon need money long have invest want buy car next year house year get kid college year retire obviously have more goal so construct portfolio mind age also affect investment horizon example wouldn invest retirement re same way re investor profile help target allocation stock bond domestic foreign security be asset mix achieve selection mutual fund portfolio generally younger be longer investment horizon more risk tolerate stock fund provide higher return time tend be more volatile bond fund so younger be more aggressive be investing stock temporary decline be make stock market recover move new high re near retirement less tolerant volatility investor profile become more conservative guide greater allocation bond fund many need range more half dozen get newsletter deliver inbox more info product service privacy policy term useyour selection work be choose target date fund ll only need invest diversify mix mutual fund diversify broad array stock bond major fund family offer fund change asset mix time go suit evolve risk tolerance example plan retire year so choose vanguard target retirement vttvx happen be largest target date fund invest vanguard fund accord morningstar direct top weight be fund invest vanguard total stock market index fund vtsmx vanguard total bond market ii index fund vtbix vanguard total international stock index fund vtsnx vanguard total international bond index fund vtibx rowe price fidelity american fund jpmorgan principal fund be also big player target date fund work financial advisor broker build investment profile then present appropriate portfolio fund want build own build portfolio exclusively mostly fund company many fund fund many fund company choose have portfolio company open account major fund company pick choose best fund several fund company then ll do brokerage account schwab fidelity td ameritrade trade other broker have platform investing fund traditional breakdown average risk tolerance be equity bond percentage equity be younger person more aggressive risk tolerance be closer retirement lower risk tolerance advisor fine tune asset mix average investor equity side be stock rest be international say ed kohlhepp ceo kohlhepp investment advisor register investment advisor rium doylestown pa stock fund be large cap rest split small midcap fund international fund third develop country fund rest emerge market most advisor recommend large cap stock fund be index fund track such vanguard index vfinx look active fund small midcap area kohlhepp say interest rate rise investor favor bond fund shorter duration mean price navs be less sensitive change interest rate suggest buy least fund invest treasury corporate high yield bond say foreign bond not be more bond allocation start search want look fund have outperformed benchmark range period be more likely have proven investment strategy don winner ibd mutual fund award be good place start ibd weekly fund personal finance section run screen top perform fund daily screen cover several category appear online fund etfs investor com ibd datum table morningstar inc lipper inc be prominent fund ranking service feature risk adjust rating however performance isn only criterium pick fund eric aane president titus wealth management rium larkspur calif say criterium choose mutual fund be manager tenure expense finally performance advisor insist long record also want see longevity fund manger say al martinez manage director hightower advisor boca raton rium boca raton fla be try find manager distinguish market protect market martinez look manager tenure individual team approach prefer team then want see manager eat own cook do invest own fund third be fund allow hold cash be important provide protection downturn ultimately come also allow manager make purchase opportunity arise most important thing need know sell mutual fund be get fund fund underperform benchmark badly prolong period be put review replacement also pay attention manager change marina gross executive vice president portfolio research consult natixis global asset management boston say important tag investment purpose hold accountable role portfolio fail deliver objective reason selling assign purpose role asset portfolio gross say equity be meant drive return then be key criterium utility value be risk mitigation then basis measure fund reason selling fund be situational say roger young senior financial planner fund giant rowe price include change allocation risk level rebalance portfolio feel stock value be too high want reduce exposure favore opportunity need cash version article originally be publish april also here list best mutual fund award winner invest fidelity stock guru john rothtip keep retirement plan track read full reportview profile top perform mutual fund
11,TROW,relative strength rs rating kkr kkr enter new percentile wednesday rise look best stock buy watch be sure pay attention relative price strength ibd proprietary rating identify market leadership worst best score score show stock price movement last week stack other stock database year market history reveal best stock tend have rs rating least early stage move see ibd help make more money stockskkr be now consider extend buy range clear buy point first stage flat base see stock form new pattern follow buy opportunity week tight pullback day week line top bottom line growth moved higher last quarter earning be compare prior report revenue increase company hold rank peer finance investment management industry group jupai jp sei investment seic price rowe group trow be top highly rate stock group related stock rise relative strength ratingswhy use ibd relative strength rating relative strength line help judge stock
12,TROW,tuesday federated investor fii reach important technical milestone see relative strength rs rating jump percentile improvement day re research best stock buy watch be sure pay attention relative price strength ibd proprietary rating identify price performance worst best score rating show stock price behavior trail week stack other stock database year market history show top perform stock tend have better rs rating begin biggest run see ibd help make more money stocksfederate investor have moved more past entry first stage cup handle meaning now proper buy range look stock offer new chance pick share week tight pullback day week line top bottom line growth moved higher last quarter earning be compare prior report revenue increase company earn rank peer finance investment management industry group jupai jp sei investment seic price rowe group trow be top highly rate stock group related stock be show rise relative strength use ibd relative strength rating relative strength line help judge stock
13,TROW,important metric look stock be higher relative strength rating blackrock blk just hit mark jump thursday exclusive rating investor business daily measure price performance worst best score score show stock price behavior last week stack other stock database history show best stock tend have rs rating north launch biggest climb look best stock buy watch start hereblackrock have rise more past entry first stage flat base meaning now proper buy range look stock offer new chance pick share week tight pullback day week line blackrock show ep growth most recent report sale growth come look next report oct company hold rank peer finance investment management industry group jupai jp noah noah price rowe group trow be top highly rate stock group related stock rise relative strength ratingswhy use ibd relative strength rating relative strength line help judge stock
14,TROW,relative strength rs rating artisan partner asset management apam moved new percentile thursday get lift ibd proprietary rating track market leadership worst best score rating show stock price performance trail week compare other stock database year market history show top perform stock tend have better rs rating early stage move see artisan partner asset management continue show renew price strength clear threshold look best stock buy watch start hereartisan partner asset management be build cup handle entry see stock clear price volume least higher normal term fundamental health company have post rise ep growth last quarters sale gain have also rise same period artisan partner asset management be expect release next quarterly number oct artisan partner asset management earn rank peer finance investment management industry group jupai jp cif price rowe group trow be top highly rate stock group related stock be show improve price performance use ibd relative strength rating relative strength line help judge stock
15,TROW,janus capital jhg have relative strength rs rating upgrade thursday welcome improvement still short better score look ibd unique rating track market leadership worst best score score show stock price performance trail week compare other stock database history reveal market biggest winner tend have rs rating north begin biggest price move see janus capital continue show renew price strength clear threshold look best stock buy watch start herejanus capital be build flat base entry see clear price heavy trade earning growth decrease most recent report revenue gain moved higher next quarterly result be expect oct company earn rank peer finance investment management industry group jupai jp cif price rowe group trow be top highly rate stock group related ibd stock rating upgrade rise relative strengthwhy use ibd relative strength rating relative strength line help judge stock
16,TROW,think defense be company charge keep america military strong supplier bomber jet missile warfare system other specialize gear capped strong week solid gain showdown north korea nuclear ambition appear intensify lockheed martin lmt reach high surpass buy point narrow
17,TROW,wednesday price rowe group trow get upgrade relative strength rs rating proprietary rating measure technical performance used worst best score identify stock price action trail week match other stock history reveal market biggest winner tend have rs rating least early stage move stock be work flat base entry see stock break heavy volume company show ep growth last quarter revenue rise price rowe group hold rank peer finance investment management industry group jupai jp be rank stock group related stock be show rise relative strength use ibd relative strength rating relative strength line help judge stock
18,TROW,relative strength rs rating affiliated manager amg enter higher percentile tuesday get lift exclusive rating investor business daily identify market leadership worst best score score show stock price movement trail week compare other stock database year market history show top perform stock tend have rs rating north launch largest run see affiliated manager continue show renew price strength hit benchmark stock be try complete flat base entry see stock break volume least higher normal earning growth drop most recent quarter revenue moved higher company hold rank peer finance investment management industry group jupai jp carlyle group cg price rowe group trow be top highly rate stock group related stock be show improve technical action use ibd relative strength rating relative strength line help judge stock
