,ticker,content
136,TROW,daunting loss market wednesday result nasty reversal several growth name hit new high earlier session carnage be everywhere asset manager track ibd finance investment management group pillar strength recent rally be particularly hard hit blackrock blk reversed hard heavy volume hit fresh high fall
137,TROW,wouldn imagine biggest company field solid financial stock month be think layoff nonetheless strategy blackrock blk world largest asset manager march company say next few month cut loose employee
138,TROW,do right customer have good shot success
139,TROW,thomas rowe price jr ride theme decade deliver stellar investment result client
140,TROW,price founder be now rowe price group trow
141,TROW,humble beginning small time investment advisory firm baltimore base company have swell global investment powerhouse more management
142,TROW,price be growth stock such investing be cool
143,TROW,be first describe use terminology growth stock jenk cromwell portfolio manager capital year rowe price tell ibd
144,TROW,forbe deem price sage baltimore lesser know investor be profile book lesson legend wall street financial planner nikki ross deem visionary growth investor
145,TROW,growth stock pioneer be also profile money master time book investment manager john train investing be life most greatest investor artist professional sort rowe price lose task
146,TROW,price be far overnight sensation many early venture have rough start have strong conviction persevere
147,TROW,price build business reputation hard work long hour great foresight passion didn care other thought investment strategy simply do own research draw own conclusion
148,TROW,take stock
149,TROW,price believe human company go life cycle big money come hold long term train note book price hold toolmaker black decker year drugmaker merck mrk year
150,TROW,be very intellectually open be always look environment say former rowe price chairman george roche be very open new idea say always love good investment fight
151,TROW,potential big money be draw many work investment world price wasn bling come cash
152,TROW,didn drive big fancy car note cromwell didn have chauffeur be hardworking plain vanilla
153,TROW,roche say be insomniac so wake middle night always keep pencil paper bedside so jot idea be roll head
154,TROW,price background wasn business finance economic graduate swarthmore college philadelphia degree chemistry have short stint couple chemical firm go business layer
155,TROW,then interest be diverge chemistry rowe price history say be spending night read financial magazine instead learn more proton neutron
156,TROW,work make career change joined small brokerage firm then land mackubin goodrich co predecessor today legg mason lm rise stockbroker head bond department
157,TROW,price didn enjoy selling part investment business love be find next gem
158,TROW,convince mackubin goodrich let head investment management department didn last long year later firm shut operation fail turn profit
159,TROW,market environment be help price be thick great depression still figured do better be accomplish mackubin goodrich set build own firm be
160,TROW,investor didn exactly line hand price money struggle pay staff yet hung depression then find foot
161,TROW,start first mutual fund growth stock fund so client invest child fund take advantage recently pass uniform gift minor act gain be taxed child rate
162,TROW,young idea
163,TROW,idea start mutual fund wasn build big empire mutual fund explain cromwell mutual fund idea be help provide more practical way child client participate same investment wisdom philosophy scale didn get complicate fee so
164,TROW,price growth stock fund didn have sale charge investor be free invest little much want
165,TROW,growth stock fund be huge winner investment have swell assume reinvestment capital gain dividend wiesenberger investment rating firm now part thomson reuter rate year performance
166,TROW,price start fund begin be tepid new horizon fund focuse young company fund rise paled vs gain get next year fund flopping vs loss
167,TROW,founder new horizon fund concentrated smaller company acorn company so speak be bond didn do anything everybody be kid say be new horizontal fund recall cromwell
168,TROW,new horizon fund finally get go surge vs want piece action investor flooded money price have make lot fee turn new investment barrage new money compromise performance force portfolio manager put money work somewhere
169,TROW,close fund shareholder say cromwell
170,TROW,detail
171,TROW,price methodology start firm dealt more find company fast grow earning roche explain price look firm
172,TROW,absence cutthroat competition other
173,TROW,free excessive labor cost
174,TROW,well manage
175,TROW,fit mold niche price know well college day drugmaker
176,TROW,industry mr price like most be pharmaceutical say roche now re talk pharmaceutical industry be industry sustain high return equity strong growth year
177,TROW,add drug have research development innovation have patent protection have absence union interference have industry have average growth back old day have good management add really powerful growth industry
178,TROW,price biggest winner pharmaceutical be sharp dohme surge abbott laboratory gain more
179,TROW,avoid industry have opposite old steel industry everybody like old day say roche be business initially old day be still burn depression start other investor want stock have high yield then didn worry growth say exact opposite
180,TROW,price also checked technical
181,TROW,mr price love chart say roche be just tool box have toolbox tool be go use
182,TROW,rowe price group go public year price death go stock run do right customer have good shot success thomas rowe price jr ride theme decade deliver stellar investment result client price founder be now rowe price group trow humble beginning small time investment advisory firm baltimore base company have swell global investment powerhouse more management price be growth stock such investing be cool be first describe use terminology growth stock jenk cromwell portfolio manager capital year rowe price tell ibd forbe deem price sage baltimore lesser know investor be profile book lesson legend wall street financial planner nikki ross deem visionary growth investor growth stock pioneer be also profile money master time book investment manager john train investing be life most greatest investor artist professional sort rowe price lose task price be far overnight sensation many early venture have rough start have strong conviction persevere price build business reputation hard work long hour great foresight passion didn care other thought investment strategy simply do own research draw own conclusion take stockprice believe human company go life cycle big money come hold long term train note book price hold toolmaker black decker year drugmaker merck mrk year be very intellectually open be always look environment say former rowe price chairman george roche be very open new idea say always love good investment fight potential big money be draw many work investment world price wasn bling come cash didn drive big fancy car note cromwell didn have chauffeur be hardworking plain vanilla roche say be insomniac so wake middle night always keep pencil paper bedside so jot idea be roll head price background wasn business finance economic graduate swarthmore college philadelphia degree chemistry have short stint couple chemical firm go business layer then interest be diverge chemistry rowe price history say be spending night read financial magazine instead learn more proton neutron work make career change joined small brokerage firm then land mackubin goodrich co predecessor today legg mason lm rise stockbroker head bond department price didn enjoy selling part investment business love be find next gem convince mackubin goodrich let head investment management department didn last long year later firm shut operation fail turn profit market environment be help price be thick great depression still figured do better be accomplish mackubin goodrich set build own firm be investor didn exactly line hand price money struggle pay staff yet hung depression then find foot start first mutual fund growth stock fund so client invest child fund take advantage recently pass uniform gift minor act gain be taxed child rate young idea idea start mutual fund wasn build big empire mutual fund explain cromwell mutual fund idea be help provide more practical way child client participate same investment wisdom philosophy scale didn get complicate fee so price growth stock fund didn have sale charge investor be free invest little much want growth stock fund be huge winner investment have swell assume reinvestment capital gain dividend wiesenberger investment rating firm now part thomson reuter rate year performance price start fund begin be tepid new horizon fund focuse young company fund rise paled vs gain get next year fund flopping vs loss founder new horizon fund concentrated smaller company acorn company so speak be bond didn do anything everybody be kid say be new horizontal fund recall cromwell new horizon fund finally get go surge vs want piece action investor flooded money price have make lot fee turn new investment barrage new money compromise performance force portfolio manager put money work somewhere close fund shareholder say cromwell detailsprice methodology start firm dealt more find company fast grow earning roche explain price look firm absence cutthroat competition other free excessive labor cost well manage fit mold niche price know well college day drugmaker industry mr price like most be pharmaceutical say roche now re talk pharmaceutical industry be industry sustain high return equity strong growth year add drug have research development innovation have patent protection have absence union interference have industry have average growth back old day have good management add really powerful growth industry price biggest winner pharmaceutical be sharp dohme surge abbott laboratory gain more avoid industry have opposite old steel industry everybody like old day say roche be business initially old day be still burn depression start other investor want stock have high yield then didn worry growth say exact opposite price also checked technical mr price love chart say roche be just tool box have toolbox tool be go use rowe price group go public year price death go stock run
183,TROW,stock step firm trade wednesday earning related move drive early action nasdaq slip dow jone industrial average volume rise board nasdaq nyse compare same time tuesday slump march durable good order combine barrage
184,TROW,investment firm legg mason lm be purchasing fauchier partner london base fund hedge fund company bnp pariba investment partner fauchier asset merge legg mason fund fund firm permal new unit have asset management fund fund hold portfolio other investment fund deal be set
185,TROW,market have play john hancock large cap equity fund hand past month most other period bidding high quality stock fund buy favorable price fund aim buy stock be trading cent less fund manager judge intrinsic value approach
186,TROW,update earning news better forecast housing datum boost stock new multimonth high thursday
187,TROW,nasdaq extend streak session now month peak chip lag philadelphia semiconductor index still rise
188,TROW,meanwhile nyse composite climb dow hit month high
189,TROW,volume finished sharply higher board
190,TROW,green mountain coffee roaster gmcr rally record high heavy trade coffee distributor report earning wednesday analyst see profit run cent share
191,TROW,wm industry wm gain more twice average trade gaming equipment firm clear buy point double bottom base
192,TROW,chipotle grill cmg stage grande upside reversal share rise nearly time average trade fast food chain be session low chipotle now sit past buy point cup handle base
193,TROW,leader didn fare well
194,TROW,com shed more triple average volume shanda interactive entertainment snda fall double normal trade susquehanna cut com neutral shanda negative
195,TROW,stec stec reversed record high drop snap flash memory product maker session streak company report earning aug analyst see profit surge
196,TROW,hour action amazon com amzn microsoft msft fall report disappointing sale american express axp netflix nflx also report lighter expect sale american express be hour netflix trade erratically
197,TROW,earning friday black decker blk fortune brand ingersoll rand ir lm ericsson eric optionsxpress oxps schlumberger slb rowe price trow
198,TROW,sole piece economic datum friday be revise university michigan consumer sentiment index
199,TROW,update index surge heavier trade
200,TROW,vincent mao
201,TROW,stock give ground final minute trading still close big gain thursday
202,TROW,nasdaq nyse composite surge rise dow
203,TROW,volume jump major exchange advancer trounce decliner more nyse more nasdaq
204,TROW,houseware medical equipment build material stock be few thursday top perform industry computer peripheral maker school operator mining be worst performer
205,TROW,update index ease late trade nasdaq eye
206,TROW,vincent mao
207,TROW,stock pull back hold lion share day gain late trade thursday
208,TROW,nyse composite rally dow
209,TROW,meanwhile nasdaq sprint pace straight gain tech heavy index last session run be back january part session advance
210,TROW,volume be again run vastly higher exchange
211,TROW,millicom international cellular micc vault month high put telecom service provider past buy point week cup base
212,TROW,bj restaurant bjri rally ahead earning close analyst see profit rise cent share
213,TROW,microsoft msft also report close share rise month high world biggest software maker be expect post earning cent share sale
214,TROW,update index pack more gain
215,TROW,vincent mao
216,TROW,major index continue tack gain afternoon trading thursday
217,TROW,nyse composite surge nasdaq dow
218,TROW,volume be again tracking sharply higher board especially nasdaq
219,TROW,wm industry wm climb clear buy point double bottom base gaming equipment firm report earning aug analyst see earning rise cent share
220,TROW,group mate ameristar casino asca reversed early loss rise stock be add potential handle own double bottom pattern
221,TROW,green mountain coffee roaster gmcr extend earlier gain share rise new record high
222,TROW,overall leader be have nice day more ibd stock be trading side
223,TROW,update index push ahead early afternoon trade
224,TROW,vincent mao
225,TROW,consolidate gain past hour stock push new session high
226,TROW,nyse composite rally dow nasdaq climb
227,TROW,philadelphia semiconductor index rise just component issue sandisk sndk gap tumble lackluster sale outlook
228,TROW,turnover be again run sharply higher board advancer thrash decliner more nyse more nasdaq
229,TROW,medarex medx gap fly bristol myer squibb bmy agree buy biotech cash medarex technology platform person pipeline provide strong complement company biologic strategy specifically immuno oncology bristol myer ceo james cornelius say press release
230,TROW,amazon com amzn rally month high heavy trading late wednesday commerce giant say buy online shoe retailer zappos com amazon also report result close analyst expect earning cent share sale
231,TROW,downside chinese online gamer pull back
232,TROW,com shed shanda interactive entertainment snda fall nearly susquehanna downgrade
233,TROW,update market rally gain steam midday
234,TROW,jonah keri
235,TROW,stock gain continue accelerate midday thursday
236,TROW,nasdaq surge dow nyse composite
237,TROW,volume turn higher board swell nyse nasdaq compare same period wednesday
238,TROW,green mountain coffee roaster gmcr follow monday big coffee roaster distributor gain nearly twice normal trade
239,TROW,stec stec ramp average volume chipmaker have be market top perform leader past few month pace ninth straight day gain time high stock have rocket past week be week break high tight flag pattern july
240,TROW,netflix nflx climb rapid turnover online movie rental subscription service provider have be form base week set report quarterly earning result market close
241,TROW,update stock build gain accelerate volume
242,TROW,update earning news better forecast housing datum boost stock new multimonth high thursday nasdaq extend streak session now month peak chip lag philadelphia semiconductor index still rise meanwhile nyse composite climb dow hit month high volume finished sharply higher board green mountain coffee roaster gmcr rally record high heavy trade coffee distributor report earning wednesday analyst see profit run cent share wm industry wm gain more twice average trade gaming equipment firm clear buy point double bottom base chipotle grill cmg stage grande upside reversal share rise nearly time average trade fast food chain be session low chipotle now sit past buy point cup handle base leader didn fare well com shed more triple average volume shanda interactive entertainment snda fall double normal trade susquehanna cut com neutral shanda negative stec stec reversed record high drop snap flash memory product maker session streak company report earning aug analyst see profit surge hour action amazon com amzn microsoft msft fall report disappointing sale american express axp netflix nflx also report lighter expect sale american express be hour netflix trade erratically earning friday black decker blk fortune brand ingersoll rand ir lm ericsson eric optionsxpress oxps schlumberger slb rowe price trow sole piece economic datum friday be revise university michigan consumer sentiment index update index surge heavier tradeby vincent maostock give ground final minute trading still close big gain thursday nasdaq nyse composite surge rise dow volume jump major exchange advancer trounce decliner more nyse more nasdaq houseware medical equipment build material stock be few thursday top perform industry computer peripheral maker school operator mining be worst performer update index ease late trade nasdaq eye vincent maostock pull back hold lion share day gain late trade thursday nyse composite rally dow meanwhile nasdaq sprint pace straight gain tech heavy index last session run be back january part session advance volume be again run vastly higher exchange millicom international cellular micc vault month high put telecom service provider past buy point week cup base bj restaurant bjri rally ahead earning close analyst see profit rise cent share microsoft msft also report close share rise month high world biggest software maker be expect post earning cent share sale update index pack more gainsby vincent maomajor index continue tack gain afternoon trading thursday nyse composite surge nasdaq dow volume be again tracking sharply higher board especially nasdaq wm industry wm climb clear buy point double bottom base gaming equipment firm report earning aug analyst see earning rise cent share group mate ameristar casino asca reversed early loss rise stock be add potential handle own double bottom pattern green mountain coffee roaster gmcr extend earlier gain share rise new record high overall leader be have nice day more ibd stock be trading side update index push ahead early afternoon tradeby vincent maoafter consolidate gain past hour stock push new session high nyse composite rally dow nasdaq climb philadelphia semiconductor index rise just component issue sandisk sndk gap tumble lackluster sale outlook turnover be again run sharply higher board advancer thrash decliner more nyse more nasdaq medarex medx gap fly bristol myer squibb bmy agree buy biotech cash medarex technology platform person pipeline provide strong complement company biologic strategy specifically immuno oncology bristol myer ceo james cornelius say press release amazon com amzn rally month high heavy trading late wednesday commerce giant say buy online shoe retailer zappos com amazon also report result close analyst expect earning cent share sale downside chinese online gamer pull back com shed shanda interactive entertainment snda fall nearly susquehanna downgrade update market rally gain steam middayby jonah keristock gain continue accelerate midday thursday nasdaq surge dow nyse composite volume turn higher board swell nyse nasdaq compare same period wednesday green mountain coffee roaster gmcr follow monday big coffee roaster distributor gain nearly twice normal trade stec stec ramp average volume chipmaker have be market top perform leader past few month pace ninth straight day gain time high stock have rocket past week be week break high tight flag pattern july netflix nflx climb rapid turnover online movie rental subscription service provider have be form base week set report quarterly earning result market close update stock build gain accelerate volume
243,TROW,investment adviser financial manager rowe price group trow have increase dividend year row annual payout have more double past year current dividend yield be rowe have be show interesting chart action stock clear cup handle base early november cup handle
244,TROW,rowe price group inc trow free report announce preliminary asset management aum june reflect nearly rise previous month client transfer mutual fund other portfolio include trust separate account be june month end total sponsored mutual fund come marginally prior month total sponsored mutual fund be stock blended asset remain come fix income money market total other investment portfolio be reflect increase previous month overall stock blended asset account other investment portfolio money market fix income come rowe price record target date retirement portfolio slightly prior month regulatory restriction sluggish economic recovery be likely impair company growth escalate cost rowe price diverse efficient business model be anticipate help further improve aum also organic growth remain impressive indicated continuous rise revenue so believe drive stock have gain year date versus decline record industry rowe currently have zack rank hold see complete list today zack rank strong buy stock here competitive landscapeamong other investment manager franklin resource ben free report announce preliminary aum subsidiary june result display rise record net market decline net outflow month be negative further figure dip prior year quarter legg mason lm free report report preliminary june month end aum record aum include net long term outflow nearly invesco ltd ivz free report report preliminary month end aum june figure reflect decrease prior month medical stock buy nowzack name company poise ride medical breakthrough be target cure leukemia aids muscular dystrophy hemophilia other condition new product field be already generate substantial revenue even more wondrous treatment be pipeline early investor realize exceptional profit click here see stock
245,TROW,invesco ltd ivz free report report preliminary month end asset management aum june figure reflect decrease prior month fall have be mainly due unfavorable market return decrease money market aum net long term outflow management fee earn aum outflow moreover fx decrease june aum invesco preliminary average total aum quarter jun be preliminary average active aum come end report month invesco equity aum decline previous month further fix income aum decrease level moreover money market aum be last month additionally balanced aum decline prior month alternative aum decrease last month company have be witness continue growth aum past few year support revenue growth overall challenge operate environment seem be weigh investor mind present invesco currently carry zack rank sell past year share company have lose industry rally see complete list today zack rank strong buy stock here apart invesco franklin resource inc ben free report report preliminary aum subsidiary june reflect increase prior month further legg mason inc lm free report rowe price group inc trow free report be expect announce aum figure soon hottest tech mega trend year generate global revenue predict blast roof fame investor mark cuban say produce world first trillionaire still leave plenty money regular investor make right trade early see zack best stock play trend
246,TROW,franklin resource ben free report have announce preliminary asset management aum subsidiary june result display rise record net market decline net outflow month be negative further figure dip prior year month end total equity asset come previous month marginally year year total equity asset be international source remain come unite state total fix income asset be previous month previous year overall tax free asset account only fix income asset remain be taxable franklin record hybrid asset be slightly witness previous month report june cash management fund come prior month figure record year period company global footprint be exceptionally favorable strategic point aum be well diversify nevertheless regulatory restriction sluggish economic recovery mar aum growth escalate cost currently franklin carry zack rank hold share company have decline last month compare loss incur industry see complete list today zack rank strong buy stock here other asset manager invesco ltd ivz free report rowe price group inc trow free report legg mason inc lm free report be expect release preliminary aum result june later week more stock news be bigger iphone become mother technological revolution apple sell mere iphone year new breakthrough be expect generate more device just year create market zack have just release special report spotlight fast emerge phenomenon ticker take advantage don buy now kick click here trade
