,ticker,content
511,URI,here be stock buy rank strong value characteristic investor consider today june unite rental inc uri free report rental service provider have zack rank strong buy see zack consensus estimate current year earning rise last day unite rental inc price consensus unite rental inc price consensus chart unite rental inc quoteunite rental have price earning ratio compare industry company possess value score unite rental inc pe ratio ttm unite rental inc pe ratio ttm unite rental inc mt free report steel company have zack rank buy see zack consensus estimate current year earning increase last day arcelormittal price consensus arcelormittal price consensus chart arcelormittal have price earning ratio compare industry company possess value score arcelormittal pe ratio ttm arcelormittal pe ratio ttm arcelormittal quotexerox corporation xrx free report developer document management system have zack rank buy see zack consensus estimate current year earning increase last day xerox corporation price consensus xerox corporation price consensus chart xerox corporation quotexerox have price earning ratio compare industry company possess value score xerox corporation pe ratio ttm xerox corporation pe ratio ttm xerox corporation quotesee full list top rank stock herelearn more value score be calculate here more stock news be bigger iphone become mother technological revolution apple sell mere iphone year new breakthrough be expect generate more device just year create market zack have just release special report spotlight fast emerge phenomenon ticker take advantage don buy now kick click here trade
512,URI,here be stock buy rank strong value characteristic investor consider today june unite rental inc uri free report rental service provider have zack rank buy see zack consensus estimate current year earning rise last day unite rental inc price consensus unite rental inc price consensus chart unite rental inc quoteunite rental have price earning ratio compare industry company possess value score unite rental inc pe ratio ttm unite rental inc pe ratio ttm unite rental inc quotebig sporting good corporation bgfv free report sporting good retailer have zack rank strong buy see zack consensus estimate current year earning soar last day big sporting good corporation price consensus big sporting good corporation price consensus chart big sporting good corporation quotebig sporting good have price earning ratio compare industry company possess value score big sporting good corporation pe ratio ttm big sporting good corporation pe ratio ttm big sporting good corporation quoterci hospitality holding inc rick free report restaurant chain have zack rank buy see zack consensus estimate current year earning increase last day rci hospitality holding inc price consensus rci hospitality holding inc price consensus chart rci hospitality holding inc quoterci have price earning ratio compare industry company possess value score rci hospitality holding inc pe ratio ttm rci hospitality holding inc pe ratio ttm rci hospitality holding inc quotevectrus inc vec free report business service provider have zack rank buy see zack consensus estimate current year earning increase last day vectrus inc price consensus vectrus inc price consensus chart vectrus inc quotevectrus have price earning ratio compare industry company possess value score vectrus inc pe ratio ttm vectrus inc pe ratio ttm vectrus inc quotesee full list top rank stock herelearn more value score be calculate here look stock skyrocket upside zack have just release special report boom investment opportunity legal marijuana ignited new referendum legislation industry be expect blast already robust early investor stand make kill have be ready act know just look see pot trade re target
513,URI,unite rental inc uri free report share have rally past year outperform gain industry belong be largest equipment rental company world unite rental enjoy strong brand recognition enable draw more customer build customer loyalty price performance company be backed impressive earning history unite rental surpass earning estimate consistently past quarters moreover earning estimate have rise past few week suggest bullish sentiment unite rental past day zack consensus estimate earning rise bullish trend justify stock zack rank buy see complete list today zack rank strong buy stock here make unite rental solid pick solid growth prospect company main strategy be improve profitability provide superior standard service customer optimize customer mix fleet mix strategic acquisition expand core equipment rental business continue expansion trench power pump footprint tool offering particular unite rental strategy call implementation project xl be set specific work stream focuse drive profitable growth revenue opportunity generate incremental profitability cost saving company have robust earning growth profile company earning grow year average last year company top line also increase year average same time period company have gradually increase industrial exposure cyclical specialty acquaintance unite rental have solid growth prospect be evident zack consensus estimate earning share current year be expect grow year year higher industry average meanwhile company sale be expect increase higher industry average expansion acquisition unite rental be expand geographic border product portfolio acquisition joint venture march unite rental acquire asset industrial rental service lead provider way radio solution industrial blind primarily gulf west coast region acquisition expand unite rental tool solution specialty rental fleet more isolation blind flange rac system industrial application well approximately radio repeater accessory plant maintenance construction personnel most important acquisition make be neff corporation ne rental neff corporation enhance company earthmoving equipment efficiency scale key market area other hand acquisition ne rental expand unite rental geographic footprint key market east coast gulf state midwest further establish company aerial supplier unite rental adjust ebitda margin expand basis point year year last report quarter continue benefit integration sizable acquisition namely ne neff valuation look rational unite rental have value style score putt top stock cover perspective company currently have trail month ratio industry average indicate stock be undervalue compare peer also company have forward ratio lower industry average so be fair say slightly more value oriented path be ahead stock term also company currently have trail month ev ebitda ratio industry average positive construction market demand unite rental product be largely related performance broader construction market latest report unite state department commerce construction spending april surge highest settlement january also mark biggest increase chamber commerce commercial construction index total contract country witness surge profit margin such demand unite rental product increase well thereby drive revenue also industry belong have decent industry rank top industry signale company space be likely benefit favorable broader factor immediate future other stock considerother top rank stock same space be century community inc ccs free report beazer home usa inc bzh free report lennar corporation len free report century community sport zack rank earning current year be likely increase beazer home be zack rank stock earning current quarter be expect grow lennar carry zack rank fiscal earning be expect grow make fortune shift electric car here stock idea consider much petroleum year lithium power soon shake world create millionaire reshape geo politic soon electric vehicle evs be cheaper gas guzzler be already reach mile single charge battery price plummet charge station set multiply company stand stock buy accord zack research not think see ticker free
514,URI,latest report unite state department commerce construction spending surge highest settlement january also mark biggest increase construction market unite state have be look time now chamber commerce commercial construction index total contract country witness surge profit margin further broad base factor low level unemployment strong job addition construction sector positive consumer confidence have be instrumental propel sector growth take such factor consideration investing stock sector fetch spectacular return construction activity spring back spending unite state rise april compare slump march seasonally adjust spending rate april be higher same period year also consensus estimate month april be increase such increase be make possible increase spending private construction project steadily rise april marked biggest increase january further outlay private residential construction surge highest settlement november follow decline previous month apart outlay residential construction jump april investment public construction witness decline month fall increase march further outlay construction project federal government fall sharply increase close march steady job addition construction latest datum bureau labor statistic total new job be add economy construction industry alone associate builder contractor abc analysis datum approximately job be add sector year year basis marked biggest increase april further bureau labor statistic also state april construction industry offer average weekly wage higher overall weekly average moreover unemployment rate sector decline percentage point mark lowest level july also add gain be fact national unemployment rate plummet lowest settlement april hot construction spending rise highest level many month space be poise gain immensely day ahead not only do sector hire more april also offer steeper wage overall average further trump business friendly policy include tax cut repeal regulation have propel sector growth zack construction sector be currently place top zack sector context have select stock be expect gain factor stock carry zack rank strong buy buy see complete list today zack rank stock here patrick industry inc patk free report be manufacturer seller build material product unite state canada company be base elkhart indiana have zack rank expect earning growth rate current year be zack consensus estimate current year have improve last day norbord inc osb free report be producer wood base panel industrial manufacturer retail chain well contractor supply yard company be base toronto ontario have zack rank expect earning growth rate current year be zack consensus estimate current year have improve last day sterling construction company inc strl free report be engage civil well residential construction unite state company be base woodland texas have zack rank expect earning growth rate current year be zack consensus estimate current year have improve past day boise cascade company bcc free report be manufacturer distributor wood product construction build material company be base boise idaho have zack rank expect earning growth rate current year be zack consensus estimate current year have improve last day unite rental inc uri free report provide equipment rental service construction company globe company be base stamford connecticut have zack rank expect earning growth rate current year be zack consensus estimate current year have improve past day look stock skyrocket upside zack have just release special report boom investment opportunity legal marijuana ignited new referendum legislation industry be expect blast already robust early investor stand make kill have be ready act know just look see pot trade re target
515,URI,erratic movement major market index last week many analyst find quite tricky spot prime factor extreme volatility dow jone industrial average rise feb wild week fear downturn future grip market however chance recession be negligible give record low unemployment level better expect job addition favorable fourth quarter earning also act antidote market bleed last weekon average dow moved more point day week market see index direction roughly time wall street journal moreover weekly decline index be steepest more year encourage wage growth datum convince investor probable spike inflation lead central bank raise interest rate sooner expect bureau labor statistic private sector worker witness year year wage growth january highest june fear impending inflation lead drop dow record high mark jan chance recession negligible most analyst believe market be overdue correction major index even plunge further not lead recession anytime soon sign recession be normally reflect indicator gdp employment datum parameter show sign recession gdp datum solid nation gdp increase seasonally adjust annual rate final month follow gain previous quarters more advance estimate release bureau economic analysis fact marked economy strongest stretch growth expansion start mid notably first quarter year gdp jump latest estimate atlanta fed significant job addition low unemployment labor department report new farm payroll job be create january beating market expectation accord survey reuter most economist be expect addition job also jobless rate remain ultra low level worker hourly wage increase year year january favorable earning dispel fearswe be almost tail end earning season member have report number yet report latest earning preview total earning company be same period last year higher revenue expect year year earning growth fourth quarter be way higher growth rate respectively moreover expect index earning increase respectively stock focus give healthy expectation earning most analyst believe market not be unstable long pick stock strong fundamental seem be smart option task be daunting be vgm score come handy here stand value growth momentum score be weight combination score such score allow eliminate negative aspect stock select winner however be important keep mind style score carry different weight arrive vgm score have narrow search follow stock base solid zack rank vgm score moreover have choose firm market capitalization more large cap stock be comparatively stable less volatile stock vgm score sport zack rank strong buy see complete list today zack rank stock here headquarter san antonio tx andeavor andv free report have strong reef presence refinery company have operatorship interest have total daily capacity barrel company manage surpass zack consensus estimate last quarters average positive surprise be also expect company witness year year earning growth headquarter menomonee fall wi kohl kss free report roughly store spread state be basically omnichannel retailer company beat zack consensus estimate last quarters average positive surprise be expect year year earning growth fiscal fiscal respectively headquarter findlay marathon petroleum mpc free report be lead refiner crude company beat zack consensus estimate earning last quarters average positive surprise marathon petroleum be anticipate post earning growth headquarter stamford ct unite rental inc uri free report be involved business rent variety equipment company post average positive earning surprise last quarters expect firm report earning growth wall street next amazonzack evp kevin matra believe familiar stock have only just begin climb become greatest investment time once generation opportunity invest pure genius click detail
516,URI,share unite rental inc uri free report fall hour trading follow fourth quarter earning release earning be line zack consensus estimate increase prior year quarter owing change tax law higher rental revenue adjust earning exclude benefit associate enact tax reform be line zack consensus estimate earning however increase year year revenuestotal revenue surpass zack consensus estimate revenue increase year year rental revenue be also year quarter volume equipment rent increase rental rate inched marginstotal equipment rental gross margin expand basis point bps year year adjust ebitda improve year year adjust ebitda margin increase bps quarter segment rental segment rental revenue increase year year segment equipment rental gross profit rise however gross margin decline bps year year trench power pump segmental rental revenue increase year year primarily same store basis equipment rental gross profit rise gross margin improve bps year year basis time utilization fleet sizetime utilization increase bps year level size rental fleet be original equipment cost oec dec compare dec age rental fleet be month oec weight basis dec compare month dec unite rental inc price consensus ep surprise unite rental inc price consensus ep surprise unite rental inc quote resultsadjust earning share exclude benefit associate enact tax reform miss zack consensus estimate company report net sale year year net sale slightly surpass zack consensus estimate balance sheetunite rental cash cash equivalent totale dec compare dec quarter company generate net cash operate activity compare same period last year guidancetotal revenue be expect range higher report adjust ebitda be project higher prior year adjust ebitda net rental capital expenditure gross purchase be project range net cash provide operate activity be expect range higher report free cash flow be expect range higher report zack rankunite rental carry zack rank hold see complete list today zack rank strong buy stock here upcoming peer releasesowen corning oc free report be slate report quarterly result feb zack consensus estimate earning be peg year year louisiana pacific lpx free report be schedule release quarterly result feb zack consensus estimate earning stand cent year year install build product ibp free report be expect report quarterly result jan zack consensus estimate earning be peg cent year year today stock zack hottest strategiesit hard believe even zack market gain top stock pick screen have return respectively outperformance have not just be recent phenomenon year have be remarkably consistent composite yearly average gain strategy have beaten market more maybe even more remarkable be fact re willing share latest stock cost obligation see free
517,URI,earning season kick notch week company report include bunch dow industrial large cap not easy beating earning estimate quarter nearly quarter several year many investor underestimate management skill take consistently beat yet company have beaten miss only once quarter year impressive pressure mount keep great earning surprise record be able comply again quarter week amazing earning chart illinois tool work itw free report hasn miss yet still doesn get respect investor share have nearly double last year beat again abbott lab free report hasn miss early now impressive continue beat earning even chaos great recession share have break new year high keep momentum unite rental uri free report have miss only once year be crude price be plunge largest equipment rental company north america have oil gas business market have improve share be soar hope economy continue generate momentum honeywell hon free report be get last laugh be kick dow industrial year look now only miss once year share be new year high starbucks sbux free report have only miss once last year share have be stick narrow trading range more year finally be year join rally full disclosure author article own share uri sbux personal portfolio look stock skyrocket upside zack have just release special report boom investment opportunity legal marijuana ignited new referendum legislation industry be expect blast already robust early investor stand make kill have be ready act know just look see pot trade re target want learn trade option have always want trade stock option be unsure begin look week zack dave bartosiak bring detailed explanation trade live youtube watch go trade answer question real time become dave minion join zack live trader community today free click here join dave
518,URI,investor be always look stock be poise beat earning season unite rental inc uri free report be such company firm have earning come pretty soon event be shape quite nicely report be unite rental be see favorable earning estimate revision activity late be generally precursor earning beat analyst raise estimate right earning most date information possible be pretty good indicator favorable trend surface uri report fact most accurate estimate current quarter be currently share uri compare broader zack consensus estimate share suggest analyst have very recently bump estimate uri give stock zack earning esp head earning season unite rental inc price ep surprise unite rental inc price ep surprise unite rental inc quotewhy be important positive read zack earning esp have proven be very powerful produce positive surprise outperform market recent year backtest show stock have positive earning esp zack rank hold better show positive surprise nearly time have return average annual return see more top earning esp stock here give uri have zack rank esp positive territory investor want consider stock ahead earning see complete list today zack rank strong buy stock here clearly recent earning estimate revision suggest good thing be ahead unite rental beat be card upcoming report hottest tech mega trend year generate global revenue predict blast roof fame investor mark cuban say produce world first trillionaire still leave plenty money regular investor make right trade early see zack best stock play trend
519,URI,unite rental inc uri free report be schedule report fourth quarter result jan market close synergy neff corporation acquisition be expect reflect fourth quarter earning company complete buyout approximately last october buyout enhance company earthmoving equipment capability efficiency scale key market part deal unite rental acquire approximately worth fleet base original equipment cost branch facility company expect revenue neff fourth quarter ebitda neff alone let delve deeper other factor be likely affect company earning third quarter company post positive rental rate straight quarters negative rate expect fourth quarter result reflect positive rental rate well factor such strong organic growth lead improve end market demand ne acquisition be likely help company see improvement rate equipment rental comprise total revenue be expect get boost fourth quarter zack consensus estimate equipment rental revenue reflect sequential growth year year rise consensus estimate rental equipment sale be indicate increase prior quarter again sale new equipment be expect increase year year basis contractor supply revenue likely witness growth service other revenue be expect rise project xl initiative prudent investment fleet accretive acquisition robust market demand enhance unite rental prospect moreover company have be experience grow demand core construction industrial sector commercial construction have be strong late upstream oil gas be also gain traction improve macro condition thus demand unite rental product be expect increase thereby drive revenue be report quarter analyst poll zack expect net sale say quarter year quarter way be estimate tread zack consensus estimate fourth quarter earning have improve last day estimate fourth quarter moved consensus mark depict increase cent current zack consensus estimate fourth quarter fiscal reflect year year growth respectively unite rental inc price ep surprise unite rental inc price ep surprise unite rental inc quote do zack model unveil proven model show unite rental be likely beat earning estimate quarter stock need have positive earning esp zack rank strong buy buy hold happen unite rental have earning esp zack rank make reasonably confident earning beat uncover best stock buy sell re report earning esp filter other stock worth lookhere be few construction stock worth consider have right combination element post earning beat quarter potlatch corporation pch free report have earning esp boast zack rank company be set report quarterly result jan horton inc dhi free report have earning esp zack rank see complete list today zack rank stock here company be set report quarterly result jan louisiana pacific corporation lpx free report have earning esp zack rank company be expect report quarterly result feb hottest tech mega trend year generate global revenue predict blast roof fame investor mark cuban say produce world first trillionaire still leave plenty money regular investor make right trade early see zack best stock play trend
