,ticker,content
69,URI,caterpillar cat equipment sale retailer rise year march quarter drive construction equipment sale china asia pacific region share dow jone industrial average component jump stock market today move back day move average stock be flat base buy point caterpillar be dow third best perform stock strong day broader market average goldman sachs gs jpmorgan chase jpm lead dow higher uncertainty fall interest rate rise first round france election result other equipment provider also gain manitowoc mtw rise terex tex deere unite rental uri rise equipment rental firm tumble last week weak rental pricing warning small increase not seem much caterpillar month year year sale be february january also investment site hedge note march gain be first date back november ibd take president trump congress add big federal infrastructure funding package top state initiative create inflection point pricing granite construction ceo james robert say february caterpillar say retail sale construction industry rise year drive gain asia pacific region sale resource industry fall overall caterpillar retail sale fall north america latin america europe middle east africa postelection surge caterpillar share have mostly moved sideway past month volatility surround ir investigation uncertainty president trump agenda improve outlook state infrastructure spending recovery energy mining sector caterpillar be due report tuesday open be expect earn cent share cent year earlier revenue be see slip related caterpillar lift dow goldman push trump ready infrastructure billu european bank soar french vote yield fed rate odd stock rise big infrastructure deal california
70,URI,stock future shift narrow gain tightly mixed trade ahead thursday start bell disappointing read december durable good order dow future slip fraction negative territory nasdaq future cling narrow gain big earning report be likely dominate headline stock market today economic datum also
71,URI,stock grab hold healthy early gain monday holiday shorten week get quiet start nasdaq climb dow jone industrial average take gain small cap lag russell show advance
72,URI,trade be sharply stock market today tracking lower nasdaq lower nyse relative trading same time friday be boost option future expiration activity
73,URI,microsoft msft nearly jpmorgan jpm gain lead dow
74,URI,unite rental uri first solar fslr climb oneok partner oke scramble head index gain tulsa base natural gas pipeline operator say distribution dividend effectively remain flat earning increase management gas price outlook be cautious expect higher result due volume fee base margin increase
75,URI,airline stock put early rally monday lead america airline group aal delta air group dal
76,URI,sweden base phone maker ericsson eric leap announce patent license deal apple aapl settle litigation bring ericsson january term be not discuss analyst cite reuter project deal mean apple revenue ipad iphone ericsson share have be deepen consolidation march apple share rise early trade monday
77,URI,early gain record set premier weekend star war force awaken quickly fade walt disney imax imax disney shed open gain slip imax fall nearly
78,URI,bbcn bancorp bbcn gap gain retake week move average big trade
79,URI,ibd list constellation brand stz add rebound week move average very strong trade alcohol producer distributor be less buy point stock grab hold healthy early gain monday holiday shorten week get quiet start nasdaq climb dow jone industrial average take gain small cap lag russell show advance trade be sharply stock market today tracking lower nasdaq lower nyse relative trading same time friday be boost option future expiration activity microsoft msft nearly jpmorgan jpm gain lead dow unite rental uri first solar fslr climb oneok partner oke scramble head index gain tulsa base natural gas pipeline operator say distribution dividend effectively remain flat earning increase management gas price outlook be cautious expect higher result due volume fee base margin increase airline stock put early rally monday lead america airline group aal delta air group dal sweden base phone maker ericsson eric leap announce patent license deal apple aapl settle litigation bring ericsson january term be not discuss analyst cite reuter project deal mean apple revenue ipad iphone ericsson share have be deepen consolidation march apple share rise early trade monday early gain record set premier weekend star war force awaken quickly fade walt disney imax imax disney shed open gain slip imax fall nearly bbcn bancorp bbcn gap gain retake week move average big trade ibd list constellation brand stz add rebound week move average very strong trade alcohol producer distributor be less buy point
80,URI,stock storm friday session sharp gain market do best shake tough week dow jone industrial average add nasdaq peg gain haul ahead
81,URI,volume be mildly higher nasdaq fraction higher nyse relative action same time thursday
82,URI,stock market today draw confidence federal reserve chair janet yellen detailed assurance late thursday fed remain track begin cycle rate hike end year comment launch global market higher leave cac paris frankfurt dax ahead afternoon trade
83,URI,positive unexpected upward revision commerce department gdp estimate add friday risk mood open
84,URI,preliminary september purchasing manager index estimate markit show uptick manufacturing activity rise august consensus forecast
85,URI,consumer confidence also higher university michigan final tally september consumer sentiment index rise economist have expect gain
86,URI,nike nke surge breaking past cup base buy point report strong fiscal result late thursday huge volume left nike share buy point
87,URI,unite rental uri rebound remain week day hefty loss
88,URI,china jd com jd pop open bell pick volume support make big jump weak trade thursday online retailer be still deep month correction
89,URI,chip supplier arm holding armh bolt higher stifel nicolaus initiate coverage buy rating
90,URI,keep eye oil price today be trading higher morning ahead weekly rig count report baker hughe bhi due et stock storm friday session sharp gain market do best shake tough week dow jone industrial average add nasdaq peg gain haul ahead volume be mildly higher nasdaq fraction higher nyse relative action same time thursday stock market today draw confidence federal reserve chair janet yellen detailed assurance late thursday fed remain track begin cycle rate hike end year comment launch global market higher leave cac paris frankfurt dax ahead afternoon trade positive unexpected upward revision commerce department gdp estimate add friday risk mood open preliminary september purchasing manager index estimate markit show uptick manufacturing activity rise august consensus forecast consumer confidence also higher university michigan final tally september consumer sentiment index rise economist have expect gain nike nke surge breaking past cup base buy point report strong fiscal result late thursday huge volume left nike share buy point unite rental uri rebound remain week day hefty loss china jd com jd pop open bell pick volume support make big jump weak trade thursday online retailer be still deep month correction chip supplier arm holding armh bolt higher stifel nicolaus initiate coverage buy rating keep eye oil price today be trading higher morning ahead weekly rig count report baker hughe bhi due et
91,URI,stock crumble start gate quick broad loss thursday dow jone industrial average be nasdaq show loss slip
92,URI,trade rise sharply stock market today nasdaq nyse
93,URI,new home sale jump august commerce department report annualize rate be nearly more july upwardly revise pace well consensus projection sale rate unit be not enough keep homebuilder stock slide general market leader horton dhi do manage hold loss less
94,URI,caterpillar cat dump start trade announce layoff worker end restructure aim focuse datum analytic digital innovation capability company plan consolidate surface underground mining equipment operation various sale support team company company aim annual cost saving management lower full year revenue guidance loss put caterpillar share week lowest mark august
95,URI,related stock catch undertow include unite rental uri joy global joy diesel maker cummin cmi slip
96,URI,chipmaker be pressure nxp semiconductor nxpi diving analog device adi slide nearly much
97,URI,taser international tasr rip ahead announce large order tenn polouse department follow report sidoti co initiate coverage buy rating price target stock remain key level support deep month consolidation
98,URI,ibd stock open lower group drop more early trade
99,URI,valeant pharmaceutical vrx take hardest blow drop nearly stock be nursing loss week near test support week move average stock crumble start gate quick broad loss thursday dow jone industrial average be nasdaq show loss slip trade rise sharply stock market today nasdaq nyse new home sale jump august commerce department report annualize rate be nearly more july upwardly revise pace well consensus projection sale rate unit be not enough keep homebuilder stock slide general market leader horton dhi do manage hold loss less caterpillar cat dump start trade announce layoff worker end restructure aim focuse datum analytic digital innovation capability company plan consolidate surface underground mining equipment operation various sale support team company company aim annual cost saving management lower full year revenue guidance loss put caterpillar share week lowest mark august related stock catch undertow include unite rental uri joy global joy diesel maker cummin cmi slip chipmaker be pressure nxp semiconductor nxpi diving analog device adi slide nearly much taser international tasr rip ahead announce large order tenn polouse department follow report sidoti co initiate coverage buy rating price target stock remain key level support deep month consolidation ibd stock open lower group drop more early trade valeant pharmaceutical vrx take hardest blow drop nearly stock be nursing loss week near test support week move average
100,URI,fluor bechtel turner score other construction company need heavy equipment project typically call unite rental uri company be largest renter construction industrial equipment location canada stock be rank ibd list number indicator such
101,URI,stock turn mixed midday monday round similarly mixed earning report well economic report foreign domestic
102,URI,nasdaq turn loss gain biotechs software issue outperformed pare deficit dow jone industrial average fall volume be tracking sharply lower board stock market today compare same time friday
103,URI,highly rate stock globant glob rally nearly time high clear buy point heavy trading hour session thin stock already match day average volume
104,URI,nike nke climb more new high be upgrade buy hold bb now past buy point athletic apparel footwear giant be recently mentioned new high column
105,URI,downside microsemi mscc drop news offer buy pmc sierra pmcs bid top buyout offer apple aapl supplier skywork solution swks microsemi fall buy point consolidation clear friday pmc share jump
106,URI,valeant vrx slump beating view raise guidance open canadian drugmaker post adjust earning share year sale grow third straight period acceleration almost lift full year sale forecast
107,URI,profit be now expect share prior outlook last week valeant say receive subpoena federal prosecutor massachusett new york request information patient assistance program drug pricing decision
108,URI,follow vincent mao twitter ibd_vmao stock turn mixed midday monday round similarly mixed earning report well economic report foreign domestic nasdaq turn loss gain biotechs software issue outperformed pare deficit dow jone industrial average fall volume be tracking sharply lower board stock market today compare same time friday highly rate stock globant glob rally nearly time high clear buy point heavy trading hour session thin stock already match day average volume nike nke climb more new high be upgrade buy hold bb now past buy point athletic apparel footwear giant be recently mentioned new high column downside microsemi mscc drop news offer buy pmc sierra pmcs bid top buyout offer apple aapl supplier skywork solution swks microsemi fall buy point consolidation clear friday pmc share jump valeant vrx slump beating view raise guidance open canadian drugmaker post adjust earning share year sale grow third straight period acceleration almost lift full year sale forecast profit be now expect share prior outlook last week valeant say receive subpoena federal prosecutor massachusett new york request information patient assistance program drug pricing decision follow vincent mao twitter ibd_vmao
109,URI,stock slide fresh session lows late monday oil price continue weigh west texas intermediate close barrel
110,URI,dow jone industrial average slump respectively nasdaq drop volume spiked higher major exchange stock market today
111,URI,lead stock virgin america va stretched loss more airline stock be weak monday plunge oil price alaska air group alk delta air line dal southwest airline luv fall delta even boost margin outlook again
112,URI,elsewhere unite rental uri tumble be cut sell buy evercore
113,URI,upside gilead science gild rise reverse high cvs caremark cvs announce cover gilead solvaldi harvoni hepatitis drug several plan gilead tumble last month news express script esrx drop coverage hepatitis treatment favor abbvie abbv
114,URI,fellow biotech akorn akrx be session high still nearly stock slide fresh session lows late monday oil price continue weigh west texas intermediate close barrel dow jone industrial average slump respectively nasdaq drop volume spiked higher major exchange stock market today lead stock virgin america va stretched loss more airline stock be weak monday plunge oil price alaska air group alk delta air line dal southwest airline luv fall delta even boost margin outlook again elsewhere unite rental uri tumble be cut sell buy evercore upside gilead science gild rise reverse high cvs caremark cvs announce cover gilead solvaldi harvoni hepatitis drug several plan gilead tumble last month news express script esrx drop coverage hepatitis treatment favor abbvie abbv fellow biotech akorn akrx be session high still nearly
115,URI,stock open lower battle tightly mixed terrain early wednesday
116,URI,edge nasdaq be close only fraction higher dow jone industrial average sag
117,URI,volume be unevenly mixed just nasdaq nyse vs trading level record early tuesday
118,URI,stock market today face early headwind mixed housing datum show december housing start slower expect rate build permit issue month europe market turn slim gain mixed action afternoon trade market earning report be morning center attention
119,URI,netflix nflx spike bolster nasdaq company report record growth new subscriber fourth quarter
120,URI,ibm ibm fall drag dow report late tuesday adjust earning decline less expect analyst revenue slip more expect however management project earning analyst consensus stock long slow correction deepen sharply company report october
121,URI,ibd list open red biggest slip be decline illumina ilmn maker large scale gene sequence equipment surge heavy trade tuesday wednesday early slip left share week move average buy point
122,URI,baidu bidu hammer gain run head list china lead search engine be hover week move average shallow month consolidation
123,URI,busy docket earning report be due today close american express axp unite rental uri sandisk sndk ebay ebay company schedule report stock open lower battle tightly mixed terrain early wednesday edge nasdaq be close only fraction higher dow jone industrial average sag volume be unevenly mixed just nasdaq nyse vs trading level record early tuesday stock market today face early headwind mixed housing datum show december housing start slower expect rate build permit issue month europe market turn slim gain mixed action afternoon trade market earning report be morning center attention netflix nflx spike bolster nasdaq company report record growth new subscriber fourth quarter ibm ibm fall drag dow report late tuesday adjust earning decline less expect analyst revenue slip more expect however management project earning analyst consensus stock long slow correction deepen sharply company report october ibd list open red biggest slip be decline illumina ilmn maker large scale gene sequence equipment surge heavy trade tuesday wednesday early slip left share week move average buy point baidu bidu hammer gain run head list china lead search engine be hover week move average shallow month consolidation busy docket earning report be due today close american express axp unite rental uri sandisk sndk ebay ebay company schedule report
124,URI,stock stumble start gate modest loss friday receive support december consumer sentiment datum
125,URI,dow jone industrial average drop nasdaq dip
126,URI,volume rise stock market today rise nasdaq nyse compare trade same time thursday
127,URI,open labor department report producer price dip november slightly more expect be flat energy food hand say inflation be not issue economy other hand show producer wield price strength suggest limp demand
128,URI,university michigan deliver more positive news raise preliminary estimate december consumer sentiment index gauge highest level year be nice jump november read well past analyst estimate small uptick
129,URI,energy related stock crowd bottom drill contractor nabor industry nbr oil producer newfield exploration nfx apiece dow loss be more ecumenical chevron cvx dupont dd caterpillar cat pfizer pfe more
130,URI,adobe system adbe kick lead nasdaq struggle design publish software developer report late thursday fiscal fourth quarter sale earning best analyst estimate also announce pay acquire privately hold stock photography fotolium stock have be consolidate june
131,URI,leader rolled weak start more ibd stock dip start trade
132,URI,spirit airline save be main holdout more early action left budget airline still more week week line support
133,URI,loss ibd list be generally modest stock lose less distinction largest decline go unite rental uri equipment rental chain hover loss pin converge week move average not quite cup handle buy point stock stumble start gate modest loss friday receive support december consumer sentiment datum dow jone industrial average drop nasdaq dip volume rise stock market today rise nasdaq nyse compare trade same time thursday open labor department report producer price dip november slightly more expect be flat energy food hand say inflation be not issue economy other hand show producer wield price strength suggest limp demand university michigan deliver more positive news raise preliminary estimate december consumer sentiment index gauge highest level year be nice jump november read well past analyst estimate small uptick energy related stock crowd bottom drill contractor nabor industry nbr oil producer newfield exploration nfx apiece dow loss be more ecumenical chevron cvx dupont dd caterpillar cat pfizer pfe more adobe system adbe kick lead nasdaq struggle design publish software developer report late thursday fiscal fourth quarter sale earning best analyst estimate also announce pay acquire privately hold stock photography fotolium stock have be consolidate june leader rolled weak start more ibd stock dip start trade spirit airline save be main holdout more early action left budget airline still more week week line support loss ibd list be generally modest stock lose less distinction largest decline go unite rental uri equipment rental chain hover loss pin converge week move average not quite cup handle buy point
134,URI,stock extend loss midday thursday day federal reserve raise interest rate first time nearly decade fall dow jone industrial average nasdaq be
135,URI,volume be run higher nyse nasdaq compare same time wednesday
136,URI,economic news be mixed unemployment claim fall little less expect week end dec manufacturing mid atlantic region fall much more expect december conference board index lead economic indicator rise november prior month increase ahead analyst forecast
137,URI,mining energy stock be hit hardest stock market today decline oil metal price
138,URI,newmont mining nem colorado base miner gold silver lose lead lower oil transportation stock oneok oke also drop
139,URI,most ibd stock be lower lead global payment gpn fall more heavy volume stock plunge wednesday slice day line agree buy rival credit card payment processor heartland payment system hpy
140,URI,total system service tss credit card payment processor ibd fall remain well buy point cup handle base clear october
141,URI,chinese social medium stock weibo wb be bright spot jump more heavy volume close buy point deep cup shape base
142,URI,stock boast rise relative strength line accumulation distribution rating indicate strong demand share stock have more double fall low aug stock extend loss midday thursday day federal reserve raise interest rate first time nearly decade fall dow jone industrial average nasdaq be volume be run higher nyse nasdaq compare same time wednesday economic news be mixed unemployment claim fall little less expect week end dec manufacturing mid atlantic region fall much more expect december conference board index lead economic indicator rise november prior month increase ahead analyst forecast mining energy stock be hit hardest stock market today decline oil metal price newmont mining nem colorado base miner gold silver lose lead lower oil transportation stock oneok oke also drop most ibd stock be lower lead global payment gpn fall more heavy volume stock plunge wednesday slice day line agree buy rival credit card payment processor heartland payment system hpy total system service tss credit card payment processor ibd fall remain well buy point cup handle base clear october chinese social medium stock weibo wb be bright spot jump more heavy volume close buy point deep cup shape base stock boast rise relative strength line accumulation distribution rating indicate strong demand share stock have more double fall low aug
143,URI,stock close lower friday lows day dow jone industrial average have first week past nasdaq be second straight week stock market today nasdaq lose fall dow drop volume be higher prior day exchange accord preliminary datum investor worry chinese manufacturing datum fall oil price signal global economic slowdown oil fall more barrel reach lowest level ibd stock be higher be lower worst performer be cal maine food calm avis budget car respectively retail industry group be strongest bask glow thursday morning better expect retail sale report november energy group be drag rear retailer zumiez zumz rise more highest close year find recent support week move average top perform stock faltered jazz pharmaceutical jazz fall nearly unite rental uri tumble more jazz fall day move average unite rental plunge day move average
144,URI,stock market close sharply lower monday major index slide mildly ascend path
145,URI,nasdaq stumble worst loss more week apple aapl share fall stock be much earlier pare loss
146,URI,lose dow jone industrial average small cap russell slide
147,URI,volume rise course friday half session
148,URI,energy stock take brunt selling stock market today solar pipeline refine exploration stock be worst performer
149,URI,transportation sector have flourished fall oil price also lag monday dow transportation average plunge
150,URI,most ibd stock close lower volume be well average most case
151,URI,wasn case ambarella amba slide heavy trading
152,URI,unite rental uri meanwhile fall day move average active trading get support day line still loss moved stock further potential
153,URI,fleetcor flt day start trimming loss touch day line stock fall much prior buy point volume be more double average stock market close sharply lower monday major index slide mildly ascend path nasdaq stumble worst loss more week apple aapl share fall stock be much earlier pare loss lose dow jone industrial average small cap russell slide volume rise course friday half session energy stock take brunt selling stock market today solar pipeline refine exploration stock be worst performer transportation sector have flourished fall oil price also lag monday dow transportation average plunge most ibd stock close lower volume be well average most case wasn case ambarella amba slide heavy trading unite rental uri meanwhile fall day move average active trading get support day line still loss moved stock further potential fleetcor flt day start trimming loss touch day line stock fall much prior buy point volume be more double average
154,URI,stock future point weak start monday market head last trading day august final week summer
155,URI,dow future trade point fair market value nasdaq future be point future show point loss be early lows
156,URI,stock market today launch nasdaq so far august tracking worst monthly performance index have be much
157,URI,nasdaq open way month trading range rebound dive open just midpoint trading range month
158,URI,market remain correction savvy investor put pause good use build watch list stock strong fundamental form possible basis
159,URI,fairly light week economic news get federal reserve september beige book report due wednesday ramp labor department august payroll report friday
160,URI,today kingsbury international report chicago purchasing manager index august et dalla federal reserve deliver regional manufacturing survey
161,URI,stock second quarter earning season be mostly pass only handful big name mostly retailer expect week
