,ticker,content
554,URI,world industry inc awi free report post adjust earning cent share first quarter compare cent report prior year quarter include time item company report earning share cent compare cent record prior year quarter operational updatenet sale increase year year drive higher architectural specialty volume higher mineral fiber average unit value auv nevertheless revenue miss zack consensus estimate world industry inc price consensus ep surprise world industry inc price consensus ep surprise world industry inc quotecost sale climb year year gross profit decline report quarter selling general administrative sg expense dip year year adjust operate income decrease year year due higher depreciation elevated manufacturing input cost however factor be offset positive auv volume growth architectural specialty sg saving adjust ebitda improve year year drive volume growth architectural specialty solid auv fall profit lower sg expense segment fiber net sale segment inched year year operate income slip first quarter report prior year quarter architectural specialty segment sale climb year year witness year quarter segment operate profit surge year year prior year quarter world report cash cash equivalent end first quarter compare end prior year quarter company record cash flow operation report quarter compare record year earlier quarter world reaffirm net sale growth outlook greater adjust ebitda growth free cash flow growth company raise ep guidance growth year year result share repurchase first quarter share price performanceover past year world have outperformed industry respect price performance stock have gain industry record growth zack rank stock world currently have zack rank sell better rank stock same sector include patrick industry inc patk free report boise cascade bcc free report unite rental inc uri free report patrick industry boise cascade sport zack rank strong buy unite rental carry zack rank buy see complete list today zack rank stock here patrick industry have long term earning growth rate share have gain past year boise cascade have long term earning growth rate stock have gain year time unite rental have long term earning growth rate company share have rally past year wall street next amazonzack evp kevin matra believe familiar stock have only just begin climb become greatest investment time once generation opportunity invest pure genius click detail
555,URI,here be stock buy rank strong value characteristic investor consider today st iconix brand group inc icon free report brand management company have zack rank buy see zack consensus estimate current year earning increase more last day iconix brand group inc price consensus iconix brand group inc price consensus chart iconix brand group inc quoteiconix have price earning ratio compare industry company possess value score iconix brand group inc pe ratio ttm iconix brand group inc pe ratio ttm iconix brand group inc inc jwn free report fashion retailer have zack rank buy see zack consensus estimate current year earning advance last day inc price consensus inc price consensus chart inc have price earning ratio compare industry company possess value score inc pe ratio ttm inc pe ratio ttm inc quoteunite rental inc uri free report rental service provider have zack rank buy see zack consensus estimate current year earning rise last day unite rental inc price consensus unite rental inc price consensus chart unite rental inc quoteunite rental have price earning ratio compare industry company possess value score unite rental inc pe ratio ttm unite rental inc pe ratio ttm unite rental inc quotecrown holding inc cck free report seller packaging product have zack rank strong buy see zack consensus estimate current year earning rise last day crown holding inc price consensus crown holding inc price consensus chart crown holding inc quotecrown holding have price earning ratio compare industry company possess value score crown holding inc pe ratio ttm crown holding inc pe ratio ttm crown holding inc quotesee full list top rank stock herelearn more value score be calculate here wall street next amazonzack evp kevin matra believe familiar stock have only just begin climb become greatest investment time once generation opportunity invest pure genius click detail
556,URI,toll brother inc tol free report have be exhibit robust performance less competition luxury new home market well solid housing demand toll brother share have underperform zack homebuilding industry so far year have outperformed industry week week week time frame meanwhile estimate current quarter year have moved last day suggest analyst optimism stock performance toll brother miss analyst expectation earning revenue recently report fourth quarter fiscal however earning increase revenue be year year give higher number home deliver delivery increase unit contract surge dollar unit year year basis fourth quarter marked consecutive quarter year year growth contract dollar unit however average price home deliver remain almost flat year year quarter positivesless competition luxury new home market prove beneficial toll brother company mostly cater luxury move buyer already possess residence be look shift larger home homebuyer be less sensitive price change thus toll brother enjoy edge other homebuilding company result increase home delivery earning revenue backlog growth total revenue increase year year delivery totale unit earning come share year year moreover give pent housing demand toll brother have secure most seek urban location country land be scarce approval be not easy obtain november toll brother acquire coleman home boise id involved takeover approximately own lot controlled lot immediate addition selling community community count acquisition toll brother expand footprint mainly western unite state also outlook homebuilding industry be quite compelling give affordable interest rate tight inventory indicate pent demand moreover latest positive housing datum reassure industry strength courtesy solid economic growth supply shortage recovery hurricane florida texas consistent job growth seemingly high homebuilder confidence be drive momentum concernsa shortage buildable lot skilled labor escalate land price higher material cost be exert pressure margin toll brother well other homebuilder fact toll brother adjust gross margin decline basis point bps fiscal additionally company believe home sale price decline have adverse year year impact adjust gross margin add wo zack rank stock considertoll brother carry zack rank hold few better rank stock sector be patrick industry inc patk free report unite rental inc uri free report world industry inc awi free report unite rental sport zack rank strong buy see complete list today zack rank stock here unite rental be expect see rise earning patrick industry carry zack rank buy be expect see growth earning world industry also carry zack rank company earning be expect improve zack hide tradeswhile share many recommendation idea public certain move be hide everyone select member portfolio service peek curtain today view start now next month invite follow zack private buy sell real time value momentum stock etf option mover insider trade company be report positive earning surprise ve call accuracy even look portfolio so exclusive be normally close new investor click here zack secret trade
557,URI,share aegion corporation aegn free report have be perform well late global leader infrastructure protection maintenance have witness share surge past month company have also outperformed industry growth aegion have market cap roughly average volume share trade last month be company have average positive earning surprise trail quarters company carry zack rank hold vgm score here stand value growth momentum score be weight combination score value growth momentum such score allow eliminate negative aspect stock select winner vgm score other key metric make company solid choice investor let take look factor be drive aegion stock late drive factorsinvestor be optimistic aegion strategic action focuse generation more predictable sustainable long term earning growth infrastructure solution platform company be likely focus restructure business tyfo fibrwrap north america operation cipp cure place pipe operation denmark australia cipp business denmark australia fyfe north america be intend be supplemental growth driver core north america cipp operation consequently company be try aggressively return business profitability early aegion choose exit pipe contract application tyfo fibrwrap technology due smaller project scope company be also involved restructure activity associate corrosion protection operation canada also include downsize activity reflect current anticipate market condition well implementation other cost saving initiative company aegion restructure cost saving initiative be anticipate generate cost saving help reduce future earning volatility aegion infrastructure solution segment be poise growth north america cipp rehabilitation business continue witness persistent expansion due good market demand further improve pressure pipe market penetration back new product development boost revenue corrosion protection segment cathodic protection business margin be gain multiple leadership change first half aggressive focus improve project execution labor utilization strong backlog position include high margin international project ongoing restructure activity canada improve execution cathodic protection business enable segment deliver improve result go forward energy service segment have deliver improve year year performance third consecutive quarter be anticipate continue term backlog be highest level strong activity maintenance turnaround construction business restructure effort undertake past be also yielding result so far aegion witness surge new order prior year period drive continue momentum key market segment third quarter end contract backlog be increase contract backlog sep aegion corp price consensus aegion corp price consensus aegion corp quotestock considersome better rank stock sector be unite rental inc uri free report world industry inc awi free report patrick industry inc patk free report unite rental have long term expect earning growth rate share have rally past year company flaunt zack rank strong buy see complete list today zack rank stock here world industry carry zack rank buy have long term expect earning growth rate share have gain past year patrick industry zack rank stock have long term expect earning growth rate share have gain past year wall street next amazonzack evp kevin matra believe familiar stock have only just begin climb become greatest investment time once generation opportunity invest pure genius click detail
558,URI,pultegroup inc phm free report prudent investment new land position continue result higher volume revenue profit company expect realize higher return invest capital increase use land option possible accelerate inventory turn first month company spend land acquisition pultegroup be track spend approximately land acquisition land development apart prudent land investment company be adopt initiative improve operate financial performance initiative include improve overhead leverage increase inventory turn implement new pricing strategy initiative have help drive profit earning quarter increase solid year level upside be support higher demand disruption cause hurricane harvey irma part cost reduction program pultegroup make significant workforce reduction curtailed overhead cost inventory moreover aggressive debt repayment due improve financial position have lower interest cost addition pultegroup strategic pricing program allow buyer select lot option value most result higher level house option lot premium company be also adjust content home be build smaller floor plan curtail construction cost also latest positive housing datum reassure industry strength courtesy solid economic growth supply shortage ongoing recovery hurricane florida texas consistent job growth seemingly high homebuilder confidence be drive momentum fact zack homebuilding industry have gain year date outperform market gain moreover good industry rank top more industry signal company space be likely benefit broader factor term concernsrising land labor cost be threaten margin limit homebuilder pricing power labor shortage be lead higher wage land price be rise owing limit availability be dent homebuilder margin home sale gross margin decrease basis point year year third quarter pultegroup homebuilding operation be locate many area be subject natural disaster severe weather condition natural disaster inclement weather condition delay delivery increase cost damage inventory reduce availability material dent demand new home share price movementshare pultegroup have gain year date outperform gain industry belong price performance have be backed impressive earning history pultegroup surpass earning past quarters average beat be earning estimate decline increase last day indicate analyst apprehension stock immediate future stock growth story impress long term zack rank stock carry zack rank hold few better rank stock sector be patrick industry inc patk free report unite rental inc uri free report world industry inc awi free report unite rental sport zack rank strong buy see complete list today zack rank stock here company be expect see rise earning patrick industry carry zack rank buy earning be expect grow world industry also carry zack rank company earning be expect grow medical stock buy nowzack name company poise ride medical breakthrough be target cure leukemia aids muscular dystrophy hemophilia other condition new product field be already generate substantial revenue even more wondrous treatment be pipeline early investor realize exceptional profit click here see stock
559,URI,share unite rental inc uri free report have rally so far year outperform gain industry belong also company have outperformed industry week week week time frame price performance be backed impressive earning history unite rental surpass earning estimate consistently past quarters moreover earning estimate have rise past few week suggest bullish sentiment unite rental last day zack consensus estimate earning rise bullish trend justify stock zack rank strong buy unite rental enjoy strong brand recognition enable draw customer enhance customer loyalty company offer approximately class rental equipment rent hourly daily weekly monthly basis furthermore return equity deliver trail month be industry return reflect company efficiency used shareholder fund equipment rental company market cap have strength several key area thus add stock portfolio seem prudent solid prospectsunite rental main strategy be drive profit core equipment rental business revenue growth margin expansion operational efficiency particular company strategy call implementation project xl be set specific work stream focuse drive profitable growth revenue opportunity generate incremental profitability cost saving also unite rental be focuse expand geographic border product portfolio acquisition joint venture october company acquire neff corporation enhance unite rental earthmoving equipment capability efficiency scale key market area august unite rental buy power equipment asset cummin inc be expect help unite rental cash strong demand power solution north america acquisition ne rental holding ii inc april be expect strengthen relationship construction industrial sector leverage unite rental technology infrastructure notably earning be expect grow way higher industry project growth additionally company sale growth be project compare industry valuation look rationalunite rental have value style score putt top stock cover perspective company currently have trail month ratio industry average indicate stock be undervalue compare peer also company have forward pe ratio so be fair say slightly more value oriented path be ahead stock term well also company currently have trail month ev ebitda ratio industry average construction market outlook positivedemand unite rental product be largely related performance broader construction market overall outlook construction market be positive factor improve economy modest wage growth low unemployment level positive consumer sentiment raise optimism sector performance such demand unite rental product increase well thereby drive revenue zack construction sector have rally year date outperform gain also industry belong have decent industry rank top industry signale company space be likely benefit favorable broader factor immediate future vgm scoreunite rental have vgm score vgm score identify stock have most attractive value growth momentum characteristic fact research show stock vgm score combine zack rank buy make solid investment choice other key picksa few other top rank stock same industry be patrick industry inc patk free report world industry inc awi free report gibraltar industry inc rock free report patrick industry sport zack rank other company carry zack rank see complete list today zack rank stock herepatrick industry be expect witness earning growth world industry be likely see earning growth gibraltar industry surpass earning estimate past quarters average beat hottest tech mega trend year generate global revenue predict blast roof fame investor mark cuban say produce world first trillionaire still leave plenty money regular investor make right trade early see zack best stock play trend
560,URI,nov world industry inc awi free report craft week high intra day trading finally close lower world have market cap average volume share trade last month be approximately investor be optimistic zack rank buy company focus transformation plan improvement auv innovation product stock have gain year time higher gain world have also outperformed industry gain respect share price movement same time frame drive world recently world sign definitive agreement divest emea europe middle east africa pacific rim business bid focus investment innovation high end mineral fiber manufacturing well expand capability architectural specialty divestment be significant step ongoing transformation plan world expect divestment complete mid realize net cash follow deal accomplishment moreover move enable company focus resource core americas ceiling wall business world remain focuse improve sale dollar unit sell average unit value auv past quarters implement price increase ceiling tile grid product americas emea company announce further pricing action depend movement raw material price foreign currency valuation further innovative latest product enhancement drive auv better mix better pricing notably world high performance ceiling system portfolio include recently launch total acoustic sustain family display endeavor offer innovative product customer backed factor world raise adjust earning share guidance range share reflect year year growth mid point further year year sale growth be estimate range translate total sale company expect benefit pent demand follow hurricane strong order backlog improve construction market upward estimate world positive estimate revision reflect optimism company potential earning growth be often indication robust prospect stock price gain ahead estimate world moved past month reflect analyst bullish sentiment earning estimate have go inched world industry inc price consensus world industry inc price consensus world industry inc mentioned tailwind have raise investor optimism stock be anticipate boost company share price day ahead other stock considerother top rank stock same space include patrick industry inc patk free report unite rental inc uri free report owen corning oc free report stock carry zack rank see complete list today zack strong buy rank stock here patrick industry have long term earning growth rate share have be year date unite rental have long term earning growth rate so far year share have rally owen corning have long term earning growth rate share have gain year date investor alert breakthrough pendinga medical advance be now flashpoint theory realization billion dollar research have pour company be already generate substantial revenue even more wondrous product be pipeline cure variety deadly disease be sight so be big potential profit early investor zack name stock buy now click here see
561,URI,housing industry appear be back track few sluggish month indicate gradual recovery strong demand american buy new home october fastest pace decade reflect underlie strength economy october housing dataper latest report commerce department new home sale increase seasonally adjust annual rate october mark second straight monthly gain scaling highest level year northeast midwest witness maximum increase south west register less gain october sale figure increase year prior month be be note september sale pace be revise unit previously report unit recent increase new home sale homebuilding sale previously own home suggest market be regain momentum hurricane harvey irma temporarily stall activity read more exist home sale rise october rally last however industry have be challenged shortage home sale suitable land skilled labor inventory new home market be unit take just month deplete current supply home market limit land availability be drive price higher average sale price new home jump year year prior month nonetheless housing homebuilding have be high recent time solid home sale datum affordable interest mortgage rate impressive housing start figure resilient job growth seemingly high homebuilder confidence be add momentum new residential construction unite state increase more expect october reinstate strength housing industry latest jointly release report census bureau department housing urban development construction new home increase october unit seasonally adjust annual rate prior month also mark biggest surge month housing start witness big gain single family home apartment again confidence homebuilder increase november highest read month second highest recession july accord housing market index national association home builder nahb well fargo keep mind positive momentum housing stock have gain current scenario have potential rise further mortgage rate start rise winning help zack stock screener narrow list stock construction sector base good zack rank other relevant metric texas base horton inc dhi free report be lead national homebuilder company remain commit achieve continue double digit annual growth revenue pre tax profit generate positive cash flow improve return horton share have return so far year outperform industry rally estimate have moved north last day current well next year respectively bullish analyst sentiment justify stock current zack rank strong buy be expect company outperform term see complete list today zack rank stock here company be also expect witness earning growth current year more industry average stock have vgm score owen corning oc free report be toledo base world leader build material system composite solution share have gain more year date substantially outperform industry zack consensus estimate earning current year next have increase respectively last day thus reflect optimism stock prospect substantiate zack rank company be also expect witness earning growth current year norbord inc osb free report be producer wood base panel operation primarily unite state europe canada company share have return year date outperform industry estimate have moved north last day current well next year respectively company zack rank be expect witness robust earning growth unite rental inc uri free report be north america largest equipment rental company stock also sport zack rank share have increase so far year outperform industry also estimate have moved north last day current well next year respectively company solid roe be also expect witness earning growth last picked nvr inc nvr free report involved construction sale single family detach home townhome condominium building stock carry zack rank buy have climb more year date outperform broader industry estimate have moved north last day current well next year respectively company be also expect witness earning growth current year stock rock solid trail month return equity roe ratio compare industry average indicate company reinvest more efficiently compare peer group today stock zack hottest strategiesit hard believe even zack market gain top stock pick screen have return respectively outperformance have not just be recent phenomenon year have be remarkably consistent composite yearly average gain strategy have beaten market more maybe even more remarkable be fact re willing share latest stock cost obligation see free
