,ticker,content
0,VFC,friday canada goose goos reach important technical milestone see relative strength rs rating jump percentile improvement day ibd unique rs rating identify technical performance used worst best score identify stock price action trail week match other stock year market history show stock go make biggest gain tend have rs rating least early stage move look winning stock try simple routinecanada goose be try complete cup handle entry see stock clear price heavy trade earning grow last quarter prior report revenue also increase keep eye company next round number oct canada goose hold rank peer apparel clothing manufacturing industry group vf corporation vfc pvh pvh carter cri be top highly rate stock group related stock be show improve technical action use ibd relative strength rating relative strength line help judge stock
1,VFC,stock inched start gate monday general electric ge drag dow seagate technology stx surge head nasdaq xon dow jone industrial average future strengthen fair value nasdaq future advanced week go october dow have gain break level so far best month february top mark be also best month february nasdaq have advanced lag strong pace set april july early earning report send vf corp vfc halliburton hal philips phg ahead open trade seagate technology jetted report fiscal first quarter earning revenue slip less expect analyst company also announce quarterly dividend cent seagate share finished friday august low begin right side month consolidation dow industrial dowdupont dwdp take early lead general electric ge slump morgan stanley ub downgrade ge share underweight neutral respectively apple aapl tick fang stock tech leader rise netflix nflx drop alphabet googl shed tesla step news report sunday say electric vehicle maker have reach deal allow build wholly own manufacturing site shanghai free trade zone facility reportedly be first automaker china be not part chinese own joint venture arrangement tesla share have be hugging support week move average mid september attempt fail biotech dbv technology dbvt collapse early trade company confirm earlier news report viaskin peanut adhesive patch treat peanut allergy do not meet lower threshold endpoint phase clinical trial peanut allergy rival treatment rival aimmune therapeutic aimt bolt higher monday open telecom software leader broadsoft rise announce be acquire cisco system csco share investor have send share higher earlier trade speculation deal cisco share gain ibd list ichor holding ichr pop early action stock be extend double bottom handle base late september ibd peer kemet kem add open gain lift maker capacitor other electronic component past buy point week tight pattern market japan europe trade higher sunday election japan left prime minister shinzo abe mandate solid parliamentary majority manage country ongoing economic reform tokyo nikkei bolt higher move index high marked june europe market see gain recover afternoon trade spain moved closer attempt impose federal government control rebel catalonian region follow vote northern region italy also pursue independence cac paris lead region benchmark economic news chicago federal reserve report national activity index moved september vs read august production related indicator improve august total industrial production rise tally improve decline august related big picture tax cut hope drive stock group lead hot growth stock watch list ibd investor research tool get start ibd
2,VFC,wednesday vf corporation vfc earn positive adjustment relative strength rs rating ibd unique rs rating track market leadership used worst best score indicate stock price action trail week match other publicly trade company history show best perform stock often have rs rating north early stage move vf corporation be now consider extend buy range clear buy point first stage flat base see stock form new pattern follow buy opportunity week tight pullback day week move average ep growth decrease last quarter sale rise vf corporation earn rank peer apparel clothing manufacturing industry group hanesbrand hbi be top rank stock group related stock be show improve price performance use ibd relative strength rating relative strength line help judge stock
3,VFC,stock market trade mixed afternoon trade range minor gain nasdasq light loss head final hour session tech heavy composite moved decline dow jone industrial average inched lower volume be tracking slightly higher exchange vs same time monday other dow industrial ibm ibm pace advancer rise microsoft msft home depot hd follow gain respectively downside medical component unitedhealth group unh pfizer pfe pull dow red decline respectively chip stock be leader day chipmaker advanced micro device amd surge chip equipment stock qorvo qrvo follow monday advance rise qorvo surge past flat base entry remain proper buy range laggard be once again retail stock drastically underperform general market apparel company armour uaa hanesbrand hbi pierce day line fall respectively ralph lauren rl vf corp vfc drop lead retailer burlington store burl gap day line early tuesday gain cup base entry have be much just day day lose streak have bring stock gain just china base stock drastically outperformed stock market today internet portal sina sina so call twitter china weibo wb report early tuesday cause shoot higher respectively company top analyst estimate sina surge long consolidation featured buy point weibo be now cup handle entry chinese commerce giant jd com jd alibaba baba moved respectively chinese internet giant tencent tcehy report result open wednesday action ibd be predominantly positive head final hour trading lead technology name china component momo momo new oriental education edu tal education tal lead way gain respectively life science software provider veeva system veev jump be now almost cup handle buy point downside stamp com stmp fall stock be build cup base battle support day line related china stock jump lead strong earning weibo sinaselling intensify retail sector department storesinternet giant join china parade cisco entry investing action plan
4,VFC,just ace baseball pitcher mix throw top mutual fund manager vary investment manager columbia large cap growth fund be mingle semiconductor stock biotech stock online travel agency chinese fast food chain good effect be benefit investor retirement account other portfolio fund be work way back multiyear top notch outperformance year go wednesday fund gain top large cap growth rival track morningstar inc advance improvement show past month fund outpaced just direct rival nonetheless decent rise so year date relative performance be turn back accomplish past year beat direct rival key piece credit go fund stake technology stock be portfolio largest sector feb weighting nearly double second largest sector then consumer discretionary have tech weighting fund semiconductor stock include lam research lrcx so far year micron technology mu year broadcom avgo ibd take broadcom be rank ibd electronic semiconductor fabless industry group composite rating be highest possible earning share growth have accelerate quarters row see additional easy understand fundamental technical datum stack rival ibd stock checkup biotech bet include vertex pharmaceutical vrtx celgene celg fund consumer discretionary play be online travel agency priceline pcln expedia expe be respectively year china base restaurant chain yum china yumc be security consumer discretionary space year ve also try make play multicategory straddler alibaba baba amazon amzn lam have benefit trend be grow complexity semiconductor manufacturing equipment say peter deininger manager fund second be consolidation semiconductor equipment space have cut inventory volatility smooth industry cycle mean higher margin higher return lam deininger say addition lam be leader etching deposition segment semiconductor equipment field help increase market share rate excess other player deininger say combine have put company good situation anticipate have leg go micron make memory datum storage device industry have go enough consolidation pricing be stable rise micron key dram product deininger say lead rise margin add industrywide earning share price do so well last year segment be top explain recent pullback space affected micron other stock deininger be not ready retreat yet continue be very balanced supply pricing remain firm lead time product be modestly extend say combine lack significant new capacity argue share price strength hold time go forward fund manager tchintcia barro like vertex exist treatment cystic fibrosis well development vertex gap march news favorable result late stage trial new treatment combination therapy vertex plan add drug create drug cocktail treat thousand more cystic fibrosis patient barro say several month competitor galapago create fear investor vertex have portfolio treatment barro say datum show galapago be year vertex fund manager have mixed feeling consumer discretionary space hand end last year have shift underweight overweight sector vs russell growth index ve sell position brand apparel manufacturer vf vfc yogawear chain store lululemon athletica lulu pharmacy operator cvs health cvs online company have put lot pressure traditional retail area manager john wilson say other hand fund still like online travel agency priceline expedia manager yum china pure play china restaurant stock yum china gap april day release first quarter financial result earning share grow slip sale sale nose consensus estimate company open new store quarter include little sheep east dawn outlet guidance fiscal company say open least new store operate profit grow double digit pace yum brand yum fund also hold say have complete spinoff yum china nov begin trading day share new company be related top columbia fund load stock leadersyou need much retirement saving age income
5,VFC,confirm earlier report armour ua say monday have clinch year deal be official field uniform provider major league baseball start financial term weren disclose contract be major first apparel footwear brand first professional sport league deal last year armour be reportedly name vie outfit national basketball association adida decide not renew partnership nike nke ultimately win armour strike deal become official outfitter nba draft combine however start deal license sport merchandise company fanatic manage manufacturing distribution armour fanatic fan gear retail accord armour armour also provide pro baseball league player connect fitness offering currently include fitness band smart scale heart rate monitor company replace vf vfc own majestic athletic vf say march be explore strategic alternative license sport group business division include majestic statement armour ceo kevin plank call deal watersh moment brand los angele dodger pitcher clayton kershaw san francisco giant catcher buster posey washington national outfielder bryce harper be just few armour mlb endorser viewer enthusiasm baseball reach fever pitch year chicago cub win world series first time share armour rise stock market today meanwhile nike receive upgrade hsbc buy hold price target bump bank acknowledge stock be worst performer dow year reality isn grim nike be good stock ibd take fear nike innovation streak be slow recent patent application dump patent trademark office show swoosh have futuristic offering work company epitomize view captain industry status growth sector even alternative brand be gain share time feel company be still poise superior growth return long term write hsbc analyst erwan rambourg monday note nike share climb retake day average first time month related major league armour mlb deal mean here play armour challenge nike dominance nba deal
6,VFC,vf corporation vfc have relative strength rs rating upgrade monday look best stock buy watch keep close eye relative price strength exclusive rating investor business daily identify share price movement worst best score rating show stock price performance trail week compare other stock database year market history reveal best perform stock typically have rs rating north begin biggest climb look best stock buy watch start herevf corporation be build cup handle buy point see clear price volume least average earning grow last quarter prior report revenue also increase company hold rank peer apparel clothing manufacturing industry group canada goose goos be top rank stock group get newsletter deliver inbox more info product service privacy policy term also stock be show improve technical action use ibd relative strength rating relative strength line help judge stock
7,VFC,armour ua be major league now brand have reportedly clinch licensing deal provide uniform major league baseball first such agreement pro sport league sport business daily first report news say armour fanatic producer license sport gear jointly make armour brand field mlb jersey start spring term agreement fanatic produce customize fan jersey retail accord espn cite team source new era still have hat right armour fanatic replace vf vfc own majestic athletic have be mlb field jersey partner fan gear maker also make fan gear nfl nhl nba collegiate team vf say march be explore strategic alternative license sport group business division include majestic armour share close stock market today nike nke tack vf rise ibd take comeback kid continue roll adida be claw back share say piper jaffray analyst follow semiannual survey nike armour adida be brand christmas armour already have number baseball hotshot endorsement roster include los angele dodger pitcher clayton kershaw san francisco giant catcher buster posey washington national outfielder bryce harper
8,VFC,related nike chelsea confirm deal reportedly worth billionbuy nike downturn world class equity say armour get street love growth opportunity
9,VFC,share iii apparel giii tumble early tuesday company fall well short quarterly earning view offer disappointing guidance report open iii post adjust earning cent share fiscal third quarter end january be cent prior year well consensus estimate cent be first time year company logged lower earning result also end run straight quarters double digit better ep growth iii sell everything swimwear accessory outerwear performance wear own vilebrequin andrew marc marc new york brand well license brand calvin klein levi kenneth cole tommy hilfiger quarterly revenue gain also well estimate iii share sank stock market today fall low stock have be rally mid january close monday session statement ceo morris goldfarb call fiscal very strong year iii say company be disappoint wholesale retail outerwear business be heavily impact warmest winter ever record say have excellent performance nonouterwear calvin klein business well dress team sport business have significantly expand relationship tommy hilfiger brand increase financial investment partnership karl lagerfeld brand be make significant investment brand go forward iii guide fiscal earning range share expect analyst poll thomson reuter apparel company pvh pvh be slate report fiscal result wednesday close analyst expect earning dip share revenue be see inch less pvh share fall tuesday ibd apparel clothing manufacturing group rank industry track recently week biggest stock group market cap be vf corp vfc own brand such north face van well athletic apparel maker armour ua vf stock fall tuesday armour share fall armour investor pay close attention nike earning close nike rise tuesday
10,VFC,share north face timberland parent vf corp vfc fall sharply friday follow fourth quarter miss outlook fall short wall street forecast shaky energy market weigh workwear apparel sale share earning dip cent quarter fall short consensus estimate cent steeper anticipate sale decline almost miss view total revenue vf expect full year currency neutral ep grow analyst poll thomson reuter expect nearly growth share revenue year be see grow mid single digit percentage rate little lower view nearly revenue growth company expect currency change weigh result percentage point currency neutral revenue earning be expect be flat also short estimate vf share close stock market today have fall much earlier day other clothing company finished lower well pvh pvh fall iii apparel giii gildan activewear gil columbia sportswear colm end flat hefty decline imagewear contemporary brand hit result vf imagewear segment revenue tumble low single digit growth license sportswear unit be offset more lower revenue workwear business due primarily impact considerably lower oil gas exploration contemporary brand segment revenue portfolio consist ella moss splendid mankind sank warm weather late last year hit north face timberland sale revenue outdoor action sport segment also include van jansport other brand quarter jeanswear revenue include wrangler lee brand denim dip sportswear segment sale experience revenue decline focus discipline agility softer consumer environment record warm weather strengthen dollar have well position navigate believe be relatively short term challenge say ceo eric wiseman statement go forward remain confident vf ability deliver continue long term profitable growth value creation shareholder wednesday company announce election kroger kr ceo rodney mcmullen vf board director image provide shutterstock
11,VFC,van north face parent vf corp vfc report better expect first quarter result early friday day complete sale nautica brand authentic brand group estimate rise cent share earning revenue grow accord zack investment researchresult ep rise cent revenue climb outlook vf corp see full year ep revenue analyst have see ep sale stock share apparel company fall stock market today close day line tumble intraday go earning vf be build consolidation entry point get newsletter deliver inbox more info product service privacy policy term usetimberland dicky bulwark denim classic wrangler lee be part company portfolio vf have be shedding certain brand look ramp sale growth be trend style comeback hasn be enough revive nautica first announce sale nautica march vf ceo steve rendle say company goal be actively manage brand portfolio ensure composition position accelerate growth sale mark yet example re deliver commitment last year apparel giant also drop license sport business fanatic be interested kanye west controversy hit adida really bad timeunder armour be threaten tick time bomb upgrade echo snl athleisure spoof armour be back bring brand themlululemon lead retail stock be watch
12,VFC,next quarterly earning report set vf corporation vfc be currently entry pattern be second stage flat base buy stock just ahead earning be risky typically don have enough time build profit cushion latest quarterly number come be sure follow sound buy sell rule minimize exposure see ibd help make more money company show earning growth last quarter sale gain come consensus analyst estimate call earning share growth quarter growth full year annual earning estimate be recently revise higher company have composite rating earn rank peer apparel clothing manufacturing industry group canada goose goos be rank stock group note date earning report be subject change check company update get newsletter deliver inbox more info product service privacy policy term also earning calendar analyst estimate stock watchnew option strategy limit risk earning
13,VFC,best time many retailer apparel fashion name be focus monday michael kor kor stock lululemon lulu valuation be too low ignore michael kor stock have catch eye hsbc analyst initiate apparel purse maker buy rating price target acknowledge group have structural weakness take time address notably very large profitable exposure wholesale be midst recovery phase write hsbc security analyst erwan rambourg monday note client stock price earning ratio suggest market do not believe recovery blue sky scenario be unlikely unfold long term short term present buy opportunity view michael kor stock top component ibd apparel clothing manufacturing group rise close stock market today entry point area consolidation think call today be more comparison traditional premium european player luxury rambourg tell cnbc monday ve have phenomenal run mostly come buoyant chinese consumer think tapestry kor be more play consumer also say see valuation affordable luxury stock lag quite significantly premium get newsletter deliver inbox more info product service privacy policy term usemeanwhile lululemon get price target lift cowen analyst reaffirm outperform rating athletic wear brand cite accelerate global brand awareness customer acquisition firm like performance lululemon digital international man segment praise current management team include new cfo patrick guido formerly work vf vfc company be still hunt new ceo departure laurent potdevin earlier year be not concern impressively business have show significant acceleration quarters prior ceo depart speak quality cohesion entire team write cowen john kernan competitive athleisure athletic apparel market cowen survey work find be evident lulu brand have wide appeal compete well entrench athletic competitor such nike nke dominate space apparel footwear still currently only have low single digit preference share american kernan say leave lot white space opportunity brand gain traction lululemon stock fall finish be still time high get instant access more trading idea exclusive stock list ibd proprietary rating only be interested lululemon stock chart have left ugly day behindibd stock dayamazon top fund manager go shopping retail stocksfossil macy stock surge push retail front marketretail commerce news stock watch
14,VFC,canada goose goos maker luxury parkas winter wear report surprise fiscal fourth quarter profit revenue crushed expectation xestimate share loss narrow cent cent year revenue surge accord analyst poll zack investment research result canada goose earn cent share revenue more double traditionally canada goose make money fall especially winter lose money warmer spring summer quarters outlook company see fiscal ep growth least revenue more stock share soar stock market today hit new record ibd stock ipo leader be well extend buy territory clear entry april share also blast profit take sell range alternative entry point get newsletter deliver inbox more info product service privacy policy term usevf vf parent north face rise columbia sportswear colm climb fashion peer michael kor kor rally february research note cowen analyst oliver chen have say heritage company be founder give unique competitive moat competition rate stock outperform ascribe premium multiple share canada goose give powerful brand equity base high level functionality quality vertically integrate supply chain opportunity become more efficient bring more manufacturing house boost margin opportunity widen addressable market grow top line global growth shift direct consumer product category expansion strategy continue be execute chen write time be interested trump china trade war bank japan canada goose investing action planipo stock news analysis find today top new issuesibd stock daybest growth stock buy watch see update ibd stock listsstock buy watch top ipos big small cap growth stockslooking best stock buy watch start here
15,VFC,ibd stock screen be regularly update add new stock watch well weed have start show weakness table ll see stock have be add remove list ibd sector leader ibd big cap screen be
16,VFC,keep watch list date be key make money stock market ibd help do regularly update stock screen ibd sector leader ibd big cap ipo leader table see stock have just be add remove list ibd display video id
17,VFC,ibd ipo leader canada goose goos know parkas be look keep upward momentum go report fiscal earning open friday wall street see premium winter coat retailer quarterly loss reduce cent cent accord zack investment research revenue be see rocket canadian firm also make vest hat glove other apparel company product have featured several film model kate upton make eye catch appearance cover sport illustrated swimsuit edition canada goose parka february research note cowen analyst oliver chen have say heritage company be founder give unique competitive moat competition rate stock outperform ascribe premium multiple share canada goose give powerful brand equity base high level functionality quality vertically integrate supply chain opportunity become more efficient bring more manufacturing house boost margin opportunity widen addressable market grow top line global growth shift direct consumer product category expansion strategy continue be execute chen write time canada goose share close stock market today timberland north face parent vf corp vfc fall be still buy range outerwear maker columbia sportswear colm lose other high end apparel name michael kor kor sell ralph lauren rl drop get newsletter deliver inbox more info product service privacy policy term apparel clothing manufacturing group leader break entry april be close profit take sell zone breaking alternative entry point investor interested stock new base form ipo stock relative strength line be time high be positive sign continue improvement go public march last year stock have soar boast top notch fundamental be reflect impressive ibd composite rating addition have ep rating relative strength rating importantly investor accumulation distribution rating reflect strong institutional investment also be interested retailer stock take charge nasdaq lead sell canada goose stock now make money stock find correct buy point still bullish bitcoin read cautionary tale blockchain stock ep rating be key pick best invest stock market start simple routine
