,ticker,content
285,VFC,corp vfc free report have successfully acquire family own private global workwear company williamson dickie mfg co cash follow conclusion acquisition be announce august williamson dickie have become wholly own subsidiary corp buyout form part target accelerate growth reshape portfolio williamson dickie now form part corp imagewear coalition add popular dicky kodiak wall brand latter portfolio brand enhance corp present workwear offering include wrangler rigg workwear timberland pro red kap bulwark horace small combine business have give rise global leader workwear be capable generate revenue annually additionally help serve more consumer industry worldwide further acquisition be expect contribute nearly corp revenue cent share earning moreover acquisition add more revenue target accelerate company revenue more earning share excess apart enhance portfolio acquisition also demonstrate corp focus be active portfolio manager drive growth enhance shareholder value follow announcement acquire williamson dickie corp have raise guidance company now expect revenue grow currency neutral revenue be expect be company now anticipate gross margin be currency be still anticipate impact gross margin roughly bps moreover company now envision earning share be meaning decline nearly year year mid single digit percentage growth currency neutral basis further company anticipate transaction deal related expense be nearly cent share additionally company revise target include impact williamson dickie acquisition company now anticipate year compound annual revenue growth rate cagr more further company now estimate earning share growth year cagr meaning earning share more company have previously expect earning share growth year cagr aforementioned acquisition be predict contribute more cent share earning news do not bear much impact company stock price however zack rank hold stock have improve year date outperform industry increase look more promising stock check better rank stock consumer discretionary space include crocs inc crox free report iii apparel group ltd giii free report pvh corp pvh free report crocs iii apparel sport zack rank strong buy pvh corp carry zack rank buy see complete list today zack rank stock here crocs have improve year date moreover stock have long term growth rate iii apparel have witness positive estimate revision last day stock have long term growth rate have advanced last month pvh corp long term earning share growth rate have surge last month make fortune shift electric car here stock idea consider much petroleum year lithium power soon shake world create millionaire reshape geo politic soon electric vehicle evs be cheaper gas guzzler be already reach mile single charge battery price plummet charge station set multiply company stand stock buy accord zack research not think see ticker free
286,VFC,corporation vfc free report post result transition period end mar adjust earning cent share surpass zack consensus estimate cent moreover bottom line rise year year include cent contribution williamson dickie acquisition currency neutral basis earning share improve earning estimate revision zack consensus estimate have be stable last day trail quarters exclude quarter review company have outpaced zack consensus estimate average corporation price consensus ep surprise corporation price consensus ep surprise corporation quoterevenue corp generate total revenue include royalty income increase year year beat zack consensus estimate net sale also advanced prior year quarter include contribution williamson dickie acquisition currency neutral basis revenue jump exclude williamson dickie acquisition revenue be currency neutral revenue grow key event apr company complete sale nautica brand business authentic brand group abg llc earlier company complete sale license sport group business consist majestic brand fanatic inc apr conjunction lsg divestiture corp also exit licensing business complete sale asset jansport brand collegiate business fourth quarter hence result business be record discontinue operation further company declare quarterly dividend cent share payable jun shareholder record jun outlook fiscal company expect revenue increase envision adjust earning share be range mark growth year year zack rank currently corp carry zack rank hold be subject change follow earning announcement see complete list today zack rank strong buy stock here check back later full corp earning report today stock zack hottest strategiesit hard believe even zack market gain top stock pick screen have return outperformance have not just be recent phenomenon year have be remarkably consistent composite yearly average gain strategy have beaten market more maybe even more remarkable be fact re willing share latest stock cost obligation see free
287,VFC,corporation vfc free report successfully complete previously announce sale iconic nautica brand authentic brand group llc lead brand development entertainment company base new york term deal remain cover company agree sell brand mar sync global business strategy focus rapidly respond change marketplace target huge shareholder return corp point strategy be focuse redesign portfolio empower key brand adopt consumer retail centric model enrich direct consumer digital business direct investment asia particularly china further plan be go be aid increase investment design innovation demand creation brand experience insight analytic retail excellence demand supply chain agility talent order reshape brand portfolio drive growth category company have be aggressively make acquisition recent venture direction include agreement buy altra footwear brand icon health fitness inc acquisition outdoor sport apparel company icebreaker holding ltd acquisition altra be likely boost growth corp direct consumer international channel addition icebreaker brand be go enhance smartwool brand portfolio acquisition be likely be immediately accretive company bottom line further company be look better serve customer enhance distribution service northeastern unite state announce plan establish new distribution center jonestown pa new square foot facility help fulfill significant increase sale due growth direct consumer business facility carry distribution product van north face timberland brand company expect lease begin july facility be fully operational early sale nautica brand do not have major impact corp share price however zack rank hold stock have gain past month outperform industry growth look promising stock check better rank stock same industry include columbia sportswear company colm free report ralph lauren corp rl free report pvh corp pvh free report carry zack rank buy see complete list today zack rank strong buy stock here columbia sportswear have improve last month moreover stock have long term growth rate ralph lauren have long term growth rate have advanced last month pvh corp long term earning share growth rate have jump last month wall street next amazonzack evp kevin matra believe familiar stock have only just begin climb become greatest investment time once generation opportunity invest pure genius click detail
288,VFC,corporation vfc free report be slate release result transitional period end mar market open previously announce company decide change fiscal year end saturday closest mar current saturday closest dec change be effective mar last report quarter designer manufacturer marketer brand apparel related product deliver negative earning surprise however company record average positive surprise last quarters expect question linger investor mind be corp be able deliver positive earning surprise quarter be report zack consensus estimate quarter review be cent share reflect year year decline note zack consensus estimate have be stable ahead earning release analyst poll zack anticipate revenue year quarter corporation price consensus ep surprise corporation price consensus ep surprise corporation quotemoreover note stock have outperformed industry past year share have increase industry grow factor playv corp be gain progress growth strategy focus respond change marketplace target shareholder return company focus plan be evident growth direct consumer digital business well international segment be key aspect plan additionally company be gain strength international direct customer platform outdoor action sport coalition workwear business moreover contribution recently conclude williamson dickie buyout be aid result company shareholder friendly move also bode well corp provide encourage view transition period expect revenue nearly increase include contribution williamson dickie acquisition exclude acquisition revenue be likely increase high single digit rate company envision adjust earning share transitional period be cent mark growth include contribution cent aforementioned acquisition exclude effect acquisition adjust earning share be estimate increase more however currency wo impact gross operate margin fourth quarter continue be hurdle further company be be trouble difficult global economic environment year now zack model unveilsour proven model show corp be likely beat earning estimate quarter stock need have positive earning esp zack rank strong buy buy hold happen company earning esp zack rank make reasonably confident earning beat uncover best stock buy sell re report earning esp filter other stock poise beat earning estimateshere be other company want consider model show too have right combination element post earning beat ralph lauren corporation rl free report have earning esp zack rank see complete list today zack rank stock here estee lauder company inc el free report have earning esp zack rank armour inc uaa free report have earning esp zack rank hottest tech mega trend year generate global revenue predict blast roof fame investor mark cuban say produce world first trillionaire still leave plenty money regular investor make right trade early see zack best stock play trend
289,VFC,monday july big name report earning today be alphabet googl free report not close bell afternoon never fear be plenty other firm push earning result meantime oil field service provider halliburton hal free report post cent share quarterly revenue number easily top expectation cent share sale improve performance north south america be cite improvement company be operate income completion production segment swung loss time year zack rank hold company be trading today pre market stanley black decker swk free report also beat zack consensus estimate top bottom line share revenue outperformed expect respectively mark least fifth straight positive earning surprise zack rank company also bump guidance range fiscal dime top bottom end toy make giant hasbro have free report report mixed report morning beating bottom line estimate cent cent share quarterly sale however narrowly miss expect zack consensus yet franchise brand sale be year year include popular brand name such monopoly transformers little pony quarterly sale share be selling roughly today pre market however stock be year date retail brand company vf corporation vfc free report beat expectation narrowly top bottom line morning penny bottom line cent share roughly top line strength company largest brand wrangler jean north face timberland nautica boost company fortune quarter vf corp also announce executive chairman eric wiseman be step late october be replace president ceo steven rendle finally beat arconic arnc free report earning sale have come morning report cent beat cent share top revenue anticipate spin alcoa aa free report also bump ep guidance share company appear be fairly sound foot consider shakeup not only regard spin sudden departure former ceo klaus kleinfeld past spring mark vickerysenior editorquestion comment article author click here
290,VFC,corporation vfc free report release second quarter result top bottom line exceed estimate sale also grow year year notably sale marked first positive surprise post straight miss solid first half result also encourage management raise outlook full year splendid quarter be well receive investor share brand apparel retailer jump pre market trading session further corp share have jump year date outperform industry marginal rise company quarterly earning continue operation come cent share beat zack consensus estimate penny however bottom line plunge year year currency neutral basis earning remain flat year year corporation price consensus ep surprise corporation price consensus ep surprise corporation quotev corp generate total revenue include royalty income increase year year surpass zack consensus estimate net sale also advanced prior year quarter currency neutral basis revenue jump revenue quarter gain strength international direct customer platform outdoor action sport coalition company workwear business company report gross margin increase basis point bps thank gain better pricing reduce product cost mix shift high margin business be partly negate foreign currency headwind foreign currency hurt gross margin bps report operate income decline operate margin contract bps currency headwind affected operate margin bps segment detailsrevenue outdoor action sport grow currency neutral basis jeanswear revenue decline year year currency neutral basis imagewear revenue surge currency neutral basis roughly revenue sportswear dip report currency neutral basis financial detailsv corp end quarter cash equivalent long term debt shareholder equity first half company used cash operate activity quarter company buy back share nearly share repurchase program authorize mar so far company have repurchase share company also declare quarterly dividend cent share payable sep shareholder record sep divestitureson apr corp divest license sport group lsg business fanatic inc include sale majestic brand also management implement plan discontinue licensing unit lead company bring asset jansport brand hold sale category aug company complete sale contemporary brand business include mankind splendid ella moss brand business be classify discontinue operation company financial statement remain impressed company quarterly performance meet expectation result be backed solid result major global brand direct consumer operation international operation strength workwear business company remain optimistic second half also encourage raise outlook give strength company remain focuse make investment big brand be aim augment shareholder value future management now anticipate revenue grow currency neutral revenue be expect rise earlier management project revenue grow low single digit percentage rate direct consumer revenue be now anticipate rise range compare high single digit percentage rate growth forecast earlier company expect digital revenue surge year year now corp now anticipate gross margin increase bps level compare bps growth expect earlier currency be still expect impact gross margin roughly bps operate margin be still expect include bps impact currency headwind finally company now envision earning share be reflect dip year period figure earlier management expect ep decline low single digit percentage rate band currency neutral basis earning share be still expect rise mid single digit percentage range company expect cash flow operation approximately effective tax rate be project be low range zack rank key picksv corp currently carry zack rank hold better rank stock be iii apparel group ltd giii free report guess inc ge free report pvh corp pvh free report iii apparel long term ep growth rate sport zack rank strong buy see complete list today zack rank stock here guess long term ep growth rate flaunt zack rank pvh corp have spectacular earning surprise history stock long term ep growth rate hold zack rank buy more stock news be bigger iphone become mother technological revolution apple sell mere iphone year new breakthrough be expect generate more device just year create market zack have just release special report spotlight fast emerge phenomenon ticker take advantage don buy now kick click here trade
291,VFC,corporation vfc free report post second quarter result earning cent share top zack consensus estimate cent however bottom line decline year year remain flat currency neutral basis earning estimate revision zack consensus estimate have be stable past day further trail quarters exclude quarter review company have outpaced zack consensus estimate average corporation price consensus ep surprise corporation price consensus ep surprise corporation quoterevenue corp generate total revenue include royalty income increase year year surpass zack consensus estimate net sale also advanced prior year quarter currency neutral basis revenue jump key event corp notified retirement eric wiseman position executive chairman board director company effective oct further state president chief executive officer director steven rendle succeed eric chairman retirement company buy back share worth second quarter further company declare quarterly dividend cent share be payable sep shareholder record sep apr corp complete sale license sport group business consist majestic brand fanatic inc aug corp conclude sale contemporary brand business include mankind splendid ella moss brand delta galil industry ltd thereafter company record result business discontinue operation outlook base solid first half result company raise outlook full year company expect revenue come nearly increase report basis growth currency neutral basis company now envision earning share share mark dip prior year quarter report basis mid single digit percentage rate currency neutral basis compare company previous guidance range share zack rank currently corp carry zack rank hold be subject change follow earning announcement see complete list today zack rank strong buy stock here stock movement corp share jump nearly pre market trading hour follow earning release investor develop positive sentiment follow company better expect result favorable view check back later full corp earning report more stock news be bigger iphone become mother technological revolution apple sell mere iphone year new breakthrough be expect generate more device just year create market zack have just release special report spotlight fast emerge phenomenon ticker take advantage don buy now kick click here trade
292,VFC,corporation vfc free report be slate release second quarter result jul question linger investor mind be designer manufacturer marketer brand apparel related product be able deliver positive earning surprise quarter be report company post line earning last quarters let see thing be shape prior announcement corporation price ep surprise corporation price ep surprise corporation quotewhat expect current zack consensus estimate quarter review be peg cent reflect year year decline note earning estimate have remain stable last day further analyst poll zack expect revenue year quarter corp form part retail wholesale sector latest earning trend jul retail wholesale sector earning be expect inch revenue growth factor playv corp share have gain last month outperform zack categorize textile apparel industry decline be largely attributable year strategic growth plan growth strategy be announce march plan focus rapidly respond change marketplace well target shareholder return further company point strategy focus redesign portfolio empower key brand adopt consumer retail centric model enrich direct consumer digital business direct investment asia particularly china well plan underscore company growth prospect fact believe company be progress well line revenue first quarter mainly gain strength international direct customer platform outdoor action sport coalition however earning sale decline year year challenge retail environment currency headwind play foul currency have long be hurdle company top line have suffer consecutive quarters year year decline also adverse currency fluctuation be expect persist hurt result evidently management expect foreign currency wo hurt revenue percentage point also gross operate margin be likely bear respective bps negative impact currency finally company expect earning share decline low single digit percentage rate year year basis same be likely rise mid single digit rate currency neutral basis consider pro con prefer see corp growth strategy help sail headwind earning season zack model unveil proven model do not conclusively show corp be likely beat earning estimate quarter be stock need have positive earning esp zack rank strong buy buy hold happen uncover best stock buy sell re report earning esp filter corp currently carry zack rank buy increase predictive power esp however company have earning esp most accurate estimate zack consensus estimate be peg cent combination corp zack rank esp make surprise prediction difficult stock poise beat earning estimateshere be company want consider model show have right combination element post earning beat dollar general corporation dg free report have earning esp zack rank see complete list today zack rank stock here amazon com inc amzn free report have earning esp zack rank inc jwn free report have earning esp zack rank today stock zack hottest strategiesit hard believe even zack market gain top stock pick screen have return respectively outperformance have not just be recent phenomenon year have be remarkably consistent composite yearly average gain strategy have beaten market more maybe even more remarkable be fact re willing share latest stock cost obligation see free
293,VFC,cruise vacation company carnival corporation ccl free report be expect release third quarter fiscal result sep market open last quarter company deliver positive earning surprise fact company earning surpass zack consensus estimate last quarters average beat let see thing be shape announcement carnival corporation price ep surprise carnival corporation price ep surprise carnival corporation quotefactor likely affect resultsdure second quarter fiscal earning conference call company have issue guidance adjust earning share fiscal third quarter carnival have factor year year growth net revenue yield constant dollar roughly flat year year net cruise cost exclude fuel project earning share be positive carnival strategy grow familiar itinerary capitalize new market fact company be confident fiscal third quarter result reflect growth china other asian market well expansion relatively other untapped market cuba bermuda mexico notably last year company have launch initial phase yield management system be expect aid drive incremental revenue yield be report quarter addition carnival predict quarter revenue yield improve back marketing initiative enhancement guest experience better book environment moreover company remain focuse cost containment effort include decrease fuel consumption be likely aid quarter margin however higher investment marketing increase marketing expense hamper quarter margin higher fuel cost adverse foreign exchange movement also weigh company profit meanwhile macroeconomic issue key operate region remain concern company top line earning whispersour proven model do not conclusively show earning beat carnival quarter be stock need have positive earning esp zack rank strong buy buy hold happen unfortunately be not case here elaborate zack esp carnival have earning esp be most accurate estimate be zack consensus estimate be peg higher uncover best stock buy sell re report earning esp filter zack rank carnival have zack rank increase predictive power esp however company negative esp make surprise prediction difficult notably caution stock zack rank sell rate go earning announcement especially company be see negative estimate revision stock considerhere be company consider model show have right combination element post earning beat quarter marriott vacation worldwide corporation vac free report have earning esp zack rank see complete list today zack rank stock here corporation vfc free report have earning esp zack rank interface inc tile free report have earning esp zack rank trade profit big league trump policiesif stock spark interest look company prime make substantial gain washington change course today zack reveal ticker benefit new trend streamline drug approval tariff lower taxe higher interest rate spending surge defense infrastructure see buy recommendation now
