,ticker,content
239,VFC,forrester forecast nation online retail market pass come fee consumer appetite bargain china vipshop holding follow try true recipe help nurture healthy growth spurt vipshop vip start go public march be somewhat rare breed retail website sell quality brand apparel accessory home good other lifestyle product discount original retail price used flash sale model morning beij time launch new flash sale finite quantity product service online limit time provide shopper greater opportunity buy featured discount product customer be limit purchasing piece same item shopping cart hold only item time food product other popular flash sale site sell everything high fashion hotel room idea be create impulse drive shopping experience help move excess inventory source variety vendor end vipshop have impressive lineup good exclusive right sell selective product more brand prefer productsvipshop feature product more brand include international label such such nike nke disney hanesbrand hbi lee own vf corp vfc domestic brand hstyle top selling brand be adida nike kappa domestic sporting good brand vipshop approach have play well customer sale more triple end year close register user have also score big hit investor vipshop stock price have rocket nearly past month vipshop have be profitable past quarters earn cent american depositary share ad most recent third quarter cent year earlier sale rocket see rise active customer rise total order analyst poll thomson reuter expect full year earning reach ad cent loss see surge rise china base ub analyst erica poon werkun forecast revenue compound annual growth rate drive mainly growth active customer january initiation note vipshop rate buy bright prospect believe vip address issue supply side namely excess inventory distribution channel difficulty penetrating lower tier city note werkun also address consumer demand superior product value proposition newness convenience shopping add vipshop main growth driver be discount product selection add willi associate analyst forrester research say vipshop offer access brand affordable price most part aren available other website china vipshop have hit niche china mass market mid range name brand adida puma be consider luxury product consumer group china say ve really do great job cater middle income consumer age offer name brand product wouldn otherwise be able afford consumer target be brand conscious be excited be able shop product price point afford growth driversin initiation report china base hsbc analyst chi tsang cite growth driver vipshop be fact market be large grow rapidly tsang estimate market discount retail china be grow year vipshop have market share company other growth driver be limit competition traditional discount retailer substantial potential upside customer number vipshop strength be mix international domestic brand flash sale say willi say not many website china offer mix site do offer mix say don do good job present brand vipshop do vipshop do good job highlight brand be international domestic flash sale other retailer tend sell product category don know actual brand name add competitive overall industry rivalry china be intense say tsang vipshop compete dedicate flash sale player online marketplace primary rival include business consumer commerce firm sell similar product service online such tmall buy dangdang dang other online flash sale firm say company filing security exchange commission marketplace dominate commerce scene china write willi china online retail forecast report biggest marketplace country include taobao tmall suning jingdong well amazon com amzn vipshop have advantage rival say tsang include customer loyalty drive high quality product selection choose be consider be largest team buyer china dedicate customer service organization effective operational management financial control meanwhile online shopping china be grow faster most anyone originally expect willi note report china online retail market include business consumer consumer consumer site surpass willi say forrester forecast nation online retail market pass
240,VFC,have goal work be good thing earlier week clothing footwear maker vf corp vfc outlined plan growth tuesday company set sale target be reach earning be expect share
241,VFC,come buy handbag holiday season woman key consumer segment show increase preference michael kor holding kor product vs year earlier preference coach coh product decline accord report cowen analyst faye lande release friday report share finding cowen consumer tracking survey handbag
242,VFC,coach coh earning sale fall more expect critical holiday quarter luxury handbag accessory maker lose further ground north america rival such michael kor
243,VFC,fiscal second quarter earning slide share analyst survey thomson reuter expect earning come flat prior quarter year increase
244,VFC,coach revenue fall short view be second straight quarter lower sale
245,VFC,north american sale fall north american direct sale sank same store store skid
246,VFC,share sank fall lowest level just prior earning report
247,VFC,come buy handbag holiday season woman key consumer segment show increase preference michael kor kor product vs year earlier preference coach product decline accord report cowen analyst faye lande
248,VFC,michael kor share rise wednesday investor see coach bad news good news kor hong kong base kor report quarterly earning february
249,VFC,coach china result remain resilient total sale same store sale rise double digit rate ceo victor luis say
250,VFC,continue be disappoint performance north america be impact substantially lower traffic store decision limit access factory flash sale site note press release
251,VFC,most luxury accessible luxury handbag rival kor coach be privately hold such herme loui vuitton coach coh earning sale fall more expect critical holiday quarter luxury handbag accessory maker lose further ground north america rival such michael kor fiscal second quarter earning slide share analyst survey thomson reuter expect earning come flat prior quarter year increase coach revenue fall short view be second straight quarter lower sale north american sale fall north american direct sale sank same store store skid share sank fall lowest level just prior earning report come buy handbag holiday season woman key consumer segment show increase preference michael kor kor product vs year earlier preference coach product decline accord report cowen analyst faye lande michael kor share rise wednesday investor see coach bad news good news kor hong kong base kor report quarterly earning february coach china result remain resilient total sale same store sale rise double digit rate ceo victor luis say continue be disappoint performance north america be impact substantially lower traffic store decision limit access factory flash sale site note press release most luxury accessible luxury handbag rival kor coach be privately hold such herme loui vuitton
252,VFC,retailer head home stretch holiday shopping season hefty sale gain late shopper step rate holiday gift buy accord key chain store sale gauge release tuesday morning international council shopping center goldman sachs index week end dec leap prior week seasonally adjust level
253,VFC,share apparel maker pvh corp pvh fall early trading then reversed stock market day maker izod calvin klein brand top quarterly earning estimate issue guidance view cite competitive holiday season report close monday new york base pvh logged fiscal third quarter earning
254,VFC,apparel manufacturer pvh corp pvh own izod calvin klein brand be expect post first earning decline year report fiscal third quarter result close monday analyst expect new york base company log earning share prior year sale be expect rise
255,VFC,clothing company vf corp vfc make lot noise last year announce buyout timberland venerable outdoor clothing footwear brand deal close september have already have major impact vf top line timberland contribute fourth quarter revenue nearly fifth total now analyst be
256,VFC,veteran brand name apparel producer vf corp vfc strategic move action sport outerwear market have prove fruitful
257,VFC,company history date back wrangler lee jean brand have be decade apparel accessory brand nautica jansport be also consumer staple north face brand performance outerwear van shoe kiple brand nylon base woman handbag have not only widen vf style range also boost firm top bottom line
258,VFC,april report result vf say outdoor action sport business notch record revenue operate income revenue grow include jump international sale vf jeanswear revenue rise total revenue rise earning grow
259,VFC,vf have execute well mild economic recovery earning share have increase year level straight quarters
260,VFC,sale have picked past quarters faster rate profit growth vs sale growth hint company ability improve business operation squeeze more profit dollar sale line trend vf return equity have improve last year
261,VFC,vf corp earning share rating mean post stronger long short term profit growth nearly quarter stock ibd database even better be year earning stability factor scale most stable indicate unusually consistent record profit
262,VFC,week vf report late april blitz tornado southeast destroy jeanswear distribution facility hackleburg ala employee be kill firm say take time determine big impact tragedy have operate result
263,VFC,vf paid share dividend past quarters equal annualize yield
264,VFC,vf stock have outperformed market nyse composite be wednesday close vf have rise same time frame veteran brand name apparel producer vf corp vfc strategic move action sport outerwear market have prove fruitful company history date back wrangler lee jean brand have be decade apparel accessory brand nautica jansport be also consumer staple north face brand performance outerwear van shoe kiple brand nylon base woman handbag have not only widen vf style range also boost firm top bottom line april report result vf say outdoor action sport business notch record revenue operate income revenue grow include jump international sale vf jeanswear revenue rise total revenue rise earning grow vf have execute well mild economic recovery earning share have increase year level straight quarters sale have picked past quarters faster rate profit growth vs sale growth hint company ability improve business operation squeeze more profit dollar sale line trend vf return equity have improve last year vf corp earning share rating mean post stronger long short term profit growth nearly quarter stock ibd database even better be year earning stability factor scale most stable indicate unusually consistent record profit week vf report late april blitz tornado southeast destroy jeanswear distribution facility hackleburg ala employee be kill firm say take time determine big impact tragedy have operate result vf paid share dividend past quarters equal annualize yield vf stock have outperformed market nyse composite be wednesday close vf have rise same time frame
265,VFC,vf corp vfc already own nautica lee wrangler north face many other brand now portfolio have just get bigger final quarter company complete buyout footwear apparel maker timberland timberland buyout already add nearly third quarter sale cent earning
266,VFC,vf corporation vfc free report report lower expect fourth quarter result earning revenue lag estimate however top bottom line improve year year marked company top bottom line miss consecutive quarter beat further company provide guidance transitional quarter end march follow dismal result share brand apparel retailer decline nearly pre market trading session however zack rank hold stock have jump last month outperform industry rise company quarterly adjust earning continue operation come share jump year year miss zack consensus estimate earning share quarter include cent contribution williamson dickie acquisition vf corporation price consensus ep surprise vf corporation price consensus ep surprise vf corporation quotevf corp generate total revenue include royalty income increase year year lag zack consensus estimate net sale also advanced prior year quarter include contribution williamson dickie acquisition currency neutral basis revenue jump exclude williamson dickie acquisition revenue be currency neutral revenue grow drive continue strength company international direct customer platform outdoor action sport coalition workwear business adjust gross margin increase basis point bps thank better pricing lower restructure expense favorable mix shift high margin business be partly negate williamson dickie acquisition foreign currency headwind exclude aforementioned acquisition adjust gross margin expand bps notably foreign currency hurt gross margin bps adjust operate income rise adjust operate margin contract bps exclude williamson dickie adjust gross margin contract bps currency headwind affected operate margin bps segment detailsrevenue outdoor action sport grow currency neutral basis jeanswear revenue rise year year currency neutral basis imagewear revenue rise currency neutral basis roughly other revenue drop report currency neutral basis financial detailsvf corp end cash cash equivalent long term debt shareholder equity company generate cash operate activity concurrently company declare quarterly dividend cent share be payable mar shareholder record mar fourth quarter company decide selling nautica brand business earlier company complete sale license sport group business consist majestic brand fanatic inc apr also management implement plan discontinue licensing unit lead company bring asset jansport brand hold sale category august company complete sale contemporary brand business include mankind splendid ella moss brand business be classify discontinue operation company financial statement outlookas previously announce company have decide change fiscal year end saturday closest mar current saturday closest dec change be effective mar consequently company provide guidance transitional quarter end mar vf corp expect revenue nearly increase include contribution williamson dickie acquisition exclude williamson dickie acquisition revenue be likely increase high single digit rate company envision adjust earning share transitional quarter be cent mark growth include cent contribution aforementioned acquisition exclude effect acquisition adjust earning share be estimate jump more look more promising bet check trend pickssome better rank stock be iii apparel group ltd giii free report zack rank strong buy michael kor holding ltd kor free report ralph lauren corp rl free report carry zack rank buy see complete list today zack rank stock here iii apparel long term ep growth rate have surge solid last month michael kor have long term ep growth rate moreover stock have return last month ralph lauren have witness growth last month company have long term ep growth rate wall street next amazonzack evp kevin matra believe familiar stock have only just begin climb become greatest investment time once generation opportunity invest pure genius click detail
267,VFC,vf corporation vfc free report post fourth quarter result earning share miss zack consensus estimate penny however bottom line rise year year include cent contribution williamson dickie acquisition earning estimate revision zack consensus estimate have be stable last day estimate fourth quarter witness uptrend trail quarters exclude quarter review company have outpaced zack consensus estimate average corporation price ep surprise corporation price ep surprise corporation quoterevenue vf corp generate total revenue include royalty income increase year year lag zack consensus estimate net sale also advanced prior year quarter include contribution williamson dickie acquisition currency neutral basis revenue jump exclude williamson dickie acquisition revenue be currency neutral revenue grow key event fourth quarter company decide selling nautica brand business earlier company complete sale license sport group business consist majestic brand fanatic inc apr also divest brand business include mankind splendid ella moss brand delta galil industry ltd aug hence result business be record discontinue operation further company declare quarterly dividend cent share payable mar shareholder record mar outlook previously announce company have decide change fiscal year end saturday closest mar current saturday closest dec change be effective mar consequently company provide guidance transitional quarter end mar expect revenue nearly increase include contribution williamson dickie acquisition exclude williamson dickie acquisition revenue be likely increase high single digit rate company envision adjust earning share transitional quarter be cent mark growth include cent contribution aforementioned acquisition exclude effect acquisition adjust earning share be estimate jump more zack rank currently vf corp carry zack rank hold be subject change follow earning announcement see complete list today zack rank strong buy stock here stock movement vf corp share dip nearly pre market trading hour follow earning release investor develop negative sentiment follow company lower expect top bottom line result check back later full vf corp earning report wall street next amazonzack evp kevin matra believe familiar stock have only just begin climb become greatest investment time once generation opportunity invest pure genius click detail
268,VFC,expect vf corporation vfc free report beat expectation report fourth quarter result feb last quarter designer manufacturer marketer brand apparel related product deliver positive earning surprise fact company record average positive surprise last quarters expect question linger investor mind now be vf corp be able deliver positive earning surprise quarter be report zack consensus estimate quarter review be share reflect year year decline note zack consensus estimate have be trend ahead earning release analyst poll zack anticipate revenue year quarter corporation price consensus ep surprise corporation price consensus ep surprise corporation quotemoreover note stock have outperformed industry last month company share have increase industry grow factor playvf corp be gain progress growth strategy strategy focus respond change marketplace target shareholder return company focus plan be evident recently raise dividend stellar third quarter performance top bottom line top zack consensus estimate grow year year quarter marked vf corp second straight quarter earning sale beat result be backed strength international direct customer platform outdoor action sport unit workwear business splendid quarter encourage management raise view result be likely gain recently conclude williamson dickie buyout further company continue investment core growth area be likely aid performance management now anticipate revenue grow nearly currency neutral revenue be expect rise williamson dickie buyout be estimate contribute nearly revenue moreover company envision earning share be reflect rise currency neutral basis year period figure however company have be trouble difficult global economic environment currency headwind year now company significant global presence expose adverse foreign currency movement currency wo continue be hurdle be expect hurt margin zack model unveilsour proven model show vf corp be likely beat earning estimate quarter stock need have positive earning esp zack rank strong buy buy hold happen earning esp company zack rank make reasonably confident earning beat uncover best stock buy sell re report earning esp filter other stock poise beat earning estimateshere be other company want consider model show too have right combination element post earning beat inc dd free report have earning esp zack rank see complete list today zack rank stock here aaron inc aan free report have earning esp zack rank macy inc free report have earning esp zack rank hottest tech mega trend year generate global revenue predict blast roof fame investor mark cuban say produce world first trillionaire still leave plenty money regular investor make right trade early see zack best stock play trend
269,VFC,bid enhance distribution service better serve consumer northeastern unite state corporation vfc free report plan establish new distribution center jonestown pa company have be witness significant growth direct consumer business provide opportunity expand distribution operation better serve customer notably revenue company direct consumer business increase third quarter notably enrich direct consumer digital business be crucial part company year strategic growth plan growth strategy plan focus rapidly respond change marketplace target fantastic shareholder return come back distribution center come square foot facility jonestown be expect be fully operational early facility carry distribution product van north face timberland brand company expect lease begin july new distribution center attract investment add more full time job region next year expect start hire employee new facility mid company endeavor be likely benefit berk lebanon dauphin county economically improve job news do not have major impact corp share price however zack rank buy stock gain past month outperform industry growth look more promising bet check other stock worth consider same space be iii apparel group ltd giii free report tailor brand inc tlrd free report crocs inc crox free report iii apparel tailor brand flaunt zack rank strong buy crocs carry zack rank see complete list today zack rank stock here iii apparel deliver average positive earning surprise trail quarters have long term earning growth rate tailor brand pull average positive earning surprise trail quarters have long term earning growth rate crocs deliver positive average earning surprise also have long term earning growth rate make fortune shift electric car here stock idea consider much petroleum year lithium power soon shake world create millionaire reshape geo politic soon electric vehicle evs be cheaper gas guzzler be already reach mile single charge battery price plummet charge station set multiply company stand stock buy accord zack research not think see ticker free
270,VFC,michael kor holding limit kor free report have do exceedingly well emerge strong contender be investment choice be quite evident stock surge past month outperform industry growth believe be still momentum left zack rank buy stock be reflect long term earning growth rate upward estimate revision past day stock such columbia sportswear company colm free report gildan activewear inc gil free report corporation vfc free report same industry have witness gain past month respectively let delve deeper find reason keep michael kor ahead peer see complete list today zack rank strong buy stock here turnaround strategymichael kor acquisition jimmy choo help diversify portfolio tap international market buyout be likely be accretive low single digit fiscal order drive top line growth michael kor have be focuse store expansion fiscal company open new store include americas worldwide fiscal open net new store opening include outlet related acquisition earlier license operation greater china give scope high profitability company own store management be putt more emphasis open retail outlet moreover company state continue expansion drive asia also believe have opportunity long term michael kor have earlier state project runway strategic plan focus product innovation brand engagement customer experience have make rapid progress second quarter part company strategy product innovation launch bancroft michael kor collection line product innovation strategy aid global woman footwear comparable sale increase double digit moreover commerce continue post robust performance valuation perspectivea brief glance valuation metric seem indicate michael kor have enough room run bourse michael kor look attractive respect forward price earning multiple compare industry more less similar picture emerge compare ev ebitda ratio michael kor hold edge here ev ebitda ratio lower industry earning trend estimate kor continue positive earning surprise streak consecutive quarter post second quarter fiscal result further revenue come ahead estimate third straight quarter bottom line be drive lower effective tax rate strategic effort take company let look michael kor earning estimate revision order get clear picture analyst be think company past day zack consensus estimate fiscal have increase further earning estimate have jump share fiscal zack editor chief go stockfull disclosure kevin matra now have more own money particular stock other believe short term profit potential also prospect more double today reveal explain surprising move new special report download free
