,ticker,content
35,VFC,armour ua kick pace athletic footwear sale last week leave larger rival nike nke trail trendy sportswear brand strike chord pre black friday shopper nike share race past rival friday follow announcement thursday buy back stock raise dividend enact stock split week end nov armour athletic footwear sale rocket year earlier accord report deutsche bank analyst dave weiner cite datum market researcher sportscaninfo armour accelerate further back strong curry basketball shoe sale weiner note nike see athletic footwear sale rise adida include reebok brand see decline adida brand sale be reebok be skecher usa skx be expand athletic footwear see sale climb armour share close stock market today nike jump skecher say thursday win favorable ruling nike lawsuit close total athletic footwear sale accelerate last week gain year earlier straight week decline basketball shoe sale rebound gain top seller basketball category athletic footwear include nike jordan retro armour curry weiner note run shoe category also rebound last week rise casual athletic shoe category keep leadership position jump sale nike air force skecher burn platform continue resonate weiner note armour have gain traction consumer big name endorsement expansion run basketball training category stock lose traction tuesday sporting good retailer dick sporting good dks major seller armour product report earning miss view note tuesday piper jaffray say armour get sale dick nike get sale athletic retailer vf corp vfc likely get less
36,VFC,athletic apparel retailer armour ua face biggest risk dick sporting good dks dismal darker outlook issue tuesday piper jaffray say note investment firm suggest rival brand such nike nke vf corp vfc be more insulate armour get sale dick piper jaffray say nike get sale athletic retailer vf corp likely draw less dick say earning release inventory rise quarter be work vendor reduce exposure slow selling merchandise return product cancele order secure markdown allowance note throw yet cautionary blanket athletic vendor group piper jaffray say believe be important gauge exposure risk appropriately not brand be create equal share armour fall stock market today close day move average first time april nike vf corp didn fare badly respectively vf corp have variety apparel brand nautica van wrangler jean dick gap tumble low worst january hibbett sport hibb sank year low hibbett sport report earning friday warm weather chill salesdick also say fourth quarter be marked more promotional environment work actively manage inventory level rise inventory sterne agee crt say note tuesday be likely part due slow selling cold weather product dick ceo edward stack say earning release record warm weather more seasonal category offset stronger show athletic apparel footwear accessory also say same store sale growth quarter initially get boost back school season sale fizzle quarter progressed macy other retailer also have warn excess inventory due warm weather dick consolidated same store sale grow well expectation dick earning share increase cent miss view cent net sale rise just beating estimate company see full year ep well street forecast dick say expect ep well short view result come week piper jaffray cut price target armour cite company recent management shake up follow bill peter twitter ibd_bpeter
37,VFC,chop chop chop be stock do again yesterday disappointing news macy send stock lead article wsj highlight headwind retailer face weaker oil factor help push stock lower unsold good be begin pile shelve retail sale number due tomorrow prove be worrisome trend glut retail industry be not good thing glut be defined excessive supply think oil glut housing glut merchandise glut glut be not necessarily bad guess depend side glut be
38,VFC,consumer merchandise glut be expect see everything go sign super sale take extra already discount price well get right retail analyst street be already prep weak result macy kohl kss michael kor kor ralph lauren rl experience slower sale leave extra merchandise shelve department store have little bit more want specialty store experience slight build inventory so group come pressure notice adjective suggest big deal little bit slight build extra merchandise none be tell truth macy layer yesterday be see emerge consumer recession retailer most likely take chin christmas
39,VFC,spdr retail etf xrt layer clearly etf be day be summer high individual name have experience even more dramatic move name lululemon lulu nike nke armour ua vf corp vfc macy kohl nordstroms jwn dsw dsw gap gps etc pressure move most significant time year company expectation strong holiday shopping season be little bit overdo so stock investor name bit tough company bit tough consumer sale create frenzy opportunity more stuff most likely don really need justify leave shelf mean sale
40,VFC,therein lie opportunity longer term investor retail stock have be be sale have not see everything go sign just yet be come surely signal bottom meantime maybe just maybe action retailer be challenge analyst be tell maybe action be forewarn tougher time ahead next not new conversation oil mkt continue be undermined weak oil price crude stockpile jump barrel last week furthermore iraq be send barrel supply directly port month news cause oil price fall ready test october lows october lows oil get violate sense be broader mkt not
41,VFC,bring right back fed be idea rate hike go work feel consumer be exhaust macro datum do not support real strength dollar continue move higher create more distress ecb morning hint more stimulus struggle european economy morning european mkts be lower uncle mario hint more stimulus warning sign sustain turnaround core inflation have weaken downside risk stem global growth trade be clearly visible euro zone
42,VFC,remind ecb still have range instrument available case more accommodation be see necessary mkts turn south same time roll royce cut forecast cause stock give just few click ftse cac dax eurostoxx spain italy here home have full day fed speaker kick bullard et yellen et lacker et evan et dudley et fischer et eco datum include init jobless claim exp cont claim mil jolt report mil suppose job opening
43,VFC,tomorrow retail sale be expect show ex auto gas miss surely send stock lower upside surprise ignite algo cause seller left get way be race future be flat trading be drive sure be conflict fed comment support continue be resistance reason break way just yet take good care kp
44,VFC,kenny polcari be vice president director nyse floor operation behalf neil security inc sister company investor business daily market commentary be opinion author be base decade industry market experience however guarantee be make imply respect opinion commentary be not be intend be rely authoritative take substitution exercise judgment comment note herein not be construe offer sell solicitation offer buy sell financial product official statement endorsement neil security incorporate affiliate chop chop chop be stock do again yesterday disappointing news macy send stock lead article wsj highlight headwind retailer face weaker oil factor help push stock lower unsold good be begin pile shelve retail sale number due tomorrow prove be worrisome trend glut retail industry be not good thing glut be defined excessive supply think oil glut housing glut merchandise glut glut be not necessarily bad guess depend side glut be consumer merchandise glut be expect see everything go sign super sale take extra already discount price well get right retail analyst street be already prep weak result macy kohl kss michael kor kor ralph lauren rl experience slower sale leave extra merchandise shelve department store have little bit more want specialty store experience slight build inventory so group come pressure notice adjective suggest big deal little bit slight build extra merchandise none be tell truth macy layer yesterday be see emerge consumer recession retailer most likely take chin christmas spdr retail etf xrt layer clearly etf be day be summer high individual name have experience even more dramatic move name lululemon lulu nike nke armour ua vf corp vfc macy kohl nordstroms jwn dsw dsw gap gps etc pressure move most significant time year company expectation strong holiday shopping season be little bit overdo so stock investor name bit tough company bit tough consumer sale create frenzy opportunity more stuff most likely don really need justify leave shelf mean sale therein lie opportunity longer term investor retail stock have be be sale have not see everything go sign just yet be come surely signal bottom meantime maybe just maybe action retailer be challenge analyst be tell maybe action be forewarn tougher time ahead next not new conversation oil mkt continue be undermined weak oil price crude stockpile jump barrel last week furthermore iraq be send barrel supply directly port month news cause oil price fall ready test october lows october lows oil get violate sense be broader mkt not bring right back fed be idea rate hike go work feel consumer be exhaust macro datum do not support real strength dollar continue move higher create more distress ecb morning hint more stimulus struggle european economy morning european mkts be lower uncle mario hint more stimulus warning sign sustain turnaround core inflation have weaken downside risk stem global growth trade be clearly visible euro zone remind ecb still have range instrument available case more accommodation be see necessary mkts turn south same time roll royce cut forecast cause stock give just few click ftse cac dax eurostoxx spain italy here home have full day fed speaker kick bullard et yellen et lacker et evan et dudley et fischer et eco datum include init jobless claim exp cont claim mil jolt report mil suppose job opening tomorrow retail sale be expect show ex auto gas miss surely send stock lower upside surprise ignite algo cause seller left get way be race future be flat trading be drive sure be conflict fed comment support continue be resistance reason break way just yet take good care kpkenny polcari be vice president director nyse floor operation behalf neil security inc sister company investor business daily market commentary be opinion author be base decade industry market experience however guarantee be make imply respect opinion commentary be not be intend be rely authoritative take substitution exercise judgment comment note herein not be construe offer sell solicitation offer buy sell financial product official statement endorsement neil security incorporate affiliate
45,VFC,stock future hammer powerful gain ahead friday open boost tech sector earning report global currency issue dow future point be rise
46,VFC,nasdaq future fly high altitude point future show strong point gain small cap show unusual strength russell future rise point
47,VFC,stock market today see economic calendar kick et researcher markit report preliminary manufacturing purchasing manager index number october oil price be focus baker hughe bhi be schedule release weekly rig count report
48,VFC,global bond currency continue react thursday news european central bank be consider boost monetary stimulus effort december addition china central bank make number significant move cut target interest rate percentage point trimming bank reserve ratio requirement eliminate deposit rate ceiling
49,VFC,china shanghai composite hong kong hang seng index rise nikkei tokyo pop europe market be knock solid gain midday dax frankfurt cac paris show gain london ftse ahead
50,VFC,many name be motion ahead friday open report quarterly result american airline aal royal caribbean rcl shire shpg rise whirlpool whr rise procter gamble pg add vf vfc slip
51,VFC,morning big move come tech
52,VFC,alphabet googl google parent company spel premarket gain stomp analyst consensus expectation late thursday ep gain rise revenue share buyback initiative be part third quarter package paid click volume carefully monitored metric jump better expect alphabet finished thursday regular session bit less buy point week cup base
53,VFC,amazon com amzn hold advance ahead friday open soar extend trading thursday diversify online tech service giant result show cent share profit vs consensus expectation cent loss revenue leap also better expect closely watch cloud service unit only total revenue see sale surge stock end thursday still buy range less buy point cup handle base
54,VFC,microsoft msft also scale report late thursday fiscal earning outpaced consensus projection ep gain easily top estimate revenue fall less forecast stock close thursday session buy range less past buy point cup handle base
55,VFC,ibd stock facebook fb bang premarket gain social networking heavyweight end thursday session buy range buy point cup handle base
56,VFC,downside shoemaker skecher skx collapse weak result jump earning revenue gain stop far short consensus projection currency issue rise rent expense be key factor company say stock have be fight regain support week move average month base effort
57,VFC,stream music service pandora crumble open calif base operation report earning rise line consensus expectation revenue increase be smaller forecast management lower revenue guidance well consensus view stock have stage comeback rally july be still deep month consolidation end trade thursday stock future hammer powerful gain ahead friday open boost tech sector earning report global currency issue dow future point be rise nasdaq future fly high altitude point future show strong point gain small cap show unusual strength russell future rise point stock market today see economic calendar kick et researcher markit report preliminary manufacturing purchasing manager index number october oil price be focus baker hughe bhi be schedule release weekly rig count report global bond currency continue react thursday news european central bank be consider boost monetary stimulus effort december addition china central bank make number significant move cut target interest rate percentage point trimming bank reserve ratio requirement eliminate deposit rate ceiling china shanghai composite hong kong hang seng index rise nikkei tokyo pop europe market be knock solid gain midday dax frankfurt cac paris show gain london ftse ahead many name be motion ahead friday open report quarterly result american airline aal royal caribbean rcl shire shpg rise whirlpool whr rise procter gamble pg add vf vfc slip morning big move come tech alphabet googl google parent company spel premarket gain stomp analyst consensus expectation late thursday ep gain rise revenue share buyback initiative be part third quarter package paid click volume carefully monitored metric jump better expect alphabet finished thursday regular session bit less buy point week cup base amazon com amzn hold advance ahead friday open soar extend trading thursday diversify online tech service giant result show cent share profit vs consensus expectation cent loss revenue leap also better expect closely watch cloud service unit only total revenue see sale surge stock end thursday still buy range less buy point cup handle base microsoft msft also scale report late thursday fiscal earning outpaced consensus projection ep gain easily top estimate revenue fall less forecast stock close thursday session buy range less past buy point cup handle base ibd stock facebook fb bang premarket gain social networking heavyweight end thursday session buy range buy point cup handle base downside shoemaker skecher skx collapse weak result jump earning revenue gain stop far short consensus projection currency issue rise rent expense be key factor company say stock have be fight regain support week move average month base effort stream music service pandora crumble open calif base operation report earning rise line consensus expectation revenue increase be smaller forecast management lower revenue guidance well consensus view stock have stage comeback rally july be still deep month consolidation end trade thursday
58,VFC,major average rise more thursday close intraday high follow strong earning report number market bellwether
59,VFC,dow jone industrial average jump mcdonald mcd mmm soar follow strong earning report nasdaq climb volume jump nyse nasdaq accord preliminary datum
60,VFC,beaten steel metal producer pace thursday gain hospital stock be hammer stock market today follow profit warning community health system cyh
61,VFC,unite state steel rise be still more september high nucor nue pop nearly retake day line result easily beat expectation
62,VFC,mcdonald jump new high profit jump share end quarters decline profit growth easily beating wall street estimate revenue fall stock be now extend flat base buy point
63,VFC,rise strong turnover profit rise share ahead view stock be testing resistance day move average
64,VFC,side community health system operate acute care hospital gap plunge massive turnover forecasting result trail wall street estimate universal health service uhs drop hca holding hca fall surgical care affiliate scai lose
65,VFC,close amazon com amzn rocket higher follow quarterly earning report online retail giant rise regular session end cup handle buy point
66,VFC,alphabet googl also soar post session trading release result stock be work week consolidation buy point
67,VFC,however skecher skx tank release result maker casual athletic shoe have be work late stage base
68,VFC,american airline aal proctor gamble pg vf vfc royal carribean cruise rcl be company due report quarterly earning friday
69,VFC,follow scott stoddard twitter ibd_sstoddard major average rise more thursday close intraday high follow strong earning report number market bellwether dow jone industrial average jump mcdonald mcd mmm soar follow strong earning report nasdaq climb volume jump nyse nasdaq accord preliminary datum beaten steel metal producer pace thursday gain hospital stock be hammer stock market today follow profit warning community health system cyh unite state steel rise be still more september high nucor nue pop nearly retake day line result easily beat expectation mcdonald jump new high profit jump share end quarters decline profit growth easily beating wall street estimate revenue fall stock be now extend flat base buy point rise strong turnover profit rise share ahead view stock be testing resistance day move average side community health system operate acute care hospital gap plunge massive turnover forecasting result trail wall street estimate universal health service uhs drop hca holding hca fall surgical care affiliate scai lose close amazon com amzn rocket higher follow quarterly earning report online retail giant rise regular session end cup handle buy point alphabet googl also soar post session trading release result stock be work week consolidation buy point however skecher skx tank release result maker casual athletic shoe have be work late stage base american airline aal proctor gamble pg vf vfc royal carribean cruise rcl be company due report quarterly earning friday follow scott stoddard twitter ibd_sstoddard
70,VFC,apparel conglomerate vf corp vfc many brand include north face nautica dicky van wrangler just fall short analyst expectation early friday fourth quarter result estimate profit growth share sale gain result vf corp earn share revenue be billionstock share fall stock market today plunge day move average heaviest volume october aside day dip september vf corp hadn close day last june high volume break day be clear sell signal vf hit record high thursday other notable apparel stock canada goose goos fall cent pvh pvh fall iii apparel giii be cent piper jaffray say last week vf corp be make significant inroad amazon amzn clean unauthorized third party distribution product commerce site say not be surprised vf announce deeper first party merchant partnership amazon soon vf get upgrade buy stifel nicolaus monday healthy inventory favorable foreign exchange rate strong consumer sentiment spending power ibd take buy hold stock be risky head earning report here earning option strategy help cash post earning stock gain minimize risk weak quarter apparel maker have be face crowd market armour uaa example beat forecast earlier week be say still need time full turnaround north america parka maker canada goose beat quarterly forecast last week share fall indication expectation have become sky high overshadow solid performance be interested hot stock food giant lead earning investing action plannike rise bill ackman disclose persh square stakeretail commerce stock industry news fang stock news quote invest stock market start simple routine
71,VFC,here investing action plan friday need know investor come day highly rate company lead earning charge ipg photonic ipgp deere vf corp vfc meanwhile host food beverage company report well include campbell soup cpb kraft heinz khc
72,VFC,stock index retreat modestly midday thursday be pocket strength apparel lodging market research stock volume be run average major exchange nasdaq slip respectively dow jone industrial average trim apparel group ralph lauren rl pvh corp pvh vf corp vfc post new high lodging stock also checked strong price volume action today market hotel vacation rental company wyndham worldwide wyn gap vigorous volume stock score new high wyndham be expect post earning growth result be release street see growth year hotel chain la quinta lq gap wednesday add gain midday thursday stock score new high day street expect earning drop then rise year market research space morningstar morn break bullish week tight pattern stock rise heavy volume clear buy point other stock research niche be show life near buy point realty information provider costar group csgp jump busy volume stock hung new high be too extend buy street see earning growth come pick growth underwriting datum provider verisk analytic vrsk be approach buy point flat pattern warren buffett berkshire hathaway own share stock most recent ownership disclosure meanwhile congress be try reach budget agreement midnight friday deadline agreement be not reach deadline government office be shut first time jobless claim checked fewer expect street consensus view be housing permit december do little more match view figure be barely consensus estimate meanwhile housing start be peg fewer view philadelphia fed outlook survey january fall shy view consensus view be read number come survey be consider indicator manufacturing trend related now be good time review sell ruleslearn invest guide beginnerswill be netflix year shine
73,VFC,build watch list look stock higher rs rating vf corporation vfc now meet criterium increase tuesday exclusive rating investor business daily track market leadership worst best score grade show stock price behavior last week hold other stock database decade market research reveal best stock often have rs rating launch biggest run see ibd help make more stocksvf corporation be now consider extend buy range clear buy point first stage flat base see stock form new pattern follow buy opportunity week tight pullback day week move average vf corporation see earning sale growth rise last quarter earning share increase revenue rise vf corporation earn rank peer apparel clothing manufacturing industry group gildan activewear gil be rank stock group related stock rise relative strength ratingswhy use ibd relative strength rating relative strength line help judge stock
74,VFC,tech stock lead broad early rally friday earning surprise foreign stimulus news buoy global market nasdaq bolt ahead climb dow jone industrial average lag gain
75,VFC,volume be mixed rise nasdaq dip fraction lower nyse relation trade same time thursday
76,VFC,much week have be focuse company news quarterly report stock market today tap wide range influence
77,VFC,european central bank news thursday consider additional stimulus measure december launch rally global market china central bank trim interest rate announce swathe banking policy change market receive psychological lift nasdaq punch decisively resistance respective day move average
78,VFC,boost come researcher markit preliminary manufacturing purchasing manager index october rise september better consensus view change read
79,VFC,oil price be worth watch west texas intermediate give early gain trade lower barrel ahead baker hughe weekly rig count report due et oil be trading more week follow surprise surge weekly inventory
80,VFC,top raft high profile earning win send biggest tech name soar early trade
81,VFC,alphabet goog microsoft msft lead nasdaq respectively report third quarter surprise strong volume gain lift alphabet nearly past buy point week cup base
82,VFC,amazon com amzn soar buy range heavy trade report surprise profit late thursday
83,VFC,other notable gain include ireland base drugmaker mallinckrodt mnk verisign vrsn also leap take new high strong trade strong report late thursday
84,VFC,leader more ibd list stock rise more top list hawaiian holding surfed snatch new high strong trade parent hawaiian airline have gain past session be extend early october
85,VFC,noah holding noah gap gain heavy trade stock be try climb right side deep consolidation
86,VFC,bottom list foot locker fl tumble big trade possibly stumbling sympathy moved link skecher skx
87,VFC,session also provide breathtaking loss
88,VFC,skecher dive pandora tank broad earning miss cabot oil gas cog drop vf corp vfc tumble
