,ticker,content
289,WBA,meanwhile cvs ban tobacco product be weigh sale same store sale rise pharmacy same store sale front end same store retail sale tobacco product be remove have tobacco sale be exclude year period front end same store sale have be basis point higher company say
290,WBA,early july competitor walgreen boot alliance wba report fiscal third quarter earning wall street estimate sale fall short
291,WBA,thursday rite aid rad say july same store sale grow pharmacy same store sale grow negative impact new generic launch front end same store retail sale rise just
292,WBA,follow elaine low twitter ibd_elow
293,WBA,related
294,WBA,cvs pharmacy clinic open target store
295,WBA,rite aid rise positive july sale cvs walgreen cvs health cvs profit revenue gain be expect slow drugstore chain report second quarter result tuesday analyst see earning climb share decelerate growth previous quarter revenue be see rise future quarters see major boost follow recent acquisition health sector overall rush consolidate obamacare related change drive seek greater scale cost control cvs announce june be acquire more pharmacy almost clinic target tgt goal rebrand target pharmacy cvs pharmacy open cvs minuteclinic target store drugstore chain shopping trip begin earlier year say buy pharmacy benefit provider omnicare ocr share cash deal be value be see add cent ep deal be see close end year meanwhile cvs ban tobacco product be weigh sale same store sale rise pharmacy same store sale front end same store retail sale tobacco product be remove have tobacco sale be exclude year period front end same store sale have be basis point higher company say early july competitor walgreen boot alliance wba report fiscal third quarter earning wall street estimate sale fall short thursday rite aid rad say july same store sale grow pharmacy same store sale grow negative impact new generic launch front end same store retail sale rise just follow elaine low twitter ibd_elow related cvs pharmacy clinic open target storesrite aid rise positive july sale cvs walgreen
296,WBA,stock be session high still hold solid gain early afternoon trading nasdaq add dow jone industrial average gain volume be tracking heavier board hold just day move average stock market today wednesday large cap benchmark close line first time october economic news jobless claim be expect claim rise forecast call slight decline walgreen boot alliance wba jump huge volume company name stefano pessina permanent ceo report earning top expectation walgreen boot alliance also raise full year profit outlook share prior guidance stock be work new flat base pattern buy point ulta beauty ulta clear flat base buy point big volume hit new time high share poke entry wednesday retreat close ulta beauty be try break free tight trading range several month sideway action
297,WBA,walgreen boot alliance wba have big day friday follow upbeat earning report day stock close touch buy point week cup shape base most work be lower part base flaw thursday morning company report earning
298,WBA,dividend pay mutual fund have underperform past year much lag stem mid dividend fund have be catch year top perform dividend mutual fund continue excel invesco dividend income fund have rise average annual past year ahead dividend income be
299,WBA,stock extend loss midday thursday day federal reserve raise interest rate first time nearly decade fall dow jone industrial average nasdaq be
300,WBA,volume be run higher nyse nasdaq compare same time wednesday
301,WBA,economic news be mixed unemployment claim fall little less expect week end dec manufacturing mid atlantic region fall much more expect december conference board index lead economic indicator rise november prior month increase ahead analyst forecast
302,WBA,mining energy stock be hit hardest stock market today decline oil metal price
303,WBA,newmont mining nem colorado base miner gold silver lose lead lower oil transportation stock oneok oke also drop
304,WBA,most ibd stock be lower lead global payment gpn fall more heavy volume stock plunge wednesday slice day line agree buy rival credit card payment processor heartland payment system hpy
305,WBA,total system service tss credit card payment processor ibd fall remain well buy point cup handle base clear october
306,WBA,chinese social medium stock weibo wb be bright spot jump more heavy volume close buy point deep cup shape base
307,WBA,stock boast rise relative strength line accumulation distribution rating indicate strong demand share stock have more double fall low aug stock extend loss midday thursday day federal reserve raise interest rate first time nearly decade fall dow jone industrial average nasdaq be volume be run higher nyse nasdaq compare same time wednesday economic news be mixed unemployment claim fall little less expect week end dec manufacturing mid atlantic region fall much more expect december conference board index lead economic indicator rise november prior month increase ahead analyst forecast mining energy stock be hit hardest stock market today decline oil metal price newmont mining nem colorado base miner gold silver lose lead lower oil transportation stock oneok oke also drop most ibd stock be lower lead global payment gpn fall more heavy volume stock plunge wednesday slice day line agree buy rival credit card payment processor heartland payment system hpy total system service tss credit card payment processor ibd fall remain well buy point cup handle base clear october chinese social medium stock weibo wb be bright spot jump more heavy volume close buy point deep cup shape base stock boast rise relative strength line accumulation distribution rating indicate strong demand share stock have more double fall low aug
308,WBA,stock show modest loss afternoon trading day fed meeting get underway lose dow jone industrial average nasdaq give volume nyse nasdaq be tracking higher monday level stock market today dow component apple aapl be mostly unchanged ahead earning report close sharp pullback apple still have lot overhead supply work get back week high also dow ibm ibm slump news sec investigation revenue recognition practice economic news order durable good fall slightly more expect september consumer confidence plunge odd rate hike wednesday be quite low fed fund future trader have odd december rate hike ibd top perform breakout continue face selling pressure lgi home lgih slump still hold day move average universal insurance uve meanwhile give still well extend cup handle buy point biotechs outperformed ibd name regeneron regn add clear double bottom buy point volume hasn come stock chip designer integrate device idti monolithic power mpwr outperformed rise respectively report strong earning group peer inphi iphi also outperformed rise ahead earning report close walgreen boot alliance wba soar report advanced talk acquire rite aid rad rite aid jump new york mercantile exchange december crude oil continue slide fall barrel follow ken shreve twitter ibd_kshreve facebook
309,WBA,rite aid rad same store sale slip week end jan mark second consecutive month decline last year company say comp rise result come rite aid agree last year be buy walgreen boot alliance wba report result month walgreen say purchase rite aid
310,WBA,joint letter publish time london british business leader such bp bp astrazeneca azn urge voter back prime minister david cameron effort keep unite kingdom european union warning job be put risk event brexit total number business leader come largest firm burberry easyjet bae system chief executive heathrow gatwick airport also sign letter other signatory include royal dutch shell rdsa hsbc hsbc goldman sachs international gs bt bt vodafone vod general electric ge chief executive random house uk roll royce uk ceo siemens siegy manufacturing walgreen boot alliance wba universal music group barclay bcs royal bank scotland rb executive do not sign letter share bp shell close oil price fall astrazeneca dip hsbc lose goldman sachs fall ge ease vodafone lose walgreen dip barclay drop rb fall ask nearly third largest publicly trade company didn sign letter cameron respond business often be reluctant make form political statement executive warn eu exit put hundred thousand job risk jeopardize britain economy referendum matter be schedule june business need unrestricted access european market person order continue grow invest create job letter say believe leave eu investment threaten job put economy risk britain be stronger safer better remain member eu issue have raise sharp division britain conservative party bbc estimate conservative member parliament campaign remain eu mps campaign leave mps have yet make position clear overwhelming majority labour party support eu membership possibility leave european union have send pound lowest level year london mayor boris johnson conservative throw support british exit brexit cameron have say johnson be wrong brexit issue monday house commons cameron suggest johnson be support eu exit merely advance own ambition become british prime minister image provide shutterstock
311,WBA,webmd wbmd health corp see stock soar then fall thursday online health care information company quiet rumor possible sale light recent news report company be report be not currently negotiation be acquire webmd say press release thursday announcement webmd stock
312,WBA,stock score gain thursday fifth time session bull show confidence nasdaq pop add ibd advanced volume stock market rise nasdaq slip nyse nasdaq recent gain include gap day gush monday
313,WBA,stock keep grip gain friday index make previous session giveback nasdaq open higher then rise finish day dow jone industrial average add ibd sprint lead index second straight session volume
314,WBA,stock finished higher thursday well early high back sharp snap back chinese market overnight nasdaq rise dow jone industrial average gain nasdaq have be much stock market today volume be higher nyse lower nasdaq exchange accord preliminary datum chinese stock re-cover recent sell off netease nte gap close higher just recover day move average noah holding noah sell investment product affluent chinese gain blast back day line stock be highly volatile ulta beauty ulta break flat base buy point finished less bottom daily range not most bullish action walgreen boot alliance wba hold early gain upbeat quarterly report stock be build right side base investor awake friday morning be review news china market have be tumble greece face sunday deadline reach deal refinance debt
315,WBA,facebook fb share get attention monday climb new high walgreen boot alliance wba starbucks sbux electronic art ea also enter new high ground have social networking stock beat come relative strength today screen day be bolt rs line look selection
316,WBA,stock give further ground early afternoon trading earning continue take center stage fall nasdaq slide dow jone industrial average give volume be tracking higher board vs same time monday manage care chipmaker biotechs be biggest gainer stock market today transport energy consumer electronic retailer lag reynold american rai gap fall brisk trade stock be still time high extend past buy point clear late last month camel cigarette maker report adjust ep rise cent meet view sale rise forecast alibaba baba more halved early gain hold highest level month chinese commerce giant report profit sale beat view mobile transaction revenue surge last year yahoo yhoo own stake alibaba be search giant plan spin stake shareholder end year apple aapl early pare gain iphone maker be slate give quarterly report close analyst expect fiscal earning rise share higher sale walgreen boot alliance wba report earning wednesday open jump heavy volume drugstore chain be close striking deal buy rival rite aid rad announcement expect wednesday accord wall street journal rite aid share soar ibd cal maine food calm lgi home lgih be biggest loser respectively edward lifescience ew cavium cavm more lead upside follow nancy gondo twitter ibd_ngondo
317,WBA,marquee name retail industry give etf investor something be thankful week lowe low hammer financial growth home depot hd wal mart wmt come look good too ahead black friday consumer discretionary sector be lead earning growth be expect continue say recent capital iq report
318,WBA,winnebago wgo unite therapeutic uthr be company try give investor little something extra stock market motor home icon winnebago hike quarterly cash dividend cent share payable nov shareholder record nov increase come disappointing earning report thursday share finished
319,WBA,investor send share cvs health cvs tuesday second largest drugstore chain report fourth quarter earning meet analyst view earning slightly beat expectation top line cvs earn adjust share quarter year earlier line view revenue rise year earlier slightly analyst poll thomson reuter have expect same store sale overall increase analyst view gain pharmacy same store sale be front end same store sale be management blame softer customer traffic partially offset uptick basket size mild flu season have modestly impact sale downside analyst say be first quarter tobacco sale be not part year year comparison tobacco product be eliminate store early september pharmacy same store sale have be basis point higher not recent generic introduction company say fourth quarter revenue company pharmacy service rise drive mostly growth specialty pharmacy business thank acquisition omnicare august pharmacy network claim quarter climb claim chief executive larry merlo note company pharmacy benefit management pbm side business have have strong selling season gross client win analyst figure add more incremental win late year vs company previously disclose win cvs marketing pitch focuse hybrid retail pharmacy pbm business be resonate quite well marketplace analyst steven valiquette ub tell ibd post earning conference call management emphasize firm pbm business be part solution not problem aim control drug spending not increase pharmacy service segment continue be source upside analyst ross muken evercore isi say note investor cvs didn change previous forecast first quarter call adjust earning share share full year first quarter analyst forecast be share full year estimate company reaffirm guidance help quiet concern macro malaise bleed have be thought highly defensive business say evercore muken share larger rival walgreen boot alliance wba rise drugstore chain rite aid rad be be buy walgreen add
320,WBA,market beat hasty retreat last week insider sale be notable executive health related company include gene sequence giant illumina ilmn ceo jazz pharmaceutical jazz chairman lead way be also couple big buy health related sector include major purchase walgreen boot alliance wba
321,WBA,walgreen boot alliance wba unitedhealth group unh be possible bidder part health information webmd wbmd financial time report late wednesday webmd have hold talk several suitor ft say webmd decide not make deal company last year explore putt sale last year ultimately opted
322,WBA,equity income be legacy mutual fund classification investment strategy use dividend pay stock produce income capital appreciation be not main goal equity income fund be less volatile fall stock market equity income mutual fund perform line much past year fall start
323,WBA,stock build early gain go lunch hour monday be trading day high europe crisis greece appear wane greek parliament have wednesday pass reform demand european union
324,WBA,nasdaq gap open rise gain dow jone industrial average be higher volume be tracking lower vs same time friday nyse higher nasdaq exchange
325,WBA,euro be sharply treasury yield rise third straight day investor take more risk
326,WBA,edward lifescience ew rise nearly breaking cup handle base buy point rbc capital market upgrade stock sector perform outperform raise price target analyst glenn novarro say market transcatheter aortic valf grow estimate other analyst have grow bullish heart value market
327,WBA,domino pizza dpz rise nearly solid volume have break flat base buy point be still buy zone company report earning thursday morning analyst be expect ep cent increase year
328,WBA,solaredge technology sedg rise third straight day company announce be sunrun prefer supplier optimized inverter share rise
329,WBA,walgreen boot alliance wba rise complete cup base buy point report better expect earning thursday
330,WBA,phillip partner psxp fall well fargo initiate coverage stock outperform rating stock build early gain go lunch hour monday be trading day high europe crisis greece appear wane greek parliament have wednesday pass reform demand european union nasdaq gap open rise gain dow jone industrial average be higher volume be tracking lower vs same time friday nyse higher nasdaq exchange euro be sharply treasury yield rise third straight day investor take more risk edward lifescience ew rise nearly breaking cup handle base buy point rbc capital market upgrade stock sector perform outperform raise price target analyst glenn novarro say market transcatheter aortic valf grow estimate other analyst have grow bullish heart value market domino pizza dpz rise nearly solid volume have break flat base buy point be still buy zone company report earning thursday morning analyst be expect ep cent increase year solaredge technology sedg rise third straight day company announce be sunrun prefer supplier optimized inverter share rise walgreen boot alliance wba rise complete cup base buy point report better expect earning thursday phillip partner psxp fall well fargo initiate coverage stock outperform rating
331,WBA,biotechs continue rebound medical related stock remain center stage week big cap accounting half list edward lifescience ew gap past cup handle buy point initially clear tuesday rbc capital market upgrade heart valve maker outperform sector outperform lift price target friday
332,WBA,best mutual fund second quarter performance updatemanager lead mutual fund past month have be take profit ease buy top rate stock top mutual fund adjust portfolio summer month kick lot market volatility thank greece persistent debt wo nasdaq drop june fall dow be ibd market pulse turn pressure june medical giant include abiom abmd illumina ilmn hca holding hca also have be favore top perform fund latest report period ibd find top notch mutual fund add abiom investing estimate latest report period danver mass base firm make medical device design assist replace pump function heart abiom flagship product be heart pump impella receive fda approval elective urgent high risk percutaneous coronary intervention procedure abiom be plan expand operation danver headquarters add employee manufacturing capacity hit week high early stock have be etching second stage base sit just high earning growth have ramp past quarters several tech issue have continue draw interest top fund recent month include palo alto network panw technology avgo cyberark software cybr fleetmatic fltx tyler technology tyl nxp semiconductor nxpi monster beverage mnst continue pique investor interest best perform fund invest estimate latest report period energy drink maker coca cola ko complete previously announce strategic partnership coca cola now own stake monster sell sidetop fund have be selling big telecom cable stock such comcast cmcsa time warner twc latest report period investor also be unload retailer include drug store cvs health cvs wallgreen boot alliance wba restaurant yum brand yum starbucks sbux be axed top fund
333,WBA,sephora ulta ulta be steal market share cvs cvs other drugstore teen gravitate authentic indie brand accord piper jaffray latest take stock teen survey late tuesday mass beauty brand be cede share indie brand label get social medium back say analyst quick peek facebook fb instagram yield result revlon fewer covergirl drugstore brand more result urbandecay popular cosmetic label be purchase ulta sephora covergirl have steadily slip ranking upper income female teen fall fourth place second place year year urban decay share have rise girl tie be increase preference specialty beauty retailer sephora nab significant chunk piper jaffray latest survey climb spring fall poll upper income teenage girl sephora be own lvmh trade paris exchange target tgt take top honor spring ulta knock third place fall take spot sephora share vote last year target have share drugstore mostly carry mass beauty brand have also slip ranking cvs cede half share slide spot spring last fall wal mart wmt walgreen wba have also slip top list last month ulta have solid history double digit earning revenue gain have strong ibd composite rating piper jaffray carry overweight rating stock ulta share close stock market today cvs fall target fall follow elaine low twitter ibd_elow related ulta beauty deliver great look growth
334,WBA,apple aapl ceo tim cook facebook fb director marc andreessen tesla tsla ceo elon musk younger brother kimbal be week top insider make trade here rundown notable one disclose week apple ceo tim cook have sell share iphone maker report disclosure file tuesday
335,WBA,general electric ge have unveil current subsidiary integrate industrial conglomerate solar energy storage electric vehicle light emit diode business predix platform several high profile customer such jpmorgan chase jpm be early current user fairfield conn base company say current begin more revenue build general electric experience energy technology several ge customer be piloting current cut cost boost energy efficiency ge say user include jpmorgan chase hilton worldwide hlt hospital corp america hca walgreen wba current be headquarter boston area additional presence silicon valley roughly new job focuse software energy project management outcome selling be create ge say operation be underway increase next year ge say general electric share rise stock market today news come engineer tesla motor tsla microsoft msft be team colleague columbia university university massachusett amherst develop software defined battery development purportedly allow different battery different chemistry be integrate system successful finding revolutionize consumer battery technology meet customer demand longer battery life quicker charge diversify chemistry tesla have expand battery storage residential business utility scale application tesla stock fall close penny day line continue concern model price tag microsoft share rise cent follow ciaran mcevoy twitter ibd_cmcevoy facebook
336,WBA,stock rebound late trading end nice gain wednesday equity have briefly turn negative federal reserve hold interest rate steady left door open rate hike december nasdaq rally climb meanwhile dow jone industrial average rise small cap russell surge wednesday lag recent session accord preliminary datum volume rise major exchange stock market today close buffalo wild wing bwld tumble post disappointing quarterly result company report ep sale view be revenue regular session top rate stock ultimate software ulti end session high still rally more follow better expect earning late tuesday stock end past buy point cup handle base apple aapl climb reaction late tuesday fiscal result stock be still day line potential base form downside walgreen boot alliance wba slump almost heavy trade give back tuesday gain then stock also slice day day move average then open drugstore giant report fiscal earning top view trim upper end earning guidance also moody investor service place walgreen review credit downgrade result deal buy rival rite aid rad aetna aet alexion pharmaceutical alxn altrium group mo baidu bidu cme group cme electronic art ea expedia expe mastercard solarcity scty starbucks sbux be notable company report earning thursday datum third quarter gdp weekly jobless claim also be thursday follow vincent mao twitter ibd_vmao
337,WBA,walgreen boot alliance wba say acquisition smaller rival rite aid rad be go plan drugstore chain turn mixed first quarter result lift lower end full year guidance earning easily come ahead expectation rise share vs view cent hefty revenue growth primarily due merger alliance boot be not enough top forecast walgreen narrow annual earning outlook nickel share analyst expect ep walgreen guidance assume material boost rite aid acquisition be first announce late october be expect close latter half year company have receive anticipate second request federal trade commission regard acquisition walgreen share close stock market today rite aid dip rival cvs health cvs ease even ep be much better expectation unlikely stock be significantly give difficulty interpreted number have comparison fact adjust operate income be lower expect company only raise lower end adjust cash fy ep guidance range higher write barclay analyst meredith adler company retail pharmacy segment include walgreen duane reade see total sale rise same store sale international retail pharmacy segment include boot benavide have total sale comp rise pro constant currency basis walgreen cite particularly strong growth mexico ireland wholesale pharmaceutical division rac sale first quarter comp growth pro constant currency basis acquisition disposition combine alliance boot acquire rest european drugstore company do not already own walgreen boot alliance divide result domestic retail pharmacy international retail pharmacy wholesale pharmaceutical segment year year result comparison be not directly comparable result report change merger last month beleaguered drugmaker valeant pharmaceutical international vrx strike year deal walgreen offer treatment previously sell now shutter philidor cut price generic follow elaine low twitter ibd_elow related rite aid sale slip wellcare shift pbm workvaleant cut drug price team walgreen
