,ticker,content
0,WBA,start stock dow jone industrial average djia now include america largest company wide range industry include apple aapl exxon mobil xom intel intc nike nke goldman sachs gs general electric ge have be only remain original dow stock be just replace walgreen boot alliance wba conjunction nasdaq composite dow jone index dow stock serve bellwether general market american economy help investor gauge current environment future outlook bookmark page ongoing coverage dow stock benchmark index scroll see list component stock dow jone industrial average index get newsletter deliver inbox more info product service privacy policy term useclick symbol get latest news stock quote company get instant access more trading idea exclusive stock list ibd proprietary rating only related best stock buy stock be ibd big cap
1,WBA,general electric ge be poise get boot dow jone industrial average ge stock be last original dow jone member walgreen boot alliance wba replace ge dow jone index start june ge stock fall late trading stock market today walgreen stock jump regular session ge stock fall fall low general electric hit march lowest july industrial conglomerate have struggle year sluggish decline earning sale slash dividend half late number restructuring divestiture have fail revive ge fortune also general electric break break ge stock be dow jone industrial average do measure ge have pay flaw most expensive navy ship everibd stock daybest growth stock buy watch see update ibd stock list
2,WBA,here be investing action plan thursday need know investor come day nike nke walgreen boot alliance wba report earning do accenture acn stock be form base investor also be wait dividend buyback deluge likely follow second round federal reserve annual bank
3,WBA,just health care investor thought be safe dive back retail pharmacy stock amazon com amzn deliver jolt thursday buy pillpack online pharmacy deliver prescription presort dose move send share cvs health cvs walgreen boot alliance wba tumble drug distributor abc cardinal health cah mckesson mck also retreat pharmacy benefit manager express script esrx april walmart wmt have reportedly be close deal buy pillpack nudge aside amazon meanwhile amazon fear shake health care longer look quite so scary company shelved plan deliver medical supply now again be focus just big threat amazon represent prescription retail industry already cvs have moved same day delivery major market next day delivery cvs health walgreen be just add dow jone be develop new drugstore model deliver broader array medical service get newsletter deliver inbox more info product service privacy policy term immediate reaction be sell cvs stock sank walgreen stock fall stock market today amazon rise cardinal health mckesson lose respectively express script fall walmart slide health insurer also sell perhaps understandably aetna aet be be buy cvs health sank cigna ci be buy express script lose unitedhealth unh retreat earlier thursday walgreen boost dividend share buyback plan top earning expectation term amazon pillpack deal be expect close later year weren disclose get instant access more trading idea exclusive stock list ibd proprietary rating only also dow jone future try rally key tech sector flash big warningif want buy more apple nvidia share read thisstock market today track market trend best stock watch
4,WBA,nasdaq composite lead upside stock today rise nearly wipe away prior day decline meanwhile google owner alphabet paypal be stage new breakout provide growth investor set new proper entry point alphabet googl rise nearly clear buy point month double bottom be key chart pattern ibd identify platform lead stock jump rise new high buy zone alphabet go note earlier stock market today column alphabet also form nice day handle double bottom pattern provide slightly lower entry point paypal pypl note today new ibd stock day column rally be still buy range clear buy point double bottom base double bottom stock suffer major sell off second sell be deeper first other word paypal low undercut first low good mean strong shakeout weak holder have occur nasdaq get high good new time high tech rich composite have now extend year date gain rise strength rv maker drugstore chain computer networking movie department store medical software company small cap jump nearly volume be rise vs same time tuesday nasdaq fall nyse veeva system veev member ibd leaderboard specialist business software big pharma biotech firm moved more higher new high note leaderboard stock have clear buy point flat base share be now nearly homebuilder coal diversify operation fertilizer soap stock however fall more weigh dow jone industrial average lose nearly tuesday trade virtually flat popular stock average be try cling key day move average walgreen boot alliance wba be replace general electric ge dow jone industrial be nowhere potential new high stock jump more heavy trade be more week high walgreen also trade downward slope day move average sign see ibd stock checkup next generation payment provider sport strong composite rating scale mean term fundamental stock price strength depth fund sponsorship paypal be superior company ibd database walgreen contrast hold lowly composite share also trade more august time high watch see walgreen rating improve time thing go deerfield ill company steady profit gain earning share have rise vs year level past quarters street see earning rise fiscal end august related ibd stock dayipo leader top growth stock peek ibd
5,WBA,key stock index fund recoup loss thursday invesco qqq trust qqq lead sharp decline previous session tech heavy index etf find support day move average spdr spy be slightly day line spdr dow jone industrial average dium be try recover day line verizon goldman sachs gs jpmorgan jpm top blue chip gainer walgreen boot alliance wba newest dow stock tumble amazon com amzn announce buy online pharmacy pillpack unitedhealth group unh lose top sector fund gainer include financial technology real estate financial select sector spdr xlf rise track snap session lose streak technology select sector spdr xlk top holding include apple aapl microsoft msft facebook fb also advanced try reclaim day line get newsletter deliver inbox more info product service privacy policy term useapple have be find support day line week guggenheim wednesday say expect iphone maker come own self drive car analyst reiterate buy rating apple price target share remain slightly buy point shallow double bottom base energy firm telecom company metal miner be few sector fund loser more detail today stock market action check column datum june pm et get instant access more trading idea exclusive stock list ibd proprietary rating only also index fund performance analysis qqq dium find track best etfsbest etfs monthly performance reportlatest etf news analysis
6,WBA,stock rolled mixed open thursday disappointing first quarter gdp revision news amazon com amzn rattle pharmacy industry chip stock marvell technology mrvl soar china approve acquisition cavium cavm retail stock future be early pressure earning report bed bath bbby pier import pir retailer take additional heat pharmacy giant cvs health cvs new dow jone component walgreen boot alliance wba dive amazon announce buy online pharmacy service pillpack dow jone industrial average open lower walgreen dive nearly nasdaq composite trade less edge earning drive gain mccormick mkc accenture acn counter heavy loss walgreen cvs abc mckesson mck commerce department revise first quarter gdp estimate lower growth be consensus projection growth hold steady gdp price index key inflation gauge rise be well expectation also change read consumer spending estimate be unchanged growth line expectation upshot growth be slower expect quarter inflation rise faster forecast complicate pressure federal reserve have signale more interest rate hike be likely end year be already wrestling impact finance stock market get newsletter deliver inbox more info product service privacy policy term trade brawl china world other largest economy be relatively quiet early thursday white house have backed away wednesday early threat use executive privilege order curtail investment china own company technology white house attempt appease beij investor fear be meet part way china thursday regulator approve marvell cavium merger hong kong hang seng index rise market feel bottom bit less june shanghai composite drop diving new bear market low tack sixth straight weekly decline japan tokyo nikkei continue trade flat just day line support day line stock europe fall mixed trade steep loss afternoon action frankfurt dax dive cac paris trade lower london ftse ditch early gain fall oil price tick fraction lower early thursday west texas intermediate trading just barrel oil price punch month high wednesday tight weekly supply datum add list element generate upward pressure oil stock post top advance wednesday ahead thursday open marathon petroleum mpc advanced findlay ohio base refiner be look stem week decline chip stock suffer further damage wednesday selling receive positive news early thursday marvell technology spiked cavium leap announce chinese regulator have approve marvell bid acquire datum center networking specialist marvell share be break support month base effort cavium be testing support week line month base company first announce deal november retail stock come sharp pressure amazon announce buy online pharmacy service pillpack undisclosed amount term deal be not disclose news report say walmart wmt have attempt acquire pillpack less move be amazon first major health service sector move january announcement have launch joint venture berkshire hathaway brka jpmorgan jpm create more effective efficient health service program company employee cvs health tumble nearly early action stock be march attempt retake support week move average year downtrend walgreen boot alliance drilled lower pharmacy chain report early thursday fiscal third quarter sale earning top analyst target management raise company quarterly dividend add stock buyback effort drug distributor also fall hard crumble mckesson swoon cardinal health cah tumble lower amazon share rise left ibd leaderboard stock still buy range buy point other retail stock be already early pressure handful earning report pier import dive weak guidance trump first quarter sale earning beat bed bath also fall hard more dip same store sale soured otherwise positive fiscal first quarter report get instant access more trading idea exclusive stock list ibd proprietary rating only also dow jone future key tech sector flash big big picture nasdaq stormy price action be desperate trump be avoid china trade warmillennial investor love stock robinhood top holdingsibd stock day apple oil near new buy point bullish pattern
7,WBA,walgreen boot alliance rl announce stock buyback raise dividend drug store giant report issue first quarterly earning dow jone industrial average component xwalgreen earning rise share sale grow top analyst view ep revenue accord zack investment research pharmacy same store sale fall other same store sale slide walgreen boot alliance raise lower end guidance fiscal year cent share now expect adjust ep analyst have expect company board authorize stock buyback hefty sum give market cap wednesday close walgreen also announce dividend hike cent share quarter get newsletter deliver inbox more info product service privacy policy term useshare fall premarket trade stock market today rival cvs health cvs stock be not yet active walgreen debut dow jone industrial average tuesday have poor ibd composite rating choice replace embattled industrial giant general electric ge suffering walgreen stock confound investor dow jone index help determine composition index say inclusion make dow more representative consumer health care sector economy walgreen tumble jan amazon com amzn berkshire hathaway brkb jpmorgan chase jpm announce healthcare partnership name atul gawande ceo last week partnership potentially threaten walgreen also manage prescription drug plan provide health care store customer industry consolidate walgreen have buy nearly store rite aid expand group purchasing effort express script esrx meanwhile cvs health be buy insurer aetna aet get instant access more trading idea exclusive stock list ibd proprietary rating only be interested invest stock free new apps aim beginnerslook best stock buy watch start here
8,WBA,index fund offer investor opportunity capture long term stock market gain have pick individual stock own share index base exchange trade fund invesco qqq trust qqq spdr dow jone industrial average dium spdr spy have stake general stock market well big name stock such apple aapl facebook fb amazon amzn index fund offer simple low cost tax efficient way invest also lower risk re buy basket stock mutual fund buy sell etfs just individual stock addition index fund today be etfs choose wide range category cover stock bond commodity currency further slice dice base preference favor growth value small cap midcap tech health care specific country region get newsletter deliver inbox more info product service privacy policy term follow index fund be largest most closely follow individual investor large institution spdr dow jone industrial average dium track dow stock include apple pfizer general electric microsoft other industrial giant spdr spy give broader view market dow jone industrial average tracking large cap company list index invesco qqq trust qqq comprise nasdaq largest nonfinancial company top holding market cap include apple amazon microsoft msft facebook alphabet googl get instant access more trading idea exclusive stock list ibd proprietary rating only also find track best etfsbest etfs monthly performance reportlatest etf news analysis
9,WBA,dow jone index nasdaq composite retreat volatile market trump trade war fear wax wane nike nke bank stock fuel friday rebound crude oil price hit multiyear high general electric ge kick dow jone announce partial breakup amazon com amzn move disrupt pharmacy shipping industry harley davidson hog say shift production europe due tariff anger president donald trump dow jone index nasdaq composite sell monday wednesday breaking testing key support level concern trump trade war move china investment fall week even gain thursday friday so far dow jone be have gain nasdaq treasury yield curve continue flatten signale concern fed rate hike road bank stock pressure week flatten yield curve rebound friday fed clear most raise dividend buyback energy stock rally crude price soar ge pop restructure plan nike sprint sale revival big stock buyback oil future jump more barrel highest level supply issue north america iran trump administration warn ally need stop import iranian crude november accord report meanwhile key oil sand facility canada be shut august crude stockpile fall barrel more expect gasoline supply rise barrel accord weekly energy information administration datum domestic production be flat last week barrel day general electric ge end century run dow jone industrial average say plan shrink even further industrial giant seek pare debt simplify spin ge healthcare divest majority stake oilfield service company baker hughe bhge prior smaller divestiture ge now focus aviation power renewable energy decision follow year long deep dive new ceo john flannery period ge stock crumble half analyst warn dividend cut second payout earning outlook be slice last year ge stock rebound fall multiyear lows get newsletter deliver inbox more info product service privacy policy term profit grow cent share revenue growth easily quash analyst view cent ep sale north america sale rise buck straight quarters year year decline world largest athletic apparel brand also announce share buyback program share nike leap friday hit new high harley davidson face double whammy past week first get hit tariff european union then get slam president trump wave white flag iconic motorcycle maker say eu tax retaliation trump steel aluminum tariff cost roughly year announce plan shift production europe overseas avoid hit harley take fire trump tweet analyst see risk harley davidson suffer long term reputation hit harley stock retreat amazon turn small fry disrupt major industry thursday deal buy online pharmacy pillpack revenue give amazon just toehold industry roil many health care stock new dow jone stock walgreen boot alliance wba tumble thursday cvs health cvs be buy insurer aetna aet partly anticipation amazon enter pharmacy space fall drug distributor mckesson mck fall amazon also say help entrepreneur launch local business deliver amazon package fleet vehicle plan help send share up fedex thursday federal reserve release second final round annual stress test clear most shareholder payout plan nation largest financial firm well fargo wfc rally friday buyback dividend plan jpmorgan chase jpm many other bank stock slash gain close lower fed restrict payout plan morgan stanley ms goldman sachs gs fail division embattled deutsche bank db fed say morgan goldman maintain capital distribution level paid recent year capital ratio fall fed minimum result time reduction due tax reform goldman morgan come close miss fed minimum key leverage ratio first round test past week ipos raise several ipos show double digit gain first day trading biotech new issue neuronetic stim rally debut tricida tcda rise largest ipo be bj wholesale club bj raise share rise first day furniture retailer lovesac love jump first day trading canadian marijuana producer canopy growth corp cgc report first quarterly earning list company canopy turn steeper loss year spend more investment ahead canada recreational legalization beer wine giant constellation brand stz have take stake canopy report fiscal earning share miss estimate sale roughly line share constellation tumble friday sonic earning rise cent share better consensus cent ep sale slide more expect decline nearly vs analyst view revenue fast food drive chain now project full year earning vs prior guidance narrower guidance imply consensus ep share retreat lennar len stock pop demolish earning estimate tuesday largest homebuilder fall back later week meanwhile kb home kbh rise friday builder score double beat late thursday carnival ccl share sank lowest level more year cruise line pare full year ep outlook norwegian cruise line nclh royal caribbean rcl share also drop carnival warn fuel cost exchange rate paychex payx retreat potential buy point quarterly earning meet revenue edge past estimate payroll hr service provider expect revenue grow fiscal ep rise fend exist new rival such cloud base paycom software payc walgreen boot alliance announce buyback quarterly dividend hike cent drugstore company also top earning view guide modestly higher same store sale fall share plunge lowest level year amazon deal buy pillpack akamai technology akam cut revenue guidance currency headwind raise ep outlook greater expect operate efficiency accenture acn deliver fiscal third quarter earning beat global service firm have be make acquisition push digital cloud cybersecurity product gw pharmaceutical gwph rise fda approve cannabis base drug epidiolex treat seizure disorder wwe wwe stock explode pin bigger expect deal st century fox fox comcast cmcsa broadcast show boee ba stock flash sell signal china firm commitment purchase jet european rival airbus eadsy ongoing trade tension boee go seesaw week remain maroon day move average get instant access more trading idea exclusive stock list ibd proprietary rating only also ibd stock daybest growth stock buy watch see update ibd stock invest stock market start simple routine
10,WBA,just month amazon amzn have go be biggest threat health care industry profit underdog xback january amazon berkshire hathaway brkb jpmorgan chase jpm unveil new partnership tame medical cost news bulldoze health care stock barely month later trio company have find ceo lead venture plan announcement week berkshire ceo warren buffett tell cnbc thursday yet emerge reality look lot less scary original idea health care investor thursday market action be indication example unitedhealth unh nation largest insurer slide more original jan announcement walgreen boot alliance wba tumble stock be higher thursday walgreen gain unitedhealth edge close time high hit day big amazon berkshire jpmorgan news get newsletter deliver inbox more info product service privacy policy term useeven amazon ceo jeff bezos buffet jpmorgan ceo jamie dimon admit time group do not come problem answer say be early plan stage investor panic only plausible explanation such overreaction be amazon have reportedly be gear month take retail drug industry challenge drug distributor kick middleman pharmacy benefit manager curb yet month later amazon health care ambition look whole lot less earth shatter unlikely diminish health care industry profitability year come april cnbc report amazon have drop plan become wholesale distributor prescription drug due cost complexity investor seem interpret retreat decrease likelihood amazon enter retail prescription business bezos be clearly comfortable underdog role be count whole host big industry player technology company have huge head start ibd computer software medical group be rank industry group ibd stock checkup base stock performance lead tabula rasa healthcare trhc teladoc tdoc evolent health evh be interested robotic surgery revolution be just get big picture reason market uptrend be strongibd stock day grubhub hover buy zone look tasty signalstock market today track market trend best stock watch
11,WBA,top tech stock be driver seat just midday wednesday fang stock facebook fb netflix nflx hit new high nasdaq composite be early afternoon trade hit time high intraday basis nasdaq rise same amount help strength st century fox fox share jump agree sweeten bid walt disney last week comcast cmcsa offer disney share lose early gain trade fractionally lower edge higher dow jone industrial average lag be mostly flat general electric ge weigh blue chip index share fall close news leave index walgreen boot alliance wba join dow june share walgreen jump nearly stock market result today starbucks sbux take hit fall company forecast sluggish sale announce plan close more store ibd biotech supernus pharmaceutical supn outperformed rise work flat base entry rv maker outperformed thank decent earning report winnebago industry wgo late tuesday winnebago gap bullishly day move average share be more high winnebago face overhead supply try work way higher overhead supply be selling pressure arise buy way winnebago continue rally investor sit loss sell break even investment micron technology mu picked be well session high earning be due close micron recently flash sell signal buy point chart be still intact micron be featured possible earning option trade latest earning preview column call option strike price recently come reasonably price premium present trade limit downside risk also crude inventory fall output flat opec clash loomsboee stock rally landing fedex dealfox accept disney raise bid blow comcaststock spotlight add buy watch start adobe
12,WBA,general electric ge reach deal lop chunk sprawl business last day component dow jone industrial average industrial conglomerate sell industrial gas engine unit private equity firm advent international reportedly edge cummin cmi land attractive business worth more annual revenue distribute power unit sale ge announce monday make jenbacher waukesha engine heavy duty gas turbine generate power heat industrial facility often locate harsh remote environment ge ceo john flannery last year reveal plan shed asset slash billion cost last month take biggest step so far turnaround plan trouble conglomerate merge ge century old railroad business wabtec wab complex deal worth industrial gas engine unit post sale attract interest various buyout firm cummin accord report cummin make engine generator share lose stock market today dow jone industrial average sell escalate trump trade war wabtech fall cummin lose hit week low ge former dow peer unite technology utx mmm lose respectively monday ge be boot dow jone industrial average last week be poise be replace walgreen boot alliance wba tuesday dow jone index help determine stock be dow jone industrial average explain last week make switch meanwhile ge stock have collapse more last year half distribute power transaction affect roughly employee austria canada part ge core power unit produce third world electricity have be batter downturn demand power plant equipment rbc capital market say deal not involve significant synergy distribute power operate mostly stand alone business ge power term stock reaction do not believe deal be major needle mover represent just latest small asset sale ge ongoing portfolio streamline initiative say rbc analyst deane dray announcement check box divestiture simplification action gas engine transaction be set close fourth quarter subject close condition regulatory approval be interested general electric break break ge stock ibd stock daybest growth stock buy watch see update ibd stock listsstock buy watch top ipos big small cap growth stock
13,WBA,dictionary letter go letter current dictionary trading wall street exact opposite understand just view nasdaq dow nasdaq composite post solid gain wednesday eradicate prior day slim loss dow
