,ticker,content
620,WBA,rite aid corporation rad free report be slate report fourth quarter fiscal result mar big question face investor be drug store retailer be able deliver positive earning surprise quarter be report last quarter company report break even bottom line result surpass zack consensus estimate loss cent share further company have top estimate trail quarters let see thing be shape prior announcement expect zack consensus estimate quarter review be loss cent share break even result report year quarter note zack consensus estimate have be stable last day further analyst poll zack expect revenue prior year quarter rite aid corporation price consensus ep surprise rite aid corporation price consensus ep surprise rite aid corporation quote further rite aid share have decline significant past month wider industry decline suggest negative sentiment stock ahead fourth quarter earning release factor playrite aid remain track transfer store related asset walgreen wba free report phased manner so far company have transfer store related asset walgreen generate net cash proceed be used pay debt strengthen liquidity position further company have agree merge grocer albertson fend rise competition amazon amzn free report moreover rite aid effort boost market share wellness remodel other strategic initiative bode well however rite aid be grapple dismal top line trend recent quarters notably rite aid have deliver negative sale surprise trail quarters due soft comp well decline revenue key business segment additionally third quarter fiscal marked third straight quarter year year sale decline sale have decline respectively first second third quarters fiscal rite aid revenue continue be hurt soft comp well decline revenue key business segment retail pharmacy pharmacy service retail pharmacy segment engage selling prescription drug health beauty product personal care item report revenue decline first second third quarter fiscal respectively segment revenue be persistently hurt soft same store sale unfavorable reimbursement rate notably unfavorable reimbursement rate have be challenge company top line nearly year now meanwhile revenue pharmacy service segment provide pbm pharmacy benefit management service range pharmacy related service drop first second third quarter fiscal respectively revenue pharmacy service segment decline due election take part lesser medicare part region fall commercial business rite aid comp drop third quarter be attribute fall pharmacy front end sale notably comp have decline straight quarters now report decline respectively first second quarters fiscal moreover comp dip second third fourth quarter fiscal remain little skeptical company performance fourth quarter let see really store company zack model unveil proven model do not conclusively show rite aid be likely beat estimate quarter be stock need have positive earning esp zack rank strong buy buy hold happen uncover best stock buy sell re report earning esp filter rite aid have earning esp zack consensus estimate most accurate estimate be peg loss cent share company zack rank increase predictive power esp need have positive esp be confident earning surprise stock poise beat earning estimateshere be company want consider model show have right combination element post earning beat walgreen boot alliance inc currently have earning esp zack rank see complete list today zack rank stock here lululemon athletic inc lulu free report have earning esp zack rank bed bath inc bbby free report have earning esp zack rank hacker put money portfolio earlier month credit bureau equifax announce massive datum breach affect american cybersecurity industry be expand quickly response similar event stock be better investment other zack have just release cybersecurity investor guide help zack com reader make most year investment opportunity create hacker other threat reveal stock worth look right away download new report now
621,WBA,underperform store cancellation dividend continue bottom line lose fred inc trouble have be aggravating dent business however cater consumer rapidly change preference sustain market competition company have be focuse pharmacy organization drive script store additionally have be putt much effort reduce operate expense let take look factor have be bruise discount retailer discuss growth plan have put place achieve recovery factor dent stockfr comp have long be ailing store closure thank recede store traffic top comp have also be bearing brunt continue increase generic dispense rate sale low productive discontinue inventory persistent challenge front store business competitive consumable category have also affected overall sale figure due comp dip first second third quarters respectively addition dismal comp increase promotional activity drive store traffic have be dent business incidentally company have be report bottom line loss straight quarters moreover company business expansion plan be eclipse cancel walgreen boot alliance wba free report rite aid corporation rad free report merger june deal be materialize have position fred third largest drugstore chain nation walgreen cvs health corporation cvs free report however obstacle such antitrust concern cancel deal keep fred far industry leader make matter management announce cancellation dividend dismal third quarter result combination such factor have gravely affected company price performance stock have lose past year industry rally effort revive performance fred strive improve store traffic have accordingly shift focus pharmacy organization be likely drive script store improve service patient fred retail pharmacy business seem be stable benefit company shift profitable generic prescription order improve retail pharmacy business company have be expand flu shot capacity aggressive inventory management marketing initiative further management continue build momentum specialty pharmacy business investing sale team therapy diversification technology owing such effort company expect specialty business gain access new patient different market forthcoming period additionally such effort position company new drug introduction improve datum flow thereby increase efficiency patient care fred also initiate several measure reduce excess inventory improve technology better manage product life cycle third quarter company witness turnaround tobacco business well improve sale beer cosmetic business further company expect improve trend category forthcoming period strengthen pharmacy operation expense reduction be also list fred effort achieve profitability third quarter management successfully reduce selling general administrative sg expense further management expect lower sg cost help augment free cash flow company expect pass gain reduce cost structure customer drive store traffic moreover management plan allocate fund derive cancel dividend curtail debt load buyback share undertake other corporate initiative such prospective endeavor place be not gloomy zack rank hold stock still hope revival shambles hope such dedicate effort help company uplift investor confidence stock long run see complete list today zack rank strong buy stock here breaking news cryptocurrency now bigger total market cap cryptos recently surpass more increase previous month re now bigger morgan stanley goldman sachs even visa new asset class expand even more rapidly new investor continue pour wall street become increasingly involved zack have just name company enable investor take advantage explosive growth cryptocurrency stock market click here access stock
622,WBA,laboratory corporation americas holding lh free report popularly know labcorp have announce extension exist partnership agreement aetna aet free report late company have be dominate headline announcement expand partnership business unitedhealth group unh free report continue serve exclusive national laboratory provider jan expand agreement aetna labcorp serve prefer national laboratory almost company member start jan extend agreement provide network access labcorp complete portfolio laboratory service eligible member collaboration play big rolelabcorp have strengthen foothold diagnostic space organic inorganic mean plan collaborate lead company academic institution offer wider portfolio test company continue increase scale competency clinical laboratory medicine acquisition range routine capability highly esoteric testing recent alliance company comprehensive laboratory collaboration appalachian regional healthcare hospital health system kentucky west virginia be worth mention apart company have expand relationship mount sinai consolidate latter reference work streamline inpatient lab also labcorp covance business recently enter strategic technology agreement glaxosmithkline plc gsk free report term agreement glaxosmithkline use covance xcellerate monitoring xcellerate insight xcellerate clinical datum hub solution software service model other recent partnership include thermo fisher tmo free report enabled launch thermo fisher oncomine dx target panel small cell lung cancer patient also labcorp work develop operate patient service center select walgreen store drug retailer walgreen wba free report apart company have important tie japan base sysmex corporation foremost clinical laboratory service provider roche world repute biotech company share price performanceover past month share labcorp have outperformed industry stock have gain compare industry gain zack ranklabcorp carry zack rank hold see complete list today zack rank strong buy stock here make fortune shift electric car here stock idea consider much petroleum year lithium power soon shake world create millionaire reshape geo politic soon electric vehicle evs be cheaper gas guzzler be already reach mile single charge battery price plummet charge station set multiply company stand stock buy accord zack research not think see ticker free
623,WBA,grocery drug store industry be witness further consolidation country largest grocer albertson company propose buy distressed drugstore retailer rite aid corporation rad free report deal be albertson rite aid latest effort dispel fear competition amazon amzn free report rite aid share react positively news pre market trading session feb zack rank hold stock have decline last day see complete list today zack rank strong buy stock here overall rite aid have gain last month industry decline dealper deal rite aid shareholder have choice opt albertson share cash only company share rite aid share shareholder get albertson share cash albertson share consequently rite aid shareholder own stake combine company subject outcome cash election further albertson shareholder own nearly stake combine company depend result cash election rite aid be likely be value share sale agreement combine company be expect generate annual revenue further new entity anticipate deliver annual run rate cost saving year company expect realize nearly cost synergy first year close transaction additionally company anticipate identify potential revenue opportunity albertson proposal be backed investment cerberus capital management kimco realty corporation klaff realty lubert adler partner schottenstein store corporation follow completion merger combine company be steer john standley chief executive officer ceo be currently chairman ceo rite aid further albertson current chairman ceo bob miller serve chairman new company leadership executive company combine entity have dual headquarters boise idaho camp hill pennsylvania name new company be decide transaction near closure further new company be list new york stock exchange later year albertson currently operate supermarket store nearly pharmacy meanwhile rite aid have drug store operation follow sale pharmacy walgreen boot alliance inc wba free report together new company operate location include pharmacy counter clinic state washington company serve more customer week company plan re banner most albertson pharmacy rite aid store follow completion transaction rite aid continue operate stand pharmacy merger have be approve board director company further be expect be close second half calendar year condition receipt approval rite aid shareholder other regulatory customary close condition industry background threat amazonmajority recent consolidation grocery drugstore industry have be try fend rise competition due entry amazon segment amazon entry grocery industry be marked recent acquisition whole food company recently team berkshire hathaway inc jpmorgan chase co jpm free report form profit company provide healthcare solution employee have perked drugstore industry concern regard commerce giant entry healthcare business further threat come time drug industry be deal challenge weak reimbursement rate lower generic drug price industry player look cut cost industry continue witness soft traffic sale front end store last several year consequence challenge be clearly visible rite aid tepid profit last year few more instance recent consolidation drugstore industry be cvs health corp cvs free report deal acquire aetna inc aet free report january well walgreen bid buy corp abc free report lead drug wholesale company more stock news be bigger iphone become mother technological revolution apple sell mere iphone year new breakthrough be expect generate more device just year create market zack have just release special report spotlight fast emerge phenomenon ticker take advantage don buy now kick click here trade
624,WBA,share pepsico inc pep free report increase post fourth quarter core earning share beating zack consensus estimate dun bradstreet corporation dnb free report share rise report fourth quarter adjust earning share surpass zack consensus estimate share corporation abc free report advanced report walgreen boot alliance inc wba free report be early stage talk buy remain stake companychegg inc chgg free report share jump post fourth quarter gaap earning share beating zack consensus estimate couple cent
625,WBA,report wall street journal walgreen boot alliance inc wba free report be early stage talk buy remain stake lead pharmaceutical service company corporation abc free report soon takeover rumor surface feb share gain hour trading subsequently close rise however stock price walgreen remain unchanged regard remind investor drugstore retailer pharmacy lead health wellbeing enterprise already hold stake be part long term strategic relationship form relationship comprise year pharmaceutical distribution contract walgreen boot alliance inc price walgreen boot alliance inc price walgreen boot alliance inc quote believe latest decision acquire remain stake come close heel rival cvs health cvs free report gigantic acquisition deal health insurer aetna inc aet free report accord reuter report walgreen integration similar cvs aetna deal be likely move vertical consolidation combine member supply chain apart analyst believe move be response amazon latest decision step multibillion dollar pharmaceutical industry notably december amazon com inc amzn free report have acquire pharmacy license dozen state far news revolve walgreen agreement be concern many market researcher view takeover rumor be strategic company have remain silent speculative issue significantly walgreen have market capitalization same remain hottest tech mega trend year generate global revenue predict blast roof fame investor mark cuban say produce world first trillionaire still leave plenty money regular investor make right trade early see zack best stock play trend
626,WBA,jan issue update research report walgreen boot alliance inc wba free report stock carry zack rank hold lead pharmacy lead health wellbeing company have be trading broader industry past month stock have gain comparison broader industry walgreen boot report impressive first quarter fiscal be encourage strength retail pharmacy usa division continue prescription growth account medicare part growth volume growth previously announce strategic pharmacy collaboration be particularly upbeat revise rite aid store deal company receive regulatory approval last september walgreen boot modify buyout contract help boost top line also gain operational benefit also help company expand optimize retail pharmacy network key market include northeast notably store be purchase be locate primarily northeast southern unite state distribution center be buy be locate dayville ct philadelphia pa spartanburg sc post transaction initial close synergy be expect be realize year moreover increase retail pharmacy international sale buoy optimism also be upbeat company decision acquire stake sinopharm hold guoda drugstore china provide strong impetus walgreen boot worldwide retail pharmacy business moreover company acceptance proposal sell part investment chinese wholesale partner guangzhou pharmaceutical corporation huge amount cash be major positive however walgreen boot face headwind form increase competition tough industry condition even company continue gain traction major mass merchant be expand pharmacy business enjoy fair market share moreover last few year slowdown generic introduction have be affect walgreen boot margin addition increase reimbursement pressure generic drug cost inflation have be hamper walgreen boot margin significantly key picksa few better rank stock broader medical sector be amedisys am free report bio rad laboratory bio free report intuitive surgical isrg free report bio rad laboratory flaunt zack rank strong buy see complete list today zack rank stock here company have long term expect earning growth rate amedisys have long term expect earning growth rate stock carry zack rank buy intuitive surgical have long term expect earning growth rate stock carry zack rank hottest tech mega trend year generate global revenue predict blast roof fame investor mark cuban say produce world first trillionaire still leave plenty money regular investor make right trade early see zack best stock play trend
627,WBA,rite aid corporation rad free report be track process transfer store related asset walgreen boot alliance inc wba free report amend restate asset purchase agreement agreement walgreen buy rite aid store distribution center related inventory cash deal company be carry transfer asset phased manner jan rite aid have transfer store related asset walgreen generate net cash proceed company have used proceed pay entire outstanding secure loan have help strengthen liquidity position further company expect complete transfer process spring company state majority close condition sale have be meet only few condition need be satisfied remain transfer store go forward rite aid expect smoothly complete transfer process simultaneously remain focuse identify new opportunity strengthen business provide great experience customer patient also enhance shareholder value be transfer store aid stock price rite aid have be witness uptrend share price complete pilot close first transfer rite aid store related asset third quarter fiscal notably stock have gain last month outperform industry growth moreover company have witness significant upside past month share surge much bother investor upside stock price be surely boost investor view be look more positive become confident stock particularly company dismal top line trend due unfavorable reimbursement rate soft same store sale keep sideline moreover revenue pharmacy service segment provide pbm pharmacy benefit management service continue be soft due election take part lesser medicare part region fall commercial business consequently stock carry zack rank sell be rite aid head rite aid rescue biggest challenge unfavorable reimbursement rate lie aforementioned sale store asset walgreen company smaller size sale asset be likely reduce rite aid exposure pressure unfavorable pharmacy reimbursement rate however real outcome be evident only store be transfer walgreen further company anticipate pharmacy service segment gain traction come day plan promote pbm business manage envision rx be acquire notably company grow envision rx medicare part membership more life life past year go forward company expect envision drive growth board target increase customer base customer fiscal additionally company health dialog rediclinic business be likely aid health wellness score improve overall performance still interested retail check more exposure broader retail sector investor count diplomat pharmacy inc dplo free report american eagle outfitter inc aeo free report sporting zack rank strong buy see complete list today zack rank stock here diplomat pharmacy have advanced past month stock have long term growth rate american eagle long term earning share growth rate have surge last month wall street next amazonzack evp kevin matra believe familiar stock have only just begin climb become greatest investment time once generation opportunity invest pure genius click detail
628,WBA,thursday june market future be again point lower ahead open bell not precipitously general indigestion regard trade tension persist hour re not see anything pitch stock significantly direction possible exception inauspicious debut walgreen boot alliance wba free report dow jone industrial average new initial jobless claim hit tape do thursday morning post headline follow previous week unrevised mark first week past initial claim have be higher previous year domestic economic recovery appear be absolute bottom trump economy free billion lower corporate taxe pent demand construction manufacturing ve actually find range aside couple week most recent have reside past couple month continue claim other hand keep steady dwindle labor market approach peak strength previous week week remain awe inspiring territory consistent historically strong employment situation wasn too long muse great be continue claim post week day look far vista second revision gdp come tad disappointing morning be basis point first revision be initially report keep mind be still seasonally slower initial month year follow holiday season dead winter even still such robust economic number come year date do seem be somewhat let good news simply take gdp figure point initial read expect next month analyst consensus be look growth second month year atlanta fed expect eye pop growth be highest ve see supply glut global oil gas industry send price tailspin walgreen share be morning help plummet dow future just pharma good retailer stumble index yet company outperformed expectation top bottom line end fiscal report share top share respectively same store sale disappoint quarter however guidance be not raise top end fiscal be ratchete bottom end range more wba earning click here perhaps also see negative sentiment walgreen base news morning amazon amzn free report be buy way retail pharma space announce purchase online pharma service company pillpack private firm founder pre sort prescription deliver patient home term acquisition have not be make public hour synergy amazon prime service be fairly obvious mark vickerysenior editorquestion comment article author click here medical stock buy nowzack name company poise ride medical breakthrough be target cure leukemia aids muscular dystrophy hemophilia other condition new product field be already generate substantial revenue even more wondrous treatment be pipeline early investor realize exceptional profit click here see stock
629,WBA,buy hold value investing example successful long term retail investor buy hold strategy tracey top stock pick episode roundup deo myl sne abbv wbawelcome episode value investor podcastevery week tracey ryniec editor zack value investor portfolio service share top value investing tip stock pick do want be buy hold investor just don know start buy hold investing be toughest type investing do call go human nature instant big payout do play lottery love idea become millionaire overnight buy hold investing be slow slog payout not come several decade have gut stick long investor do have gut buy hold investing pay big return strategy buy hold investing start young longer have invest more ll reap reward compound diversify don just buy stock even be bear stearn spread risk don get fancy don need latest fad stock biotech wonder stick basic buy company have solid fundamental strong brand stock buy buy hold portfolio todaywhen read successful buy hold investor re almost always invest company ve hear therefore tracey screen big cap company zack rank strong buy buy hold also have value component average be diageo plc deo free report isn technically value stock have forward expect grow earning fiscal maker guinness bailey johnnie walker also pay dividend currently yielding healthy mylan myl free report be dirt cheap drug company trade forward just also have earning growth be expect be sony sne free report be big entertainment be also move self drive car market work sensor value stock forward sony also pay dividend currently yielding abbvie abbv free report be rare growth value stock have forward yet be expect grow earning extra bonus shareholder also get dividend yielding walgreen boot wba free report have pull back high so cheaper january trade forward close rite aid deal add store earning be expect rise fiscal else know be buy hold investor find week podcast breaking news cryptocurrency now bigger total market cap cryptos recently surpass more increase previous month re now bigger morgan stanley goldman sachs even visa new asset class expand even more rapidly new investor continue pour wall street become increasingly involved zack have just name company enable investor take advantage explosive growth cryptocurrency stock market click here access stock
