,ticker,content
115,WBA,walgreen boot alliance wba ceo stefano pessina say still back rite aid rad takeover say drugstore giant board decide extend deal past friday deadline walgreen rite aid have plan close share merger jan federal trade commission hasn give approval follow report late last week ftc wasn satisfied rite aid plan sell store smaller rival fred fred walgreen say have not receive official notice ftc president trump have chance name several commissioner ftc member board perhaps shape agency merger friendly deal unknown take week month transform ftc gop lead body pessina tell bloomberg tuesday meeting be matter board anticipate ll do drugstore do previously extend deadline oct work ftc approval ibd take investor wait trump settle walgreen rite aid look administration be already move other sector cement material build product firm resume advance tuesday fresh talk big infrastructure spending eagle material vulcan martin marietta be buy range buy point walgreen likely have pay breakup fee deal collapse be much certain condition walgreen stock fall stock market today day drop rite aid rise sink intraday rite aid be still past session evercore isi say last week rite aid share fall deal fred more double store rite aid deal advanced fred be last session fred spiked dec news rite aid deal have give more half gain then related walgreen fall rite aid dife ftc reportedly oppose merger offer
116,WBA,google parent alphabet googl have expand grocery delivery business fresh produce set online order voice activate home speaker system take amazon com amzn new front google express delivery business offer fresh produce initially part los angele san francisco google express have partner fresh produce costco cost whole food wfm other retailer google express compete amazon fresh freshdirect safeway instacart amazon prime now also have retail partner amazon fresh have own warehouse google express annual membership cost amazon october change fee structure amazon fresh cost monthly amazon prime member prime membership cost year google have also add shopping support google home internet connect speaker system compete amazon echo smart speaker system product however only be available google express partner include retailer such walgreen boot alliance wba bed bath bbby amazon have sell more echo home speaker say consumer intelligence research google parent alphabet launch artificial intelligence support home speaker system last fall hasn disclose shipment amazon echo google home be voice activate ibd take broadcom inphi fabrinet be ibd sector leader list highlight best stock sector sector leader show outstanding earning sale growth recent quarters measure amazon category be go be tough amazon have system million product be available globally google have sign lot retailer locality aim have service available say richard windsor analyst edison investment research report however come almost other feature google assistant be capable offer vastly superior user performance amazon alexa write be ai power google assistant be top class alexa be second rate best edison investment estimate alphabet have sell google home device google home sell less echo amazon stock hit time high friday end day buy zone wednesday alphabet stock hit high jan rise friday amazon too be buy zone last month fang stock general have be do well late amazon alphabet be race add more feature internet connect home device amazon google reportedly be work technology turn voice activate home speaker system phone not clear telecom regulation get way amazon echo google home add such feature observer also speculate amazon plan paid search popular echo device threat google core advertising business advertising industry meeting jan top amazon executive signale plan paid search google be ask voice base search earning call jan google ceo sundar pichai say expect voice work many different context so be think phone home tvs car know try drive ecosystem way related amazon expect introduce line private label intimate apparel
117,WBA,walgreen boot alliance wba rite aid rad fall stock market today bloomberg report federal trade commission be not satisfied drug store propose offer approval merger rite aid have propose selling store smaller rival fred fred ease antitrust concern share offer first announce october ftc official don believe go far enough bloomberg report cite source walgreen fall late afternoon trade rite aid crash briefly be halter fall low stock tumble day day line fred sank fred shot dec rite aid store deal be announce have pull back substantially then cvs health cvs lose rite aid share have shot last week new york post report regulator be expect deal president obama left office rite aid fall less walgreen deal fall evercore isi say analyst speculate gop lead ftc trump administration be more favorable walgreen rite aid deal president trump have seat fill person board once ftc chairwoman ramirez step feb walgreen rite aid have jan expiration date deal isn approve then timeline isn extend walgreen owe termination fee certain circumstance related walgreen rite aid merger see trump take office
118,WBA,here weekly investing action plan need know investor come week nvidia nvda disney grubhub grub general motor gm highlight earning news report season slow meanwhile boee ba lockheed martin lmt other giant defense aerospace appear conference time fraught
119,WBA,walgreen boot alliance wba rite aid rad regulatory approval soon new york post report wednesday send share drugstore chain higher federal trade commission be try get share deal first announce back october donald trump take office jan new york post say cite source trump be expect ask ftc chairwoman ramirez step leave ftc just commissioner person board ftc deal include rite aid plan sale store fred fred satisfy antitrust concern action more double fred footprint walgreen boot alliance climb close stock market today rise intraday rite aid jump fred initially rise reversed trade kroger kr point have be run buy rite aid location reportedly have want close many site make grocery location ftc want stand alone store kroger share dip close ibd take telecom company make flurry takeover deal trump administration telecom scenario trump earning outlook separately walgreen fedex fdx announce deal offer fedex pickup drop walgreen location service begin few store spring plan be expand nearly location fall deal expand fedex delivery option give commerce shopper reason come walgreen fedex share fall
120,WBA,dow jone industrial average give start week president trump immigration policy other move worry investor moved back level friday job report apple aapl boom return earning growth investor didn care facebook fb amazon amzn result guidance unite parcel service up be struggle commerce boom charle schwab schw launch new stock trading pricing war dow jone industrial average fall back key level regain friday january job report trump move ease dodd frank other financial regulation dow fall week nasdaq rise end week record high trump immigration order create conflict tech firm trading partner earning be mixed bag cboe volatility index vix rally extreme level not much related dow component apple earn share sale quarter end dec be better expect marked return growth straight quarters year year decline apple current quarter guidance be conservative usual apple say iphone demand outstripped supply service revenue apple share rise nearly week hit month high related advanced micro device amd report smaller expect loss forecast sale bullish outlook share shot nearly hit year high nvidia nvda compete amd graphic other market jump ahead earning come week apple chip supplier cirrus logic crus qorvo qrvo top quarterly view give bearish guidance stock sell thursday related facebook ep soar revenue rise easily beating view decelerate second straight quarter mobile ad account ad revenue facebook reiterate ad revenue growth rate come meaningfully deliberate move avoid ad saturation now see heavy expense growth step hire facebook fall week snap parent snapchat file publicly upcoming ipo snap report soar revenue growth also slow user growth facebook instagram imitate key snapchat feature snap use ticker snap win sell voting share related amazon top earning forecast revenue revenue outlook be lower expect amazon web service cloud compute unit generate most commerce giant profit report revenue gain forecast aw be feel pressure rival cloud effort alphabet googl microsoft msft amazon share fall nearly friday undercut recent buy point related amazon result miss revenue beat ep stock fallsunited parcel service up report modest earning revenue growth holiday fourth quarter fall short forecast up also guide profit target lower cite impact strong dollar up see significant shift mix lower revenue product residential delivery accounting total package volume up ceo say result indicate up quicken pace investment network shift handle increase commerce meanwhile amazon announce set air hub cincinnatus northern kentucky international airport seek lessen dependence up fedex fdx up share plunge fedex lose related mastercard edge past earning view revenue be light share have be buy zone pull back nearly even regain day friday larger rival visa late thursday report better expect quarterly result strong payment growth visa rise friday push dow stock past buy point record high related federal reserve left interest rate alone give indication policymaker be hurry raise rate add strong job january well estimate slim wage gain ease fear economy be overheat ism manufacturing index rise fresh year high january related exxon mobil xom report adjust ep view oil major plan boost capital spending activity heat royal dutch shell rdsa say cut spending year report ep view conocophillip cop say plan raise spending energy information administration say crude stockpile rise barrel analyst expect russia opec seem be comply promise output cut accord reuter datum related auto sale decline december longtime high even automaker offer hefty incentive general motor gm ford fiat chrysler fcau report year year decline only gm miss forecast datum offer new evidence auto demand have peaked related charle schwab schw cut stock etf commission trade lower fidelity td ameritrade amtd trade etfc schwab fall thursday td ameritrade trade rely more stock trade schwab tumble interactive broker ibkr charge cent share trade sank related president trump meeting tuesday ceo exec celgene celg eli lilly lly johnson johnson jnj merck mrk novartis nvs say drug price be astronomical reiterate aim bring drug price also urge drugmaker manufacture also promise deregulate industry cut taxe drug stock pop day response related drugmaker eli lilly pfizer pfe disappoint tuesday earning lag consensus sale top meet respectively roche rhhby sale be light revenue earning rise mid single digit merck follow thursday line sale earning include time defer revenue amgen amgn late thursday report better expect earning say ldl cholesterol fighter reduce cardiovascular risk study related miss merger deadline expire walgreen boot alliance wba rite aid rad extend agreement end date july walgreen cut takeover price share share depend many rite aid store have be divest order new term get regulatory walgreen fall rite aid fall concern ftc win approve deal fred have agreement buy rite aid store edge lower related armour uaa miss estimate top bottom ep fall penny cent sale rise revenue guidance be light athletic apparel brand cfo be step personal reason share tumble year low related
121,WBA,walgreen boot alliance wba first quarter profit top wall street estimate thursday drugstore chain raise low end full year outlook earning share rise beating view penny revenue fall fall short view walgreen raise low end full year ep outlook cent range midpoint consensus walgreen share fall intraday rally close stock market today company also say be work close pending acquisition rite aid rad early part year rite aid share fall ibd take drug stock investor relieve hillary clinton win be president now worry donald trump impose drug price control december rite aid agree sell store fred fred cash help ease antitrust concern ahead merger walgreen sale be contingent walgreen rite aid deal go kroger kr have be consider buy hundred rite aid walgreen store convert grocery store location reportedly ftc want stay stand alone drugstore fred share sank kroger share dip related fred adopt poison pill hedge fund want rite aid talk
122,WBA,here investing action plan thursday need know come trading day december begin flurry earning ambarella amba ulta beauty ulta wesson swhc kroger kr dollar general dg automaker release november sale figure key manufacturing report come ambarella video process chipmaker
123,WBA,here weekly investing action plan need know investor come week market focus opec meeting november job report propel stock further record territory drag increasingly lofty sentiment ambarella amba autodesk adsk ulta beauty ulta kroger kr highlight earning news automaker
124,WBA,be rite aid rad new twitter twtr rite aid share fall wednesday report kroger kr not buy hundred store walgreen boot alliance wba rite aid need divest regulatory approval merger rite aid fall stock market today fall intraday lowest level october walgreen announce share deal smaller drugstore rival ftc want walgreen rite aid divest store grocery store giant kroger have be interested want close location reopen grocery store ftc want preserve stand alone drugstore source tell new york post later reuter confirm kroger be uncertain buy store due ftc insistence remain open rite aid share have already be slide recent week private equity firm reportedly lose interest walgreen share fall walgreen offer update rite aid merger report earning thursday morning kroger climb
125,WBA,walgreen boot alliance wba report fiscal fourth quarter earning early thursday share profit top view sale come little light drugstore giant extend merger deadline rite aid rad give more time gain regulatory approval new doubt deal pass muster estimate ep climb cent revenue result ep grow sale rise outlook walgreen see fiscal ep roughly line analyst expectation stock walgreen jump close stock market today find resistance day line share have be move sideway much bob day move average rite aid climb rival cvs health cvs be ibd take big drugstore chain sell beauty product have be bright spot otherwise bleak retail landscape here commerce giant amazon have have trouble breaking market last year walgreen agree buy rite aid skepticism get antitrust approval have weigh share july walgreen hold talk federal trade commission many combine store need sell get approval deal accord new york post appear be make progress winning regulator last month walgreen say be explore potential divestiture remedy signale expect get ftc soon say see sale store combine kroger kr balk buy hundred store walgreen rite aid need divest regulatory approval kroger have want close location reopen grocery store ftc want preserve stand alone drugstore source tell new york post reuter wednesday related cvs earning beat specialty pharma bet guidance raise
126,WBA,major average give intraday gain close back red thursday slide oil price weak economic datum mixed earning report weigh dow jone industrial average fall nasdaq ease volume be mixed slightly lower nyse higher nasdaq accord preliminary figure tool maker drugstore steel stock lead upside stock market today snap sna gap surge retake day day line heavy trade hand power tool maker report mixed result earning top sale miss estimate walgreen boot alliance wba leap healthy volume regain day line stopping just short day line drugstore operator fiscal profit beat view revenue miss also extend merger deadline rite aid rad seek regulatory approval deal walgreen announce plan last year acquire rite aid rite aid vault thursday american express axp be dow biggest winner heavy volume share gap past day day move average line highest level month credit card provider report strong earning close wednesday microsoft msft jump close better expect fiscal result xbox surface maker stock close regular session loss work flat base buy point biggest blue chip loser be traveler trv heavy trade lowest close late april insurance giant report profit fall last year miss view ebay ebay gap tumble report result top forecast revenue guidance disappoint stock trigger sell rule wipe gain buy point clear july now entry economic news weekly jobless claim rise expectation claim philly fed business outlook survey october come september read light economic datum schedule friday include baker hughe weekly rig count fed daniel tarullo john william be also slate speak earning report be due general electric ge honeywell hon mcdonald mcd suntrust bank sti related walgreen boot alliance earning mixed rite aid deadline extendedebay get picked apart earning miss key metric
127,WBA,here investing action plan thursday need know investor come day month close call false start share walt disney netflix nflx be now buy range day st century fox foxa clear entry point meanwhile walgreen boot alliance wba constellation brand ticker
128,WBA,fred fred adopt poison pill hedge fund take nearly stake discount store operator so talk fred negotiation rite aid rad tuesday fred say shareholder right plan be activate more share be acquire individual investor group poison pill plan be enact prevent hostile takeover announcement come fred noticed unusual substantial activity share thursday alden global capital llc announce stake fred right plan expire june fred share close stock market today soar last tuesday rite aid say last week sell store fred ease antitrust concern merger walgreen boot alliance wba acquisition more double fred footprint expand geographical reach wall street journal report say alden support deal rite aid want discuss capital allocation board representation rite aid share dip tuesday walgreen edge ibd take drug stock investor first relieve hillary clinton win be president now worry donald trump impose drug price control related rite aid note difficult environment walgreen deal dragscvs health dife sale miss earning guidance walgreen fall
129,WBA,stock close modestly higher friday follow donald trump inauguration speech trump continue series ceremoney be swear president today dozen be arrest sometimes violent protest washington dow jone industrial average lead key index thank big gain merck mrk ibm ibm procter gamble pg dow close gain nasdaq add volume be mixed higher nyse lower nasdaq accord preliminary datum dow nasdaq shed week dip less small cap russell post weekly loss chipmaker department store oil stock be top gainer stock market today west texas intermediate crude price surge barrel gold stock advanced too gold future climb ounce medical fiber optic defense issue underperform merck lead dow gap healthy trade share work right side flat base potential buy point be bristol myer bmy say win pursue accelerate approval opdivo lung cancer drug potential rival merck keytruda bristol share gap plunge hit worst level late procter gamble add ibm general electric fall breach day move average fast turnover industrial giant report mixed result ibm be try clear resistance intel intc climb broad chip rally work handle cup base buy point mizuho security wednesday report name intel nvidia several chip stock benefit artificial intelligence deep learn rate stock buy chipmaker rise more friday apple aapl pare early gain close iphone maker share have yet show strong follow jan past buy point stock rs rating be soft too macquarie research friday reiterate outperform rating raise price target cite apple service business drugstore stock fall sharply walgreen boot alliance wba rite aid rad sank respectively report federal trade commission isn happy propose offer gain approval merger stock undercut day day line heavy volume bank stock lead upside ibd financial wtfc bank ozark ozrk gain more stock test week move average re recent high respectively take breather big postelection advance chip stock microsemi mscc broadcom avgo outperformed too microsemi be jam high continue ride day line broadcom be time high now extend past buy point clear december nvidia nvda sit chip stock rally volume be well average stock continue digest big gain graphic chip designer display climax top action late december pullback thus far have raise alarm related walgreen fall rite aid dife ftc reportedly oppose merger offerdid miss nvidia big last year don miss next onebristol myer dife year low opdivo lung cancer setback merck jump
